SET search_path TO documentdb_core,documentdb_api,documentdb_api_catalog,documentdb_api_internal;
SET citus.next_shard_id TO 562000;
SET documentdb.next_collection_id TO 5620;
SET documentdb.next_collection_index_id TO 5620;
SET documentdb.enable_large_unique_index_keys TO false;
-- insert a document
SELECT documentdb_api.insert_one('db','queryuniquecomposite','{"_id":"1", "a": { "b": 1 } }', NULL);
NOTICE:  creating collection
                              insert_one                              
---------------------------------------------------------------------
 { "n" : { "$numberInt" : "1" }, "ok" : { "$numberDouble" : "1.0" } }
(1 row)

-- Create a unique index on the collection.
SELECT documentdb_api_internal.create_indexes_non_concurrently('db', '{ "createIndexes": "queryuniquecomposite", "indexes": [ { "key" : { "a.b": 1 }, "name": "rumConstraint1", "unique": 1, "enableCompositeTerm": true }] }', true);
                                                                                                   create_indexes_non_concurrently                                                                                                    
---------------------------------------------------------------------
 { "raw" : { "defaultShard" : { "numIndexesBefore" : { "$numberInt" : "1" }, "numIndexesAfter" : { "$numberInt" : "2" }, "createdCollectionAutomatically" : false, "ok" : { "$numberInt" : "1" } } }, "ok" : { "$numberInt" : "1" } }
(1 row)

SELECT * FROM documentdb_distributed_test_helpers.get_collection_indexes('db', 'queryuniquecomposite') ORDER BY collection_id, index_id;
 collection_id | index_id |                                                                             index_spec_as_bson                                                                              | index_is_valid 
---------------------------------------------------------------------
          5620 |     5620 | { "v" : { "$numberInt" : "2" }, "key" : { "_id" : { "$numberInt" : "1" } }, "name" : "_id_" }                                                                               | t
          5620 |     5621 | { "v" : { "$numberInt" : "2" }, "key" : { "a.b" : { "$numberInt" : "1" } }, "name" : "rumConstraint1", "unique" : true, "storageEngine" : { "enableOrderedIndex" : true } } | t
(2 rows)

-- insert a value that doesn't collide with the unique index.
SELECT documentdb_api.insert_one('db','queryuniquecomposite','{"_id":"2", "a": [ { "b": 2 }, { "b" : 3 }]}', NULL);
                              insert_one                              
---------------------------------------------------------------------
 { "n" : { "$numberInt" : "1" }, "ok" : { "$numberDouble" : "1.0" } }
(1 row)

-- insert a value that has duplicate values that do not collide with other values.
SELECT documentdb_api.insert_one('db','queryuniquecomposite','{"_id":"3", "a": [ { "b": 4 }, { "b" : 4 }]}', NULL);
                              insert_one                              
---------------------------------------------------------------------
 { "n" : { "$numberInt" : "1" }, "ok" : { "$numberDouble" : "1.0" } }
(1 row)

-- insert a value that has duplicate values that collide wtih other values.
SELECT documentdb_api.insert_one('db','queryuniquecomposite','{"_id":"4", "a": [ { "b": 5 }, { "b" : 3 }]}', NULL);
                                                                                                                            insert_one                                                                                                                             
---------------------------------------------------------------------
 { "n" : { "$numberInt" : "0" }, "ok" : { "$numberDouble" : "1.0" }, "writeErrors" : [ { "index" : { "$numberInt" : "0" }, "code" : { "$numberInt" : "319029277" }, "errmsg" : "Duplicate key violation on the requested collection: Index 'rumConstraint1'" } ] }
(1 row)

SELECT documentdb_api.insert_one('db','queryuniquecomposite','{"_id":"5", "a": { "b": [ 5, 3 ] } }', NULL);
                                                                                                                            insert_one                                                                                                                             
---------------------------------------------------------------------
 { "n" : { "$numberInt" : "0" }, "ok" : { "$numberDouble" : "1.0" }, "writeErrors" : [ { "index" : { "$numberInt" : "0" }, "code" : { "$numberInt" : "319029277" }, "errmsg" : "Duplicate key violation on the requested collection: Index 'rumConstraint1'" } ] }
(1 row)

SELECT documentdb_api.insert_one('db','queryuniquecomposite','{"_id":"6", "a": { "b": 3 } }', NULL);
                                                                                                                            insert_one                                                                                                                             
---------------------------------------------------------------------
 { "n" : { "$numberInt" : "0" }, "ok" : { "$numberDouble" : "1.0" }, "writeErrors" : [ { "index" : { "$numberInt" : "0" }, "code" : { "$numberInt" : "319029277" }, "errmsg" : "Duplicate key violation on the requested collection: Index 'rumConstraint1'" } ] }
(1 row)

-- valid scenarios again.
SELECT documentdb_api.insert_one('db','queryuniquecomposite','{"_id":"4", "a": [ { "b": 5 }, { "b" : 6 }]}', NULL);
                              insert_one                              
---------------------------------------------------------------------
 { "n" : { "$numberInt" : "1" }, "ok" : { "$numberDouble" : "1.0" } }
(1 row)

SELECT documentdb_api.insert_one('db','queryuniquecomposite','{"_id":"5", "a": { "b": [ 7, 9 ] } }', NULL);
                              insert_one                              
---------------------------------------------------------------------
 { "n" : { "$numberInt" : "1" }, "ok" : { "$numberDouble" : "1.0" } }
(1 row)

SELECT documentdb_api.insert_one('db','queryuniquecomposite','{"_id":"6", "a": { "b": 8 } }', NULL);
                              insert_one                              
---------------------------------------------------------------------
 { "n" : { "$numberInt" : "1" }, "ok" : { "$numberDouble" : "1.0" } }
(1 row)

SELECT documentdb_api.insert_one('db','queryuniquecomposite','{"_id":"7", "a": { "b": true } }', NULL);
                              insert_one                              
---------------------------------------------------------------------
 { "n" : { "$numberInt" : "1" }, "ok" : { "$numberDouble" : "1.0" } }
(1 row)

SELECT documentdb_api.insert_one('db','queryuniquecomposite','{"_id":"8", "a": { "b": "someValue" } }', NULL);
                              insert_one                              
---------------------------------------------------------------------
 { "n" : { "$numberInt" : "1" }, "ok" : { "$numberDouble" : "1.0" } }
(1 row)

-- we can use the unique index for queries
BEGIN;
set local documentdb.forceUseIndexIfAvailable to on;
set local enable_seqscan TO off;
set local documentdb.forceRumIndexScantoBitmapHeapScan TO OFF;
EXPLAIN (COSTS OFF) SELECT document FROM documentdb_api.collection('db', 'queryuniquecomposite') WHERE document @@ '{ "a.b": { "$gt": 5 } }';
                                                             QUERY PLAN                                                              
---------------------------------------------------------------------
 Custom Scan (Citus Adaptive)
   Task Count: 1
   Tasks Shown: All
   ->  Task
         Node: host=localhost port=58070 dbname=regression
         ->  Index Scan using "rumConstraint1" on documents_5620_562002 collection
               Index Cond: (document OPERATOR(documentdb_api_catalog.@>) '{ "a.b" : { "$numberInt" : "5" } }'::documentdb_core.bson)
(7 rows)

ROLLBACK;
-- insert a document that does not have an a.b (should succeed)
SELECT documentdb_api.insert_one('db','queryuniquecomposite','{"a": { "c": "someValue" } }', NULL);
                              insert_one                              
---------------------------------------------------------------------
 { "n" : { "$numberInt" : "1" }, "ok" : { "$numberDouble" : "1.0" } }
(1 row)

-- insert another document that does not have an a.b (should fail)
SELECT documentdb_api.insert_one('db','queryuniquecomposite','{"a": { "d": "someValue" } }', NULL);
                                                                                                                            insert_one                                                                                                                             
---------------------------------------------------------------------
 { "n" : { "$numberInt" : "0" }, "ok" : { "$numberDouble" : "1.0" }, "writeErrors" : [ { "index" : { "$numberInt" : "0" }, "code" : { "$numberInt" : "319029277" }, "errmsg" : "Duplicate key violation on the requested collection: Index 'rumConstraint1'" } ] }
(1 row)

-- insert another document that has a.b = null (Should fail)
SELECT documentdb_api.insert_one('db','queryuniquecomposite','{"a": { "b": null } }', NULL);
                                                                                                                            insert_one                                                                                                                             
---------------------------------------------------------------------
 { "n" : { "$numberInt" : "0" }, "ok" : { "$numberDouble" : "1.0" }, "writeErrors" : [ { "index" : { "$numberInt" : "0" }, "code" : { "$numberInt" : "319029277" }, "errmsg" : "Duplicate key violation on the requested collection: Index 'rumConstraint1'" } ] }
(1 row)

-- insert a document that has constraint failure on _id
SELECT documentdb_api.insert_one('db','queryuniquecomposite','{"_id": "8", "a": { "b": 2055 } }', NULL);
                                                                                                                       insert_one                                                                                                                        
---------------------------------------------------------------------
 { "n" : { "$numberInt" : "0" }, "ok" : { "$numberDouble" : "1.0" }, "writeErrors" : [ { "index" : { "$numberInt" : "0" }, "code" : { "$numberInt" : "319029277" }, "errmsg" : "Duplicate key violation on the requested collection: Index '_id_'" } ] }
(1 row)

-- drop the unique index.
CALL documentdb_api.drop_indexes('db', '{"dropIndexes": "queryuniquecomposite", "index": ["rumConstraint1"]}');
                          retval                          
---------------------------------------------------------------------
 { "ok" : true, "nIndexesWas" : { "$numberLong" : "2" } }
(1 row)

SELECT * FROM documentdb_distributed_test_helpers.get_collection_indexes('db', 'queryuniquecomposite') ORDER BY collection_id, index_id;
 collection_id | index_id |                                      index_spec_as_bson                                       | index_is_valid 
---------------------------------------------------------------------
          5620 |     5620 | { "v" : { "$numberInt" : "2" }, "key" : { "_id" : { "$numberInt" : "1" } }, "name" : "_id_" } | t
(1 row)

-- now we can violate the unique constraint
SELECT documentdb_api.insert_one('db','queryuniquecomposite','{"_id":"9", "a": { "b": 1 } }', NULL);
                              insert_one                              
---------------------------------------------------------------------
 { "n" : { "$numberInt" : "1" }, "ok" : { "$numberDouble" : "1.0" } }
(1 row)

SELECT documentdb_api.insert_one('db','queryuniquecomposite','{"_id":"10", "a": { "b": [ 2, 1 ] } }', NULL);
                              insert_one                              
---------------------------------------------------------------------
 { "n" : { "$numberInt" : "1" }, "ok" : { "$numberDouble" : "1.0" } }
(1 row)

-- create an index when the collection violates unique. Should fail.
SELECT documentdb_api_internal.create_indexes_non_concurrently('db', '{ "createIndexes": "queryuniquecomposite", "indexes": [ { "key" : { "a.b": 1 }, "name": "rumConstraint1", "unique": 1, "sparse": 1, "enableCompositeTerm": true }] }', true);
ERROR:  could not create exclusion constraint "documents_rum_index_5622_562002"
DETAIL:  Key (document, generate_unique_shard_document(document, shard_key_value, '{ "a.b" : { "$numberInt" : "1" } }'::bson, true, true))=({ "_id" : "1", "a" : { "b" : { "$numberInt" : "1" } } }, { "$shard_key_value" : { "$numberLong" : "5620" }, "$numTerms" : { "$numberInt" : "1" }, "$numPaths" : { "$numberInt" : "1" }, "a.b" : [ { "$numberInt" : "1" } ] }) conflicts with key (document, generate_unique_shard_document(document, shard_key_value, '{ "a.b" : { "$numberInt" : "1" } }'::bson, true, true))=({ "_id" : "9", "a" : { "b" : { "$numberInt" : "1" } } }, { "$shard_key_value" : { "$numberLong" : "5620" }, "$numTerms" : { "$numberInt" : "1" }, "$numPaths" : { "$numberInt" : "1" }, "a.b" : [ { "$numberInt" : "1" } ] }).
CONTEXT:  SQL statement "ALTER TABLE documentdb_data.documents_5620 ADD CONSTRAINT documents_rum_index_5622 EXCLUDE USING documentdb_rum ( document documentdb_api_internal.bson_rum_composite_path_ops(pathspec='[ "a.b" ]',tl=2691) WITH OPERATOR(documentdb_api_catalog.=?=),documentdb_api_internal.generate_unique_shard_document(document, shard_key_value, 'BSONHEX0e00000010612e62000100000000'::documentdb_core.bson, true, true) documentdb_api_internal.bson_rum_unique_shard_path_ops(cmp=true)  WITH OPERATOR(documentdb_api_internal.=#=)) "
-- create a unique index with the same name ( should be fine since we dropped it )
SELECT documentdb_api_internal.create_indexes_non_concurrently('db', '{ "createIndexes": "queryuniquecomposite", "indexes": [ { "key" : { "c": 1 }, "name": "rumConstraint1", "unique": 1, "sparse": 1 , "enableCompositeTerm": true}] }', true);
                                                                                                   create_indexes_non_concurrently                                                                                                    
---------------------------------------------------------------------
 { "raw" : { "defaultShard" : { "numIndexesBefore" : { "$numberInt" : "1" }, "numIndexesAfter" : { "$numberInt" : "2" }, "createdCollectionAutomatically" : false, "ok" : { "$numberInt" : "1" } } }, "ok" : { "$numberInt" : "1" } }
(1 row)

SELECT * FROM documentdb_distributed_test_helpers.get_collection_indexes('db', 'queryuniquecomposite') ORDER BY collection_id, index_id;
 collection_id | index_id |                                                                                     index_spec_as_bson                                                                                     | index_is_valid 
---------------------------------------------------------------------
          5620 |     5620 | { "v" : { "$numberInt" : "2" }, "key" : { "_id" : { "$numberInt" : "1" } }, "name" : "_id_" }                                                                                              | t
          5620 |     5623 | { "v" : { "$numberInt" : "2" }, "key" : { "c" : { "$numberInt" : "1" } }, "name" : "rumConstraint1", "sparse" : true, "unique" : true, "storageEngine" : { "enableOrderedIndex" : true } } | t
(2 rows)

-- since this is sparse, we can create several documents without "c" on it.
SELECT documentdb_api.insert_one('db','queryuniquecomposite','{"_id":"11", "d": "someValue" }', NULL);
                              insert_one                              
---------------------------------------------------------------------
 { "n" : { "$numberInt" : "1" }, "ok" : { "$numberDouble" : "1.0" } }
(1 row)

-- insert another document that does not have an c (should succeed)
SELECT documentdb_api.insert_one('db','queryuniquecomposite','{"_id":"12", "e" : true }', NULL);
                              insert_one                              
---------------------------------------------------------------------
 { "n" : { "$numberInt" : "1" }, "ok" : { "$numberDouble" : "1.0" } }
(1 row)

-- insert another document that has a.b = null (Should succeed)
SELECT documentdb_api.insert_one('db','queryuniquecomposite','{"_id":"13", "c": null }', NULL);
                              insert_one                              
---------------------------------------------------------------------
 { "n" : { "$numberInt" : "1" }, "ok" : { "$numberDouble" : "1.0" } }
(1 row)

-- however, inserting 'c' again should fail.
SELECT documentdb_api.insert_one('db','queryuniquecomposite','{"_id":"14", "c": null }', NULL);
                                                                                                                            insert_one                                                                                                                             
---------------------------------------------------------------------
 { "n" : { "$numberInt" : "0" }, "ok" : { "$numberDouble" : "1.0" }, "writeErrors" : [ { "index" : { "$numberInt" : "0" }, "code" : { "$numberInt" : "319029277" }, "errmsg" : "Duplicate key violation on the requested collection: Index 'rumConstraint1'" } ] }
(1 row)

-- drop the unique index by key.
CALL documentdb_api.drop_indexes('db', '{"dropIndexes": "queryuniquecomposite", "index": {"c": 1} }');
                          retval                          
---------------------------------------------------------------------
 { "ok" : true, "nIndexesWas" : { "$numberLong" : "2" } }
(1 row)

SELECT * FROM documentdb_distributed_test_helpers.get_collection_indexes('db', 'queryuniquecomposite') ORDER BY collection_id, index_id;
 collection_id | index_id |                                      index_spec_as_bson                                       | index_is_valid 
---------------------------------------------------------------------
          5620 |     5620 | { "v" : { "$numberInt" : "2" }, "key" : { "_id" : { "$numberInt" : "1" } }, "name" : "_id_" } | t
(1 row)

-- create unique index fails for wildcard.
SELECT documentdb_api_internal.create_indexes_non_concurrently('uniquedb', '{"createIndexes": "collection1", "indexes": [{"key": {"f.$**": 1}, "name": "my_idx3", "unique": 1.0 }]}', true);
ERROR:  Error in specification { "key" : { "f.$**" : 1 }, "name" : "my_idx3", "unique" : 1.0 }:Index type 'wildcard' does not support the unique option
SELECT documentdb_api_internal.create_indexes_non_concurrently('uniquedb', '{"createIndexes": "collection1", "indexes": [{"key": {"$**": 1}, "wildcardProjection": { "f.g": 0 }, "name": "my_idx3", "unique": 1.0}]}', true);
ERROR:  Error in specification { "key" : { "$**" : 1 }, "wildcardProjection" : { "f.g" : 0 }, "name" : "my_idx3", "unique" : 1.0 }:Index type 'wildcard' does not support the unique option
-- test for sharded
SELECT documentdb_api.insert_one('db','queryuniqueshardedcomposite','{"_id":"1", "a": { "b": 1 }, "d": 1 }', NULL);
NOTICE:  creating collection
                              insert_one                              
---------------------------------------------------------------------
 { "n" : { "$numberInt" : "1" }, "ok" : { "$numberDouble" : "1.0" } }
(1 row)

SELECT documentdb_api.shard_collection('db', 'queryuniqueshardedcomposite', '{ "d": "hashed" }', false);
 shard_collection 
---------------------------------------------------------------------
 
(1 row)

-- Create a unique index on the collection.
SELECT documentdb_api_internal.create_indexes_non_concurrently('db', '{ "createIndexes": "queryuniqueshardedcomposite", "indexes": [ { "key" : { "a.b": 1 }, "name": "rumConstraint1", "unique": 1, "enableCompositeTerm": true }] }', true);
                                                                                                   create_indexes_non_concurrently                                                                                                    
---------------------------------------------------------------------
 { "raw" : { "defaultShard" : { "numIndexesBefore" : { "$numberInt" : "1" }, "numIndexesAfter" : { "$numberInt" : "2" }, "createdCollectionAutomatically" : false, "ok" : { "$numberInt" : "1" } } }, "ok" : { "$numberInt" : "1" } }
(1 row)

SELECT * FROM documentdb_distributed_test_helpers.get_collection_indexes('db', 'queryuniqueshardedcomposite') ORDER BY collection_id, index_id;
 collection_id | index_id |                                                                             index_spec_as_bson                                                                              | index_is_valid 
---------------------------------------------------------------------
          5621 |     5625 | { "v" : { "$numberInt" : "2" }, "key" : { "_id" : { "$numberInt" : "1" } }, "name" : "_id_" }                                                                               | t
          5621 |     5626 | { "v" : { "$numberInt" : "2" }, "key" : { "a.b" : { "$numberInt" : "1" } }, "name" : "rumConstraint1", "unique" : true, "storageEngine" : { "enableOrderedIndex" : true } } | t
(2 rows)

-- valid scenarios:
SELECT documentdb_api.insert_one('db','queryuniqueshardedcomposite','{"_id":"2", "a": { "b": [ 2, 2] }, "d": 1 }', NULL);
                              insert_one                              
---------------------------------------------------------------------
 { "n" : { "$numberInt" : "1" }, "ok" : { "$numberDouble" : "1.0" } }
(1 row)

SELECT documentdb_api.insert_one('db','queryuniqueshardedcomposite','{"_id":"3", "a": { "b": [ 3, 4 ] }, "d": 1 }', NULL);
                              insert_one                              
---------------------------------------------------------------------
 { "n" : { "$numberInt" : "1" }, "ok" : { "$numberDouble" : "1.0" } }
(1 row)

SELECT documentdb_api.insert_one('db','queryuniqueshardedcomposite','{"_id":"4", "a": { "b": 5 }, "d": 1 }', NULL);
                              insert_one                              
---------------------------------------------------------------------
 { "n" : { "$numberInt" : "1" }, "ok" : { "$numberDouble" : "1.0" } }
(1 row)

SELECT documentdb_api.insert_one('db','queryuniqueshardedcomposite','{"_id":"5", "a": { "c": 5 }, "d": 1 }', NULL);
                              insert_one                              
---------------------------------------------------------------------
 { "n" : { "$numberInt" : "1" }, "ok" : { "$numberDouble" : "1.0" } }
(1 row)

-- now violate unique in shard key "d": 1 
SELECT documentdb_api.insert_one('db','queryuniqueshardedcomposite','{"_id":"6", "a": { "b": [ 3, 6 ] }, "d": 1 }', NULL);
                                                                                                                            insert_one                                                                                                                             
---------------------------------------------------------------------
 { "n" : { "$numberInt" : "0" }, "ok" : { "$numberDouble" : "1.0" }, "writeErrors" : [ { "index" : { "$numberInt" : "0" }, "code" : { "$numberInt" : "319029277" }, "errmsg" : "Duplicate key violation on the requested collection: Index 'rumConstraint1'" } ] }
(1 row)

SELECT documentdb_api.insert_one('db','queryuniqueshardedcomposite','{"_id":"7", "a": { "b": null }, "d": 1 }', NULL);
                                                                                                                            insert_one                                                                                                                             
---------------------------------------------------------------------
 { "n" : { "$numberInt" : "0" }, "ok" : { "$numberDouble" : "1.0" }, "writeErrors" : [ { "index" : { "$numberInt" : "0" }, "code" : { "$numberInt" : "319029277" }, "errmsg" : "Duplicate key violation on the requested collection: Index 'rumConstraint1'" } ] }
(1 row)

-- now insert something in a different shard - should not violate unique
SELECT documentdb_api.insert_one('db','queryuniqueshardedcomposite','{"_id":"8", "a": { "b": [ 3, 6 ] }, "d": 2 }', NULL);
                              insert_one                              
---------------------------------------------------------------------
 { "n" : { "$numberInt" : "1" }, "ok" : { "$numberDouble" : "1.0" } }
(1 row)

SELECT documentdb_api.insert_one('db','queryuniqueshardedcomposite','{"_id":"9", "a": { "b": null }, "d": 2 }', NULL);
                              insert_one                              
---------------------------------------------------------------------
 { "n" : { "$numberInt" : "1" }, "ok" : { "$numberDouble" : "1.0" } }
(1 row)

-- still can be used for query.
BEGIN;
set local documentdb.forceUseIndexIfAvailable to on;
set local enable_seqscan TO off;
EXPLAIN (COSTS OFF) SELECT document FROM documentdb_api.collection('db', 'queryuniqueshardedcomposite') WHERE document @@ '{ "a.b": { "$gt": 5 } }';
                                                                QUERY PLAN                                                                 
---------------------------------------------------------------------
 Custom Scan (Citus Adaptive)
   Task Count: 8
   Tasks Shown: One of 8
   ->  Task
         Node: host=localhost port=58070 dbname=regression
         ->  Bitmap Heap Scan on documents_5621_562032 documents_5621
               Recheck Cond: (document OPERATOR(documentdb_api_catalog.@>) '{ "a.b" : { "$numberInt" : "5" } }'::documentdb_core.bson)
               ->  Bitmap Index Scan on "rumConstraint1"
                     Index Cond: (document OPERATOR(documentdb_api_catalog.@>) '{ "a.b" : { "$numberInt" : "5" } }'::documentdb_core.bson)
(9 rows)

ROLLBACK;
-- create unique index with truncation
SELECT string_agg(md5(random()::text), '_') AS longstring1 FROM generate_series(1, 100) \gset
SELECT string_agg(md5(random()::text), '_') AS longstring2 FROM generate_series(1, 100) \gset
SELECT string_agg(md5(random()::text), '_') AS longstring3 FROM generate_series(1, 100) \gset
SELECT string_agg(md5(random()::text), '_') AS longstring4 FROM generate_series(1, 100) \gset
SELECT length(:'longstring1');
 length 
---------------------------------------------------------------------
   3299
(1 row)

-- create with truncation allowed and the new op-class enabled
set documentdb.enable_large_unique_index_keys to on;
SELECT documentdb_api_internal.create_indexes_non_concurrently('db', '{ "createIndexes": "queryuniquecomposite", "indexes": [ { "key" : { "e": 1 }, "name": "rumConstraint1", "unique": 1, "unique": 1, "sparse": 1, "enableCompositeTerm": true }] }', true);
                                                                                                   create_indexes_non_concurrently                                                                                                    
---------------------------------------------------------------------
 { "raw" : { "defaultShard" : { "numIndexesBefore" : { "$numberInt" : "1" }, "numIndexesAfter" : { "$numberInt" : "2" }, "createdCollectionAutomatically" : false, "ok" : { "$numberInt" : "1" } } }, "ok" : { "$numberInt" : "1" } }
(1 row)

SELECT documentdb_api_internal.create_indexes_non_concurrently('db', '{ "createIndexes": "queryuniquecomposite", "indexes": [ { "key" : { "e": 1, "f": 1 }, "name": "rumConstraint2", "unique": 1, "unique": 1, "sparse": 1, "enableCompositeTerm": true }] }', true);
                                                                                                   create_indexes_non_concurrently                                                                                                    
---------------------------------------------------------------------
 { "raw" : { "defaultShard" : { "numIndexesBefore" : { "$numberInt" : "2" }, "numIndexesAfter" : { "$numberInt" : "3" }, "createdCollectionAutomatically" : false, "ok" : { "$numberInt" : "1" } } }, "ok" : { "$numberInt" : "1" } }
(1 row)

\d documentdb_data.documents_5620
          Table "documentdb_data.documents_5620"
     Column      |  Type  | Collation | Nullable | Default 
---------------------------------------------------------------------
 shard_key_value | bigint |           | not null | 
 object_id       | bson   |           | not null | 
 document        | bson   |           | not null | 
Indexes:
    "collection_pk_5620" PRIMARY KEY, btree (shard_key_value, object_id)
    "documents_rum_index_5627" EXCLUDE USING documentdb_rum (document bson_rum_composite_path_ops (pathspec='[ "e" ]', tl='2691') WITH =?=, generate_unique_shard_document(document, shard_key_value, '{ "e" : { "$numberInt" : "1" } }'::bson, true, true) bson_rum_unique_shard_path_ops (cmp='true') WITH =#=)
    "documents_rum_index_5628" EXCLUDE USING documentdb_rum (document bson_rum_composite_path_ops (pathspec='[ "e", "f" ]', tl='2691') WITH =?=, generate_unique_shard_document(document, shard_key_value, '{ "e" : { "$numberInt" : "1" }, "f" : { "$numberInt" : "1" } }'::bson, true, true) bson_rum_unique_shard_path_ops (cmp='true') WITH =#=)
Check constraints:
    "shard_key_value_check" CHECK (shard_key_value = '5620'::bigint)

-- succeeds
SELECT documentdb_api.insert_one('db', 'queryuniquecomposite', FORMAT('{ "_id": 1, "e": "%s", "f": 1 }', :'longstring1')::bson);
                              insert_one                              
---------------------------------------------------------------------
 { "n" : { "$numberInt" : "1" }, "ok" : { "$numberDouble" : "1.0" } }
(1 row)

-- unique conflict
SELECT documentdb_api.insert_one('db', 'queryuniquecomposite', FORMAT('{ "_id": 2, "e": [ "%s", "%s" ], "f": 1 }', :'longstring1', :'longstring2')::bson);
                                                                                                                            insert_one                                                                                                                             
---------------------------------------------------------------------
 { "n" : { "$numberInt" : "0" }, "ok" : { "$numberDouble" : "1.0" }, "writeErrors" : [ { "index" : { "$numberInt" : "0" }, "code" : { "$numberInt" : "319029277" }, "errmsg" : "Duplicate key violation on the requested collection: Index 'rumConstraint1'" } ] }
(1 row)

-- create with suffix post truncation - succeeds
SELECT documentdb_api.insert_one('db', 'queryuniquecomposite', FORMAT('{ "_id": 3, "e": [ "%s-withsuffix", "%s" ], "f": 1 }', :'longstring1', :'longstring2')::bson);
                              insert_one                              
---------------------------------------------------------------------
 { "n" : { "$numberInt" : "1" }, "ok" : { "$numberDouble" : "1.0" } }
(1 row)

-- this should also fail
SELECT documentdb_api.insert_one('db', 'queryuniquecomposite', FORMAT('{ "_id": 4, "e": "%s-withsuffix", "f": 1 }', :'longstring1')::bson);
                                                                                                                            insert_one                                                                                                                             
---------------------------------------------------------------------
 { "n" : { "$numberInt" : "0" }, "ok" : { "$numberDouble" : "1.0" }, "writeErrors" : [ { "index" : { "$numberInt" : "0" }, "code" : { "$numberInt" : "319029277" }, "errmsg" : "Duplicate key violation on the requested collection: Index 'rumConstraint1'" } ] }
(1 row)

-- this will work.
SELECT documentdb_api.insert_one('db', 'queryuniquecomposite', FORMAT('{ "_id": 5, "e": "%s-withsuffix", "f": 1 }', :'longstring2')::bson);
                              insert_one                              
---------------------------------------------------------------------
 { "n" : { "$numberInt" : "1" }, "ok" : { "$numberDouble" : "1.0" } }
(1 row)

-- this will fail (suffix match of array and string).
SELECT documentdb_api.insert_one('db', 'queryuniquecomposite', FORMAT('{ "_id": 6, "e": [ "%s", "%s-withsuffix" ], "f": 1 }', :'longstring3', :'longstring2')::bson);
                                                                                                                            insert_one                                                                                                                             
---------------------------------------------------------------------
 { "n" : { "$numberInt" : "0" }, "ok" : { "$numberDouble" : "1.0" }, "writeErrors" : [ { "index" : { "$numberInt" : "0" }, "code" : { "$numberInt" : "319029277" }, "errmsg" : "Duplicate key violation on the requested collection: Index 'rumConstraint1'" } ] }
(1 row)

-- test truncated elements with numeric types of the same/different equivalent value. 
SELECT documentdb_api.insert_one('db', 'queryuniquecomposite', FORMAT('{ "_id": 7, "e": { "path1": "%s", "path2": 1.0 }, "f": 1 }', :'longstring3')::bson);
                              insert_one                              
---------------------------------------------------------------------
 { "n" : { "$numberInt" : "1" }, "ok" : { "$numberDouble" : "1.0" } }
(1 row)

SELECT documentdb_api.insert_one('db', 'queryuniquecomposite', FORMAT('{ "_id": 8, "e": { "path1": "%s", "path2": { "$numberDecimal": "1.0" }}, "f": 1 }', :'longstring3')::bson);
                                                                                                                            insert_one                                                                                                                             
---------------------------------------------------------------------
 { "n" : { "$numberInt" : "0" }, "ok" : { "$numberDouble" : "1.0" }, "writeErrors" : [ { "index" : { "$numberInt" : "0" }, "code" : { "$numberInt" : "319029277" }, "errmsg" : "Duplicate key violation on the requested collection: Index 'rumConstraint1'" } ] }
(1 row)

SELECT documentdb_api.insert_one('db', 'queryuniquecomposite', FORMAT('{ "_id": 9, "e": { "path1": "%s", "path2": { "$numberDecimal": "1.01" }}, "f": 1 }', :'longstring3')::bson);
                              insert_one                              
---------------------------------------------------------------------
 { "n" : { "$numberInt" : "1" }, "ok" : { "$numberDouble" : "1.0" } }
(1 row)

-- test composite sparse unique indexes: Should succeed since none of the documents have this path (sparse unique ignore)
SELECT documentdb_api_internal.create_indexes_non_concurrently('db', '{ "createIndexes": "queryuniquecomposite", "indexes": [ { "key" : { "g": 1, "h": 1 }, "name": "rumConstraint3", "unique": 1, "sparse": 1, "enableCompositeTerm": true }] }', true);
                                                                                                   create_indexes_non_concurrently                                                                                                    
---------------------------------------------------------------------
 { "raw" : { "defaultShard" : { "numIndexesBefore" : { "$numberInt" : "3" }, "numIndexesAfter" : { "$numberInt" : "4" }, "createdCollectionAutomatically" : false, "ok" : { "$numberInt" : "1" } } }, "ok" : { "$numberInt" : "1" } }
(1 row)

-- works
SELECT documentdb_api.insert_one('db', 'queryuniquecomposite', '{ "g": 5, "h": 5 }');
                              insert_one                              
---------------------------------------------------------------------
 { "n" : { "$numberInt" : "1" }, "ok" : { "$numberDouble" : "1.0" } }
(1 row)

-- fails (unique cosntraint)
SELECT documentdb_api.insert_one('db', 'queryuniquecomposite', '{ "g": 5, "h": 5 }');
                                                                                                                            insert_one                                                                                                                             
---------------------------------------------------------------------
 { "n" : { "$numberInt" : "0" }, "ok" : { "$numberDouble" : "1.0" }, "writeErrors" : [ { "index" : { "$numberInt" : "0" }, "code" : { "$numberInt" : "319029277" }, "errmsg" : "Duplicate key violation on the requested collection: Index 'rumConstraint3'" } ] }
(1 row)

-- works
SELECT documentdb_api.insert_one('db', 'queryuniquecomposite', '{ "g": 5 }');
                              insert_one                              
---------------------------------------------------------------------
 { "n" : { "$numberInt" : "1" }, "ok" : { "$numberDouble" : "1.0" } }
(1 row)

-- fails (unique constraint)
SELECT documentdb_api.insert_one('db', 'queryuniquecomposite', '{ "g": 5 }');
                                                                                                                            insert_one                                                                                                                             
---------------------------------------------------------------------
 { "n" : { "$numberInt" : "0" }, "ok" : { "$numberDouble" : "1.0" }, "writeErrors" : [ { "index" : { "$numberInt" : "0" }, "code" : { "$numberInt" : "319029277" }, "errmsg" : "Duplicate key violation on the requested collection: Index 'rumConstraint3'" } ] }
(1 row)

-- works
SELECT documentdb_api.insert_one('db', 'queryuniquecomposite', '{ "h": 5 }');
                              insert_one                              
---------------------------------------------------------------------
 { "n" : { "$numberInt" : "1" }, "ok" : { "$numberDouble" : "1.0" } }
(1 row)

-- fails (unique constraint)
SELECT documentdb_api.insert_one('db', 'queryuniquecomposite', '{ "h": 5 }');
                                                                                                                            insert_one                                                                                                                             
---------------------------------------------------------------------
 { "n" : { "$numberInt" : "0" }, "ok" : { "$numberDouble" : "1.0" }, "writeErrors" : [ { "index" : { "$numberInt" : "0" }, "code" : { "$numberInt" : "319029277" }, "errmsg" : "Duplicate key violation on the requested collection: Index 'rumConstraint3'" } ] }
(1 row)

-- reset test data
set documentdb.enable_large_unique_index_keys to on;
DELETE FROM documentdb_data.documents_5620;
CALL documentdb_api.drop_indexes('db', '{ "dropIndexes": "queryuniquecomposite", "index": [ "rumConstraint1", "rumConstraint2", "rumConstraint3" ] }');
                          retval                          
---------------------------------------------------------------------
 { "ok" : true, "nIndexesWas" : { "$numberLong" : "4" } }
(1 row)

\d documentdb_data.documents_5620
          Table "documentdb_data.documents_5620"
     Column      |  Type  | Collation | Nullable | Default 
---------------------------------------------------------------------
 shard_key_value | bigint |           | not null | 
 object_id       | bson   |           | not null | 
 document        | bson   |           | not null | 
Indexes:
    "collection_pk_5620" PRIMARY KEY, btree (shard_key_value, object_id)
Check constraints:
    "shard_key_value_check" CHECK (shard_key_value = '5620'::bigint)

-- test unique sparse composite index
SELECT documentdb_api_internal.create_indexes_non_concurrently('db', '{ "createIndexes": "queryuniquecomposite", "indexes": [ { "key" : { "key1": 1, "key2": 1 }, "name": "constraint1", "unique": 1, "sparse": 1, "enableCompositeTerm": true }] }', true);
                                                                                                   create_indexes_non_concurrently                                                                                                    
---------------------------------------------------------------------
 { "raw" : { "defaultShard" : { "numIndexesBefore" : { "$numberInt" : "1" }, "numIndexesAfter" : { "$numberInt" : "2" }, "createdCollectionAutomatically" : false, "ok" : { "$numberInt" : "1" } } }, "ok" : { "$numberInt" : "1" } }
(1 row)

\d documentdb_data.documents_5620
          Table "documentdb_data.documents_5620"
     Column      |  Type  | Collation | Nullable | Default 
---------------------------------------------------------------------
 shard_key_value | bigint |           | not null | 
 object_id       | bson   |           | not null | 
 document        | bson   |           | not null | 
Indexes:
    "collection_pk_5620" PRIMARY KEY, btree (shard_key_value, object_id)
    "documents_rum_index_5630" EXCLUDE USING documentdb_rum (document bson_rum_composite_path_ops (pathspec='[ "key1", "key2" ]', tl='2691') WITH =?=, generate_unique_shard_document(document, shard_key_value, '{ "key1" : { "$numberInt" : "1" }, "key2" : { "$numberInt" : "1" } }'::bson, true, true) bson_rum_unique_shard_path_ops (cmp='true') WITH =#=)
Check constraints:
    "shard_key_value_check" CHECK (shard_key_value = '5620'::bigint)

-- should succeed and generate terms for all combinations on both arrays
SELECT documentdb_api.insert_one('db', 'queryuniquecomposite', '{ "key1": [1, 2, 3], "key2": [4, 5, 6] }');
                              insert_one                              
---------------------------------------------------------------------
 { "n" : { "$numberInt" : "1" }, "ok" : { "$numberDouble" : "1.0" } }
(1 row)

-- should fail due to terms permutation on both arrays
SELECT documentdb_api.insert_one('db', 'queryuniquecomposite', '{ "key1": [1, 2, 3], "key2": [4, 5, 6] }');
                                                                                                                           insert_one                                                                                                                           
---------------------------------------------------------------------
 { "n" : { "$numberInt" : "0" }, "ok" : { "$numberDouble" : "1.0" }, "writeErrors" : [ { "index" : { "$numberInt" : "0" }, "code" : { "$numberInt" : "319029277" }, "errmsg" : "Duplicate key violation on the requested collection: Index 'constraint1'" } ] }
(1 row)

SELECT documentdb_api.insert_one('db', 'queryuniquecomposite', '{ "key1": 1, "key2": 4 }');
                                                                                                                           insert_one                                                                                                                           
---------------------------------------------------------------------
 { "n" : { "$numberInt" : "0" }, "ok" : { "$numberDouble" : "1.0" }, "writeErrors" : [ { "index" : { "$numberInt" : "0" }, "code" : { "$numberInt" : "319029277" }, "errmsg" : "Duplicate key violation on the requested collection: Index 'constraint1'" } ] }
(1 row)

SELECT documentdb_api.insert_one('db', 'queryuniquecomposite', '{ "key1": 1, "key2": 5 }');
                                                                                                                           insert_one                                                                                                                           
---------------------------------------------------------------------
 { "n" : { "$numberInt" : "0" }, "ok" : { "$numberDouble" : "1.0" }, "writeErrors" : [ { "index" : { "$numberInt" : "0" }, "code" : { "$numberInt" : "319029277" }, "errmsg" : "Duplicate key violation on the requested collection: Index 'constraint1'" } ] }
(1 row)

SELECT documentdb_api.insert_one('db', 'queryuniquecomposite', '{ "key1": 1, "key2": 6 }');
                                                                                                                           insert_one                                                                                                                           
---------------------------------------------------------------------
 { "n" : { "$numberInt" : "0" }, "ok" : { "$numberDouble" : "1.0" }, "writeErrors" : [ { "index" : { "$numberInt" : "0" }, "code" : { "$numberInt" : "319029277" }, "errmsg" : "Duplicate key violation on the requested collection: Index 'constraint1'" } ] }
(1 row)

SELECT documentdb_api.insert_one('db', 'queryuniquecomposite', '{ "key1": 2, "key2": 4 }');
                                                                                                                           insert_one                                                                                                                           
---------------------------------------------------------------------
 { "n" : { "$numberInt" : "0" }, "ok" : { "$numberDouble" : "1.0" }, "writeErrors" : [ { "index" : { "$numberInt" : "0" }, "code" : { "$numberInt" : "319029277" }, "errmsg" : "Duplicate key violation on the requested collection: Index 'constraint1'" } ] }
(1 row)

SELECT documentdb_api.insert_one('db', 'queryuniquecomposite', '{ "key1": 2, "key2": 5 }');
                                                                                                                           insert_one                                                                                                                           
---------------------------------------------------------------------
 { "n" : { "$numberInt" : "0" }, "ok" : { "$numberDouble" : "1.0" }, "writeErrors" : [ { "index" : { "$numberInt" : "0" }, "code" : { "$numberInt" : "319029277" }, "errmsg" : "Duplicate key violation on the requested collection: Index 'constraint1'" } ] }
(1 row)

SELECT documentdb_api.insert_one('db', 'queryuniquecomposite', '{ "key1": 2, "key2": 6 }');
                                                                                                                           insert_one                                                                                                                           
---------------------------------------------------------------------
 { "n" : { "$numberInt" : "0" }, "ok" : { "$numberDouble" : "1.0" }, "writeErrors" : [ { "index" : { "$numberInt" : "0" }, "code" : { "$numberInt" : "319029277" }, "errmsg" : "Duplicate key violation on the requested collection: Index 'constraint1'" } ] }
(1 row)

SELECT documentdb_api.insert_one('db', 'queryuniquecomposite', '{ "key1": 3, "key2": 4 }');
                                                                                                                           insert_one                                                                                                                           
---------------------------------------------------------------------
 { "n" : { "$numberInt" : "0" }, "ok" : { "$numberDouble" : "1.0" }, "writeErrors" : [ { "index" : { "$numberInt" : "0" }, "code" : { "$numberInt" : "319029277" }, "errmsg" : "Duplicate key violation on the requested collection: Index 'constraint1'" } ] }
(1 row)

SELECT documentdb_api.insert_one('db', 'queryuniquecomposite', '{ "key1": 3, "key2": 5 }');
                                                                                                                           insert_one                                                                                                                           
---------------------------------------------------------------------
 { "n" : { "$numberInt" : "0" }, "ok" : { "$numberDouble" : "1.0" }, "writeErrors" : [ { "index" : { "$numberInt" : "0" }, "code" : { "$numberInt" : "319029277" }, "errmsg" : "Duplicate key violation on the requested collection: Index 'constraint1'" } ] }
(1 row)

SELECT documentdb_api.insert_one('db', 'queryuniquecomposite', '{ "key1": 3, "key2": 6 }');
                                                                                                                           insert_one                                                                                                                           
---------------------------------------------------------------------
 { "n" : { "$numberInt" : "0" }, "ok" : { "$numberDouble" : "1.0" }, "writeErrors" : [ { "index" : { "$numberInt" : "0" }, "code" : { "$numberInt" : "319029277" }, "errmsg" : "Duplicate key violation on the requested collection: Index 'constraint1'" } ] }
(1 row)

-- now test array permutations with missing key
SELECT documentdb_api.insert_one('db', 'queryuniquecomposite', '{ "key1": [1, 2, 3, 4, 5] }');
                              insert_one                              
---------------------------------------------------------------------
 { "n" : { "$numberInt" : "1" }, "ok" : { "$numberDouble" : "1.0" } }
(1 row)

-- should fail with undefined permutations on missing key
SELECT documentdb_api.insert_one('db', 'queryuniquecomposite', '{ "key1": 1 }');
                                                                                                                           insert_one                                                                                                                           
---------------------------------------------------------------------
 { "n" : { "$numberInt" : "0" }, "ok" : { "$numberDouble" : "1.0" }, "writeErrors" : [ { "index" : { "$numberInt" : "0" }, "code" : { "$numberInt" : "319029277" }, "errmsg" : "Duplicate key violation on the requested collection: Index 'constraint1'" } ] }
(1 row)

SELECT documentdb_api.insert_one('db', 'queryuniquecomposite', '{ "key1": 2 }');
                                                                                                                           insert_one                                                                                                                           
---------------------------------------------------------------------
 { "n" : { "$numberInt" : "0" }, "ok" : { "$numberDouble" : "1.0" }, "writeErrors" : [ { "index" : { "$numberInt" : "0" }, "code" : { "$numberInt" : "319029277" }, "errmsg" : "Duplicate key violation on the requested collection: Index 'constraint1'" } ] }
(1 row)

SELECT documentdb_api.insert_one('db', 'queryuniquecomposite', '{ "key1": 3 }');
                                                                                                                           insert_one                                                                                                                           
---------------------------------------------------------------------
 { "n" : { "$numberInt" : "0" }, "ok" : { "$numberDouble" : "1.0" }, "writeErrors" : [ { "index" : { "$numberInt" : "0" }, "code" : { "$numberInt" : "319029277" }, "errmsg" : "Duplicate key violation on the requested collection: Index 'constraint1'" } ] }
(1 row)

SELECT documentdb_api.insert_one('db', 'queryuniquecomposite', '{ "key1": 4 }');
                                                                                                                           insert_one                                                                                                                           
---------------------------------------------------------------------
 { "n" : { "$numberInt" : "0" }, "ok" : { "$numberDouble" : "1.0" }, "writeErrors" : [ { "index" : { "$numberInt" : "0" }, "code" : { "$numberInt" : "319029277" }, "errmsg" : "Duplicate key violation on the requested collection: Index 'constraint1'" } ] }
(1 row)

SELECT documentdb_api.insert_one('db', 'queryuniquecomposite', '{ "key1": 5 }');
                                                                                                                           insert_one                                                                                                                           
---------------------------------------------------------------------
 { "n" : { "$numberInt" : "0" }, "ok" : { "$numberDouble" : "1.0" }, "writeErrors" : [ { "index" : { "$numberInt" : "0" }, "code" : { "$numberInt" : "319029277" }, "errmsg" : "Duplicate key violation on the requested collection: Index 'constraint1'" } ] }
(1 row)

-- should succeed with null permutations on missing key (sparse)
SELECT documentdb_api.insert_one('db', 'queryuniquecomposite', '{ "key1": 1, "key2": null }');
                              insert_one                              
---------------------------------------------------------------------
 { "n" : { "$numberInt" : "1" }, "ok" : { "$numberDouble" : "1.0" } }
(1 row)

SELECT documentdb_api.insert_one('db', 'queryuniquecomposite', '{ "key1": 2, "key2": null }');
                              insert_one                              
---------------------------------------------------------------------
 { "n" : { "$numberInt" : "1" }, "ok" : { "$numberDouble" : "1.0" } }
(1 row)

SELECT documentdb_api.insert_one('db', 'queryuniquecomposite', '{ "key1": 3, "key2": null }');
                              insert_one                              
---------------------------------------------------------------------
 { "n" : { "$numberInt" : "1" }, "ok" : { "$numberDouble" : "1.0" } }
(1 row)

SELECT documentdb_api.insert_one('db', 'queryuniquecomposite', '{ "key1": 4, "key2": null }');
                              insert_one                              
---------------------------------------------------------------------
 { "n" : { "$numberInt" : "1" }, "ok" : { "$numberDouble" : "1.0" } }
(1 row)

SELECT documentdb_api.insert_one('db', 'queryuniquecomposite', '{ "key1": 5, "key2": null }');
                              insert_one                              
---------------------------------------------------------------------
 { "n" : { "$numberInt" : "1" }, "ok" : { "$numberDouble" : "1.0" } }
(1 row)

-- should succeed due to new combinations
SELECT documentdb_api.insert_one('db', 'queryuniquecomposite', '{ "key1": 6 }');
                              insert_one                              
---------------------------------------------------------------------
 { "n" : { "$numberInt" : "1" }, "ok" : { "$numberDouble" : "1.0" } }
(1 row)

SELECT documentdb_api.insert_one('db', 'queryuniquecomposite', '{ "key1": 6, "key2": 1 }');
                              insert_one                              
---------------------------------------------------------------------
 { "n" : { "$numberInt" : "1" }, "ok" : { "$numberDouble" : "1.0" } }
(1 row)

SELECT documentdb_api.insert_one('db', 'queryuniquecomposite', '{ "key1": 6, "key2": 2 }');
                              insert_one                              
---------------------------------------------------------------------
 { "n" : { "$numberInt" : "1" }, "ok" : { "$numberDouble" : "1.0" } }
(1 row)

SELECT documentdb_api.insert_one('db', 'queryuniquecomposite', '{ "key1": 6, "key2": 3 }');
                              insert_one                              
---------------------------------------------------------------------
 { "n" : { "$numberInt" : "1" }, "ok" : { "$numberDouble" : "1.0" } }
(1 row)

SELECT documentdb_api.insert_one('db', 'queryuniquecomposite', '{ "key1": 6, "key2": 4 }');
                              insert_one                              
---------------------------------------------------------------------
 { "n" : { "$numberInt" : "1" }, "ok" : { "$numberDouble" : "1.0" } }
(1 row)

SELECT documentdb_api.insert_one('db', 'queryuniquecomposite', '{ "key2": 1 }');
                              insert_one                              
---------------------------------------------------------------------
 { "n" : { "$numberInt" : "1" }, "ok" : { "$numberDouble" : "1.0" } }
(1 row)

SELECT documentdb_api.insert_one('db', 'queryuniquecomposite', '{ "key2": 2 }');
                              insert_one                              
---------------------------------------------------------------------
 { "n" : { "$numberInt" : "1" }, "ok" : { "$numberDouble" : "1.0" } }
(1 row)

SELECT documentdb_api.insert_one('db', 'queryuniquecomposite', '{ "key2": 3 }');
                              insert_one                              
---------------------------------------------------------------------
 { "n" : { "$numberInt" : "1" }, "ok" : { "$numberDouble" : "1.0" } }
(1 row)

-- should work because doesn't fall in unique constraint
SELECT documentdb_api.insert_one('db', 'queryuniquecomposite', '{ "key3": [1, 2] }');
                              insert_one                              
---------------------------------------------------------------------
 { "n" : { "$numberInt" : "1" }, "ok" : { "$numberDouble" : "1.0" } }
(1 row)

SELECT documentdb_api.insert_one('db', 'queryuniquecomposite', '{ "key3": [1, 2] }');
                              insert_one                              
---------------------------------------------------------------------
 { "n" : { "$numberInt" : "1" }, "ok" : { "$numberDouble" : "1.0" } }
(1 row)

-- reset data
set documentdb.enable_large_unique_index_keys to on;
DELETE FROM documentdb_data.documents_5620;
CALL documentdb_api.drop_indexes('db', '{ "dropIndexes": "queryuniquecomposite", "index": [ "constraint1" ] }');
                          retval                          
---------------------------------------------------------------------
 { "ok" : true, "nIndexesWas" : { "$numberLong" : "2" } }
(1 row)

\d documentdb_data.documents_5620
          Table "documentdb_data.documents_5620"
     Column      |  Type  | Collation | Nullable | Default 
---------------------------------------------------------------------
 shard_key_value | bigint |           | not null | 
 object_id       | bson   |           | not null | 
 document        | bson   |           | not null | 
Indexes:
    "collection_pk_5620" PRIMARY KEY, btree (shard_key_value, object_id)
Check constraints:
    "shard_key_value_check" CHECK (shard_key_value = '5620'::bigint)

-- now test composite not-sparse unique index
SELECT documentdb_api_internal.create_indexes_non_concurrently('db', '{ "createIndexes": "queryuniquecomposite", "indexes": [ { "key" : { "key1": 1, "key2": 1 }, "name": "constraint1", "unique": true, "sparse": false, "enableCompositeTerm": true }] }', true);
                                                                                                   create_indexes_non_concurrently                                                                                                    
---------------------------------------------------------------------
 { "raw" : { "defaultShard" : { "numIndexesBefore" : { "$numberInt" : "1" }, "numIndexesAfter" : { "$numberInt" : "2" }, "createdCollectionAutomatically" : false, "ok" : { "$numberInt" : "1" } } }, "ok" : { "$numberInt" : "1" } }
(1 row)

\d+ documentdb_data.documents_5620
                              Table "documentdb_data.documents_5620"
     Column      |  Type  | Collation | Nullable | Default | Storage  | Stats target | Description 
---------------------------------------------------------------------
 shard_key_value | bigint |           | not null |         | plain    |              | 
 object_id       | bson   |           | not null |         | extended |              | 
 document        | bson   |           | not null |         | extended |              | 
Indexes:
    "collection_pk_5620" PRIMARY KEY, btree (shard_key_value, object_id)
    "documents_rum_index_5631" EXCLUDE USING documentdb_rum (document bson_rum_composite_path_ops (pathspec='[ "key1", "key2" ]', tl='2691') WITH =?=, generate_unique_shard_document(document, shard_key_value, '{ "key1" : { "$numberInt" : "1" }, "key2" : { "$numberInt" : "1" } }'::bson, false, true) bson_rum_unique_shard_path_ops (cmp='true') WITH =#=)
Check constraints:
    "shard_key_value_check" CHECK (shard_key_value = '5620'::bigint)

\d+ documentdb_data.documents_rum_index_5631
                                                                                        Index "documentdb_data.documents_rum_index_5631"
             Column             | Type  | Key? |                                                                      Definition                                                                      | Storage  | Stats target 
---------------------------------------------------------------------
 document                       | bytea | yes  | document                                                                                                                                             | extended | 
 generate_unique_shard_document | uuid  | yes  | generate_unique_shard_document(document, shard_key_value, '{ "key1" : { "$numberInt" : "1" }, "key2" : { "$numberInt" : "1" } }'::bson, false, true) | plain    | 0
documentdb_rum, for table "documentdb_data.documents_5620"

-- test array permutations with missing key
SELECT documentdb_api.insert_one('db', 'queryuniquecomposite', '{ "key1": [1, 2, 3, 4, 5] }');
                              insert_one                              
---------------------------------------------------------------------
 { "n" : { "$numberInt" : "1" }, "ok" : { "$numberDouble" : "1.0" } }
(1 row)

-- should fail with undefined permutations on missing key
SELECT documentdb_api.insert_one('db', 'queryuniquecomposite', '{ "key1": 1 }');
                                                                                                                           insert_one                                                                                                                           
---------------------------------------------------------------------
 { "n" : { "$numberInt" : "0" }, "ok" : { "$numberDouble" : "1.0" }, "writeErrors" : [ { "index" : { "$numberInt" : "0" }, "code" : { "$numberInt" : "319029277" }, "errmsg" : "Duplicate key violation on the requested collection: Index 'constraint1'" } ] }
(1 row)

SELECT documentdb_api.insert_one('db', 'queryuniquecomposite', '{ "key1": 2 }');
                                                                                                                           insert_one                                                                                                                           
---------------------------------------------------------------------
 { "n" : { "$numberInt" : "0" }, "ok" : { "$numberDouble" : "1.0" }, "writeErrors" : [ { "index" : { "$numberInt" : "0" }, "code" : { "$numberInt" : "319029277" }, "errmsg" : "Duplicate key violation on the requested collection: Index 'constraint1'" } ] }
(1 row)

SELECT documentdb_api.insert_one('db', 'queryuniquecomposite', '{ "key1": 3 }');
                                                                                                                           insert_one                                                                                                                           
---------------------------------------------------------------------
 { "n" : { "$numberInt" : "0" }, "ok" : { "$numberDouble" : "1.0" }, "writeErrors" : [ { "index" : { "$numberInt" : "0" }, "code" : { "$numberInt" : "319029277" }, "errmsg" : "Duplicate key violation on the requested collection: Index 'constraint1'" } ] }
(1 row)

SELECT documentdb_api.insert_one('db', 'queryuniquecomposite', '{ "key1": 4 }');
                                                                                                                           insert_one                                                                                                                           
---------------------------------------------------------------------
 { "n" : { "$numberInt" : "0" }, "ok" : { "$numberDouble" : "1.0" }, "writeErrors" : [ { "index" : { "$numberInt" : "0" }, "code" : { "$numberInt" : "319029277" }, "errmsg" : "Duplicate key violation on the requested collection: Index 'constraint1'" } ] }
(1 row)

SELECT documentdb_api.insert_one('db', 'queryuniquecomposite', '{ "key1": 5 }');
                                                                                                                           insert_one                                                                                                                           
---------------------------------------------------------------------
 { "n" : { "$numberInt" : "0" }, "ok" : { "$numberDouble" : "1.0" }, "writeErrors" : [ { "index" : { "$numberInt" : "0" }, "code" : { "$numberInt" : "319029277" }, "errmsg" : "Duplicate key violation on the requested collection: Index 'constraint1'" } ] }
(1 row)

-- should fail with null permutations on missing key (non-sparse)
SELECT documentdb_api.insert_one('db', 'queryuniquecomposite', '{ "key1": 1, "key2": null }');
                                                                                                                           insert_one                                                                                                                           
---------------------------------------------------------------------
 { "n" : { "$numberInt" : "0" }, "ok" : { "$numberDouble" : "1.0" }, "writeErrors" : [ { "index" : { "$numberInt" : "0" }, "code" : { "$numberInt" : "319029277" }, "errmsg" : "Duplicate key violation on the requested collection: Index 'constraint1'" } ] }
(1 row)

SELECT documentdb_api.insert_one('db', 'queryuniquecomposite', '{ "key1": 2, "key2": null }');
                                                                                                                           insert_one                                                                                                                           
---------------------------------------------------------------------
 { "n" : { "$numberInt" : "0" }, "ok" : { "$numberDouble" : "1.0" }, "writeErrors" : [ { "index" : { "$numberInt" : "0" }, "code" : { "$numberInt" : "319029277" }, "errmsg" : "Duplicate key violation on the requested collection: Index 'constraint1'" } ] }
(1 row)

SELECT documentdb_api.insert_one('db', 'queryuniquecomposite', '{ "key1": 3, "key2": null }');
                                                                                                                           insert_one                                                                                                                           
---------------------------------------------------------------------
 { "n" : { "$numberInt" : "0" }, "ok" : { "$numberDouble" : "1.0" }, "writeErrors" : [ { "index" : { "$numberInt" : "0" }, "code" : { "$numberInt" : "319029277" }, "errmsg" : "Duplicate key violation on the requested collection: Index 'constraint1'" } ] }
(1 row)

SELECT documentdb_api.insert_one('db', 'queryuniquecomposite', '{ "key1": 4, "key2": null }');
                                                                                                                           insert_one                                                                                                                           
---------------------------------------------------------------------
 { "n" : { "$numberInt" : "0" }, "ok" : { "$numberDouble" : "1.0" }, "writeErrors" : [ { "index" : { "$numberInt" : "0" }, "code" : { "$numberInt" : "319029277" }, "errmsg" : "Duplicate key violation on the requested collection: Index 'constraint1'" } ] }
(1 row)

SELECT documentdb_api.insert_one('db', 'queryuniquecomposite', '{ "key1": 5, "key2": null }');
                                                                                                                           insert_one                                                                                                                           
---------------------------------------------------------------------
 { "n" : { "$numberInt" : "0" }, "ok" : { "$numberDouble" : "1.0" }, "writeErrors" : [ { "index" : { "$numberInt" : "0" }, "code" : { "$numberInt" : "319029277" }, "errmsg" : "Duplicate key violation on the requested collection: Index 'constraint1'" } ] }
(1 row)

-- reset data
set documentdb.enable_large_unique_index_keys to on;
DELETE FROM documentdb_data.documents_5620;
CALL documentdb_api.drop_indexes('db', '{ "dropIndexes": "queryuniquecomposite", "index": [ "constraint1" ] }');
                          retval                          
---------------------------------------------------------------------
 { "ok" : true, "nIndexesWas" : { "$numberLong" : "2" } }
(1 row)

\d documentdb_data.documents_5620
          Table "documentdb_data.documents_5620"
     Column      |  Type  | Collation | Nullable | Default 
---------------------------------------------------------------------
 shard_key_value | bigint |           | not null | 
 object_id       | bson   |           | not null | 
 document        | bson   |           | not null | 
Indexes:
    "collection_pk_5620" PRIMARY KEY, btree (shard_key_value, object_id)
Check constraints:
    "shard_key_value_check" CHECK (shard_key_value = '5620'::bigint)

-- now test composite not-sparse unique index
SELECT documentdb_api_internal.create_indexes_non_concurrently('db', '{ "createIndexes": "queryuniquecomposite", "indexes": [ { "key" : { "a": 1, "b": 1, "c": 1 }, "name": "constraint1", "unique": true, "sparse": true, "enableCompositeTerm": true }] }', true);
                                                                                                   create_indexes_non_concurrently                                                                                                    
---------------------------------------------------------------------
 { "raw" : { "defaultShard" : { "numIndexesBefore" : { "$numberInt" : "1" }, "numIndexesAfter" : { "$numberInt" : "2" }, "createdCollectionAutomatically" : false, "ok" : { "$numberInt" : "1" } } }, "ok" : { "$numberInt" : "1" } }
(1 row)

\d documentdb_data.documents_5620
          Table "documentdb_data.documents_5620"
     Column      |  Type  | Collation | Nullable | Default 
---------------------------------------------------------------------
 shard_key_value | bigint |           | not null | 
 object_id       | bson   |           | not null | 
 document        | bson   |           | not null | 
Indexes:
    "collection_pk_5620" PRIMARY KEY, btree (shard_key_value, object_id)
    "documents_rum_index_5632" EXCLUDE USING documentdb_rum (document bson_rum_composite_path_ops (pathspec='[ "a", "b", "c" ]', tl='2691') WITH =?=, generate_unique_shard_document(document, shard_key_value, '{ "a" : { "$numberInt" : "1" }, "b" : { "$numberInt" : "1" }, "c" : { "$numberInt" : "1" } }'::bson, true, true) bson_rum_unique_shard_path_ops (cmp='true') WITH =#=)
Check constraints:
    "shard_key_value_check" CHECK (shard_key_value = '5620'::bigint)

-- should work
SELECT documentdb_api.insert_one('db', 'queryuniquecomposite', '{ "a": 1 }');
                              insert_one                              
---------------------------------------------------------------------
 { "n" : { "$numberInt" : "1" }, "ok" : { "$numberDouble" : "1.0" } }
(1 row)

SELECT documentdb_api.insert_one('db', 'queryuniquecomposite', '{ "a": 1, "b": 1 }');
                              insert_one                              
---------------------------------------------------------------------
 { "n" : { "$numberInt" : "1" }, "ok" : { "$numberDouble" : "1.0" } }
(1 row)

SELECT documentdb_api.insert_one('db', 'queryuniquecomposite', '{ "a": 1, "c": 1 }');
                              insert_one                              
---------------------------------------------------------------------
 { "n" : { "$numberInt" : "1" }, "ok" : { "$numberDouble" : "1.0" } }
(1 row)

SELECT documentdb_api.insert_one('db', 'queryuniquecomposite', '{ "b": 1, "c": 1 }');
                              insert_one                              
---------------------------------------------------------------------
 { "n" : { "$numberInt" : "1" }, "ok" : { "$numberDouble" : "1.0" } }
(1 row)

-- repeated documents won't matter because  they don't fall in the index (sparse)
SELECT documentdb_api.insert_one('db', 'queryuniquecomposite', '{ "z": 1 }');
                              insert_one                              
---------------------------------------------------------------------
 { "n" : { "$numberInt" : "1" }, "ok" : { "$numberDouble" : "1.0" } }
(1 row)

SELECT documentdb_api.insert_one('db', 'queryuniquecomposite', '{ "z": 1 }');
                              insert_one                              
---------------------------------------------------------------------
 { "n" : { "$numberInt" : "1" }, "ok" : { "$numberDouble" : "1.0" } }
(1 row)

-- should fail
SELECT documentdb_api.insert_one('db', 'queryuniquecomposite', '{ "a": 1 }');
                                                                                                                           insert_one                                                                                                                           
---------------------------------------------------------------------
 { "n" : { "$numberInt" : "0" }, "ok" : { "$numberDouble" : "1.0" }, "writeErrors" : [ { "index" : { "$numberInt" : "0" }, "code" : { "$numberInt" : "319029277" }, "errmsg" : "Duplicate key violation on the requested collection: Index 'constraint1'" } ] }
(1 row)

SELECT documentdb_api.insert_one('db', 'queryuniquecomposite', '{ "a": 1, "b": 1 }');
                                                                                                                           insert_one                                                                                                                           
---------------------------------------------------------------------
 { "n" : { "$numberInt" : "0" }, "ok" : { "$numberDouble" : "1.0" }, "writeErrors" : [ { "index" : { "$numberInt" : "0" }, "code" : { "$numberInt" : "319029277" }, "errmsg" : "Duplicate key violation on the requested collection: Index 'constraint1'" } ] }
(1 row)

-- reset data
set documentdb.enable_large_unique_index_keys to on;
DELETE FROM documentdb_data.documents_5620;
CALL documentdb_api.drop_indexes('db', '{ "dropIndexes": "queryuniquecomposite", "index": [ "constraint1" ] }');
                          retval                          
---------------------------------------------------------------------
 { "ok" : true, "nIndexesWas" : { "$numberLong" : "2" } }
(1 row)

\d documentdb_data.documents_5620
          Table "documentdb_data.documents_5620"
     Column      |  Type  | Collation | Nullable | Default 
---------------------------------------------------------------------
 shard_key_value | bigint |           | not null | 
 object_id       | bson   |           | not null | 
 document        | bson   |           | not null | 
Indexes:
    "collection_pk_5620" PRIMARY KEY, btree (shard_key_value, object_id)
Check constraints:
    "shard_key_value_check" CHECK (shard_key_value = '5620'::bigint)

-- now test composite not-sparse unique index
SELECT documentdb_api_internal.create_indexes_non_concurrently('db', '{ "createIndexes": "queryuniquecomposite", "indexes": [ { "key" : { "a": 1, "b": 1, "c": 1 }, "name": "constraint1", "unique": true, "sparse": false, "enableCompositeTerm": true }] }', true);
                                                                                                   create_indexes_non_concurrently                                                                                                    
---------------------------------------------------------------------
 { "raw" : { "defaultShard" : { "numIndexesBefore" : { "$numberInt" : "1" }, "numIndexesAfter" : { "$numberInt" : "2" }, "createdCollectionAutomatically" : false, "ok" : { "$numberInt" : "1" } } }, "ok" : { "$numberInt" : "1" } }
(1 row)

\d documentdb_data.documents_5620
          Table "documentdb_data.documents_5620"
     Column      |  Type  | Collation | Nullable | Default 
---------------------------------------------------------------------
 shard_key_value | bigint |           | not null | 
 object_id       | bson   |           | not null | 
 document        | bson   |           | not null | 
Indexes:
    "collection_pk_5620" PRIMARY KEY, btree (shard_key_value, object_id)
    "documents_rum_index_5633" EXCLUDE USING documentdb_rum (document bson_rum_composite_path_ops (pathspec='[ "a", "b", "c" ]', tl='2691') WITH =?=, generate_unique_shard_document(document, shard_key_value, '{ "a" : { "$numberInt" : "1" }, "b" : { "$numberInt" : "1" }, "c" : { "$numberInt" : "1" } }'::bson, false, true) bson_rum_unique_shard_path_ops (cmp='true') WITH =#=)
Check constraints:
    "shard_key_value_check" CHECK (shard_key_value = '5620'::bigint)

-- should work
SELECT documentdb_api.insert_one('db', 'queryuniquecomposite', '{ "a": 1 }');
                              insert_one                              
---------------------------------------------------------------------
 { "n" : { "$numberInt" : "1" }, "ok" : { "$numberDouble" : "1.0" } }
(1 row)

SELECT documentdb_api.insert_one('db', 'queryuniquecomposite', '{ "a": 1, "b": 1 }');
                              insert_one                              
---------------------------------------------------------------------
 { "n" : { "$numberInt" : "1" }, "ok" : { "$numberDouble" : "1.0" } }
(1 row)

SELECT documentdb_api.insert_one('db', 'queryuniquecomposite', '{ "a": 1, "c": 1 }');
                              insert_one                              
---------------------------------------------------------------------
 { "n" : { "$numberInt" : "1" }, "ok" : { "$numberDouble" : "1.0" } }
(1 row)

SELECT documentdb_api.insert_one('db', 'queryuniquecomposite', '{ "b": 1, "c": 1 }');
                              insert_one                              
---------------------------------------------------------------------
 { "n" : { "$numberInt" : "1" }, "ok" : { "$numberDouble" : "1.0" } }
(1 row)

-- repeated documents will matter because they fall in the index (non-sparse)
SELECT documentdb_api.insert_one('db', 'queryuniquecomposite', '{ "z": 1 }');
                              insert_one                              
---------------------------------------------------------------------
 { "n" : { "$numberInt" : "1" }, "ok" : { "$numberDouble" : "1.0" } }
(1 row)

SELECT documentdb_api.insert_one('db', 'queryuniquecomposite', '{ "z": 1 }');
                                                                                                                           insert_one                                                                                                                           
---------------------------------------------------------------------
 { "n" : { "$numberInt" : "0" }, "ok" : { "$numberDouble" : "1.0" }, "writeErrors" : [ { "index" : { "$numberInt" : "0" }, "code" : { "$numberInt" : "319029277" }, "errmsg" : "Duplicate key violation on the requested collection: Index 'constraint1'" } ] }
(1 row)

-- should fail
SELECT documentdb_api.insert_one('db', 'queryuniquecomposite', '{ "a": 1 }');
                                                                                                                           insert_one                                                                                                                           
---------------------------------------------------------------------
 { "n" : { "$numberInt" : "0" }, "ok" : { "$numberDouble" : "1.0" }, "writeErrors" : [ { "index" : { "$numberInt" : "0" }, "code" : { "$numberInt" : "319029277" }, "errmsg" : "Duplicate key violation on the requested collection: Index 'constraint1'" } ] }
(1 row)

SELECT documentdb_api.insert_one('db', 'queryuniquecomposite', '{ "a": 1, "b": 1 }');
                                                                                                                           insert_one                                                                                                                           
---------------------------------------------------------------------
 { "n" : { "$numberInt" : "0" }, "ok" : { "$numberDouble" : "1.0" }, "writeErrors" : [ { "index" : { "$numberInt" : "0" }, "code" : { "$numberInt" : "319029277" }, "errmsg" : "Duplicate key violation on the requested collection: Index 'constraint1'" } ] }
(1 row)

-- reset data
set documentdb.enable_large_unique_index_keys to on;
set documentdb.indexTermLimitOverride to 60;
DELETE FROM documentdb_data.documents_5620;
CALL documentdb_api.drop_indexes('db', '{ "dropIndexes": "queryuniquecomposite", "index": [ "constraint1" ] }');
                          retval                          
---------------------------------------------------------------------
 { "ok" : true, "nIndexesWas" : { "$numberLong" : "2" } }
(1 row)

\d documentdb_data.documents_5620
          Table "documentdb_data.documents_5620"
     Column      |  Type  | Collation | Nullable | Default 
---------------------------------------------------------------------
 shard_key_value | bigint |           | not null | 
 object_id       | bson   |           | not null | 
 document        | bson   |           | not null | 
Indexes:
    "collection_pk_5620" PRIMARY KEY, btree (shard_key_value, object_id)
Check constraints:
    "shard_key_value_check" CHECK (shard_key_value = '5620'::bigint)

-- now test composite not-sparse unique index
SELECT documentdb_api_internal.create_indexes_non_concurrently('db', '{ "createIndexes": "queryuniquecomposite", "indexes": [ { "key" : { "a": 1, "b": 1 }, "name": "constraint1", "unique": true, "sparse": false, "enableCompositeTerm": true }] }', true);
                                                                                                   create_indexes_non_concurrently                                                                                                    
---------------------------------------------------------------------
 { "raw" : { "defaultShard" : { "numIndexesBefore" : { "$numberInt" : "1" }, "numIndexesAfter" : { "$numberInt" : "2" }, "createdCollectionAutomatically" : false, "ok" : { "$numberInt" : "1" } } }, "ok" : { "$numberInt" : "1" } }
(1 row)

\d documentdb_data.documents_5620
          Table "documentdb_data.documents_5620"
     Column      |  Type  | Collation | Nullable | Default 
---------------------------------------------------------------------
 shard_key_value | bigint |           | not null | 
 object_id       | bson   |           | not null | 
 document        | bson   |           | not null | 
Indexes:
    "collection_pk_5620" PRIMARY KEY, btree (shard_key_value, object_id)
    "documents_rum_index_5634" EXCLUDE USING documentdb_rum (document bson_rum_composite_path_ops (pathspec='[ "a", "b" ]', tl='60') WITH =?=, generate_unique_shard_document(document, shard_key_value, '{ "a" : { "$numberInt" : "1" }, "b" : { "$numberInt" : "1" } }'::bson, false, true) bson_rum_unique_shard_path_ops (cmp='true') WITH =#=)
Check constraints:
    "shard_key_value_check" CHECK (shard_key_value = '5620'::bigint)

-- insert data in a way that bson_rum_single_path_ops will match truncated and bson_rum_unique_shard_path_ops recheck won't
set documentdb.defaultUniqueIndexKeyhashOverride to 1;
-- set log level in order to test hash collision flow
SET client_min_messages TO DEBUG1;
-- works
SELECT documentdb_api.insert_one('db', 'queryuniquecomposite', '{ "a": "thiskeyisalittlelargerthanthemaximumallowedsizeof60characters", "b": "thiskeyisalotorinotherwordsmuchmuchlargerthanthemaximumallowedsizeof60characters" }');
                              insert_one                              
---------------------------------------------------------------------
 { "n" : { "$numberInt" : "1" }, "ok" : { "$numberDouble" : "1.0" } }
(1 row)

-- should succeed with hash collision and truncation
SELECT documentdb_api.insert_one('db', 'queryuniquecomposite', '{ "a": "thiskeyisalittlelargerthanthemaximumallowedsizeof60characters2", "b": "thiskeyisalotorinotherwordsmuchmuchlargerthanthemaximumallowedsizeof60characters2" }');
DEBUG:  Executing unique index runtime recheck.
                              insert_one                              
---------------------------------------------------------------------
 { "n" : { "$numberInt" : "1" }, "ok" : { "$numberDouble" : "1.0" } }
(1 row)

SELECT documentdb_api.insert_one('db', 'queryuniquecomposite', '{ "a": "thiskeyisalittlelargerthanthemaximumallowedsizeof60characters3", "b": "thiskeyisalotorinotherwordsmuchmuchlargerthanthemaximumallowedsizeof60characters3" }');
DEBUG:  Executing unique index runtime recheck.
DEBUG:  Executing unique index runtime recheck.
                              insert_one                              
---------------------------------------------------------------------
 { "n" : { "$numberInt" : "1" }, "ok" : { "$numberDouble" : "1.0" } }
(1 row)

SELECT documentdb_api.insert_one('db', 'queryuniquecomposite', '{ "a": "thiskeyisalittlelargerthanthemaximumallowedsizeof60characters4", "b": "thiskeyisalotorinotherwordsmuchmuchlargerthanthemaximumallowedsizeof60characters4" }');
DEBUG:  Executing unique index runtime recheck.
DEBUG:  Executing unique index runtime recheck.
DEBUG:  Executing unique index runtime recheck.
                              insert_one                              
---------------------------------------------------------------------
 { "n" : { "$numberInt" : "1" }, "ok" : { "$numberDouble" : "1.0" } }
(1 row)

-- reset log level
RESET client_min_messages;
-- should fail even with hash collision and truncation
SELECT documentdb_api.insert_one('db', 'queryuniquecomposite', '{ "a": "thiskeyisalittlelargerthanthemaximumallowedsizeof60characters", "b": "thiskeyisalotorinotherwordsmuchmuchlargerthanthemaximumallowedsizeof60characters" }');
                                                                                                                           insert_one                                                                                                                           
---------------------------------------------------------------------
 { "n" : { "$numberInt" : "0" }, "ok" : { "$numberDouble" : "1.0" }, "writeErrors" : [ { "index" : { "$numberInt" : "0" }, "code" : { "$numberInt" : "319029277" }, "errmsg" : "Duplicate key violation on the requested collection: Index 'constraint1'" } ] }
(1 row)

-- reset data
set documentdb.enable_large_unique_index_keys to on;
set documentdb.indexTermLimitOverride to 60;
DELETE FROM documentdb_data.documents_5620;
CALL documentdb_api.drop_indexes('db', '{ "dropIndexes": "queryuniquecomposite", "index": [ "constraint1" ] }');
                          retval                          
---------------------------------------------------------------------
 { "ok" : true, "nIndexesWas" : { "$numberLong" : "2" } }
(1 row)

\d documentdb_data.documents_5620
          Table "documentdb_data.documents_5620"
     Column      |  Type  | Collation | Nullable | Default 
---------------------------------------------------------------------
 shard_key_value | bigint |           | not null | 
 object_id       | bson   |           | not null | 
 document        | bson   |           | not null | 
Indexes:
    "collection_pk_5620" PRIMARY KEY, btree (shard_key_value, object_id)
Check constraints:
    "shard_key_value_check" CHECK (shard_key_value = '5620'::bigint)

-- now test composite not-sparse unique index
SELECT documentdb_api_internal.create_indexes_non_concurrently('db', '{ "createIndexes": "queryuniquecomposite", "indexes": [ { "key" : { "a": 1, "b": 1 }, "name": "constraint1", "unique": true, "sparse": false, "enableCompositeTerm": true }] }', true);
                                                                                                   create_indexes_non_concurrently                                                                                                    
---------------------------------------------------------------------
 { "raw" : { "defaultShard" : { "numIndexesBefore" : { "$numberInt" : "1" }, "numIndexesAfter" : { "$numberInt" : "2" }, "createdCollectionAutomatically" : false, "ok" : { "$numberInt" : "1" } } }, "ok" : { "$numberInt" : "1" } }
(1 row)

\d documentdb_data.documents_5620
          Table "documentdb_data.documents_5620"
     Column      |  Type  | Collation | Nullable | Default 
---------------------------------------------------------------------
 shard_key_value | bigint |           | not null | 
 object_id       | bson   |           | not null | 
 document        | bson   |           | not null | 
Indexes:
    "collection_pk_5620" PRIMARY KEY, btree (shard_key_value, object_id)
    "documents_rum_index_5635" EXCLUDE USING documentdb_rum (document bson_rum_composite_path_ops (pathspec='[ "a", "b" ]', tl='60') WITH =?=, generate_unique_shard_document(document, shard_key_value, '{ "a" : { "$numberInt" : "1" }, "b" : { "$numberInt" : "1" } }'::bson, false, true) bson_rum_unique_shard_path_ops (cmp='true') WITH =#=)
Check constraints:
    "shard_key_value_check" CHECK (shard_key_value = '5620'::bigint)

-- insert data in a way that bson_rum_single_path_ops will match truncated but unique shard uuid won't match
set documentdb.defaultUniqueIndexKeyhashOverride to 0;
-- set log level in order to test hash collision flow
SET client_min_messages TO DEBUG1;
-- works -
SELECT documentdb_api.insert_one('db', 'queryuniquecomposite', '{ "a": "thiskeyisalittlelargerthanthemaximumallowedsizeof60characters", "b": "thiskeyisalotorinotherwordsmuchmuchlargerthanthemaximumallowedsizeof60characters" }');
                              insert_one                              
---------------------------------------------------------------------
 { "n" : { "$numberInt" : "1" }, "ok" : { "$numberDouble" : "1.0" } }
(1 row)

-- should succeed without recheck logs
SELECT documentdb_api.insert_one('db', 'queryuniquecomposite', '{ "a": "thiskeyisalittlelargerthanthemaximumallowedsizeof60characters2", "b": "thiskeyisalotorinotherwordsmuchmuchlargerthanthemaximumallowedsizeof60characters2" }');
                              insert_one                              
---------------------------------------------------------------------
 { "n" : { "$numberInt" : "1" }, "ok" : { "$numberDouble" : "1.0" } }
(1 row)

SELECT documentdb_api.insert_one('db', 'queryuniquecomposite', '{ "a": "thiskeyisalittlelargerthanthemaximumallowedsizeof60characters3", "b": "thiskeyisalotorinotherwordsmuchmuchlargerthanthemaximumallowedsizeof60characters3" }');
                              insert_one                              
---------------------------------------------------------------------
 { "n" : { "$numberInt" : "1" }, "ok" : { "$numberDouble" : "1.0" } }
(1 row)

SELECT documentdb_api.insert_one('db', 'queryuniquecomposite', '{ "a": "thiskeyisalittlelargerthanthemaximumallowedsizeof60characters4", "b": "thiskeyisalotorinotherwordsmuchmuchlargerthanthemaximumallowedsizeof60characters4" }');
                              insert_one                              
---------------------------------------------------------------------
 { "n" : { "$numberInt" : "1" }, "ok" : { "$numberDouble" : "1.0" } }
(1 row)

-- reset log level
RESET client_min_messages;
-- should fail
SELECT documentdb_api.insert_one('db', 'queryuniquecomposite', '{ "a": "thiskeyisalittlelargerthanthemaximumallowedsizeof60characters", "b": "thiskeyisalotorinotherwordsmuchmuchlargerthanthemaximumallowedsizeof60characters" }');
                                                                                                                           insert_one                                                                                                                           
---------------------------------------------------------------------
 { "n" : { "$numberInt" : "0" }, "ok" : { "$numberDouble" : "1.0" }, "writeErrors" : [ { "index" : { "$numberInt" : "0" }, "code" : { "$numberInt" : "319029277" }, "errmsg" : "Duplicate key violation on the requested collection: Index 'constraint1'" } ] }
(1 row)

