Parsed test spec with 2 sessions

starting permutation: s1_select s2_select s1_savepoint_a s1_update_k_1 s1_rollback_to_a s1_lock_k_1 s1_update_k_3 s1_commit s2_update_k_1 s2_commit s1_select
step s1_select: SELECT * FROM t;
 k|v
--+-
 5|0
 1|0
 6|0
 7|0
 9|0
10|0
 4|0
 2|0
 8|0
 3|0
(10 rows)

step s2_select: SELECT * FROM t;
 k|v
--+-
 5|0
 1|0
 6|0
 7|0
 9|0
10|0
 4|0
 2|0
 8|0
 3|0
(10 rows)

step s1_savepoint_a: SAVEPOINT a;
step s1_update_k_1: UPDATE t SET v=1 WHERE k=1;
step s1_rollback_to_a: ROLLBACK TO a;
step s1_lock_k_1: SELECT * FROM t WHERE k=1 FOR UPDATE;
k|v
-+-
1|0
(1 row)

step s1_update_k_3: UPDATE t SET v=1 WHERE k=3;
step s1_commit: COMMIT;
step s2_update_k_1: UPDATE t SET v=2 WHERE k=1;
step s2_commit: COMMIT;
step s1_select: SELECT * FROM t;
 k|v
--+-
 5|0
 1|2
 6|0
 7|0
 9|0
10|0
 4|0
 2|0
 8|0
 3|1
(10 rows)
