--
-- Planner's plan choices with yb_test_force_parallel = 'force'
--
CREATE DATABASE pctest colocation = true;
\c pctest
set yb_enable_cbo = on;
-- set smaller parallel interval to produce more ranges
set yb_parallel_range_size to 1024;
-- enable parallel query for YB tables
set yb_parallel_range_rows to 1;
-- parallel bitmap scan not supported yet
set enable_bitmapscan = false;
---
--- colocated tables
---
set yb_enable_parallel_scan_colocated = on;
CREATE TABLE pctest1(k int primary key, a int, b int, c int, d text)
    WITH (colocation = true);
CREATE TABLE pctest2(k int primary key, a int, b int, c int, d text)
    WITH (colocation = true);
CREATE UNIQUE INDEX NONCONCURRENTLY ON pctest1(a);
CREATE INDEX NONCONCURRENTLY ON pctest1(c);
CREATE INDEX NONCONCURRENTLY ON pctest2(b);
-- Populate with enlarged, mutually-uncorrelated columns using a fixed seed so
-- the data is reproducible.  k is the PK (1..N); a is a random permutation of
-- 1..N (unique index); b and c are independent random draws.  The old
-- deterministic formulas (c = k%50 vs k%10) made columns functionally dependent
-- on k, badly under-estimating the k=k AND c=c join, and the tiny sizes left
-- plan totals dominated by parallel_setup_cost so choices fell inside the fuzz
-- band.  Larger, uncorrelated data makes the cost-based choices meaningful.
SELECT setseed(0.4321);
 setseed 
---------
 
(1 row)

INSERT INTO pctest1
    SELECT i, a, (random() * 133)::int, (random() * 49)::int, 'Value' || i::text
    FROM (SELECT i, row_number() OVER (ORDER BY random()) AS a
          FROM generate_series(1, 4000) i) t;
SELECT setseed(0.8765);
 setseed 
---------
 
(1 row)

INSERT INTO pctest2
    SELECT i, a, (random() * 200)::int, (random() * 49)::int, 'Other value ' || i::text
    FROM (SELECT i, row_number() OVER (ORDER BY random()) AS a
          FROM generate_series(1, 1000) i) t;
ANALYZE pctest1;
ANALYZE pctest2;
set yb_test_force_parallel = force;
-- Parallel sequential scan
EXPLAIN (costs off)
SELECT * FROM pctest1 WHERE d LIKE 'Value_9';
                   QUERY PLAN                   
------------------------------------------------
 Gather
   Workers Planned: 2
   ->  Parallel Seq Scan on pctest1
         Storage Filter: (d ~~ 'Value_9'::text)
(4 rows)

SELECT * FROM pctest1 WHERE d LIKE 'Value_9';
 k  |  a   |  b  | c  |    d    
----+------+-----+----+---------
 19 | 2039 |  37 | 28 | Value19
 29 | 3992 |  64 |  8 | Value29
 39 | 2715 | 112 | 14 | Value39
 49 | 3339 | 129 | 37 | Value49
 59 | 2537 | 114 | 16 | Value59
 69 |  557 |  82 | 11 | Value69
 79 | 3687 |  57 | 33 | Value79
 89 | 1281 | 102 | 30 | Value89
 99 | 3326 | 126 | 14 | Value99
(9 rows)

-- with aggregates
EXPLAIN (costs off)
SELECT count(*) FROM pctest1 WHERE d LIKE 'Value_9';
                      QUERY PLAN                      
------------------------------------------------------
 Aggregate
   ->  Gather
         Workers Planned: 2
         ->  Parallel Seq Scan on pctest1
               Storage Filter: (d ~~ 'Value_9'::text)
(5 rows)

SELECT count(*) FROM pctest1 WHERE d LIKE 'Value_9';
 count 
-------
     9
(1 row)

-- with sort
EXPLAIN (costs off)
SELECT * FROM pctest1 WHERE d LIKE 'Value_9' ORDER BY b DESC;
                      QUERY PLAN                      
------------------------------------------------------
 Sort
   Sort Key: b DESC
   ->  Gather
         Workers Planned: 2
         ->  Parallel Seq Scan on pctest1
               Storage Filter: (d ~~ 'Value_9'::text)
(6 rows)

SELECT * FROM pctest1 WHERE d LIKE 'Value_9' ORDER BY b DESC;
 k  |  a   |  b  | c  |    d    
----+------+-----+----+---------
 49 | 3339 | 129 | 37 | Value49
 99 | 3326 | 126 | 14 | Value99
 59 | 2537 | 114 | 16 | Value59
 39 | 2715 | 112 | 14 | Value39
 89 | 1281 | 102 | 30 | Value89
 69 |  557 |  82 | 11 | Value69
 29 | 3992 |  64 |  8 | Value29
 79 | 3687 |  57 | 33 | Value79
 19 | 2039 |  37 | 28 | Value19
(9 rows)

-- with grouping
EXPLAIN (costs off)
SELECT b, count(*) FROM pctest1 WHERE d LIKE 'Value99%' GROUP BY b;
                         QUERY PLAN                          
-------------------------------------------------------------
 GroupAggregate
   Group Key: b
   ->  Sort
         Sort Key: b
         ->  Gather
               Workers Planned: 2
               ->  Parallel Seq Scan on pctest1
                     Storage Filter: (d ~~ 'Value99%'::text)
(8 rows)

SELECT b, count(*) FROM pctest1 WHERE d LIKE 'Value99%' GROUP BY b;
  b  | count 
-----+-------
   5 |     1
  23 |     1
  49 |     2
  58 |     1
  86 |     1
  95 |     1
 104 |     1
 108 |     2
 126 |     1
(9 rows)

-- Parallel index scan
EXPLAIN (costs off)
SELECT * FROM pctest1 WHERE k < 10;
                       QUERY PLAN                        
---------------------------------------------------------
 Gather
   Workers Planned: 2
   ->  Parallel Index Scan using pctest1_pkey on pctest1
         Index Cond: (k < 10)
(4 rows)

SELECT * FROM pctest1 WHERE k < 10;
 k |  a   |  b  | c  |   d    
---+------+-----+----+--------
 1 | 2074 |  33 | 10 | Value1
 2 | 1113 | 117 |  1 | Value2
 3 | 3360 |   6 | 27 | Value3
 4 | 2488 |  35 | 43 | Value4
 5 | 2527 |  12 | 25 | Value5
 6 | 3387 |   9 | 44 | Value6
 7 | 1161 |  24 | 39 | Value7
 8 |  753 |  49 |  1 | Value8
 9 | 1371 |  20 | 37 | Value9
(9 rows)

EXPLAIN (costs off)
SELECT * FROM pctest1 WHERE d LIKE 'Value_9' ORDER BY k;
                          QUERY PLAN                           
---------------------------------------------------------------
 Sort
   Sort Key: k
   ->  Gather
         Workers Planned: 2
         ->  Parallel Index Scan using pctest1_pkey on pctest1
               Storage Filter: (d ~~ 'Value_9'::text)
(6 rows)

SELECT * FROM pctest1 WHERE d LIKE 'Value_9' ORDER BY k;
 k  |  a   |  b  | c  |    d    
----+------+-----+----+---------
 19 | 2039 |  37 | 28 | Value19
 29 | 3992 |  64 |  8 | Value29
 39 | 2715 | 112 | 14 | Value39
 49 | 3339 | 129 | 37 | Value49
 59 | 2537 | 114 | 16 | Value59
 69 |  557 |  82 | 11 | Value69
 79 | 3687 |  57 | 33 | Value79
 89 | 1281 | 102 | 30 | Value89
 99 | 3326 | 126 | 14 | Value99
(9 rows)

--secondary index
EXPLAIN (costs off)
SELECT * FROM pctest1 WHERE c = 10;
                        QUERY PLAN                        
----------------------------------------------------------
 Gather
   Workers Planned: 2
   ->  Parallel Index Scan using pctest1_c_idx on pctest1
         Index Cond: (c = 10)
(4 rows)

SELECT * FROM pctest1 WHERE c = 10;
  k   |  a   |  b  | c  |     d     
------+------+-----+----+-----------
    1 | 2074 |  33 | 10 | Value1
   23 | 3960 |  36 | 10 | Value23
   55 |  571 | 119 | 10 | Value55
   94 |  874 | 126 | 10 | Value94
  119 | 1348 |  26 | 10 | Value119
  191 | 3557 | 112 | 10 | Value191
  224 | 2733 |  12 | 10 | Value224
  296 |  347 | 119 | 10 | Value296
  352 | 3383 | 105 | 10 | Value352
  391 |  134 |  23 | 10 | Value391
  393 | 2975 | 124 | 10 | Value393
  403 |  903 |   5 | 10 | Value403
  422 | 1358 |   9 | 10 | Value422
  435 | 2658 |  65 | 10 | Value435
  439 | 2558 | 111 | 10 | Value439
  497 | 1120 |   4 | 10 | Value497
  652 | 3818 | 128 | 10 | Value652
  717 | 3776 |  21 | 10 | Value717
 1047 | 3577 |  16 | 10 | Value1047
 1079 | 1050 |  95 | 10 | Value1079
 1103 | 2255 |   4 | 10 | Value1103
 1127 |  126 |  41 | 10 | Value1127
 1181 | 1570 | 122 | 10 | Value1181
 1214 | 1972 |   6 | 10 | Value1214
 1248 | 3763 | 102 | 10 | Value1248
 1279 | 3826 |  41 | 10 | Value1279
 1318 | 2679 | 132 | 10 | Value1318
 1367 | 1142 |  75 | 10 | Value1367
 1372 | 1864 |  82 | 10 | Value1372
 1400 | 1499 |  66 | 10 | Value1400
 1481 | 2910 |  54 | 10 | Value1481
 1492 | 1467 |  32 | 10 | Value1492
 1508 | 3092 | 120 | 10 | Value1508
 1539 | 2147 |  69 | 10 | Value1539
 1555 | 3719 |  90 | 10 | Value1555
 1569 |  836 | 123 | 10 | Value1569
 1580 |  271 |  60 | 10 | Value1580
 1602 | 2919 |  42 | 10 | Value1602
 1765 | 1313 | 114 | 10 | Value1765
 1879 |  210 |  23 | 10 | Value1879
 1882 | 2289 |   8 | 10 | Value1882
 1931 | 3040 |  87 | 10 | Value1931
 1932 | 3657 |   9 | 10 | Value1932
 1937 | 3995 | 105 | 10 | Value1937
 1973 | 3598 | 113 | 10 | Value1973
 1977 | 1753 |  78 | 10 | Value1977
 1981 | 3894 | 130 | 10 | Value1981
 1995 | 2920 | 104 | 10 | Value1995
 2009 | 1237 |  15 | 10 | Value2009
 2039 | 3115 |  52 | 10 | Value2039
 2050 |  810 |  57 | 10 | Value2050
 2068 | 3056 | 131 | 10 | Value2068
 2109 | 2089 |  81 | 10 | Value2109
 2136 | 2612 | 118 | 10 | Value2136
 2151 |  891 | 125 | 10 | Value2151
 2182 | 2217 |  12 | 10 | Value2182
 2230 | 1455 |  40 | 10 | Value2230
 2241 | 1207 | 126 | 10 | Value2241
 2312 | 3670 |  37 | 10 | Value2312
 2330 | 2076 |  92 | 10 | Value2330
 2361 | 1356 |  42 | 10 | Value2361
 2433 |  907 |  67 | 10 | Value2433
 2577 |  317 | 133 | 10 | Value2577
 2670 | 1974 | 133 | 10 | Value2670
 2804 | 2172 |  54 | 10 | Value2804
 2915 | 1950 |  66 | 10 | Value2915
 2922 |  376 |  74 | 10 | Value2922
 2942 | 2585 |  49 | 10 | Value2942
 2982 | 2118 |  24 | 10 | Value2982
 2994 | 1744 | 130 | 10 | Value2994
 3043 | 1564 |  56 | 10 | Value3043
 3079 | 3886 |  55 | 10 | Value3079
 3100 | 2881 |  48 | 10 | Value3100
 3146 | 1277 |  69 | 10 | Value3146
 3173 |  249 |   7 | 10 | Value3173
 3309 | 3534 | 120 | 10 | Value3309
 3320 | 2782 |  79 | 10 | Value3320
 3331 |  802 | 101 | 10 | Value3331
 3411 | 1827 |  34 | 10 | Value3411
 3449 | 3946 |  82 | 10 | Value3449
 3467 |  112 |   4 | 10 | Value3467
 3507 | 3293 |  67 | 10 | Value3507
 3536 | 2433 |  51 | 10 | Value3536
 3692 | 3789 |  27 | 10 | Value3692
 3706 | 1500 |  52 | 10 | Value3706
 3789 | 1746 |  76 | 10 | Value3789
 3833 |  759 |  77 | 10 | Value3833
 3884 |  568 |   6 | 10 | Value3884
 3995 |  191 |  58 | 10 | Value3995
(89 rows)

--secondary index
EXPLAIN (costs off)
SELECT * FROM pctest1 ORDER BY a LIMIT 10;
                           QUERY PLAN                           
----------------------------------------------------------------
 Limit
   ->  Gather Merge
         Workers Planned: 2
         ->  Parallel Index Scan using pctest1_a_idx on pctest1
(4 rows)

SELECT * FROM pctest1 ORDER BY a LIMIT 10;
  k   | a  |  b  | c  |     d     
------+----+-----+----+-----------
 3999 |  1 | 116 | 27 | Value3999
 1693 |  2 |   2 | 14 | Value1693
 2831 |  3 | 121 | 20 | Value2831
  967 |  4 |  55 | 33 | Value967
 3798 |  5 |   3 | 40 | Value3798
 1112 |  6 | 129 | 28 | Value1112
 1042 |  7 |  36 | 44 | Value1042
 1740 |  8 | 118 | 24 | Value1740
 2740 |  9 |  48 | 34 | Value2740
 2463 | 10 |  98 | 43 | Value2463
(10 rows)

-- with aggregates
EXPLAIN (costs off)
SELECT count(*) FROM pctest1 WHERE k > 123;
                             QUERY PLAN                              
---------------------------------------------------------------------
 Finalize Aggregate
   ->  Gather
         Workers Planned: 2
         ->  Noop Aggregate
               ->  Parallel Index Scan using pctest1_pkey on pctest1
                     Index Cond: (k > 123)
                     Partial Aggregate: true
(7 rows)

SELECT count(*) FROM pctest1 WHERE k > 123;
 count 
-------
  3877
(1 row)

-- index only
EXPLAIN (costs off)
SELECT a FROM pctest1 WHERE a < 10;
                          QUERY PLAN                           
---------------------------------------------------------------
 Gather
   Workers Planned: 2
   ->  Parallel Index Only Scan using pctest1_a_idx on pctest1
         Index Cond: (a < 10)
(4 rows)

SELECT a FROM pctest1 WHERE a < 10;
 a 
---
 1
 2
 3
 4
 5
 6
 7
 8
 9
(9 rows)

-- with grouping
EXPLAIN (costs off)
SELECT c, count(*) FROM pctest1 WHERE c > 40 GROUP BY c;
                                QUERY PLAN                                 
---------------------------------------------------------------------------
 Finalize GroupAggregate
   Group Key: c
   ->  Gather Merge
         Workers Planned: 2
         ->  Partial GroupAggregate
               Group Key: c
               ->  Parallel Index Only Scan using pctest1_c_idx on pctest1
                     Index Cond: (c > 40)
(8 rows)

SELECT c, count(*) FROM pctest1 WHERE c > 40 GROUP BY c;
 c  | count 
----+-------
 41 |    84
 42 |    93
 43 |    75
 44 |    83
 45 |    87
 46 |    87
 47 |    67
 48 |    72
 49 |    40
(9 rows)

-- Joins
-- Nest loop
/*+
  Set(enable_mergejoin off) Set(enable_hashjoin off)
  Set(yb_bnl_batch_size 1) Set(enable_material off)
*/
EXPLAIN (costs off)
SELECT pctest1.* FROM pctest1, pctest2
  WHERE pctest1.a = pctest2.b and pctest1.a % 10 = 0;
                      QUERY PLAN                      
------------------------------------------------------
 Nested Loop
   ->  Gather
         Workers Planned: 2
         ->  Parallel Seq Scan on pctest1
               Storage Filter: ((a % 10) = 0)
   ->  Index Only Scan using pctest2_b_idx on pctest2
         Index Cond: (b = pctest1.a)
(7 rows)

/*+
  Set(enable_mergejoin off) Set(enable_hashjoin off)
  Set(yb_bnl_batch_size 1) Set(enable_material off)
*/
SELECT pctest1.* FROM pctest1, pctest2
  WHERE pctest1.a = pctest2.b and pctest1.a % 10 = 0;
  k   |  a  |  b  | c  |     d     
------+-----+-----+----+-----------
  524 | 170 | 123 | 31 | Value524
  524 | 170 | 123 | 31 | Value524
  524 | 170 | 123 | 31 | Value524
  524 | 170 | 123 | 31 | Value524
  524 | 170 | 123 | 31 | Value524
  922 | 120 |  76 | 29 | Value922
  922 | 120 |  76 | 29 | Value922
  922 | 120 |  76 | 29 | Value922
  922 | 120 |  76 | 29 | Value922
  922 | 120 |  76 | 29 | Value922
  922 | 120 |  76 | 29 | Value922
 1014 | 160 |  42 | 40 | Value1014
 1014 | 160 |  42 | 40 | Value1014
 1014 | 160 |  42 | 40 | Value1014
 1014 | 160 |  42 | 40 | Value1014
 1030 |  70 |  87 |  5 | Value1030
 1030 |  70 |  87 |  5 | Value1030
 1030 |  70 |  87 |  5 | Value1030
 2463 |  10 |  98 | 43 | Value2463
 2530 | 140 | 112 | 12 | Value2530
 2530 | 140 | 112 | 12 | Value2530
 2530 | 140 | 112 | 12 | Value2530
 2530 | 140 | 112 | 12 | Value2530
 2530 | 140 | 112 | 12 | Value2530
 2530 | 140 | 112 | 12 | Value2530
 2536 | 180 |  69 | 24 | Value2536
 2536 | 180 |  69 | 24 | Value2536
 2536 | 180 |  69 | 24 | Value2536
 2536 | 180 |  69 | 24 | Value2536
 2606 | 150 | 101 | 44 | Value2606
 2606 | 150 | 101 | 44 | Value2606
 2606 | 150 | 101 | 44 | Value2606
 2607 | 190 |  70 | 40 | Value2607
 2607 | 190 |  70 | 40 | Value2607
 2607 | 190 |  70 | 40 | Value2607
 2607 | 190 |  70 | 40 | Value2607
 2693 |  50 | 112 | 16 | Value2693
 2693 |  50 | 112 | 16 | Value2693
 2693 |  50 | 112 | 16 | Value2693
 2693 |  50 | 112 | 16 | Value2693
 2818 |  60 |  27 | 45 | Value2818
 2818 |  60 |  27 | 45 | Value2818
 2818 |  60 |  27 | 45 | Value2818
 2818 |  60 |  27 | 45 | Value2818
 2917 |  90 | 101 | 31 | Value2917
 2917 |  90 | 101 | 31 | Value2917
 2917 |  90 | 101 | 31 | Value2917
 2917 |  90 | 101 | 31 | Value2917
 2917 |  90 | 101 | 31 | Value2917
 2917 |  90 | 101 | 31 | Value2917
 2917 |  90 | 101 | 31 | Value2917
 2917 |  90 | 101 | 31 | Value2917
 3038 |  20 |   7 |  3 | Value3038
 3038 |  20 |   7 |  3 | Value3038
 3038 |  20 |   7 |  3 | Value3038
 3038 |  20 |   7 |  3 | Value3038
 3157 |  40 |  36 |  5 | Value3157
 3157 |  40 |  36 |  5 | Value3157
 3157 |  40 |  36 |  5 | Value3157
 3157 |  40 |  36 |  5 | Value3157
 3157 |  40 |  36 |  5 | Value3157
 3157 |  40 |  36 |  5 | Value3157
 3196 |  80 |  99 | 12 | Value3196
 3196 |  80 |  99 | 12 | Value3196
 3196 |  80 |  99 | 12 | Value3196
 3196 |  80 |  99 | 12 | Value3196
 3196 |  80 |  99 | 12 | Value3196
 3259 |  30 |  65 | 49 | Value3259
 3259 |  30 |  65 | 49 | Value3259
 3259 |  30 |  65 | 49 | Value3259
 3259 |  30 |  65 | 49 | Value3259
 3259 |  30 |  65 | 49 | Value3259
 3259 |  30 |  65 | 49 | Value3259
 3294 | 100 |  18 | 42 | Value3294
 3294 | 100 |  18 | 42 | Value3294
 3294 | 100 |  18 | 42 | Value3294
 3352 | 130 | 111 | 43 | Value3352
 3352 | 130 | 111 | 43 | Value3352
 3352 | 130 | 111 | 43 | Value3352
 3352 | 130 | 111 | 43 | Value3352
 3352 | 130 | 111 | 43 | Value3352
 3713 | 110 | 110 | 23 | Value3713
 3713 | 110 | 110 | 23 | Value3713
 3713 | 110 | 110 | 23 | Value3713
 3713 | 110 | 110 | 23 | Value3713
 3944 | 200 |  49 | 12 | Value3944
 3944 | 200 |  49 | 12 | Value3944
 3944 | 200 |  49 | 12 | Value3944
(88 rows)

EXPLAIN (costs off)
/*+YbBatchedNL(pctest1 pctest2)*/
SELECT pctest1.*, pctest2.k FROM pctest1, pctest2
  WHERE pctest1.c = 42 AND pctest1.k = pctest2.k ORDER BY pctest1.k;
                                    QUERY PLAN                                    
----------------------------------------------------------------------------------
 Gather Merge
   Workers Planned: 2
   ->  Sort
         Sort Key: pctest1.k
         ->  YB Batched Nested Loop Join
               Join Filter: (pctest1.k = pctest2.k)
               ->  Parallel Index Scan using pctest1_c_idx on pctest1
                     Index Cond: (c = 42)
               ->  Index Scan using pctest2_pkey on pctest2
                     Index Cond: (k = ANY (ARRAY[pctest1.k, $1, $2, ..., $1023]))
(10 rows)

/*+YbBatchedNL(pctest1 pctest2)*/
SELECT pctest1.*, pctest2.k FROM pctest1, pctest2
  WHERE pctest1.c = 42 AND pctest1.k = pctest2.k ORDER BY pctest1.k;
  k  |  a   |  b  | c  |    d     |  k  
-----+------+-----+----+----------+-----
  57 | 3634 |  21 | 42 | Value57  |  57
 154 |   17 |  76 | 42 | Value154 | 154
 248 | 2599 |   3 | 42 | Value248 | 248
 257 | 1364 |  58 | 42 | Value257 | 257
 311 | 2831 |  24 | 42 | Value311 | 311
 343 |  968 |  41 | 42 | Value343 | 343
 475 | 3086 |  97 | 42 | Value475 | 475
 637 | 3913 |  73 | 42 | Value637 | 637
 715 | 3132 |  18 | 42 | Value715 | 715
 807 | 2090 |  30 | 42 | Value807 | 807
 814 |  575 |  68 | 42 | Value814 | 814
 818 | 3163 | 104 | 42 | Value818 | 818
 839 | 3887 |   6 | 42 | Value839 | 839
 853 |  175 |  91 | 42 | Value853 | 853
 941 | 1987 |  67 | 42 | Value941 | 941
 947 | 3675 |  27 | 42 | Value947 | 947
 951 |  739 |  22 | 42 | Value951 | 951
 965 |  597 |  78 | 42 | Value965 | 965
 970 | 3014 |  64 | 42 | Value970 | 970
 974 | 1589 | 127 | 42 | Value974 | 974
(20 rows)

-- Hash join
set enable_mergejoin to false;
EXPLAIN (costs off)
SELECT pctest1.k, pctest2.k FROM pctest1 JOIN pctest2 USING (a, c)
  ORDER BY pctest1.k, pctest2.k;
                                   QUERY PLAN                                   
--------------------------------------------------------------------------------
 Gather Merge
   Workers Planned: 2
   ->  Sort
         Sort Key: pctest1.k, pctest2.k
         ->  Hash Join
               Hash Cond: ((pctest2.a = pctest1.a) AND (pctest2.c = pctest1.c))
               ->  Parallel Seq Scan on pctest2
               ->  Hash
                     ->  Index Scan using pctest1_pkey on pctest1
(9 rows)

SELECT pctest1.k, pctest2.k FROM pctest1 JOIN pctest2 USING (a, c)
  ORDER BY pctest1.k, pctest2.k;
  k   |  k  
------+-----
   32 | 577
   64 | 376
  314 | 368
  343 | 448
  353 | 609
  464 | 310
  470 | 549
 1157 | 394
 1170 | 765
 1308 | 725
 1796 | 640
 2135 | 324
 2176 |  60
 2702 | 854
 2737 | 208
 2854 | 291
 2869 | 707
 3192 | 242
 3584 | 440
 3954 |  56
(20 rows)

reset enable_mergejoin;
-- Merge join
set enable_hashjoin to false;
set yb_bnl_batch_size = 1;
EXPLAIN (costs off)
SELECT pctest1.*, pctest2.k FROM pctest1, pctest2
  WHERE pctest1.c = 42 AND pctest1.k = pctest2.k ORDER BY pctest1.k;
                              QUERY PLAN                              
----------------------------------------------------------------------
 Gather Merge
   Workers Planned: 2
   ->  Merge Join
         Merge Cond: (pctest1.k = pctest2.k)
         ->  Sort
               Sort Key: pctest1.k
               ->  Parallel Index Scan using pctest1_c_idx on pctest1
                     Index Cond: (c = 42)
         ->  Index Scan using pctest2_pkey on pctest2
(9 rows)

SELECT pctest1.*, pctest2.k FROM pctest1, pctest2
  WHERE pctest1.c = 42 AND pctest1.k = pctest2.k ORDER BY pctest1.k;
  k  |  a   |  b  | c  |    d     |  k  
-----+------+-----+----+----------+-----
  57 | 3634 |  21 | 42 | Value57  |  57
 154 |   17 |  76 | 42 | Value154 | 154
 248 | 2599 |   3 | 42 | Value248 | 248
 257 | 1364 |  58 | 42 | Value257 | 257
 311 | 2831 |  24 | 42 | Value311 | 311
 343 |  968 |  41 | 42 | Value343 | 343
 475 | 3086 |  97 | 42 | Value475 | 475
 637 | 3913 |  73 | 42 | Value637 | 637
 715 | 3132 |  18 | 42 | Value715 | 715
 807 | 2090 |  30 | 42 | Value807 | 807
 814 |  575 |  68 | 42 | Value814 | 814
 818 | 3163 | 104 | 42 | Value818 | 818
 839 | 3887 |   6 | 42 | Value839 | 839
 853 |  175 |  91 | 42 | Value853 | 853
 941 | 1987 |  67 | 42 | Value941 | 941
 947 | 3675 |  27 | 42 | Value947 | 947
 951 |  739 |  22 | 42 | Value951 | 951
 965 |  597 |  78 | 42 | Value965 | 965
 970 | 3014 |  64 | 42 | Value970 | 970
 974 | 1589 | 127 | 42 | Value974 | 974
(20 rows)

reset enable_hashjoin;
reset yb_bnl_batch_size;
-- Subquery
EXPLAIN (costs off)
SELECT x, d FROM
  (SELECT pctest1.* FROM pctest1, pctest2
     WHERE pctest1.k = pctest2.k AND pctest1.c = pctest2.c) ss RIGHT JOIN
  (values (15),(16),(17)) v(x) on ss.b = v.x ORDER BY x;
                                      QUERY PLAN                                      
--------------------------------------------------------------------------------------
 Sort
   Sort Key: "*VALUES*".column1
   ->  Hash Right Join
         Hash Cond: (pctest1.b = "*VALUES*".column1)
         ->  Gather
               Workers Planned: 2
               ->  Parallel Hash Join
                     Hash Cond: ((pctest1.k = pctest2.k) AND (pctest1.c = pctest2.c))
                     ->  Parallel Index Scan using pctest1_pkey on pctest1
                     ->  Parallel Hash
                           ->  Parallel Index Scan using pctest2_pkey on pctest2
         ->  Hash
               ->  Values Scan on "*VALUES*"
(13 rows)

SELECT x, d FROM
  (SELECT pctest1.* FROM pctest1, pctest2
     WHERE pctest1.k = pctest2.k AND pctest1.c = pctest2.c) ss RIGHT JOIN
  (values (15),(16),(17)) v(x) on ss.b = v.x ORDER BY x;
 x  | d 
----+---
 15 | 
 16 | 
 17 | 
(3 rows)

EXPLAIN (costs off)
SELECT * FROM
  (SELECT pctest1.* FROM pctest1, pctest2
     WHERE pctest1.k = pctest2.k AND pctest1.c = pctest2.c) s1 JOIN
  (SELECT pctest4.* FROM pctest1 pctest3, pctest2 pctest4
     WHERE pctest3.k = pctest4.k AND pctest3.b = pctest4.b) s2 ON s1.b = s2.c;
                                    QUERY PLAN                                     
-----------------------------------------------------------------------------------
 Gather
   Workers Planned: 2
   ->  Parallel Hash Join
         Hash Cond: (pctest1.b = pctest4.c)
         ->  Merge Join
               Merge Cond: (pctest1.k = pctest2.k)
               Join Filter: (pctest1.c = pctest2.c)
               ->  Parallel Index Scan using pctest1_pkey on pctest1
               ->  Materialize
                     ->  Index Scan using pctest2_pkey on pctest2
         ->  Parallel Hash
               ->  Merge Join
                     Merge Cond: (pctest3.k = pctest4.k)
                     Join Filter: (pctest3.b = pctest4.b)
                     ->  Parallel Index Scan using pctest1_pkey on pctest1 pctest3
                     ->  Materialize
                           ->  Index Scan using pctest2_pkey on pctest2 pctest4
(17 rows)

SELECT * FROM
  (SELECT pctest1.* FROM pctest1, pctest2
     WHERE pctest1.k = pctest2.k AND pctest1.c = pctest2.c) s1 JOIN
  (SELECT pctest4.* FROM pctest1 pctest3, pctest2 pctest4
     WHERE pctest3.k = pctest4.k AND pctest3.b = pctest4.b) s2 ON s1.b = s2.c;
 k | a | b | c | d | k | a | b | c | d 
---+---+---+---+---+---+---+---+---+---
(0 rows)

-- no parallelism
EXPLAIN (costs off)
SELECT * from pctest2
  WHERE b < (SELECT avg(b) / 20 FROM pctest1 WHERE c = pctest2.c);
                       QUERY PLAN                        
---------------------------------------------------------
 Seq Scan on pctest2
   Filter: ((b)::numeric < (SubPlan 1))
   SubPlan 1
     ->  Finalize Aggregate
           ->  Index Scan using pctest1_c_idx on pctest1
                 Index Cond: (c = pctest2.c)
                 Partial Aggregate: true
(7 rows)

SELECT * from pctest2
  WHERE b < (SELECT avg(b) / 20 FROM pctest1 WHERE c = pctest2.c);
  k  |  a  | b | c  |        d        
-----+-----+---+----+-----------------
 140 | 622 | 2 | 26 | Other value 140
 145 | 118 | 3 | 29 | Other value 145
 170 | 731 | 3 | 18 | Other value 170
 280 | 582 | 2 | 35 | Other value 280
 302 |  45 | 1 | 20 | Other value 302
 339 | 456 | 3 | 45 | Other value 339
 346 | 478 | 2 | 45 | Other value 346
 367 | 680 | 3 | 22 | Other value 367
 390 | 279 | 1 | 22 | Other value 390
 625 | 833 | 2 |  5 | Other value 625
 636 | 597 | 2 | 19 | Other value 636
 833 |  44 | 2 |  9 | Other value 833
 858 | 693 | 2 | 40 | Other value 858
 906 | 151 | 2 |  8 | Other value 906
 912 |  65 | 0 | 44 | Other value 912
 983 | 377 | 2 |  8 | Other value 983
(16 rows)

-- passing parameters to workers
EXPLAIN (costs off)
SELECT * from pctest2
  WHERE c IN (SELECT b FROM pctest1 WHERE d LIKE 'Value_9')
    AND b < (SELECT avg(b) FROM pctest1 WHERE d LIKE 'Value_9');
                          QUERY PLAN                          
--------------------------------------------------------------
 Gather
   Workers Planned: 2
   Params Evaluated: $1
   InitPlan 1 (returns $1)
     ->  Aggregate
           ->  Gather
                 Workers Planned: 2
                 ->  Parallel Seq Scan on pctest1
                       Storage Filter: (d ~~ 'Value_9'::text)
   ->  Parallel Hash Semi Join
         Hash Cond: (pctest2.c = pctest1_1.b)
         ->  Parallel Seq Scan on pctest2
               Storage Filter: ((b)::numeric < $1)
         ->  Parallel Hash
               ->  Parallel Seq Scan on pctest1 pctest1_1
                     Storage Filter: (d ~~ 'Value_9'::text)
(16 rows)

SELECT * from pctest2
  WHERE c IN (SELECT b FROM pctest1 WHERE d LIKE 'Value_9')
    AND b < (SELECT avg(b) FROM pctest1 WHERE d LIKE 'Value_9');
  k  |  a  | b  | c  |        d        
-----+-----+----+----+-----------------
 295 | 399 | 24 | 37 | Other value 295
 392 | 934 | 55 | 37 | Other value 392
 562 |  29 | 75 | 37 | Other value 562
 649 | 793 | 33 | 37 | Other value 649
 805 | 661 |  4 | 37 | Other value 805
(5 rows)

-- test rescan cases
set enable_material = false;
EXPLAIN (costs off)
select * from
  (SELECT count(*) FROM pctest1 WHERE b > 10) ss
  right join (values (1),(2),(3)) v(x) on true;
                      QUERY PLAN                      
------------------------------------------------------
 Nested Loop Left Join
   ->  Values Scan on "*VALUES*"
   ->  Finalize Aggregate
         ->  Gather
               Workers Planned: 2
               ->  Noop Aggregate
                     ->  Parallel Seq Scan on pctest1
                           Storage Filter: (b > 10)
                           Partial Aggregate: true
(9 rows)

select * from
  (SELECT count(*) FROM pctest1 WHERE b > 10) ss
  right join (values (1),(2),(3)) v(x) on true;
 count | x 
-------+---
  3696 | 1
  3696 | 2
  3696 | 3
(3 rows)

EXPLAIN (costs off)
select * from
  (SELECT count(*) FROM pctest1 WHERE c > 10) ss
  right join (values (1),(2),(3)) v(x) on true;
                                   QUERY PLAN                                    
---------------------------------------------------------------------------------
 Nested Loop Left Join
   ->  Values Scan on "*VALUES*"
   ->  Finalize Aggregate
         ->  Gather
               Workers Planned: 2
               ->  Noop Aggregate
                     ->  Parallel Index Only Scan using pctest1_c_idx on pctest1
                           Index Cond: (c > 10)
                           Partial Aggregate: true
(9 rows)

select * from
  (SELECT count(*) FROM pctest1 WHERE c > 10) ss
  right join (values (1),(2),(3)) v(x) on true;
 count | x 
-------+---
  3146 | 1
  3146 | 2
  3146 | 3
(3 rows)

reset enable_material;
-- Modify table (no parallelism)
EXPLAIN (costs off)
UPDATE pctest1 SET b = 0 WHERE d LIKE 'Value_9';
                   QUERY PLAN                   
------------------------------------------------
 Update on pctest1
   ->  Seq Scan on pctest1
         Storage Filter: (d ~~ 'Value_9'::text)
(3 rows)

UPDATE pctest1 SET b = 0 WHERE d LIKE 'Value_9';
SELECT count(*) FROM pctest1 WHERE b = 0;
 count 
-------
    21
(1 row)

EXPLAIN (costs off)
DELETE FROM pctest1 WHERE d LIKE 'Value_8';
                   QUERY PLAN                   
------------------------------------------------
 Delete on pctest1
   ->  Seq Scan on pctest1
         Storage Filter: (d ~~ 'Value_8'::text)
(3 rows)

DELETE FROM pctest1 WHERE d LIKE 'Value_8';
SELECT count(*) FROM pctest1;
 count 
-------
  3991
(1 row)

-- index scan with aggregates pushdown such that #atts being pushed down > #atts in relation
CREATE TABLE pctest3(k int primary key, a int unique) WITH (colocation = true);
INSERT INTO pctest3 SELECT i, i FROM generate_series(1, 1000) i;
ANALYZE pctest3;
EXPLAIN (costs off) SELECT count(*), max(k), min(k) FROM pctest3 WHERE k > 123;
                             QUERY PLAN                              
---------------------------------------------------------------------
 Finalize Aggregate
   ->  Gather
         Workers Planned: 2
         ->  Noop Aggregate
               ->  Parallel Index Scan using pctest3_pkey on pctest3
                     Index Cond: (k > 123)
                     Partial Aggregate: true
(7 rows)

SELECT count(*), max(k), min(k) FROM pctest3 WHERE k > 123;
 count | max  | min 
-------+------+-----
   877 | 1000 | 124
(1 row)

---
--- hash sharded tables
---
set yb_enable_parallel_scan_hash_sharded = on;
CREATE TABLE pctest_h1(k int, a int, b int, c int, d text, primary key(k hash))
    WITH (colocation = false);
CREATE TABLE pctest_h2(k int, a int, b int, c int, d text, primary key(k hash))
    WITH (colocation = false);
CREATE UNIQUE INDEX ON pctest_h1(a hash);
CREATE INDEX ON pctest_h1(c hash) split into 3 tablets;
CREATE INDEX ON pctest_h2(b hash) split into 3 tablets;
INSERT INTO pctest_h1
    SELECT i, 400 - i, i/3, i%50, 'Value' || i::text FROM generate_series(1, 400) i;
INSERT INTO pctest_h2
    SELECT i, 100 + i, i/5, i%10, 'Other value ' || i::text FROM generate_series(1, 100) i;
ANALYZE pctest_h1;
ANALYZE pctest_h2;
-- Parallel sequential scan
EXPLAIN (costs off)
SELECT * FROM pctest_h1 WHERE d LIKE 'Value_9';
                   QUERY PLAN                   
------------------------------------------------
 Gather
   Workers Planned: 2
   ->  Parallel Seq Scan on pctest_h1
         Storage Filter: (d ~~ 'Value_9'::text)
(4 rows)

SELECT * FROM pctest_h1 WHERE d LIKE 'Value_9';
 k  |  a  | b  | c  |    d    
----+-----+----+----+---------
 49 | 351 | 16 | 49 | Value49
 29 | 371 |  9 | 29 | Value29
 89 | 311 | 29 | 39 | Value89
 59 | 341 | 19 |  9 | Value59
 19 | 381 |  6 | 19 | Value19
 69 | 331 | 23 | 19 | Value69
 99 | 301 | 33 | 49 | Value99
 79 | 321 | 26 | 29 | Value79
 39 | 361 | 13 | 39 | Value39
(9 rows)

-- with aggregates
EXPLAIN (costs off)
SELECT count(*) FROM pctest_h1 WHERE d LIKE 'Value_9';
                         QUERY PLAN                         
------------------------------------------------------------
 Finalize Aggregate
   ->  Gather
         Workers Planned: 2
         ->  Noop Aggregate
               ->  Parallel Seq Scan on pctest_h1
                     Storage Filter: (d ~~ 'Value_9'::text)
                     Partial Aggregate: true
(7 rows)

SELECT count(*) FROM pctest_h1 WHERE d LIKE 'Value_9';
 count 
-------
     9
(1 row)

-- with sort
EXPLAIN (costs off)
SELECT * FROM pctest_h1 WHERE d LIKE 'Value_9' ORDER BY b DESC;
                      QUERY PLAN                      
------------------------------------------------------
 Gather Merge
   Workers Planned: 2
   ->  Sort
         Sort Key: b DESC
         ->  Parallel Seq Scan on pctest_h1
               Storage Filter: (d ~~ 'Value_9'::text)
(6 rows)

SELECT * FROM pctest_h1 WHERE d LIKE 'Value_9' ORDER BY b DESC;
 k  |  a  | b  | c  |    d    
----+-----+----+----+---------
 99 | 301 | 33 | 49 | Value99
 89 | 311 | 29 | 39 | Value89
 79 | 321 | 26 | 29 | Value79
 69 | 331 | 23 | 19 | Value69
 59 | 341 | 19 |  9 | Value59
 49 | 351 | 16 | 49 | Value49
 39 | 361 | 13 | 39 | Value39
 29 | 371 |  9 | 29 | Value29
 19 | 381 |  6 | 19 | Value19
(9 rows)

-- with grouping
EXPLAIN (costs off)
SELECT b, count(*) FROM pctest_h1 WHERE d LIKE 'Value9%' GROUP BY b;
                            QUERY PLAN                            
------------------------------------------------------------------
 Finalize GroupAggregate
   Group Key: b
   ->  Gather Merge
         Workers Planned: 2
         ->  Partial GroupAggregate
               Group Key: b
               ->  Sort
                     Sort Key: b
                     ->  Parallel Seq Scan on pctest_h1
                           Storage Filter: (d ~~ 'Value9%'::text)
(10 rows)

SELECT b, count(*) FROM pctest_h1 WHERE d LIKE 'Value9%' GROUP BY b;
 b  | count 
----+-------
  3 |     1
 30 |     3
 31 |     3
 32 |     3
 33 |     1
(5 rows)

-- Parallel index scan
--secondary index
EXPLAIN (costs off)
SELECT * FROM pctest_h1 WHERE c = 10;
                          QUERY PLAN                          
--------------------------------------------------------------
 Gather
   Workers Planned: 2
   ->  Parallel Index Scan using pctest_h1_c_idx on pctest_h1
         Index Cond: (c = 10)
(4 rows)

SELECT * FROM pctest_h1 WHERE c = 10;
  k  |  a  |  b  | c  |    d     
-----+-----+-----+----+----------
 210 | 190 |  70 | 10 | Value210
 110 | 290 |  36 | 10 | Value110
 360 |  40 | 120 | 10 | Value360
 160 | 240 |  53 | 10 | Value160
  60 | 340 |  20 | 10 | Value60
  10 | 390 |   3 | 10 | Value10
 310 |  90 | 103 | 10 | Value310
 260 | 140 |  86 | 10 | Value260
(8 rows)

-- with aggregates
EXPLAIN (costs off)
SELECT count(*) FROM pctest_h1 WHERE k > 123;
                    QUERY PLAN                    
--------------------------------------------------
 Finalize Aggregate
   ->  Gather
         Workers Planned: 2
         ->  Noop Aggregate
               ->  Parallel Seq Scan on pctest_h1
                     Storage Filter: (k > 123)
                     Partial Aggregate: true
(7 rows)

SELECT count(*) FROM pctest_h1 WHERE k > 123;
 count 
-------
   277
(1 row)

-- index only
/*+ IndexOnlyScan(pctest_h1) */
EXPLAIN (costs off)
SELECT a FROM pctest_h1 WHERE a < 10;
                            QUERY PLAN                             
-------------------------------------------------------------------
 Gather
   Workers Planned: 2
   ->  Parallel Index Only Scan using pctest_h1_a_idx on pctest_h1
         Storage Filter: (a < 10)
(4 rows)

/*+ IndexOnlyScan(pctest_h1) */
SELECT a FROM pctest_h1 WHERE a < 10;
 a 
---
 5
 1
 6
 7
 9
 4
 0
 2
 8
 3
(10 rows)

-- with grouping
EXPLAIN (costs off)
SELECT c, count(*) FROM pctest_h1 WHERE c > 40 GROUP BY c;
                       QUERY PLAN                       
--------------------------------------------------------
 Finalize GroupAggregate
   Group Key: c
   ->  Gather Merge
         Workers Planned: 2
         ->  Partial GroupAggregate
               Group Key: c
               ->  Sort
                     Sort Key: c
                     ->  Parallel Seq Scan on pctest_h1
                           Storage Filter: (c > 40)
(10 rows)

SELECT c, count(*) FROM pctest_h1 WHERE c > 40 GROUP BY c;
 c  | count 
----+-------
 41 |     8
 42 |     8
 43 |     8
 44 |     8
 45 |     8
 46 |     8
 47 |     8
 48 |     8
 49 |     8
(9 rows)

-- Subquery
EXPLAIN (costs off)
SELECT * FROM
  (SELECT pctest_h1.* FROM pctest_h1, pctest_h2
     WHERE pctest_h1.k = pctest_h2.k AND pctest_h1.c = pctest_h2.c) s1 JOIN
  (SELECT pctest_h4.* FROM pctest_h1 pctest_h3, pctest_h2 pctest_h4
     WHERE pctest_h3.k = pctest_h4.k AND pctest_h3.b = pctest_h4.b) s2 ON s1.b = s2.c
ORDER BY s1.k;
                                          QUERY PLAN                                          
----------------------------------------------------------------------------------------------
 Nested Loop
   Join Filter: (pctest_h1.b = pctest_h4.c)
   ->  Gather Merge
         Workers Planned: 2
         ->  Sort
               Sort Key: pctest_h1.k
               ->  Hash Join
                     Hash Cond: ((pctest_h2.k = pctest_h1.k) AND (pctest_h2.c = pctest_h1.c))
                     ->  Parallel Seq Scan on pctest_h2
                     ->  Hash
                           ->  Seq Scan on pctest_h1
   ->  Materialize
         ->  Gather
               Workers Planned: 2
               ->  Parallel Hash Join
                     Hash Cond: ((pctest_h3.k = pctest_h4.k) AND (pctest_h3.b = pctest_h4.b))
                     ->  Parallel Seq Scan on pctest_h1 pctest_h3
                     ->  Parallel Hash
                           ->  Parallel Seq Scan on pctest_h2 pctest_h4
(19 rows)

SELECT * FROM
  (SELECT pctest_h1.* FROM pctest_h1, pctest_h2
     WHERE pctest_h1.k = pctest_h2.k AND pctest_h1.c = pctest_h2.c) s1 JOIN
  (SELECT pctest_h4.* FROM pctest_h1 pctest_h3, pctest_h2 pctest_h4
     WHERE pctest_h3.k = pctest_h4.k AND pctest_h3.b = pctest_h4.b) s2 ON s1.b = s2.c
ORDER BY s1.k;
 k |  a  | b | c |   d    | k |  a  | b | c |       d       
---+-----+---+---+--------+---+-----+---+---+---------------
 3 | 397 | 1 | 3 | Value3 | 1 | 101 | 0 | 1 | Other value 1
 4 | 396 | 1 | 4 | Value4 | 1 | 101 | 0 | 1 | Other value 1
 5 | 395 | 1 | 5 | Value5 | 1 | 101 | 0 | 1 | Other value 1
 6 | 394 | 2 | 6 | Value6 | 2 | 102 | 0 | 2 | Other value 2
 7 | 393 | 2 | 7 | Value7 | 2 | 102 | 0 | 2 | Other value 2
 8 | 392 | 2 | 8 | Value8 | 2 | 102 | 0 | 2 | Other value 2
(6 rows)

-- no parallelism
EXPLAIN (costs off)
SELECT * from pctest_h2
  WHERE b < (SELECT avg(b) / 20 FROM pctest_h1 WHERE c = pctest_h2.c);
                    QUERY PLAN                     
---------------------------------------------------
 Seq Scan on pctest_h2
   Filter: ((b)::numeric < (SubPlan 1))
   SubPlan 1
     ->  Finalize Aggregate
           ->  Seq Scan on pctest_h1
                 Storage Filter: (c = pctest_h2.c)
                 Partial Aggregate: true
(7 rows)

SELECT * from pctest_h2
  WHERE b < (SELECT avg(b) / 20 FROM pctest_h1 WHERE c = pctest_h2.c);
 k  |  a  | b | c |       d        
----+-----+---+---+----------------
  5 | 105 | 1 | 5 | Other value 5
  1 | 101 | 0 | 1 | Other value 1
 11 | 111 | 2 | 1 | Other value 11
 13 | 113 | 2 | 3 | Other value 13
 12 | 112 | 2 | 2 | Other value 12
  6 | 106 | 1 | 6 | Other value 6
  7 | 107 | 1 | 7 | Other value 7
  9 | 109 | 1 | 9 | Other value 9
 17 | 117 | 3 | 7 | Other value 17
 10 | 110 | 2 | 0 | Other value 10
 19 | 119 | 3 | 9 | Other value 19
  4 | 104 | 0 | 4 | Other value 4
 18 | 118 | 3 | 8 | Other value 18
  2 | 102 | 0 | 2 | Other value 2
  8 | 108 | 1 | 8 | Other value 8
 14 | 114 | 2 | 4 | Other value 14
  3 | 103 | 0 | 3 | Other value 3
(17 rows)

-- passing parameters to workers
EXPLAIN (costs off)
SELECT * from pctest_h2
  WHERE c IN (SELECT b FROM pctest_h1 WHERE d LIKE 'Value_9')
    AND b < (SELECT avg(b) FROM pctest_h1 WHERE d LIKE 'Value_9');
                             QUERY PLAN                             
--------------------------------------------------------------------
 Gather
   Workers Planned: 2
   Params Evaluated: $1
   InitPlan 1 (returns $1)
     ->  Finalize Aggregate
           ->  Gather
                 Workers Planned: 2
                 ->  Noop Aggregate
                       ->  Parallel Seq Scan on pctest_h1
                             Storage Filter: (d ~~ 'Value_9'::text)
                             Partial Aggregate: true
   ->  Parallel Hash Semi Join
         Hash Cond: (pctest_h2.c = pctest_h1_1.b)
         ->  Parallel Seq Scan on pctest_h2
               Storage Filter: ((b)::numeric < $1)
         ->  Parallel Hash
               ->  Parallel Seq Scan on pctest_h1 pctest_h1_1
                     Storage Filter: (d ~~ 'Value_9'::text)
(18 rows)

SELECT * from pctest_h2
  WHERE c IN (SELECT b FROM pctest_h1 WHERE d LIKE 'Value_9')
    AND b < (SELECT avg(b) FROM pctest_h1 WHERE d LIKE 'Value_9');
 k  |  a  | b  | c |       d        
----+-----+----+---+----------------
 49 | 149 |  9 | 9 | Other value 49
 29 | 129 |  5 | 9 | Other value 29
 89 | 189 | 17 | 9 | Other value 89
 86 | 186 | 17 | 6 | Other value 86
 16 | 116 |  3 | 6 | Other value 16
 59 | 159 | 11 | 9 | Other value 59
  6 | 106 |  1 | 6 | Other value 6
 96 | 196 | 19 | 6 | Other value 96
  9 | 109 |  1 | 9 | Other value 9
 19 | 119 |  3 | 9 | Other value 19
 36 | 136 |  7 | 6 | Other value 36
 69 | 169 | 13 | 9 | Other value 69
 66 | 166 | 13 | 6 | Other value 66
 99 | 199 | 19 | 9 | Other value 99
 79 | 179 | 15 | 9 | Other value 79
 46 | 146 |  9 | 6 | Other value 46
 56 | 156 | 11 | 6 | Other value 56
 26 | 126 |  5 | 6 | Other value 26
 39 | 139 |  7 | 9 | Other value 39
 76 | 176 | 15 | 6 | Other value 76
(20 rows)

-- test rescan cases
set enable_material = false;
EXPLAIN (costs off)
select * from
  (SELECT count(*) FROM pctest_h1 WHERE b > 10) ss
  right join (values (1),(2),(3)) v(x) on true;
                       QUERY PLAN                       
--------------------------------------------------------
 Nested Loop Left Join
   ->  Values Scan on "*VALUES*"
   ->  Finalize Aggregate
         ->  Gather
               Workers Planned: 2
               ->  Noop Aggregate
                     ->  Parallel Seq Scan on pctest_h1
                           Storage Filter: (b > 10)
                           Partial Aggregate: true
(9 rows)

select * from
  (SELECT count(*) FROM pctest_h1 WHERE b > 10) ss
  right join (values (1),(2),(3)) v(x) on true;
 count | x 
-------+---
   368 | 1
   368 | 2
   368 | 3
(3 rows)

EXPLAIN (costs off)
select * from
  (SELECT count(*) FROM pctest_h1 WHERE c > 10) ss
  right join (values (1),(2),(3)) v(x) on true;
                       QUERY PLAN                       
--------------------------------------------------------
 Nested Loop Left Join
   ->  Values Scan on "*VALUES*"
   ->  Finalize Aggregate
         ->  Gather
               Workers Planned: 2
               ->  Noop Aggregate
                     ->  Parallel Seq Scan on pctest_h1
                           Storage Filter: (c > 10)
                           Partial Aggregate: true
(9 rows)

select * from
  (SELECT count(*) FROM pctest_h1 WHERE c > 10) ss
  right join (values (1),(2),(3)) v(x) on true;
 count | x 
-------+---
   312 | 1
   312 | 2
   312 | 3
(3 rows)

reset enable_material;
-- Modify table (no parallelism)
EXPLAIN (costs off)
UPDATE pctest_h1 SET b = 0 WHERE d LIKE 'Value_9';
                   QUERY PLAN                   
------------------------------------------------
 Update on pctest_h1
   ->  Seq Scan on pctest_h1
         Storage Filter: (d ~~ 'Value_9'::text)
(3 rows)

UPDATE pctest_h1 SET b = 0 WHERE d LIKE 'Value_9';
SELECT count(*) FROM pctest_h1 WHERE b = 0;
 count 
-------
    11
(1 row)

EXPLAIN (costs off)
DELETE FROM pctest_h1 WHERE d LIKE 'Value_8';
                   QUERY PLAN                   
------------------------------------------------
 Delete on pctest_h1
   ->  Seq Scan on pctest_h1
         Storage Filter: (d ~~ 'Value_8'::text)
(3 rows)

DELETE FROM pctest_h1 WHERE d LIKE 'Value_8';
SELECT count(*) FROM pctest_h1;
 count 
-------
   391
(1 row)

-- index scan with aggregates pushdown such that #atts being pushed down > #atts in relation
CREATE TABLE pctest_h3(k int primary key, a int unique);
INSERT INTO pctest_h3 SELECT i, i FROM generate_series(1, 1000) i;
ANALYZE pctest_h3;
EXPLAIN (costs off) SELECT count(*), max(k), min(k) FROM pctest_h3 WHERE k > 123;
                               QUERY PLAN                                
-------------------------------------------------------------------------
 Finalize Aggregate
   ->  Gather
         Workers Planned: 2
         ->  Noop Aggregate
               ->  Parallel Index Scan using pctest_h3_pkey on pctest_h3
                     Index Cond: (k > 123)
                     Partial Aggregate: true
(7 rows)

SELECT count(*), max(k), min(k) FROM pctest_h3 WHERE k > 123;
 count | max  | min 
-------+------+-----
   877 | 1000 | 124
(1 row)

-- Parallel index scan
EXPLAIN (costs off)
SELECT * FROM pctest_h1 WHERE k < 10;
              QUERY PLAN              
--------------------------------------
 Gather
   Workers Planned: 2
   ->  Parallel Seq Scan on pctest_h1
         Storage Filter: (k < 10)
(4 rows)

SELECT * FROM pctest_h1 WHERE k < 10;
 k |  a  | b | c |   d    
---+-----+---+---+--------
 5 | 395 | 1 | 5 | Value5
 1 | 399 | 0 | 1 | Value1
 6 | 394 | 2 | 6 | Value6
 7 | 393 | 2 | 7 | Value7
 9 | 391 | 3 | 9 | Value9
 4 | 396 | 1 | 4 | Value4
 2 | 398 | 0 | 2 | Value2
 8 | 392 | 2 | 8 | Value8
 3 | 397 | 1 | 3 | Value3
(9 rows)

EXPLAIN (costs off)
SELECT * FROM pctest_h1 WHERE d LIKE 'Value_9' ORDER BY k;
                      QUERY PLAN                      
------------------------------------------------------
 Gather Merge
   Workers Planned: 2
   ->  Sort
         Sort Key: k
         ->  Parallel Seq Scan on pctest_h1
               Storage Filter: (d ~~ 'Value_9'::text)
(6 rows)

SELECT * FROM pctest_h1 WHERE d LIKE 'Value_9' ORDER BY k;
 k  |  a  | b | c  |    d    
----+-----+---+----+---------
 19 | 381 | 0 | 19 | Value19
 29 | 371 | 0 | 29 | Value29
 39 | 361 | 0 | 39 | Value39
 49 | 351 | 0 | 49 | Value49
 59 | 341 | 0 |  9 | Value59
 69 | 331 | 0 | 19 | Value69
 79 | 321 | 0 | 29 | Value79
 89 | 311 | 0 | 39 | Value89
 99 | 301 | 0 | 49 | Value99
(9 rows)

--secondary index
EXPLAIN (costs off)
SELECT * FROM pctest_h1 ORDER BY a LIMIT 10;
                    QUERY PLAN                    
--------------------------------------------------
 Limit
   ->  Gather Merge
         Workers Planned: 2
         ->  Sort
               Sort Key: a
               ->  Parallel Seq Scan on pctest_h1
(6 rows)

SELECT * FROM pctest_h1 ORDER BY a LIMIT 10;
  k  | a |  b  | c  |    d     
-----+---+-----+----+----------
 400 | 0 | 133 |  0 | Value400
 399 | 1 | 133 | 49 | Value399
 398 | 2 | 132 | 48 | Value398
 397 | 3 | 132 | 47 | Value397
 396 | 4 | 132 | 46 | Value396
 395 | 5 | 131 | 45 | Value395
 394 | 6 | 131 | 44 | Value394
 393 | 7 | 131 | 43 | Value393
 392 | 8 | 130 | 42 | Value392
 391 | 9 | 130 | 41 | Value391
(10 rows)

-- Joins
-- Nest loop
/*+
  Set(enable_mergejoin off) Set(enable_hashjoin off)
  Set(yb_bnl_batch_size 1) Set(enable_material off)
*/
EXPLAIN (costs off)
WITH cte AS MATERIALIZED (
  SELECT pctest_h1.* FROM pctest_h1, pctest_h2
    WHERE pctest_h1.a = pctest_h2.b and pctest_h1.a % 10 = 0)
SELECT * FROM cte ORDER BY k;
                            QUERY PLAN                            
------------------------------------------------------------------
 Sort
   Sort Key: cte.k
   CTE cte
     ->  Nested Loop
           ->  Gather
                 Workers Planned: 2
                 ->  Parallel Seq Scan on pctest_h1
                       Storage Filter: ((a % 10) = 0)
           ->  Index Only Scan using pctest_h2_b_idx on pctest_h2
                 Index Cond: (b = pctest_h1.a)
   ->  CTE Scan on cte
(11 rows)

/*+
  Set(enable_mergejoin off) Set(enable_hashjoin off)
  Set(yb_bnl_batch_size 1) Set(enable_material off)
*/
WITH cte AS MATERIALIZED (
  SELECT pctest_h1.* FROM pctest_h1, pctest_h2
    WHERE pctest_h1.a = pctest_h2.b and pctest_h1.a % 10 = 0)
SELECT * FROM cte ORDER BY k;
  k  | a  |  b  | c  |    d     
-----+----+-----+----+----------
 380 | 20 | 126 | 30 | Value380
 390 | 10 | 130 | 40 | Value390
 390 | 10 | 130 | 40 | Value390
 390 | 10 | 130 | 40 | Value390
 390 | 10 | 130 | 40 | Value390
 390 | 10 | 130 | 40 | Value390
 400 |  0 | 133 |  0 | Value400
 400 |  0 | 133 |  0 | Value400
 400 |  0 | 133 |  0 | Value400
 400 |  0 | 133 |  0 | Value400
(10 rows)

EXPLAIN (costs off)
/*+YbBatchedNL(pctest_h1 pctest_h2)*/
SELECT pctest_h1.*, pctest_h2.k FROM pctest_h1, pctest_h2
  WHERE pctest_h1.c = 42 AND pctest_h1.k = pctest_h2.k ORDER BY pctest_h1.k;
                                     QUERY PLAN                                     
------------------------------------------------------------------------------------
 Gather Merge
   Workers Planned: 2
   ->  Sort
         Sort Key: pctest_h1.k
         ->  YB Batched Nested Loop Join
               Join Filter: (pctest_h1.k = pctest_h2.k)
               ->  Parallel Index Scan using pctest_h1_c_idx on pctest_h1
                     Index Cond: (c = 42)
               ->  Index Scan using pctest_h2_pkey on pctest_h2
                     Index Cond: (k = ANY (ARRAY[pctest_h1.k, $1, $2, ..., $1023]))
(10 rows)

/*+YbBatchedNL(pctest_h1 pctest_h2)*/
SELECT pctest_h1.*, pctest_h2.k FROM pctest_h1, pctest_h2
  WHERE pctest_h1.c = 42 AND pctest_h1.k = pctest_h2.k ORDER BY pctest_h1.k;
 k  |  a  | b  | c  |    d    | k  
----+-----+----+----+---------+----
 42 | 358 | 14 | 42 | Value42 | 42
 92 | 308 | 30 | 42 | Value92 | 92
(2 rows)

-- Hash join
set enable_mergejoin to false;
EXPLAIN (costs off)
SELECT pctest_h1.k, pctest_h2.k FROM pctest_h1 JOIN pctest_h2 USING (a, c) ORDER BY pctest_h1.k, pctest_h2.k;
                                       QUERY PLAN                                       
----------------------------------------------------------------------------------------
 Gather Merge
   Workers Planned: 2
   ->  Sort
         Sort Key: pctest_h1.k, pctest_h2.k
         ->  Hash Join
               Hash Cond: ((pctest_h2.a = pctest_h1.a) AND (pctest_h2.c = pctest_h1.c))
               ->  Parallel Seq Scan on pctest_h2
               ->  Hash
                     ->  Seq Scan on pctest_h1
(9 rows)

SELECT pctest_h1.k, pctest_h2.k FROM pctest_h1 JOIN pctest_h2 USING (a, c) ORDER BY pctest_h1.k, pctest_h2.k;
  k  |  k  
-----+-----
 200 | 100
 205 |  95
 250 |  50
 255 |  45
(4 rows)

reset enable_mergejoin;
-- Merge join
set enable_hashjoin to false;
set yb_bnl_batch_size = 1;
EXPLAIN (costs off)
SELECT pctest_h1.*, pctest_h2.k FROM pctest_h1, pctest_h2
  WHERE pctest_h1.c = 42 AND pctest_h1.k = pctest_h2.k ORDER BY pctest_h1.k;
                                QUERY PLAN                                
--------------------------------------------------------------------------
 Gather Merge
   Workers Planned: 2
   ->  Merge Join
         Merge Cond: (pctest_h1.k = pctest_h2.k)
         ->  Sort
               Sort Key: pctest_h1.k
               ->  Parallel Index Scan using pctest_h1_c_idx on pctest_h1
                     Index Cond: (c = 42)
         ->  Sort
               Sort Key: pctest_h2.k
               ->  Seq Scan on pctest_h2
(11 rows)

SELECT pctest_h1.*, pctest_h2.k FROM pctest_h1, pctest_h2
  WHERE pctest_h1.c = 42 AND pctest_h1.k = pctest_h2.k ORDER BY pctest_h1.k;
 k  |  a  | b  | c  |    d    | k  
----+-----+----+----+---------+----
 42 | 358 | 14 | 42 | Value42 | 42
 92 | 308 | 30 | 42 | Value92 | 92
(2 rows)

reset enable_hashjoin;
reset yb_bnl_batch_size;
-- Subquery
EXPLAIN (costs off)
SELECT x, d FROM
  (SELECT pctest_h1.* FROM pctest_h1, pctest_h2
     WHERE pctest_h1.k = pctest_h2.k AND pctest_h1.c = pctest_h2.c) ss RIGHT JOIN
  (values (15),(16),(17)) v(x) on ss.b = v.x ORDER BY x;
                                          QUERY PLAN                                          
----------------------------------------------------------------------------------------------
 Merge Left Join
   Merge Cond: ("*VALUES*".column1 = pctest_h1.b)
   ->  Sort
         Sort Key: "*VALUES*".column1
         ->  Values Scan on "*VALUES*"
   ->  Sort
         Sort Key: pctest_h1.b
         ->  Gather
               Workers Planned: 2
               ->  Parallel Hash Join
                     Hash Cond: ((pctest_h1.k = pctest_h2.k) AND (pctest_h1.c = pctest_h2.c))
                     ->  Parallel Seq Scan on pctest_h1
                     ->  Parallel Hash
                           ->  Parallel Seq Scan on pctest_h2
(14 rows)

SELECT x, d FROM
  (SELECT pctest_h1.* FROM pctest_h1, pctest_h2
     WHERE pctest_h1.k = pctest_h2.k AND pctest_h1.c = pctest_h2.c) ss RIGHT JOIN
  (values (15),(16),(17)) v(x) on ss.b = v.x ORDER BY x;
 x  |    d    
----+---------
 15 | 
 16 | Value50
 17 | Value51
 17 | Value53
 17 | Value52
(5 rows)

EXPLAIN (costs off)
WITH cte AS MATERIALIZED (
SELECT * FROM
  (SELECT pctest_h1.* FROM pctest_h1, pctest_h2
     WHERE pctest_h1.k = pctest_h2.k AND pctest_h1.c = pctest_h2.c) s1 JOIN
  (SELECT pctest_h2.* FROM pctest_h1, pctest_h2
     WHERE pctest_h1.k = pctest_h2.k AND pctest_h1.b = pctest_h2.b) s2 ON s1.b = s2.c)
SELECT * FROM cte ORDER BY 1, 5;
                                                 QUERY PLAN                                                 
------------------------------------------------------------------------------------------------------------
 Sort
   Sort Key: cte.k, cte.d
   CTE cte
     ->  Nested Loop
           ->  Gather
                 Workers Planned: 2
                 ->  Parallel Hash Join
                       Hash Cond: (pctest_h2_1.c = pctest_h1.b)
                       ->  Parallel Seq Scan on pctest_h2 pctest_h2_1
                       ->  Parallel Hash
                             ->  Hash Join
                                   Hash Cond: ((pctest_h2.k = pctest_h1.k) AND (pctest_h2.c = pctest_h1.c))
                                   ->  Parallel Seq Scan on pctest_h2
                                   ->  Hash
                                         ->  Seq Scan on pctest_h1
           ->  Index Scan using pctest_h1_pkey on pctest_h1 pctest_h1_1
                 Index Cond: (k = pctest_h2_1.k)
                 Storage Filter: (pctest_h2_1.b = b)
   ->  CTE Scan on cte
(19 rows)

WITH cte AS MATERIALIZED (
SELECT * FROM
  (SELECT pctest_h1.* FROM pctest_h1, pctest_h2
     WHERE pctest_h1.k = pctest_h2.k AND pctest_h1.c = pctest_h2.c) s1 JOIN
  (SELECT pctest_h2.* FROM pctest_h1, pctest_h2
     WHERE pctest_h1.k = pctest_h2.k AND pctest_h1.b = pctest_h2.b) s2 ON s1.b = s2.c)
SELECT * FROM cte ORDER BY 1, 5;
 k |  a  | b | c |   d    | k |  a  | b | c |       d       
---+-----+---+---+--------+---+-----+---+---+---------------
 3 | 397 | 1 | 3 | Value3 | 1 | 101 | 0 | 1 | Other value 1
 4 | 396 | 1 | 4 | Value4 | 1 | 101 | 0 | 1 | Other value 1
 5 | 395 | 1 | 5 | Value5 | 1 | 101 | 0 | 1 | Other value 1
 6 | 394 | 2 | 6 | Value6 | 2 | 102 | 0 | 2 | Other value 2
 7 | 393 | 2 | 7 | Value7 | 2 | 102 | 0 | 2 | Other value 2
 8 | 392 | 2 | 8 | Value8 | 2 | 102 | 0 | 2 | Other value 2
(6 rows)

-- index only scan with aggregates pushdown such that #atts being pushed down > #atts in relation
/*+ IndexOnlyScan(pctest_h3) */
EXPLAIN (costs off) SELECT count(*), max(a), min(a) FROM pctest_h3 WHERE a > 123;
                                  QUERY PLAN                                   
-------------------------------------------------------------------------------
 Finalize Aggregate
   ->  Gather
         Workers Planned: 2
         ->  Noop Aggregate
               ->  Parallel Index Only Scan using pctest_h3_a_key on pctest_h3
                     Index Cond: (a > 123)
                     Partial Aggregate: true
(7 rows)

/*+ IndexOnlyScan(pctest_h3) */
SELECT count(*), max(a), min(a) FROM pctest_h3 WHERE a > 123;
 count | max  | min 
-------+------+-----
   877 | 1000 | 124
(1 row)

-- conditions on yb_hash_code()
EXPLAIN (costs off) SELECT * FROM pctest_h1 WHERE yb_hash_code(k) >= 512 AND yb_hash_code(k) < 1024;
                                 QUERY PLAN                                  
-----------------------------------------------------------------------------
 Gather
   Workers Planned: 2
   ->  Parallel Index Scan using pctest_h1_pkey on pctest_h1
         Index Cond: ((yb_hash_code(k) >= 512) AND (yb_hash_code(k) < 1024))
(4 rows)

SELECT * FROM pctest_h1 WHERE yb_hash_code(k) >= 512 AND yb_hash_code(k) < 1024;
  k  |  a  |  b  | c  |    d     
-----+-----+-----+----+----------
 149 | 251 |  49 | 49 | Value149
 135 | 265 |  45 | 35 | Value135
 311 |  89 | 103 | 11 | Value311
(3 rows)

EXPLAIN (costs off) SELECT * FROM pctest_h1 WHERE yb_hash_code(c) >= 1024 AND yb_hash_code(c) < 2048;
                                  QUERY PLAN                                  
------------------------------------------------------------------------------
 Gather
   Workers Planned: 2
   ->  Parallel Index Scan using pctest_h1_c_idx on pctest_h1
         Index Cond: ((yb_hash_code(c) >= 1024) AND (yb_hash_code(c) < 2048))
(4 rows)

SELECT * FROM pctest_h1 WHERE yb_hash_code(c) >= 1024 AND yb_hash_code(c) < 2048;
  k  |  a  |  b  | c  |    d     
-----+-----+-----+----+----------
  45 | 355 |  15 | 45 | Value45
 295 | 105 |  98 | 45 | Value295
 345 |  55 | 115 | 45 | Value345
 395 |   5 | 131 | 45 | Value395
 195 | 205 |  65 | 45 | Value195
 145 | 255 |  48 | 45 | Value145
 245 | 155 |  81 | 45 | Value245
  95 | 305 |  31 | 45 | Value95
(8 rows)

DROP TABLE pctest1;
DROP TABLE pctest2;
DROP TABLE pctest3;
DROP TABLE pctest_h1;
DROP TABLE pctest_h2;
DROP TABLE pctest_h3;
