--
-- YB-specific tests for transition tables (REFERENCING clause)
-- Covers edge cases not in upstream PG regress tests.
--
-- Helper function to log transition table contents
CREATE FUNCTION tt_log_insert() RETURNS trigger LANGUAGE plpgsql AS $$
BEGIN
  RAISE NOTICE 'tt_log_insert: tg_op=%, new_table=%',
    TG_OP,
    (SELECT string_agg(new_table::text, ', ' ORDER BY id) FROM new_table);
  RETURN NULL;
END;
$$;
CREATE FUNCTION tt_log_update() RETURNS trigger LANGUAGE plpgsql AS $$
BEGIN
  RAISE NOTICE 'tt_log_update: tg_op=%, old_table=%, new_table=%',
    TG_OP,
    (SELECT string_agg(old_table::text, ', ' ORDER BY id) FROM old_table),
    (SELECT string_agg(new_table::text, ', ' ORDER BY id) FROM new_table);
  RETURN NULL;
END;
$$;
CREATE FUNCTION tt_log_delete() RETURNS trigger LANGUAGE plpgsql AS $$
BEGIN
  RAISE NOTICE 'tt_log_delete: tg_op=%, old_table=%',
    TG_OP,
    (SELECT string_agg(old_table::text, ', ' ORDER BY id) FROM old_table);
  RETURN NULL;
END;
$$;
----------------------------------------------------------------------
-- Section 1: Basic operations
----------------------------------------------------------------------
CREATE TABLE tt_test (id int PRIMARY KEY, val text);
INSERT INTO tt_test VALUES (1, 'a'), (2, 'b'), (3, 'c'), (4, 'd');
CREATE TRIGGER tt_test_ins AFTER INSERT ON tt_test
  REFERENCING NEW TABLE AS new_table
  FOR EACH STATEMENT EXECUTE FUNCTION tt_log_insert();
CREATE TRIGGER tt_test_upd AFTER UPDATE ON tt_test
  REFERENCING OLD TABLE AS old_table NEW TABLE AS new_table
  FOR EACH STATEMENT EXECUTE FUNCTION tt_log_update();
CREATE TRIGGER tt_test_del AFTER DELETE ON tt_test
  REFERENCING OLD TABLE AS old_table
  FOR EACH STATEMENT EXECUTE FUNCTION tt_log_delete();
-- Plain INSERT with transition table
INSERT INTO tt_test VALUES (10, 'ten');
NOTICE:  tt_log_insert: tg_op=INSERT, new_table=(10,ten)
-- Plain UPDATE with transition tables
UPDATE tt_test SET val = 'updated_' || val WHERE id = 1;
NOTICE:  tt_log_update: tg_op=UPDATE, old_table=(1,a), new_table=(1,updated_a)
-- Plain DELETE with REFERENCING OLD TABLE
DELETE FROM tt_test WHERE id = 2;
NOTICE:  tt_log_delete: tg_op=DELETE, old_table=(2,b)
-- DELETE WHERE no rows match (empty transition table)
DELETE FROM tt_test WHERE id = 999;
NOTICE:  tt_log_delete: tg_op=DELETE, old_table=<NULL>
-- UPDATE WHERE no rows match (empty transition table)
UPDATE tt_test SET val = 'nope' WHERE id = 999;
NOTICE:  tt_log_update: tg_op=UPDATE, old_table=<NULL>, new_table=<NULL>
-- INSERT with no rows (empty transition table via INSERT ... SELECT)
INSERT INTO tt_test SELECT * FROM tt_test WHERE id < 0;
NOTICE:  tt_log_insert: tg_op=INSERT, new_table=<NULL>
----------------------------------------------------------------------
-- Section 2: CTE (modifying WITH) edge cases
----------------------------------------------------------------------
-- Reset data
TRUNCATE tt_test;
INSERT INTO tt_test VALUES (1, 'a'), (2, 'b'), (3, 'c'), (4, 'd');
NOTICE:  tt_log_insert: tg_op=INSERT, new_table=(1,a), (2,b), (3,c), (4,d)
-- CTE: single DELETE with transition tables
WITH del AS (DELETE FROM tt_test WHERE id = 1 RETURNING *)
SELECT * FROM del;
NOTICE:  tt_log_delete: tg_op=DELETE, old_table=(1,a)
 id | val 
----+-----
  1 | a
(1 row)

-- CTE: single UPDATE with transition tables
WITH upd AS (UPDATE tt_test SET val = 'changed_b' WHERE id = 2 RETURNING *)
SELECT * FROM upd;
NOTICE:  tt_log_update: tg_op=UPDATE, old_table=(2,b), new_table=(2,changed_b)
 id |    val    
----+-----------
  2 | changed_b
(1 row)

-- Re-insert deleted row for subsequent tests
INSERT INTO tt_test VALUES (1, 'a_new');
NOTICE:  tt_log_insert: tg_op=INSERT, new_table=(1,a_new)
-- CTE: INSERT + UPDATE in one CTE
WITH
  ins AS (INSERT INTO tt_test VALUES (5, 'five') RETURNING *),
  upd AS (UPDATE tt_test SET val = 'changed_c' WHERE id = 3 RETURNING *)
SELECT * FROM ins UNION ALL SELECT * FROM upd;
NOTICE:  tt_log_insert: tg_op=INSERT, new_table=(5,five)
NOTICE:  tt_log_update: tg_op=UPDATE, old_table=(3,c), new_table=(3,changed_c)
 id |    val    
----+-----------
  5 | five
  3 | changed_c
(2 rows)

-- CTE: INSERT + DELETE in one CTE
WITH
  ins AS (INSERT INTO tt_test VALUES (6, 'six') RETURNING *),
  del AS (DELETE FROM tt_test WHERE id = 4 RETURNING *)
SELECT * FROM ins UNION ALL SELECT * FROM del;
NOTICE:  tt_log_insert: tg_op=INSERT, new_table=(6,six)
NOTICE:  tt_log_delete: tg_op=DELETE, old_table=(4,d)
 id | val 
----+-----
  6 | six
  4 | d
(2 rows)

-- CTE: INSERT + UPDATE + DELETE in one CTE
WITH
  ins AS (INSERT INTO tt_test VALUES (7, 'seven') RETURNING *),
  upd AS (UPDATE tt_test SET val = 'changed_a' WHERE id = 1 RETURNING *),
  del AS (DELETE FROM tt_test WHERE id = 5 RETURNING *)
SELECT * FROM ins
UNION ALL SELECT * FROM upd
UNION ALL SELECT * FROM del;
NOTICE:  tt_log_insert: tg_op=INSERT, new_table=(7,seven)
NOTICE:  tt_log_update: tg_op=UPDATE, old_table=(1,a_new), new_table=(1,changed_a)
NOTICE:  tt_log_delete: tg_op=DELETE, old_table=(5,five)
 id |    val    
----+-----------
  7 | seven
  1 | changed_a
  5 | five
(3 rows)

-- CTE: two UPDATEs on same table (merged into one trigger)
WITH
  upd1 AS (UPDATE tt_test SET val = 'first_' || val WHERE id IN (2, 3) RETURNING *),
  upd2 AS (UPDATE tt_test SET val = 'second_' || val WHERE id IN (6, 7) RETURNING *)
SELECT * FROM upd1 UNION ALL SELECT * FROM upd2;
NOTICE:  tt_log_update: tg_op=UPDATE, old_table=(2,changed_b), (3,changed_c), (6,six), (7,seven), new_table=(2,first_changed_b), (3,first_changed_c), (6,second_six), (7,second_seven)
 id |       val       
----+-----------------
  2 | first_changed_b
  3 | first_changed_c
  6 | second_six
  7 | second_seven
(4 rows)

-- CTE: two DELETEs on same table (merged into one trigger)
WITH
  del1 AS (DELETE FROM tt_test WHERE id = 6 RETURNING *),
  del2 AS (DELETE FROM tt_test WHERE id = 7 RETURNING *)
SELECT * FROM del1 UNION ALL SELECT * FROM del2;
NOTICE:  tt_log_delete: tg_op=DELETE, old_table=(6,second_six), (7,second_seven)
 id |     val      
----+--------------
  6 | second_six
  7 | second_seven
(2 rows)

-- CTE: two INSERTs on same table (merged -- regression test)
WITH
  ins1 AS (INSERT INTO tt_test VALUES (20, 'twenty') RETURNING *),
  ins2 AS (INSERT INTO tt_test VALUES (21, 'twenty_one') RETURNING *)
SELECT * FROM ins1 UNION ALL SELECT * FROM ins2;
NOTICE:  tt_log_insert: tg_op=INSERT, new_table=(20,twenty), (21,twenty_one)
 id |    val     
----+------------
 20 | twenty
 21 | twenty_one
(2 rows)

-- CTE: UPDATE ... RETURNING used by outer SELECT
WITH upd AS (UPDATE tt_test SET val = 'ret_' || val WHERE id = 1 RETURNING id, val)
SELECT id, val FROM upd;
NOTICE:  tt_log_update: tg_op=UPDATE, old_table=(1,changed_a), new_table=(1,ret_changed_a)
 id |      val      
----+---------------
  1 | ret_changed_a
(1 row)

-- CTE: DELETE ... RETURNING used by outer SELECT
WITH del AS (DELETE FROM tt_test WHERE id = 20 RETURNING id, val)
SELECT id, val FROM del;
NOTICE:  tt_log_delete: tg_op=DELETE, old_table=(20,twenty)
 id |  val   
----+--------
 20 | twenty
(1 row)

----------------------------------------------------------------------
-- Section 3: UPDATE ... FROM / DELETE ... USING
----------------------------------------------------------------------
TRUNCATE tt_test;
INSERT INTO tt_test VALUES (1, 'a'), (2, 'b'), (3, 'c');
NOTICE:  tt_log_insert: tg_op=INSERT, new_table=(1,a), (2,b), (3,c)
CREATE TABLE tt_source (id int, new_val text);
INSERT INTO tt_source VALUES (1, 'from_a'), (2, 'from_b');
-- UPDATE ... FROM with transition tables
UPDATE tt_test SET val = s.new_val FROM tt_source s WHERE tt_test.id = s.id;
NOTICE:  tt_log_update: tg_op=UPDATE, old_table=(1,a), (2,b), new_table=(1,from_a), (2,from_b)
-- DELETE ... USING with transition tables
DELETE FROM tt_test USING tt_source s WHERE tt_test.id = s.id;
NOTICE:  tt_log_delete: tg_op=DELETE, old_table=(1,from_a), (2,from_b)
-- Two separate UPDATE ... FROM statements (each fires own trigger)
INSERT INTO tt_test VALUES (1, 'a'), (2, 'b');
NOTICE:  tt_log_insert: tg_op=INSERT, new_table=(1,a), (2,b)
UPDATE tt_test SET val = 'first_pass' WHERE id = 1;
NOTICE:  tt_log_update: tg_op=UPDATE, old_table=(1,a), new_table=(1,first_pass)
UPDATE tt_test SET val = 'second_pass' WHERE id = 2;
NOTICE:  tt_log_update: tg_op=UPDATE, old_table=(2,b), new_table=(2,second_pass)
DROP TABLE tt_source;
----------------------------------------------------------------------
-- Section 4: Transaction and error handling
----------------------------------------------------------------------
TRUNCATE tt_test;
INSERT INTO tt_test VALUES (1, 'a'), (2, 'b');
NOTICE:  tt_log_insert: tg_op=INSERT, new_table=(1,a), (2,b)
-- Transition tables inside explicit transaction
BEGIN;
UPDATE tt_test SET val = 'txn_' || val WHERE id = 1;
NOTICE:  tt_log_update: tg_op=UPDATE, old_table=(1,a), new_table=(1,txn_a)
INSERT INTO tt_test VALUES (10, 'txn_new');
NOTICE:  tt_log_insert: tg_op=INSERT, new_table=(10,txn_new)
DELETE FROM tt_test WHERE id = 2;
NOTICE:  tt_log_delete: tg_op=DELETE, old_table=(2,b)
COMMIT;
-- SAVEPOINT + ROLLBACK TO with transition tables
INSERT INTO tt_test VALUES (2, 'b_restored');
NOTICE:  tt_log_insert: tg_op=INSERT, new_table=(2,b_restored)
BEGIN;
SAVEPOINT sp1;
UPDATE tt_test SET val = 'will_rollback' WHERE id = 1;
NOTICE:  tt_log_update: tg_op=UPDATE, old_table=(1,txn_a), new_table=(1,will_rollback)
ROLLBACK TO sp1;
UPDATE tt_test SET val = 'after_rollback' WHERE id = 1;
NOTICE:  tt_log_update: tg_op=UPDATE, old_table=(1,txn_a), new_table=(1,after_rollback)
COMMIT;
-- Trigger function raises exception — rollback behavior
CREATE FUNCTION tt_raise_error() RETURNS trigger LANGUAGE plpgsql AS $$
BEGIN
  RAISE EXCEPTION 'intentional error in trigger';
  RETURN NULL;
END;
$$;
CREATE TRIGGER tt_test_err AFTER UPDATE ON tt_test
  REFERENCING OLD TABLE AS old_table NEW TABLE AS new_table
  FOR EACH STATEMENT EXECUTE FUNCTION tt_raise_error();
BEGIN;
SAVEPOINT sp1;
UPDATE tt_test SET val = 'should_fail' WHERE id = 1;  -- error expected
ERROR:  intentional error in trigger
CONTEXT:  PL/pgSQL function tt_raise_error() line 3 at RAISE
ROLLBACK TO sp1;
COMMIT;
DROP TRIGGER tt_test_err ON tt_test;
DROP FUNCTION tt_raise_error();
-- Multiple statements in a transaction each with transition triggers
BEGIN;
INSERT INTO tt_test VALUES (30, 'thirty');
NOTICE:  tt_log_insert: tg_op=INSERT, new_table=(30,thirty)
UPDATE tt_test SET val = 'multi_txn_' || val WHERE id = 1;
NOTICE:  tt_log_update: tg_op=UPDATE, old_table=(1,after_rollback), new_table=(1,multi_txn_after_rollback)
DELETE FROM tt_test WHERE id = 30;
NOTICE:  tt_log_delete: tg_op=DELETE, old_table=(30,thirty)
COMMIT;
----------------------------------------------------------------------
-- Section 5: Data edge cases
----------------------------------------------------------------------
TRUNCATE tt_test;
-- Transition tables with NULL values
TRUNCATE tt_test;
INSERT INTO tt_test VALUES (1, NULL), (2, NULL);
NOTICE:  tt_log_insert: tg_op=INSERT, new_table=(1,), (2,)
UPDATE tt_test SET val = NULL WHERE id = 1;
NOTICE:  tt_log_update: tg_op=UPDATE, old_table=(1,), new_table=(1,)
DELETE FROM tt_test WHERE id = 2;
NOTICE:  tt_log_delete: tg_op=DELETE, old_table=(2,)
-- Transition tables with various data types
CREATE TABLE tt_types (
  id int PRIMARY KEY,
  t text,
  j jsonb,
  a int[]
);
CREATE TRIGGER tt_types_ins AFTER INSERT ON tt_types
  REFERENCING NEW TABLE AS new_table
  FOR EACH STATEMENT EXECUTE FUNCTION tt_log_insert();
CREATE TRIGGER tt_types_upd AFTER UPDATE ON tt_types
  REFERENCING OLD TABLE AS old_table NEW TABLE AS new_table
  FOR EACH STATEMENT EXECUTE FUNCTION tt_log_update();
CREATE TRIGGER tt_types_del AFTER DELETE ON tt_types
  REFERENCING OLD TABLE AS old_table
  FOR EACH STATEMENT EXECUTE FUNCTION tt_log_delete();
INSERT INTO tt_types VALUES (1, 'hello', '{"key": "value"}', '{1,2,3}');
NOTICE:  tt_log_insert: tg_op=INSERT, new_table=(1,hello,"{""key"": ""value""}","{1,2,3}")
UPDATE tt_types SET j = '{"updated": true}' WHERE id = 1;
NOTICE:  tt_log_update: tg_op=UPDATE, old_table=(1,hello,"{""key"": ""value""}","{1,2,3}"), new_table=(1,hello,"{""updated"": true}","{1,2,3}")
DELETE FROM tt_types WHERE id = 1;
NOTICE:  tt_log_delete: tg_op=DELETE, old_table=(1,hello,"{""updated"": true}","{1,2,3}")
DROP TABLE tt_types;
-- Trigger function queries the transition table multiple times
CREATE FUNCTION tt_multi_query() RETURNS trigger LANGUAGE plpgsql AS $$
DECLARE
  cnt int;
  vals text;
BEGIN
  SELECT count(*) INTO cnt FROM new_table;
  SELECT string_agg(val, ', ' ORDER BY id) INTO vals FROM new_table;
  RAISE NOTICE 'count=%, vals=%', cnt, vals;
  RETURN NULL;
END;
$$;
TRUNCATE tt_test;
CREATE TRIGGER tt_test_multi AFTER INSERT ON tt_test
  REFERENCING NEW TABLE AS new_table
  FOR EACH STATEMENT EXECUTE FUNCTION tt_multi_query();
INSERT INTO tt_test VALUES (1, 'first'), (2, 'second'), (3, 'third');
NOTICE:  tt_log_insert: tg_op=INSERT, new_table=(1,first), (2,second), (3,third)
NOTICE:  count=3, vals=first, second, third
DROP TRIGGER tt_test_multi ON tt_test;
DROP FUNCTION tt_multi_query();
----------------------------------------------------------------------
-- Section 6: Multiple triggers and trigger ordering
----------------------------------------------------------------------
-- Multiple statement-level triggers on same event
CREATE FUNCTION tt_log_insert_2() RETURNS trigger LANGUAGE plpgsql AS $$
BEGIN
  RAISE NOTICE 'tt_log_insert_2: tg_name=%, new_table=%',
    TG_NAME,
    (SELECT string_agg(new_table::text, ', ' ORDER BY id) FROM new_table);
  RETURN NULL;
END;
$$;
TRUNCATE tt_test;
CREATE TRIGGER tt_test_ins_2 AFTER INSERT ON tt_test
  REFERENCING NEW TABLE AS new_table
  FOR EACH STATEMENT EXECUTE FUNCTION tt_log_insert_2();
INSERT INTO tt_test VALUES (1, 'multi_trigger');
NOTICE:  tt_log_insert: tg_op=INSERT, new_table=(1,multi_trigger)
NOTICE:  tt_log_insert_2: tg_name=tt_test_ins_2, new_table=(1,multi_trigger)
DROP TRIGGER tt_test_ins_2 ON tt_test;
DROP FUNCTION tt_log_insert_2();
-- Row-level + statement-level triggers
CREATE FUNCTION tt_row_trigger() RETURNS trigger LANGUAGE plpgsql AS $$
BEGIN
  RAISE NOTICE 'row trigger: id=%, val=%', NEW.id, NEW.val;
  RETURN NEW;
END;
$$;
TRUNCATE tt_test;
CREATE TRIGGER tt_test_row_ins AFTER INSERT ON tt_test
  FOR EACH ROW EXECUTE FUNCTION tt_row_trigger();
INSERT INTO tt_test VALUES (1, 'row_and_stmt'), (2, 'row_and_stmt_2');
NOTICE:  row trigger: id=1, val=row_and_stmt
NOTICE:  row trigger: id=2, val=row_and_stmt_2
NOTICE:  tt_log_insert: tg_op=INSERT, new_table=(1,row_and_stmt), (2,row_and_stmt_2)
DROP TRIGGER tt_test_row_ins ON tt_test;
DROP FUNCTION tt_row_trigger();
----------------------------------------------------------------------
-- Section 7: COPY
----------------------------------------------------------------------
TRUNCATE tt_test;
-- COPY FROM with INSERT transition table trigger
COPY tt_test FROM stdin;
NOTICE:  tt_log_insert: tg_op=INSERT, new_table=(1,copy_a), (2,copy_b), (3,copy_c)
-- COPY FROM with index present (different code path)
CREATE INDEX ON tt_test(val);
COPY tt_test FROM stdin;
NOTICE:  tt_log_insert: tg_op=INSERT, new_table=(4,copy_d), (5,copy_e)
DROP INDEX tt_test_val_idx;
----------------------------------------------------------------------
-- Section 8: Tuplestore spill behavior
----------------------------------------------------------------------
-- Statement trigger transition table spills to disk under low work_mem
--
-- With work_mem=64kB, inserting 2000 rows of ~5kB each into a table that has
-- a transition-table trigger forces the tuplestore to spill to disk.  We
-- extract the "temp written=N" value from EXPLAIN (ANALYZE, BUFFERS) and
-- assert it exceeds 1000 blocks.
CREATE FUNCTION tt_explain_temp_written(query text) RETURNS int LANGUAGE plpgsql AS $$
DECLARE
  line text;
  matches text[];
  temp_written int := 0;
BEGIN
  FOR line IN EXECUTE query LOOP
    matches := regexp_match(line, 'temp(?: read=[0-9]+)? written=([0-9]+)');
    IF matches IS NOT NULL THEN
      temp_written := GREATEST(temp_written, matches[1]::int);
    END IF;
  END LOOP;

  RETURN temp_written;
END;
$$;
CREATE TABLE tt_spill_test (id int PRIMARY KEY, payload text);
SET work_mem = '64kB';
CREATE FUNCTION tt_spill_count() RETURNS trigger LANGUAGE plpgsql AS $$
DECLARE
  cnt bigint;
BEGIN
  SELECT count(*) INTO cnt FROM new_table;
  RETURN NULL;
END;
$$;
CREATE TRIGGER tt_spill_ins AFTER INSERT ON tt_spill_test
  REFERENCING NEW TABLE AS new_table
  FOR EACH STATEMENT EXECUTE FUNCTION tt_spill_count();
SELECT tt_explain_temp_written($q$
  EXPLAIN (ANALYZE, BUFFERS, COSTS OFF, SUMMARY OFF, TIMING OFF)
  INSERT INTO tt_spill_test
  SELECT g, repeat('x', 5000)
  FROM generate_series(1, 2000) AS g
$q$) > 1000 AS spill_to_disk;
 spill_to_disk 
---------------
 t
(1 row)

RESET work_mem;
DROP TABLE tt_spill_test;
DROP FUNCTION tt_spill_count();
DROP FUNCTION tt_explain_temp_written(text);
----------------------------------------------------------------------
-- Section 9: System columns referenced from transition tables
----------------------------------------------------------------------
TRUNCATE tt_test;
CREATE FUNCTION tt_log_sys_cols() RETURNS trigger LANGUAGE plpgsql AS $$
DECLARE
  s text;
BEGIN
  IF (TG_OP = 'INSERT') THEN
    SELECT string_agg(format('id=%s,tableoid_ok=%s', id, tableoid = 'tt_test'::regclass), '; ' ORDER BY id)
      INTO s FROM new_table;
    RAISE NOTICE 'sys ins: %', s;
  ELSIF (TG_OP = 'DELETE') THEN
    SELECT string_agg(format('id=%s,tableoid_ok=%s', id, tableoid = 'tt_test'::regclass), '; ' ORDER BY id)
      INTO s FROM old_table;
    RAISE NOTICE 'sys del: %', s;
  END IF;
  RETURN NULL;
END;
$$;
CREATE TRIGGER tt_test_sys_ins AFTER INSERT ON tt_test
  REFERENCING NEW TABLE AS new_table
  FOR EACH STATEMENT EXECUTE FUNCTION tt_log_sys_cols();
CREATE TRIGGER tt_test_sys_del AFTER DELETE ON tt_test
  REFERENCING OLD TABLE AS old_table
  FOR EACH STATEMENT EXECUTE FUNCTION tt_log_sys_cols();
-- tableoid is accessible from transition table rows
INSERT INTO tt_test VALUES (1, 'sys_a'), (2, 'sys_b');
NOTICE:  tt_log_insert: tg_op=INSERT, new_table=(1,sys_a), (2,sys_b)
ERROR:  column "tableoid" does not exist
LINE 1: ...ECT string_agg(format('id=%s,tableoid_ok=%s', id, tableoid =...
                                                             ^
QUERY:  SELECT string_agg(format('id=%s,tableoid_ok=%s', id, tableoid = 'tt_test'::regclass), '; ' ORDER BY id)
             FROM new_table
CONTEXT:  PL/pgSQL function tt_log_sys_cols() line 6 at SQL statement
DELETE FROM tt_test WHERE id = 1;
NOTICE:  tt_log_delete: tg_op=DELETE, old_table=<NULL>
ERROR:  column "tableoid" does not exist
LINE 1: ...ECT string_agg(format('id=%s,tableoid_ok=%s', id, tableoid =...
                                                             ^
QUERY:  SELECT string_agg(format('id=%s,tableoid_ok=%s', id, tableoid = 'tt_test'::regclass), '; ' ORDER BY id)
             FROM old_table
CONTEXT:  PL/pgSQL function tt_log_sys_cols() line 10 at SQL statement
DROP TRIGGER tt_test_sys_ins ON tt_test;
DROP TRIGGER tt_test_sys_del ON tt_test;
DROP FUNCTION tt_log_sys_cols();
----------------------------------------------------------------------
-- Section 10: Views and transition tables
----------------------------------------------------------------------
TRUNCATE tt_test;
INSERT INTO tt_test VALUES (1, 'a'), (2, 'b');
NOTICE:  tt_log_insert: tg_op=INSERT, new_table=(1,a), (2,b)
-- REFERENCING not allowed on INSTEAD OF triggers on views
CREATE VIEW tt_test_v AS SELECT * FROM tt_test;
CREATE FUNCTION tt_view_instead() RETURNS trigger LANGUAGE plpgsql AS $$
BEGIN
  RETURN NULL;
END;
$$;
-- expected: ERROR (REFERENCING clause not allowed with INSTEAD OF triggers)
CREATE TRIGGER tt_view_bad
  AFTER INSERT ON tt_test_v
  REFERENCING NEW TABLE AS new_table
  FOR EACH STATEMENT EXECUTE FUNCTION tt_view_instead();
ERROR:  "tt_test_v" is a view
DETAIL:  Triggers on views cannot have transition tables.
CREATE TRIGGER tt_view_bad
  INSTEAD OF INSERT ON tt_test_v
  REFERENCING NEW TABLE AS new_table
  FOR EACH ROW EXECUTE FUNCTION tt_view_instead();
ERROR:  "tt_test_v" is a view
DETAIL:  Triggers on views cannot have transition tables.
DROP FUNCTION tt_view_instead();
-- Auto-updatable view fires base table's transition-table trigger
INSERT INTO tt_test_v VALUES (10, 'via_view');
NOTICE:  tt_log_insert: tg_op=INSERT, new_table=(10,via_view)
UPDATE tt_test_v SET val = 'via_view_upd' WHERE id = 10;
NOTICE:  tt_log_update: tg_op=UPDATE, old_table=(10,via_view), new_table=(10,via_view_upd)
DELETE FROM tt_test_v WHERE id = 10;
NOTICE:  tt_log_delete: tg_op=DELETE, old_table=(10,via_view_upd)
DROP VIEW tt_test_v;
----------------------------------------------------------------------
-- Section 11: Inheritance / partition DELETE behavior
----------------------------------------------------------------------
-- DELETE on a leaf partition does NOT fire root-level statement
-- trigger (matches vanilla PG).  Trigger on root has transition table; we
-- DELETE directly from the leaf and expect no NOTICE from the root trigger.
CREATE TABLE tt_orders (id int, region text, qty int, PRIMARY KEY (id, region))
  PARTITION BY LIST (region);
CREATE TABLE tt_orders_us PARTITION OF tt_orders FOR VALUES IN ('US');
CREATE TABLE tt_orders_eu PARTITION OF tt_orders FOR VALUES IN ('EU');
INSERT INTO tt_orders VALUES (1, 'US', 5), (2, 'US', 25), (3, 'EU', 50);
CREATE TRIGGER tt_orders_del AFTER DELETE ON tt_orders
  REFERENCING OLD TABLE AS old_table
  FOR EACH STATEMENT EXECUTE FUNCTION tt_log_delete();
-- DELETE on the root -- trigger fires
DELETE FROM tt_orders WHERE qty >= 20;
NOTICE:  tt_log_delete: tg_op=DELETE, old_table=(2,US,25), (3,EU,50)
-- DELETE addressed directly to a leaf -- root trigger must NOT fire
INSERT INTO tt_orders VALUES (4, 'EU', 30);
DELETE FROM tt_orders_eu WHERE qty >= 20;
DROP TABLE tt_orders;
----------------------------------------------------------------------
-- Section 12: Multi-level (>2) hierarchy DELETE behavior
----------------------------------------------------------------------
-- Statement-level (transition table) triggers fire ONLY on the relation
-- explicitly named in the DML -- never on an ancestor above it, an
-- intermediate parent below it, or a leaf below it.  This is critical for
-- the YB planner fix in add_row_identity_columns(): when emitting the
-- wholerow junk attribute for a child relation, only the query's
-- resultRelation (the SQL-named target) needs to be consulted; intermediate
-- parents in the hierarchy cannot contribute a transition-table trigger.
CREATE FUNCTION tt_log_delete_mh() RETURNS trigger LANGUAGE plpgsql AS $$
BEGIN
  RAISE NOTICE 'fired: trigger=%, tg_table=%, old_table=%',
    TG_NAME, TG_TABLE_NAME,
    (SELECT string_agg(old_table::text, ', ' ORDER BY id) FROM old_table);
  RETURN NULL;
END;
$$;
-- 4-level partition hierarchy: tt_mh_a > tt_mh_b > tt_mh_c > tt_mh_d
CREATE TABLE tt_mh_a (id int, region text, qty int, PRIMARY KEY (id, region))
  PARTITION BY LIST (region);
CREATE TABLE tt_mh_b PARTITION OF tt_mh_a FOR VALUES IN ('US','EU')
  PARTITION BY LIST (region);
CREATE TABLE tt_mh_c PARTITION OF tt_mh_b FOR VALUES IN ('US')
  PARTITION BY LIST (region);
CREATE TABLE tt_mh_d PARTITION OF tt_mh_c FOR VALUES IN ('US');
CREATE TRIGGER tt_mh_a_del AFTER DELETE ON tt_mh_a
  REFERENCING OLD TABLE AS old_table
  FOR EACH STATEMENT EXECUTE FUNCTION tt_log_delete_mh();
CREATE TRIGGER tt_mh_b_del AFTER DELETE ON tt_mh_b
  REFERENCING OLD TABLE AS old_table
  FOR EACH STATEMENT EXECUTE FUNCTION tt_log_delete_mh();
CREATE TRIGGER tt_mh_c_del AFTER DELETE ON tt_mh_c
  REFERENCING OLD TABLE AS old_table
  FOR EACH STATEMENT EXECUTE FUNCTION tt_log_delete_mh();
CREATE TRIGGER tt_mh_d_del AFTER DELETE ON tt_mh_d
  REFERENCING OLD TABLE AS old_table
  FOR EACH STATEMENT EXECUTE FUNCTION tt_log_delete_mh();
INSERT INTO tt_mh_a VALUES (1,'US',10),(2,'US',20),(3,'US',30),(4,'US',40);
-- DELETE FROM tt_mh_b (intermediate) -- only tt_mh_b_del fires
DELETE FROM tt_mh_b WHERE qty IN (10, 20);
NOTICE:  fired: trigger=tt_mh_b_del, tg_table=tt_mh_b, old_table=(1,US,10), (2,US,20)
-- DELETE FROM tt_mh_c (intermediate) -- only tt_mh_c_del fires
DELETE FROM tt_mh_c WHERE qty = 30;
NOTICE:  fired: trigger=tt_mh_c_del, tg_table=tt_mh_c, old_table=(3,US,30)
-- DELETE FROM tt_mh_a (root) -- only tt_mh_a_del fires
DELETE FROM tt_mh_a WHERE qty = 40;
NOTICE:  fired: trigger=tt_mh_a_del, tg_table=tt_mh_a, old_table=(4,US,40)
-- DELETE FROM tt_mh_d (leaf) -- only tt_mh_d_del fires
INSERT INTO tt_mh_a VALUES (5,'US',50);
DELETE FROM tt_mh_d WHERE qty = 50;
NOTICE:  fired: trigger=tt_mh_d_del, tg_table=tt_mh_d, old_table=(5,US,50)
DROP TABLE tt_mh_a;
-- 4-level inheritance hierarchy: tt_ih_a > tt_ih_b > tt_ih_c > tt_ih_d
CREATE TABLE tt_ih_a (id int, val text);
CREATE TABLE tt_ih_b () INHERITS (tt_ih_a);
CREATE TABLE tt_ih_c () INHERITS (tt_ih_b);
CREATE TABLE tt_ih_d () INHERITS (tt_ih_c);
CREATE TRIGGER tt_ih_a_del AFTER DELETE ON tt_ih_a
  REFERENCING OLD TABLE AS old_table
  FOR EACH STATEMENT EXECUTE FUNCTION tt_log_delete_mh();
CREATE TRIGGER tt_ih_b_del AFTER DELETE ON tt_ih_b
  REFERENCING OLD TABLE AS old_table
  FOR EACH STATEMENT EXECUTE FUNCTION tt_log_delete_mh();
CREATE TRIGGER tt_ih_c_del AFTER DELETE ON tt_ih_c
  REFERENCING OLD TABLE AS old_table
  FOR EACH STATEMENT EXECUTE FUNCTION tt_log_delete_mh();
CREATE TRIGGER tt_ih_d_del AFTER DELETE ON tt_ih_d
  REFERENCING OLD TABLE AS old_table
  FOR EACH STATEMENT EXECUTE FUNCTION tt_log_delete_mh();
INSERT INTO tt_ih_a VALUES (1,'a1');
INSERT INTO tt_ih_b VALUES (2,'b1');
INSERT INTO tt_ih_c VALUES (3,'c1');
INSERT INTO tt_ih_d VALUES (4,'d1');
-- DELETE FROM tt_ih_b -- hits rows from B,C,D; only tt_ih_b_del fires
DELETE FROM tt_ih_b;
NOTICE:  fired: trigger=tt_ih_b_del, tg_table=tt_ih_b, old_table=(2,b1), (3,c1), (4,d1)
INSERT INTO tt_ih_c VALUES (3,'c1');
INSERT INTO tt_ih_d VALUES (4,'d1');
-- DELETE FROM tt_ih_c -- hits rows from C,D; only tt_ih_c_del fires
DELETE FROM tt_ih_c;
NOTICE:  fired: trigger=tt_ih_c_del, tg_table=tt_ih_c, old_table=(3,c1), (4,d1)
DROP TABLE tt_ih_a, tt_ih_b, tt_ih_c, tt_ih_d;
DROP FUNCTION tt_log_delete_mh();
----------------------------------------------------------------------
-- Section 13: IOCDU on partition with reordered + dropped columns
----------------------------------------------------------------------
-- Regression test for the fix in YbFlushSlotsFromBatch: the deferred
-- IOC batching path must restore tcs_original_insert_tuple to point at
-- the deep-copied root-format planSlot we kept, not the stale slot
-- ExecPrepareTupleRouting stashed at routing time.  If the slot's
-- tuple descriptor doesn't match the root's, the transition table
-- captures garbled columns -- visible here as wrong per-column values
-- or as a crash when varlena lengths are mismatched.
CREATE TABLE tt_ioc_root (a int UNIQUE, b text, c numeric)
  PARTITION BY LIST (a);
-- Child has a dropped column AND reordered remaining columns
CREATE TABLE tt_ioc_child (xdrop int, b text, c numeric, a int UNIQUE);
ALTER TABLE tt_ioc_child DROP COLUMN xdrop;
ALTER TABLE tt_ioc_root ATTACH PARTITION tt_ioc_child FOR VALUES IN (1,2,3,4);
CREATE FUNCTION tt_ioc_cap() RETURNS trigger LANGUAGE plpgsql AS $$
BEGIN
  IF TG_OP = 'UPDATE' THEN
    RAISE NOTICE 'UPDATE old per-col: %',
      (SELECT string_agg(format('a=%s/b=%s/c=%s', a, b, c), ', ' ORDER BY a)
         FROM old_table);
    RAISE NOTICE 'UPDATE new per-col: %',
      (SELECT string_agg(format('a=%s/b=%s/c=%s', a, b, c), ', ' ORDER BY a)
         FROM new_table);
  ELSE
    RAISE NOTICE 'INSERT new per-col: %',
      (SELECT string_agg(format('a=%s/b=%s/c=%s', a, b, c), ', ' ORDER BY a)
         FROM new_table);
  END IF;
  RETURN NULL;
END;
$$;
CREATE TRIGGER tt_ioc_root_ins AFTER INSERT ON tt_ioc_root
  REFERENCING NEW TABLE AS new_table
  FOR EACH STATEMENT EXECUTE FUNCTION tt_ioc_cap();
CREATE TRIGGER tt_ioc_root_upd AFTER UPDATE ON tt_ioc_root
  REFERENCING OLD TABLE AS old_table NEW TABLE AS new_table
  FOR EACH STATEMENT EXECUTE FUNCTION tt_ioc_cap();
-- Seed with the plain INSERT path
INSERT INTO tt_ioc_root (a,b,c) VALUES (1,'one',1.1), (2,'two',2.2);
NOTICE:  INSERT new per-col: a=1/b=one/c=1.1, a=2/b=two/c=2.2
-- IOCDU mixing inserts and updates with varied varlena lengths to
-- catch format-mismatch corruption.
INSERT INTO tt_ioc_root (a,b,c) VALUES
  (1, repeat('A',60),  11.11),
  (3, repeat('B',80),  33.33),
  (2, repeat('C',100), 22.22),
  (4, repeat('D',150), 44.44)
ON CONFLICT (a) DO UPDATE SET b = excluded.b, c = excluded.c;
NOTICE:  UPDATE old per-col: a=1/b=one/c=1.1, a=2/b=two/c=2.2
NOTICE:  UPDATE new per-col: a=1/b=AAAAAAAAAAAAAAAAAAAAAAAAAAAAAAAAAAAAAAAAAAAAAAAAAAAAAAAAAAAA/c=11.11, a=2/b=CCCCCCCCCCCCCCCCCCCCCCCCCCCCCCCCCCCCCCCCCCCCCCCCCCCCCCCCCCCCCCCCCCCCCCCCCCCCCCCCCCCCCCCCCCCCCCCCCCCC/c=22.22
NOTICE:  INSERT new per-col: a=3/b=BBBBBBBBBBBBBBBBBBBBBBBBBBBBBBBBBBBBBBBBBBBBBBBBBBBBBBBBBBBBBBBBBBBBBBBBBBBBBBBB/c=33.33, a=4/b=DDDDDDDDDDDDDDDDDDDDDDDDDDDDDDDDDDDDDDDDDDDDDDDDDDDDDDDDDDDDDDDDDDDDDDDDDDDDDDDDDDDDDDDDDDDDDDDDDDDDDDDDDDDDDDDDDDDDDDDDDDDDDDDDDDDDDDDDDDDDDDDDDDDDDD/c=44.44
-- Verify final state: column values and lengths must line up exactly.
SELECT a, length(b) AS b_len, left(b,1) AS b_first, c FROM tt_ioc_root ORDER BY a;
 a | b_len | b_first |   c   
---+-------+---------+-------
 1 |    60 | A       | 11.11
 2 |   100 | C       | 22.22
 3 |    80 | B       | 33.33
 4 |   150 | D       | 44.44
(4 rows)

DROP TABLE tt_ioc_root;
DROP FUNCTION tt_ioc_cap();
----------------------------------------------------------------------
-- Cleanup
----------------------------------------------------------------------
DROP TABLE tt_test;
DROP FUNCTION tt_log_insert();
DROP FUNCTION tt_log_update();
DROP FUNCTION tt_log_delete();
