-- hash pk
create table ybctid_test_hash(k int primary key, v text) split into 1 tablets;
insert into ybctid_test_hash values (1, 'one'), (2, 'two'), (3, 'three'), (4, 'four');
select ybctid, * from ybctid_test_hash;
         ybctid         | k |   v   
------------------------+---+-------
 \x47121048800000012121 | 1 | one
 \x479eaf48800000042121 | 4 | four
 \x47c0c448800000022121 | 2 | two
 \x47fca048800000032121 | 3 | three
(4 rows)

-------------
-- tid scan
-------------
explain (costs off)
select k, v from ybctid_test_hash where ybctid = '\x47121048800000012121';
                       QUERY PLAN                       
--------------------------------------------------------
 Tid Scan on ybctid_test_hash
   TID Cond: (ybctid = '\x47121048800000012121'::bytea)
(2 rows)

select k, v from ybctid_test_hash where ybctid = '\x47121048800000012121';
 k |  v  
---+-----
 1 | one
(1 row)

-- key for 5 is not in the table
explain (costs off)
select k, v from ybctid_test_hash where ybctid = '\x470a7348800000052121';
                       QUERY PLAN                       
--------------------------------------------------------
 Tid Scan on ybctid_test_hash
   TID Cond: (ybctid = '\x470a7348800000052121'::bytea)
(2 rows)

select k, v from ybctid_test_hash where ybctid = '\x470a7348800000052121';
 k | v 
---+---
(0 rows)

-- key is invalid
explain (costs off)
select k, v from ybctid_test_hash where ybctid = '\x0123456789abcdef';
                     QUERY PLAN                     
----------------------------------------------------
 Tid Scan on ybctid_test_hash
   TID Cond: (ybctid = '\x0123456789abcdef'::bytea)
(2 rows)

select k, v from ybctid_test_hash where ybctid = '\x0123456789abcdef';
 k | v 
---+---
(0 rows)

-- or semantics
explain (costs off)
select k, v from ybctid_test_hash where ybctid = '\x47121048800000012121' or ybctid = '\x47c0c448800000022121';
                                               QUERY PLAN                                               
--------------------------------------------------------------------------------------------------------
 Tid Scan on ybctid_test_hash
   TID Cond: ((ybctid = '\x47121048800000012121'::bytea) OR (ybctid = '\x47c0c448800000022121'::bytea))
(2 rows)

select k, v from ybctid_test_hash where ybctid = '\x47121048800000012121' or ybctid = '\x47c0c448800000022121';
 k |  v  
---+-----
 1 | one
 2 | two
(2 rows)

explain (costs off)
select k, v from ybctid_test_hash where ybctid = '\x47121048800000012121' or ybctid = '\x470a7348800000052121';
                                               QUERY PLAN                                               
--------------------------------------------------------------------------------------------------------
 Tid Scan on ybctid_test_hash
   TID Cond: ((ybctid = '\x47121048800000012121'::bytea) OR (ybctid = '\x470a7348800000052121'::bytea))
(2 rows)

select k, v from ybctid_test_hash where ybctid = '\x47121048800000012121' or ybctid = '\x470a7348800000052121';
 k |  v  
---+-----
 1 | one
(1 row)

explain (costs off)
select k, v from ybctid_test_hash where ybctid = '\x47121048800000012121' or ybctid = '\x47121048800000012121' or ybctid = '\x0123456789abcdef';
                                                                    QUERY PLAN                                                                    
--------------------------------------------------------------------------------------------------------------------------------------------------
 Tid Scan on ybctid_test_hash
   TID Cond: ((ybctid = '\x47121048800000012121'::bytea) OR (ybctid = '\x47121048800000012121'::bytea) OR (ybctid = '\x0123456789abcdef'::bytea))
(2 rows)

select k, v from ybctid_test_hash where ybctid = '\x47121048800000012121' or ybctid = '\x47121048800000012121' or ybctid = '\x0123456789abcdef';
 k |  v  
---+-----
 1 | one
(1 row)

-- in
explain (costs off)
select k, v from ybctid_test_hash where ybctid IN ('\x47fca048800000032121', '\x479eaf48800000042121');
                                          QUERY PLAN                                           
-----------------------------------------------------------------------------------------------
 Tid Scan on ybctid_test_hash
   TID Cond: (ybctid = ANY ('{"\\x47fca048800000032121","\\x479eaf48800000042121"}'::bytea[]))
(2 rows)

select k, v from ybctid_test_hash where ybctid IN ('\x47fca048800000032121', '\x479eaf48800000042121');
 k |   v   
---+-------
 4 | four
 3 | three
(2 rows)

explain (costs off)
select k, v from ybctid_test_hash where ybctid IN ('\x47fca048800000032121', '\x470a7348800000052121');
                                          QUERY PLAN                                           
-----------------------------------------------------------------------------------------------
 Tid Scan on ybctid_test_hash
   TID Cond: (ybctid = ANY ('{"\\x47fca048800000032121","\\x470a7348800000052121"}'::bytea[]))
(2 rows)

select k, v from ybctid_test_hash where ybctid IN ('\x47fca048800000032121', '\x470a7348800000052121');
 k |   v   
---+-------
 3 | three
(1 row)

explain (costs off)
select k, v from ybctid_test_hash where ybctid IN ('\x47fca048800000032121', '\x0123456789abcdef', '\x47fca048800000032121');
                                                     QUERY PLAN                                                      
---------------------------------------------------------------------------------------------------------------------
 Tid Scan on ybctid_test_hash
   TID Cond: (ybctid = ANY ('{"\\x47fca048800000032121","\\x0123456789abcdef","\\x47fca048800000032121"}'::bytea[]))
(2 rows)

select k, v from ybctid_test_hash where ybctid IN ('\x47fca048800000032121', '\x0123456789abcdef', '\x47fca048800000032121');
 k |   v   
---+-------
 3 | three
(1 row)

-- or + in
explain (costs off)
select k, v from ybctid_test_hash where ybctid = '\x47121048800000012121' or ybctid = '\x47c0c448800000022121'
              or ybctid IN ('\x47fca048800000032121', '\x479eaf48800000042121');
                                                                                         QUERY PLAN                                                                                          
---------------------------------------------------------------------------------------------------------------------------------------------------------------------------------------------
 Tid Scan on ybctid_test_hash
   TID Cond: ((ybctid = '\x47121048800000012121'::bytea) OR (ybctid = '\x47c0c448800000022121'::bytea) OR (ybctid = ANY ('{"\\x47fca048800000032121","\\x479eaf48800000042121"}'::bytea[])))
(2 rows)

select k, v from ybctid_test_hash where ybctid = '\x47121048800000012121' or ybctid = '\x47c0c448800000022121'
              or ybctid IN ('\x47fca048800000032121', '\x479eaf48800000042121');
 k |   v   
---+-------
 1 | one
 4 | four
 2 | two
 3 | three
(4 rows)

explain (costs off)
select k, v from ybctid_test_hash where ybctid = '\x470a7348800000052121' or ybctid = '\x47c0c448800000022121'
              or ybctid IN ('\x470a7348800000052121', '\x479eaf48800000042121');
                                                                                         QUERY PLAN                                                                                          
---------------------------------------------------------------------------------------------------------------------------------------------------------------------------------------------
 Tid Scan on ybctid_test_hash
   TID Cond: ((ybctid = '\x470a7348800000052121'::bytea) OR (ybctid = '\x47c0c448800000022121'::bytea) OR (ybctid = ANY ('{"\\x470a7348800000052121","\\x479eaf48800000042121"}'::bytea[])))
(2 rows)

select k, v from ybctid_test_hash where ybctid = '\x470a7348800000052121' or ybctid = '\x47c0c448800000022121'
              or ybctid IN ('\x470a7348800000052121', '\x479eaf48800000042121');
 k |  v   
---+------
 4 | four
 2 | two
(2 rows)

explain (costs off)
select k, v from ybctid_test_hash where ybctid = '\x0123456789abcdef' or ybctid = '\x47c0c448800000022121' or ybctid = '\x47c0c448800000022121'
              or ybctid IN ('\x0123456789abcdef', '\x479eaf48800000042121', '\x479eaf48800000042121', '\x47c0c448800000022121');
                                                                                                                                      QUERY PLAN                                                                                                                                       
---------------------------------------------------------------------------------------------------------------------------------------------------------------------------------------------------------------------------------------------------------------------------------------
 Tid Scan on ybctid_test_hash
   TID Cond: ((ybctid = '\x0123456789abcdef'::bytea) OR (ybctid = '\x47c0c448800000022121'::bytea) OR (ybctid = '\x47c0c448800000022121'::bytea) OR (ybctid = ANY ('{"\\x0123456789abcdef","\\x479eaf48800000042121","\\x479eaf48800000042121","\\x47c0c448800000022121"}'::bytea[])))
(2 rows)

select k, v from ybctid_test_hash where ybctid = '\x0123456789abcdef' or ybctid = '\x47c0c448800000022121' or ybctid = '\x47c0c448800000022121'
              or ybctid IN ('\x0123456789abcdef', '\x479eaf48800000042121', '\x479eaf48800000042121', '\x47c0c448800000022121');
 k |  v   
---+------
 4 | four
 2 | two
(2 rows)

-- expression pushdown
explain (costs off)
select k, v from ybctid_test_hash where
    ybctid IN ('\x47121048800000012121', '\x47c0c448800000022121', '\x47fca048800000032121', '\x479eaf48800000042121', '\x470a7348800000052121') and v like '%e';
                                                                                 QUERY PLAN                                                                                  
-----------------------------------------------------------------------------------------------------------------------------------------------------------------------------
 Tid Scan on ybctid_test_hash
   TID Cond: (ybctid = ANY ('{"\\x47121048800000012121","\\x47c0c448800000022121","\\x47fca048800000032121","\\x479eaf48800000042121","\\x470a7348800000052121"}'::bytea[]))
   Storage Filter: (v ~~ '%e'::text)
(3 rows)

select k, v from ybctid_test_hash where
    ybctid IN ('\x47121048800000012121', '\x47c0c448800000022121', '\x47fca048800000032121', '\x479eaf48800000042121', '\x470a7348800000052121') and v like '%e';
 k |   v   
---+-------
 1 | one
 3 | three
(2 rows)

set yb_enable_expression_pushdown to false;
explain (costs off)
select k, v from ybctid_test_hash where
    ybctid IN ('\x47121048800000012121', '\x47c0c448800000022121', '\x47fca048800000032121', '\x479eaf48800000042121', '\x470a7348800000052121') and v like '%e';
                                                                                 QUERY PLAN                                                                                  
-----------------------------------------------------------------------------------------------------------------------------------------------------------------------------
 Tid Scan on ybctid_test_hash
   TID Cond: (ybctid = ANY ('{"\\x47121048800000012121","\\x47c0c448800000022121","\\x47fca048800000032121","\\x479eaf48800000042121","\\x470a7348800000052121"}'::bytea[]))
   Filter: (v ~~ '%e'::text)
(3 rows)

select k, v from ybctid_test_hash where
    ybctid IN ('\x47121048800000012121', '\x47c0c448800000022121', '\x47fca048800000032121', '\x479eaf48800000042121', '\x470a7348800000052121') and v like '%e';
 k |   v   
---+-------
 1 | one
 3 | three
(2 rows)

reset yb_enable_expression_pushdown;
-- aggregate pushdown
explain (costs off)
select count(*), sum(k) from ybctid_test_hash where
    ybctid IN ('\x47121048800000012121', '\x47c0c448800000022121', '\x47fca048800000032121', '\x479eaf48800000042121', '\x470a7348800000052121');
                                                                                    QUERY PLAN                                                                                     
-----------------------------------------------------------------------------------------------------------------------------------------------------------------------------------
 Finalize Aggregate
   ->  Tid Scan on ybctid_test_hash
         TID Cond: (ybctid = ANY ('{"\\x47121048800000012121","\\x47c0c448800000022121","\\x47fca048800000032121","\\x479eaf48800000042121","\\x470a7348800000052121"}'::bytea[]))
         Partial Aggregate: true
(4 rows)

select count(*), sum(k) from ybctid_test_hash where
    ybctid IN ('\x47121048800000012121', '\x47c0c448800000022121', '\x47fca048800000032121', '\x479eaf48800000042121', '\x470a7348800000052121');
 count | sum 
-------+-----
     4 |  10
(1 row)

explain (costs off)
select count(*), sum(k) from ybctid_test_hash where
    ybctid IN ('\x47121048800000012121', '\x47c0c448800000022121', '\x47fca048800000032121', '\x479eaf48800000042121', '\x470a7348800000052121') and v like '%e';
                                                                                    QUERY PLAN                                                                                     
-----------------------------------------------------------------------------------------------------------------------------------------------------------------------------------
 Finalize Aggregate
   ->  Tid Scan on ybctid_test_hash
         TID Cond: (ybctid = ANY ('{"\\x47121048800000012121","\\x47c0c448800000022121","\\x47fca048800000032121","\\x479eaf48800000042121","\\x470a7348800000052121"}'::bytea[]))
         Storage Filter: (v ~~ '%e'::text)
         Partial Aggregate: true
(5 rows)

select count(*), sum(k) from ybctid_test_hash where
    ybctid IN ('\x47121048800000012121', '\x47c0c448800000022121', '\x47fca048800000032121', '\x479eaf48800000042121', '\x470a7348800000052121') and v like '%e';
 count | sum 
-------+-----
     2 |   4
(1 row)

set yb_enable_expression_pushdown to false;
explain (costs off)
select count(*), sum(k) from ybctid_test_hash where
    ybctid IN ('\x47121048800000012121', '\x47c0c448800000022121', '\x47fca048800000032121', '\x479eaf48800000042121', '\x470a7348800000052121') and v like '%e';
                                                                                    QUERY PLAN                                                                                     
-----------------------------------------------------------------------------------------------------------------------------------------------------------------------------------
 Aggregate
   ->  Tid Scan on ybctid_test_hash
         TID Cond: (ybctid = ANY ('{"\\x47121048800000012121","\\x47c0c448800000022121","\\x47fca048800000032121","\\x479eaf48800000042121","\\x470a7348800000052121"}'::bytea[]))
         Filter: (v ~~ '%e'::text)
(4 rows)

select count(*), sum(k) from ybctid_test_hash where
    ybctid IN ('\x47121048800000012121', '\x47c0c448800000022121', '\x47fca048800000032121', '\x479eaf48800000042121', '\x470a7348800000052121') and v like '%e';
 count | sum 
-------+-----
     2 |   4
(1 row)

reset yb_enable_expression_pushdown;
-- join
create table ybctid_test_hash_master(k_int int, k_data bytea, primary key(k_int asc));
insert into ybctid_test_hash_master values (1, '\x47121048800000012121'), (2, '\x47c0c448800000022121'), (3, '\x47fca048800000032121'),
                                           (4, '\x479eaf48800000042121'), (5, '\x470a7348800000052121');
explain (costs off)
/*+ NestLoop(ybctid_test_hash_master ybctid_test_hash) Leading((ybctid_test_hash_master ybctid_test_hash)) */ select k_int, v from ybctid_test_hash_master join ybctid_test_hash on k_data = ybctid_test_hash.ybctid;
                         QUERY PLAN                          
-------------------------------------------------------------
 Nested Loop
   ->  Seq Scan on ybctid_test_hash_master
   ->  Tid Scan on ybctid_test_hash
         TID Cond: (ybctid = ybctid_test_hash_master.k_data)
(4 rows)

/*+ NestLoop(ybctid_test_hash_master ybctid_test_hash) Leading((ybctid_test_hash_master ybctid_test_hash)) */ select k_int, v from ybctid_test_hash_master join ybctid_test_hash on k_data = ybctid_test_hash.ybctid;
 k_int |   v   
-------+-------
     1 | one
     2 | two
     3 | three
     4 | four
(4 rows)

drop table ybctid_test_hash_master;
select ybctid, k, v from ybctid_test_hash order by ybctid;
         ybctid         | k |   v   
------------------------+---+-------
 \x47121048800000012121 | 1 | one
 \x479eaf48800000042121 | 4 | four
 \x47c0c448800000022121 | 2 | two
 \x47fca048800000032121 | 3 | three
(4 rows)

create index on ybctid_test_hash(v);
explain (costs off)
select ybctid, * from ybctid_test_hash where v = 'one';
                         QUERY PLAN                          
-------------------------------------------------------------
 Index Scan using ybctid_test_hash_v_idx on ybctid_test_hash
   Index Cond: (v = 'one'::text)
(2 rows)

select ybctid, * from ybctid_test_hash where v = 'one';
         ybctid         | k |  v  
------------------------+---+-----
 \x47121048800000012121 | 1 | one
(1 row)

drop table ybctid_test_hash;
-- range pk
create table ybctid_test_range(k int, v text, primary key(k asc));
insert into ybctid_test_range values (1, 'one'), (2, 'two'), (3, 'three'), (4, 'four');
select ybctid, * from ybctid_test_range;
     ybctid     | k |   v   
----------------+---+-------
 \x488000000121 | 1 | one
 \x488000000221 | 2 | two
 \x488000000321 | 3 | three
 \x488000000421 | 4 | four
(4 rows)

-------------
-- tid scan
-------------
explain (costs off)
select k, v from ybctid_test_range where ybctid = '\x488000000121';
                   QUERY PLAN                   
------------------------------------------------
 Tid Scan on ybctid_test_range
   TID Cond: (ybctid = '\x488000000121'::bytea)
(2 rows)

select k, v from ybctid_test_range where ybctid = '\x488000000121';
 k |  v  
---+-----
 1 | one
(1 row)

-- key for 5 is not in the table
explain (costs off)
select k, v from ybctid_test_range where ybctid = '\x488000000521';
                   QUERY PLAN                   
------------------------------------------------
 Tid Scan on ybctid_test_range
   TID Cond: (ybctid = '\x488000000521'::bytea)
(2 rows)

select k, v from ybctid_test_range where ybctid = '\x488000000521';
 k | v 
---+---
(0 rows)

-- key is invalid
explain (costs off)
select k, v from ybctid_test_range where ybctid = '\x0123456789abcdef';
                     QUERY PLAN                     
----------------------------------------------------
 Tid Scan on ybctid_test_range
   TID Cond: (ybctid = '\x0123456789abcdef'::bytea)
(2 rows)

select k, v from ybctid_test_range where ybctid = '\x0123456789abcdef';
 k | v 
---+---
(0 rows)

-- or semantics
explain (costs off)
select k, v from ybctid_test_range where ybctid = '\x488000000121' or ybctid = '\x488000000221';
                                       QUERY PLAN                                       
----------------------------------------------------------------------------------------
 Tid Scan on ybctid_test_range
   TID Cond: ((ybctid = '\x488000000121'::bytea) OR (ybctid = '\x488000000221'::bytea))
(2 rows)

select k, v from ybctid_test_range where ybctid = '\x488000000121' or ybctid = '\x488000000221';
 k |  v  
---+-----
 1 | one
 2 | two
(2 rows)

explain (costs off)
select k, v from ybctid_test_range where ybctid = '\x488000000121' or ybctid = '\x488000000521';
                                       QUERY PLAN                                       
----------------------------------------------------------------------------------------
 Tid Scan on ybctid_test_range
   TID Cond: ((ybctid = '\x488000000121'::bytea) OR (ybctid = '\x488000000521'::bytea))
(2 rows)

select k, v from ybctid_test_range where ybctid = '\x488000000121' or ybctid = '\x488000000521';
 k |  v  
---+-----
 1 | one
(1 row)

explain (costs off)
select k, v from ybctid_test_range where ybctid = '\x488000000121' or ybctid = '\x488000000121' or ybctid = '\x0123456789abcdef';
                                                            QUERY PLAN                                                            
----------------------------------------------------------------------------------------------------------------------------------
 Tid Scan on ybctid_test_range
   TID Cond: ((ybctid = '\x488000000121'::bytea) OR (ybctid = '\x488000000121'::bytea) OR (ybctid = '\x0123456789abcdef'::bytea))
(2 rows)

select k, v from ybctid_test_range where ybctid = '\x488000000121' or ybctid = '\x488000000121' or ybctid = '\x0123456789abcdef';
 k |  v  
---+-----
 1 | one
(1 row)

-- in
explain (costs off)
select k, v from ybctid_test_range where ybctid IN ('\x488000000321', '\x488000000421');
                                  QUERY PLAN                                   
-------------------------------------------------------------------------------
 Tid Scan on ybctid_test_range
   TID Cond: (ybctid = ANY ('{"\\x488000000321","\\x488000000421"}'::bytea[]))
(2 rows)

select k, v from ybctid_test_range where ybctid IN ('\x488000000321', '\x488000000421');
 k |   v   
---+-------
 3 | three
 4 | four
(2 rows)

explain (costs off)
select k, v from ybctid_test_range where ybctid IN ('\x488000000321', '\x488000000521');
                                  QUERY PLAN                                   
-------------------------------------------------------------------------------
 Tid Scan on ybctid_test_range
   TID Cond: (ybctid = ANY ('{"\\x488000000321","\\x488000000521"}'::bytea[]))
(2 rows)

select k, v from ybctid_test_range where ybctid IN ('\x488000000321', '\x488000000521');
 k |   v   
---+-------
 3 | three
(1 row)

explain (costs off)
select k, v from ybctid_test_range where ybctid IN ('\x488000000321', '\x0123456789abcdef', '\x488000000321');
                                             QUERY PLAN                                              
-----------------------------------------------------------------------------------------------------
 Tid Scan on ybctid_test_range
   TID Cond: (ybctid = ANY ('{"\\x488000000321","\\x0123456789abcdef","\\x488000000321"}'::bytea[]))
(2 rows)

select k, v from ybctid_test_range where ybctid IN ('\x488000000321', '\x0123456789abcdef', '\x488000000321');
 k |   v   
---+-------
 3 | three
(1 row)

-- or + in
explain (costs off)
select k, v from ybctid_test_range where ybctid = '\x488000000121' or ybctid = '\x488000000221'
                                      or ybctid IN ('\x488000000321', '\x488000000421');
                                                                         QUERY PLAN                                                                          
-------------------------------------------------------------------------------------------------------------------------------------------------------------
 Tid Scan on ybctid_test_range
   TID Cond: ((ybctid = '\x488000000121'::bytea) OR (ybctid = '\x488000000221'::bytea) OR (ybctid = ANY ('{"\\x488000000321","\\x488000000421"}'::bytea[])))
(2 rows)

select k, v from ybctid_test_range where ybctid = '\x488000000121' or ybctid = '\x488000000221'
                                      or ybctid IN ('\x488000000321', '\x488000000421');
 k |   v   
---+-------
 1 | one
 2 | two
 3 | three
 4 | four
(4 rows)

explain (costs off)
select k, v from ybctid_test_range where ybctid = '\x488000000521' or ybctid = '\x488000000221'
                                      or ybctid IN ('\x488000000521', '\x488000000421');
                                                                         QUERY PLAN                                                                          
-------------------------------------------------------------------------------------------------------------------------------------------------------------
 Tid Scan on ybctid_test_range
   TID Cond: ((ybctid = '\x488000000521'::bytea) OR (ybctid = '\x488000000221'::bytea) OR (ybctid = ANY ('{"\\x488000000521","\\x488000000421"}'::bytea[])))
(2 rows)

select k, v from ybctid_test_range where ybctid = '\x488000000521' or ybctid = '\x488000000221'
                                      or ybctid IN ('\x488000000521', '\x488000000421');
 k |  v   
---+------
 2 | two
 4 | four
(2 rows)

explain (costs off)
select k, v from ybctid_test_range where ybctid = '\x0123456789abcdef' or ybctid = '\x488000000221' or ybctid = '\x488000000221'
                                      or ybctid IN ('\x0123456789abcdef', '\x488000000421', '\x488000000421', '\x488000000221');
                                                                                                                  QUERY PLAN                                                                                                                   
-----------------------------------------------------------------------------------------------------------------------------------------------------------------------------------------------------------------------------------------------
 Tid Scan on ybctid_test_range
   TID Cond: ((ybctid = '\x0123456789abcdef'::bytea) OR (ybctid = '\x488000000221'::bytea) OR (ybctid = '\x488000000221'::bytea) OR (ybctid = ANY ('{"\\x0123456789abcdef","\\x488000000421","\\x488000000421","\\x488000000221"}'::bytea[])))
(2 rows)

select k, v from ybctid_test_range where ybctid = '\x0123456789abcdef' or ybctid = '\x488000000221' or ybctid = '\x488000000221'
                                      or ybctid IN ('\x0123456789abcdef', '\x488000000421', '\x488000000421', '\x488000000221');
 k |  v   
---+------
 2 | two
 4 | four
(2 rows)

-- expression pushdown
explain (costs off)
select k, v from ybctid_test_range where
    ybctid IN ('\x488000000121', '\x488000000221', '\x488000000321', '\x488000000421', '\x488000000521') and v like '%e';
                                                             QUERY PLAN                                                              
-------------------------------------------------------------------------------------------------------------------------------------
 Tid Scan on ybctid_test_range
   TID Cond: (ybctid = ANY ('{"\\x488000000121","\\x488000000221","\\x488000000321","\\x488000000421","\\x488000000521"}'::bytea[]))
   Storage Filter: (v ~~ '%e'::text)
(3 rows)

select k, v from ybctid_test_range where
    ybctid IN ('\x488000000121', '\x488000000221', '\x488000000321', '\x488000000421', '\x488000000521') and v like '%e';
 k |   v   
---+-------
 1 | one
 3 | three
(2 rows)

set yb_enable_expression_pushdown to false;
explain (costs off)
select k, v from ybctid_test_range where
    ybctid IN ('\x488000000121', '\x488000000221', '\x488000000321', '\x488000000421', '\x488000000521') and v like '%e';
                                                             QUERY PLAN                                                              
-------------------------------------------------------------------------------------------------------------------------------------
 Tid Scan on ybctid_test_range
   TID Cond: (ybctid = ANY ('{"\\x488000000121","\\x488000000221","\\x488000000321","\\x488000000421","\\x488000000521"}'::bytea[]))
   Filter: (v ~~ '%e'::text)
(3 rows)

select k, v from ybctid_test_range where
    ybctid IN ('\x488000000121', '\x488000000221', '\x488000000321', '\x488000000421', '\x488000000521') and v like '%e';
 k |   v   
---+-------
 1 | one
 3 | three
(2 rows)

reset yb_enable_expression_pushdown;
-- aggregate pushdown
explain (costs off)
select count(*), sum(k) from ybctid_test_range where
    ybctid IN ('\x488000000121', '\x488000000221', '\x488000000321', '\x488000000421', '\x488000000521');
                                                                QUERY PLAN                                                                 
-------------------------------------------------------------------------------------------------------------------------------------------
 Finalize Aggregate
   ->  Tid Scan on ybctid_test_range
         TID Cond: (ybctid = ANY ('{"\\x488000000121","\\x488000000221","\\x488000000321","\\x488000000421","\\x488000000521"}'::bytea[]))
         Partial Aggregate: true
(4 rows)

select count(*), sum(k) from ybctid_test_range where
    ybctid IN ('\x488000000121', '\x488000000221', '\x488000000321', '\x488000000421', '\x488000000521');
 count | sum 
-------+-----
     4 |  10
(1 row)

explain (costs off)
select count(*), sum(k) from ybctid_test_range where
    ybctid IN ('\x488000000121', '\x488000000221', '\x488000000321', '\x488000000421', '\x488000000521') and v like '%e';
                                                                QUERY PLAN                                                                 
-------------------------------------------------------------------------------------------------------------------------------------------
 Finalize Aggregate
   ->  Tid Scan on ybctid_test_range
         TID Cond: (ybctid = ANY ('{"\\x488000000121","\\x488000000221","\\x488000000321","\\x488000000421","\\x488000000521"}'::bytea[]))
         Storage Filter: (v ~~ '%e'::text)
         Partial Aggregate: true
(5 rows)

select count(*), sum(k) from ybctid_test_range where
    ybctid IN ('\x488000000121', '\x488000000221', '\x488000000321', '\x488000000421', '\x488000000521') and v like '%e';
 count | sum 
-------+-----
     2 |   4
(1 row)

set yb_enable_expression_pushdown to false;
explain (costs off)
select count(*), sum(k) from ybctid_test_range where
    ybctid IN ('\x488000000121', '\x488000000221', '\x488000000321', '\x488000000421', '\x488000000521') and v like '%e';
                                                                QUERY PLAN                                                                 
-------------------------------------------------------------------------------------------------------------------------------------------
 Aggregate
   ->  Tid Scan on ybctid_test_range
         TID Cond: (ybctid = ANY ('{"\\x488000000121","\\x488000000221","\\x488000000321","\\x488000000421","\\x488000000521"}'::bytea[]))
         Filter: (v ~~ '%e'::text)
(4 rows)

select count(*), sum(k) from ybctid_test_range where
    ybctid IN ('\x488000000121', '\x488000000221', '\x488000000321', '\x488000000421', '\x488000000521') and v like '%e';
 count | sum 
-------+-----
     2 |   4
(1 row)

reset yb_enable_expression_pushdown;
-- join
create table ybctid_test_range_master(k_int int, k_data bytea, primary key(k_int desc));
insert into ybctid_test_range_master values (1, '\x488000000121'), (2, '\x488000000221'), (3, '\x488000000321'),
                                            (4, '\x488000000421'), (5, '\x488000000521');
explain (costs off)
/*+ NestLoop(ybctid_test_range_master ybctid_test_range) Leading((ybctid_test_range_master ybctid_test_range)) */ select k_int, v from ybctid_test_range_master join ybctid_test_range on k_data = ybctid_test_range.ybctid;
                          QUERY PLAN                          
--------------------------------------------------------------
 Nested Loop
   ->  Seq Scan on ybctid_test_range_master
   ->  Tid Scan on ybctid_test_range
         TID Cond: (ybctid = ybctid_test_range_master.k_data)
(4 rows)

/*+ NestLoop(ybctid_test_range_master ybctid_test_range) Leading((ybctid_test_range_master ybctid_test_range)) */ select k_int, v from ybctid_test_range_master join ybctid_test_range on k_data = ybctid_test_range.ybctid;
 k_int |   v   
-------+-------
     4 | four
     3 | three
     2 | two
     1 | one
(4 rows)

drop table ybctid_test_range_master;
select ybctid, k, v from ybctid_test_range order by ybctid;
     ybctid     | k |   v   
----------------+---+-------
 \x488000000121 | 1 | one
 \x488000000221 | 2 | two
 \x488000000321 | 3 | three
 \x488000000421 | 4 | four
(4 rows)

create index on ybctid_test_range(v asc);
explain (costs off)
select ybctid, * from ybctid_test_range where v = 'one';
                          QUERY PLAN                           
---------------------------------------------------------------
 Index Scan using ybctid_test_range_v_idx on ybctid_test_range
   Index Cond: (v = 'one'::text)
(2 rows)

select ybctid, * from ybctid_test_range where v = 'one';
     ybctid     | k |  v  
----------------+---+-----
 \x488000000121 | 1 | one
(1 row)

drop table ybctid_test_range;
-- hash + range pk
create table ybctid_test_hash_range(k1 int, k2 int, k3 text, v text,
                                    primary key((k1, k2) hash, k3 asc));
insert into ybctid_test_hash_range values (1, 4, 'one', 'four'), (2, 3, 'two', 'three'),
                                          (3, 2, 'three', 'two'), (4, 1, 'four', 'one');
select ybctid, * from ybctid_test_hash_range;
                      ybctid                      | k1 | k2 |  k3   |   v   
--------------------------------------------------+----+----+-------+-------
 \x4707b64880000003488000000221537468726565000021 |  3 |  2 | three | two
 \x47801748800000024880000003215374776f000021     |  2 |  3 | two   | three
 \x478343488000000448800000012153666f7572000021   |  4 |  1 | four  | one
 \x47a9014880000001488000000421536f6e65000021     |  1 |  4 | one   | four
(4 rows)

explain (costs off)
select k1, k2, k3, v from ybctid_test_hash_range where ybctid = '\x4707b64880000003488000000221537468726565000021';
                                    QUERY PLAN                                    
----------------------------------------------------------------------------------
 Tid Scan on ybctid_test_hash_range
   TID Cond: (ybctid = '\x4707b64880000003488000000221537468726565000021'::bytea)
(2 rows)

select k1, k2, k3, v from ybctid_test_hash_range where ybctid = '\x4707b64880000003488000000221537468726565000021';
 k1 | k2 |  k3   |  v  
----+----+-------+-----
  3 |  2 | three | two
(1 row)

explain (costs off)
select k1, k2, k3, v from ybctid_test_hash_range where
    ybctid in ('\x47a9014880000001488000000421536f6e65000021', '\x47801748800000024880000003215374776f000021');
                                                                QUERY PLAN                                                                 
-------------------------------------------------------------------------------------------------------------------------------------------
 Tid Scan on ybctid_test_hash_range
   TID Cond: (ybctid = ANY ('{"\\x47a9014880000001488000000421536f6e65000021","\\x47801748800000024880000003215374776f000021"}'::bytea[]))
(2 rows)

select k1, k2, k3, v from ybctid_test_hash_range where
    ybctid in ('\x47a9014880000001488000000421536f6e65000021', '\x47801748800000024880000003215374776f000021');
 k1 | k2 | k3  |   v   
----+----+-----+-------
  2 |  3 | two | three
  1 |  4 | one | four
(2 rows)

explain (costs off)
select k1, k2, k3, v from ybctid_test_hash_range where
    ybctid = '\x47a9014880000001488000000421536f6e65000021' or
    ybctid = '\x0123456789abcdef' or
    ybctid in ('\x47a9014880000001488000000421536f6e65000021', '\x47801748800000024880000003215374776f000021', '\x4783434880000004488000000121536f6e65000021');
                                                                                                                                                QUERY PLAN                                                                                                                                                 
-----------------------------------------------------------------------------------------------------------------------------------------------------------------------------------------------------------------------------------------------------------------------------------------------------------
 Tid Scan on ybctid_test_hash_range
   TID Cond: ((ybctid = '\x47a9014880000001488000000421536f6e65000021'::bytea) OR (ybctid = '\x0123456789abcdef'::bytea) OR (ybctid = ANY ('{"\\x47a9014880000001488000000421536f6e65000021","\\x47801748800000024880000003215374776f000021","\\x4783434880000004488000000121536f6e65000021"}'::bytea[])))
(2 rows)

select k1, k2, k3, v from ybctid_test_hash_range where
    ybctid = '\x47a9014880000001488000000421536f6e65000021' or
    ybctid = '\x0123456789abcdef' or
    ybctid in ('\x47a9014880000001488000000421536f6e65000021', '\x47801748800000024880000003215374776f000021', '\x4783434880000004488000000121536f6e65000021');
 k1 | k2 | k3  |   v   
----+----+-----+-------
  2 |  3 | two | three
  1 |  4 | one | four
(2 rows)

select ybctid, k1, k2, k3, v from ybctid_test_hash_range order by ybctid;
                      ybctid                      | k1 | k2 |  k3   |   v   
--------------------------------------------------+----+----+-------+-------
 \x4707b64880000003488000000221537468726565000021 |  3 |  2 | three | two
 \x47801748800000024880000003215374776f000021     |  2 |  3 | two   | three
 \x478343488000000448800000012153666f7572000021   |  4 |  1 | four  | one
 \x47a9014880000001488000000421536f6e65000021     |  1 |  4 | one   | four
(4 rows)

create index on ybctid_test_hash_range(v desc);
explain (costs off)
select ybctid, * from ybctid_test_hash_range where v = 'one';
                               QUERY PLAN                                
-------------------------------------------------------------------------
 Index Scan using ybctid_test_hash_range_v_idx on ybctid_test_hash_range
   Index Cond: (v = 'one'::text)
(2 rows)

select ybctid, * from ybctid_test_hash_range where v = 'one';
                     ybctid                     | k1 | k2 |  k3  |  v  
------------------------------------------------+----+----+------+-----
 \x478343488000000448800000012153666f7572000021 |  4 |  1 | four | one
(1 row)

drop table ybctid_test_hash_range;
-- no pk, ybctid are random, test can't show them or sort by them
create table ybctid_test_nopk(k int, v text);
insert into ybctid_test_nopk values (1, 'one'), (2, 'two'), (3, 'three'), (4, 'four');
CREATE OR REPLACE FUNCTION rows_by_ybctid() RETURNS TABLE (kp int, vp text)
AS $$
DECLARE rowid bytea;
BEGIN
  FOR rowid IN select ybctid from ybctid_test_nopk order by k
  LOOP
    RETURN QUERY select k, v from ybctid_test_nopk where ybctid = rowid;
  END LOOP;
END
$$ LANGUAGE plpgsql;
select * from rows_by_ybctid();
 kp |  vp   
----+-------
  1 | one
  2 | two
  3 | three
  4 | four
(4 rows)

drop function rows_by_ybctid;
drop table ybctid_test_nopk;
-- colocated tables
create database codb colocation = true;
\c codb
-- with pk
create table ybctid_test_with_pk(k int, v text, primary key(k asc)) with (colocation=true);
insert into ybctid_test_with_pk values (1, 'one'), (2, 'two'), (3, 'three'), (4, 'four');
select ybctid, * from ybctid_test_with_pk;
     ybctid     | k |   v   
----------------+---+-------
 \x488000000121 | 1 | one
 \x488000000221 | 2 | two
 \x488000000321 | 3 | three
 \x488000000421 | 4 | four
(4 rows)

explain (costs off)
select k, v from ybctid_test_with_pk where ybctid = '\x488000000121';
                   QUERY PLAN                   
------------------------------------------------
 Tid Scan on ybctid_test_with_pk
   TID Cond: (ybctid = '\x488000000121'::bytea)
(2 rows)

select k, v from ybctid_test_with_pk where ybctid = '\x488000000121';
 k |  v  
---+-----
 1 | one
(1 row)

-- key for 5 is not in the table
explain (costs off)
select k, v from ybctid_test_with_pk where ybctid = '\x488000000521';
                   QUERY PLAN                   
------------------------------------------------
 Tid Scan on ybctid_test_with_pk
   TID Cond: (ybctid = '\x488000000521'::bytea)
(2 rows)

select k, v from ybctid_test_with_pk where ybctid = '\x488000000521';
 k | v 
---+---
(0 rows)

-- key is invalid
explain (costs off)
select k, v from ybctid_test_with_pk where ybctid = '\x0123456789abcdef';
                     QUERY PLAN                     
----------------------------------------------------
 Tid Scan on ybctid_test_with_pk
   TID Cond: (ybctid = '\x0123456789abcdef'::bytea)
(2 rows)

select k, v from ybctid_test_with_pk where ybctid = '\x0123456789abcdef';
 k | v 
---+---
(0 rows)

-- or semantics
explain (costs off)
select k, v from ybctid_test_with_pk where ybctid = '\x488000000121' or ybctid = '\x488000000221';
                                       QUERY PLAN                                       
----------------------------------------------------------------------------------------
 Tid Scan on ybctid_test_with_pk
   TID Cond: ((ybctid = '\x488000000121'::bytea) OR (ybctid = '\x488000000221'::bytea))
(2 rows)

select k, v from ybctid_test_with_pk where ybctid = '\x488000000121' or ybctid = '\x488000000221';
 k |  v  
---+-----
 1 | one
 2 | two
(2 rows)

explain (costs off)
select k, v from ybctid_test_with_pk where ybctid = '\x488000000121' or ybctid = '\x488000000521';
                                       QUERY PLAN                                       
----------------------------------------------------------------------------------------
 Tid Scan on ybctid_test_with_pk
   TID Cond: ((ybctid = '\x488000000121'::bytea) OR (ybctid = '\x488000000521'::bytea))
(2 rows)

select k, v from ybctid_test_with_pk where ybctid = '\x488000000121' or ybctid = '\x488000000521';
 k |  v  
---+-----
 1 | one
(1 row)

explain (costs off)
select k, v from ybctid_test_with_pk where ybctid = '\x488000000121' or ybctid = '\x488000000121' or ybctid = '\x0123456789abcdef';
                                                            QUERY PLAN                                                            
----------------------------------------------------------------------------------------------------------------------------------
 Tid Scan on ybctid_test_with_pk
   TID Cond: ((ybctid = '\x488000000121'::bytea) OR (ybctid = '\x488000000121'::bytea) OR (ybctid = '\x0123456789abcdef'::bytea))
(2 rows)

select k, v from ybctid_test_with_pk where ybctid = '\x488000000121' or ybctid = '\x488000000121' or ybctid = '\x0123456789abcdef';
 k |  v  
---+-----
 1 | one
(1 row)

-- in
explain (costs off)
select k, v from ybctid_test_with_pk where ybctid IN ('\x488000000321', '\x488000000421');
                                  QUERY PLAN                                   
-------------------------------------------------------------------------------
 Tid Scan on ybctid_test_with_pk
   TID Cond: (ybctid = ANY ('{"\\x488000000321","\\x488000000421"}'::bytea[]))
(2 rows)

select k, v from ybctid_test_with_pk where ybctid IN ('\x488000000321', '\x488000000421');
 k |   v   
---+-------
 3 | three
 4 | four
(2 rows)

explain (costs off)
select k, v from ybctid_test_with_pk where ybctid IN ('\x488000000321', '\x488000000521');
                                  QUERY PLAN                                   
-------------------------------------------------------------------------------
 Tid Scan on ybctid_test_with_pk
   TID Cond: (ybctid = ANY ('{"\\x488000000321","\\x488000000521"}'::bytea[]))
(2 rows)

select k, v from ybctid_test_with_pk where ybctid IN ('\x488000000321', '\x488000000521');
 k |   v   
---+-------
 3 | three
(1 row)

explain (costs off)
select k, v from ybctid_test_with_pk where ybctid IN ('\x488000000321', '\x0123456789abcdef', '\x488000000321');
                                             QUERY PLAN                                              
-----------------------------------------------------------------------------------------------------
 Tid Scan on ybctid_test_with_pk
   TID Cond: (ybctid = ANY ('{"\\x488000000321","\\x0123456789abcdef","\\x488000000321"}'::bytea[]))
(2 rows)

select k, v from ybctid_test_with_pk where ybctid IN ('\x488000000321', '\x0123456789abcdef', '\x488000000321');
 k |   v   
---+-------
 3 | three
(1 row)

-- or + in
explain (costs off)
select k, v from ybctid_test_with_pk where ybctid = '\x488000000121' or ybctid = '\x488000000221'
                                      or ybctid IN ('\x488000000321', '\x488000000421');
                                                                         QUERY PLAN                                                                          
-------------------------------------------------------------------------------------------------------------------------------------------------------------
 Tid Scan on ybctid_test_with_pk
   TID Cond: ((ybctid = '\x488000000121'::bytea) OR (ybctid = '\x488000000221'::bytea) OR (ybctid = ANY ('{"\\x488000000321","\\x488000000421"}'::bytea[])))
(2 rows)

select k, v from ybctid_test_with_pk where ybctid = '\x488000000121' or ybctid = '\x488000000221'
                                      or ybctid IN ('\x488000000321', '\x488000000421');
 k |   v   
---+-------
 1 | one
 2 | two
 3 | three
 4 | four
(4 rows)

explain (costs off)
select k, v from ybctid_test_with_pk where ybctid = '\x488000000521' or ybctid = '\x488000000221'
                                      or ybctid IN ('\x488000000521', '\x488000000421');
                                                                         QUERY PLAN                                                                          
-------------------------------------------------------------------------------------------------------------------------------------------------------------
 Tid Scan on ybctid_test_with_pk
   TID Cond: ((ybctid = '\x488000000521'::bytea) OR (ybctid = '\x488000000221'::bytea) OR (ybctid = ANY ('{"\\x488000000521","\\x488000000421"}'::bytea[])))
(2 rows)

select k, v from ybctid_test_with_pk where ybctid = '\x488000000521' or ybctid = '\x488000000221'
                                      or ybctid IN ('\x488000000521', '\x488000000421');
 k |  v   
---+------
 2 | two
 4 | four
(2 rows)

explain (costs off)
select k, v from ybctid_test_with_pk where ybctid = '\x0123456789abcdef' or ybctid = '\x488000000221' or ybctid = '\x488000000221'
                                      or ybctid IN ('\x0123456789abcdef', '\x488000000421', '\x488000000421', '\x488000000221');
                                                                                                                  QUERY PLAN                                                                                                                   
-----------------------------------------------------------------------------------------------------------------------------------------------------------------------------------------------------------------------------------------------
 Tid Scan on ybctid_test_with_pk
   TID Cond: ((ybctid = '\x0123456789abcdef'::bytea) OR (ybctid = '\x488000000221'::bytea) OR (ybctid = '\x488000000221'::bytea) OR (ybctid = ANY ('{"\\x0123456789abcdef","\\x488000000421","\\x488000000421","\\x488000000221"}'::bytea[])))
(2 rows)

select k, v from ybctid_test_with_pk where ybctid = '\x0123456789abcdef' or ybctid = '\x488000000221' or ybctid = '\x488000000221'
                                      or ybctid IN ('\x0123456789abcdef', '\x488000000421', '\x488000000421', '\x488000000221');
 k |  v   
---+------
 2 | two
 4 | four
(2 rows)

select ybctid, k, v from ybctid_test_with_pk order by ybctid;
     ybctid     | k |   v   
----------------+---+-------
 \x488000000121 | 1 | one
 \x488000000221 | 2 | two
 \x488000000321 | 3 | three
 \x488000000421 | 4 | four
(4 rows)

drop table ybctid_test_with_pk;
-- without pk
create table ybctid_test_without_pk(k int, v text) with (colocation=true);
insert into ybctid_test_without_pk values (1, 'one'), (2, 'two'), (3, 'three'), (4, 'four');
CREATE OR REPLACE FUNCTION rows_by_ybctid() RETURNS TABLE (kp int, vp text)
AS $$
DECLARE rowid bytea;
BEGIN
  FOR rowid IN select ybctid from ybctid_test_without_pk order by k
  LOOP
    RETURN QUERY select k, v from ybctid_test_without_pk where ybctid = rowid;
  END LOOP;
END
$$ LANGUAGE plpgsql;
select * from rows_by_ybctid();
 kp |  vp   
----+-------
  1 | one
  2 | two
  3 | three
  4 | four
(4 rows)

drop function rows_by_ybctid;
drop table ybctid_test_without_pk;
--
-- Test ybctid in RETURNING clause of DML queries
--
\c yugabyte
CREATE TABLE ybctid_test_hash_range (k1 INT, k2 TEXT, v INT, PRIMARY KEY (k1 HASH, k2 ASC));
-- Basic DML queries
-- Queries that return > 1 row are wrapped in a CTE to impose an ordering on the returned rows.
INSERT INTO ybctid_test_hash_range VALUES (1, 'one', 1), (2, 'two', 2), (3, 'three', 3), (4, 'four', 4) RETURNING *, ybctid;
 k1 |  k2   | v |                 ybctid                 
----+-------+---+----------------------------------------
  1 | one   | 1 | \x471210488000000121536f6e65000021
  2 | two   | 2 | \x47c0c44880000002215374776f000021
  3 | three | 3 | \x47fca0488000000321537468726565000021
  4 | four  | 4 | \x479eaf48800000042153666f7572000021
(4 rows)

WITH cte AS (UPDATE ybctid_test_hash_range SET v = v + 1 WHERE k1 < 10 RETURNING *, ybctid)
SELECT * FROM cte ORDER BY k1, k2;
 k1 |  k2   | v |                 ybctid                 
----+-------+---+----------------------------------------
  1 | one   | 2 | \x471210488000000121536f6e65000021
  2 | two   | 3 | \x47c0c44880000002215374776f000021
  3 | three | 4 | \x47fca0488000000321537468726565000021
  4 | four  | 5 | \x479eaf48800000042153666f7572000021
(4 rows)

UPDATE ybctid_test_hash_range SET k2 = k2 || '_updated', v = v + 1 WHERE k1 = 2 RETURNING *, ybctid;
 k1 |     k2      | v |                       ybctid                       
----+-------------+---+----------------------------------------------------
  2 | two_updated | 4 | \x47c0c44880000002215374776f5f75706461746564000021
(1 row)

UPDATE ybctid_test_hash_range SET k1 = k1 + 5, k2 = k2 || '_updated' WHERE k2 = 'three' RETURNING *, ybctid;
 k1 |      k2       | v |                         ybctid                         
----+---------------+---+--------------------------------------------------------
  8 | three_updated | 4 | \x47c3a24880000008215374687265655f75706461746564000021
(1 row)

UPDATE ybctid_test_hash_range SET k1 = k1 + 5 WHERE ybctid = '\x479eaf48800000042153666f7572000021' RETURNING *, ybctid;
 k1 |  k2  | v |                ybctid                
----+------+---+--------------------------------------
  9 | four | 5 | \x475d6048800000092153666f7572000021
(1 row)

WITH cte AS (DELETE FROM ybctid_test_hash_range WHERE k1 < 10 RETURNING *, ybctid)
SELECT * FROM cte ORDER BY k1, k2;
 k1 |      k2       | v |                         ybctid                         
----+---------------+---+--------------------------------------------------------
  1 | one           | 2 | \x471210488000000121536f6e65000021
  2 | two_updated   | 4 | \x47c0c44880000002215374776f5f75706461746564000021
  8 | three_updated | 4 | \x47c3a24880000008215374687265655f75706461746564000021
  9 | four          | 5 | \x475d6048800000092153666f7572000021
(4 rows)

-- Single shard queries
INSERT INTO ybctid_test_hash_range VALUES (5, 'five', 5) RETURNING *, ybctid;
 k1 |  k2  | v |                ybctid                
----+------+---+--------------------------------------
  5 | five | 5 | \x470a734880000005215366697665000021
(1 row)

UPDATE ybctid_test_hash_range SET v = v + 1 WHERE k1 = 5 AND k2 = 'five' RETURNING k1, k2, ybctid;
 k1 |  k2  |                ybctid                
----+------+--------------------------------------
  5 | five | \x470a734880000005215366697665000021
(1 row)

DELETE FROM ybctid_test_hash_range WHERE k1 = 5 AND k2 = 'five' RETURNING k2, ybctid;
  k2  |                ybctid                
------+--------------------------------------
 five | \x470a734880000005215366697665000021
(1 row)

-- INSERT ... ON CONFLICT queries
INSERT INTO ybctid_test_hash_range VALUES (6, 'six', 6), (7, 'seven', 7) ON CONFLICT (k1, k2) DO NOTHING RETURNING *, ybctid;
 k1 |  k2   | v |                 ybctid                 
----+-------+---+----------------------------------------
  6 | six   | 6 | \x474e5848800000062153736978000021
  7 | seven | 7 | \x4752cf48800000072153736576656e000021
(2 rows)

INSERT INTO ybctid_test_hash_range VALUES (7, 'seven', 7), (8, 'eight', 8) ON CONFLICT (k1, k2) DO NOTHING RETURNING *, ybctid;
 k1 |  k2   | v |                 ybctid                 
----+-------+---+----------------------------------------
  8 | eight | 8 | \x47c3a2488000000821536569676874000021
(1 row)

INSERT INTO ybctid_test_hash_range VALUES (9, 'nine', 9), (8, 'eight', 8) ON CONFLICT (k1, k2) DO UPDATE SET v = EXCLUDED.v + 1 RETURNING *, ybctid;
 k1 |  k2   | v |                 ybctid                 
----+-------+---+----------------------------------------
  9 | nine  | 9 | \x475d60488000000921536e696e65000021
  8 | eight | 9 | \x47c3a2488000000821536569676874000021
(2 rows)

-- Expressions in the RETURNING clause
INSERT INTO ybctid_test_hash_range VALUES (10, 'ten', 10), (11, 'eleven', 11)
  RETURNING (k2 || '-' || k1::TEXT) AS keys, (k1 + v) AS nums, (ybctid || '-' || ybctid) AS dblybctid, ybctid;
   keys    | nums |                                    dblybctid                                     |                  ybctid                  
-----------+------+----------------------------------------------------------------------------------+------------------------------------------
 ten-10    |   20 | \x4771cf488000000a215374656e0000212d4771cf488000000a215374656e000021             | \x4771cf488000000a215374656e000021
 eleven-11 |   22 | \x471c99488000000b2153656c6576656e0000212d471c99488000000b2153656c6576656e000021 | \x471c99488000000b2153656c6576656e000021
(2 rows)

UPDATE ybctid_test_hash_range SET v = v + 1 WHERE k1 = 10
  RETURNING (k2 || '-' || k1::TEXT) AS keys, (k1 + v) AS nums, (ybctid || '-' || ybctid) AS dblybctid, ybctid;
  keys  | nums |                              dblybctid                               |               ybctid               
--------+------+----------------------------------------------------------------------+------------------------------------
 ten-10 |   21 | \x4771cf488000000a215374656e0000212d4771cf488000000a215374656e000021 | \x4771cf488000000a215374656e000021
(1 row)

UPDATE ybctid_test_hash_range SET k2 = k2 || '_updated' WHERE k1 = 11
  RETURNING (k2 || '-' || k1::TEXT) AS keys, (k1 + v) AS nums, (ybctid || '-' || ybctid) AS dblybctid, ybctid;
       keys        | nums |                                                    dblybctid                                                     |                          ybctid                          
-------------------+------+------------------------------------------------------------------------------------------------------------------+----------------------------------------------------------
 eleven_updated-11 |   22 | \x471c99488000000b2153656c6576656e5f757064617465640000212d471c99488000000b2153656c6576656e5f75706461746564000021 | \x471c99488000000b2153656c6576656e5f75706461746564000021
(1 row)

DELETE FROM ybctid_test_hash_range WHERE k1 = 10
  RETURNING (k2 || '-' || k1::TEXT) AS keys, (k1 + v) AS nums, (ybctid || '-' || ybctid) AS dblybctid, ybctid;
  keys  | nums |                              dblybctid                               |               ybctid               
--------+------+----------------------------------------------------------------------+------------------------------------
 ten-10 |   21 | \x4771cf488000000a215374656e0000212d4771cf488000000a215374656e000021 | \x4771cf488000000a215374656e000021
(1 row)

DELETE FROM ybctid_test_hash_range WHERE ybctid = '\x471c99488000000b2153656c6576656e5f75706461746564000021'
  RETURNING (k2 || '-' || k1::TEXT) AS keys, (k1 + v) AS nums, (ybctid || '-' || ybctid) AS dblybctid, ybctid;
       keys        | nums |                                                    dblybctid                                                     |                          ybctid                          
-------------------+------+------------------------------------------------------------------------------------------------------------------+----------------------------------------------------------
 eleven_updated-11 |   22 | \x471c99488000000b2153656c6576656e5f757064617465640000212d471c99488000000b2153656c6576656e5f75706461746564000021 | \x471c99488000000b2153656c6576656e5f75706461746564000021
(1 row)

-- Triggers modifying key columns
CREATE OR REPLACE FUNCTION increment_k1() RETURNS TRIGGER AS $$
BEGIN
	IF TG_OP = 'DELETE' THEN
		OLD.k1 = OLD.k1 + 2;
		RETURN OLD;
	ELSE
		NEW.k1 = NEW.k1 + 2;
		RETURN NEW;
	END IF;
END;
$$ LANGUAGE plpgsql;
CREATE TRIGGER increment_k1_trigger BEFORE INSERT OR UPDATE OR DELETE ON ybctid_test_hash_range FOR EACH ROW EXECUTE PROCEDURE increment_k1();
-- Returned ybctid should have 0x20
INSERT INTO ybctid_test_hash_range VALUES (30, 'thirty', 30) RETURNING *, ybctid;
 k1 |   k2   | v  |                  ybctid                  
----+--------+----+------------------------------------------
 32 | thirty | 30 | \x47540e48800000202153746869727479000021
(1 row)

-- Returned ybctid should have 0x22
UPDATE ybctid_test_hash_range SET k2 = k2 || '_updated', v = v + 1 WHERE k1 = 32 RETURNING *, ybctid;
 k1 |       k2       | v  |                          ybctid                          
----+----------------+----+----------------------------------------------------------
 34 | thirty_updated | 31 | \x478bb8488000002221537468697274795f75706461746564000021
(1 row)

-- Returned ybctid should have 0x22
DELETE FROM ybctid_test_hash_range WHERE k1 > 30 AND k1 < 40 RETURNING *, ybctid;
 k1 |       k2       | v  |                          ybctid                          
----+----------------+----+----------------------------------------------------------
 34 | thirty_updated | 31 | \x478bb8488000002221537468697274795f75706461746564000021
(1 row)

SELECT * FROM ybctid_test_hash_range ORDER BY k1;
 k1 |  k2   | v 
----+-------+---
  6 | six   | 6
  7 | seven | 7
  8 | eight | 9
  9 | nine  | 9
(4 rows)

DROP TABLE ybctid_test_hash_range;
