-- Create a table with columns of different types and sizes.
CREATE TABLE base (a INT4 PRIMARY KEY, b TEXT, c BOOL) PARTITION BY RANGE (a);
-- Attach partitions with columns in different order.
CREATE TABLE part1 (c BOOL, b TEXT, a INT4 NOT NULL);
CREATE TABLE part2 (b TEXT, a INT4 PRIMARY KEY, c BOOL);
CREATE TABLE part3 (a INT4 UNIQUE NOT NULL, c BOOL, b TEXT);
ALTER TABLE base ATTACH PARTITION part1 FOR VALUES FROM (11) TO (21);
NOTICE:  table rewrite may lead to inconsistencies
DETAIL:  Concurrent DMLs may not be reflected in the new table.
HINT:  See https://github.com/yugabyte/yugabyte-db/issues/19860. Set 'ysql_suppress_unsafe_alter_notice' yb-tserver gflag to true to suppress this notice.
ALTER TABLE base ATTACH PARTITION part2 FOR VALUES FROM (21) TO (31);
ALTER TABLE base ATTACH PARTITION part3 FOR VALUES FROM (31) TO (41);
CREATE TABLE part4 (a BOOL, c TEXT, b INT4 PRIMARY KEY);
-- Error: names and types of columns should match
ALTER TABLE base ATTACH PARTITION part4 FOR VALUES FROM (41) TO (51);
ERROR:  child table "part4" has different type for column "a"
DROP TABLE part4;
CREATE TABLE part5 (c INT4 PRIMARY KEY, a TEXT, B BOOL);
-- Error: names and types of columns should match
ALTER TABLE base ATTACH PARTITION part5 FOR VALUES FROM (51) TO (61);
ERROR:  child table "part5" has different type for column "a"
DROP TABLE part5;
-- Attach a hierarchy of partitions with columns in different order
CREATE TABLE part6 (b TEXT, a INT NOT NULL, c BOOL) PARTITION BY LIST (a);
ALTER TABLE base ATTACH PARTITION part6 FOR VALUES FROM (61) TO (71);
NOTICE:  table rewrite may lead to inconsistencies
DETAIL:  Concurrent DMLs may not be reflected in the new table.
HINT:  See https://github.com/yugabyte/yugabyte-db/issues/19860. Set 'ysql_suppress_unsafe_alter_notice' yb-tserver gflag to true to suppress this notice.
CREATE TABLE part6a (a INT NOT NULL, b TEXT, c BOOL);
CREATE TABLE part6b (c BOOL, b TEXT, a INT NOT NULL);
ALTER TABLE part6 ATTACH PARTITION part6a FOR VALUES IN ((61), (62), (63), (64), (65));
NOTICE:  table rewrite may lead to inconsistencies
DETAIL:  Concurrent DMLs may not be reflected in the new table.
HINT:  See https://github.com/yugabyte/yugabyte-db/issues/19860. Set 'ysql_suppress_unsafe_alter_notice' yb-tserver gflag to true to suppress this notice.
ALTER TABLE part6 ATTACH PARTITION part6b FOR VALUES IN
 ((66), (67), (68), (69), (70));
NOTICE:  table rewrite may lead to inconsistencies
DETAIL:  Concurrent DMLs may not be reflected in the new table.
HINT:  See https://github.com/yugabyte/yugabyte-db/issues/19860. Set 'ysql_suppress_unsafe_alter_notice' yb-tserver gflag to true to suppress this notice.
CREATE TABLE partmisc (a INT NOT NULL, b TEXT, c BOOL);
ALTER TABLE base ATTACH PARTITION partmisc FOR VALUES FROM (100) TO (1000);
NOTICE:  table rewrite may lead to inconsistencies
DETAIL:  Concurrent DMLs may not be reflected in the new table.
HINT:  See https://github.com/yugabyte/yugabyte-db/issues/19860. Set 'ysql_suppress_unsafe_alter_notice' yb-tserver gflag to true to suppress this notice.
-- Inserts should be routed to the correct partition and inserted in the format
-- of the child partition.
INSERT INTO base VALUES (11, 'foo', TRUE);
INSERT INTO base VALUES (12, 'bar', TRUE), (21, 'baz', FALSE), (31, 'qux', TRUE);
INSERT INTO base (b, c, a) VALUES ('abc', 0::bool, 13), ('caz', TRUE, 22), ('xuq', FALSE, 32);
INSERT INTO base (b, a, c) VALUES ('part6a-abc', 61, FALSE), ('part6b-abc', 66, TRUE), ('partmisc-abc', 100, TRUE);
-- Error: When the main table is specified, the columns in the input should match the main table
-- rather than the partition to which the insert is routed.
INSERT INTO base VALUES (FALSE, 'def', 14);
ERROR:  column "a" is of type integer but expression is of type boolean
LINE 1: INSERT INTO base VALUES (FALSE, 'def', 14);
                                 ^
HINT:  You will need to rewrite or cast the expression.
-- Inserts that fetch values from a SELECT must also be of the correct format.
INSERT INTO base (SELECT b, c, a + 12 FROM part1);
ERROR:  column "a" is of type integer but expression is of type text
LINE 1: INSERT INTO base (SELECT b, c, a + 12 FROM part1);
                                 ^
HINT:  You will need to rewrite or cast the expression.
BEGIN;
INSERT INTO base (a, b, c) (SELECT a + 12, b, c FROM part1);
INSERT INTO base (SELECT a + 12, b, c FROM part2);
SELECT * FROM base ORDER BY a;
  a  |      b       | c 
-----+--------------+---
  11 | foo          | t
  12 | bar          | t
  13 | abc          | f
  21 | baz          | f
  22 | caz          | t
  23 | foo          | t
  24 | bar          | t
  25 | abc          | f
  31 | qux          | t
  32 | xuq          | f
  33 | baz          | f
  34 | caz          | t
  35 | foo          | t
  36 | bar          | t
  37 | abc          | f
  61 | part6a-abc   | f
  66 | part6b-abc   | t
 100 | partmisc-abc | t
(18 rows)

ROLLBACK;
SELECT * FROM base ORDER BY a;
  a  |      b       | c 
-----+--------------+---
  11 | foo          | t
  12 | bar          | t
  13 | abc          | f
  21 | baz          | f
  22 | caz          | t
  31 | qux          | t
  32 | xuq          | f
  61 | part6a-abc   | f
  66 | part6b-abc   | t
 100 | partmisc-abc | t
(10 rows)

-- INSERTs that directly insert into a child partition.
INSERT INTO part1 (a, b) VALUES (14, 'not-def');
INSERT INTO part2 VALUES ('daz', 26, TRUE), ('faz', 27, FALSE);
INSERT INTO part3 (SELECT a + 12, c, b FROM part2 WHERE a IN (26, 27));
SELECT * FROM base ORDER BY a;
  a  |      b       | c 
-----+--------------+---
  11 | foo          | t
  12 | bar          | t
  13 | abc          | f
  14 | not-def      | 
  21 | baz          | f
  22 | caz          | t
  26 | daz          | t
  27 | faz          | f
  31 | qux          | t
  32 | xuq          | f
  38 | daz          | t
  39 | faz          | f
  61 | part6a-abc   | f
  66 | part6b-abc   | t
 100 | partmisc-abc | t
(15 rows)

-- INSERT .. ON CONFLICT DO NOTHING cases
INSERT INTO base VALUES (11, 'doodoo', FALSE) ON CONFLICT DO NOTHING;
INSERT INTO base (a, b, c) VALUES (21, 'caz', TRUE) ON CONFLICT (a) DO NOTHING;
INSERT INTO base (c, b, a) VALUES (TRUE, 'abc', 26), (TRUE, 'abc', 26) ON CONFLICT (a) DO NOTHING;
INSERT INTO base (a, b, c) VALUES (11, 'aaa', TRUE), (31, 'ccc', FALSE), (21, 'bbb', TRUE) ON CONFLICT (a) DO NOTHING;
INSERT INTO base (a, b, c) VALUES (61, 'part6a-def', FALSE), (67, 'part6b-def', TRUE) ON CONFLICT DO NOTHING;
INSERT INTO part1 (a, b) VALUES (14, 'not-abc') ON CONFLICT DO NOTHING;
INSERT INTO part2 VALUES ('not-daz', 26, FALSE) ON CONFLICT (a) DO NOTHING;
INSERT INTO part3 (SELECT a + 6, c, b FROM part2 WHERE a IN (26, 27)) ON CONFLICT DO NOTHING;
SELECT * FROM base ORDER BY a;
  a  |      b       | c 
-----+--------------+---
  11 | foo          | t
  12 | bar          | t
  13 | abc          | f
  14 | not-def      | 
  21 | baz          | f
  22 | caz          | t
  26 | daz          | t
  27 | faz          | f
  31 | qux          | t
  32 | xuq          | f
  33 | faz          | f
  38 | daz          | t
  39 | faz          | f
  61 | part6a-abc   | f
  66 | part6b-abc   | t
  67 | part6b-def   | t
 100 | partmisc-abc | t
(17 rows)

-- INSERT .. ON CONFLICT DO UPDATE cases
-- Update partitioned column
INSERT INTO base VALUES (11, 'doodoo', FALSE), (12, 'zoozoo', FALSE), (21, 'bazbaz', FALSE) ON CONFLICT (a) DO UPDATE SET a = EXCLUDED.a;
INSERT INTO base VALUES (11, 'doodoo', FALSE), (12, 'zoozoo', FALSE), (21, 'bazbaz', FALSE) ON CONFLICT (a) DO UPDATE SET a = base.a;
INSERT INTO base (a, b) VALUES (15, 'ghi'), (62, 'part6a-def'), (100, 'partmisc-abc') ON CONFLICT (a) DO UPDATE SET a = EXCLUDED.a + 1;
-- Update both partitioned and non-partitioned columns
INSERT INTO base AS old (a, b, c) VALUES (11, 'doodoo', FALSE), (12, 'zoozoo', FALSE), (21, 'bazbaz', FALSE) ON CONFLICT (a) DO UPDATE SET b = old.b || 'z';
INSERT INTO base AS old (b, c, a) VALUES ('bar', TRUE, 13), ('baz', FALSE, 22), ('qux', TRUE, 33) ON CONFLICT (a) DO UPDATE SET b = old.b || 'z';
INSERT INTO base AS old (a) VALUES (22), (32), (62) ON CONFLICT (a) DO UPDATE SET b = old.b || 'y', a = EXCLUDED.a;
-- Update multiple columns in the column list format
INSERT INTO base AS old (a) VALUES (22), (32), (62) ON CONFLICT (a) DO UPDATE SET (b, a, c) = (old.b || 'y', EXCLUDED.a, NOT old.c);
-- Update columns with implicit type casting
INSERT INTO base (a, b, c) VALUES (38, 'dazzle', TRUE) ON CONFLICT (a) DO UPDATE SET (c, b, a) = (0::BOOL, 'dazz'::VARCHAR, 38.0);
-- Perform constraint checking as a constraint
INSERT INTO base AS old (a) VALUES (11), (102), (68) ON CONFLICT ON CONSTRAINT base_pkey DO UPDATE SET b = old.b || 'z';
-- Error: Moving between partitions should be recognized and disallowed.
INSERT INTO base VALUES(11, 'aaa', TRUE), (21, 'bbb', TRUE) ON CONFLICT (a) DO UPDATE SET a = base.a + 15;
ERROR:  invalid ON UPDATE specification
DETAIL:  The result tuple would appear in a different partition than the original tuple.
INSERT INTO base VALUES(61, 'aaa', TRUE), (66, 'bbb', TRUE) ON CONFLICT (a) DO UPDATE SET b = EXCLUDED.b || 'z', a = base.a + 5;
ERROR:  invalid ON UPDATE specification
DETAIL:  The result tuple would appear in a different partition than the original tuple.
INSERT INTO part1 VALUES (TRUE, 'def', 14), (TRUE, 'ghi', 15) ON CONFLICT (a) DO UPDATE SET b = 'not-' || part1.b;
INSERT INTO part3 AS old (a, b, c) VALUES (31, 'qux', TRUE), (39, 'fax', TRUE) ON CONFLICT (a) DO UPDATE SET b = EXCLUDED.b || 'x';
INSERT INTO part6 VALUES ('part6a-def', 61, FALSE), ('part6b-def', 66, TRUE) ON CONFLICT (a) DO UPDATE SET (b, c) = (EXCLUDED.b || 'z', NOT EXCLUDED.c);
SELECT * FROM base ORDER BY a;
  a  |      b       | c 
-----+--------------+---
  11 | foozz        | t
  12 | barz         | t
  13 | abcz         | f
  14 | not-not-def  | 
  15 | not-ghi      | 
  21 | bazz         | f
  22 | cazzyy       | f
  26 | daz          | t
  27 | faz          | f
  31 | quxx         | t
  32 | xuqyy        | t
  33 | fazz         | f
  38 | dazz         | f
  39 | faxx         | f
  61 | part6a-defz  | t
  62 | part6a-defyy | 
  66 | part6b-defz  | f
  67 | part6b-def   | t
  68 |              | 
 101 | partmisc-abc | t
 102 |              | 
(21 rows)

-- UPDATE cases
-- Updates affecting a single partition to the correct partition and in the correct format.
UPDATE base SET a = a, b = 'y' || b WHERE a IN (21, 31);
-- Updates spanning multiples partitions must supply tuples in the correct format.
UPDATE base SET b = 'updated-' || b WHERE a % 10 = 2;
UPDATE base SET (c, b) = ((c::INT + 1)::BOOL, 'test-' || b) WHERE a % 10 = 6;
-- Updates affecting the partition key should be handled correctly when the
-- affected row moves between partitions.
UPDATE base SET a = a + 10, b = b || 'z' WHERE a IN (15, 27, 101);
-- Updates targeting a specific partition should work as expected.
UPDATE part1 SET c = NOT c, a = a + 2 WHERE a BETWEEN 60 AND 65 RETURNING *; -- no rows affected
 c | b | a 
---+---+---
(0 rows)

UPDATE part6a SET c = NOT c, a = a + 2 WHERE a BETWEEN 60 AND 65 RETURNING c, b, a;
 c |          b           | a  
---+----------------------+----
 f | part6a-defz          | 63
   | updated-part6a-defyy | 64
(2 rows)

UPDATE part2 SET b = 'y' || b WHERE a % 10 = 1;
UPDATE part3 SET (b, c) = (b || 'z', NOT c) WHERE a >= 33 AND a <= 38;
SELECT * FROM base ORDER BY a;
  a  |          b           | c 
-----+----------------------+---
  11 | foozz                | t
  12 | updated-barz         | t
  13 | abcz                 | f
  14 | not-not-def          | 
  21 | yybazz               | f
  22 | updated-cazzyy       | f
  25 | not-ghiz             | 
  26 | test-daz             | t
  31 | yquxx                | t
  32 | updated-xuqyy        | t
  33 | fazzz                | t
  37 | fazzz                | t
  38 | dazzz                | t
  39 | faxx                 | f
  63 | part6a-defz          | f
  64 | updated-part6a-defyy | 
  66 | test-part6b-defz     | t
  67 | part6b-def           | t
  68 |                      | 
 102 |                      | 
 111 | partmisc-abcz        | t
(21 rows)

TRUNCATE base;
-- GH-25147: Test UPDATE projections with partitions out-of-order.
INSERT INTO base VALUES (11, 'foo', TRUE), (21, 'bar', TRUE), (31, 'baz', FALSE);
UPDATE base SET (a, b) = (SELECT base.a, base.b || 'z');
UPDATE base SET (b, c, a) = (SELECT base.b || 'y', NOT base.c, base.a);
UPDATE base SET (b, c, a) = (SELECT base.b || 'y', base.c, base.a + 1);
INSERT INTO base (a, b) VALUES (12, 'foo'), (32, 'baz') ON CONFLICT(a) DO UPDATE SET (a, b) = (SELECT EXCLUDED.a, base.b || 'x');
SELECT * FROM base ORDER BY a;
 a  |    b    | c 
----+---------+---
 12 | foozyyx | f
 22 | barzyy  | f
 32 | bazzyyx | t
(3 rows)

