--
-- Testing foreign key constraint check when types mismatch.
--
-- This test ensures that the foreign key constraint check uses the
-- batched DocDB lookup path when types mismatch.
--
-- Templated type pairs run yb_commands/foreign_key_when_types_mismatch_helper.sql
-- after CREATE TABLE, CREATE UNIQUE INDEX parent_v1_key ... SPLIT INTO 1 TABLETS,
-- and setting v1-v5, trap_parent_val, trap_child_val.
-- The helper covers: CASCADE, multi row insert, COPY, out of range,
-- SET NULL, NO ACTION deferrable (including deferred COMMIT fail), RESTRICT deferrable,
-- partial null composite update, SET DEFAULT composite, and MATCH FULL.
--
-- Covered type pairs (each runs the helper via \i):
--  * int2 -> int4, int4 -> int8, int2 -> int8 (widening, implicit cast)
--  * int4 -> int2, int8 -> int2, int8 -> int4 (narrowing, assignment cast)
--  * int2 -> bigserial, int4 -> bigserial, int8 -> bigserial
--  * int2 -> serial, int4 -> serial, int2 -> smallserial, smallserial -> bigserial
--  * text -> varchar, varchar -> text
--
-- Inline-only (structural or catalog-specific; not in helper):
--  * VARCHAR(3)/TEXT length overflow (cannot use generic parent/child shape)
--  * composite FK (3+ columns), multi-parent FK, partitioned/attach partition
--  * pg_constraint/pg_cast/pg_proc cache, ON CONFLICT, self-referential FK
--
\set VERBOSITY default
SHOW yb_enable_fkey_batched_docdb_lookup_when_types_mismatch; -- should be true
 yb_enable_fkey_batched_docdb_lookup_when_types_mismatch 
---------------------------------------------------------
 on
(1 row)

-- int2 to int4
CREATE TABLE parent(h INT PRIMARY KEY, v1 INT) SPLIT INTO 1 TABLETS;
CREATE UNIQUE INDEX parent_v1_key ON parent(v1) SPLIT INTO 1 TABLETS;
CREATE TABLE child(h INT PRIMARY KEY, v1 SMALLINT, FOREIGN KEY(v1) REFERENCES parent(v1)
  ON DELETE CASCADE ON UPDATE CASCADE) SPLIT INTO 1 TABLETS;
\set v1 456
\set v2 458
\set v3 457
\set v4 460
\set v5 999
\set trap_parent_val -32767
\set trap_child_val 32769
\i yb_commands/foreign_key_when_types_mismatch_helper.sql
--
-- Helper for yb.orig.foreign_key_when_types_mismatch.sql.
--
-- Driver must CREATE parent(h, v1) and child(h, v1) with ON DELETE/UPDATE CASCADE.
-- parent(v1) must be backed by parent_v1_key with SPLIT INTO 1 TABLETS so FK batched
-- lookups hit a single tablet. Then set psql variables:
--   v1, v2, v3, v4, v5
--   trap_parent_val, trap_child_val
--
-- Each scenario inserts its own rows (parent h from 1, child h from 100001),
-- then TRUNCATEs both tables. The helper ends by dropping parent and child.
--
-- Scenarios (in order):
--   CASCADE, multi row insert, COPY, out of range insert/update,
--   SET NULL, NO ACTION deferrable (including COMMIT fail),
--   RESTRICT deferrable, partial null composite update, SET DEFAULT composite, MATCH FULL
--
-- CASCADE
INSERT INTO parent VALUES (1, :'v1');
INSERT INTO child VALUES (1, :'v1'); -- warm up catalog cache
DELETE FROM child WHERE h = 1; -- undo changes due to warm up
BEGIN TRANSACTION ISOLATION LEVEL SERIALIZABLE;
EXPLAIN (DIST, ANALYZE, COSTS OFF) INSERT INTO child VALUES (100001, :'v1');
                  QUERY PLAN                   
-----------------------------------------------
 Insert on child (actual rows=0 loops=1)
   ->  Result *RESULT* (actual rows=1 loops=1)
         Storage Table Write Requests: 1
 Trigger for constraint child_v1_fkey: calls=1
 Storage Read Requests: 1
 Storage Read Ops: 1
 Storage Rows Scanned: 1
 Storage Write Requests: 1
 Storage Flush Requests: 1
(9 rows)

COMMIT;
SELECT count(*) FROM child;
 count 
-------
     1
(1 row)

ALTER TABLE child DROP CONSTRAINT child_v1_fkey;
ALTER TABLE child ADD CONSTRAINT child_v1_fkey FOREIGN KEY(v1) REFERENCES parent(v1)
  ON DELETE CASCADE ON UPDATE CASCADE;
UPDATE parent SET v1 = :'v3' WHERE h = 1;
SELECT count(*) FROM child WHERE h = 100001 AND v1 = :'v3';
 count 
-------
     1
(1 row)

DELETE FROM parent WHERE h = 1;
SELECT count(*) FROM child;
 count 
-------
     0
(1 row)

INSERT INTO parent VALUES (1, :'v1');
INSERT INTO child VALUES (100002, :'v5'); -- should fail: no matching parent key
ysqlsh:yb_commands/foreign_key_when_types_mismatch_helper.sql:35: ERROR:  insert or update on table "child" violates foreign key constraint "child_v1_fkey"
DETAIL:  Key (v1)=(999) is not present in table "parent".
SELECT count(*) FROM child;
 count 
-------
     0
(1 row)

TRUNCATE child, parent;
-- multi row insert
INSERT INTO parent VALUES (1, :'v1'), (2, :'v2'), (3, :'v3');
INSERT INTO child VALUES (1, :'v1'); -- warm up catalog cache
DELETE FROM child WHERE h = 1; -- undo changes due to warm up
-- three distinct keys: run first with empty child for one batched FK read
BEGIN TRANSACTION ISOLATION LEVEL SERIALIZABLE;
EXPLAIN (DIST, ANALYZE, COSTS OFF) INSERT INTO child VALUES
  (100007, :'v1'), (100008, :'v2'), (100009, :'v3');
                       QUERY PLAN                        
---------------------------------------------------------
 Insert on child (actual rows=0 loops=1)
   ->  Values Scan on "*VALUES*" (actual rows=3 loops=1)
         Storage Table Write Requests: 3
 Trigger for constraint child_v1_fkey: calls=3
 Storage Read Requests: 1
 Storage Read Ops: 2
 Storage Rows Scanned: 3
 Storage Write Requests: 3
 Storage Flush Requests: 1
(9 rows)

COMMIT;
SELECT count(*) FROM child;
 count 
-------
     3
(1 row)

-- same key repeated
BEGIN TRANSACTION ISOLATION LEVEL SERIALIZABLE;
EXPLAIN (DIST, ANALYZE, COSTS OFF) INSERT INTO child VALUES
  (100004, :'v1'), (100005, :'v1'), (100006, :'v1');
                       QUERY PLAN                        
---------------------------------------------------------
 Insert on child (actual rows=0 loops=1)
   ->  Values Scan on "*VALUES*" (actual rows=3 loops=1)
         Storage Table Write Requests: 3
 Trigger for constraint child_v1_fkey: calls=3
 Storage Read Requests: 1
 Storage Read Ops: 1
 Storage Rows Scanned: 1
 Storage Write Requests: 3
 Storage Flush Requests: 1
(9 rows)

COMMIT;
SELECT count(*) FROM child;
 count 
-------
     6
(1 row)

-- two distinct keys with duplicate
BEGIN TRANSACTION ISOLATION LEVEL SERIALIZABLE;
EXPLAIN (DIST, ANALYZE, COSTS OFF) INSERT INTO child VALUES
  (100001, :'v1'), (100002, :'v1'), (100003, :'v2');
                       QUERY PLAN                        
---------------------------------------------------------
 Insert on child (actual rows=0 loops=1)
   ->  Values Scan on "*VALUES*" (actual rows=3 loops=1)
         Storage Table Write Requests: 3
 Trigger for constraint child_v1_fkey: calls=3
 Storage Read Requests: 1
 Storage Read Ops: 2
 Storage Rows Scanned: 2
 Storage Write Requests: 3
 Storage Flush Requests: 1
(9 rows)

COMMIT;
SELECT count(*) FROM child;
 count 
-------
     9
(1 row)

TRUNCATE child, parent;
-- COPY
INSERT INTO parent VALUES (1, :'v1'), (2, :'v2');
\set copy_cmd 'printf "100001\t' :v1 '\n100002\t' :v2 '\n"'
COPY child FROM PROGRAM :'copy_cmd';
SELECT count(*) FROM child;
 count 
-------
     2
(1 row)

\set copy_cmd 'printf "100003\t' :v1 '\n100004\t' :v2 '\n100005\t' :v5 '\n"'
COPY child FROM PROGRAM :'copy_cmd';
ysqlsh:yb_commands/foreign_key_when_types_mismatch_helper.sql:69: ERROR:  insert or update on table "child" violates foreign key constraint "child_v1_fkey"
DETAIL:  Key (v1)=(999) is not present in table "parent".
CONTEXT:  COPY child, line 4: ""
-- should fail: no matching parent key
SELECT count(*) FROM child;
 count 
-------
     2
(1 row)

INSERT INTO parent VALUES (3, :'trap_parent_val');
\set copy_cmd 'printf "100006\t' :trap_child_val '\n"'
COPY child FROM PROGRAM :'copy_cmd';
ysqlsh:yb_commands/foreign_key_when_types_mismatch_helper.sql:74: ERROR:  value "32769" is out of range for type smallint
CONTEXT:  COPY child, line 1, column v1: "32769"
-- should fail: out of range
SELECT count(*) FROM child;
 count 
-------
     2
(1 row)

TRUNCATE child, parent;
-- out of range insert and parent update
INSERT INTO parent VALUES (1, :'trap_parent_val');
INSERT INTO child VALUES (100001, :'trap_child_val'); -- should fail: out of range
ysqlsh:yb_commands/foreign_key_when_types_mismatch_helper.sql:81: ERROR:  value "32769" is out of range for type smallint
LINE 1: INSERT INTO child VALUES (100001, '32769');
                                          ^
SELECT count(*) FROM child;
 count 
-------
     0
(1 row)

INSERT INTO parent VALUES (2, :'trap_child_val');
INSERT INTO child VALUES (100002, :'trap_parent_val');
SELECT count(*) FROM child;
 count 
-------
     1
(1 row)

DELETE FROM parent WHERE h = 2;
SELECT count(*) FROM child;
 count 
-------
     1
(1 row)

DELETE FROM parent WHERE h = 1;
DELETE FROM child WHERE h = 100002;
INSERT INTO parent VALUES (1, :'v1');
INSERT INTO child VALUES (100002, :'v1');
SELECT count(*) FROM child;
 count 
-------
     1
(1 row)

UPDATE parent SET v1 = :'trap_child_val' WHERE h = 1; -- should fail: cannot fit child column
ysqlsh:yb_commands/foreign_key_when_types_mismatch_helper.sql:93: ERROR:  smallint out of range
CONTEXT:  SQL statement "UPDATE ONLY "public"."child" SET "v1" = $1 WHERE $2 OPERATOR(pg_catalog.=) "v1""
SELECT count(*) FROM child WHERE h = 100002 AND v1 = :'v1';
 count 
-------
     1
(1 row)

TRUNCATE child, parent;
-- ON DELETE/UPDATE SET NULL
ALTER TABLE child DROP CONSTRAINT child_v1_fkey;
ALTER TABLE child ADD CONSTRAINT child_v1_fkey FOREIGN KEY(v1) REFERENCES parent(v1)
  ON DELETE SET NULL ON UPDATE SET NULL;
INSERT INTO parent VALUES (1, :'v4'), (2, :'v5');
INSERT INTO child VALUES (100001, :'v4'), (100002, :'v5');
SELECT count(*) FROM child;
 count 
-------
     2
(1 row)

UPDATE parent SET v1 = :'v3' WHERE h = 1;
SELECT count(*) FROM child WHERE h = 100001 AND v1 IS NULL;
 count 
-------
     1
(1 row)

DELETE FROM parent WHERE h = 2;
SELECT count(*) FROM child WHERE h = 100002 AND v1 IS NULL;
 count 
-------
     1
(1 row)

TRUNCATE child, parent;
-- ON DELETE/UPDATE NO ACTION deferrable
ALTER TABLE child DROP CONSTRAINT child_v1_fkey;
ALTER TABLE child ADD CONSTRAINT child_v1_fkey FOREIGN KEY(v1) REFERENCES parent(v1)
  ON DELETE NO ACTION ON UPDATE NO ACTION DEFERRABLE INITIALLY DEFERRED;
INSERT INTO parent VALUES (1, :'v4'), (2, :'v5');
INSERT INTO child VALUES (100001, :'v4'), (100002, :'v5');
SELECT count(*) FROM child;
 count 
-------
     2
(1 row)

UPDATE parent SET v1 = :'v3' WHERE h = 1; -- should fail: no matching parent key
ysqlsh:yb_commands/foreign_key_when_types_mismatch_helper.sql:117: ERROR:  update or delete on table "parent" violates foreign key constraint "child_v1_fkey" on table "child"
DETAIL:  Key (v1)=(460) is still referenced from table "child".
DELETE FROM parent WHERE h = 2; -- should fail: no matching parent key
ysqlsh:yb_commands/foreign_key_when_types_mismatch_helper.sql:118: ERROR:  update or delete on table "parent" violates foreign key constraint "child_v1_fkey" on table "child"
DETAIL:  Key (v1)=(999) is still referenced from table "child".
SELECT count(*) FROM child;
 count 
-------
     2
(1 row)

BEGIN;
  UPDATE parent SET v1 = :'v3' WHERE h = 1; -- should pass for now
  INSERT INTO parent VALUES (3, :'v4');
COMMIT; -- should pass
SELECT count(*) FROM parent WHERE v1 = :'v3';
 count 
-------
     1
(1 row)

BEGIN;
  DELETE FROM parent WHERE h = 3; -- child still references :'v4'
COMMIT; -- should fail
ysqlsh:yb_commands/foreign_key_when_types_mismatch_helper.sql:127: ERROR:  update or delete on table "parent" violates foreign key constraint "child_v1_fkey" on table "child"
DETAIL:  Key (v1)=(460) is still referenced from table "child".
SELECT count(*) FROM child;
 count 
-------
     2
(1 row)

BEGIN;
  DELETE FROM parent WHERE h = 2; -- should pass for now
  INSERT INTO parent VALUES (4, :'v5');
COMMIT; -- should pass
SELECT count(*) FROM parent WHERE h = 2;
 count 
-------
     0
(1 row)

BEGIN;
  DELETE FROM parent WHERE h = 4; -- child still references :'v5'
COMMIT; -- should fail
ysqlsh:yb_commands/foreign_key_when_types_mismatch_helper.sql:136: ERROR:  update or delete on table "parent" violates foreign key constraint "child_v1_fkey" on table "child"
DETAIL:  Key (v1)=(999) is still referenced from table "child".
SELECT count(*) FROM child;
 count 
-------
     2
(1 row)

TRUNCATE child, parent;
-- ON DELETE/UPDATE RESTRICT deferrable
ALTER TABLE child DROP CONSTRAINT child_v1_fkey;
ALTER TABLE child ADD CONSTRAINT child_v1_fkey FOREIGN KEY(v1) REFERENCES parent(v1)
  ON DELETE RESTRICT ON UPDATE RESTRICT DEFERRABLE INITIALLY DEFERRED;
INSERT INTO parent VALUES (1, :'v4'), (2, :'v5');
INSERT INTO child VALUES (100001, :'v4'), (100002, :'v5');
SELECT count(*) FROM child;
 count 
-------
     2
(1 row)

UPDATE parent SET v1 = :'v3' WHERE h = 1; -- should fail: no matching parent key
ysqlsh:yb_commands/foreign_key_when_types_mismatch_helper.sql:147: ERROR:  update or delete on table "parent" violates foreign key constraint "child_v1_fkey" on table "child"
DETAIL:  Key (v1)=(460) is still referenced from table "child".
DELETE FROM parent WHERE h = 2; -- should fail: no matching parent key
ysqlsh:yb_commands/foreign_key_when_types_mismatch_helper.sql:148: ERROR:  update or delete on table "parent" violates foreign key constraint "child_v1_fkey" on table "child"
DETAIL:  Key (v1)=(999) is still referenced from table "child".
SELECT count(*) FROM child;
 count 
-------
     2
(1 row)

BEGIN;
  UPDATE parent SET v1 = :'v3' WHERE h = 1; -- should fail: no matching parent key
ysqlsh:yb_commands/foreign_key_when_types_mismatch_helper.sql:151: ERROR:  update or delete on table "parent" violates foreign key constraint "child_v1_fkey" on table "child"
DETAIL:  Key (v1)=(460) is still referenced from table "child".
  INSERT INTO parent VALUES (3, :'v4');
ysqlsh:yb_commands/foreign_key_when_types_mismatch_helper.sql:152: ERROR:  current transaction is aborted, commands ignored until end of transaction block
COMMIT; -- should fail
SELECT count(*) FROM parent WHERE v1 = :'v3';
 count 
-------
     0
(1 row)

BEGIN;
  DELETE FROM parent WHERE h = 2; -- should fail: no matching parent key
ysqlsh:yb_commands/foreign_key_when_types_mismatch_helper.sql:156: ERROR:  update or delete on table "parent" violates foreign key constraint "child_v1_fkey" on table "child"
DETAIL:  Key (v1)=(999) is still referenced from table "child".
  INSERT INTO parent VALUES (4, :'v5');
ysqlsh:yb_commands/foreign_key_when_types_mismatch_helper.sql:157: ERROR:  current transaction is aborted, commands ignored until end of transaction block
COMMIT; -- should fail
SELECT count(*) FROM parent WHERE h = 2;
 count 
-------
     1
(1 row)

TRUNCATE child, parent;
-- setup a composite foreign key constraint
ALTER TABLE parent ADD COLUMN v2 TEXT;
ALTER TABLE child ADD COLUMN v2 VARCHAR(12);
ALTER TABLE child DROP CONSTRAINT child_v1_fkey;
DROP INDEX parent_v1_key;
ALTER TABLE parent ADD UNIQUE (v1, v2);
-- partial null composite update
ALTER TABLE child ADD CONSTRAINT child_v1_v2_fkey FOREIGN KEY(v1, v2) REFERENCES parent(v1, v2)
  ON DELETE CASCADE ON UPDATE CASCADE;
INSERT INTO parent VALUES (1, 1, 'hello');
INSERT INTO child VALUES (100001, 1, 'hello');
SELECT count(*) FROM child;
 count 
-------
     1
(1 row)

UPDATE parent SET v1 = NULL, v2 = 'hello2' WHERE h = 1; -- should pass: v2 need not exist in parent
SELECT count(*) FROM child WHERE h = 100001 AND v1 IS NULL AND v2 = 'hello2';
 count 
-------
     1
(1 row)

UPDATE parent SET v1 = 4, v2 = 'hello' WHERE h = 1; -- child row should be unchanged
SELECT count(*) FROM child WHERE h = 100001 AND v1 IS NULL AND v2 = 'hello2';
 count 
-------
     1
(1 row)

TRUNCATE child, parent;
ALTER TABLE child DROP CONSTRAINT child_v1_v2_fkey;
-- ON DELETE/UPDATE SET DEFAULT composite
ALTER TABLE child ALTER COLUMN v1 SET DEFAULT :'v1';
ALTER TABLE child ALTER COLUMN v2 SET DEFAULT 'default';
ALTER TABLE child ADD CONSTRAINT child_v1_v2_fkey FOREIGN KEY(v1, v2) REFERENCES parent(v1, v2)
  ON DELETE SET DEFAULT ON UPDATE SET DEFAULT;
INSERT INTO parent VALUES (1, :'v1', 'hello'), (2, :'v2', 'world'), (3, :'v4', 'yugabyte');
INSERT INTO child VALUES (100001, :'v2', 'world'), (100002, :'v4', 'yugabyte');
SELECT count(*) FROM child;
 count 
-------
     2
(1 row)

UPDATE parent SET v1 = :'v3', v2 = 'world2' WHERE h = 2; -- should fail: default pair not in parent
ysqlsh:yb_commands/foreign_key_when_types_mismatch_helper.sql:190: ERROR:  insert or update on table "child" violates foreign key constraint "child_v1_v2_fkey"
DETAIL:  Key (v1, v2)=(456, default) is not present in table "parent".
INSERT INTO parent VALUES (4, :'v1', 'default');
UPDATE parent SET v1 = :'v3', v2 = 'world2' WHERE h = 2; -- should pass
SELECT count(*) FROM child WHERE h = 100001 AND v1 = :'v3' AND v2 = 'world2';
 count 
-------
     0
(1 row)

SELECT count(*) FROM child WHERE h = 100001 AND v1 = :'v1' AND v2 = 'default';
 count 
-------
     1
(1 row)

DELETE FROM parent WHERE h = 3;
SELECT count(*) FROM child WHERE v1 = :'v1' AND v2 = 'default';
 count 
-------
     2
(1 row)

TRUNCATE child, parent;
ALTER TABLE child DROP CONSTRAINT child_v1_v2_fkey;
-- MATCH FULL
ALTER TABLE child ADD CONSTRAINT child_v1_v2_fkey FOREIGN KEY(v1, v2) REFERENCES parent(v1, v2)
  MATCH FULL ON DELETE CASCADE ON UPDATE CASCADE;
INSERT INTO parent VALUES (1, :'v1', 'hello');
INSERT INTO child VALUES (100001, :'v1', 'hello');
SELECT count(*) FROM child;
 count 
-------
     1
(1 row)

INSERT INTO parent VALUES (2, NULL, 'hello');
INSERT INTO child VALUES (100002, NULL, 'hello'); -- should fail
ysqlsh:yb_commands/foreign_key_when_types_mismatch_helper.sql:207: ERROR:  insert or update on table "child" violates foreign key constraint "child_v1_v2_fkey"
DETAIL:  MATCH FULL does not allow mixing of null and nonnull key values.
SELECT count(*) FROM child;
 count 
-------
     1
(1 row)

INSERT INTO child VALUES (100003, NULL, NULL); -- should pass
SELECT count(*) FROM child;
 count 
-------
     2
(1 row)

UPDATE child SET v1 = NULL; -- should fail
ysqlsh:yb_commands/foreign_key_when_types_mismatch_helper.sql:211: ERROR:  insert or update on table "child" violates foreign key constraint "child_v1_v2_fkey"
DETAIL:  MATCH FULL does not allow mixing of null and nonnull key values.
SELECT count(*) FROM child;
 count 
-------
     2
(1 row)

UPDATE child SET v1 = NULL, v2 = NULL; -- should pass
SELECT count(*) FROM child WHERE v1 IS NULL AND v2 IS NULL;
 count 
-------
     2
(1 row)

TRUNCATE child, parent;
ALTER TABLE child DROP CONSTRAINT child_v1_v2_fkey;
ALTER TABLE parent DROP CONSTRAINT parent_v1_v2_key;
ALTER TABLE parent DROP COLUMN v2;
ALTER TABLE child DROP COLUMN v2;
CREATE UNIQUE INDEX parent_v1_key ON parent(v1) SPLIT INTO 1 TABLETS;
-- cleanup
DROP TABLE child;
DROP TABLE parent;
-- int4 to int8
CREATE TABLE parent(h INT PRIMARY KEY, v1 BIGINT) SPLIT INTO 1 TABLETS;
CREATE UNIQUE INDEX parent_v1_key ON parent(v1) SPLIT INTO 1 TABLETS;
CREATE TABLE child(h INT PRIMARY KEY, v1 INT, FOREIGN KEY(v1) REFERENCES parent(v1)
  ON DELETE CASCADE ON UPDATE CASCADE) SPLIT INTO 1 TABLETS;
\set v1 789
\set v2 791
\set v3 790
\set v4 792
\set v5 999
\set trap_parent_val -2147483648
\set trap_child_val 2147483648
\i yb_commands/foreign_key_when_types_mismatch_helper.sql
--
-- Helper for yb.orig.foreign_key_when_types_mismatch.sql.
--
-- Driver must CREATE parent(h, v1) and child(h, v1) with ON DELETE/UPDATE CASCADE.
-- parent(v1) must be backed by parent_v1_key with SPLIT INTO 1 TABLETS so FK batched
-- lookups hit a single tablet. Then set psql variables:
--   v1, v2, v3, v4, v5
--   trap_parent_val, trap_child_val
--
-- Each scenario inserts its own rows (parent h from 1, child h from 100001),
-- then TRUNCATEs both tables. The helper ends by dropping parent and child.
--
-- Scenarios (in order):
--   CASCADE, multi row insert, COPY, out of range insert/update,
--   SET NULL, NO ACTION deferrable (including COMMIT fail),
--   RESTRICT deferrable, partial null composite update, SET DEFAULT composite, MATCH FULL
--
-- CASCADE
INSERT INTO parent VALUES (1, :'v1');
INSERT INTO child VALUES (1, :'v1'); -- warm up catalog cache
DELETE FROM child WHERE h = 1; -- undo changes due to warm up
BEGIN TRANSACTION ISOLATION LEVEL SERIALIZABLE;
EXPLAIN (DIST, ANALYZE, COSTS OFF) INSERT INTO child VALUES (100001, :'v1');
                  QUERY PLAN                   
-----------------------------------------------
 Insert on child (actual rows=0 loops=1)
   ->  Result *RESULT* (actual rows=1 loops=1)
         Storage Table Write Requests: 1
 Trigger for constraint child_v1_fkey: calls=1
 Storage Read Requests: 1
 Storage Read Ops: 1
 Storage Rows Scanned: 1
 Storage Write Requests: 1
 Storage Flush Requests: 1
(9 rows)

COMMIT;
SELECT count(*) FROM child;
 count 
-------
     1
(1 row)

ALTER TABLE child DROP CONSTRAINT child_v1_fkey;
ALTER TABLE child ADD CONSTRAINT child_v1_fkey FOREIGN KEY(v1) REFERENCES parent(v1)
  ON DELETE CASCADE ON UPDATE CASCADE;
UPDATE parent SET v1 = :'v3' WHERE h = 1;
SELECT count(*) FROM child WHERE h = 100001 AND v1 = :'v3';
 count 
-------
     1
(1 row)

DELETE FROM parent WHERE h = 1;
SELECT count(*) FROM child;
 count 
-------
     0
(1 row)

INSERT INTO parent VALUES (1, :'v1');
INSERT INTO child VALUES (100002, :'v5'); -- should fail: no matching parent key
ysqlsh:yb_commands/foreign_key_when_types_mismatch_helper.sql:35: ERROR:  insert or update on table "child" violates foreign key constraint "child_v1_fkey"
DETAIL:  Key (v1)=(999) is not present in table "parent".
SELECT count(*) FROM child;
 count 
-------
     0
(1 row)

TRUNCATE child, parent;
-- multi row insert
INSERT INTO parent VALUES (1, :'v1'), (2, :'v2'), (3, :'v3');
INSERT INTO child VALUES (1, :'v1'); -- warm up catalog cache
DELETE FROM child WHERE h = 1; -- undo changes due to warm up
-- three distinct keys: run first with empty child for one batched FK read
BEGIN TRANSACTION ISOLATION LEVEL SERIALIZABLE;
EXPLAIN (DIST, ANALYZE, COSTS OFF) INSERT INTO child VALUES
  (100007, :'v1'), (100008, :'v2'), (100009, :'v3');
                       QUERY PLAN                        
---------------------------------------------------------
 Insert on child (actual rows=0 loops=1)
   ->  Values Scan on "*VALUES*" (actual rows=3 loops=1)
         Storage Table Write Requests: 3
 Trigger for constraint child_v1_fkey: calls=3
 Storage Read Requests: 1
 Storage Read Ops: 2
 Storage Rows Scanned: 3
 Storage Write Requests: 3
 Storage Flush Requests: 1
(9 rows)

COMMIT;
SELECT count(*) FROM child;
 count 
-------
     3
(1 row)

-- same key repeated
BEGIN TRANSACTION ISOLATION LEVEL SERIALIZABLE;
EXPLAIN (DIST, ANALYZE, COSTS OFF) INSERT INTO child VALUES
  (100004, :'v1'), (100005, :'v1'), (100006, :'v1');
                       QUERY PLAN                        
---------------------------------------------------------
 Insert on child (actual rows=0 loops=1)
   ->  Values Scan on "*VALUES*" (actual rows=3 loops=1)
         Storage Table Write Requests: 3
 Trigger for constraint child_v1_fkey: calls=3
 Storage Read Requests: 1
 Storage Read Ops: 1
 Storage Rows Scanned: 1
 Storage Write Requests: 3
 Storage Flush Requests: 1
(9 rows)

COMMIT;
SELECT count(*) FROM child;
 count 
-------
     6
(1 row)

-- two distinct keys with duplicate
BEGIN TRANSACTION ISOLATION LEVEL SERIALIZABLE;
EXPLAIN (DIST, ANALYZE, COSTS OFF) INSERT INTO child VALUES
  (100001, :'v1'), (100002, :'v1'), (100003, :'v2');
                       QUERY PLAN                        
---------------------------------------------------------
 Insert on child (actual rows=0 loops=1)
   ->  Values Scan on "*VALUES*" (actual rows=3 loops=1)
         Storage Table Write Requests: 3
 Trigger for constraint child_v1_fkey: calls=3
 Storage Read Requests: 1
 Storage Read Ops: 2
 Storage Rows Scanned: 2
 Storage Write Requests: 3
 Storage Flush Requests: 1
(9 rows)

COMMIT;
SELECT count(*) FROM child;
 count 
-------
     9
(1 row)

TRUNCATE child, parent;
-- COPY
INSERT INTO parent VALUES (1, :'v1'), (2, :'v2');
\set copy_cmd 'printf "100001\t' :v1 '\n100002\t' :v2 '\n"'
COPY child FROM PROGRAM :'copy_cmd';
SELECT count(*) FROM child;
 count 
-------
     2
(1 row)

\set copy_cmd 'printf "100003\t' :v1 '\n100004\t' :v2 '\n100005\t' :v5 '\n"'
COPY child FROM PROGRAM :'copy_cmd';
ysqlsh:yb_commands/foreign_key_when_types_mismatch_helper.sql:69: ERROR:  insert or update on table "child" violates foreign key constraint "child_v1_fkey"
DETAIL:  Key (v1)=(999) is not present in table "parent".
CONTEXT:  COPY child, line 4: ""
-- should fail: no matching parent key
SELECT count(*) FROM child;
 count 
-------
     2
(1 row)

INSERT INTO parent VALUES (3, :'trap_parent_val');
\set copy_cmd 'printf "100006\t' :trap_child_val '\n"'
COPY child FROM PROGRAM :'copy_cmd';
ysqlsh:yb_commands/foreign_key_when_types_mismatch_helper.sql:74: ERROR:  value "2147483648" is out of range for type integer
CONTEXT:  COPY child, line 1, column v1: "2147483648"
-- should fail: out of range
SELECT count(*) FROM child;
 count 
-------
     2
(1 row)

TRUNCATE child, parent;
-- out of range insert and parent update
INSERT INTO parent VALUES (1, :'trap_parent_val');
INSERT INTO child VALUES (100001, :'trap_child_val'); -- should fail: out of range
ysqlsh:yb_commands/foreign_key_when_types_mismatch_helper.sql:81: ERROR:  value "2147483648" is out of range for type integer
LINE 1: INSERT INTO child VALUES (100001, '2147483648');
                                          ^
SELECT count(*) FROM child;
 count 
-------
     0
(1 row)

INSERT INTO parent VALUES (2, :'trap_child_val');
INSERT INTO child VALUES (100002, :'trap_parent_val');
SELECT count(*) FROM child;
 count 
-------
     1
(1 row)

DELETE FROM parent WHERE h = 2;
SELECT count(*) FROM child;
 count 
-------
     1
(1 row)

DELETE FROM parent WHERE h = 1;
DELETE FROM child WHERE h = 100002;
INSERT INTO parent VALUES (1, :'v1');
INSERT INTO child VALUES (100002, :'v1');
SELECT count(*) FROM child;
 count 
-------
     1
(1 row)

UPDATE parent SET v1 = :'trap_child_val' WHERE h = 1; -- should fail: cannot fit child column
ysqlsh:yb_commands/foreign_key_when_types_mismatch_helper.sql:93: ERROR:  integer out of range
CONTEXT:  SQL statement "UPDATE ONLY "public"."child" SET "v1" = $1 WHERE $2 OPERATOR(pg_catalog.=) "v1""
SELECT count(*) FROM child WHERE h = 100002 AND v1 = :'v1';
 count 
-------
     1
(1 row)

TRUNCATE child, parent;
-- ON DELETE/UPDATE SET NULL
ALTER TABLE child DROP CONSTRAINT child_v1_fkey;
ALTER TABLE child ADD CONSTRAINT child_v1_fkey FOREIGN KEY(v1) REFERENCES parent(v1)
  ON DELETE SET NULL ON UPDATE SET NULL;
INSERT INTO parent VALUES (1, :'v4'), (2, :'v5');
INSERT INTO child VALUES (100001, :'v4'), (100002, :'v5');
SELECT count(*) FROM child;
 count 
-------
     2
(1 row)

UPDATE parent SET v1 = :'v3' WHERE h = 1;
SELECT count(*) FROM child WHERE h = 100001 AND v1 IS NULL;
 count 
-------
     1
(1 row)

DELETE FROM parent WHERE h = 2;
SELECT count(*) FROM child WHERE h = 100002 AND v1 IS NULL;
 count 
-------
     1
(1 row)

TRUNCATE child, parent;
-- ON DELETE/UPDATE NO ACTION deferrable
ALTER TABLE child DROP CONSTRAINT child_v1_fkey;
ALTER TABLE child ADD CONSTRAINT child_v1_fkey FOREIGN KEY(v1) REFERENCES parent(v1)
  ON DELETE NO ACTION ON UPDATE NO ACTION DEFERRABLE INITIALLY DEFERRED;
INSERT INTO parent VALUES (1, :'v4'), (2, :'v5');
INSERT INTO child VALUES (100001, :'v4'), (100002, :'v5');
SELECT count(*) FROM child;
 count 
-------
     2
(1 row)

UPDATE parent SET v1 = :'v3' WHERE h = 1; -- should fail: no matching parent key
ysqlsh:yb_commands/foreign_key_when_types_mismatch_helper.sql:117: ERROR:  update or delete on table "parent" violates foreign key constraint "child_v1_fkey" on table "child"
DETAIL:  Key (v1)=(792) is still referenced from table "child".
DELETE FROM parent WHERE h = 2; -- should fail: no matching parent key
ysqlsh:yb_commands/foreign_key_when_types_mismatch_helper.sql:118: ERROR:  update or delete on table "parent" violates foreign key constraint "child_v1_fkey" on table "child"
DETAIL:  Key (v1)=(999) is still referenced from table "child".
SELECT count(*) FROM child;
 count 
-------
     2
(1 row)

BEGIN;
  UPDATE parent SET v1 = :'v3' WHERE h = 1; -- should pass for now
  INSERT INTO parent VALUES (3, :'v4');
COMMIT; -- should pass
SELECT count(*) FROM parent WHERE v1 = :'v3';
 count 
-------
     1
(1 row)

BEGIN;
  DELETE FROM parent WHERE h = 3; -- child still references :'v4'
COMMIT; -- should fail
ysqlsh:yb_commands/foreign_key_when_types_mismatch_helper.sql:127: ERROR:  update or delete on table "parent" violates foreign key constraint "child_v1_fkey" on table "child"
DETAIL:  Key (v1)=(792) is still referenced from table "child".
SELECT count(*) FROM child;
 count 
-------
     2
(1 row)

BEGIN;
  DELETE FROM parent WHERE h = 2; -- should pass for now
  INSERT INTO parent VALUES (4, :'v5');
COMMIT; -- should pass
SELECT count(*) FROM parent WHERE h = 2;
 count 
-------
     0
(1 row)

BEGIN;
  DELETE FROM parent WHERE h = 4; -- child still references :'v5'
COMMIT; -- should fail
ysqlsh:yb_commands/foreign_key_when_types_mismatch_helper.sql:136: ERROR:  update or delete on table "parent" violates foreign key constraint "child_v1_fkey" on table "child"
DETAIL:  Key (v1)=(999) is still referenced from table "child".
SELECT count(*) FROM child;
 count 
-------
     2
(1 row)

TRUNCATE child, parent;
-- ON DELETE/UPDATE RESTRICT deferrable
ALTER TABLE child DROP CONSTRAINT child_v1_fkey;
ALTER TABLE child ADD CONSTRAINT child_v1_fkey FOREIGN KEY(v1) REFERENCES parent(v1)
  ON DELETE RESTRICT ON UPDATE RESTRICT DEFERRABLE INITIALLY DEFERRED;
INSERT INTO parent VALUES (1, :'v4'), (2, :'v5');
INSERT INTO child VALUES (100001, :'v4'), (100002, :'v5');
SELECT count(*) FROM child;
 count 
-------
     2
(1 row)

UPDATE parent SET v1 = :'v3' WHERE h = 1; -- should fail: no matching parent key
ysqlsh:yb_commands/foreign_key_when_types_mismatch_helper.sql:147: ERROR:  update or delete on table "parent" violates foreign key constraint "child_v1_fkey" on table "child"
DETAIL:  Key (v1)=(792) is still referenced from table "child".
DELETE FROM parent WHERE h = 2; -- should fail: no matching parent key
ysqlsh:yb_commands/foreign_key_when_types_mismatch_helper.sql:148: ERROR:  update or delete on table "parent" violates foreign key constraint "child_v1_fkey" on table "child"
DETAIL:  Key (v1)=(999) is still referenced from table "child".
SELECT count(*) FROM child;
 count 
-------
     2
(1 row)

BEGIN;
  UPDATE parent SET v1 = :'v3' WHERE h = 1; -- should fail: no matching parent key
ysqlsh:yb_commands/foreign_key_when_types_mismatch_helper.sql:151: ERROR:  update or delete on table "parent" violates foreign key constraint "child_v1_fkey" on table "child"
DETAIL:  Key (v1)=(792) is still referenced from table "child".
  INSERT INTO parent VALUES (3, :'v4');
ysqlsh:yb_commands/foreign_key_when_types_mismatch_helper.sql:152: ERROR:  current transaction is aborted, commands ignored until end of transaction block
COMMIT; -- should fail
SELECT count(*) FROM parent WHERE v1 = :'v3';
 count 
-------
     0
(1 row)

BEGIN;
  DELETE FROM parent WHERE h = 2; -- should fail: no matching parent key
ysqlsh:yb_commands/foreign_key_when_types_mismatch_helper.sql:156: ERROR:  update or delete on table "parent" violates foreign key constraint "child_v1_fkey" on table "child"
DETAIL:  Key (v1)=(999) is still referenced from table "child".
  INSERT INTO parent VALUES (4, :'v5');
ysqlsh:yb_commands/foreign_key_when_types_mismatch_helper.sql:157: ERROR:  current transaction is aborted, commands ignored until end of transaction block
COMMIT; -- should fail
SELECT count(*) FROM parent WHERE h = 2;
 count 
-------
     1
(1 row)

TRUNCATE child, parent;
-- setup a composite foreign key constraint
ALTER TABLE parent ADD COLUMN v2 TEXT;
ALTER TABLE child ADD COLUMN v2 VARCHAR(12);
ALTER TABLE child DROP CONSTRAINT child_v1_fkey;
DROP INDEX parent_v1_key;
ALTER TABLE parent ADD UNIQUE (v1, v2);
-- partial null composite update
ALTER TABLE child ADD CONSTRAINT child_v1_v2_fkey FOREIGN KEY(v1, v2) REFERENCES parent(v1, v2)
  ON DELETE CASCADE ON UPDATE CASCADE;
INSERT INTO parent VALUES (1, 1, 'hello');
INSERT INTO child VALUES (100001, 1, 'hello');
SELECT count(*) FROM child;
 count 
-------
     1
(1 row)

UPDATE parent SET v1 = NULL, v2 = 'hello2' WHERE h = 1; -- should pass: v2 need not exist in parent
SELECT count(*) FROM child WHERE h = 100001 AND v1 IS NULL AND v2 = 'hello2';
 count 
-------
     1
(1 row)

UPDATE parent SET v1 = 4, v2 = 'hello' WHERE h = 1; -- child row should be unchanged
SELECT count(*) FROM child WHERE h = 100001 AND v1 IS NULL AND v2 = 'hello2';
 count 
-------
     1
(1 row)

TRUNCATE child, parent;
ALTER TABLE child DROP CONSTRAINT child_v1_v2_fkey;
-- ON DELETE/UPDATE SET DEFAULT composite
ALTER TABLE child ALTER COLUMN v1 SET DEFAULT :'v1';
ALTER TABLE child ALTER COLUMN v2 SET DEFAULT 'default';
ALTER TABLE child ADD CONSTRAINT child_v1_v2_fkey FOREIGN KEY(v1, v2) REFERENCES parent(v1, v2)
  ON DELETE SET DEFAULT ON UPDATE SET DEFAULT;
INSERT INTO parent VALUES (1, :'v1', 'hello'), (2, :'v2', 'world'), (3, :'v4', 'yugabyte');
INSERT INTO child VALUES (100001, :'v2', 'world'), (100002, :'v4', 'yugabyte');
SELECT count(*) FROM child;
 count 
-------
     2
(1 row)

UPDATE parent SET v1 = :'v3', v2 = 'world2' WHERE h = 2; -- should fail: default pair not in parent
ysqlsh:yb_commands/foreign_key_when_types_mismatch_helper.sql:190: ERROR:  insert or update on table "child" violates foreign key constraint "child_v1_v2_fkey"
DETAIL:  Key (v1, v2)=(789, default) is not present in table "parent".
INSERT INTO parent VALUES (4, :'v1', 'default');
UPDATE parent SET v1 = :'v3', v2 = 'world2' WHERE h = 2; -- should pass
SELECT count(*) FROM child WHERE h = 100001 AND v1 = :'v3' AND v2 = 'world2';
 count 
-------
     0
(1 row)

SELECT count(*) FROM child WHERE h = 100001 AND v1 = :'v1' AND v2 = 'default';
 count 
-------
     1
(1 row)

DELETE FROM parent WHERE h = 3;
SELECT count(*) FROM child WHERE v1 = :'v1' AND v2 = 'default';
 count 
-------
     2
(1 row)

TRUNCATE child, parent;
ALTER TABLE child DROP CONSTRAINT child_v1_v2_fkey;
-- MATCH FULL
ALTER TABLE child ADD CONSTRAINT child_v1_v2_fkey FOREIGN KEY(v1, v2) REFERENCES parent(v1, v2)
  MATCH FULL ON DELETE CASCADE ON UPDATE CASCADE;
INSERT INTO parent VALUES (1, :'v1', 'hello');
INSERT INTO child VALUES (100001, :'v1', 'hello');
SELECT count(*) FROM child;
 count 
-------
     1
(1 row)

INSERT INTO parent VALUES (2, NULL, 'hello');
INSERT INTO child VALUES (100002, NULL, 'hello'); -- should fail
ysqlsh:yb_commands/foreign_key_when_types_mismatch_helper.sql:207: ERROR:  insert or update on table "child" violates foreign key constraint "child_v1_v2_fkey"
DETAIL:  MATCH FULL does not allow mixing of null and nonnull key values.
SELECT count(*) FROM child;
 count 
-------
     1
(1 row)

INSERT INTO child VALUES (100003, NULL, NULL); -- should pass
SELECT count(*) FROM child;
 count 
-------
     2
(1 row)

UPDATE child SET v1 = NULL; -- should fail
ysqlsh:yb_commands/foreign_key_when_types_mismatch_helper.sql:211: ERROR:  insert or update on table "child" violates foreign key constraint "child_v1_v2_fkey"
DETAIL:  MATCH FULL does not allow mixing of null and nonnull key values.
SELECT count(*) FROM child;
 count 
-------
     2
(1 row)

UPDATE child SET v1 = NULL, v2 = NULL; -- should pass
SELECT count(*) FROM child WHERE v1 IS NULL AND v2 IS NULL;
 count 
-------
     2
(1 row)

TRUNCATE child, parent;
ALTER TABLE child DROP CONSTRAINT child_v1_v2_fkey;
ALTER TABLE parent DROP CONSTRAINT parent_v1_v2_key;
ALTER TABLE parent DROP COLUMN v2;
ALTER TABLE child DROP COLUMN v2;
CREATE UNIQUE INDEX parent_v1_key ON parent(v1) SPLIT INTO 1 TABLETS;
-- cleanup
DROP TABLE child;
DROP TABLE parent;
-- int2 to int8
CREATE TABLE parent(h INT PRIMARY KEY, v1 BIGINT) SPLIT INTO 1 TABLETS;
CREATE UNIQUE INDEX parent_v1_key ON parent(v1) SPLIT INTO 1 TABLETS;
CREATE TABLE child(h INT PRIMARY KEY, v1 SMALLINT, FOREIGN KEY(v1) REFERENCES parent(v1)
  ON DELETE CASCADE ON UPDATE CASCADE) SPLIT INTO 1 TABLETS;
\set v1 32000
\set v2 32002
\set v3 32001
\set v4 32004
\set v5 999
\set trap_parent_val -32767
\set trap_child_val 32769
\i yb_commands/foreign_key_when_types_mismatch_helper.sql
--
-- Helper for yb.orig.foreign_key_when_types_mismatch.sql.
--
-- Driver must CREATE parent(h, v1) and child(h, v1) with ON DELETE/UPDATE CASCADE.
-- parent(v1) must be backed by parent_v1_key with SPLIT INTO 1 TABLETS so FK batched
-- lookups hit a single tablet. Then set psql variables:
--   v1, v2, v3, v4, v5
--   trap_parent_val, trap_child_val
--
-- Each scenario inserts its own rows (parent h from 1, child h from 100001),
-- then TRUNCATEs both tables. The helper ends by dropping parent and child.
--
-- Scenarios (in order):
--   CASCADE, multi row insert, COPY, out of range insert/update,
--   SET NULL, NO ACTION deferrable (including COMMIT fail),
--   RESTRICT deferrable, partial null composite update, SET DEFAULT composite, MATCH FULL
--
-- CASCADE
INSERT INTO parent VALUES (1, :'v1');
INSERT INTO child VALUES (1, :'v1'); -- warm up catalog cache
DELETE FROM child WHERE h = 1; -- undo changes due to warm up
BEGIN TRANSACTION ISOLATION LEVEL SERIALIZABLE;
EXPLAIN (DIST, ANALYZE, COSTS OFF) INSERT INTO child VALUES (100001, :'v1');
                  QUERY PLAN                   
-----------------------------------------------
 Insert on child (actual rows=0 loops=1)
   ->  Result *RESULT* (actual rows=1 loops=1)
         Storage Table Write Requests: 1
 Trigger for constraint child_v1_fkey: calls=1
 Storage Read Requests: 1
 Storage Read Ops: 1
 Storage Rows Scanned: 1
 Storage Write Requests: 1
 Storage Flush Requests: 1
(9 rows)

COMMIT;
SELECT count(*) FROM child;
 count 
-------
     1
(1 row)

ALTER TABLE child DROP CONSTRAINT child_v1_fkey;
ALTER TABLE child ADD CONSTRAINT child_v1_fkey FOREIGN KEY(v1) REFERENCES parent(v1)
  ON DELETE CASCADE ON UPDATE CASCADE;
UPDATE parent SET v1 = :'v3' WHERE h = 1;
SELECT count(*) FROM child WHERE h = 100001 AND v1 = :'v3';
 count 
-------
     1
(1 row)

DELETE FROM parent WHERE h = 1;
SELECT count(*) FROM child;
 count 
-------
     0
(1 row)

INSERT INTO parent VALUES (1, :'v1');
INSERT INTO child VALUES (100002, :'v5'); -- should fail: no matching parent key
ysqlsh:yb_commands/foreign_key_when_types_mismatch_helper.sql:35: ERROR:  insert or update on table "child" violates foreign key constraint "child_v1_fkey"
DETAIL:  Key (v1)=(999) is not present in table "parent".
SELECT count(*) FROM child;
 count 
-------
     0
(1 row)

TRUNCATE child, parent;
-- multi row insert
INSERT INTO parent VALUES (1, :'v1'), (2, :'v2'), (3, :'v3');
INSERT INTO child VALUES (1, :'v1'); -- warm up catalog cache
DELETE FROM child WHERE h = 1; -- undo changes due to warm up
-- three distinct keys: run first with empty child for one batched FK read
BEGIN TRANSACTION ISOLATION LEVEL SERIALIZABLE;
EXPLAIN (DIST, ANALYZE, COSTS OFF) INSERT INTO child VALUES
  (100007, :'v1'), (100008, :'v2'), (100009, :'v3');
                       QUERY PLAN                        
---------------------------------------------------------
 Insert on child (actual rows=0 loops=1)
   ->  Values Scan on "*VALUES*" (actual rows=3 loops=1)
         Storage Table Write Requests: 3
 Trigger for constraint child_v1_fkey: calls=3
 Storage Read Requests: 1
 Storage Read Ops: 2
 Storage Rows Scanned: 3
 Storage Write Requests: 3
 Storage Flush Requests: 1
(9 rows)

COMMIT;
SELECT count(*) FROM child;
 count 
-------
     3
(1 row)

-- same key repeated
BEGIN TRANSACTION ISOLATION LEVEL SERIALIZABLE;
EXPLAIN (DIST, ANALYZE, COSTS OFF) INSERT INTO child VALUES
  (100004, :'v1'), (100005, :'v1'), (100006, :'v1');
                       QUERY PLAN                        
---------------------------------------------------------
 Insert on child (actual rows=0 loops=1)
   ->  Values Scan on "*VALUES*" (actual rows=3 loops=1)
         Storage Table Write Requests: 3
 Trigger for constraint child_v1_fkey: calls=3
 Storage Read Requests: 1
 Storage Read Ops: 1
 Storage Rows Scanned: 1
 Storage Write Requests: 3
 Storage Flush Requests: 1
(9 rows)

COMMIT;
SELECT count(*) FROM child;
 count 
-------
     6
(1 row)

-- two distinct keys with duplicate
BEGIN TRANSACTION ISOLATION LEVEL SERIALIZABLE;
EXPLAIN (DIST, ANALYZE, COSTS OFF) INSERT INTO child VALUES
  (100001, :'v1'), (100002, :'v1'), (100003, :'v2');
                       QUERY PLAN                        
---------------------------------------------------------
 Insert on child (actual rows=0 loops=1)
   ->  Values Scan on "*VALUES*" (actual rows=3 loops=1)
         Storage Table Write Requests: 3
 Trigger for constraint child_v1_fkey: calls=3
 Storage Read Requests: 1
 Storage Read Ops: 1
 Storage Rows Scanned: 2
 Storage Write Requests: 3
 Storage Flush Requests: 1
(9 rows)

COMMIT;
SELECT count(*) FROM child;
 count 
-------
     9
(1 row)

TRUNCATE child, parent;
-- COPY
INSERT INTO parent VALUES (1, :'v1'), (2, :'v2');
\set copy_cmd 'printf "100001\t' :v1 '\n100002\t' :v2 '\n"'
COPY child FROM PROGRAM :'copy_cmd';
SELECT count(*) FROM child;
 count 
-------
     2
(1 row)

\set copy_cmd 'printf "100003\t' :v1 '\n100004\t' :v2 '\n100005\t' :v5 '\n"'
COPY child FROM PROGRAM :'copy_cmd';
ysqlsh:yb_commands/foreign_key_when_types_mismatch_helper.sql:69: ERROR:  insert or update on table "child" violates foreign key constraint "child_v1_fkey"
DETAIL:  Key (v1)=(999) is not present in table "parent".
CONTEXT:  COPY child, line 4: ""
-- should fail: no matching parent key
SELECT count(*) FROM child;
 count 
-------
     2
(1 row)

INSERT INTO parent VALUES (3, :'trap_parent_val');
\set copy_cmd 'printf "100006\t' :trap_child_val '\n"'
COPY child FROM PROGRAM :'copy_cmd';
ysqlsh:yb_commands/foreign_key_when_types_mismatch_helper.sql:74: ERROR:  value "32769" is out of range for type smallint
CONTEXT:  COPY child, line 1, column v1: "32769"
-- should fail: out of range
SELECT count(*) FROM child;
 count 
-------
     2
(1 row)

TRUNCATE child, parent;
-- out of range insert and parent update
INSERT INTO parent VALUES (1, :'trap_parent_val');
INSERT INTO child VALUES (100001, :'trap_child_val'); -- should fail: out of range
ysqlsh:yb_commands/foreign_key_when_types_mismatch_helper.sql:81: ERROR:  value "32769" is out of range for type smallint
LINE 1: INSERT INTO child VALUES (100001, '32769');
                                          ^
SELECT count(*) FROM child;
 count 
-------
     0
(1 row)

INSERT INTO parent VALUES (2, :'trap_child_val');
INSERT INTO child VALUES (100002, :'trap_parent_val');
SELECT count(*) FROM child;
 count 
-------
     1
(1 row)

DELETE FROM parent WHERE h = 2;
SELECT count(*) FROM child;
 count 
-------
     1
(1 row)

DELETE FROM parent WHERE h = 1;
DELETE FROM child WHERE h = 100002;
INSERT INTO parent VALUES (1, :'v1');
INSERT INTO child VALUES (100002, :'v1');
SELECT count(*) FROM child;
 count 
-------
     1
(1 row)

UPDATE parent SET v1 = :'trap_child_val' WHERE h = 1; -- should fail: cannot fit child column
ysqlsh:yb_commands/foreign_key_when_types_mismatch_helper.sql:93: ERROR:  smallint out of range
CONTEXT:  SQL statement "UPDATE ONLY "public"."child" SET "v1" = $1 WHERE $2 OPERATOR(pg_catalog.=) "v1""
SELECT count(*) FROM child WHERE h = 100002 AND v1 = :'v1';
 count 
-------
     1
(1 row)

TRUNCATE child, parent;
-- ON DELETE/UPDATE SET NULL
ALTER TABLE child DROP CONSTRAINT child_v1_fkey;
ALTER TABLE child ADD CONSTRAINT child_v1_fkey FOREIGN KEY(v1) REFERENCES parent(v1)
  ON DELETE SET NULL ON UPDATE SET NULL;
INSERT INTO parent VALUES (1, :'v4'), (2, :'v5');
INSERT INTO child VALUES (100001, :'v4'), (100002, :'v5');
SELECT count(*) FROM child;
 count 
-------
     2
(1 row)

UPDATE parent SET v1 = :'v3' WHERE h = 1;
SELECT count(*) FROM child WHERE h = 100001 AND v1 IS NULL;
 count 
-------
     1
(1 row)

DELETE FROM parent WHERE h = 2;
SELECT count(*) FROM child WHERE h = 100002 AND v1 IS NULL;
 count 
-------
     1
(1 row)

TRUNCATE child, parent;
-- ON DELETE/UPDATE NO ACTION deferrable
ALTER TABLE child DROP CONSTRAINT child_v1_fkey;
ALTER TABLE child ADD CONSTRAINT child_v1_fkey FOREIGN KEY(v1) REFERENCES parent(v1)
  ON DELETE NO ACTION ON UPDATE NO ACTION DEFERRABLE INITIALLY DEFERRED;
INSERT INTO parent VALUES (1, :'v4'), (2, :'v5');
INSERT INTO child VALUES (100001, :'v4'), (100002, :'v5');
SELECT count(*) FROM child;
 count 
-------
     2
(1 row)

UPDATE parent SET v1 = :'v3' WHERE h = 1; -- should fail: no matching parent key
ysqlsh:yb_commands/foreign_key_when_types_mismatch_helper.sql:117: ERROR:  update or delete on table "parent" violates foreign key constraint "child_v1_fkey" on table "child"
DETAIL:  Key (v1)=(32004) is still referenced from table "child".
DELETE FROM parent WHERE h = 2; -- should fail: no matching parent key
ysqlsh:yb_commands/foreign_key_when_types_mismatch_helper.sql:118: ERROR:  update or delete on table "parent" violates foreign key constraint "child_v1_fkey" on table "child"
DETAIL:  Key (v1)=(999) is still referenced from table "child".
SELECT count(*) FROM child;
 count 
-------
     2
(1 row)

BEGIN;
  UPDATE parent SET v1 = :'v3' WHERE h = 1; -- should pass for now
  INSERT INTO parent VALUES (3, :'v4');
COMMIT; -- should pass
SELECT count(*) FROM parent WHERE v1 = :'v3';
 count 
-------
     1
(1 row)

BEGIN;
  DELETE FROM parent WHERE h = 3; -- child still references :'v4'
COMMIT; -- should fail
ysqlsh:yb_commands/foreign_key_when_types_mismatch_helper.sql:127: ERROR:  update or delete on table "parent" violates foreign key constraint "child_v1_fkey" on table "child"
DETAIL:  Key (v1)=(32004) is still referenced from table "child".
SELECT count(*) FROM child;
 count 
-------
     2
(1 row)

BEGIN;
  DELETE FROM parent WHERE h = 2; -- should pass for now
  INSERT INTO parent VALUES (4, :'v5');
COMMIT; -- should pass
SELECT count(*) FROM parent WHERE h = 2;
 count 
-------
     0
(1 row)

BEGIN;
  DELETE FROM parent WHERE h = 4; -- child still references :'v5'
COMMIT; -- should fail
ysqlsh:yb_commands/foreign_key_when_types_mismatch_helper.sql:136: ERROR:  update or delete on table "parent" violates foreign key constraint "child_v1_fkey" on table "child"
DETAIL:  Key (v1)=(999) is still referenced from table "child".
SELECT count(*) FROM child;
 count 
-------
     2
(1 row)

TRUNCATE child, parent;
-- ON DELETE/UPDATE RESTRICT deferrable
ALTER TABLE child DROP CONSTRAINT child_v1_fkey;
ALTER TABLE child ADD CONSTRAINT child_v1_fkey FOREIGN KEY(v1) REFERENCES parent(v1)
  ON DELETE RESTRICT ON UPDATE RESTRICT DEFERRABLE INITIALLY DEFERRED;
INSERT INTO parent VALUES (1, :'v4'), (2, :'v5');
INSERT INTO child VALUES (100001, :'v4'), (100002, :'v5');
SELECT count(*) FROM child;
 count 
-------
     2
(1 row)

UPDATE parent SET v1 = :'v3' WHERE h = 1; -- should fail: no matching parent key
ysqlsh:yb_commands/foreign_key_when_types_mismatch_helper.sql:147: ERROR:  update or delete on table "parent" violates foreign key constraint "child_v1_fkey" on table "child"
DETAIL:  Key (v1)=(32004) is still referenced from table "child".
DELETE FROM parent WHERE h = 2; -- should fail: no matching parent key
ysqlsh:yb_commands/foreign_key_when_types_mismatch_helper.sql:148: ERROR:  update or delete on table "parent" violates foreign key constraint "child_v1_fkey" on table "child"
DETAIL:  Key (v1)=(999) is still referenced from table "child".
SELECT count(*) FROM child;
 count 
-------
     2
(1 row)

BEGIN;
  UPDATE parent SET v1 = :'v3' WHERE h = 1; -- should fail: no matching parent key
ysqlsh:yb_commands/foreign_key_when_types_mismatch_helper.sql:151: ERROR:  update or delete on table "parent" violates foreign key constraint "child_v1_fkey" on table "child"
DETAIL:  Key (v1)=(32004) is still referenced from table "child".
  INSERT INTO parent VALUES (3, :'v4');
ysqlsh:yb_commands/foreign_key_when_types_mismatch_helper.sql:152: ERROR:  current transaction is aborted, commands ignored until end of transaction block
COMMIT; -- should fail
SELECT count(*) FROM parent WHERE v1 = :'v3';
 count 
-------
     0
(1 row)

BEGIN;
  DELETE FROM parent WHERE h = 2; -- should fail: no matching parent key
ysqlsh:yb_commands/foreign_key_when_types_mismatch_helper.sql:156: ERROR:  update or delete on table "parent" violates foreign key constraint "child_v1_fkey" on table "child"
DETAIL:  Key (v1)=(999) is still referenced from table "child".
  INSERT INTO parent VALUES (4, :'v5');
ysqlsh:yb_commands/foreign_key_when_types_mismatch_helper.sql:157: ERROR:  current transaction is aborted, commands ignored until end of transaction block
COMMIT; -- should fail
SELECT count(*) FROM parent WHERE h = 2;
 count 
-------
     1
(1 row)

TRUNCATE child, parent;
-- setup a composite foreign key constraint
ALTER TABLE parent ADD COLUMN v2 TEXT;
ALTER TABLE child ADD COLUMN v2 VARCHAR(12);
ALTER TABLE child DROP CONSTRAINT child_v1_fkey;
DROP INDEX parent_v1_key;
ALTER TABLE parent ADD UNIQUE (v1, v2);
-- partial null composite update
ALTER TABLE child ADD CONSTRAINT child_v1_v2_fkey FOREIGN KEY(v1, v2) REFERENCES parent(v1, v2)
  ON DELETE CASCADE ON UPDATE CASCADE;
INSERT INTO parent VALUES (1, 1, 'hello');
INSERT INTO child VALUES (100001, 1, 'hello');
SELECT count(*) FROM child;
 count 
-------
     1
(1 row)

UPDATE parent SET v1 = NULL, v2 = 'hello2' WHERE h = 1; -- should pass: v2 need not exist in parent
SELECT count(*) FROM child WHERE h = 100001 AND v1 IS NULL AND v2 = 'hello2';
 count 
-------
     1
(1 row)

UPDATE parent SET v1 = 4, v2 = 'hello' WHERE h = 1; -- child row should be unchanged
SELECT count(*) FROM child WHERE h = 100001 AND v1 IS NULL AND v2 = 'hello2';
 count 
-------
     1
(1 row)

TRUNCATE child, parent;
ALTER TABLE child DROP CONSTRAINT child_v1_v2_fkey;
-- ON DELETE/UPDATE SET DEFAULT composite
ALTER TABLE child ALTER COLUMN v1 SET DEFAULT :'v1';
ALTER TABLE child ALTER COLUMN v2 SET DEFAULT 'default';
ALTER TABLE child ADD CONSTRAINT child_v1_v2_fkey FOREIGN KEY(v1, v2) REFERENCES parent(v1, v2)
  ON DELETE SET DEFAULT ON UPDATE SET DEFAULT;
INSERT INTO parent VALUES (1, :'v1', 'hello'), (2, :'v2', 'world'), (3, :'v4', 'yugabyte');
INSERT INTO child VALUES (100001, :'v2', 'world'), (100002, :'v4', 'yugabyte');
SELECT count(*) FROM child;
 count 
-------
     2
(1 row)

UPDATE parent SET v1 = :'v3', v2 = 'world2' WHERE h = 2; -- should fail: default pair not in parent
ysqlsh:yb_commands/foreign_key_when_types_mismatch_helper.sql:190: ERROR:  insert or update on table "child" violates foreign key constraint "child_v1_v2_fkey"
DETAIL:  Key (v1, v2)=(32000, default) is not present in table "parent".
INSERT INTO parent VALUES (4, :'v1', 'default');
UPDATE parent SET v1 = :'v3', v2 = 'world2' WHERE h = 2; -- should pass
SELECT count(*) FROM child WHERE h = 100001 AND v1 = :'v3' AND v2 = 'world2';
 count 
-------
     0
(1 row)

SELECT count(*) FROM child WHERE h = 100001 AND v1 = :'v1' AND v2 = 'default';
 count 
-------
     1
(1 row)

DELETE FROM parent WHERE h = 3;
SELECT count(*) FROM child WHERE v1 = :'v1' AND v2 = 'default';
 count 
-------
     2
(1 row)

TRUNCATE child, parent;
ALTER TABLE child DROP CONSTRAINT child_v1_v2_fkey;
-- MATCH FULL
ALTER TABLE child ADD CONSTRAINT child_v1_v2_fkey FOREIGN KEY(v1, v2) REFERENCES parent(v1, v2)
  MATCH FULL ON DELETE CASCADE ON UPDATE CASCADE;
INSERT INTO parent VALUES (1, :'v1', 'hello');
INSERT INTO child VALUES (100001, :'v1', 'hello');
SELECT count(*) FROM child;
 count 
-------
     1
(1 row)

INSERT INTO parent VALUES (2, NULL, 'hello');
INSERT INTO child VALUES (100002, NULL, 'hello'); -- should fail
ysqlsh:yb_commands/foreign_key_when_types_mismatch_helper.sql:207: ERROR:  insert or update on table "child" violates foreign key constraint "child_v1_v2_fkey"
DETAIL:  MATCH FULL does not allow mixing of null and nonnull key values.
SELECT count(*) FROM child;
 count 
-------
     1
(1 row)

INSERT INTO child VALUES (100003, NULL, NULL); -- should pass
SELECT count(*) FROM child;
 count 
-------
     2
(1 row)

UPDATE child SET v1 = NULL; -- should fail
ysqlsh:yb_commands/foreign_key_when_types_mismatch_helper.sql:211: ERROR:  insert or update on table "child" violates foreign key constraint "child_v1_v2_fkey"
DETAIL:  MATCH FULL does not allow mixing of null and nonnull key values.
SELECT count(*) FROM child;
 count 
-------
     2
(1 row)

UPDATE child SET v1 = NULL, v2 = NULL; -- should pass
SELECT count(*) FROM child WHERE v1 IS NULL AND v2 IS NULL;
 count 
-------
     2
(1 row)

TRUNCATE child, parent;
ALTER TABLE child DROP CONSTRAINT child_v1_v2_fkey;
ALTER TABLE parent DROP CONSTRAINT parent_v1_v2_key;
ALTER TABLE parent DROP COLUMN v2;
ALTER TABLE child DROP COLUMN v2;
CREATE UNIQUE INDEX parent_v1_key ON parent(v1) SPLIT INTO 1 TABLETS;
-- cleanup
DROP TABLE child;
DROP TABLE parent;
-- int4 to bigserial
CREATE TABLE parent(h INT PRIMARY KEY, v1 BIGSERIAL) SPLIT INTO 1 TABLETS;
CREATE UNIQUE INDEX parent_v1_key ON parent(v1) SPLIT INTO 1 TABLETS;
CREATE TABLE child(h INT PRIMARY KEY, v1 INT, FOREIGN KEY(v1) REFERENCES parent(v1)
  ON DELETE CASCADE ON UPDATE CASCADE) SPLIT INTO 1 TABLETS;
\set v1 2023
\set v2 2025
\set v3 2024
\set v4 2026
\set v5 999
\set trap_parent_val -2147483648
\set trap_child_val 2147483648
\i yb_commands/foreign_key_when_types_mismatch_helper.sql
--
-- Helper for yb.orig.foreign_key_when_types_mismatch.sql.
--
-- Driver must CREATE parent(h, v1) and child(h, v1) with ON DELETE/UPDATE CASCADE.
-- parent(v1) must be backed by parent_v1_key with SPLIT INTO 1 TABLETS so FK batched
-- lookups hit a single tablet. Then set psql variables:
--   v1, v2, v3, v4, v5
--   trap_parent_val, trap_child_val
--
-- Each scenario inserts its own rows (parent h from 1, child h from 100001),
-- then TRUNCATEs both tables. The helper ends by dropping parent and child.
--
-- Scenarios (in order):
--   CASCADE, multi row insert, COPY, out of range insert/update,
--   SET NULL, NO ACTION deferrable (including COMMIT fail),
--   RESTRICT deferrable, partial null composite update, SET DEFAULT composite, MATCH FULL
--
-- CASCADE
INSERT INTO parent VALUES (1, :'v1');
INSERT INTO child VALUES (1, :'v1'); -- warm up catalog cache
DELETE FROM child WHERE h = 1; -- undo changes due to warm up
BEGIN TRANSACTION ISOLATION LEVEL SERIALIZABLE;
EXPLAIN (DIST, ANALYZE, COSTS OFF) INSERT INTO child VALUES (100001, :'v1');
                  QUERY PLAN                   
-----------------------------------------------
 Insert on child (actual rows=0 loops=1)
   ->  Result *RESULT* (actual rows=1 loops=1)
         Storage Table Write Requests: 1
 Trigger for constraint child_v1_fkey: calls=1
 Storage Read Requests: 1
 Storage Read Ops: 1
 Storage Rows Scanned: 1
 Storage Write Requests: 1
 Storage Flush Requests: 1
(9 rows)

COMMIT;
SELECT count(*) FROM child;
 count 
-------
     1
(1 row)

ALTER TABLE child DROP CONSTRAINT child_v1_fkey;
ALTER TABLE child ADD CONSTRAINT child_v1_fkey FOREIGN KEY(v1) REFERENCES parent(v1)
  ON DELETE CASCADE ON UPDATE CASCADE;
UPDATE parent SET v1 = :'v3' WHERE h = 1;
SELECT count(*) FROM child WHERE h = 100001 AND v1 = :'v3';
 count 
-------
     1
(1 row)

DELETE FROM parent WHERE h = 1;
SELECT count(*) FROM child;
 count 
-------
     0
(1 row)

INSERT INTO parent VALUES (1, :'v1');
INSERT INTO child VALUES (100002, :'v5'); -- should fail: no matching parent key
ysqlsh:yb_commands/foreign_key_when_types_mismatch_helper.sql:35: ERROR:  insert or update on table "child" violates foreign key constraint "child_v1_fkey"
DETAIL:  Key (v1)=(999) is not present in table "parent".
SELECT count(*) FROM child;
 count 
-------
     0
(1 row)

TRUNCATE child, parent;
-- multi row insert
INSERT INTO parent VALUES (1, :'v1'), (2, :'v2'), (3, :'v3');
INSERT INTO child VALUES (1, :'v1'); -- warm up catalog cache
DELETE FROM child WHERE h = 1; -- undo changes due to warm up
-- three distinct keys: run first with empty child for one batched FK read
BEGIN TRANSACTION ISOLATION LEVEL SERIALIZABLE;
EXPLAIN (DIST, ANALYZE, COSTS OFF) INSERT INTO child VALUES
  (100007, :'v1'), (100008, :'v2'), (100009, :'v3');
                       QUERY PLAN                        
---------------------------------------------------------
 Insert on child (actual rows=0 loops=1)
   ->  Values Scan on "*VALUES*" (actual rows=3 loops=1)
         Storage Table Write Requests: 3
 Trigger for constraint child_v1_fkey: calls=3
 Storage Read Requests: 1
 Storage Read Ops: 2
 Storage Rows Scanned: 3
 Storage Write Requests: 3
 Storage Flush Requests: 1
(9 rows)

COMMIT;
SELECT count(*) FROM child;
 count 
-------
     3
(1 row)

-- same key repeated
BEGIN TRANSACTION ISOLATION LEVEL SERIALIZABLE;
EXPLAIN (DIST, ANALYZE, COSTS OFF) INSERT INTO child VALUES
  (100004, :'v1'), (100005, :'v1'), (100006, :'v1');
                       QUERY PLAN                        
---------------------------------------------------------
 Insert on child (actual rows=0 loops=1)
   ->  Values Scan on "*VALUES*" (actual rows=3 loops=1)
         Storage Table Write Requests: 3
 Trigger for constraint child_v1_fkey: calls=3
 Storage Read Requests: 1
 Storage Read Ops: 1
 Storage Rows Scanned: 1
 Storage Write Requests: 3
 Storage Flush Requests: 1
(9 rows)

COMMIT;
SELECT count(*) FROM child;
 count 
-------
     6
(1 row)

-- two distinct keys with duplicate
BEGIN TRANSACTION ISOLATION LEVEL SERIALIZABLE;
EXPLAIN (DIST, ANALYZE, COSTS OFF) INSERT INTO child VALUES
  (100001, :'v1'), (100002, :'v1'), (100003, :'v2');
                       QUERY PLAN                        
---------------------------------------------------------
 Insert on child (actual rows=0 loops=1)
   ->  Values Scan on "*VALUES*" (actual rows=3 loops=1)
         Storage Table Write Requests: 3
 Trigger for constraint child_v1_fkey: calls=3
 Storage Read Requests: 1
 Storage Read Ops: 2
 Storage Rows Scanned: 2
 Storage Write Requests: 3
 Storage Flush Requests: 1
(9 rows)

COMMIT;
SELECT count(*) FROM child;
 count 
-------
     9
(1 row)

TRUNCATE child, parent;
-- COPY
INSERT INTO parent VALUES (1, :'v1'), (2, :'v2');
\set copy_cmd 'printf "100001\t' :v1 '\n100002\t' :v2 '\n"'
COPY child FROM PROGRAM :'copy_cmd';
SELECT count(*) FROM child;
 count 
-------
     2
(1 row)

\set copy_cmd 'printf "100003\t' :v1 '\n100004\t' :v2 '\n100005\t' :v5 '\n"'
COPY child FROM PROGRAM :'copy_cmd';
ysqlsh:yb_commands/foreign_key_when_types_mismatch_helper.sql:69: ERROR:  insert or update on table "child" violates foreign key constraint "child_v1_fkey"
DETAIL:  Key (v1)=(999) is not present in table "parent".
CONTEXT:  COPY child, line 4: ""
-- should fail: no matching parent key
SELECT count(*) FROM child;
 count 
-------
     2
(1 row)

INSERT INTO parent VALUES (3, :'trap_parent_val');
\set copy_cmd 'printf "100006\t' :trap_child_val '\n"'
COPY child FROM PROGRAM :'copy_cmd';
ysqlsh:yb_commands/foreign_key_when_types_mismatch_helper.sql:74: ERROR:  value "2147483648" is out of range for type integer
CONTEXT:  COPY child, line 1, column v1: "2147483648"
-- should fail: out of range
SELECT count(*) FROM child;
 count 
-------
     2
(1 row)

TRUNCATE child, parent;
-- out of range insert and parent update
INSERT INTO parent VALUES (1, :'trap_parent_val');
INSERT INTO child VALUES (100001, :'trap_child_val'); -- should fail: out of range
ysqlsh:yb_commands/foreign_key_when_types_mismatch_helper.sql:81: ERROR:  value "2147483648" is out of range for type integer
LINE 1: INSERT INTO child VALUES (100001, '2147483648');
                                          ^
SELECT count(*) FROM child;
 count 
-------
     0
(1 row)

INSERT INTO parent VALUES (2, :'trap_child_val');
INSERT INTO child VALUES (100002, :'trap_parent_val');
SELECT count(*) FROM child;
 count 
-------
     1
(1 row)

DELETE FROM parent WHERE h = 2;
SELECT count(*) FROM child;
 count 
-------
     1
(1 row)

DELETE FROM parent WHERE h = 1;
DELETE FROM child WHERE h = 100002;
INSERT INTO parent VALUES (1, :'v1');
INSERT INTO child VALUES (100002, :'v1');
SELECT count(*) FROM child;
 count 
-------
     1
(1 row)

UPDATE parent SET v1 = :'trap_child_val' WHERE h = 1; -- should fail: cannot fit child column
ysqlsh:yb_commands/foreign_key_when_types_mismatch_helper.sql:93: ERROR:  integer out of range
CONTEXT:  SQL statement "UPDATE ONLY "public"."child" SET "v1" = $1 WHERE $2 OPERATOR(pg_catalog.=) "v1""
SELECT count(*) FROM child WHERE h = 100002 AND v1 = :'v1';
 count 
-------
     1
(1 row)

TRUNCATE child, parent;
-- ON DELETE/UPDATE SET NULL
ALTER TABLE child DROP CONSTRAINT child_v1_fkey;
ALTER TABLE child ADD CONSTRAINT child_v1_fkey FOREIGN KEY(v1) REFERENCES parent(v1)
  ON DELETE SET NULL ON UPDATE SET NULL;
INSERT INTO parent VALUES (1, :'v4'), (2, :'v5');
INSERT INTO child VALUES (100001, :'v4'), (100002, :'v5');
SELECT count(*) FROM child;
 count 
-------
     2
(1 row)

UPDATE parent SET v1 = :'v3' WHERE h = 1;
SELECT count(*) FROM child WHERE h = 100001 AND v1 IS NULL;
 count 
-------
     1
(1 row)

DELETE FROM parent WHERE h = 2;
SELECT count(*) FROM child WHERE h = 100002 AND v1 IS NULL;
 count 
-------
     1
(1 row)

TRUNCATE child, parent;
-- ON DELETE/UPDATE NO ACTION deferrable
ALTER TABLE child DROP CONSTRAINT child_v1_fkey;
ALTER TABLE child ADD CONSTRAINT child_v1_fkey FOREIGN KEY(v1) REFERENCES parent(v1)
  ON DELETE NO ACTION ON UPDATE NO ACTION DEFERRABLE INITIALLY DEFERRED;
INSERT INTO parent VALUES (1, :'v4'), (2, :'v5');
INSERT INTO child VALUES (100001, :'v4'), (100002, :'v5');
SELECT count(*) FROM child;
 count 
-------
     2
(1 row)

UPDATE parent SET v1 = :'v3' WHERE h = 1; -- should fail: no matching parent key
ysqlsh:yb_commands/foreign_key_when_types_mismatch_helper.sql:117: ERROR:  update or delete on table "parent" violates foreign key constraint "child_v1_fkey" on table "child"
DETAIL:  Key (v1)=(2026) is still referenced from table "child".
DELETE FROM parent WHERE h = 2; -- should fail: no matching parent key
ysqlsh:yb_commands/foreign_key_when_types_mismatch_helper.sql:118: ERROR:  update or delete on table "parent" violates foreign key constraint "child_v1_fkey" on table "child"
DETAIL:  Key (v1)=(999) is still referenced from table "child".
SELECT count(*) FROM child;
 count 
-------
     2
(1 row)

BEGIN;
  UPDATE parent SET v1 = :'v3' WHERE h = 1; -- should pass for now
  INSERT INTO parent VALUES (3, :'v4');
COMMIT; -- should pass
SELECT count(*) FROM parent WHERE v1 = :'v3';
 count 
-------
     1
(1 row)

BEGIN;
  DELETE FROM parent WHERE h = 3; -- child still references :'v4'
COMMIT; -- should fail
ysqlsh:yb_commands/foreign_key_when_types_mismatch_helper.sql:127: ERROR:  update or delete on table "parent" violates foreign key constraint "child_v1_fkey" on table "child"
DETAIL:  Key (v1)=(2026) is still referenced from table "child".
SELECT count(*) FROM child;
 count 
-------
     2
(1 row)

BEGIN;
  DELETE FROM parent WHERE h = 2; -- should pass for now
  INSERT INTO parent VALUES (4, :'v5');
COMMIT; -- should pass
SELECT count(*) FROM parent WHERE h = 2;
 count 
-------
     0
(1 row)

BEGIN;
  DELETE FROM parent WHERE h = 4; -- child still references :'v5'
COMMIT; -- should fail
ysqlsh:yb_commands/foreign_key_when_types_mismatch_helper.sql:136: ERROR:  update or delete on table "parent" violates foreign key constraint "child_v1_fkey" on table "child"
DETAIL:  Key (v1)=(999) is still referenced from table "child".
SELECT count(*) FROM child;
 count 
-------
     2
(1 row)

TRUNCATE child, parent;
-- ON DELETE/UPDATE RESTRICT deferrable
ALTER TABLE child DROP CONSTRAINT child_v1_fkey;
ALTER TABLE child ADD CONSTRAINT child_v1_fkey FOREIGN KEY(v1) REFERENCES parent(v1)
  ON DELETE RESTRICT ON UPDATE RESTRICT DEFERRABLE INITIALLY DEFERRED;
INSERT INTO parent VALUES (1, :'v4'), (2, :'v5');
INSERT INTO child VALUES (100001, :'v4'), (100002, :'v5');
SELECT count(*) FROM child;
 count 
-------
     2
(1 row)

UPDATE parent SET v1 = :'v3' WHERE h = 1; -- should fail: no matching parent key
ysqlsh:yb_commands/foreign_key_when_types_mismatch_helper.sql:147: ERROR:  update or delete on table "parent" violates foreign key constraint "child_v1_fkey" on table "child"
DETAIL:  Key (v1)=(2026) is still referenced from table "child".
DELETE FROM parent WHERE h = 2; -- should fail: no matching parent key
ysqlsh:yb_commands/foreign_key_when_types_mismatch_helper.sql:148: ERROR:  update or delete on table "parent" violates foreign key constraint "child_v1_fkey" on table "child"
DETAIL:  Key (v1)=(999) is still referenced from table "child".
SELECT count(*) FROM child;
 count 
-------
     2
(1 row)

BEGIN;
  UPDATE parent SET v1 = :'v3' WHERE h = 1; -- should fail: no matching parent key
ysqlsh:yb_commands/foreign_key_when_types_mismatch_helper.sql:151: ERROR:  update or delete on table "parent" violates foreign key constraint "child_v1_fkey" on table "child"
DETAIL:  Key (v1)=(2026) is still referenced from table "child".
  INSERT INTO parent VALUES (3, :'v4');
ysqlsh:yb_commands/foreign_key_when_types_mismatch_helper.sql:152: ERROR:  current transaction is aborted, commands ignored until end of transaction block
COMMIT; -- should fail
SELECT count(*) FROM parent WHERE v1 = :'v3';
 count 
-------
     0
(1 row)

BEGIN;
  DELETE FROM parent WHERE h = 2; -- should fail: no matching parent key
ysqlsh:yb_commands/foreign_key_when_types_mismatch_helper.sql:156: ERROR:  update or delete on table "parent" violates foreign key constraint "child_v1_fkey" on table "child"
DETAIL:  Key (v1)=(999) is still referenced from table "child".
  INSERT INTO parent VALUES (4, :'v5');
ysqlsh:yb_commands/foreign_key_when_types_mismatch_helper.sql:157: ERROR:  current transaction is aborted, commands ignored until end of transaction block
COMMIT; -- should fail
SELECT count(*) FROM parent WHERE h = 2;
 count 
-------
     1
(1 row)

TRUNCATE child, parent;
-- setup a composite foreign key constraint
ALTER TABLE parent ADD COLUMN v2 TEXT;
ALTER TABLE child ADD COLUMN v2 VARCHAR(12);
ALTER TABLE child DROP CONSTRAINT child_v1_fkey;
DROP INDEX parent_v1_key;
ALTER TABLE parent ADD UNIQUE (v1, v2);
-- partial null composite update
ALTER TABLE child ADD CONSTRAINT child_v1_v2_fkey FOREIGN KEY(v1, v2) REFERENCES parent(v1, v2)
  ON DELETE CASCADE ON UPDATE CASCADE;
INSERT INTO parent VALUES (1, 1, 'hello');
INSERT INTO child VALUES (100001, 1, 'hello');
SELECT count(*) FROM child;
 count 
-------
     1
(1 row)

UPDATE parent SET v1 = NULL, v2 = 'hello2' WHERE h = 1; -- should pass: v2 need not exist in parent
ysqlsh:yb_commands/foreign_key_when_types_mismatch_helper.sql:175: ERROR:  null value in column "v1" of relation "parent" violates not-null constraint
DETAIL:  Failing row contains (1, null, hello2).
SELECT count(*) FROM child WHERE h = 100001 AND v1 IS NULL AND v2 = 'hello2';
 count 
-------
     0
(1 row)

UPDATE parent SET v1 = 4, v2 = 'hello' WHERE h = 1; -- child row should be unchanged
SELECT count(*) FROM child WHERE h = 100001 AND v1 IS NULL AND v2 = 'hello2';
 count 
-------
     0
(1 row)

TRUNCATE child, parent;
ALTER TABLE child DROP CONSTRAINT child_v1_v2_fkey;
-- ON DELETE/UPDATE SET DEFAULT composite
ALTER TABLE child ALTER COLUMN v1 SET DEFAULT :'v1';
ALTER TABLE child ALTER COLUMN v2 SET DEFAULT 'default';
ALTER TABLE child ADD CONSTRAINT child_v1_v2_fkey FOREIGN KEY(v1, v2) REFERENCES parent(v1, v2)
  ON DELETE SET DEFAULT ON UPDATE SET DEFAULT;
INSERT INTO parent VALUES (1, :'v1', 'hello'), (2, :'v2', 'world'), (3, :'v4', 'yugabyte');
INSERT INTO child VALUES (100001, :'v2', 'world'), (100002, :'v4', 'yugabyte');
SELECT count(*) FROM child;
 count 
-------
     2
(1 row)

UPDATE parent SET v1 = :'v3', v2 = 'world2' WHERE h = 2; -- should fail: default pair not in parent
ysqlsh:yb_commands/foreign_key_when_types_mismatch_helper.sql:190: ERROR:  insert or update on table "child" violates foreign key constraint "child_v1_v2_fkey"
DETAIL:  Key (v1, v2)=(2023, default) is not present in table "parent".
INSERT INTO parent VALUES (4, :'v1', 'default');
UPDATE parent SET v1 = :'v3', v2 = 'world2' WHERE h = 2; -- should pass
SELECT count(*) FROM child WHERE h = 100001 AND v1 = :'v3' AND v2 = 'world2';
 count 
-------
     0
(1 row)

SELECT count(*) FROM child WHERE h = 100001 AND v1 = :'v1' AND v2 = 'default';
 count 
-------
     1
(1 row)

DELETE FROM parent WHERE h = 3;
SELECT count(*) FROM child WHERE v1 = :'v1' AND v2 = 'default';
 count 
-------
     2
(1 row)

TRUNCATE child, parent;
ALTER TABLE child DROP CONSTRAINT child_v1_v2_fkey;
-- MATCH FULL
ALTER TABLE child ADD CONSTRAINT child_v1_v2_fkey FOREIGN KEY(v1, v2) REFERENCES parent(v1, v2)
  MATCH FULL ON DELETE CASCADE ON UPDATE CASCADE;
INSERT INTO parent VALUES (1, :'v1', 'hello');
INSERT INTO child VALUES (100001, :'v1', 'hello');
SELECT count(*) FROM child;
 count 
-------
     1
(1 row)

INSERT INTO parent VALUES (2, NULL, 'hello');
ysqlsh:yb_commands/foreign_key_when_types_mismatch_helper.sql:206: ERROR:  null value in column "v1" of relation "parent" violates not-null constraint
DETAIL:  Failing row contains (2, null, hello).
INSERT INTO child VALUES (100002, NULL, 'hello'); -- should fail
ysqlsh:yb_commands/foreign_key_when_types_mismatch_helper.sql:207: ERROR:  insert or update on table "child" violates foreign key constraint "child_v1_v2_fkey"
DETAIL:  MATCH FULL does not allow mixing of null and nonnull key values.
SELECT count(*) FROM child;
 count 
-------
     1
(1 row)

INSERT INTO child VALUES (100003, NULL, NULL); -- should pass
SELECT count(*) FROM child;
 count 
-------
     2
(1 row)

UPDATE child SET v1 = NULL; -- should fail
ysqlsh:yb_commands/foreign_key_when_types_mismatch_helper.sql:211: ERROR:  insert or update on table "child" violates foreign key constraint "child_v1_v2_fkey"
DETAIL:  MATCH FULL does not allow mixing of null and nonnull key values.
SELECT count(*) FROM child;
 count 
-------
     2
(1 row)

UPDATE child SET v1 = NULL, v2 = NULL; -- should pass
SELECT count(*) FROM child WHERE v1 IS NULL AND v2 IS NULL;
 count 
-------
     2
(1 row)

TRUNCATE child, parent;
ALTER TABLE child DROP CONSTRAINT child_v1_v2_fkey;
ALTER TABLE parent DROP CONSTRAINT parent_v1_v2_key;
ALTER TABLE parent DROP COLUMN v2;
ALTER TABLE child DROP COLUMN v2;
CREATE UNIQUE INDEX parent_v1_key ON parent(v1) SPLIT INTO 1 TABLETS;
-- cleanup
DROP TABLE child;
DROP TABLE parent;
-- int2 to smallserial
CREATE TABLE parent(h INT PRIMARY KEY, v1 SMALLSERIAL) SPLIT INTO 1 TABLETS;
CREATE UNIQUE INDEX parent_v1_key ON parent(v1) SPLIT INTO 1 TABLETS;
CREATE TABLE child(h INT PRIMARY KEY, v1 SMALLINT, FOREIGN KEY(v1) REFERENCES parent(v1)
  ON DELETE CASCADE ON UPDATE CASCADE) SPLIT INTO 1 TABLETS;
\set v1 4
\set v2 6
\set v3 5
\set v4 7
\set v5 999
\set trap_parent_val -32767
\set trap_child_val 32769
\i yb_commands/foreign_key_when_types_mismatch_helper.sql
--
-- Helper for yb.orig.foreign_key_when_types_mismatch.sql.
--
-- Driver must CREATE parent(h, v1) and child(h, v1) with ON DELETE/UPDATE CASCADE.
-- parent(v1) must be backed by parent_v1_key with SPLIT INTO 1 TABLETS so FK batched
-- lookups hit a single tablet. Then set psql variables:
--   v1, v2, v3, v4, v5
--   trap_parent_val, trap_child_val
--
-- Each scenario inserts its own rows (parent h from 1, child h from 100001),
-- then TRUNCATEs both tables. The helper ends by dropping parent and child.
--
-- Scenarios (in order):
--   CASCADE, multi row insert, COPY, out of range insert/update,
--   SET NULL, NO ACTION deferrable (including COMMIT fail),
--   RESTRICT deferrable, partial null composite update, SET DEFAULT composite, MATCH FULL
--
-- CASCADE
INSERT INTO parent VALUES (1, :'v1');
INSERT INTO child VALUES (1, :'v1'); -- warm up catalog cache
DELETE FROM child WHERE h = 1; -- undo changes due to warm up
BEGIN TRANSACTION ISOLATION LEVEL SERIALIZABLE;
EXPLAIN (DIST, ANALYZE, COSTS OFF) INSERT INTO child VALUES (100001, :'v1');
                  QUERY PLAN                   
-----------------------------------------------
 Insert on child (actual rows=0 loops=1)
   ->  Result *RESULT* (actual rows=1 loops=1)
         Storage Table Write Requests: 1
 Trigger for constraint child_v1_fkey: calls=1
 Storage Read Requests: 1
 Storage Read Ops: 1
 Storage Rows Scanned: 1
 Storage Write Requests: 1
 Storage Flush Requests: 1
(9 rows)

COMMIT;
SELECT count(*) FROM child;
 count 
-------
     1
(1 row)

ALTER TABLE child DROP CONSTRAINT child_v1_fkey;
ALTER TABLE child ADD CONSTRAINT child_v1_fkey FOREIGN KEY(v1) REFERENCES parent(v1)
  ON DELETE CASCADE ON UPDATE CASCADE;
UPDATE parent SET v1 = :'v3' WHERE h = 1;
SELECT count(*) FROM child WHERE h = 100001 AND v1 = :'v3';
 count 
-------
     1
(1 row)

DELETE FROM parent WHERE h = 1;
SELECT count(*) FROM child;
 count 
-------
     0
(1 row)

INSERT INTO parent VALUES (1, :'v1');
INSERT INTO child VALUES (100002, :'v5'); -- should fail: no matching parent key
ysqlsh:yb_commands/foreign_key_when_types_mismatch_helper.sql:35: ERROR:  insert or update on table "child" violates foreign key constraint "child_v1_fkey"
DETAIL:  Key (v1)=(999) is not present in table "parent".
SELECT count(*) FROM child;
 count 
-------
     0
(1 row)

TRUNCATE child, parent;
-- multi row insert
INSERT INTO parent VALUES (1, :'v1'), (2, :'v2'), (3, :'v3');
INSERT INTO child VALUES (1, :'v1'); -- warm up catalog cache
DELETE FROM child WHERE h = 1; -- undo changes due to warm up
-- three distinct keys: run first with empty child for one batched FK read
BEGIN TRANSACTION ISOLATION LEVEL SERIALIZABLE;
EXPLAIN (DIST, ANALYZE, COSTS OFF) INSERT INTO child VALUES
  (100007, :'v1'), (100008, :'v2'), (100009, :'v3');
                       QUERY PLAN                        
---------------------------------------------------------
 Insert on child (actual rows=0 loops=1)
   ->  Values Scan on "*VALUES*" (actual rows=3 loops=1)
         Storage Table Write Requests: 3
 Trigger for constraint child_v1_fkey: calls=3
 Storage Read Requests: 1
 Storage Read Ops: 3
 Storage Rows Scanned: 3
 Storage Write Requests: 3
 Storage Flush Requests: 1
(9 rows)

COMMIT;
SELECT count(*) FROM child;
 count 
-------
     3
(1 row)

-- same key repeated
BEGIN TRANSACTION ISOLATION LEVEL SERIALIZABLE;
EXPLAIN (DIST, ANALYZE, COSTS OFF) INSERT INTO child VALUES
  (100004, :'v1'), (100005, :'v1'), (100006, :'v1');
                       QUERY PLAN                        
---------------------------------------------------------
 Insert on child (actual rows=0 loops=1)
   ->  Values Scan on "*VALUES*" (actual rows=3 loops=1)
         Storage Table Write Requests: 3
 Trigger for constraint child_v1_fkey: calls=3
 Storage Read Requests: 1
 Storage Read Ops: 1
 Storage Rows Scanned: 1
 Storage Write Requests: 3
 Storage Flush Requests: 1
(9 rows)

COMMIT;
SELECT count(*) FROM child;
 count 
-------
     6
(1 row)

-- two distinct keys with duplicate
BEGIN TRANSACTION ISOLATION LEVEL SERIALIZABLE;
EXPLAIN (DIST, ANALYZE, COSTS OFF) INSERT INTO child VALUES
  (100001, :'v1'), (100002, :'v1'), (100003, :'v2');
                       QUERY PLAN                        
---------------------------------------------------------
 Insert on child (actual rows=0 loops=1)
   ->  Values Scan on "*VALUES*" (actual rows=3 loops=1)
         Storage Table Write Requests: 3
 Trigger for constraint child_v1_fkey: calls=3
 Storage Read Requests: 1
 Storage Read Ops: 2
 Storage Rows Scanned: 2
 Storage Write Requests: 3
 Storage Flush Requests: 1
(9 rows)

COMMIT;
SELECT count(*) FROM child;
 count 
-------
     9
(1 row)

TRUNCATE child, parent;
-- COPY
INSERT INTO parent VALUES (1, :'v1'), (2, :'v2');
\set copy_cmd 'printf "100001\t' :v1 '\n100002\t' :v2 '\n"'
COPY child FROM PROGRAM :'copy_cmd';
SELECT count(*) FROM child;
 count 
-------
     2
(1 row)

\set copy_cmd 'printf "100003\t' :v1 '\n100004\t' :v2 '\n100005\t' :v5 '\n"'
COPY child FROM PROGRAM :'copy_cmd';
ysqlsh:yb_commands/foreign_key_when_types_mismatch_helper.sql:69: ERROR:  insert or update on table "child" violates foreign key constraint "child_v1_fkey"
DETAIL:  Key (v1)=(999) is not present in table "parent".
CONTEXT:  COPY child, line 4: ""
-- should fail: no matching parent key
SELECT count(*) FROM child;
 count 
-------
     2
(1 row)

INSERT INTO parent VALUES (3, :'trap_parent_val');
\set copy_cmd 'printf "100006\t' :trap_child_val '\n"'
COPY child FROM PROGRAM :'copy_cmd';
ysqlsh:yb_commands/foreign_key_when_types_mismatch_helper.sql:74: ERROR:  value "32769" is out of range for type smallint
CONTEXT:  COPY child, line 1, column v1: "32769"
-- should fail: out of range
SELECT count(*) FROM child;
 count 
-------
     2
(1 row)

TRUNCATE child, parent;
-- out of range insert and parent update
INSERT INTO parent VALUES (1, :'trap_parent_val');
INSERT INTO child VALUES (100001, :'trap_child_val'); -- should fail: out of range
ysqlsh:yb_commands/foreign_key_when_types_mismatch_helper.sql:81: ERROR:  value "32769" is out of range for type smallint
LINE 1: INSERT INTO child VALUES (100001, '32769');
                                          ^
SELECT count(*) FROM child;
 count 
-------
     0
(1 row)

INSERT INTO parent VALUES (2, :'trap_child_val');
ysqlsh:yb_commands/foreign_key_when_types_mismatch_helper.sql:83: ERROR:  value "32769" is out of range for type smallint
LINE 1: INSERT INTO parent VALUES (2, '32769');
                                      ^
INSERT INTO child VALUES (100002, :'trap_parent_val');
SELECT count(*) FROM child;
 count 
-------
     1
(1 row)

DELETE FROM parent WHERE h = 2;
SELECT count(*) FROM child;
 count 
-------
     1
(1 row)

DELETE FROM parent WHERE h = 1;
DELETE FROM child WHERE h = 100002;
INSERT INTO parent VALUES (1, :'v1');
INSERT INTO child VALUES (100002, :'v1');
SELECT count(*) FROM child;
 count 
-------
     1
(1 row)

UPDATE parent SET v1 = :'trap_child_val' WHERE h = 1; -- should fail: cannot fit child column
ysqlsh:yb_commands/foreign_key_when_types_mismatch_helper.sql:93: ERROR:  value "32769" is out of range for type smallint
LINE 1: UPDATE parent SET v1 = '32769' WHERE h = 1;
                               ^
SELECT count(*) FROM child WHERE h = 100002 AND v1 = :'v1';
 count 
-------
     1
(1 row)

TRUNCATE child, parent;
-- ON DELETE/UPDATE SET NULL
ALTER TABLE child DROP CONSTRAINT child_v1_fkey;
ALTER TABLE child ADD CONSTRAINT child_v1_fkey FOREIGN KEY(v1) REFERENCES parent(v1)
  ON DELETE SET NULL ON UPDATE SET NULL;
INSERT INTO parent VALUES (1, :'v4'), (2, :'v5');
INSERT INTO child VALUES (100001, :'v4'), (100002, :'v5');
SELECT count(*) FROM child;
 count 
-------
     2
(1 row)

UPDATE parent SET v1 = :'v3' WHERE h = 1;
SELECT count(*) FROM child WHERE h = 100001 AND v1 IS NULL;
 count 
-------
     1
(1 row)

DELETE FROM parent WHERE h = 2;
SELECT count(*) FROM child WHERE h = 100002 AND v1 IS NULL;
 count 
-------
     1
(1 row)

TRUNCATE child, parent;
-- ON DELETE/UPDATE NO ACTION deferrable
ALTER TABLE child DROP CONSTRAINT child_v1_fkey;
ALTER TABLE child ADD CONSTRAINT child_v1_fkey FOREIGN KEY(v1) REFERENCES parent(v1)
  ON DELETE NO ACTION ON UPDATE NO ACTION DEFERRABLE INITIALLY DEFERRED;
INSERT INTO parent VALUES (1, :'v4'), (2, :'v5');
INSERT INTO child VALUES (100001, :'v4'), (100002, :'v5');
SELECT count(*) FROM child;
 count 
-------
     2
(1 row)

UPDATE parent SET v1 = :'v3' WHERE h = 1; -- should fail: no matching parent key
ysqlsh:yb_commands/foreign_key_when_types_mismatch_helper.sql:117: ERROR:  update or delete on table "parent" violates foreign key constraint "child_v1_fkey" on table "child"
DETAIL:  Key (v1)=(7) is still referenced from table "child".
DELETE FROM parent WHERE h = 2; -- should fail: no matching parent key
ysqlsh:yb_commands/foreign_key_when_types_mismatch_helper.sql:118: ERROR:  update or delete on table "parent" violates foreign key constraint "child_v1_fkey" on table "child"
DETAIL:  Key (v1)=(999) is still referenced from table "child".
SELECT count(*) FROM child;
 count 
-------
     2
(1 row)

BEGIN;
  UPDATE parent SET v1 = :'v3' WHERE h = 1; -- should pass for now
  INSERT INTO parent VALUES (3, :'v4');
COMMIT; -- should pass
SELECT count(*) FROM parent WHERE v1 = :'v3';
 count 
-------
     1
(1 row)

BEGIN;
  DELETE FROM parent WHERE h = 3; -- child still references :'v4'
COMMIT; -- should fail
ysqlsh:yb_commands/foreign_key_when_types_mismatch_helper.sql:127: ERROR:  update or delete on table "parent" violates foreign key constraint "child_v1_fkey" on table "child"
DETAIL:  Key (v1)=(7) is still referenced from table "child".
SELECT count(*) FROM child;
 count 
-------
     2
(1 row)

BEGIN;
  DELETE FROM parent WHERE h = 2; -- should pass for now
  INSERT INTO parent VALUES (4, :'v5');
COMMIT; -- should pass
SELECT count(*) FROM parent WHERE h = 2;
 count 
-------
     0
(1 row)

BEGIN;
  DELETE FROM parent WHERE h = 4; -- child still references :'v5'
COMMIT; -- should fail
ysqlsh:yb_commands/foreign_key_when_types_mismatch_helper.sql:136: ERROR:  update or delete on table "parent" violates foreign key constraint "child_v1_fkey" on table "child"
DETAIL:  Key (v1)=(999) is still referenced from table "child".
SELECT count(*) FROM child;
 count 
-------
     2
(1 row)

TRUNCATE child, parent;
-- ON DELETE/UPDATE RESTRICT deferrable
ALTER TABLE child DROP CONSTRAINT child_v1_fkey;
ALTER TABLE child ADD CONSTRAINT child_v1_fkey FOREIGN KEY(v1) REFERENCES parent(v1)
  ON DELETE RESTRICT ON UPDATE RESTRICT DEFERRABLE INITIALLY DEFERRED;
INSERT INTO parent VALUES (1, :'v4'), (2, :'v5');
INSERT INTO child VALUES (100001, :'v4'), (100002, :'v5');
SELECT count(*) FROM child;
 count 
-------
     2
(1 row)

UPDATE parent SET v1 = :'v3' WHERE h = 1; -- should fail: no matching parent key
ysqlsh:yb_commands/foreign_key_when_types_mismatch_helper.sql:147: ERROR:  update or delete on table "parent" violates foreign key constraint "child_v1_fkey" on table "child"
DETAIL:  Key (v1)=(7) is still referenced from table "child".
DELETE FROM parent WHERE h = 2; -- should fail: no matching parent key
ysqlsh:yb_commands/foreign_key_when_types_mismatch_helper.sql:148: ERROR:  update or delete on table "parent" violates foreign key constraint "child_v1_fkey" on table "child"
DETAIL:  Key (v1)=(999) is still referenced from table "child".
SELECT count(*) FROM child;
 count 
-------
     2
(1 row)

BEGIN;
  UPDATE parent SET v1 = :'v3' WHERE h = 1; -- should fail: no matching parent key
ysqlsh:yb_commands/foreign_key_when_types_mismatch_helper.sql:151: ERROR:  update or delete on table "parent" violates foreign key constraint "child_v1_fkey" on table "child"
DETAIL:  Key (v1)=(7) is still referenced from table "child".
  INSERT INTO parent VALUES (3, :'v4');
ysqlsh:yb_commands/foreign_key_when_types_mismatch_helper.sql:152: ERROR:  current transaction is aborted, commands ignored until end of transaction block
COMMIT; -- should fail
SELECT count(*) FROM parent WHERE v1 = :'v3';
 count 
-------
     0
(1 row)

BEGIN;
  DELETE FROM parent WHERE h = 2; -- should fail: no matching parent key
ysqlsh:yb_commands/foreign_key_when_types_mismatch_helper.sql:156: ERROR:  update or delete on table "parent" violates foreign key constraint "child_v1_fkey" on table "child"
DETAIL:  Key (v1)=(999) is still referenced from table "child".
  INSERT INTO parent VALUES (4, :'v5');
ysqlsh:yb_commands/foreign_key_when_types_mismatch_helper.sql:157: ERROR:  current transaction is aborted, commands ignored until end of transaction block
COMMIT; -- should fail
SELECT count(*) FROM parent WHERE h = 2;
 count 
-------
     1
(1 row)

TRUNCATE child, parent;
-- setup a composite foreign key constraint
ALTER TABLE parent ADD COLUMN v2 TEXT;
ALTER TABLE child ADD COLUMN v2 VARCHAR(12);
ALTER TABLE child DROP CONSTRAINT child_v1_fkey;
DROP INDEX parent_v1_key;
ALTER TABLE parent ADD UNIQUE (v1, v2);
-- partial null composite update
ALTER TABLE child ADD CONSTRAINT child_v1_v2_fkey FOREIGN KEY(v1, v2) REFERENCES parent(v1, v2)
  ON DELETE CASCADE ON UPDATE CASCADE;
INSERT INTO parent VALUES (1, 1, 'hello');
INSERT INTO child VALUES (100001, 1, 'hello');
SELECT count(*) FROM child;
 count 
-------
     1
(1 row)

UPDATE parent SET v1 = NULL, v2 = 'hello2' WHERE h = 1; -- should pass: v2 need not exist in parent
ysqlsh:yb_commands/foreign_key_when_types_mismatch_helper.sql:175: ERROR:  null value in column "v1" of relation "parent" violates not-null constraint
DETAIL:  Failing row contains (1, null, hello2).
SELECT count(*) FROM child WHERE h = 100001 AND v1 IS NULL AND v2 = 'hello2';
 count 
-------
     0
(1 row)

UPDATE parent SET v1 = 4, v2 = 'hello' WHERE h = 1; -- child row should be unchanged
SELECT count(*) FROM child WHERE h = 100001 AND v1 IS NULL AND v2 = 'hello2';
 count 
-------
     0
(1 row)

TRUNCATE child, parent;
ALTER TABLE child DROP CONSTRAINT child_v1_v2_fkey;
-- ON DELETE/UPDATE SET DEFAULT composite
ALTER TABLE child ALTER COLUMN v1 SET DEFAULT :'v1';
ALTER TABLE child ALTER COLUMN v2 SET DEFAULT 'default';
ALTER TABLE child ADD CONSTRAINT child_v1_v2_fkey FOREIGN KEY(v1, v2) REFERENCES parent(v1, v2)
  ON DELETE SET DEFAULT ON UPDATE SET DEFAULT;
INSERT INTO parent VALUES (1, :'v1', 'hello'), (2, :'v2', 'world'), (3, :'v4', 'yugabyte');
INSERT INTO child VALUES (100001, :'v2', 'world'), (100002, :'v4', 'yugabyte');
SELECT count(*) FROM child;
 count 
-------
     2
(1 row)

UPDATE parent SET v1 = :'v3', v2 = 'world2' WHERE h = 2; -- should fail: default pair not in parent
ysqlsh:yb_commands/foreign_key_when_types_mismatch_helper.sql:190: ERROR:  insert or update on table "child" violates foreign key constraint "child_v1_v2_fkey"
DETAIL:  Key (v1, v2)=(4, default) is not present in table "parent".
INSERT INTO parent VALUES (4, :'v1', 'default');
UPDATE parent SET v1 = :'v3', v2 = 'world2' WHERE h = 2; -- should pass
SELECT count(*) FROM child WHERE h = 100001 AND v1 = :'v3' AND v2 = 'world2';
 count 
-------
     0
(1 row)

SELECT count(*) FROM child WHERE h = 100001 AND v1 = :'v1' AND v2 = 'default';
 count 
-------
     1
(1 row)

DELETE FROM parent WHERE h = 3;
SELECT count(*) FROM child WHERE v1 = :'v1' AND v2 = 'default';
 count 
-------
     2
(1 row)

TRUNCATE child, parent;
ALTER TABLE child DROP CONSTRAINT child_v1_v2_fkey;
-- MATCH FULL
ALTER TABLE child ADD CONSTRAINT child_v1_v2_fkey FOREIGN KEY(v1, v2) REFERENCES parent(v1, v2)
  MATCH FULL ON DELETE CASCADE ON UPDATE CASCADE;
INSERT INTO parent VALUES (1, :'v1', 'hello');
INSERT INTO child VALUES (100001, :'v1', 'hello');
SELECT count(*) FROM child;
 count 
-------
     1
(1 row)

INSERT INTO parent VALUES (2, NULL, 'hello');
ysqlsh:yb_commands/foreign_key_when_types_mismatch_helper.sql:206: ERROR:  null value in column "v1" of relation "parent" violates not-null constraint
DETAIL:  Failing row contains (2, null, hello).
INSERT INTO child VALUES (100002, NULL, 'hello'); -- should fail
ysqlsh:yb_commands/foreign_key_when_types_mismatch_helper.sql:207: ERROR:  insert or update on table "child" violates foreign key constraint "child_v1_v2_fkey"
DETAIL:  MATCH FULL does not allow mixing of null and nonnull key values.
SELECT count(*) FROM child;
 count 
-------
     1
(1 row)

INSERT INTO child VALUES (100003, NULL, NULL); -- should pass
SELECT count(*) FROM child;
 count 
-------
     2
(1 row)

UPDATE child SET v1 = NULL; -- should fail
ysqlsh:yb_commands/foreign_key_when_types_mismatch_helper.sql:211: ERROR:  insert or update on table "child" violates foreign key constraint "child_v1_v2_fkey"
DETAIL:  MATCH FULL does not allow mixing of null and nonnull key values.
SELECT count(*) FROM child;
 count 
-------
     2
(1 row)

UPDATE child SET v1 = NULL, v2 = NULL; -- should pass
SELECT count(*) FROM child WHERE v1 IS NULL AND v2 IS NULL;
 count 
-------
     2
(1 row)

TRUNCATE child, parent;
ALTER TABLE child DROP CONSTRAINT child_v1_v2_fkey;
ALTER TABLE parent DROP CONSTRAINT parent_v1_v2_key;
ALTER TABLE parent DROP COLUMN v2;
ALTER TABLE child DROP COLUMN v2;
CREATE UNIQUE INDEX parent_v1_key ON parent(v1) SPLIT INTO 1 TABLETS;
-- cleanup
DROP TABLE child;
DROP TABLE parent;
-- smallserial to bigserial
CREATE TABLE parent(h INT PRIMARY KEY, v1 BIGSERIAL) SPLIT INTO 1 TABLETS;
CREATE UNIQUE INDEX parent_v1_key ON parent(v1) SPLIT INTO 1 TABLETS;
CREATE TABLE child(h INT PRIMARY KEY, v1 SMALLSERIAL, FOREIGN KEY(v1) REFERENCES parent(v1)
  ON DELETE CASCADE ON UPDATE CASCADE) SPLIT INTO 1 TABLETS;
\set v1 49
\set v2 51
\set v3 50
\set v4 52
\set v5 999
\set trap_parent_val -32767
\set trap_child_val 32769
\i yb_commands/foreign_key_when_types_mismatch_helper.sql
--
-- Helper for yb.orig.foreign_key_when_types_mismatch.sql.
--
-- Driver must CREATE parent(h, v1) and child(h, v1) with ON DELETE/UPDATE CASCADE.
-- parent(v1) must be backed by parent_v1_key with SPLIT INTO 1 TABLETS so FK batched
-- lookups hit a single tablet. Then set psql variables:
--   v1, v2, v3, v4, v5
--   trap_parent_val, trap_child_val
--
-- Each scenario inserts its own rows (parent h from 1, child h from 100001),
-- then TRUNCATEs both tables. The helper ends by dropping parent and child.
--
-- Scenarios (in order):
--   CASCADE, multi row insert, COPY, out of range insert/update,
--   SET NULL, NO ACTION deferrable (including COMMIT fail),
--   RESTRICT deferrable, partial null composite update, SET DEFAULT composite, MATCH FULL
--
-- CASCADE
INSERT INTO parent VALUES (1, :'v1');
INSERT INTO child VALUES (1, :'v1'); -- warm up catalog cache
DELETE FROM child WHERE h = 1; -- undo changes due to warm up
BEGIN TRANSACTION ISOLATION LEVEL SERIALIZABLE;
EXPLAIN (DIST, ANALYZE, COSTS OFF) INSERT INTO child VALUES (100001, :'v1');
                  QUERY PLAN                   
-----------------------------------------------
 Insert on child (actual rows=0 loops=1)
   ->  Result *RESULT* (actual rows=1 loops=1)
         Storage Table Write Requests: 1
 Trigger for constraint child_v1_fkey: calls=1
 Storage Read Requests: 1
 Storage Read Ops: 1
 Storage Rows Scanned: 1
 Storage Write Requests: 1
 Storage Flush Requests: 1
(9 rows)

COMMIT;
SELECT count(*) FROM child;
 count 
-------
     1
(1 row)

ALTER TABLE child DROP CONSTRAINT child_v1_fkey;
ALTER TABLE child ADD CONSTRAINT child_v1_fkey FOREIGN KEY(v1) REFERENCES parent(v1)
  ON DELETE CASCADE ON UPDATE CASCADE;
UPDATE parent SET v1 = :'v3' WHERE h = 1;
SELECT count(*) FROM child WHERE h = 100001 AND v1 = :'v3';
 count 
-------
     1
(1 row)

DELETE FROM parent WHERE h = 1;
SELECT count(*) FROM child;
 count 
-------
     0
(1 row)

INSERT INTO parent VALUES (1, :'v1');
INSERT INTO child VALUES (100002, :'v5'); -- should fail: no matching parent key
ysqlsh:yb_commands/foreign_key_when_types_mismatch_helper.sql:35: ERROR:  insert or update on table "child" violates foreign key constraint "child_v1_fkey"
DETAIL:  Key (v1)=(999) is not present in table "parent".
SELECT count(*) FROM child;
 count 
-------
     0
(1 row)

TRUNCATE child, parent;
-- multi row insert
INSERT INTO parent VALUES (1, :'v1'), (2, :'v2'), (3, :'v3');
INSERT INTO child VALUES (1, :'v1'); -- warm up catalog cache
DELETE FROM child WHERE h = 1; -- undo changes due to warm up
-- three distinct keys: run first with empty child for one batched FK read
BEGIN TRANSACTION ISOLATION LEVEL SERIALIZABLE;
EXPLAIN (DIST, ANALYZE, COSTS OFF) INSERT INTO child VALUES
  (100007, :'v1'), (100008, :'v2'), (100009, :'v3');
                       QUERY PLAN                        
---------------------------------------------------------
 Insert on child (actual rows=0 loops=1)
   ->  Values Scan on "*VALUES*" (actual rows=3 loops=1)
         Storage Table Write Requests: 3
 Trigger for constraint child_v1_fkey: calls=3
 Storage Read Requests: 1
 Storage Read Ops: 1
 Storage Rows Scanned: 3
 Storage Write Requests: 3
 Storage Flush Requests: 1
(9 rows)

COMMIT;
SELECT count(*) FROM child;
 count 
-------
     3
(1 row)

-- same key repeated
BEGIN TRANSACTION ISOLATION LEVEL SERIALIZABLE;
EXPLAIN (DIST, ANALYZE, COSTS OFF) INSERT INTO child VALUES
  (100004, :'v1'), (100005, :'v1'), (100006, :'v1');
                       QUERY PLAN                        
---------------------------------------------------------
 Insert on child (actual rows=0 loops=1)
   ->  Values Scan on "*VALUES*" (actual rows=3 loops=1)
         Storage Table Write Requests: 3
 Trigger for constraint child_v1_fkey: calls=3
 Storage Read Requests: 1
 Storage Read Ops: 1
 Storage Rows Scanned: 1
 Storage Write Requests: 3
 Storage Flush Requests: 1
(9 rows)

COMMIT;
SELECT count(*) FROM child;
 count 
-------
     6
(1 row)

-- two distinct keys with duplicate
BEGIN TRANSACTION ISOLATION LEVEL SERIALIZABLE;
EXPLAIN (DIST, ANALYZE, COSTS OFF) INSERT INTO child VALUES
  (100001, :'v1'), (100002, :'v1'), (100003, :'v2');
                       QUERY PLAN                        
---------------------------------------------------------
 Insert on child (actual rows=0 loops=1)
   ->  Values Scan on "*VALUES*" (actual rows=3 loops=1)
         Storage Table Write Requests: 3
 Trigger for constraint child_v1_fkey: calls=3
 Storage Read Requests: 1
 Storage Read Ops: 1
 Storage Rows Scanned: 2
 Storage Write Requests: 3
 Storage Flush Requests: 1
(9 rows)

COMMIT;
SELECT count(*) FROM child;
 count 
-------
     9
(1 row)

TRUNCATE child, parent;
-- COPY
INSERT INTO parent VALUES (1, :'v1'), (2, :'v2');
\set copy_cmd 'printf "100001\t' :v1 '\n100002\t' :v2 '\n"'
COPY child FROM PROGRAM :'copy_cmd';
SELECT count(*) FROM child;
 count 
-------
     2
(1 row)

\set copy_cmd 'printf "100003\t' :v1 '\n100004\t' :v2 '\n100005\t' :v5 '\n"'
COPY child FROM PROGRAM :'copy_cmd';
ysqlsh:yb_commands/foreign_key_when_types_mismatch_helper.sql:69: ERROR:  insert or update on table "child" violates foreign key constraint "child_v1_fkey"
DETAIL:  Key (v1)=(999) is not present in table "parent".
CONTEXT:  COPY child, line 4: ""
-- should fail: no matching parent key
SELECT count(*) FROM child;
 count 
-------
     2
(1 row)

INSERT INTO parent VALUES (3, :'trap_parent_val');
\set copy_cmd 'printf "100006\t' :trap_child_val '\n"'
COPY child FROM PROGRAM :'copy_cmd';
ysqlsh:yb_commands/foreign_key_when_types_mismatch_helper.sql:74: ERROR:  value "32769" is out of range for type smallint
CONTEXT:  COPY child, line 1, column v1: "32769"
-- should fail: out of range
SELECT count(*) FROM child;
 count 
-------
     2
(1 row)

TRUNCATE child, parent;
-- out of range insert and parent update
INSERT INTO parent VALUES (1, :'trap_parent_val');
INSERT INTO child VALUES (100001, :'trap_child_val'); -- should fail: out of range
ysqlsh:yb_commands/foreign_key_when_types_mismatch_helper.sql:81: ERROR:  value "32769" is out of range for type smallint
LINE 1: INSERT INTO child VALUES (100001, '32769');
                                          ^
SELECT count(*) FROM child;
 count 
-------
     0
(1 row)

INSERT INTO parent VALUES (2, :'trap_child_val');
INSERT INTO child VALUES (100002, :'trap_parent_val');
SELECT count(*) FROM child;
 count 
-------
     1
(1 row)

DELETE FROM parent WHERE h = 2;
SELECT count(*) FROM child;
 count 
-------
     1
(1 row)

DELETE FROM parent WHERE h = 1;
DELETE FROM child WHERE h = 100002;
INSERT INTO parent VALUES (1, :'v1');
INSERT INTO child VALUES (100002, :'v1');
SELECT count(*) FROM child;
 count 
-------
     1
(1 row)

UPDATE parent SET v1 = :'trap_child_val' WHERE h = 1; -- should fail: cannot fit child column
ysqlsh:yb_commands/foreign_key_when_types_mismatch_helper.sql:93: ERROR:  smallint out of range
CONTEXT:  SQL statement "UPDATE ONLY "public"."child" SET "v1" = $1 WHERE $2 OPERATOR(pg_catalog.=) "v1""
SELECT count(*) FROM child WHERE h = 100002 AND v1 = :'v1';
 count 
-------
     1
(1 row)

TRUNCATE child, parent;
-- ON DELETE/UPDATE SET NULL
ALTER TABLE child DROP CONSTRAINT child_v1_fkey;
ALTER TABLE child ADD CONSTRAINT child_v1_fkey FOREIGN KEY(v1) REFERENCES parent(v1)
  ON DELETE SET NULL ON UPDATE SET NULL;
INSERT INTO parent VALUES (1, :'v4'), (2, :'v5');
INSERT INTO child VALUES (100001, :'v4'), (100002, :'v5');
SELECT count(*) FROM child;
 count 
-------
     2
(1 row)

UPDATE parent SET v1 = :'v3' WHERE h = 1;
ysqlsh:yb_commands/foreign_key_when_types_mismatch_helper.sql:104: ERROR:  null value in column "v1" of relation "child" violates not-null constraint
DETAIL:  Failing row contains (100001, null).
CONTEXT:  SQL statement "UPDATE ONLY "public"."child" SET "v1" = NULL WHERE $1 OPERATOR(pg_catalog.=) "v1""
SELECT count(*) FROM child WHERE h = 100001 AND v1 IS NULL;
 count 
-------
     0
(1 row)

DELETE FROM parent WHERE h = 2;
ysqlsh:yb_commands/foreign_key_when_types_mismatch_helper.sql:106: ERROR:  null value in column "v1" of relation "child" violates not-null constraint
DETAIL:  Failing row contains (100002, null).
CONTEXT:  SQL statement "UPDATE ONLY "public"."child" SET "v1" = NULL WHERE $1 OPERATOR(pg_catalog.=) "v1""
SELECT count(*) FROM child WHERE h = 100002 AND v1 IS NULL;
 count 
-------
     0
(1 row)

TRUNCATE child, parent;
-- ON DELETE/UPDATE NO ACTION deferrable
ALTER TABLE child DROP CONSTRAINT child_v1_fkey;
ALTER TABLE child ADD CONSTRAINT child_v1_fkey FOREIGN KEY(v1) REFERENCES parent(v1)
  ON DELETE NO ACTION ON UPDATE NO ACTION DEFERRABLE INITIALLY DEFERRED;
INSERT INTO parent VALUES (1, :'v4'), (2, :'v5');
INSERT INTO child VALUES (100001, :'v4'), (100002, :'v5');
SELECT count(*) FROM child;
 count 
-------
     2
(1 row)

UPDATE parent SET v1 = :'v3' WHERE h = 1; -- should fail: no matching parent key
ysqlsh:yb_commands/foreign_key_when_types_mismatch_helper.sql:117: ERROR:  update or delete on table "parent" violates foreign key constraint "child_v1_fkey" on table "child"
DETAIL:  Key (v1)=(52) is still referenced from table "child".
DELETE FROM parent WHERE h = 2; -- should fail: no matching parent key
ysqlsh:yb_commands/foreign_key_when_types_mismatch_helper.sql:118: ERROR:  update or delete on table "parent" violates foreign key constraint "child_v1_fkey" on table "child"
DETAIL:  Key (v1)=(999) is still referenced from table "child".
SELECT count(*) FROM child;
 count 
-------
     2
(1 row)

BEGIN;
  UPDATE parent SET v1 = :'v3' WHERE h = 1; -- should pass for now
  INSERT INTO parent VALUES (3, :'v4');
COMMIT; -- should pass
SELECT count(*) FROM parent WHERE v1 = :'v3';
 count 
-------
     1
(1 row)

BEGIN;
  DELETE FROM parent WHERE h = 3; -- child still references :'v4'
COMMIT; -- should fail
ysqlsh:yb_commands/foreign_key_when_types_mismatch_helper.sql:127: ERROR:  update or delete on table "parent" violates foreign key constraint "child_v1_fkey" on table "child"
DETAIL:  Key (v1)=(52) is still referenced from table "child".
SELECT count(*) FROM child;
 count 
-------
     2
(1 row)

BEGIN;
  DELETE FROM parent WHERE h = 2; -- should pass for now
  INSERT INTO parent VALUES (4, :'v5');
COMMIT; -- should pass
SELECT count(*) FROM parent WHERE h = 2;
 count 
-------
     0
(1 row)

BEGIN;
  DELETE FROM parent WHERE h = 4; -- child still references :'v5'
COMMIT; -- should fail
ysqlsh:yb_commands/foreign_key_when_types_mismatch_helper.sql:136: ERROR:  update or delete on table "parent" violates foreign key constraint "child_v1_fkey" on table "child"
DETAIL:  Key (v1)=(999) is still referenced from table "child".
SELECT count(*) FROM child;
 count 
-------
     2
(1 row)

TRUNCATE child, parent;
-- ON DELETE/UPDATE RESTRICT deferrable
ALTER TABLE child DROP CONSTRAINT child_v1_fkey;
ALTER TABLE child ADD CONSTRAINT child_v1_fkey FOREIGN KEY(v1) REFERENCES parent(v1)
  ON DELETE RESTRICT ON UPDATE RESTRICT DEFERRABLE INITIALLY DEFERRED;
INSERT INTO parent VALUES (1, :'v4'), (2, :'v5');
INSERT INTO child VALUES (100001, :'v4'), (100002, :'v5');
SELECT count(*) FROM child;
 count 
-------
     2
(1 row)

UPDATE parent SET v1 = :'v3' WHERE h = 1; -- should fail: no matching parent key
ysqlsh:yb_commands/foreign_key_when_types_mismatch_helper.sql:147: ERROR:  update or delete on table "parent" violates foreign key constraint "child_v1_fkey" on table "child"
DETAIL:  Key (v1)=(52) is still referenced from table "child".
DELETE FROM parent WHERE h = 2; -- should fail: no matching parent key
ysqlsh:yb_commands/foreign_key_when_types_mismatch_helper.sql:148: ERROR:  update or delete on table "parent" violates foreign key constraint "child_v1_fkey" on table "child"
DETAIL:  Key (v1)=(999) is still referenced from table "child".
SELECT count(*) FROM child;
 count 
-------
     2
(1 row)

BEGIN;
  UPDATE parent SET v1 = :'v3' WHERE h = 1; -- should fail: no matching parent key
ysqlsh:yb_commands/foreign_key_when_types_mismatch_helper.sql:151: ERROR:  update or delete on table "parent" violates foreign key constraint "child_v1_fkey" on table "child"
DETAIL:  Key (v1)=(52) is still referenced from table "child".
  INSERT INTO parent VALUES (3, :'v4');
ysqlsh:yb_commands/foreign_key_when_types_mismatch_helper.sql:152: ERROR:  current transaction is aborted, commands ignored until end of transaction block
COMMIT; -- should fail
SELECT count(*) FROM parent WHERE v1 = :'v3';
 count 
-------
     0
(1 row)

BEGIN;
  DELETE FROM parent WHERE h = 2; -- should fail: no matching parent key
ysqlsh:yb_commands/foreign_key_when_types_mismatch_helper.sql:156: ERROR:  update or delete on table "parent" violates foreign key constraint "child_v1_fkey" on table "child"
DETAIL:  Key (v1)=(999) is still referenced from table "child".
  INSERT INTO parent VALUES (4, :'v5');
ysqlsh:yb_commands/foreign_key_when_types_mismatch_helper.sql:157: ERROR:  current transaction is aborted, commands ignored until end of transaction block
COMMIT; -- should fail
SELECT count(*) FROM parent WHERE h = 2;
 count 
-------
     1
(1 row)

TRUNCATE child, parent;
-- setup a composite foreign key constraint
ALTER TABLE parent ADD COLUMN v2 TEXT;
ALTER TABLE child ADD COLUMN v2 VARCHAR(12);
ALTER TABLE child DROP CONSTRAINT child_v1_fkey;
DROP INDEX parent_v1_key;
ALTER TABLE parent ADD UNIQUE (v1, v2);
-- partial null composite update
ALTER TABLE child ADD CONSTRAINT child_v1_v2_fkey FOREIGN KEY(v1, v2) REFERENCES parent(v1, v2)
  ON DELETE CASCADE ON UPDATE CASCADE;
INSERT INTO parent VALUES (1, 1, 'hello');
INSERT INTO child VALUES (100001, 1, 'hello');
SELECT count(*) FROM child;
 count 
-------
     1
(1 row)

UPDATE parent SET v1 = NULL, v2 = 'hello2' WHERE h = 1; -- should pass: v2 need not exist in parent
ysqlsh:yb_commands/foreign_key_when_types_mismatch_helper.sql:175: ERROR:  null value in column "v1" of relation "parent" violates not-null constraint
DETAIL:  Failing row contains (1, null, hello2).
SELECT count(*) FROM child WHERE h = 100001 AND v1 IS NULL AND v2 = 'hello2';
 count 
-------
     0
(1 row)

UPDATE parent SET v1 = 4, v2 = 'hello' WHERE h = 1; -- child row should be unchanged
SELECT count(*) FROM child WHERE h = 100001 AND v1 IS NULL AND v2 = 'hello2';
 count 
-------
     0
(1 row)

TRUNCATE child, parent;
ALTER TABLE child DROP CONSTRAINT child_v1_v2_fkey;
-- ON DELETE/UPDATE SET DEFAULT composite
ALTER TABLE child ALTER COLUMN v1 SET DEFAULT :'v1';
ALTER TABLE child ALTER COLUMN v2 SET DEFAULT 'default';
ALTER TABLE child ADD CONSTRAINT child_v1_v2_fkey FOREIGN KEY(v1, v2) REFERENCES parent(v1, v2)
  ON DELETE SET DEFAULT ON UPDATE SET DEFAULT;
INSERT INTO parent VALUES (1, :'v1', 'hello'), (2, :'v2', 'world'), (3, :'v4', 'yugabyte');
INSERT INTO child VALUES (100001, :'v2', 'world'), (100002, :'v4', 'yugabyte');
SELECT count(*) FROM child;
 count 
-------
     2
(1 row)

UPDATE parent SET v1 = :'v3', v2 = 'world2' WHERE h = 2; -- should fail: default pair not in parent
ysqlsh:yb_commands/foreign_key_when_types_mismatch_helper.sql:190: ERROR:  insert or update on table "child" violates foreign key constraint "child_v1_v2_fkey"
DETAIL:  Key (v1, v2)=(49, default) is not present in table "parent".
INSERT INTO parent VALUES (4, :'v1', 'default');
UPDATE parent SET v1 = :'v3', v2 = 'world2' WHERE h = 2; -- should pass
SELECT count(*) FROM child WHERE h = 100001 AND v1 = :'v3' AND v2 = 'world2';
 count 
-------
     0
(1 row)

SELECT count(*) FROM child WHERE h = 100001 AND v1 = :'v1' AND v2 = 'default';
 count 
-------
     1
(1 row)

DELETE FROM parent WHERE h = 3;
SELECT count(*) FROM child WHERE v1 = :'v1' AND v2 = 'default';
 count 
-------
     2
(1 row)

TRUNCATE child, parent;
ALTER TABLE child DROP CONSTRAINT child_v1_v2_fkey;
-- MATCH FULL
ALTER TABLE child ADD CONSTRAINT child_v1_v2_fkey FOREIGN KEY(v1, v2) REFERENCES parent(v1, v2)
  MATCH FULL ON DELETE CASCADE ON UPDATE CASCADE;
INSERT INTO parent VALUES (1, :'v1', 'hello');
INSERT INTO child VALUES (100001, :'v1', 'hello');
SELECT count(*) FROM child;
 count 
-------
     1
(1 row)

INSERT INTO parent VALUES (2, NULL, 'hello');
ysqlsh:yb_commands/foreign_key_when_types_mismatch_helper.sql:206: ERROR:  null value in column "v1" of relation "parent" violates not-null constraint
DETAIL:  Failing row contains (2, null, hello).
INSERT INTO child VALUES (100002, NULL, 'hello'); -- should fail
ysqlsh:yb_commands/foreign_key_when_types_mismatch_helper.sql:207: ERROR:  null value in column "v1" of relation "child" violates not-null constraint
DETAIL:  Failing row contains (100002, null, hello).
SELECT count(*) FROM child;
 count 
-------
     1
(1 row)

INSERT INTO child VALUES (100003, NULL, NULL); -- should pass
ysqlsh:yb_commands/foreign_key_when_types_mismatch_helper.sql:209: ERROR:  null value in column "v1" of relation "child" violates not-null constraint
DETAIL:  Failing row contains (100003, null, null).
SELECT count(*) FROM child;
 count 
-------
     1
(1 row)

UPDATE child SET v1 = NULL; -- should fail
ysqlsh:yb_commands/foreign_key_when_types_mismatch_helper.sql:211: ERROR:  null value in column "v1" of relation "child" violates not-null constraint
DETAIL:  Failing row contains (100001, null, hello).
SELECT count(*) FROM child;
 count 
-------
     1
(1 row)

UPDATE child SET v1 = NULL, v2 = NULL; -- should pass
ysqlsh:yb_commands/foreign_key_when_types_mismatch_helper.sql:213: ERROR:  null value in column "v1" of relation "child" violates not-null constraint
DETAIL:  Failing row contains (100001, null, null).
SELECT count(*) FROM child WHERE v1 IS NULL AND v2 IS NULL;
 count 
-------
     0
(1 row)

TRUNCATE child, parent;
ALTER TABLE child DROP CONSTRAINT child_v1_v2_fkey;
ALTER TABLE parent DROP CONSTRAINT parent_v1_v2_key;
ALTER TABLE parent DROP COLUMN v2;
ALTER TABLE child DROP COLUMN v2;
CREATE UNIQUE INDEX parent_v1_key ON parent(v1) SPLIT INTO 1 TABLETS;
-- cleanup
DROP TABLE child;
DROP TABLE parent;
-- int4 to int2 (assignment cast): child INT references parent SMALLINT.
CREATE TABLE parent(h INT PRIMARY KEY, v1 SMALLINT) SPLIT INTO 1 TABLETS;
CREATE UNIQUE INDEX parent_v1_key ON parent(v1) SPLIT INTO 1 TABLETS;
CREATE TABLE child(h INT PRIMARY KEY, v1 INT, FOREIGN KEY(v1) REFERENCES parent(v1)
  ON DELETE CASCADE ON UPDATE CASCADE) SPLIT INTO 1 TABLETS;
\set v1 100
\set v2 200
\set v3 101
\set v4 10
\set v5 999
\set trap_parent_val -32767
\set trap_child_val 32769
\i yb_commands/foreign_key_when_types_mismatch_helper.sql
--
-- Helper for yb.orig.foreign_key_when_types_mismatch.sql.
--
-- Driver must CREATE parent(h, v1) and child(h, v1) with ON DELETE/UPDATE CASCADE.
-- parent(v1) must be backed by parent_v1_key with SPLIT INTO 1 TABLETS so FK batched
-- lookups hit a single tablet. Then set psql variables:
--   v1, v2, v3, v4, v5
--   trap_parent_val, trap_child_val
--
-- Each scenario inserts its own rows (parent h from 1, child h from 100001),
-- then TRUNCATEs both tables. The helper ends by dropping parent and child.
--
-- Scenarios (in order):
--   CASCADE, multi row insert, COPY, out of range insert/update,
--   SET NULL, NO ACTION deferrable (including COMMIT fail),
--   RESTRICT deferrable, partial null composite update, SET DEFAULT composite, MATCH FULL
--
-- CASCADE
INSERT INTO parent VALUES (1, :'v1');
INSERT INTO child VALUES (1, :'v1'); -- warm up catalog cache
DELETE FROM child WHERE h = 1; -- undo changes due to warm up
BEGIN TRANSACTION ISOLATION LEVEL SERIALIZABLE;
EXPLAIN (DIST, ANALYZE, COSTS OFF) INSERT INTO child VALUES (100001, :'v1');
                  QUERY PLAN                   
-----------------------------------------------
 Insert on child (actual rows=0 loops=1)
   ->  Result *RESULT* (actual rows=1 loops=1)
         Storage Table Write Requests: 1
 Trigger for constraint child_v1_fkey: calls=1
 Storage Read Requests: 1
 Storage Read Ops: 1
 Storage Rows Scanned: 1
 Storage Write Requests: 1
 Storage Flush Requests: 1
(9 rows)

COMMIT;
SELECT count(*) FROM child;
 count 
-------
     1
(1 row)

ALTER TABLE child DROP CONSTRAINT child_v1_fkey;
ALTER TABLE child ADD CONSTRAINT child_v1_fkey FOREIGN KEY(v1) REFERENCES parent(v1)
  ON DELETE CASCADE ON UPDATE CASCADE;
UPDATE parent SET v1 = :'v3' WHERE h = 1;
SELECT count(*) FROM child WHERE h = 100001 AND v1 = :'v3';
 count 
-------
     1
(1 row)

DELETE FROM parent WHERE h = 1;
SELECT count(*) FROM child;
 count 
-------
     0
(1 row)

INSERT INTO parent VALUES (1, :'v1');
INSERT INTO child VALUES (100002, :'v5'); -- should fail: no matching parent key
ysqlsh:yb_commands/foreign_key_when_types_mismatch_helper.sql:35: ERROR:  insert or update on table "child" violates foreign key constraint "child_v1_fkey"
DETAIL:  Key (v1)=(999) is not present in table "parent".
SELECT count(*) FROM child;
 count 
-------
     0
(1 row)

TRUNCATE child, parent;
-- multi row insert
INSERT INTO parent VALUES (1, :'v1'), (2, :'v2'), (3, :'v3');
INSERT INTO child VALUES (1, :'v1'); -- warm up catalog cache
DELETE FROM child WHERE h = 1; -- undo changes due to warm up
-- three distinct keys: run first with empty child for one batched FK read
BEGIN TRANSACTION ISOLATION LEVEL SERIALIZABLE;
EXPLAIN (DIST, ANALYZE, COSTS OFF) INSERT INTO child VALUES
  (100007, :'v1'), (100008, :'v2'), (100009, :'v3');
                       QUERY PLAN                        
---------------------------------------------------------
 Insert on child (actual rows=0 loops=1)
   ->  Values Scan on "*VALUES*" (actual rows=3 loops=1)
         Storage Table Write Requests: 3
 Trigger for constraint child_v1_fkey: calls=3
 Storage Read Requests: 1
 Storage Read Ops: 2
 Storage Rows Scanned: 3
 Storage Write Requests: 3
 Storage Flush Requests: 1
(9 rows)

COMMIT;
SELECT count(*) FROM child;
 count 
-------
     3
(1 row)

-- same key repeated
BEGIN TRANSACTION ISOLATION LEVEL SERIALIZABLE;
EXPLAIN (DIST, ANALYZE, COSTS OFF) INSERT INTO child VALUES
  (100004, :'v1'), (100005, :'v1'), (100006, :'v1');
                       QUERY PLAN                        
---------------------------------------------------------
 Insert on child (actual rows=0 loops=1)
   ->  Values Scan on "*VALUES*" (actual rows=3 loops=1)
         Storage Table Write Requests: 3
 Trigger for constraint child_v1_fkey: calls=3
 Storage Read Requests: 1
 Storage Read Ops: 1
 Storage Rows Scanned: 1
 Storage Write Requests: 3
 Storage Flush Requests: 1
(9 rows)

COMMIT;
SELECT count(*) FROM child;
 count 
-------
     6
(1 row)

-- two distinct keys with duplicate
BEGIN TRANSACTION ISOLATION LEVEL SERIALIZABLE;
EXPLAIN (DIST, ANALYZE, COSTS OFF) INSERT INTO child VALUES
  (100001, :'v1'), (100002, :'v1'), (100003, :'v2');
                       QUERY PLAN                        
---------------------------------------------------------
 Insert on child (actual rows=0 loops=1)
   ->  Values Scan on "*VALUES*" (actual rows=3 loops=1)
         Storage Table Write Requests: 3
 Trigger for constraint child_v1_fkey: calls=3
 Storage Read Requests: 1
 Storage Read Ops: 2
 Storage Rows Scanned: 2
 Storage Write Requests: 3
 Storage Flush Requests: 1
(9 rows)

COMMIT;
SELECT count(*) FROM child;
 count 
-------
     9
(1 row)

TRUNCATE child, parent;
-- COPY
INSERT INTO parent VALUES (1, :'v1'), (2, :'v2');
\set copy_cmd 'printf "100001\t' :v1 '\n100002\t' :v2 '\n"'
COPY child FROM PROGRAM :'copy_cmd';
SELECT count(*) FROM child;
 count 
-------
     2
(1 row)

\set copy_cmd 'printf "100003\t' :v1 '\n100004\t' :v2 '\n100005\t' :v5 '\n"'
COPY child FROM PROGRAM :'copy_cmd';
ysqlsh:yb_commands/foreign_key_when_types_mismatch_helper.sql:69: ERROR:  insert or update on table "child" violates foreign key constraint "child_v1_fkey"
DETAIL:  Key (v1)=(999) is not present in table "parent".
CONTEXT:  COPY child, line 4: ""
-- should fail: no matching parent key
SELECT count(*) FROM child;
 count 
-------
     2
(1 row)

INSERT INTO parent VALUES (3, :'trap_parent_val');
\set copy_cmd 'printf "100006\t' :trap_child_val '\n"'
COPY child FROM PROGRAM :'copy_cmd';
ysqlsh:yb_commands/foreign_key_when_types_mismatch_helper.sql:74: ERROR:  insert or update on table "child" violates foreign key constraint "child_v1_fkey"
DETAIL:  Key (v1)=(32769) is not present in table "parent".
CONTEXT:  COPY child, line 2: ""
-- should fail: out of range
SELECT count(*) FROM child;
 count 
-------
     2
(1 row)

TRUNCATE child, parent;
-- out of range insert and parent update
INSERT INTO parent VALUES (1, :'trap_parent_val');
INSERT INTO child VALUES (100001, :'trap_child_val'); -- should fail: out of range
ysqlsh:yb_commands/foreign_key_when_types_mismatch_helper.sql:81: ERROR:  insert or update on table "child" violates foreign key constraint "child_v1_fkey"
DETAIL:  Key (v1)=(32769) is not present in table "parent".
SELECT count(*) FROM child;
 count 
-------
     0
(1 row)

INSERT INTO parent VALUES (2, :'trap_child_val');
ysqlsh:yb_commands/foreign_key_when_types_mismatch_helper.sql:83: ERROR:  value "32769" is out of range for type smallint
LINE 1: INSERT INTO parent VALUES (2, '32769');
                                      ^
INSERT INTO child VALUES (100002, :'trap_parent_val');
SELECT count(*) FROM child;
 count 
-------
     1
(1 row)

DELETE FROM parent WHERE h = 2;
SELECT count(*) FROM child;
 count 
-------
     1
(1 row)

DELETE FROM parent WHERE h = 1;
DELETE FROM child WHERE h = 100002;
INSERT INTO parent VALUES (1, :'v1');
INSERT INTO child VALUES (100002, :'v1');
SELECT count(*) FROM child;
 count 
-------
     1
(1 row)

UPDATE parent SET v1 = :'trap_child_val' WHERE h = 1; -- should fail: cannot fit child column
ysqlsh:yb_commands/foreign_key_when_types_mismatch_helper.sql:93: ERROR:  value "32769" is out of range for type smallint
LINE 1: UPDATE parent SET v1 = '32769' WHERE h = 1;
                               ^
SELECT count(*) FROM child WHERE h = 100002 AND v1 = :'v1';
 count 
-------
     1
(1 row)

TRUNCATE child, parent;
-- ON DELETE/UPDATE SET NULL
ALTER TABLE child DROP CONSTRAINT child_v1_fkey;
ALTER TABLE child ADD CONSTRAINT child_v1_fkey FOREIGN KEY(v1) REFERENCES parent(v1)
  ON DELETE SET NULL ON UPDATE SET NULL;
INSERT INTO parent VALUES (1, :'v4'), (2, :'v5');
INSERT INTO child VALUES (100001, :'v4'), (100002, :'v5');
SELECT count(*) FROM child;
 count 
-------
     2
(1 row)

UPDATE parent SET v1 = :'v3' WHERE h = 1;
SELECT count(*) FROM child WHERE h = 100001 AND v1 IS NULL;
 count 
-------
     1
(1 row)

DELETE FROM parent WHERE h = 2;
SELECT count(*) FROM child WHERE h = 100002 AND v1 IS NULL;
 count 
-------
     1
(1 row)

TRUNCATE child, parent;
-- ON DELETE/UPDATE NO ACTION deferrable
ALTER TABLE child DROP CONSTRAINT child_v1_fkey;
ALTER TABLE child ADD CONSTRAINT child_v1_fkey FOREIGN KEY(v1) REFERENCES parent(v1)
  ON DELETE NO ACTION ON UPDATE NO ACTION DEFERRABLE INITIALLY DEFERRED;
INSERT INTO parent VALUES (1, :'v4'), (2, :'v5');
INSERT INTO child VALUES (100001, :'v4'), (100002, :'v5');
SELECT count(*) FROM child;
 count 
-------
     2
(1 row)

UPDATE parent SET v1 = :'v3' WHERE h = 1; -- should fail: no matching parent key
ysqlsh:yb_commands/foreign_key_when_types_mismatch_helper.sql:117: ERROR:  update or delete on table "parent" violates foreign key constraint "child_v1_fkey" on table "child"
DETAIL:  Key (v1)=(10) is still referenced from table "child".
DELETE FROM parent WHERE h = 2; -- should fail: no matching parent key
ysqlsh:yb_commands/foreign_key_when_types_mismatch_helper.sql:118: ERROR:  update or delete on table "parent" violates foreign key constraint "child_v1_fkey" on table "child"
DETAIL:  Key (v1)=(999) is still referenced from table "child".
SELECT count(*) FROM child;
 count 
-------
     2
(1 row)

BEGIN;
  UPDATE parent SET v1 = :'v3' WHERE h = 1; -- should pass for now
  INSERT INTO parent VALUES (3, :'v4');
COMMIT; -- should pass
SELECT count(*) FROM parent WHERE v1 = :'v3';
 count 
-------
     1
(1 row)

BEGIN;
  DELETE FROM parent WHERE h = 3; -- child still references :'v4'
COMMIT; -- should fail
ysqlsh:yb_commands/foreign_key_when_types_mismatch_helper.sql:127: ERROR:  update or delete on table "parent" violates foreign key constraint "child_v1_fkey" on table "child"
DETAIL:  Key (v1)=(10) is still referenced from table "child".
SELECT count(*) FROM child;
 count 
-------
     2
(1 row)

BEGIN;
  DELETE FROM parent WHERE h = 2; -- should pass for now
  INSERT INTO parent VALUES (4, :'v5');
COMMIT; -- should pass
SELECT count(*) FROM parent WHERE h = 2;
 count 
-------
     0
(1 row)

BEGIN;
  DELETE FROM parent WHERE h = 4; -- child still references :'v5'
COMMIT; -- should fail
ysqlsh:yb_commands/foreign_key_when_types_mismatch_helper.sql:136: ERROR:  update or delete on table "parent" violates foreign key constraint "child_v1_fkey" on table "child"
DETAIL:  Key (v1)=(999) is still referenced from table "child".
SELECT count(*) FROM child;
 count 
-------
     2
(1 row)

TRUNCATE child, parent;
-- ON DELETE/UPDATE RESTRICT deferrable
ALTER TABLE child DROP CONSTRAINT child_v1_fkey;
ALTER TABLE child ADD CONSTRAINT child_v1_fkey FOREIGN KEY(v1) REFERENCES parent(v1)
  ON DELETE RESTRICT ON UPDATE RESTRICT DEFERRABLE INITIALLY DEFERRED;
INSERT INTO parent VALUES (1, :'v4'), (2, :'v5');
INSERT INTO child VALUES (100001, :'v4'), (100002, :'v5');
SELECT count(*) FROM child;
 count 
-------
     2
(1 row)

UPDATE parent SET v1 = :'v3' WHERE h = 1; -- should fail: no matching parent key
ysqlsh:yb_commands/foreign_key_when_types_mismatch_helper.sql:147: ERROR:  update or delete on table "parent" violates foreign key constraint "child_v1_fkey" on table "child"
DETAIL:  Key (v1)=(10) is still referenced from table "child".
DELETE FROM parent WHERE h = 2; -- should fail: no matching parent key
ysqlsh:yb_commands/foreign_key_when_types_mismatch_helper.sql:148: ERROR:  update or delete on table "parent" violates foreign key constraint "child_v1_fkey" on table "child"
DETAIL:  Key (v1)=(999) is still referenced from table "child".
SELECT count(*) FROM child;
 count 
-------
     2
(1 row)

BEGIN;
  UPDATE parent SET v1 = :'v3' WHERE h = 1; -- should fail: no matching parent key
ysqlsh:yb_commands/foreign_key_when_types_mismatch_helper.sql:151: ERROR:  update or delete on table "parent" violates foreign key constraint "child_v1_fkey" on table "child"
DETAIL:  Key (v1)=(10) is still referenced from table "child".
  INSERT INTO parent VALUES (3, :'v4');
ysqlsh:yb_commands/foreign_key_when_types_mismatch_helper.sql:152: ERROR:  current transaction is aborted, commands ignored until end of transaction block
COMMIT; -- should fail
SELECT count(*) FROM parent WHERE v1 = :'v3';
 count 
-------
     0
(1 row)

BEGIN;
  DELETE FROM parent WHERE h = 2; -- should fail: no matching parent key
ysqlsh:yb_commands/foreign_key_when_types_mismatch_helper.sql:156: ERROR:  update or delete on table "parent" violates foreign key constraint "child_v1_fkey" on table "child"
DETAIL:  Key (v1)=(999) is still referenced from table "child".
  INSERT INTO parent VALUES (4, :'v5');
ysqlsh:yb_commands/foreign_key_when_types_mismatch_helper.sql:157: ERROR:  current transaction is aborted, commands ignored until end of transaction block
COMMIT; -- should fail
SELECT count(*) FROM parent WHERE h = 2;
 count 
-------
     1
(1 row)

TRUNCATE child, parent;
-- setup a composite foreign key constraint
ALTER TABLE parent ADD COLUMN v2 TEXT;
ALTER TABLE child ADD COLUMN v2 VARCHAR(12);
ALTER TABLE child DROP CONSTRAINT child_v1_fkey;
DROP INDEX parent_v1_key;
ALTER TABLE parent ADD UNIQUE (v1, v2);
-- partial null composite update
ALTER TABLE child ADD CONSTRAINT child_v1_v2_fkey FOREIGN KEY(v1, v2) REFERENCES parent(v1, v2)
  ON DELETE CASCADE ON UPDATE CASCADE;
INSERT INTO parent VALUES (1, 1, 'hello');
INSERT INTO child VALUES (100001, 1, 'hello');
SELECT count(*) FROM child;
 count 
-------
     1
(1 row)

UPDATE parent SET v1 = NULL, v2 = 'hello2' WHERE h = 1; -- should pass: v2 need not exist in parent
SELECT count(*) FROM child WHERE h = 100001 AND v1 IS NULL AND v2 = 'hello2';
 count 
-------
     1
(1 row)

UPDATE parent SET v1 = 4, v2 = 'hello' WHERE h = 1; -- child row should be unchanged
SELECT count(*) FROM child WHERE h = 100001 AND v1 IS NULL AND v2 = 'hello2';
 count 
-------
     1
(1 row)

TRUNCATE child, parent;
ALTER TABLE child DROP CONSTRAINT child_v1_v2_fkey;
-- ON DELETE/UPDATE SET DEFAULT composite
ALTER TABLE child ALTER COLUMN v1 SET DEFAULT :'v1';
ALTER TABLE child ALTER COLUMN v2 SET DEFAULT 'default';
ALTER TABLE child ADD CONSTRAINT child_v1_v2_fkey FOREIGN KEY(v1, v2) REFERENCES parent(v1, v2)
  ON DELETE SET DEFAULT ON UPDATE SET DEFAULT;
INSERT INTO parent VALUES (1, :'v1', 'hello'), (2, :'v2', 'world'), (3, :'v4', 'yugabyte');
INSERT INTO child VALUES (100001, :'v2', 'world'), (100002, :'v4', 'yugabyte');
SELECT count(*) FROM child;
 count 
-------
     2
(1 row)

UPDATE parent SET v1 = :'v3', v2 = 'world2' WHERE h = 2; -- should fail: default pair not in parent
ysqlsh:yb_commands/foreign_key_when_types_mismatch_helper.sql:190: ERROR:  insert or update on table "child" violates foreign key constraint "child_v1_v2_fkey"
DETAIL:  Key (v1, v2)=(100, default) is not present in table "parent".
INSERT INTO parent VALUES (4, :'v1', 'default');
UPDATE parent SET v1 = :'v3', v2 = 'world2' WHERE h = 2; -- should pass
SELECT count(*) FROM child WHERE h = 100001 AND v1 = :'v3' AND v2 = 'world2';
 count 
-------
     0
(1 row)

SELECT count(*) FROM child WHERE h = 100001 AND v1 = :'v1' AND v2 = 'default';
 count 
-------
     1
(1 row)

DELETE FROM parent WHERE h = 3;
SELECT count(*) FROM child WHERE v1 = :'v1' AND v2 = 'default';
 count 
-------
     2
(1 row)

TRUNCATE child, parent;
ALTER TABLE child DROP CONSTRAINT child_v1_v2_fkey;
-- MATCH FULL
ALTER TABLE child ADD CONSTRAINT child_v1_v2_fkey FOREIGN KEY(v1, v2) REFERENCES parent(v1, v2)
  MATCH FULL ON DELETE CASCADE ON UPDATE CASCADE;
INSERT INTO parent VALUES (1, :'v1', 'hello');
INSERT INTO child VALUES (100001, :'v1', 'hello');
SELECT count(*) FROM child;
 count 
-------
     1
(1 row)

INSERT INTO parent VALUES (2, NULL, 'hello');
INSERT INTO child VALUES (100002, NULL, 'hello'); -- should fail
ysqlsh:yb_commands/foreign_key_when_types_mismatch_helper.sql:207: ERROR:  insert or update on table "child" violates foreign key constraint "child_v1_v2_fkey"
DETAIL:  MATCH FULL does not allow mixing of null and nonnull key values.
SELECT count(*) FROM child;
 count 
-------
     1
(1 row)

INSERT INTO child VALUES (100003, NULL, NULL); -- should pass
SELECT count(*) FROM child;
 count 
-------
     2
(1 row)

UPDATE child SET v1 = NULL; -- should fail
ysqlsh:yb_commands/foreign_key_when_types_mismatch_helper.sql:211: ERROR:  insert or update on table "child" violates foreign key constraint "child_v1_v2_fkey"
DETAIL:  MATCH FULL does not allow mixing of null and nonnull key values.
SELECT count(*) FROM child;
 count 
-------
     2
(1 row)

UPDATE child SET v1 = NULL, v2 = NULL; -- should pass
SELECT count(*) FROM child WHERE v1 IS NULL AND v2 IS NULL;
 count 
-------
     2
(1 row)

TRUNCATE child, parent;
ALTER TABLE child DROP CONSTRAINT child_v1_v2_fkey;
ALTER TABLE parent DROP CONSTRAINT parent_v1_v2_key;
ALTER TABLE parent DROP COLUMN v2;
ALTER TABLE child DROP COLUMN v2;
CREATE UNIQUE INDEX parent_v1_key ON parent(v1) SPLIT INTO 1 TABLETS;
-- cleanup
DROP TABLE child;
DROP TABLE parent;
-- int8 to int2 (assignment cast): child BIGINT references parent SMALLINT.
CREATE TABLE parent(h INT PRIMARY KEY, v1 SMALLINT) SPLIT INTO 1 TABLETS;
CREATE UNIQUE INDEX parent_v1_key ON parent(v1) SPLIT INTO 1 TABLETS;
CREATE TABLE child(h INT PRIMARY KEY, v1 BIGINT, FOREIGN KEY(v1) REFERENCES parent(v1)
  ON DELETE CASCADE ON UPDATE CASCADE) SPLIT INTO 1 TABLETS;
\set v1 20000
\set v2 20002
\set v3 20001
\set v4 10
\set v5 999
\set trap_parent_val -32767
\set trap_child_val 32769
\i yb_commands/foreign_key_when_types_mismatch_helper.sql
--
-- Helper for yb.orig.foreign_key_when_types_mismatch.sql.
--
-- Driver must CREATE parent(h, v1) and child(h, v1) with ON DELETE/UPDATE CASCADE.
-- parent(v1) must be backed by parent_v1_key with SPLIT INTO 1 TABLETS so FK batched
-- lookups hit a single tablet. Then set psql variables:
--   v1, v2, v3, v4, v5
--   trap_parent_val, trap_child_val
--
-- Each scenario inserts its own rows (parent h from 1, child h from 100001),
-- then TRUNCATEs both tables. The helper ends by dropping parent and child.
--
-- Scenarios (in order):
--   CASCADE, multi row insert, COPY, out of range insert/update,
--   SET NULL, NO ACTION deferrable (including COMMIT fail),
--   RESTRICT deferrable, partial null composite update, SET DEFAULT composite, MATCH FULL
--
-- CASCADE
INSERT INTO parent VALUES (1, :'v1');
INSERT INTO child VALUES (1, :'v1'); -- warm up catalog cache
DELETE FROM child WHERE h = 1; -- undo changes due to warm up
BEGIN TRANSACTION ISOLATION LEVEL SERIALIZABLE;
EXPLAIN (DIST, ANALYZE, COSTS OFF) INSERT INTO child VALUES (100001, :'v1');
                  QUERY PLAN                   
-----------------------------------------------
 Insert on child (actual rows=0 loops=1)
   ->  Result *RESULT* (actual rows=1 loops=1)
         Storage Table Write Requests: 1
 Trigger for constraint child_v1_fkey: calls=1
 Storage Read Requests: 1
 Storage Read Ops: 1
 Storage Rows Scanned: 1
 Storage Write Requests: 1
 Storage Flush Requests: 1
(9 rows)

COMMIT;
SELECT count(*) FROM child;
 count 
-------
     1
(1 row)

ALTER TABLE child DROP CONSTRAINT child_v1_fkey;
ALTER TABLE child ADD CONSTRAINT child_v1_fkey FOREIGN KEY(v1) REFERENCES parent(v1)
  ON DELETE CASCADE ON UPDATE CASCADE;
UPDATE parent SET v1 = :'v3' WHERE h = 1;
SELECT count(*) FROM child WHERE h = 100001 AND v1 = :'v3';
 count 
-------
     1
(1 row)

DELETE FROM parent WHERE h = 1;
SELECT count(*) FROM child;
 count 
-------
     0
(1 row)

INSERT INTO parent VALUES (1, :'v1');
INSERT INTO child VALUES (100002, :'v5'); -- should fail: no matching parent key
ysqlsh:yb_commands/foreign_key_when_types_mismatch_helper.sql:35: ERROR:  insert or update on table "child" violates foreign key constraint "child_v1_fkey"
DETAIL:  Key (v1)=(999) is not present in table "parent".
SELECT count(*) FROM child;
 count 
-------
     0
(1 row)

TRUNCATE child, parent;
-- multi row insert
INSERT INTO parent VALUES (1, :'v1'), (2, :'v2'), (3, :'v3');
INSERT INTO child VALUES (1, :'v1'); -- warm up catalog cache
DELETE FROM child WHERE h = 1; -- undo changes due to warm up
-- three distinct keys: run first with empty child for one batched FK read
BEGIN TRANSACTION ISOLATION LEVEL SERIALIZABLE;
EXPLAIN (DIST, ANALYZE, COSTS OFF) INSERT INTO child VALUES
  (100007, :'v1'), (100008, :'v2'), (100009, :'v3');
                       QUERY PLAN                        
---------------------------------------------------------
 Insert on child (actual rows=0 loops=1)
   ->  Values Scan on "*VALUES*" (actual rows=3 loops=1)
         Storage Table Write Requests: 3
 Trigger for constraint child_v1_fkey: calls=3
 Storage Read Requests: 1
 Storage Read Ops: 3
 Storage Rows Scanned: 3
 Storage Write Requests: 3
 Storage Flush Requests: 1
(9 rows)

COMMIT;
SELECT count(*) FROM child;
 count 
-------
     3
(1 row)

-- same key repeated
BEGIN TRANSACTION ISOLATION LEVEL SERIALIZABLE;
EXPLAIN (DIST, ANALYZE, COSTS OFF) INSERT INTO child VALUES
  (100004, :'v1'), (100005, :'v1'), (100006, :'v1');
                       QUERY PLAN                        
---------------------------------------------------------
 Insert on child (actual rows=0 loops=1)
   ->  Values Scan on "*VALUES*" (actual rows=3 loops=1)
         Storage Table Write Requests: 3
 Trigger for constraint child_v1_fkey: calls=3
 Storage Read Requests: 1
 Storage Read Ops: 1
 Storage Rows Scanned: 1
 Storage Write Requests: 3
 Storage Flush Requests: 1
(9 rows)

COMMIT;
SELECT count(*) FROM child;
 count 
-------
     6
(1 row)

-- two distinct keys with duplicate
BEGIN TRANSACTION ISOLATION LEVEL SERIALIZABLE;
EXPLAIN (DIST, ANALYZE, COSTS OFF) INSERT INTO child VALUES
  (100001, :'v1'), (100002, :'v1'), (100003, :'v2');
                       QUERY PLAN                        
---------------------------------------------------------
 Insert on child (actual rows=0 loops=1)
   ->  Values Scan on "*VALUES*" (actual rows=3 loops=1)
         Storage Table Write Requests: 3
 Trigger for constraint child_v1_fkey: calls=3
 Storage Read Requests: 1
 Storage Read Ops: 2
 Storage Rows Scanned: 2
 Storage Write Requests: 3
 Storage Flush Requests: 1
(9 rows)

COMMIT;
SELECT count(*) FROM child;
 count 
-------
     9
(1 row)

TRUNCATE child, parent;
-- COPY
INSERT INTO parent VALUES (1, :'v1'), (2, :'v2');
\set copy_cmd 'printf "100001\t' :v1 '\n100002\t' :v2 '\n"'
COPY child FROM PROGRAM :'copy_cmd';
SELECT count(*) FROM child;
 count 
-------
     2
(1 row)

\set copy_cmd 'printf "100003\t' :v1 '\n100004\t' :v2 '\n100005\t' :v5 '\n"'
COPY child FROM PROGRAM :'copy_cmd';
ysqlsh:yb_commands/foreign_key_when_types_mismatch_helper.sql:69: ERROR:  insert or update on table "child" violates foreign key constraint "child_v1_fkey"
DETAIL:  Key (v1)=(999) is not present in table "parent".
CONTEXT:  COPY child, line 4: ""
-- should fail: no matching parent key
SELECT count(*) FROM child;
 count 
-------
     2
(1 row)

INSERT INTO parent VALUES (3, :'trap_parent_val');
\set copy_cmd 'printf "100006\t' :trap_child_val '\n"'
COPY child FROM PROGRAM :'copy_cmd';
ysqlsh:yb_commands/foreign_key_when_types_mismatch_helper.sql:74: ERROR:  insert or update on table "child" violates foreign key constraint "child_v1_fkey"
DETAIL:  Key (v1)=(32769) is not present in table "parent".
CONTEXT:  COPY child, line 2: ""
-- should fail: out of range
SELECT count(*) FROM child;
 count 
-------
     2
(1 row)

TRUNCATE child, parent;
-- out of range insert and parent update
INSERT INTO parent VALUES (1, :'trap_parent_val');
INSERT INTO child VALUES (100001, :'trap_child_val'); -- should fail: out of range
ysqlsh:yb_commands/foreign_key_when_types_mismatch_helper.sql:81: ERROR:  insert or update on table "child" violates foreign key constraint "child_v1_fkey"
DETAIL:  Key (v1)=(32769) is not present in table "parent".
SELECT count(*) FROM child;
 count 
-------
     0
(1 row)

INSERT INTO parent VALUES (2, :'trap_child_val');
ysqlsh:yb_commands/foreign_key_when_types_mismatch_helper.sql:83: ERROR:  value "32769" is out of range for type smallint
LINE 1: INSERT INTO parent VALUES (2, '32769');
                                      ^
INSERT INTO child VALUES (100002, :'trap_parent_val');
SELECT count(*) FROM child;
 count 
-------
     1
(1 row)

DELETE FROM parent WHERE h = 2;
SELECT count(*) FROM child;
 count 
-------
     1
(1 row)

DELETE FROM parent WHERE h = 1;
DELETE FROM child WHERE h = 100002;
INSERT INTO parent VALUES (1, :'v1');
INSERT INTO child VALUES (100002, :'v1');
SELECT count(*) FROM child;
 count 
-------
     1
(1 row)

UPDATE parent SET v1 = :'trap_child_val' WHERE h = 1; -- should fail: cannot fit child column
ysqlsh:yb_commands/foreign_key_when_types_mismatch_helper.sql:93: ERROR:  value "32769" is out of range for type smallint
LINE 1: UPDATE parent SET v1 = '32769' WHERE h = 1;
                               ^
SELECT count(*) FROM child WHERE h = 100002 AND v1 = :'v1';
 count 
-------
     1
(1 row)

TRUNCATE child, parent;
-- ON DELETE/UPDATE SET NULL
ALTER TABLE child DROP CONSTRAINT child_v1_fkey;
ALTER TABLE child ADD CONSTRAINT child_v1_fkey FOREIGN KEY(v1) REFERENCES parent(v1)
  ON DELETE SET NULL ON UPDATE SET NULL;
INSERT INTO parent VALUES (1, :'v4'), (2, :'v5');
INSERT INTO child VALUES (100001, :'v4'), (100002, :'v5');
SELECT count(*) FROM child;
 count 
-------
     2
(1 row)

UPDATE parent SET v1 = :'v3' WHERE h = 1;
SELECT count(*) FROM child WHERE h = 100001 AND v1 IS NULL;
 count 
-------
     1
(1 row)

DELETE FROM parent WHERE h = 2;
SELECT count(*) FROM child WHERE h = 100002 AND v1 IS NULL;
 count 
-------
     1
(1 row)

TRUNCATE child, parent;
-- ON DELETE/UPDATE NO ACTION deferrable
ALTER TABLE child DROP CONSTRAINT child_v1_fkey;
ALTER TABLE child ADD CONSTRAINT child_v1_fkey FOREIGN KEY(v1) REFERENCES parent(v1)
  ON DELETE NO ACTION ON UPDATE NO ACTION DEFERRABLE INITIALLY DEFERRED;
INSERT INTO parent VALUES (1, :'v4'), (2, :'v5');
INSERT INTO child VALUES (100001, :'v4'), (100002, :'v5');
SELECT count(*) FROM child;
 count 
-------
     2
(1 row)

UPDATE parent SET v1 = :'v3' WHERE h = 1; -- should fail: no matching parent key
ysqlsh:yb_commands/foreign_key_when_types_mismatch_helper.sql:117: ERROR:  update or delete on table "parent" violates foreign key constraint "child_v1_fkey" on table "child"
DETAIL:  Key (v1)=(10) is still referenced from table "child".
DELETE FROM parent WHERE h = 2; -- should fail: no matching parent key
ysqlsh:yb_commands/foreign_key_when_types_mismatch_helper.sql:118: ERROR:  update or delete on table "parent" violates foreign key constraint "child_v1_fkey" on table "child"
DETAIL:  Key (v1)=(999) is still referenced from table "child".
SELECT count(*) FROM child;
 count 
-------
     2
(1 row)

BEGIN;
  UPDATE parent SET v1 = :'v3' WHERE h = 1; -- should pass for now
  INSERT INTO parent VALUES (3, :'v4');
COMMIT; -- should pass
SELECT count(*) FROM parent WHERE v1 = :'v3';
 count 
-------
     1
(1 row)

BEGIN;
  DELETE FROM parent WHERE h = 3; -- child still references :'v4'
COMMIT; -- should fail
ysqlsh:yb_commands/foreign_key_when_types_mismatch_helper.sql:127: ERROR:  update or delete on table "parent" violates foreign key constraint "child_v1_fkey" on table "child"
DETAIL:  Key (v1)=(10) is still referenced from table "child".
SELECT count(*) FROM child;
 count 
-------
     2
(1 row)

BEGIN;
  DELETE FROM parent WHERE h = 2; -- should pass for now
  INSERT INTO parent VALUES (4, :'v5');
COMMIT; -- should pass
SELECT count(*) FROM parent WHERE h = 2;
 count 
-------
     0
(1 row)

BEGIN;
  DELETE FROM parent WHERE h = 4; -- child still references :'v5'
COMMIT; -- should fail
ysqlsh:yb_commands/foreign_key_when_types_mismatch_helper.sql:136: ERROR:  update or delete on table "parent" violates foreign key constraint "child_v1_fkey" on table "child"
DETAIL:  Key (v1)=(999) is still referenced from table "child".
SELECT count(*) FROM child;
 count 
-------
     2
(1 row)

TRUNCATE child, parent;
-- ON DELETE/UPDATE RESTRICT deferrable
ALTER TABLE child DROP CONSTRAINT child_v1_fkey;
ALTER TABLE child ADD CONSTRAINT child_v1_fkey FOREIGN KEY(v1) REFERENCES parent(v1)
  ON DELETE RESTRICT ON UPDATE RESTRICT DEFERRABLE INITIALLY DEFERRED;
INSERT INTO parent VALUES (1, :'v4'), (2, :'v5');
INSERT INTO child VALUES (100001, :'v4'), (100002, :'v5');
SELECT count(*) FROM child;
 count 
-------
     2
(1 row)

UPDATE parent SET v1 = :'v3' WHERE h = 1; -- should fail: no matching parent key
ysqlsh:yb_commands/foreign_key_when_types_mismatch_helper.sql:147: ERROR:  update or delete on table "parent" violates foreign key constraint "child_v1_fkey" on table "child"
DETAIL:  Key (v1)=(10) is still referenced from table "child".
DELETE FROM parent WHERE h = 2; -- should fail: no matching parent key
ysqlsh:yb_commands/foreign_key_when_types_mismatch_helper.sql:148: ERROR:  update or delete on table "parent" violates foreign key constraint "child_v1_fkey" on table "child"
DETAIL:  Key (v1)=(999) is still referenced from table "child".
SELECT count(*) FROM child;
 count 
-------
     2
(1 row)

BEGIN;
  UPDATE parent SET v1 = :'v3' WHERE h = 1; -- should fail: no matching parent key
ysqlsh:yb_commands/foreign_key_when_types_mismatch_helper.sql:151: ERROR:  update or delete on table "parent" violates foreign key constraint "child_v1_fkey" on table "child"
DETAIL:  Key (v1)=(10) is still referenced from table "child".
  INSERT INTO parent VALUES (3, :'v4');
ysqlsh:yb_commands/foreign_key_when_types_mismatch_helper.sql:152: ERROR:  current transaction is aborted, commands ignored until end of transaction block
COMMIT; -- should fail
SELECT count(*) FROM parent WHERE v1 = :'v3';
 count 
-------
     0
(1 row)

BEGIN;
  DELETE FROM parent WHERE h = 2; -- should fail: no matching parent key
ysqlsh:yb_commands/foreign_key_when_types_mismatch_helper.sql:156: ERROR:  update or delete on table "parent" violates foreign key constraint "child_v1_fkey" on table "child"
DETAIL:  Key (v1)=(999) is still referenced from table "child".
  INSERT INTO parent VALUES (4, :'v5');
ysqlsh:yb_commands/foreign_key_when_types_mismatch_helper.sql:157: ERROR:  current transaction is aborted, commands ignored until end of transaction block
COMMIT; -- should fail
SELECT count(*) FROM parent WHERE h = 2;
 count 
-------
     1
(1 row)

TRUNCATE child, parent;
-- setup a composite foreign key constraint
ALTER TABLE parent ADD COLUMN v2 TEXT;
ALTER TABLE child ADD COLUMN v2 VARCHAR(12);
ALTER TABLE child DROP CONSTRAINT child_v1_fkey;
DROP INDEX parent_v1_key;
ALTER TABLE parent ADD UNIQUE (v1, v2);
-- partial null composite update
ALTER TABLE child ADD CONSTRAINT child_v1_v2_fkey FOREIGN KEY(v1, v2) REFERENCES parent(v1, v2)
  ON DELETE CASCADE ON UPDATE CASCADE;
INSERT INTO parent VALUES (1, 1, 'hello');
INSERT INTO child VALUES (100001, 1, 'hello');
SELECT count(*) FROM child;
 count 
-------
     1
(1 row)

UPDATE parent SET v1 = NULL, v2 = 'hello2' WHERE h = 1; -- should pass: v2 need not exist in parent
SELECT count(*) FROM child WHERE h = 100001 AND v1 IS NULL AND v2 = 'hello2';
 count 
-------
     1
(1 row)

UPDATE parent SET v1 = 4, v2 = 'hello' WHERE h = 1; -- child row should be unchanged
SELECT count(*) FROM child WHERE h = 100001 AND v1 IS NULL AND v2 = 'hello2';
 count 
-------
     1
(1 row)

TRUNCATE child, parent;
ALTER TABLE child DROP CONSTRAINT child_v1_v2_fkey;
-- ON DELETE/UPDATE SET DEFAULT composite
ALTER TABLE child ALTER COLUMN v1 SET DEFAULT :'v1';
ALTER TABLE child ALTER COLUMN v2 SET DEFAULT 'default';
ALTER TABLE child ADD CONSTRAINT child_v1_v2_fkey FOREIGN KEY(v1, v2) REFERENCES parent(v1, v2)
  ON DELETE SET DEFAULT ON UPDATE SET DEFAULT;
INSERT INTO parent VALUES (1, :'v1', 'hello'), (2, :'v2', 'world'), (3, :'v4', 'yugabyte');
INSERT INTO child VALUES (100001, :'v2', 'world'), (100002, :'v4', 'yugabyte');
SELECT count(*) FROM child;
 count 
-------
     2
(1 row)

UPDATE parent SET v1 = :'v3', v2 = 'world2' WHERE h = 2; -- should fail: default pair not in parent
ysqlsh:yb_commands/foreign_key_when_types_mismatch_helper.sql:190: ERROR:  insert or update on table "child" violates foreign key constraint "child_v1_v2_fkey"
DETAIL:  Key (v1, v2)=(20000, default) is not present in table "parent".
INSERT INTO parent VALUES (4, :'v1', 'default');
UPDATE parent SET v1 = :'v3', v2 = 'world2' WHERE h = 2; -- should pass
SELECT count(*) FROM child WHERE h = 100001 AND v1 = :'v3' AND v2 = 'world2';
 count 
-------
     0
(1 row)

SELECT count(*) FROM child WHERE h = 100001 AND v1 = :'v1' AND v2 = 'default';
 count 
-------
     1
(1 row)

DELETE FROM parent WHERE h = 3;
SELECT count(*) FROM child WHERE v1 = :'v1' AND v2 = 'default';
 count 
-------
     2
(1 row)

TRUNCATE child, parent;
ALTER TABLE child DROP CONSTRAINT child_v1_v2_fkey;
-- MATCH FULL
ALTER TABLE child ADD CONSTRAINT child_v1_v2_fkey FOREIGN KEY(v1, v2) REFERENCES parent(v1, v2)
  MATCH FULL ON DELETE CASCADE ON UPDATE CASCADE;
INSERT INTO parent VALUES (1, :'v1', 'hello');
INSERT INTO child VALUES (100001, :'v1', 'hello');
SELECT count(*) FROM child;
 count 
-------
     1
(1 row)

INSERT INTO parent VALUES (2, NULL, 'hello');
INSERT INTO child VALUES (100002, NULL, 'hello'); -- should fail
ysqlsh:yb_commands/foreign_key_when_types_mismatch_helper.sql:207: ERROR:  insert or update on table "child" violates foreign key constraint "child_v1_v2_fkey"
DETAIL:  MATCH FULL does not allow mixing of null and nonnull key values.
SELECT count(*) FROM child;
 count 
-------
     1
(1 row)

INSERT INTO child VALUES (100003, NULL, NULL); -- should pass
SELECT count(*) FROM child;
 count 
-------
     2
(1 row)

UPDATE child SET v1 = NULL; -- should fail
ysqlsh:yb_commands/foreign_key_when_types_mismatch_helper.sql:211: ERROR:  insert or update on table "child" violates foreign key constraint "child_v1_v2_fkey"
DETAIL:  MATCH FULL does not allow mixing of null and nonnull key values.
SELECT count(*) FROM child;
 count 
-------
     2
(1 row)

UPDATE child SET v1 = NULL, v2 = NULL; -- should pass
SELECT count(*) FROM child WHERE v1 IS NULL AND v2 IS NULL;
 count 
-------
     2
(1 row)

TRUNCATE child, parent;
ALTER TABLE child DROP CONSTRAINT child_v1_v2_fkey;
ALTER TABLE parent DROP CONSTRAINT parent_v1_v2_key;
ALTER TABLE parent DROP COLUMN v2;
ALTER TABLE child DROP COLUMN v2;
CREATE UNIQUE INDEX parent_v1_key ON parent(v1) SPLIT INTO 1 TABLETS;
-- cleanup
DROP TABLE child;
DROP TABLE parent;
-- int8 to int4 (assignment cast): child BIGINT references parent INT.
CREATE TABLE parent(h INT PRIMARY KEY, v1 INT) SPLIT INTO 1 TABLETS;
CREATE UNIQUE INDEX parent_v1_key ON parent(v1) SPLIT INTO 1 TABLETS;
CREATE TABLE child(h INT PRIMARY KEY, v1 BIGINT, FOREIGN KEY(v1) REFERENCES parent(v1)
  ON DELETE CASCADE ON UPDATE CASCADE) SPLIT INTO 1 TABLETS;
\set v1 1000000
\set v2 1000002
\set v3 1000001
\set v4 10
\set v5 999
\set trap_parent_val -2147483648
\set trap_child_val 2147483648
\i yb_commands/foreign_key_when_types_mismatch_helper.sql
--
-- Helper for yb.orig.foreign_key_when_types_mismatch.sql.
--
-- Driver must CREATE parent(h, v1) and child(h, v1) with ON DELETE/UPDATE CASCADE.
-- parent(v1) must be backed by parent_v1_key with SPLIT INTO 1 TABLETS so FK batched
-- lookups hit a single tablet. Then set psql variables:
--   v1, v2, v3, v4, v5
--   trap_parent_val, trap_child_val
--
-- Each scenario inserts its own rows (parent h from 1, child h from 100001),
-- then TRUNCATEs both tables. The helper ends by dropping parent and child.
--
-- Scenarios (in order):
--   CASCADE, multi row insert, COPY, out of range insert/update,
--   SET NULL, NO ACTION deferrable (including COMMIT fail),
--   RESTRICT deferrable, partial null composite update, SET DEFAULT composite, MATCH FULL
--
-- CASCADE
INSERT INTO parent VALUES (1, :'v1');
INSERT INTO child VALUES (1, :'v1'); -- warm up catalog cache
DELETE FROM child WHERE h = 1; -- undo changes due to warm up
BEGIN TRANSACTION ISOLATION LEVEL SERIALIZABLE;
EXPLAIN (DIST, ANALYZE, COSTS OFF) INSERT INTO child VALUES (100001, :'v1');
                  QUERY PLAN                   
-----------------------------------------------
 Insert on child (actual rows=0 loops=1)
   ->  Result *RESULT* (actual rows=1 loops=1)
         Storage Table Write Requests: 1
 Trigger for constraint child_v1_fkey: calls=1
 Storage Read Requests: 1
 Storage Read Ops: 1
 Storage Rows Scanned: 1
 Storage Write Requests: 1
 Storage Flush Requests: 1
(9 rows)

COMMIT;
SELECT count(*) FROM child;
 count 
-------
     1
(1 row)

ALTER TABLE child DROP CONSTRAINT child_v1_fkey;
ALTER TABLE child ADD CONSTRAINT child_v1_fkey FOREIGN KEY(v1) REFERENCES parent(v1)
  ON DELETE CASCADE ON UPDATE CASCADE;
UPDATE parent SET v1 = :'v3' WHERE h = 1;
SELECT count(*) FROM child WHERE h = 100001 AND v1 = :'v3';
 count 
-------
     1
(1 row)

DELETE FROM parent WHERE h = 1;
SELECT count(*) FROM child;
 count 
-------
     0
(1 row)

INSERT INTO parent VALUES (1, :'v1');
INSERT INTO child VALUES (100002, :'v5'); -- should fail: no matching parent key
ysqlsh:yb_commands/foreign_key_when_types_mismatch_helper.sql:35: ERROR:  insert or update on table "child" violates foreign key constraint "child_v1_fkey"
DETAIL:  Key (v1)=(999) is not present in table "parent".
SELECT count(*) FROM child;
 count 
-------
     0
(1 row)

TRUNCATE child, parent;
-- multi row insert
INSERT INTO parent VALUES (1, :'v1'), (2, :'v2'), (3, :'v3');
INSERT INTO child VALUES (1, :'v1'); -- warm up catalog cache
DELETE FROM child WHERE h = 1; -- undo changes due to warm up
-- three distinct keys: run first with empty child for one batched FK read
BEGIN TRANSACTION ISOLATION LEVEL SERIALIZABLE;
EXPLAIN (DIST, ANALYZE, COSTS OFF) INSERT INTO child VALUES
  (100007, :'v1'), (100008, :'v2'), (100009, :'v3');
                       QUERY PLAN                        
---------------------------------------------------------
 Insert on child (actual rows=0 loops=1)
   ->  Values Scan on "*VALUES*" (actual rows=3 loops=1)
         Storage Table Write Requests: 3
 Trigger for constraint child_v1_fkey: calls=3
 Storage Read Requests: 1
 Storage Read Ops: 2
 Storage Rows Scanned: 3
 Storage Write Requests: 3
 Storage Flush Requests: 1
(9 rows)

COMMIT;
SELECT count(*) FROM child;
 count 
-------
     3
(1 row)

-- same key repeated
BEGIN TRANSACTION ISOLATION LEVEL SERIALIZABLE;
EXPLAIN (DIST, ANALYZE, COSTS OFF) INSERT INTO child VALUES
  (100004, :'v1'), (100005, :'v1'), (100006, :'v1');
                       QUERY PLAN                        
---------------------------------------------------------
 Insert on child (actual rows=0 loops=1)
   ->  Values Scan on "*VALUES*" (actual rows=3 loops=1)
         Storage Table Write Requests: 3
 Trigger for constraint child_v1_fkey: calls=3
 Storage Read Requests: 1
 Storage Read Ops: 1
 Storage Rows Scanned: 1
 Storage Write Requests: 3
 Storage Flush Requests: 1
(9 rows)

COMMIT;
SELECT count(*) FROM child;
 count 
-------
     6
(1 row)

-- two distinct keys with duplicate
BEGIN TRANSACTION ISOLATION LEVEL SERIALIZABLE;
EXPLAIN (DIST, ANALYZE, COSTS OFF) INSERT INTO child VALUES
  (100001, :'v1'), (100002, :'v1'), (100003, :'v2');
                       QUERY PLAN                        
---------------------------------------------------------
 Insert on child (actual rows=0 loops=1)
   ->  Values Scan on "*VALUES*" (actual rows=3 loops=1)
         Storage Table Write Requests: 3
 Trigger for constraint child_v1_fkey: calls=3
 Storage Read Requests: 1
 Storage Read Ops: 1
 Storage Rows Scanned: 2
 Storage Write Requests: 3
 Storage Flush Requests: 1
(9 rows)

COMMIT;
SELECT count(*) FROM child;
 count 
-------
     9
(1 row)

TRUNCATE child, parent;
-- COPY
INSERT INTO parent VALUES (1, :'v1'), (2, :'v2');
\set copy_cmd 'printf "100001\t' :v1 '\n100002\t' :v2 '\n"'
COPY child FROM PROGRAM :'copy_cmd';
SELECT count(*) FROM child;
 count 
-------
     2
(1 row)

\set copy_cmd 'printf "100003\t' :v1 '\n100004\t' :v2 '\n100005\t' :v5 '\n"'
COPY child FROM PROGRAM :'copy_cmd';
ysqlsh:yb_commands/foreign_key_when_types_mismatch_helper.sql:69: ERROR:  insert or update on table "child" violates foreign key constraint "child_v1_fkey"
DETAIL:  Key (v1)=(999) is not present in table "parent".
CONTEXT:  COPY child, line 4: ""
-- should fail: no matching parent key
SELECT count(*) FROM child;
 count 
-------
     2
(1 row)

INSERT INTO parent VALUES (3, :'trap_parent_val');
\set copy_cmd 'printf "100006\t' :trap_child_val '\n"'
COPY child FROM PROGRAM :'copy_cmd';
ysqlsh:yb_commands/foreign_key_when_types_mismatch_helper.sql:74: ERROR:  insert or update on table "child" violates foreign key constraint "child_v1_fkey"
DETAIL:  Key (v1)=(2147483648) is not present in table "parent".
CONTEXT:  COPY child, line 2: ""
-- should fail: out of range
SELECT count(*) FROM child;
 count 
-------
     2
(1 row)

TRUNCATE child, parent;
-- out of range insert and parent update
INSERT INTO parent VALUES (1, :'trap_parent_val');
INSERT INTO child VALUES (100001, :'trap_child_val'); -- should fail: out of range
ysqlsh:yb_commands/foreign_key_when_types_mismatch_helper.sql:81: ERROR:  insert or update on table "child" violates foreign key constraint "child_v1_fkey"
DETAIL:  Key (v1)=(2147483648) is not present in table "parent".
SELECT count(*) FROM child;
 count 
-------
     0
(1 row)

INSERT INTO parent VALUES (2, :'trap_child_val');
ysqlsh:yb_commands/foreign_key_when_types_mismatch_helper.sql:83: ERROR:  value "2147483648" is out of range for type integer
LINE 1: INSERT INTO parent VALUES (2, '2147483648');
                                      ^
INSERT INTO child VALUES (100002, :'trap_parent_val');
SELECT count(*) FROM child;
 count 
-------
     1
(1 row)

DELETE FROM parent WHERE h = 2;
SELECT count(*) FROM child;
 count 
-------
     1
(1 row)

DELETE FROM parent WHERE h = 1;
DELETE FROM child WHERE h = 100002;
INSERT INTO parent VALUES (1, :'v1');
INSERT INTO child VALUES (100002, :'v1');
SELECT count(*) FROM child;
 count 
-------
     1
(1 row)

UPDATE parent SET v1 = :'trap_child_val' WHERE h = 1; -- should fail: cannot fit child column
ysqlsh:yb_commands/foreign_key_when_types_mismatch_helper.sql:93: ERROR:  value "2147483648" is out of range for type integer
LINE 1: UPDATE parent SET v1 = '2147483648' WHERE h = 1;
                               ^
SELECT count(*) FROM child WHERE h = 100002 AND v1 = :'v1';
 count 
-------
     1
(1 row)

TRUNCATE child, parent;
-- ON DELETE/UPDATE SET NULL
ALTER TABLE child DROP CONSTRAINT child_v1_fkey;
ALTER TABLE child ADD CONSTRAINT child_v1_fkey FOREIGN KEY(v1) REFERENCES parent(v1)
  ON DELETE SET NULL ON UPDATE SET NULL;
INSERT INTO parent VALUES (1, :'v4'), (2, :'v5');
INSERT INTO child VALUES (100001, :'v4'), (100002, :'v5');
SELECT count(*) FROM child;
 count 
-------
     2
(1 row)

UPDATE parent SET v1 = :'v3' WHERE h = 1;
SELECT count(*) FROM child WHERE h = 100001 AND v1 IS NULL;
 count 
-------
     1
(1 row)

DELETE FROM parent WHERE h = 2;
SELECT count(*) FROM child WHERE h = 100002 AND v1 IS NULL;
 count 
-------
     1
(1 row)

TRUNCATE child, parent;
-- ON DELETE/UPDATE NO ACTION deferrable
ALTER TABLE child DROP CONSTRAINT child_v1_fkey;
ALTER TABLE child ADD CONSTRAINT child_v1_fkey FOREIGN KEY(v1) REFERENCES parent(v1)
  ON DELETE NO ACTION ON UPDATE NO ACTION DEFERRABLE INITIALLY DEFERRED;
INSERT INTO parent VALUES (1, :'v4'), (2, :'v5');
INSERT INTO child VALUES (100001, :'v4'), (100002, :'v5');
SELECT count(*) FROM child;
 count 
-------
     2
(1 row)

UPDATE parent SET v1 = :'v3' WHERE h = 1; -- should fail: no matching parent key
ysqlsh:yb_commands/foreign_key_when_types_mismatch_helper.sql:117: ERROR:  update or delete on table "parent" violates foreign key constraint "child_v1_fkey" on table "child"
DETAIL:  Key (v1)=(10) is still referenced from table "child".
DELETE FROM parent WHERE h = 2; -- should fail: no matching parent key
ysqlsh:yb_commands/foreign_key_when_types_mismatch_helper.sql:118: ERROR:  update or delete on table "parent" violates foreign key constraint "child_v1_fkey" on table "child"
DETAIL:  Key (v1)=(999) is still referenced from table "child".
SELECT count(*) FROM child;
 count 
-------
     2
(1 row)

BEGIN;
  UPDATE parent SET v1 = :'v3' WHERE h = 1; -- should pass for now
  INSERT INTO parent VALUES (3, :'v4');
COMMIT; -- should pass
SELECT count(*) FROM parent WHERE v1 = :'v3';
 count 
-------
     1
(1 row)

BEGIN;
  DELETE FROM parent WHERE h = 3; -- child still references :'v4'
COMMIT; -- should fail
ysqlsh:yb_commands/foreign_key_when_types_mismatch_helper.sql:127: ERROR:  update or delete on table "parent" violates foreign key constraint "child_v1_fkey" on table "child"
DETAIL:  Key (v1)=(10) is still referenced from table "child".
SELECT count(*) FROM child;
 count 
-------
     2
(1 row)

BEGIN;
  DELETE FROM parent WHERE h = 2; -- should pass for now
  INSERT INTO parent VALUES (4, :'v5');
COMMIT; -- should pass
SELECT count(*) FROM parent WHERE h = 2;
 count 
-------
     0
(1 row)

BEGIN;
  DELETE FROM parent WHERE h = 4; -- child still references :'v5'
COMMIT; -- should fail
ysqlsh:yb_commands/foreign_key_when_types_mismatch_helper.sql:136: ERROR:  update or delete on table "parent" violates foreign key constraint "child_v1_fkey" on table "child"
DETAIL:  Key (v1)=(999) is still referenced from table "child".
SELECT count(*) FROM child;
 count 
-------
     2
(1 row)

TRUNCATE child, parent;
-- ON DELETE/UPDATE RESTRICT deferrable
ALTER TABLE child DROP CONSTRAINT child_v1_fkey;
ALTER TABLE child ADD CONSTRAINT child_v1_fkey FOREIGN KEY(v1) REFERENCES parent(v1)
  ON DELETE RESTRICT ON UPDATE RESTRICT DEFERRABLE INITIALLY DEFERRED;
INSERT INTO parent VALUES (1, :'v4'), (2, :'v5');
INSERT INTO child VALUES (100001, :'v4'), (100002, :'v5');
SELECT count(*) FROM child;
 count 
-------
     2
(1 row)

UPDATE parent SET v1 = :'v3' WHERE h = 1; -- should fail: no matching parent key
ysqlsh:yb_commands/foreign_key_when_types_mismatch_helper.sql:147: ERROR:  update or delete on table "parent" violates foreign key constraint "child_v1_fkey" on table "child"
DETAIL:  Key (v1)=(10) is still referenced from table "child".
DELETE FROM parent WHERE h = 2; -- should fail: no matching parent key
ysqlsh:yb_commands/foreign_key_when_types_mismatch_helper.sql:148: ERROR:  update or delete on table "parent" violates foreign key constraint "child_v1_fkey" on table "child"
DETAIL:  Key (v1)=(999) is still referenced from table "child".
SELECT count(*) FROM child;
 count 
-------
     2
(1 row)

BEGIN;
  UPDATE parent SET v1 = :'v3' WHERE h = 1; -- should fail: no matching parent key
ysqlsh:yb_commands/foreign_key_when_types_mismatch_helper.sql:151: ERROR:  update or delete on table "parent" violates foreign key constraint "child_v1_fkey" on table "child"
DETAIL:  Key (v1)=(10) is still referenced from table "child".
  INSERT INTO parent VALUES (3, :'v4');
ysqlsh:yb_commands/foreign_key_when_types_mismatch_helper.sql:152: ERROR:  current transaction is aborted, commands ignored until end of transaction block
COMMIT; -- should fail
SELECT count(*) FROM parent WHERE v1 = :'v3';
 count 
-------
     0
(1 row)

BEGIN;
  DELETE FROM parent WHERE h = 2; -- should fail: no matching parent key
ysqlsh:yb_commands/foreign_key_when_types_mismatch_helper.sql:156: ERROR:  update or delete on table "parent" violates foreign key constraint "child_v1_fkey" on table "child"
DETAIL:  Key (v1)=(999) is still referenced from table "child".
  INSERT INTO parent VALUES (4, :'v5');
ysqlsh:yb_commands/foreign_key_when_types_mismatch_helper.sql:157: ERROR:  current transaction is aborted, commands ignored until end of transaction block
COMMIT; -- should fail
SELECT count(*) FROM parent WHERE h = 2;
 count 
-------
     1
(1 row)

TRUNCATE child, parent;
-- setup a composite foreign key constraint
ALTER TABLE parent ADD COLUMN v2 TEXT;
ALTER TABLE child ADD COLUMN v2 VARCHAR(12);
ALTER TABLE child DROP CONSTRAINT child_v1_fkey;
DROP INDEX parent_v1_key;
ALTER TABLE parent ADD UNIQUE (v1, v2);
-- partial null composite update
ALTER TABLE child ADD CONSTRAINT child_v1_v2_fkey FOREIGN KEY(v1, v2) REFERENCES parent(v1, v2)
  ON DELETE CASCADE ON UPDATE CASCADE;
INSERT INTO parent VALUES (1, 1, 'hello');
INSERT INTO child VALUES (100001, 1, 'hello');
SELECT count(*) FROM child;
 count 
-------
     1
(1 row)

UPDATE parent SET v1 = NULL, v2 = 'hello2' WHERE h = 1; -- should pass: v2 need not exist in parent
SELECT count(*) FROM child WHERE h = 100001 AND v1 IS NULL AND v2 = 'hello2';
 count 
-------
     1
(1 row)

UPDATE parent SET v1 = 4, v2 = 'hello' WHERE h = 1; -- child row should be unchanged
SELECT count(*) FROM child WHERE h = 100001 AND v1 IS NULL AND v2 = 'hello2';
 count 
-------
     1
(1 row)

TRUNCATE child, parent;
ALTER TABLE child DROP CONSTRAINT child_v1_v2_fkey;
-- ON DELETE/UPDATE SET DEFAULT composite
ALTER TABLE child ALTER COLUMN v1 SET DEFAULT :'v1';
ALTER TABLE child ALTER COLUMN v2 SET DEFAULT 'default';
ALTER TABLE child ADD CONSTRAINT child_v1_v2_fkey FOREIGN KEY(v1, v2) REFERENCES parent(v1, v2)
  ON DELETE SET DEFAULT ON UPDATE SET DEFAULT;
INSERT INTO parent VALUES (1, :'v1', 'hello'), (2, :'v2', 'world'), (3, :'v4', 'yugabyte');
INSERT INTO child VALUES (100001, :'v2', 'world'), (100002, :'v4', 'yugabyte');
SELECT count(*) FROM child;
 count 
-------
     2
(1 row)

UPDATE parent SET v1 = :'v3', v2 = 'world2' WHERE h = 2; -- should fail: default pair not in parent
ysqlsh:yb_commands/foreign_key_when_types_mismatch_helper.sql:190: ERROR:  insert or update on table "child" violates foreign key constraint "child_v1_v2_fkey"
DETAIL:  Key (v1, v2)=(1000000, default) is not present in table "parent".
INSERT INTO parent VALUES (4, :'v1', 'default');
UPDATE parent SET v1 = :'v3', v2 = 'world2' WHERE h = 2; -- should pass
SELECT count(*) FROM child WHERE h = 100001 AND v1 = :'v3' AND v2 = 'world2';
 count 
-------
     0
(1 row)

SELECT count(*) FROM child WHERE h = 100001 AND v1 = :'v1' AND v2 = 'default';
 count 
-------
     1
(1 row)

DELETE FROM parent WHERE h = 3;
SELECT count(*) FROM child WHERE v1 = :'v1' AND v2 = 'default';
 count 
-------
     2
(1 row)

TRUNCATE child, parent;
ALTER TABLE child DROP CONSTRAINT child_v1_v2_fkey;
-- MATCH FULL
ALTER TABLE child ADD CONSTRAINT child_v1_v2_fkey FOREIGN KEY(v1, v2) REFERENCES parent(v1, v2)
  MATCH FULL ON DELETE CASCADE ON UPDATE CASCADE;
INSERT INTO parent VALUES (1, :'v1', 'hello');
INSERT INTO child VALUES (100001, :'v1', 'hello');
SELECT count(*) FROM child;
 count 
-------
     1
(1 row)

INSERT INTO parent VALUES (2, NULL, 'hello');
INSERT INTO child VALUES (100002, NULL, 'hello'); -- should fail
ysqlsh:yb_commands/foreign_key_when_types_mismatch_helper.sql:207: ERROR:  insert or update on table "child" violates foreign key constraint "child_v1_v2_fkey"
DETAIL:  MATCH FULL does not allow mixing of null and nonnull key values.
SELECT count(*) FROM child;
 count 
-------
     1
(1 row)

INSERT INTO child VALUES (100003, NULL, NULL); -- should pass
SELECT count(*) FROM child;
 count 
-------
     2
(1 row)

UPDATE child SET v1 = NULL; -- should fail
ysqlsh:yb_commands/foreign_key_when_types_mismatch_helper.sql:211: ERROR:  insert or update on table "child" violates foreign key constraint "child_v1_v2_fkey"
DETAIL:  MATCH FULL does not allow mixing of null and nonnull key values.
SELECT count(*) FROM child;
 count 
-------
     2
(1 row)

UPDATE child SET v1 = NULL, v2 = NULL; -- should pass
SELECT count(*) FROM child WHERE v1 IS NULL AND v2 IS NULL;
 count 
-------
     2
(1 row)

TRUNCATE child, parent;
ALTER TABLE child DROP CONSTRAINT child_v1_v2_fkey;
ALTER TABLE parent DROP CONSTRAINT parent_v1_v2_key;
ALTER TABLE parent DROP COLUMN v2;
ALTER TABLE child DROP COLUMN v2;
CREATE UNIQUE INDEX parent_v1_key ON parent(v1) SPLIT INTO 1 TABLETS;
-- cleanup
DROP TABLE child;
DROP TABLE parent;
-- varchar to text
CREATE TABLE parent(h INT PRIMARY KEY, v1 TEXT) SPLIT INTO 1 TABLETS;
CREATE UNIQUE INDEX parent_v1_key ON parent(v1) SPLIT INTO 1 TABLETS;
CREATE TABLE child(h INT PRIMARY KEY, v1 VARCHAR(12), FOREIGN KEY(v1) REFERENCES parent(v1)
  ON DELETE CASCADE ON UPDATE CASCADE) SPLIT INTO 1 TABLETS;
\set v1 world
\set v2 beta
\set v3 world_upd
\set v4 alpha
\set v5 missing
\set trap_parent_val xy_no_parent
\set trap_child_val xy_no_parent_text
\i yb_commands/foreign_key_when_types_mismatch_helper.sql
--
-- Helper for yb.orig.foreign_key_when_types_mismatch.sql.
--
-- Driver must CREATE parent(h, v1) and child(h, v1) with ON DELETE/UPDATE CASCADE.
-- parent(v1) must be backed by parent_v1_key with SPLIT INTO 1 TABLETS so FK batched
-- lookups hit a single tablet. Then set psql variables:
--   v1, v2, v3, v4, v5
--   trap_parent_val, trap_child_val
--
-- Each scenario inserts its own rows (parent h from 1, child h from 100001),
-- then TRUNCATEs both tables. The helper ends by dropping parent and child.
--
-- Scenarios (in order):
--   CASCADE, multi row insert, COPY, out of range insert/update,
--   SET NULL, NO ACTION deferrable (including COMMIT fail),
--   RESTRICT deferrable, partial null composite update, SET DEFAULT composite, MATCH FULL
--
-- CASCADE
INSERT INTO parent VALUES (1, :'v1');
INSERT INTO child VALUES (1, :'v1'); -- warm up catalog cache
DELETE FROM child WHERE h = 1; -- undo changes due to warm up
BEGIN TRANSACTION ISOLATION LEVEL SERIALIZABLE;
EXPLAIN (DIST, ANALYZE, COSTS OFF) INSERT INTO child VALUES (100001, :'v1');
                  QUERY PLAN                   
-----------------------------------------------
 Insert on child (actual rows=0 loops=1)
   ->  Result *RESULT* (actual rows=1 loops=1)
         Storage Table Write Requests: 1
 Trigger for constraint child_v1_fkey: calls=1
 Storage Read Requests: 1
 Storage Read Ops: 1
 Storage Rows Scanned: 1
 Storage Write Requests: 1
 Storage Flush Requests: 1
(9 rows)

COMMIT;
SELECT count(*) FROM child;
 count 
-------
     1
(1 row)

ALTER TABLE child DROP CONSTRAINT child_v1_fkey;
ALTER TABLE child ADD CONSTRAINT child_v1_fkey FOREIGN KEY(v1) REFERENCES parent(v1)
  ON DELETE CASCADE ON UPDATE CASCADE;
UPDATE parent SET v1 = :'v3' WHERE h = 1;
SELECT count(*) FROM child WHERE h = 100001 AND v1 = :'v3';
 count 
-------
     1
(1 row)

DELETE FROM parent WHERE h = 1;
SELECT count(*) FROM child;
 count 
-------
     0
(1 row)

INSERT INTO parent VALUES (1, :'v1');
INSERT INTO child VALUES (100002, :'v5'); -- should fail: no matching parent key
ysqlsh:yb_commands/foreign_key_when_types_mismatch_helper.sql:35: ERROR:  insert or update on table "child" violates foreign key constraint "child_v1_fkey"
DETAIL:  Key (v1)=(missing) is not present in table "parent".
SELECT count(*) FROM child;
 count 
-------
     0
(1 row)

TRUNCATE child, parent;
-- multi row insert
INSERT INTO parent VALUES (1, :'v1'), (2, :'v2'), (3, :'v3');
INSERT INTO child VALUES (1, :'v1'); -- warm up catalog cache
DELETE FROM child WHERE h = 1; -- undo changes due to warm up
-- three distinct keys: run first with empty child for one batched FK read
BEGIN TRANSACTION ISOLATION LEVEL SERIALIZABLE;
EXPLAIN (DIST, ANALYZE, COSTS OFF) INSERT INTO child VALUES
  (100007, :'v1'), (100008, :'v2'), (100009, :'v3');
                       QUERY PLAN                        
---------------------------------------------------------
 Insert on child (actual rows=0 loops=1)
   ->  Values Scan on "*VALUES*" (actual rows=3 loops=1)
         Storage Table Write Requests: 3
 Trigger for constraint child_v1_fkey: calls=3
 Storage Read Requests: 1
 Storage Read Ops: 3
 Storage Rows Scanned: 3
 Storage Write Requests: 3
 Storage Flush Requests: 1
(9 rows)

COMMIT;
SELECT count(*) FROM child;
 count 
-------
     3
(1 row)

-- same key repeated
BEGIN TRANSACTION ISOLATION LEVEL SERIALIZABLE;
EXPLAIN (DIST, ANALYZE, COSTS OFF) INSERT INTO child VALUES
  (100004, :'v1'), (100005, :'v1'), (100006, :'v1');
                       QUERY PLAN                        
---------------------------------------------------------
 Insert on child (actual rows=0 loops=1)
   ->  Values Scan on "*VALUES*" (actual rows=3 loops=1)
         Storage Table Write Requests: 3
 Trigger for constraint child_v1_fkey: calls=3
 Storage Read Requests: 1
 Storage Read Ops: 1
 Storage Rows Scanned: 1
 Storage Write Requests: 3
 Storage Flush Requests: 1
(9 rows)

COMMIT;
SELECT count(*) FROM child;
 count 
-------
     6
(1 row)

-- two distinct keys with duplicate
BEGIN TRANSACTION ISOLATION LEVEL SERIALIZABLE;
EXPLAIN (DIST, ANALYZE, COSTS OFF) INSERT INTO child VALUES
  (100001, :'v1'), (100002, :'v1'), (100003, :'v2');
                       QUERY PLAN                        
---------------------------------------------------------
 Insert on child (actual rows=0 loops=1)
   ->  Values Scan on "*VALUES*" (actual rows=3 loops=1)
         Storage Table Write Requests: 3
 Trigger for constraint child_v1_fkey: calls=3
 Storage Read Requests: 1
 Storage Read Ops: 2
 Storage Rows Scanned: 2
 Storage Write Requests: 3
 Storage Flush Requests: 1
(9 rows)

COMMIT;
SELECT count(*) FROM child;
 count 
-------
     9
(1 row)

TRUNCATE child, parent;
-- COPY
INSERT INTO parent VALUES (1, :'v1'), (2, :'v2');
\set copy_cmd 'printf "100001\t' :v1 '\n100002\t' :v2 '\n"'
COPY child FROM PROGRAM :'copy_cmd';
SELECT count(*) FROM child;
 count 
-------
     2
(1 row)

\set copy_cmd 'printf "100003\t' :v1 '\n100004\t' :v2 '\n100005\t' :v5 '\n"'
COPY child FROM PROGRAM :'copy_cmd';
ysqlsh:yb_commands/foreign_key_when_types_mismatch_helper.sql:69: ERROR:  insert or update on table "child" violates foreign key constraint "child_v1_fkey"
DETAIL:  Key (v1)=(missing) is not present in table "parent".
CONTEXT:  COPY child, line 4: ""
-- should fail: no matching parent key
SELECT count(*) FROM child;
 count 
-------
     2
(1 row)

INSERT INTO parent VALUES (3, :'trap_parent_val');
\set copy_cmd 'printf "100006\t' :trap_child_val '\n"'
COPY child FROM PROGRAM :'copy_cmd';
ysqlsh:yb_commands/foreign_key_when_types_mismatch_helper.sql:74: ERROR:  value too long for type character varying(12)
CONTEXT:  COPY child, line 1, column v1: "xy_no_parent_text"
-- should fail: out of range
SELECT count(*) FROM child;
 count 
-------
     2
(1 row)

TRUNCATE child, parent;
-- out of range insert and parent update
INSERT INTO parent VALUES (1, :'trap_parent_val');
INSERT INTO child VALUES (100001, :'trap_child_val'); -- should fail: out of range
ysqlsh:yb_commands/foreign_key_when_types_mismatch_helper.sql:81: ERROR:  value too long for type character varying(12)
SELECT count(*) FROM child;
 count 
-------
     0
(1 row)

INSERT INTO parent VALUES (2, :'trap_child_val');
INSERT INTO child VALUES (100002, :'trap_parent_val');
SELECT count(*) FROM child;
 count 
-------
     1
(1 row)

DELETE FROM parent WHERE h = 2;
SELECT count(*) FROM child;
 count 
-------
     1
(1 row)

DELETE FROM parent WHERE h = 1;
DELETE FROM child WHERE h = 100002;
INSERT INTO parent VALUES (1, :'v1');
INSERT INTO child VALUES (100002, :'v1');
SELECT count(*) FROM child;
 count 
-------
     1
(1 row)

UPDATE parent SET v1 = :'trap_child_val' WHERE h = 1; -- should fail: cannot fit child column
ysqlsh:yb_commands/foreign_key_when_types_mismatch_helper.sql:93: ERROR:  value too long for type character varying(12)
CONTEXT:  SQL statement "UPDATE ONLY "public"."child" SET "v1" = $1 WHERE $2 OPERATOR(pg_catalog.=) "v1"::pg_catalog.text"
SELECT count(*) FROM child WHERE h = 100002 AND v1 = :'v1';
 count 
-------
     1
(1 row)

TRUNCATE child, parent;
-- ON DELETE/UPDATE SET NULL
ALTER TABLE child DROP CONSTRAINT child_v1_fkey;
ALTER TABLE child ADD CONSTRAINT child_v1_fkey FOREIGN KEY(v1) REFERENCES parent(v1)
  ON DELETE SET NULL ON UPDATE SET NULL;
INSERT INTO parent VALUES (1, :'v4'), (2, :'v5');
INSERT INTO child VALUES (100001, :'v4'), (100002, :'v5');
SELECT count(*) FROM child;
 count 
-------
     2
(1 row)

UPDATE parent SET v1 = :'v3' WHERE h = 1;
SELECT count(*) FROM child WHERE h = 100001 AND v1 IS NULL;
 count 
-------
     1
(1 row)

DELETE FROM parent WHERE h = 2;
SELECT count(*) FROM child WHERE h = 100002 AND v1 IS NULL;
 count 
-------
     1
(1 row)

TRUNCATE child, parent;
-- ON DELETE/UPDATE NO ACTION deferrable
ALTER TABLE child DROP CONSTRAINT child_v1_fkey;
ALTER TABLE child ADD CONSTRAINT child_v1_fkey FOREIGN KEY(v1) REFERENCES parent(v1)
  ON DELETE NO ACTION ON UPDATE NO ACTION DEFERRABLE INITIALLY DEFERRED;
INSERT INTO parent VALUES (1, :'v4'), (2, :'v5');
INSERT INTO child VALUES (100001, :'v4'), (100002, :'v5');
SELECT count(*) FROM child;
 count 
-------
     2
(1 row)

UPDATE parent SET v1 = :'v3' WHERE h = 1; -- should fail: no matching parent key
ysqlsh:yb_commands/foreign_key_when_types_mismatch_helper.sql:117: ERROR:  update or delete on table "parent" violates foreign key constraint "child_v1_fkey" on table "child"
DETAIL:  Key (v1)=(alpha) is still referenced from table "child".
DELETE FROM parent WHERE h = 2; -- should fail: no matching parent key
ysqlsh:yb_commands/foreign_key_when_types_mismatch_helper.sql:118: ERROR:  update or delete on table "parent" violates foreign key constraint "child_v1_fkey" on table "child"
DETAIL:  Key (v1)=(missing) is still referenced from table "child".
SELECT count(*) FROM child;
 count 
-------
     2
(1 row)

BEGIN;
  UPDATE parent SET v1 = :'v3' WHERE h = 1; -- should pass for now
  INSERT INTO parent VALUES (3, :'v4');
COMMIT; -- should pass
SELECT count(*) FROM parent WHERE v1 = :'v3';
 count 
-------
     1
(1 row)

BEGIN;
  DELETE FROM parent WHERE h = 3; -- child still references :'v4'
COMMIT; -- should fail
ysqlsh:yb_commands/foreign_key_when_types_mismatch_helper.sql:127: ERROR:  update or delete on table "parent" violates foreign key constraint "child_v1_fkey" on table "child"
DETAIL:  Key (v1)=(alpha) is still referenced from table "child".
SELECT count(*) FROM child;
 count 
-------
     2
(1 row)

BEGIN;
  DELETE FROM parent WHERE h = 2; -- should pass for now
  INSERT INTO parent VALUES (4, :'v5');
COMMIT; -- should pass
SELECT count(*) FROM parent WHERE h = 2;
 count 
-------
     0
(1 row)

BEGIN;
  DELETE FROM parent WHERE h = 4; -- child still references :'v5'
COMMIT; -- should fail
ysqlsh:yb_commands/foreign_key_when_types_mismatch_helper.sql:136: ERROR:  update or delete on table "parent" violates foreign key constraint "child_v1_fkey" on table "child"
DETAIL:  Key (v1)=(missing) is still referenced from table "child".
SELECT count(*) FROM child;
 count 
-------
     2
(1 row)

TRUNCATE child, parent;
-- ON DELETE/UPDATE RESTRICT deferrable
ALTER TABLE child DROP CONSTRAINT child_v1_fkey;
ALTER TABLE child ADD CONSTRAINT child_v1_fkey FOREIGN KEY(v1) REFERENCES parent(v1)
  ON DELETE RESTRICT ON UPDATE RESTRICT DEFERRABLE INITIALLY DEFERRED;
INSERT INTO parent VALUES (1, :'v4'), (2, :'v5');
INSERT INTO child VALUES (100001, :'v4'), (100002, :'v5');
SELECT count(*) FROM child;
 count 
-------
     2
(1 row)

UPDATE parent SET v1 = :'v3' WHERE h = 1; -- should fail: no matching parent key
ysqlsh:yb_commands/foreign_key_when_types_mismatch_helper.sql:147: ERROR:  update or delete on table "parent" violates foreign key constraint "child_v1_fkey" on table "child"
DETAIL:  Key (v1)=(alpha) is still referenced from table "child".
DELETE FROM parent WHERE h = 2; -- should fail: no matching parent key
ysqlsh:yb_commands/foreign_key_when_types_mismatch_helper.sql:148: ERROR:  update or delete on table "parent" violates foreign key constraint "child_v1_fkey" on table "child"
DETAIL:  Key (v1)=(missing) is still referenced from table "child".
SELECT count(*) FROM child;
 count 
-------
     2
(1 row)

BEGIN;
  UPDATE parent SET v1 = :'v3' WHERE h = 1; -- should fail: no matching parent key
ysqlsh:yb_commands/foreign_key_when_types_mismatch_helper.sql:151: ERROR:  update or delete on table "parent" violates foreign key constraint "child_v1_fkey" on table "child"
DETAIL:  Key (v1)=(alpha) is still referenced from table "child".
  INSERT INTO parent VALUES (3, :'v4');
ysqlsh:yb_commands/foreign_key_when_types_mismatch_helper.sql:152: ERROR:  current transaction is aborted, commands ignored until end of transaction block
COMMIT; -- should fail
SELECT count(*) FROM parent WHERE v1 = :'v3';
 count 
-------
     0
(1 row)

BEGIN;
  DELETE FROM parent WHERE h = 2; -- should fail: no matching parent key
ysqlsh:yb_commands/foreign_key_when_types_mismatch_helper.sql:156: ERROR:  update or delete on table "parent" violates foreign key constraint "child_v1_fkey" on table "child"
DETAIL:  Key (v1)=(missing) is still referenced from table "child".
  INSERT INTO parent VALUES (4, :'v5');
ysqlsh:yb_commands/foreign_key_when_types_mismatch_helper.sql:157: ERROR:  current transaction is aborted, commands ignored until end of transaction block
COMMIT; -- should fail
SELECT count(*) FROM parent WHERE h = 2;
 count 
-------
     1
(1 row)

TRUNCATE child, parent;
-- setup a composite foreign key constraint
ALTER TABLE parent ADD COLUMN v2 TEXT;
ALTER TABLE child ADD COLUMN v2 VARCHAR(12);
ALTER TABLE child DROP CONSTRAINT child_v1_fkey;
DROP INDEX parent_v1_key;
ALTER TABLE parent ADD UNIQUE (v1, v2);
-- partial null composite update
ALTER TABLE child ADD CONSTRAINT child_v1_v2_fkey FOREIGN KEY(v1, v2) REFERENCES parent(v1, v2)
  ON DELETE CASCADE ON UPDATE CASCADE;
INSERT INTO parent VALUES (1, 1, 'hello');
INSERT INTO child VALUES (100001, 1, 'hello');
SELECT count(*) FROM child;
 count 
-------
     1
(1 row)

UPDATE parent SET v1 = NULL, v2 = 'hello2' WHERE h = 1; -- should pass: v2 need not exist in parent
SELECT count(*) FROM child WHERE h = 100001 AND v1 IS NULL AND v2 = 'hello2';
 count 
-------
     1
(1 row)

UPDATE parent SET v1 = 4, v2 = 'hello' WHERE h = 1; -- child row should be unchanged
SELECT count(*) FROM child WHERE h = 100001 AND v1 IS NULL AND v2 = 'hello2';
 count 
-------
     1
(1 row)

TRUNCATE child, parent;
ALTER TABLE child DROP CONSTRAINT child_v1_v2_fkey;
-- ON DELETE/UPDATE SET DEFAULT composite
ALTER TABLE child ALTER COLUMN v1 SET DEFAULT :'v1';
ALTER TABLE child ALTER COLUMN v2 SET DEFAULT 'default';
ALTER TABLE child ADD CONSTRAINT child_v1_v2_fkey FOREIGN KEY(v1, v2) REFERENCES parent(v1, v2)
  ON DELETE SET DEFAULT ON UPDATE SET DEFAULT;
INSERT INTO parent VALUES (1, :'v1', 'hello'), (2, :'v2', 'world'), (3, :'v4', 'yugabyte');
INSERT INTO child VALUES (100001, :'v2', 'world'), (100002, :'v4', 'yugabyte');
SELECT count(*) FROM child;
 count 
-------
     2
(1 row)

UPDATE parent SET v1 = :'v3', v2 = 'world2' WHERE h = 2; -- should fail: default pair not in parent
ysqlsh:yb_commands/foreign_key_when_types_mismatch_helper.sql:190: ERROR:  insert or update on table "child" violates foreign key constraint "child_v1_v2_fkey"
DETAIL:  Key (v1, v2)=(world, default) is not present in table "parent".
INSERT INTO parent VALUES (4, :'v1', 'default');
UPDATE parent SET v1 = :'v3', v2 = 'world2' WHERE h = 2; -- should pass
SELECT count(*) FROM child WHERE h = 100001 AND v1 = :'v3' AND v2 = 'world2';
 count 
-------
     0
(1 row)

SELECT count(*) FROM child WHERE h = 100001 AND v1 = :'v1' AND v2 = 'default';
 count 
-------
     1
(1 row)

DELETE FROM parent WHERE h = 3;
SELECT count(*) FROM child WHERE v1 = :'v1' AND v2 = 'default';
 count 
-------
     2
(1 row)

TRUNCATE child, parent;
ALTER TABLE child DROP CONSTRAINT child_v1_v2_fkey;
-- MATCH FULL
ALTER TABLE child ADD CONSTRAINT child_v1_v2_fkey FOREIGN KEY(v1, v2) REFERENCES parent(v1, v2)
  MATCH FULL ON DELETE CASCADE ON UPDATE CASCADE;
INSERT INTO parent VALUES (1, :'v1', 'hello');
INSERT INTO child VALUES (100001, :'v1', 'hello');
SELECT count(*) FROM child;
 count 
-------
     1
(1 row)

INSERT INTO parent VALUES (2, NULL, 'hello');
INSERT INTO child VALUES (100002, NULL, 'hello'); -- should fail
ysqlsh:yb_commands/foreign_key_when_types_mismatch_helper.sql:207: ERROR:  insert or update on table "child" violates foreign key constraint "child_v1_v2_fkey"
DETAIL:  MATCH FULL does not allow mixing of null and nonnull key values.
SELECT count(*) FROM child;
 count 
-------
     1
(1 row)

INSERT INTO child VALUES (100003, NULL, NULL); -- should pass
SELECT count(*) FROM child;
 count 
-------
     2
(1 row)

UPDATE child SET v1 = NULL; -- should fail
ysqlsh:yb_commands/foreign_key_when_types_mismatch_helper.sql:211: ERROR:  insert or update on table "child" violates foreign key constraint "child_v1_v2_fkey"
DETAIL:  MATCH FULL does not allow mixing of null and nonnull key values.
SELECT count(*) FROM child;
 count 
-------
     2
(1 row)

UPDATE child SET v1 = NULL, v2 = NULL; -- should pass
SELECT count(*) FROM child WHERE v1 IS NULL AND v2 IS NULL;
 count 
-------
     2
(1 row)

TRUNCATE child, parent;
ALTER TABLE child DROP CONSTRAINT child_v1_v2_fkey;
ALTER TABLE parent DROP CONSTRAINT parent_v1_v2_key;
ALTER TABLE parent DROP COLUMN v2;
ALTER TABLE child DROP COLUMN v2;
CREATE UNIQUE INDEX parent_v1_key ON parent(v1) SPLIT INTO 1 TABLETS;
-- cleanup
DROP TABLE child;
DROP TABLE parent;
-- text to varchar
CREATE TABLE parent(h INT PRIMARY KEY, v1 VARCHAR(12)) SPLIT INTO 1 TABLETS;
CREATE UNIQUE INDEX parent_v1_key ON parent(v1) SPLIT INTO 1 TABLETS;
CREATE TABLE child(h INT PRIMARY KEY, v1 TEXT, FOREIGN KEY(v1) REFERENCES parent(v1)
  ON DELETE CASCADE ON UPDATE CASCADE) SPLIT INTO 1 TABLETS;
\set v1 hello
\set v2 beta
\set v3 hello_upd
\set v4 alpha
\set v5 missing
\set trap_parent_val xy_no_parent
\set trap_child_val xy_no_parent_text
\i yb_commands/foreign_key_when_types_mismatch_helper.sql
--
-- Helper for yb.orig.foreign_key_when_types_mismatch.sql.
--
-- Driver must CREATE parent(h, v1) and child(h, v1) with ON DELETE/UPDATE CASCADE.
-- parent(v1) must be backed by parent_v1_key with SPLIT INTO 1 TABLETS so FK batched
-- lookups hit a single tablet. Then set psql variables:
--   v1, v2, v3, v4, v5
--   trap_parent_val, trap_child_val
--
-- Each scenario inserts its own rows (parent h from 1, child h from 100001),
-- then TRUNCATEs both tables. The helper ends by dropping parent and child.
--
-- Scenarios (in order):
--   CASCADE, multi row insert, COPY, out of range insert/update,
--   SET NULL, NO ACTION deferrable (including COMMIT fail),
--   RESTRICT deferrable, partial null composite update, SET DEFAULT composite, MATCH FULL
--
-- CASCADE
INSERT INTO parent VALUES (1, :'v1');
INSERT INTO child VALUES (1, :'v1'); -- warm up catalog cache
DELETE FROM child WHERE h = 1; -- undo changes due to warm up
BEGIN TRANSACTION ISOLATION LEVEL SERIALIZABLE;
EXPLAIN (DIST, ANALYZE, COSTS OFF) INSERT INTO child VALUES (100001, :'v1');
                  QUERY PLAN                   
-----------------------------------------------
 Insert on child (actual rows=0 loops=1)
   ->  Result *RESULT* (actual rows=1 loops=1)
         Storage Table Write Requests: 1
 Trigger for constraint child_v1_fkey: calls=1
 Storage Read Requests: 1
 Storage Read Ops: 1
 Storage Rows Scanned: 1
 Storage Write Requests: 1
 Storage Flush Requests: 1
(9 rows)

COMMIT;
SELECT count(*) FROM child;
 count 
-------
     1
(1 row)

ALTER TABLE child DROP CONSTRAINT child_v1_fkey;
ALTER TABLE child ADD CONSTRAINT child_v1_fkey FOREIGN KEY(v1) REFERENCES parent(v1)
  ON DELETE CASCADE ON UPDATE CASCADE;
UPDATE parent SET v1 = :'v3' WHERE h = 1;
SELECT count(*) FROM child WHERE h = 100001 AND v1 = :'v3';
 count 
-------
     1
(1 row)

DELETE FROM parent WHERE h = 1;
SELECT count(*) FROM child;
 count 
-------
     0
(1 row)

INSERT INTO parent VALUES (1, :'v1');
INSERT INTO child VALUES (100002, :'v5'); -- should fail: no matching parent key
ysqlsh:yb_commands/foreign_key_when_types_mismatch_helper.sql:35: ERROR:  insert or update on table "child" violates foreign key constraint "child_v1_fkey"
DETAIL:  Key (v1)=(missing) is not present in table "parent".
SELECT count(*) FROM child;
 count 
-------
     0
(1 row)

TRUNCATE child, parent;
-- multi row insert
INSERT INTO parent VALUES (1, :'v1'), (2, :'v2'), (3, :'v3');
INSERT INTO child VALUES (1, :'v1'); -- warm up catalog cache
DELETE FROM child WHERE h = 1; -- undo changes due to warm up
-- three distinct keys: run first with empty child for one batched FK read
BEGIN TRANSACTION ISOLATION LEVEL SERIALIZABLE;
EXPLAIN (DIST, ANALYZE, COSTS OFF) INSERT INTO child VALUES
  (100007, :'v1'), (100008, :'v2'), (100009, :'v3');
                       QUERY PLAN                        
---------------------------------------------------------
 Insert on child (actual rows=0 loops=1)
   ->  Values Scan on "*VALUES*" (actual rows=3 loops=1)
         Storage Table Write Requests: 3
 Trigger for constraint child_v1_fkey: calls=3
 Storage Read Requests: 1
 Storage Read Ops: 3
 Storage Rows Scanned: 3
 Storage Write Requests: 3
 Storage Flush Requests: 1
(9 rows)

COMMIT;
SELECT count(*) FROM child;
 count 
-------
     3
(1 row)

-- same key repeated
BEGIN TRANSACTION ISOLATION LEVEL SERIALIZABLE;
EXPLAIN (DIST, ANALYZE, COSTS OFF) INSERT INTO child VALUES
  (100004, :'v1'), (100005, :'v1'), (100006, :'v1');
                       QUERY PLAN                        
---------------------------------------------------------
 Insert on child (actual rows=0 loops=1)
   ->  Values Scan on "*VALUES*" (actual rows=3 loops=1)
         Storage Table Write Requests: 3
 Trigger for constraint child_v1_fkey: calls=3
 Storage Read Requests: 1
 Storage Read Ops: 1
 Storage Rows Scanned: 1
 Storage Write Requests: 3
 Storage Flush Requests: 1
(9 rows)

COMMIT;
SELECT count(*) FROM child;
 count 
-------
     6
(1 row)

-- two distinct keys with duplicate
BEGIN TRANSACTION ISOLATION LEVEL SERIALIZABLE;
EXPLAIN (DIST, ANALYZE, COSTS OFF) INSERT INTO child VALUES
  (100001, :'v1'), (100002, :'v1'), (100003, :'v2');
                       QUERY PLAN                        
---------------------------------------------------------
 Insert on child (actual rows=0 loops=1)
   ->  Values Scan on "*VALUES*" (actual rows=3 loops=1)
         Storage Table Write Requests: 3
 Trigger for constraint child_v1_fkey: calls=3
 Storage Read Requests: 1
 Storage Read Ops: 2
 Storage Rows Scanned: 2
 Storage Write Requests: 3
 Storage Flush Requests: 1
(9 rows)

COMMIT;
SELECT count(*) FROM child;
 count 
-------
     9
(1 row)

TRUNCATE child, parent;
-- COPY
INSERT INTO parent VALUES (1, :'v1'), (2, :'v2');
\set copy_cmd 'printf "100001\t' :v1 '\n100002\t' :v2 '\n"'
COPY child FROM PROGRAM :'copy_cmd';
SELECT count(*) FROM child;
 count 
-------
     2
(1 row)

\set copy_cmd 'printf "100003\t' :v1 '\n100004\t' :v2 '\n100005\t' :v5 '\n"'
COPY child FROM PROGRAM :'copy_cmd';
ysqlsh:yb_commands/foreign_key_when_types_mismatch_helper.sql:69: ERROR:  insert or update on table "child" violates foreign key constraint "child_v1_fkey"
DETAIL:  Key (v1)=(missing) is not present in table "parent".
CONTEXT:  COPY child, line 4: ""
-- should fail: no matching parent key
SELECT count(*) FROM child;
 count 
-------
     2
(1 row)

INSERT INTO parent VALUES (3, :'trap_parent_val');
\set copy_cmd 'printf "100006\t' :trap_child_val '\n"'
COPY child FROM PROGRAM :'copy_cmd';
ysqlsh:yb_commands/foreign_key_when_types_mismatch_helper.sql:74: ERROR:  insert or update on table "child" violates foreign key constraint "child_v1_fkey"
DETAIL:  Key (v1)=(xy_no_parent_text) is not present in table "parent".
CONTEXT:  COPY child, line 2: ""
-- should fail: out of range
SELECT count(*) FROM child;
 count 
-------
     2
(1 row)

TRUNCATE child, parent;
-- out of range insert and parent update
INSERT INTO parent VALUES (1, :'trap_parent_val');
INSERT INTO child VALUES (100001, :'trap_child_val'); -- should fail: out of range
ysqlsh:yb_commands/foreign_key_when_types_mismatch_helper.sql:81: ERROR:  insert or update on table "child" violates foreign key constraint "child_v1_fkey"
DETAIL:  Key (v1)=(xy_no_parent_text) is not present in table "parent".
SELECT count(*) FROM child;
 count 
-------
     0
(1 row)

INSERT INTO parent VALUES (2, :'trap_child_val');
ysqlsh:yb_commands/foreign_key_when_types_mismatch_helper.sql:83: ERROR:  value too long for type character varying(12)
INSERT INTO child VALUES (100002, :'trap_parent_val');
SELECT count(*) FROM child;
 count 
-------
     1
(1 row)

DELETE FROM parent WHERE h = 2;
SELECT count(*) FROM child;
 count 
-------
     1
(1 row)

DELETE FROM parent WHERE h = 1;
DELETE FROM child WHERE h = 100002;
INSERT INTO parent VALUES (1, :'v1');
INSERT INTO child VALUES (100002, :'v1');
SELECT count(*) FROM child;
 count 
-------
     1
(1 row)

UPDATE parent SET v1 = :'trap_child_val' WHERE h = 1; -- should fail: cannot fit child column
ysqlsh:yb_commands/foreign_key_when_types_mismatch_helper.sql:93: ERROR:  value too long for type character varying(12)
SELECT count(*) FROM child WHERE h = 100002 AND v1 = :'v1';
 count 
-------
     1
(1 row)

TRUNCATE child, parent;
-- ON DELETE/UPDATE SET NULL
ALTER TABLE child DROP CONSTRAINT child_v1_fkey;
ALTER TABLE child ADD CONSTRAINT child_v1_fkey FOREIGN KEY(v1) REFERENCES parent(v1)
  ON DELETE SET NULL ON UPDATE SET NULL;
INSERT INTO parent VALUES (1, :'v4'), (2, :'v5');
INSERT INTO child VALUES (100001, :'v4'), (100002, :'v5');
SELECT count(*) FROM child;
 count 
-------
     2
(1 row)

UPDATE parent SET v1 = :'v3' WHERE h = 1;
SELECT count(*) FROM child WHERE h = 100001 AND v1 IS NULL;
 count 
-------
     1
(1 row)

DELETE FROM parent WHERE h = 2;
SELECT count(*) FROM child WHERE h = 100002 AND v1 IS NULL;
 count 
-------
     1
(1 row)

TRUNCATE child, parent;
-- ON DELETE/UPDATE NO ACTION deferrable
ALTER TABLE child DROP CONSTRAINT child_v1_fkey;
ALTER TABLE child ADD CONSTRAINT child_v1_fkey FOREIGN KEY(v1) REFERENCES parent(v1)
  ON DELETE NO ACTION ON UPDATE NO ACTION DEFERRABLE INITIALLY DEFERRED;
INSERT INTO parent VALUES (1, :'v4'), (2, :'v5');
INSERT INTO child VALUES (100001, :'v4'), (100002, :'v5');
SELECT count(*) FROM child;
 count 
-------
     2
(1 row)

UPDATE parent SET v1 = :'v3' WHERE h = 1; -- should fail: no matching parent key
ysqlsh:yb_commands/foreign_key_when_types_mismatch_helper.sql:117: ERROR:  update or delete on table "parent" violates foreign key constraint "child_v1_fkey" on table "child"
DETAIL:  Key (v1)=(alpha) is still referenced from table "child".
DELETE FROM parent WHERE h = 2; -- should fail: no matching parent key
ysqlsh:yb_commands/foreign_key_when_types_mismatch_helper.sql:118: ERROR:  update or delete on table "parent" violates foreign key constraint "child_v1_fkey" on table "child"
DETAIL:  Key (v1)=(missing) is still referenced from table "child".
SELECT count(*) FROM child;
 count 
-------
     2
(1 row)

BEGIN;
  UPDATE parent SET v1 = :'v3' WHERE h = 1; -- should pass for now
  INSERT INTO parent VALUES (3, :'v4');
COMMIT; -- should pass
SELECT count(*) FROM parent WHERE v1 = :'v3';
 count 
-------
     1
(1 row)

BEGIN;
  DELETE FROM parent WHERE h = 3; -- child still references :'v4'
COMMIT; -- should fail
ysqlsh:yb_commands/foreign_key_when_types_mismatch_helper.sql:127: ERROR:  update or delete on table "parent" violates foreign key constraint "child_v1_fkey" on table "child"
DETAIL:  Key (v1)=(alpha) is still referenced from table "child".
SELECT count(*) FROM child;
 count 
-------
     2
(1 row)

BEGIN;
  DELETE FROM parent WHERE h = 2; -- should pass for now
  INSERT INTO parent VALUES (4, :'v5');
COMMIT; -- should pass
SELECT count(*) FROM parent WHERE h = 2;
 count 
-------
     0
(1 row)

BEGIN;
  DELETE FROM parent WHERE h = 4; -- child still references :'v5'
COMMIT; -- should fail
ysqlsh:yb_commands/foreign_key_when_types_mismatch_helper.sql:136: ERROR:  update or delete on table "parent" violates foreign key constraint "child_v1_fkey" on table "child"
DETAIL:  Key (v1)=(missing) is still referenced from table "child".
SELECT count(*) FROM child;
 count 
-------
     2
(1 row)

TRUNCATE child, parent;
-- ON DELETE/UPDATE RESTRICT deferrable
ALTER TABLE child DROP CONSTRAINT child_v1_fkey;
ALTER TABLE child ADD CONSTRAINT child_v1_fkey FOREIGN KEY(v1) REFERENCES parent(v1)
  ON DELETE RESTRICT ON UPDATE RESTRICT DEFERRABLE INITIALLY DEFERRED;
INSERT INTO parent VALUES (1, :'v4'), (2, :'v5');
INSERT INTO child VALUES (100001, :'v4'), (100002, :'v5');
SELECT count(*) FROM child;
 count 
-------
     2
(1 row)

UPDATE parent SET v1 = :'v3' WHERE h = 1; -- should fail: no matching parent key
ysqlsh:yb_commands/foreign_key_when_types_mismatch_helper.sql:147: ERROR:  update or delete on table "parent" violates foreign key constraint "child_v1_fkey" on table "child"
DETAIL:  Key (v1)=(alpha) is still referenced from table "child".
DELETE FROM parent WHERE h = 2; -- should fail: no matching parent key
ysqlsh:yb_commands/foreign_key_when_types_mismatch_helper.sql:148: ERROR:  update or delete on table "parent" violates foreign key constraint "child_v1_fkey" on table "child"
DETAIL:  Key (v1)=(missing) is still referenced from table "child".
SELECT count(*) FROM child;
 count 
-------
     2
(1 row)

BEGIN;
  UPDATE parent SET v1 = :'v3' WHERE h = 1; -- should fail: no matching parent key
ysqlsh:yb_commands/foreign_key_when_types_mismatch_helper.sql:151: ERROR:  update or delete on table "parent" violates foreign key constraint "child_v1_fkey" on table "child"
DETAIL:  Key (v1)=(alpha) is still referenced from table "child".
  INSERT INTO parent VALUES (3, :'v4');
ysqlsh:yb_commands/foreign_key_when_types_mismatch_helper.sql:152: ERROR:  current transaction is aborted, commands ignored until end of transaction block
COMMIT; -- should fail
SELECT count(*) FROM parent WHERE v1 = :'v3';
 count 
-------
     0
(1 row)

BEGIN;
  DELETE FROM parent WHERE h = 2; -- should fail: no matching parent key
ysqlsh:yb_commands/foreign_key_when_types_mismatch_helper.sql:156: ERROR:  update or delete on table "parent" violates foreign key constraint "child_v1_fkey" on table "child"
DETAIL:  Key (v1)=(missing) is still referenced from table "child".
  INSERT INTO parent VALUES (4, :'v5');
ysqlsh:yb_commands/foreign_key_when_types_mismatch_helper.sql:157: ERROR:  current transaction is aborted, commands ignored until end of transaction block
COMMIT; -- should fail
SELECT count(*) FROM parent WHERE h = 2;
 count 
-------
     1
(1 row)

TRUNCATE child, parent;
-- setup a composite foreign key constraint
ALTER TABLE parent ADD COLUMN v2 TEXT;
ALTER TABLE child ADD COLUMN v2 VARCHAR(12);
ALTER TABLE child DROP CONSTRAINT child_v1_fkey;
DROP INDEX parent_v1_key;
ALTER TABLE parent ADD UNIQUE (v1, v2);
-- partial null composite update
ALTER TABLE child ADD CONSTRAINT child_v1_v2_fkey FOREIGN KEY(v1, v2) REFERENCES parent(v1, v2)
  ON DELETE CASCADE ON UPDATE CASCADE;
INSERT INTO parent VALUES (1, 1, 'hello');
INSERT INTO child VALUES (100001, 1, 'hello');
SELECT count(*) FROM child;
 count 
-------
     1
(1 row)

UPDATE parent SET v1 = NULL, v2 = 'hello2' WHERE h = 1; -- should pass: v2 need not exist in parent
SELECT count(*) FROM child WHERE h = 100001 AND v1 IS NULL AND v2 = 'hello2';
 count 
-------
     1
(1 row)

UPDATE parent SET v1 = 4, v2 = 'hello' WHERE h = 1; -- child row should be unchanged
SELECT count(*) FROM child WHERE h = 100001 AND v1 IS NULL AND v2 = 'hello2';
 count 
-------
     1
(1 row)

TRUNCATE child, parent;
ALTER TABLE child DROP CONSTRAINT child_v1_v2_fkey;
-- ON DELETE/UPDATE SET DEFAULT composite
ALTER TABLE child ALTER COLUMN v1 SET DEFAULT :'v1';
ALTER TABLE child ALTER COLUMN v2 SET DEFAULT 'default';
ALTER TABLE child ADD CONSTRAINT child_v1_v2_fkey FOREIGN KEY(v1, v2) REFERENCES parent(v1, v2)
  ON DELETE SET DEFAULT ON UPDATE SET DEFAULT;
INSERT INTO parent VALUES (1, :'v1', 'hello'), (2, :'v2', 'world'), (3, :'v4', 'yugabyte');
INSERT INTO child VALUES (100001, :'v2', 'world'), (100002, :'v4', 'yugabyte');
SELECT count(*) FROM child;
 count 
-------
     2
(1 row)

UPDATE parent SET v1 = :'v3', v2 = 'world2' WHERE h = 2; -- should fail: default pair not in parent
ysqlsh:yb_commands/foreign_key_when_types_mismatch_helper.sql:190: ERROR:  insert or update on table "child" violates foreign key constraint "child_v1_v2_fkey"
DETAIL:  Key (v1, v2)=(hello, default) is not present in table "parent".
INSERT INTO parent VALUES (4, :'v1', 'default');
UPDATE parent SET v1 = :'v3', v2 = 'world2' WHERE h = 2; -- should pass
SELECT count(*) FROM child WHERE h = 100001 AND v1 = :'v3' AND v2 = 'world2';
 count 
-------
     0
(1 row)

SELECT count(*) FROM child WHERE h = 100001 AND v1 = :'v1' AND v2 = 'default';
 count 
-------
     1
(1 row)

DELETE FROM parent WHERE h = 3;
SELECT count(*) FROM child WHERE v1 = :'v1' AND v2 = 'default';
 count 
-------
     2
(1 row)

TRUNCATE child, parent;
ALTER TABLE child DROP CONSTRAINT child_v1_v2_fkey;
-- MATCH FULL
ALTER TABLE child ADD CONSTRAINT child_v1_v2_fkey FOREIGN KEY(v1, v2) REFERENCES parent(v1, v2)
  MATCH FULL ON DELETE CASCADE ON UPDATE CASCADE;
INSERT INTO parent VALUES (1, :'v1', 'hello');
INSERT INTO child VALUES (100001, :'v1', 'hello');
SELECT count(*) FROM child;
 count 
-------
     1
(1 row)

INSERT INTO parent VALUES (2, NULL, 'hello');
INSERT INTO child VALUES (100002, NULL, 'hello'); -- should fail
ysqlsh:yb_commands/foreign_key_when_types_mismatch_helper.sql:207: ERROR:  insert or update on table "child" violates foreign key constraint "child_v1_v2_fkey"
DETAIL:  MATCH FULL does not allow mixing of null and nonnull key values.
SELECT count(*) FROM child;
 count 
-------
     1
(1 row)

INSERT INTO child VALUES (100003, NULL, NULL); -- should pass
SELECT count(*) FROM child;
 count 
-------
     2
(1 row)

UPDATE child SET v1 = NULL; -- should fail
ysqlsh:yb_commands/foreign_key_when_types_mismatch_helper.sql:211: ERROR:  insert or update on table "child" violates foreign key constraint "child_v1_v2_fkey"
DETAIL:  MATCH FULL does not allow mixing of null and nonnull key values.
SELECT count(*) FROM child;
 count 
-------
     2
(1 row)

UPDATE child SET v1 = NULL, v2 = NULL; -- should pass
SELECT count(*) FROM child WHERE v1 IS NULL AND v2 IS NULL;
 count 
-------
     2
(1 row)

TRUNCATE child, parent;
ALTER TABLE child DROP CONSTRAINT child_v1_v2_fkey;
ALTER TABLE parent DROP CONSTRAINT parent_v1_v2_key;
ALTER TABLE parent DROP COLUMN v2;
ALTER TABLE child DROP COLUMN v2;
CREATE UNIQUE INDEX parent_v1_key ON parent(v1) SPLIT INTO 1 TABLETS;
-- cleanup
DROP TABLE child;
DROP TABLE parent;
-- Overflow case: parent VARCHAR(3), child TEXT
-- This test ensures that we error about non-existence, when inserting a longer text into
-- the child column than the parent column can hold, because it cannot exist in the parent table.
CREATE TABLE parent(h INT PRIMARY KEY, v1 VARCHAR(3) UNIQUE) SPLIT INTO 1 TABLETS;
CREATE TABLE child(h INT PRIMARY KEY, v1 TEXT, FOREIGN KEY(v1) REFERENCES parent(v1)
  ON DELETE CASCADE ON UPDATE CASCADE) SPLIT INTO 1 TABLETS;
INSERT INTO parent VALUES (1, 'abcdef'); -- should fail: cannot fit parent column
ERROR:  value too long for type character varying(3)
INSERT INTO parent VALUES (2, 'abc');
INSERT INTO child VALUES (100001, 'abcdef'); -- should fail: cannot exist in parent table
ERROR:  insert or update on table "child" violates foreign key constraint "child_v1_fkey"
DETAIL:  Key (v1)=(abcdef) is not present in table "parent".
UPDATE parent SET v1 = 'abcdef' WHERE h = 2; -- should fail: cannot fit parent column
ERROR:  value too long for type character varying(3)
DROP TABLE child;
DROP TABLE parent;
-- Overflow case: parent TEXT, child VARCHAR(3)
-- Parent text update should fail: cannot fit child column.
CREATE TABLE parent(h INT PRIMARY KEY, v1 TEXT) SPLIT INTO 1 TABLETS;
CREATE UNIQUE INDEX parent_v1_key ON parent(v1) SPLIT INTO 1 TABLETS;
CREATE TABLE child(h INT PRIMARY KEY, v1 VARCHAR(3), FOREIGN KEY(v1) REFERENCES parent(v1)
  ON DELETE CASCADE ON UPDATE CASCADE) SPLIT INTO 1 TABLETS;
INSERT INTO parent VALUES (1, 'abcdef');
INSERT INTO parent VALUES (2, 'abc');
INSERT INTO child VALUES (100001, 'abcdef'); -- should fail: cannot fit child column
ERROR:  value too long for type character varying(3)
INSERT INTO child VALUES (100002, 'abc');
UPDATE parent SET v1 = 'hello' WHERE h = 2; -- should fail: cannot fit child column
ERROR:  value too long for type character varying(3)
CONTEXT:  SQL statement "UPDATE ONLY "public"."child" SET "v1" = $1 WHERE $2 OPERATOR(pg_catalog.=) "v1"::pg_catalog.text"
DROP TABLE child;
DROP TABLE parent;
-- Composite FK with mixed mismatch and same-type columns
CREATE TABLE parent(h INT PRIMARY KEY, v1 INT, v2 BIGINT, v3 TEXT, UNIQUE(v1, v2, v3))
  SPLIT INTO 1 TABLETS;
CREATE TABLE child(h INT PRIMARY KEY, v1 SMALLINT, v2 BIGINT, v3 VARCHAR(12),
  FOREIGN KEY(v1, v2, v3) REFERENCES parent(v1, v2, v3)
  ON DELETE CASCADE ON UPDATE CASCADE) SPLIT INTO 1 TABLETS;
INSERT INTO parent VALUES (1, 123, 9876543210, 'hello');
INSERT INTO child VALUES (1, 123, 9876543210, 'hello'); -- warm up catalog cache
DELETE FROM child WHERE h = 1; -- undo changes due to warm up
BEGIN TRANSACTION ISOLATION LEVEL SERIALIZABLE;
EXPLAIN (DIST, ANALYZE, COSTS OFF) INSERT INTO child VALUES (100001, 123, 9876543210, 'hello');
                     QUERY PLAN                      
-----------------------------------------------------
 Insert on child (actual rows=0 loops=1)
   ->  Result *RESULT* (actual rows=1 loops=1)
         Storage Table Write Requests: 1
 Trigger for constraint child_v1_v2_v3_fkey: calls=1
 Storage Read Requests: 1
 Storage Read Ops: 1
 Storage Rows Scanned: 1
 Storage Write Requests: 1
 Storage Flush Requests: 1
(9 rows)

COMMIT;
SELECT count(*) FROM child;
 count 
-------
     1
(1 row)

ALTER TABLE child DROP CONSTRAINT child_v1_v2_v3_fkey;
ALTER TABLE child ADD CONSTRAINT child_v1_v2_v3_fkey FOREIGN KEY(v1, v2, v3)
  REFERENCES parent(v1, v2, v3) ON DELETE CASCADE ON UPDATE CASCADE;
UPDATE parent SET v1 = 124, v2 = 9876543211, v3 = 'hello2' WHERE h = 1;
SELECT count(*) FROM child WHERE h = 100001 AND v1 = 124 AND v2 = 9876543211 AND v3 = 'hello2';
 count 
-------
     1
(1 row)

DELETE FROM parent WHERE h = 1;
SELECT count(*) FROM child;
 count 
-------
     0
(1 row)

DROP TABLE child;
DROP TABLE parent;
-- Composite FK with 1 explicit and 3 implicit casts ==> 1 explicit cast
-- because this is a composite key, we ultimately use an explicit cast.
CREATE TABLE parent(h INT PRIMARY KEY, v1 INT, v2 SMALLINT, v3 TEXT, v4 VARCHAR(6),
  UNIQUE(v1, v2, v3, v4)) SPLIT INTO 1 TABLETS;
CREATE TABLE child(h INT PRIMARY KEY, v1 BIGINT, v2 INT, v3 VARCHAR(6), v4 CHAR(6),
  FOREIGN KEY(v1, v2, v3, v4) REFERENCES parent(v1, v2, v3, v4)
  ON DELETE CASCADE ON UPDATE CASCADE) SPLIT INTO 1 TABLETS;
INSERT INTO parent VALUES (1, 100, 123, 'hello', 'world');
INSERT INTO child VALUES (1, 100, 123, 'hello', 'world'); -- warm up catalog cache
DELETE FROM child WHERE h = 1; -- undo changes due to warm up
BEGIN TRANSACTION ISOLATION LEVEL SERIALIZABLE;
EXPLAIN (DIST, ANALYZE, COSTS OFF) INSERT INTO child VALUES (100001, 100, 123, 'hello', 'world');
                       QUERY PLAN                       
--------------------------------------------------------
 Insert on child (actual rows=0 loops=1)
   ->  Result *RESULT* (actual rows=1 loops=1)
         Storage Table Write Requests: 1
 Trigger for constraint child_v1_v2_v3_v4_fkey: calls=1
 Storage Read Requests: 2
 Storage Read Ops: 2
 Storage Rows Scanned: 2
 Storage Write Requests: 1
 Storage Flush Requests: 1
(9 rows)

COMMIT;
SELECT count(*) FROM child;
 count 
-------
     1
(1 row)

ALTER TABLE child DROP CONSTRAINT child_v1_v2_v3_v4_fkey;
ALTER TABLE child ADD CONSTRAINT child_v1_v2_v3_v4_fkey FOREIGN KEY(v1, v2, v3, v4)
  REFERENCES parent(v1, v2, v3, v4) ON DELETE CASCADE ON UPDATE CASCADE;
UPDATE parent SET v1 = 101, v2 = 124, v3 = 'hello2', v4 = 'world2' WHERE h = 1;
SELECT count(*) FROM child WHERE h = 100001 AND v1 = 101 AND v2 = 124 AND
  v3 = 'hello2' AND v4 = 'world2';
 count 
-------
     1
(1 row)

DELETE FROM parent WHERE h = 1;
SELECT count(*) FROM child;
 count 
-------
     0
(1 row)

DROP TABLE child;
DROP TABLE parent;
-- Foreign key into multiple parents
CREATE TABLE parent1(h INT PRIMARY KEY, v1 INT8 UNIQUE) SPLIT INTO 1 TABLETS;
CREATE TABLE parent2(h INT PRIMARY KEY, v1 INT4 UNIQUE) SPLIT INTO 1 TABLETS;
CREATE TABLE child(h INT PRIMARY KEY, v1 INT2,
  FOREIGN KEY(v1) REFERENCES parent1(v1) ON DELETE CASCADE ON UPDATE CASCADE,
  FOREIGN KEY(v1) REFERENCES parent2(v1) ON DELETE CASCADE ON UPDATE CASCADE) SPLIT INTO 1 TABLETS;
INSERT INTO parent1 VALUES (1, 1);
INSERT INTO parent2 VALUES (101, 1);
INSERT INTO child VALUES (100001, 1); -- warm up catalog cache
DELETE FROM child WHERE h = 100001; -- undo changes due to warm up
BEGIN TRANSACTION ISOLATION LEVEL SERIALIZABLE;
EXPLAIN (DIST, ANALYZE, COSTS OFF) INSERT INTO child VALUES (100001, 1);
                   QUERY PLAN                   
------------------------------------------------
 Insert on child (actual rows=0 loops=1)
   ->  Result *RESULT* (actual rows=1 loops=1)
         Storage Table Write Requests: 1
 Trigger for constraint child_v1_fkey: calls=1
 Trigger for constraint child_v1_fkey1: calls=1
 Storage Read Requests: 1
 Storage Read Ops: 2
 Storage Rows Scanned: 2
 Storage Write Requests: 1
 Storage Flush Requests: 1
(10 rows)

COMMIT;
SELECT count(*) FROM child;
 count 
-------
     1
(1 row)

ALTER TABLE child DROP CONSTRAINT child_v1_fkey;
ALTER TABLE child DROP CONSTRAINT child_v1_fkey1;
ALTER TABLE child ADD CONSTRAINT child_v1_fkey
  FOREIGN KEY(v1) REFERENCES parent1(v1) ON DELETE CASCADE ON UPDATE CASCADE;
ALTER TABLE child ADD CONSTRAINT child_v1_fkey1
  FOREIGN KEY(v1) REFERENCES parent2(v1) ON DELETE CASCADE ON UPDATE CASCADE;
UPDATE parent1 SET v1 = 2 WHERE h = 1; -- should fail: no matching parent key
ERROR:  insert or update on table "child" violates foreign key constraint "child_v1_fkey1"
DETAIL:  Key (v1)=(2) is not present in table "parent2".
SELECT count(*) FROM child WHERE v1 = 2;
 count 
-------
     0
(1 row)

DELETE FROM parent2 WHERE h = 101;
SELECT count(*) FROM child;
 count 
-------
     0
(1 row)

DELETE FROM parent1 WHERE h = 1;
SELECT count(*) FROM child;
 count 
-------
     0
(1 row)

DELETE FROM parent2 WHERE h = 101;
SELECT count(*) FROM child;
 count 
-------
     0
(1 row)

DROP TABLE child;
DROP TABLE parent1;
DROP TABLE parent2;
-- INSERT ... ON CONFLICT: varchar -> text FK mismatch.
CREATE TABLE parent(h INT PRIMARY KEY, v1 TEXT) SPLIT INTO 1 TABLETS;
CREATE UNIQUE INDEX parent_v1_key ON parent(v1) SPLIT INTO 1 TABLETS;
CREATE TABLE child(h INT PRIMARY KEY, v1 VARCHAR(12), FOREIGN KEY(v1) REFERENCES parent(v1)
  ON DELETE CASCADE ON UPDATE CASCADE) SPLIT INTO 1 TABLETS;
INSERT INTO parent VALUES (1, 'alpha'), (2, 'beta'), (3, 'gamma');
INSERT INTO child VALUES (100001, 'alpha'), (100002, 'beta');
INSERT INTO child VALUES (100001, 'alpha') ON CONFLICT (h) DO UPDATE SET v1 = 'gamma';
SELECT * from child ORDER BY h;
   h    |  v1   
--------+-------
 100001 | gamma
 100002 | beta
(2 rows)

INSERT INTO child VALUES (100001, 'beta') ON CONFLICT (h) DO UPDATE SET v1 = 'delta';
ERROR:  insert or update on table "child" violates foreign key constraint "child_v1_fkey"
DETAIL:  Key (v1)=(delta) is not present in table "parent".
SELECT * from child ORDER BY h;
   h    |  v1   
--------+-------
 100001 | gamma
 100002 | beta
(2 rows)

DROP TABLE child;
DROP TABLE parent;
-- Self-referential FK: int4 -> int8 (ref_id references id).
CREATE TABLE parent(id INT8 PRIMARY KEY, ref_id INT4 REFERENCES parent(id)) SPLIT INTO 1 TABLETS;
INSERT INTO parent VALUES (1, NULL);
INSERT INTO parent VALUES (2, 1);
INSERT INTO parent VALUES (3, 2);
SELECT * FROM parent ORDER BY id;
 id | ref_id 
----+--------
  1 |       
  2 |      1
  3 |      2
(3 rows)

INSERT INTO parent VALUES (4, 999); -- should fail: no matching parent key
ERROR:  insert or update on table "parent" violates foreign key constraint "parent_ref_id_fkey"
DETAIL:  Key (ref_id)=(999) is not present in table "parent".
INSERT INTO parent VALUES (5, 5);
DROP TABLE parent;
-- Tests for partitioned table
CREATE TABLE parent(h INT PRIMARY KEY, v1 BIGINT) SPLIT INTO 1 TABLETS;
CREATE UNIQUE INDEX parent_v1_key ON parent(v1) SPLIT INTO 1 TABLETS;
CREATE TABLE child(h INT PRIMARY KEY, v1 SMALLINT) PARTITION BY RANGE (h);
CREATE TABLE child_p1 PARTITION OF child FOR VALUES FROM (0) TO (100) SPLIT INTO 1 TABLETS;
CREATE TABLE child_p2 PARTITION OF child FOR VALUES FROM (100) TO (200) SPLIT INTO 1 TABLETS;
ALTER TABLE child ADD CONSTRAINT child_v1_fkey FOREIGN KEY(v1) REFERENCES parent(v1)
  ON DELETE CASCADE ON UPDATE CASCADE;
INSERT INTO parent VALUES (1, 100), (2, 200), (3, 300);
INSERT INTO child VALUES (10, 100), (110, 200); -- warm up catalog cache
BEGIN TRANSACTION ISOLATION LEVEL SERIALIZABLE;
EXPLAIN (DIST, ANALYZE, COSTS OFF) INSERT INTO child VALUES (11, 100), (111, 200), (112, 100);
                        QUERY PLAN                         
-----------------------------------------------------------
 Insert on child (actual rows=0 loops=1)
   ->  Values Scan on "*VALUES*" (actual rows=3 loops=1)
         Storage Table Write Requests: 3
         Storage Flush Requests: 1
 Trigger for constraint child_v1_fkey on child_p1: calls=1
 Trigger for constraint child_v1_fkey on child_p2: calls=2
 Storage Read Requests: 1
 Storage Read Ops: 1
 Storage Rows Scanned: 2
 Storage Write Requests: 3
 Storage Flush Requests: 2
(11 rows)

COMMIT;
SELECT count(*) FROM child;
 count 
-------
     5
(1 row)

INSERT INTO child VALUES (120, 999); -- should fail: no matching parent key
ERROR:  insert or update on table "child_p2" violates foreign key constraint "child_v1_fkey"
DETAIL:  Key (v1)=(999) is not present in table "parent".
UPDATE parent SET v1 = 101 WHERE h = 1;
SELECT count(*) FROM child WHERE v1 = 101;
 count 
-------
     3
(1 row)

DELETE FROM parent WHERE h = 2;
SELECT count(*) FROM child;
 count 
-------
     3
(1 row)

DROP TABLE child;
DROP TABLE parent;
-- Partitioned child + composite FK mismatch (int->bigint, varchar->text)
CREATE TABLE parent(h INT PRIMARY KEY, v1 BIGINT, v2 TEXT, UNIQUE(v1, v2)) SPLIT INTO 1 TABLETS;
CREATE TABLE child(h INT PRIMARY KEY, v1 INT, v2 VARCHAR(12)) PARTITION BY RANGE (h);
CREATE TABLE child_p1 PARTITION OF child FOR VALUES FROM (0) TO (100) SPLIT INTO 1 TABLETS;
CREATE TABLE child_p2 PARTITION OF child FOR VALUES FROM (100) TO (200) SPLIT INTO 1 TABLETS;
ALTER TABLE child ADD CONSTRAINT child_v1_v2_fkey FOREIGN KEY(v1, v2) REFERENCES parent(v1, v2)
  ON DELETE CASCADE ON UPDATE CASCADE;
INSERT INTO parent VALUES (1, 100, 'alpha'), (2, 200, 'beta');
INSERT INTO child VALUES (10, 100, 'alpha'), (110, 200, 'beta'); -- warm up catalog cache
BEGIN TRANSACTION ISOLATION LEVEL SERIALIZABLE;
EXPLAIN (DIST, ANALYZE, COSTS OFF) INSERT INTO child VALUES (11, 100, 'alpha'), (111, 200, 'beta');
                          QUERY PLAN                          
--------------------------------------------------------------
 Insert on child (actual rows=0 loops=1)
   ->  Values Scan on "*VALUES*" (actual rows=2 loops=1)
         Storage Table Write Requests: 2
         Storage Flush Requests: 1
 Trigger for constraint child_v1_v2_fkey on child_p1: calls=1
 Trigger for constraint child_v1_v2_fkey on child_p2: calls=1
 Storage Read Requests: 1
 Storage Read Ops: 2
 Storage Rows Scanned: 2
 Storage Write Requests: 2
 Storage Flush Requests: 2
(11 rows)

COMMIT;
SELECT count(*) FROM child;
 count 
-------
     4
(1 row)

INSERT INTO child VALUES (120, 100, 'alpha2'); -- should fail: no matching parent key
ERROR:  insert or update on table "child_p2" violates foreign key constraint "child_v1_v2_fkey"
DETAIL:  Key (v1, v2)=(100, alpha2) is not present in table "parent".
UPDATE parent SET v1 = 101, v2 = 'alpha2' WHERE h = 1;
SELECT count(*) FROM child WHERE v1 = 101 AND v2 = 'alpha2';
 count 
-------
     2
(1 row)

DELETE FROM parent WHERE h = 2;
SELECT count(*) FROM child;
 count 
-------
     2
(1 row)

DROP TABLE child;
DROP TABLE parent;
-- Partitioned parent + non-partitioned child mismatch (int -> bigint)
CREATE TABLE parent(h INT PRIMARY KEY, v1 BIGINT, UNIQUE(v1, h)) PARTITION BY RANGE (h);
CREATE TABLE parent_p1 PARTITION OF parent FOR VALUES FROM (0) TO (100) SPLIT INTO 1 TABLETS;
CREATE TABLE parent_p2 PARTITION OF parent FOR VALUES FROM (100) TO (200) SPLIT INTO 1 TABLETS;
CREATE TABLE child(h INT PRIMARY KEY, v1 INT, v2 TEXT, FOREIGN KEY(v1, h) REFERENCES parent(v1, h)
  ON DELETE CASCADE ON UPDATE CASCADE) SPLIT INTO 1 TABLETS;
INSERT INTO parent VALUES (10, 100), (11, 200), (110, 200), (120, 300), (130, 400);
INSERT INTO child VALUES (10, 100, 'alpha'), (110, 200, 'beta'); -- warm up catalog cache
BEGIN TRANSACTION ISOLATION LEVEL SERIALIZABLE;
EXPLAIN (DIST, ANALYZE, COSTS OFF) INSERT INTO child VALUES (11, 200, 'gamma'),
 (120, 300, 'delta'), (130, 400, 'epsilon');
                        QUERY PLAN                        
----------------------------------------------------------
 Insert on child (actual rows=0 loops=1)
   ->  Values Scan on "*VALUES*" (actual rows=3 loops=1)
         Storage Table Write Requests: 3
         Storage Flush Requests: 2
 Trigger for constraint child_v1_h_fkey on child: calls=3
 Storage Read Requests: 1
 Storage Read Ops: 2
 Storage Rows Scanned: 3
 Storage Write Requests: 3
 Storage Flush Requests: 3
(10 rows)

COMMIT;
SELECT count(*) FROM child;
 count 
-------
     5
(1 row)

INSERT INTO child VALUES (190, 100, 'alpha2'); -- should fail: no matching parent key
ERROR:  insert or update on table "child" violates foreign key constraint "child_v1_h_fkey"
DETAIL:  Key (v1, h)=(100, 190) is not present in table "parent".
UPDATE parent SET v1 = 101 WHERE h = 10;
SELECT count(*) FROM child WHERE v1 = 101 AND h = 10;
 count 
-------
     1
(1 row)

DELETE FROM parent WHERE h = 110;
SELECT count(*) FROM child;
 count 
-------
     4
(1 row)

DROP TABLE child;
DROP TABLE parent;
-- Partitioned parent + partitioned child mismatch (int -> bigint)
CREATE TABLE parent(h INT PRIMARY KEY, v1 INT, UNIQUE(v1, h)) PARTITION BY RANGE (h);
CREATE TABLE parent_p1 PARTITION OF parent FOR VALUES FROM (0) TO (10000) SPLIT INTO 1 TABLETS;
CREATE TABLE parent_p2 PARTITION OF parent FOR VALUES FROM (10000) TO (20000) SPLIT INTO 1 TABLETS;
CREATE TABLE child(h INT PRIMARY KEY, v1 SMALLINT, FOREIGN KEY(v1, h) REFERENCES parent(v1, h)
  ON DELETE CASCADE ON UPDATE CASCADE) PARTITION BY RANGE (h);
CREATE TABLE child_p1 PARTITION OF child FOR VALUES FROM (0) TO (100) SPLIT INTO 1 TABLETS;
CREATE TABLE child_p2 PARTITION OF child FOR VALUES FROM (100) TO (12000) SPLIT INTO 1 TABLETS;
CREATE TABLE child_p3 PARTITION OF child FOR VALUES FROM (12000) TO (20000) SPLIT INTO 1 TABLETS;
INSERT INTO parent VALUES (1, 10000), (2, 10000), (11001, 20000), (12002, 30000);
INSERT INTO child VALUES (1, 10000); -- warm up catalog cache
BEGIN TRANSACTION ISOLATION LEVEL SERIALIZABLE;
EXPLAIN (DIST, ANALYZE, COSTS OFF) INSERT INTO child
  VALUES (2, 10000), (11001, 20000), (12002, 30000);
                         QUERY PLAN                          
-------------------------------------------------------------
 Insert on child (actual rows=0 loops=1)
   ->  Values Scan on "*VALUES*" (actual rows=3 loops=1)
         Storage Table Write Requests: 3
         Storage Flush Requests: 3
 Trigger for constraint child_v1_h_fkey on child_p1: calls=1
 Trigger for constraint child_v1_h_fkey on child_p2: calls=1
 Trigger for constraint child_v1_h_fkey on child_p3: calls=1
 Storage Read Requests: 1
 Storage Read Ops: 2
 Storage Rows Scanned: 3
 Storage Write Requests: 3
 Storage Flush Requests: 3
(12 rows)

COMMIT;
SELECT count(*) FROM child;
 count 
-------
     4
(1 row)

INSERT INTO child VALUES (10, 10000); -- should fail: no matching parent key
ERROR:  insert or update on table "child_p1" violates foreign key constraint "child_v1_h_fkey"
DETAIL:  Key (v1, h)=(10000, 10) is not present in table "parent".
UPDATE parent SET v1 = 10001 WHERE h = 1;
SELECT count(*) FROM child WHERE v1 = 10001 AND h = 1;
 count 
-------
     1
(1 row)

DELETE FROM parent WHERE h = 11001;
SELECT count(*) FROM child;
 count 
-------
     3
(1 row)

DROP TABLE child;
DROP TABLE parent;
-- Partitioned parent + attached partitions with dropped-column holes in key mapping.
-- v2 is added later to exercise add-column schema churn before attach.
CREATE TABLE parent(h INT, v1 BIGINT, UNIQUE(v1, h))
  PARTITION BY RANGE (h);
CREATE TABLE parent_p1(h INT, dropped_col1 TEXT, v1 BIGINT, dropped_col2 INT,
  dropped_col3 BOOL)
  SPLIT INTO 1 TABLETS;
CREATE TABLE parent_p2(h INT, v1 BIGINT, dropped_col4 TEXT, dropped_col5 INT)
  SPLIT INTO 1 TABLETS;
ALTER TABLE parent_p1 ADD COLUMN added_col1 TEXT;
ALTER TABLE parent_p1 ADD COLUMN added_col2 INT;
ALTER TABLE parent_p2 ADD COLUMN added_col3 BOOL;
ALTER TABLE parent_p2 ADD COLUMN added_col4 TEXT;
ALTER TABLE parent_p1 DROP COLUMN dropped_col1;
ALTER TABLE parent_p1 DROP COLUMN dropped_col2;
ALTER TABLE parent_p1 DROP COLUMN dropped_col3;
ALTER TABLE parent_p2 DROP COLUMN dropped_col4;
ALTER TABLE parent_p2 DROP COLUMN dropped_col5;
ALTER TABLE parent_p1 DROP COLUMN added_col1;
ALTER TABLE parent_p1 DROP COLUMN added_col2;
ALTER TABLE parent_p2 DROP COLUMN added_col3;
ALTER TABLE parent_p2 DROP COLUMN added_col4;
ALTER TABLE parent ADD COLUMN v2 INT;
ALTER TABLE parent_p1 ADD COLUMN v2 INT;
ALTER TABLE parent_p2 ADD COLUMN v2 INT;
ALTER TABLE parent_p1 ADD CONSTRAINT parent_p1_v1_v2_h_key UNIQUE(v1, v2, h);
ALTER TABLE parent_p2 ADD CONSTRAINT parent_p2_v1_v2_h_key UNIQUE(v1, v2, h);
ALTER TABLE parent ATTACH PARTITION parent_p1 FOR VALUES FROM (0) TO (100);
ALTER TABLE parent ATTACH PARTITION parent_p2 FOR VALUES FROM (100) TO (200);
ALTER TABLE parent ADD CONSTRAINT parent_v1_v2_h_key UNIQUE(v1, v2, h);
CREATE TABLE child(id INT PRIMARY KEY, h INT, v1 INT, v2 INT,
  FOREIGN KEY(v1, v2, h) REFERENCES parent(v1, v2, h)
  ON DELETE CASCADE ON UPDATE CASCADE) SPLIT INTO 1 TABLETS;
INSERT INTO parent(h, v1, v2) VALUES (10, 100, 1), (20, 200, 2), (120, 300, 3), (130, 400, 4);
INSERT INTO child VALUES (1, 120, 300, 3); -- warm up catalog cache
DELETE FROM child WHERE id = 1; -- undo changes due to warm up
BEGIN TRANSACTION ISOLATION LEVEL SERIALIZABLE;
EXPLAIN (DIST, ANALYZE, COSTS OFF) INSERT INTO child
  VALUES (100001, 10, 100, 1), (100002, 20, 200, 2), (100003, 120, 300, 3),
  (100004, 10, 100, 1), (100005, 130, 400, 4);
                         QUERY PLAN                          
-------------------------------------------------------------
 Insert on child (actual rows=0 loops=1)
   ->  Values Scan on "*VALUES*" (actual rows=5 loops=1)
         Storage Table Write Requests: 5
         Storage Flush Requests: 2
 Trigger for constraint child_v1_v2_h_fkey on child: calls=5
 Storage Read Requests: 1
 Storage Read Ops: 3
 Storage Rows Scanned: 4
 Storage Write Requests: 5
 Storage Flush Requests: 3
(10 rows)

COMMIT;
SELECT count(*) FROM child;
 count 
-------
     5
(1 row)

INSERT INTO child VALUES (100010, 120, 300, 9); -- should fail: no matching parent key
ERROR:  insert or update on table "child" violates foreign key constraint "child_v1_v2_h_fkey"
DETAIL:  Key (v1, v2, h)=(300, 9, 120) is not present in table "parent".
UPDATE parent SET v1 = 101 WHERE h = 10;
SELECT count(*) FROM child WHERE id IN (100001, 100004) AND v1 = 101;
 count 
-------
     2
(1 row)

DELETE FROM parent WHERE h = 120;
SELECT count(*) FROM child WHERE h = 120;
 count 
-------
     0
(1 row)

SELECT count(*) FROM child;
 count 
-------
     4
(1 row)

DROP TABLE child;
DROP TABLE parent;
-- ATTACH PARTITION on partitioned child (varchar -> text FK): valid vs invalid rows.
CREATE TABLE parent(h INT PRIMARY KEY, k TEXT UNIQUE) SPLIT INTO 1 TABLETS;
INSERT INTO parent VALUES (1, 'alpha'), (2, 'beta');
CREATE TABLE child(id INT PRIMARY KEY, rk VARCHAR(12) REFERENCES parent(k))
  PARTITION BY RANGE (id);
CREATE TABLE child_p1 PARTITION OF child FOR VALUES FROM (0) TO (100) SPLIT INTO 1 TABLETS;
INSERT INTO child VALUES (1, 'alpha');
-- Attach partition whose rows reference existing parent keys (validation should pass).
CREATE TABLE child_p_good(id INT PRIMARY KEY, rk VARCHAR(12)) SPLIT INTO 1 TABLETS;
INSERT INTO child_p_good VALUES (101, 'beta'), (111, 'alpha');
ALTER TABLE child ATTACH PARTITION child_p_good FOR VALUES FROM (100) TO (200);
INSERT INTO child VALUES (102, 'beta');
SELECT * FROM child ORDER BY id;
 id  |  rk   
-----+-------
   1 | alpha
 101 | beta
 102 | beta
 111 | alpha
(4 rows)

INSERT INTO child VALUES (122, 'missing'); -- should fail: no matching parent key
ERROR:  insert or update on table "child_p_good" violates foreign key constraint "child_rk_fkey"
DETAIL:  Key (rk)=(missing) is not present in table "parent".
-- Attach partition whose rows violate the FK (validation should fail).
CREATE TABLE child_p_bad(id INT PRIMARY KEY, rk VARCHAR(12)) SPLIT INTO 1 TABLETS;
INSERT INTO child_p_bad VALUES (201, 'missing');
ALTER TABLE child ATTACH PARTITION child_p_bad FOR VALUES FROM (200) TO (300); -- should fail: FK validation fails
ERROR:  insert or update on table "child_p_bad" violates foreign key constraint "child_rk_fkey"
DETAIL:  Key (rk)=(missing) is not present in table "parent".
DROP TABLE child_p_bad;
DROP TABLE child_p_good;
DROP TABLE child_p1;
DROP TABLE child;
DROP TABLE parent;
-- Partitioned child: int4 -> int2 FK mismatch.
CREATE TABLE parent(h INT PRIMARY KEY, v1 SMALLINT) SPLIT INTO 1 TABLETS;
CREATE UNIQUE INDEX parent_v1_key ON parent(v1) SPLIT INTO 1 TABLETS;
CREATE TABLE child(h INT PRIMARY KEY, v1 INT) PARTITION BY RANGE (h);
CREATE TABLE child_p1 PARTITION OF child FOR VALUES FROM (0) TO (100) SPLIT INTO 1 TABLETS;
CREATE TABLE child_p2 PARTITION OF child FOR VALUES FROM (100) TO (200) SPLIT INTO 1 TABLETS;
ALTER TABLE child ADD CONSTRAINT child_v1_fkey FOREIGN KEY(v1) REFERENCES parent(v1)
  ON DELETE CASCADE ON UPDATE CASCADE;
INSERT INTO parent VALUES (1, 100), (2, 200), (3, 300);
INSERT INTO child VALUES (10, 100), (110, 200); -- warm up catalog cache
BEGIN TRANSACTION ISOLATION LEVEL SERIALIZABLE;
EXPLAIN (DIST, ANALYZE, COSTS OFF) INSERT INTO child VALUES (11, 100), (111, 200), (112, 100);
                        QUERY PLAN                         
-----------------------------------------------------------
 Insert on child (actual rows=0 loops=1)
   ->  Values Scan on "*VALUES*" (actual rows=3 loops=1)
         Storage Table Write Requests: 3
         Storage Flush Requests: 1
 Trigger for constraint child_v1_fkey on child_p1: calls=1
 Trigger for constraint child_v1_fkey on child_p2: calls=2
 Storage Read Requests: 1
 Storage Read Ops: 1
 Storage Rows Scanned: 2
 Storage Write Requests: 3
 Storage Flush Requests: 2
(11 rows)

COMMIT;
SELECT count(*) FROM child;
 count 
-------
     5
(1 row)

INSERT INTO child VALUES (120, 999); -- should fail: no matching parent key
ERROR:  insert or update on table "child_p2" violates foreign key constraint "child_v1_fkey"
DETAIL:  Key (v1)=(999) is not present in table "parent".
UPDATE parent SET v1 = 101 WHERE h = 1;
SELECT count(*) FROM child WHERE v1 = 101;
 count 
-------
     3
(1 row)

DELETE FROM parent WHERE h = 2;
SELECT count(*) FROM child;
 count 
-------
     3
(1 row)

DROP TABLE child;
DROP TABLE parent;
-- Partitioned child: int8 -> int2 FK mismatch.
CREATE TABLE parent(h INT PRIMARY KEY, v1 SMALLINT) SPLIT INTO 1 TABLETS;
CREATE UNIQUE INDEX parent_v1_key ON parent(v1) SPLIT INTO 1 TABLETS;
CREATE TABLE child(h INT PRIMARY KEY, v1 BIGINT) PARTITION BY RANGE (h);
CREATE TABLE child_p1 PARTITION OF child FOR VALUES FROM (0) TO (100) SPLIT INTO 1 TABLETS;
CREATE TABLE child_p2 PARTITION OF child FOR VALUES FROM (100) TO (200) SPLIT INTO 1 TABLETS;
ALTER TABLE child ADD CONSTRAINT child_v1_fkey FOREIGN KEY(v1) REFERENCES parent(v1)
  ON DELETE CASCADE ON UPDATE CASCADE;
INSERT INTO parent VALUES (1, 100), (2, 200), (3, 300);
INSERT INTO child VALUES (10, 100), (110, 200); -- warm up catalog cache
BEGIN TRANSACTION ISOLATION LEVEL SERIALIZABLE;
EXPLAIN (DIST, ANALYZE, COSTS OFF) INSERT INTO child VALUES (11, 100), (111, 200), (112, 100);
                        QUERY PLAN                         
-----------------------------------------------------------
 Insert on child (actual rows=0 loops=1)
   ->  Values Scan on "*VALUES*" (actual rows=3 loops=1)
         Storage Table Write Requests: 3
         Storage Flush Requests: 1
 Trigger for constraint child_v1_fkey on child_p1: calls=1
 Trigger for constraint child_v1_fkey on child_p2: calls=2
 Storage Read Requests: 1
 Storage Read Ops: 1
 Storage Rows Scanned: 2
 Storage Write Requests: 3
 Storage Flush Requests: 2
(11 rows)

COMMIT;
SELECT count(*) FROM child;
 count 
-------
     5
(1 row)

INSERT INTO child VALUES (120, 999); -- should fail: no matching parent key
ERROR:  insert or update on table "child_p2" violates foreign key constraint "child_v1_fkey"
DETAIL:  Key (v1)=(999) is not present in table "parent".
UPDATE parent SET v1 = 101 WHERE h = 1;
SELECT count(*) FROM child WHERE v1 = 101;
 count 
-------
     3
(1 row)

DELETE FROM parent WHERE h = 2;
SELECT count(*) FROM child;
 count 
-------
     3
(1 row)

DROP TABLE child;
DROP TABLE parent;
-- Partitioned child: int8 -> int4 FK mismatch.
CREATE TABLE parent(h INT PRIMARY KEY, v1 INT) SPLIT INTO 1 TABLETS;
CREATE UNIQUE INDEX parent_v1_key ON parent(v1) SPLIT INTO 1 TABLETS;
CREATE TABLE child(h INT PRIMARY KEY, v1 BIGINT) PARTITION BY RANGE (h);
CREATE TABLE child_p1 PARTITION OF child FOR VALUES FROM (0) TO (100) SPLIT INTO 1 TABLETS;
CREATE TABLE child_p2 PARTITION OF child FOR VALUES FROM (100) TO (200) SPLIT INTO 1 TABLETS;
ALTER TABLE child ADD CONSTRAINT child_v1_fkey FOREIGN KEY(v1) REFERENCES parent(v1)
  ON DELETE CASCADE ON UPDATE CASCADE;
INSERT INTO parent VALUES (1, 100), (2, 200), (3, 300);
INSERT INTO child VALUES (10, 100), (110, 200); -- warm up catalog cache
BEGIN TRANSACTION ISOLATION LEVEL SERIALIZABLE;
EXPLAIN (DIST, ANALYZE, COSTS OFF) INSERT INTO child VALUES (11, 100), (111, 200), (112, 100);
                        QUERY PLAN                         
-----------------------------------------------------------
 Insert on child (actual rows=0 loops=1)
   ->  Values Scan on "*VALUES*" (actual rows=3 loops=1)
         Storage Table Write Requests: 3
         Storage Flush Requests: 1
 Trigger for constraint child_v1_fkey on child_p1: calls=1
 Trigger for constraint child_v1_fkey on child_p2: calls=2
 Storage Read Requests: 1
 Storage Read Ops: 1
 Storage Rows Scanned: 2
 Storage Write Requests: 3
 Storage Flush Requests: 2
(11 rows)

COMMIT;
SELECT count(*) FROM child;
 count 
-------
     5
(1 row)

INSERT INTO child VALUES (120, 999); -- should fail: no matching parent key
ERROR:  insert or update on table "child_p2" violates foreign key constraint "child_v1_fkey"
DETAIL:  Key (v1)=(999) is not present in table "parent".
UPDATE parent SET v1 = 101 WHERE h = 1;
SELECT count(*) FROM child WHERE v1 = 101;
 count 
-------
     3
(1 row)

DELETE FROM parent WHERE h = 2;
SELECT count(*) FROM child;
 count 
-------
     3
(1 row)

DROP TABLE child;
DROP TABLE parent;
-- ATTACH PARTITION: int4 -> int2 assignment cast.
CREATE TABLE parent(h INT PRIMARY KEY, k SMALLINT UNIQUE) SPLIT INTO 1 TABLETS;
INSERT INTO parent VALUES (1, 100), (2, 200);
CREATE TABLE child(id INT PRIMARY KEY, rk INT REFERENCES parent(k))
  PARTITION BY RANGE (id);
CREATE TABLE child_p1 PARTITION OF child FOR VALUES FROM (0) TO (100) SPLIT INTO 1 TABLETS;
INSERT INTO child VALUES (1, 100);
CREATE TABLE child_p_good(id INT PRIMARY KEY, rk INT) SPLIT INTO 1 TABLETS;
INSERT INTO child_p_good VALUES (101, 200), (111, 100);
ALTER TABLE child ATTACH PARTITION child_p_good FOR VALUES FROM (100) TO (200);
INSERT INTO child VALUES (102, 200);
SELECT * FROM child ORDER BY id;
 id  | rk  
-----+-----
   1 | 100
 101 | 200
 102 | 200
 111 | 100
(4 rows)

INSERT INTO child VALUES (122, 999); -- should fail: no matching parent key
ERROR:  insert or update on table "child_p_good" violates foreign key constraint "child_rk_fkey"
DETAIL:  Key (rk)=(999) is not present in table "parent".
CREATE TABLE child_p_bad(id INT PRIMARY KEY, rk INT) SPLIT INTO 1 TABLETS;
INSERT INTO child_p_bad VALUES (201, 999);
ALTER TABLE child ATTACH PARTITION child_p_bad FOR VALUES FROM (200) TO (300); -- should fail: FK validation fails
ERROR:  insert or update on table "child_p_bad" violates foreign key constraint "child_rk_fkey"
DETAIL:  Key (rk)=(999) is not present in table "parent".
DROP TABLE child_p_bad;
DROP TABLE child_p_good;
DROP TABLE child_p1;
DROP TABLE child;
DROP TABLE parent;
-- ATTACH PARTITION: int8 -> int2 assignment cast.
CREATE TABLE parent(h INT PRIMARY KEY, k SMALLINT UNIQUE) SPLIT INTO 1 TABLETS;
INSERT INTO parent VALUES (1, 100), (2, 200);
CREATE TABLE child(id INT PRIMARY KEY, rk BIGINT REFERENCES parent(k))
  PARTITION BY RANGE (id);
CREATE TABLE child_p1 PARTITION OF child FOR VALUES FROM (0) TO (100) SPLIT INTO 1 TABLETS;
INSERT INTO child VALUES (1, 100);
CREATE TABLE child_p_good(id INT PRIMARY KEY, rk BIGINT) SPLIT INTO 1 TABLETS;
INSERT INTO child_p_good VALUES (101, 200), (111, 100);
ALTER TABLE child ATTACH PARTITION child_p_good FOR VALUES FROM (100) TO (200);
INSERT INTO child VALUES (102, 200);
SELECT * FROM child ORDER BY id;
 id  | rk  
-----+-----
   1 | 100
 101 | 200
 102 | 200
 111 | 100
(4 rows)

INSERT INTO child VALUES (122, 999); -- should fail: no matching parent key
ERROR:  insert or update on table "child_p_good" violates foreign key constraint "child_rk_fkey"
DETAIL:  Key (rk)=(999) is not present in table "parent".
CREATE TABLE child_p_bad(id INT PRIMARY KEY, rk BIGINT) SPLIT INTO 1 TABLETS;
INSERT INTO child_p_bad VALUES (201, 999);
ALTER TABLE child ATTACH PARTITION child_p_bad FOR VALUES FROM (200) TO (300); -- should fail: FK validation fails
ERROR:  insert or update on table "child_p_bad" violates foreign key constraint "child_rk_fkey"
DETAIL:  Key (rk)=(999) is not present in table "parent".
DROP TABLE child_p_bad;
DROP TABLE child_p_good;
DROP TABLE child_p1;
DROP TABLE child;
DROP TABLE parent;
-- ATTACH PARTITION: int8 -> int4 assignment cast.
CREATE TABLE parent(h INT PRIMARY KEY, k INT UNIQUE) SPLIT INTO 1 TABLETS;
INSERT INTO parent VALUES (1, 100), (2, 200);
CREATE TABLE child(id INT PRIMARY KEY, rk BIGINT REFERENCES parent(k))
  PARTITION BY RANGE (id);
CREATE TABLE child_p1 PARTITION OF child FOR VALUES FROM (0) TO (100) SPLIT INTO 1 TABLETS;
INSERT INTO child VALUES (1, 100);
CREATE TABLE child_p_good(id INT PRIMARY KEY, rk BIGINT) SPLIT INTO 1 TABLETS;
INSERT INTO child_p_good VALUES (101, 200), (111, 100);
ALTER TABLE child ATTACH PARTITION child_p_good FOR VALUES FROM (100) TO (200);
INSERT INTO child VALUES (102, 200);
SELECT * FROM child ORDER BY id;
 id  | rk  
-----+-----
   1 | 100
 101 | 200
 102 | 200
 111 | 100
(4 rows)

INSERT INTO child VALUES (122, 999); -- should fail: no matching parent key
ERROR:  insert or update on table "child_p_good" violates foreign key constraint "child_rk_fkey"
DETAIL:  Key (rk)=(999) is not present in table "parent".
CREATE TABLE child_p_bad(id INT PRIMARY KEY, rk BIGINT) SPLIT INTO 1 TABLETS;
INSERT INTO child_p_bad VALUES (201, 999);
ALTER TABLE child ATTACH PARTITION child_p_bad FOR VALUES FROM (200) TO (300); -- should fail: FK validation fails
ERROR:  insert or update on table "child_p_bad" violates foreign key constraint "child_rk_fkey"
DETAIL:  Key (rk)=(999) is not present in table "parent".
DROP TABLE child_p_bad;
DROP TABLE child_p_good;
DROP TABLE child_p1;
DROP TABLE child;
DROP TABLE parent;
-- ALTER COLUMN on FK column: int4 -> int8 after narrowing child column to int4.
CREATE TABLE parent(k BIGINT PRIMARY KEY);
CREATE TABLE child(id INT PRIMARY KEY, v1 BIGINT NOT NULL REFERENCES parent(k));
INSERT INTO parent VALUES (1), (2), (3);
INSERT INTO child VALUES (10, 1), (20, 2);
ALTER TABLE child ALTER COLUMN v1 TYPE INT USING v1::int;
NOTICE:  table rewrite may lead to inconsistencies
DETAIL:  Concurrent DMLs may not be reflected in the new table.
HINT:  See https://github.com/yugabyte/yugabyte-db/issues/19860. Set 'ysql_suppress_unsafe_alter_notice' yb-tserver gflag to true to suppress this notice.
INSERT INTO child VALUES (30, 3000000000);
ERROR:  integer out of range
INSERT INTO child VALUES (40, 3);
SELECT * FROM child ORDER BY id;
 id | v1 
----+----
 10 |  1
 20 |  2
 40 |  3
(3 rows)

INSERT INTO child VALUES (50, 99); -- should fail: no matching parent key
ERROR:  insert or update on table "child" violates foreign key constraint "child_v1_fkey"
DETAIL:  Key (v1)=(99) is not present in table "parent".
DROP TABLE child;
DROP TABLE parent;
-- test ensures that the constraint cache is updated correctly when the
-- pg_constraint table is updated after the foreign key constraint is created.
CREATE TABLE parent(k int4 PRIMARY KEY);
CREATE TABLE child(id int4 GENERATED BY DEFAULT AS IDENTITY PRIMARY KEY, v1 int2 NOT NULL,
  CONSTRAINT child_v1_fkey FOREIGN KEY (v1) REFERENCES parent(k) DEFERRABLE INITIALLY DEFERRED);
INSERT INTO parent VALUES (1);
INSERT INTO child (v1) VALUES (1);
SELECT count(*) FROM child;
 count 
-------
     1
(1 row)

BEGIN;
  INSERT INTO child (v1) VALUES (2);
  INSERT INTO parent VALUES (2);
COMMIT;  -- should succeed
ALTER TABLE child ALTER CONSTRAINT child_v1_fkey DEFERRABLE INITIALLY IMMEDIATE;
BEGIN;
  INSERT INTO child (v1) VALUES (3);
ERROR:  insert or update on table "child" violates foreign key constraint "child_v1_fkey"
DETAIL:  Key (v1)=(3) is not present in table "parent".
  INSERT INTO parent VALUES (3);
ERROR:  current transaction is aborted, commands ignored until end of transaction block
COMMIT;  -- should FAIL
SELECT count(*) FROM child;
 count 
-------
     2
(1 row)

DROP TABLE child;
DROP TABLE parent;
-- Test when pg_cast changes, cache must be invalidated.
CREATE TABLE parent(h INT PRIMARY KEY, v1 INT) SPLIT INTO 1 TABLETS;
CREATE UNIQUE INDEX parent_v1_key ON parent(v1) SPLIT INTO 1 TABLETS;
CREATE TABLE child(h INT PRIMARY KEY, v1 SMALLINT, FOREIGN KEY(v1) REFERENCES parent(v1)
  ON DELETE CASCADE ON UPDATE CASCADE) SPLIT INTO 1 TABLETS;
INSERT INTO parent VALUES (1, 100);
INSERT INTO child VALUES (100001, 100); -- warm up catalog cache
DELETE FROM child WHERE h = 100001; -- undo changes due to warm up
BEGIN TRANSACTION ISOLATION LEVEL SERIALIZABLE;
EXPLAIN (DIST, ANALYZE, COSTS OFF) INSERT INTO child VALUES (100002, 100);
                  QUERY PLAN                   
-----------------------------------------------
 Insert on child (actual rows=0 loops=1)
   ->  Result *RESULT* (actual rows=1 loops=1)
         Storage Table Write Requests: 1
 Trigger for constraint child_v1_fkey: calls=1
 Storage Read Requests: 1
 Storage Read Ops: 1
 Storage Rows Scanned: 1
 Storage Write Requests: 1
 Storage Flush Requests: 1
(9 rows)

COMMIT;
SELECT count(*) FROM child;
 count 
-------
     1
(1 row)

SET yb_non_ddl_txn_for_sys_tables_allowed = on;
SELECT castfunc AS initial_castfunc FROM pg_cast
  WHERE castsource = 'int2'::regtype AND casttarget = 'int4'::regtype
  \gset
UPDATE pg_cast SET castfunc = 128912 -- some random function id
  WHERE castsource = 'int2'::regtype AND casttarget = 'int4'::regtype;
UPDATE pg_cast SET castfunc = :'initial_castfunc' -- back to original function id
  WHERE castsource = 'int2'::regtype AND casttarget = 'int4'::regtype;
BEGIN TRANSACTION ISOLATION LEVEL SERIALIZABLE; -- should perform a catalog cache flush
EXPLAIN (DIST, ANALYZE, COSTS OFF) INSERT INTO child VALUES (100003, 100);
                  QUERY PLAN                   
-----------------------------------------------
 Insert on child (actual rows=0 loops=1)
   ->  Result *RESULT* (actual rows=1 loops=1)
         Storage Table Write Requests: 1
         Storage Flush Requests: 1
 Trigger for constraint child_v1_fkey: calls=1
 Storage Read Requests: 1
 Storage Read Ops: 1
 Storage Rows Scanned: 1
 Storage Write Requests: 1
 Storage Flush Requests: 1
(10 rows)

COMMIT;
SELECT count(*) FROM child;
 count 
-------
     2
(1 row)

SET yb_non_ddl_txn_for_sys_tables_allowed = off;
DROP TABLE child;
DROP TABLE parent;
-- Test when pg_proc changes, cache must be invalidated.
CREATE TABLE parent(h INT PRIMARY KEY, v1 INT) SPLIT INTO 1 TABLETS;
CREATE UNIQUE INDEX parent_v1_key ON parent(v1) SPLIT INTO 1 TABLETS;
CREATE TABLE child(h INT PRIMARY KEY, v1 SMALLINT, FOREIGN KEY(v1) REFERENCES parent(v1)
  ON DELETE CASCADE ON UPDATE CASCADE) SPLIT INTO 1 TABLETS;
INSERT INTO parent VALUES (1, 100);
INSERT INTO child VALUES (100001, 100); -- warm up catalog cache
DELETE FROM child WHERE h = 100001; -- undo changes due to warm up
BEGIN TRANSACTION ISOLATION LEVEL SERIALIZABLE;
EXPLAIN (DIST, ANALYZE, COSTS OFF) INSERT INTO child VALUES (100002, 100);
                  QUERY PLAN                   
-----------------------------------------------
 Insert on child (actual rows=0 loops=1)
   ->  Result *RESULT* (actual rows=1 loops=1)
         Storage Table Write Requests: 1
 Trigger for constraint child_v1_fkey: calls=1
 Storage Read Requests: 1
 Storage Read Ops: 1
 Storage Rows Scanned: 1
 Storage Write Requests: 1
 Storage Flush Requests: 1
(9 rows)

COMMIT;
SELECT count(*) FROM child;
 count 
-------
     1
(1 row)

SET yb_non_ddl_txn_for_sys_tables_allowed = on;
SELECT castfunc AS int4_castfunc FROM pg_cast
  WHERE castsource = 'int2'::regtype AND casttarget = 'int4'::regtype
  \gset
SELECT proname AS initial_proname FROM pg_proc WHERE oid = (:int4_castfunc)
  \gset
UPDATE pg_proc SET proname = 'random-func' WHERE oid = (:int4_castfunc);
UPDATE pg_proc SET proname = (:'initial_proname') WHERE oid = (:int4_castfunc);
-- The following query should perform a catalog cache flush but because the function
-- oid 313 (function int4 for int2 to int4 cast) is a builtin function, it will not
-- perform a catalog lookup and hence, not perform a catalog cache flush.
BEGIN TRANSACTION ISOLATION LEVEL SERIALIZABLE;
EXPLAIN (DIST, ANALYZE, COSTS OFF) INSERT INTO child VALUES (100003, 100);
                  QUERY PLAN                   
-----------------------------------------------
 Insert on child (actual rows=0 loops=1)
   ->  Result *RESULT* (actual rows=1 loops=1)
         Storage Table Write Requests: 1
 Trigger for constraint child_v1_fkey: calls=1
 Storage Read Requests: 1
 Storage Read Ops: 1
 Storage Rows Scanned: 1
 Storage Write Requests: 1
 Storage Flush Requests: 1
(9 rows)

COMMIT;
SELECT count(*) FROM child;
 count 
-------
     2
(1 row)

SET yb_non_ddl_txn_for_sys_tables_allowed = off;
DROP TABLE child;
DROP TABLE parent;
-- yb_enable_fkey_batched_docdb_lookup_when_types_mismatch = false
SET yb_enable_fkey_batched_docdb_lookup_when_types_mismatch = false; -- should fail
ERROR:  parameter "yb_enable_fkey_batched_docdb_lookup_when_types_mismatch" cannot be set after connection start
-- Connect to a new session and verify the GUC is set to false.
\c "options='-c yb_enable_fkey_batched_docdb_lookup_when_types_mismatch=false'"
SHOW yb_enable_fkey_batched_docdb_lookup_when_types_mismatch; -- should be false
 yb_enable_fkey_batched_docdb_lookup_when_types_mismatch 
---------------------------------------------------------
 off
(1 row)

-- int2 to int4
CREATE TABLE parent(h INT PRIMARY KEY, v1 INT) SPLIT INTO 1 TABLETS;
CREATE UNIQUE INDEX parent_v1_key ON parent(v1) SPLIT INTO 1 TABLETS;
CREATE TABLE child(h INT PRIMARY KEY, v1 SMALLINT, FOREIGN KEY(v1) REFERENCES parent(v1)
  ON DELETE CASCADE ON UPDATE CASCADE) SPLIT INTO 1 TABLETS;
INSERT INTO parent VALUES (1, 456);
INSERT INTO child VALUES (1, 456); -- warm up catalog cache
DELETE FROM child WHERE h = 1; -- undo changes due to warm up
BEGIN TRANSACTION ISOLATION LEVEL SERIALIZABLE;
EXPLAIN (DIST, ANALYZE, COSTS OFF) INSERT INTO child VALUES (100001, 456);
                  QUERY PLAN                   
-----------------------------------------------
 Insert on child (actual rows=0 loops=1)
   ->  Result *RESULT* (actual rows=1 loops=1)
         Storage Table Write Requests: 1
 Trigger for constraint child_v1_fkey: calls=1
 Storage Read Requests: 2
 Storage Read Ops: 2
 Storage Rows Scanned: 2
 Storage Write Requests: 1
 Storage Flush Requests: 1
(9 rows)

COMMIT;
SELECT count(*) FROM child;
 count 
-------
     1
(1 row)

ALTER TABLE child DROP CONSTRAINT child_v1_fkey;
ALTER TABLE child ADD CONSTRAINT child_v1_fkey FOREIGN KEY(v1) REFERENCES parent(v1)
  ON DELETE CASCADE ON UPDATE CASCADE;
UPDATE parent SET v1 = 457 WHERE h = 1;
SELECT count(*) FROM child WHERE h = 100001 AND v1 = 457;
 count 
-------
     1
(1 row)

DELETE FROM parent WHERE h = 1;
SELECT count(*) FROM child;
 count 
-------
     0
(1 row)

INSERT INTO parent VALUES (1, 456);
INSERT INTO child VALUES (100002, 999); -- should fail: no matching parent key
ERROR:  insert or update on table "child" violates foreign key constraint "child_v1_fkey"
DETAIL:  Key (v1)=(999) is not present in table "parent".
SELECT count(*) FROM child;
 count 
-------
     0
(1 row)

TRUNCATE child, parent;
-- cleanup
DROP TABLE child;
DROP TABLE parent;
-- yb_enable_fkey_batched_docdb_lookup_when_types_mismatch = true
SET yb_enable_fkey_batched_docdb_lookup_when_types_mismatch = true; -- should fail
ERROR:  parameter "yb_enable_fkey_batched_docdb_lookup_when_types_mismatch" cannot be set after connection start
