-- Test planner's roundtrip estimates
-- DEPENDENCY: yb.orig.roundtrip_estimate_setup
\c roundtrip_test
delete from queries;
-- generate colocation x scan kind x index cond range combinations
insert into queries (qid, query)
with relations(rel, qidrel) as (
    values ('ce.r',  10000),
           ('ce.rC', 20000)
),
ranges(qidbase, predicate) as (
    values (100, '##COL## = 1'),
           (200, '##COL## between 1 and 100'),
           (300, '##COL## between 1 and 5000'),
           (400, '##COL## between 1 and 12345')
),
scans(qidoff, target, predicol) as (
    values (1, '*',  'pk'),  -- Index Scan using PK index
           (2, 'v',  'b'),   -- Index Scan using non-PK index
           (3, 'b',  'b')    -- Index Only Scan on non-PK index
)
select
    r.qidrel + rng.qidbase + s.qidoff as qid,
    'select ' || s.target || ' from ' || r.rel || ' where ' ||
    replace(rng.predicate, '##COL##', s.predicol) as query
from relations r, ranges rng, scans s;
-- generate colocation x scan kind x filter combination queries:
-- (index cond, +storage [index] filter, +storage table filter, +local filter)
insert into queries (qid, query)
with relations(rel, qidrel) as (
    values ('ce.r',  10000),
           ('ce.rC', 20000)
),
filter_combos(qidbase, qidoff, target, predicol, extra) as (
    -- PK Index Scan: + storage filter, + local filter
    values (500, 1, '*', 'pk', 'pk % 100 <= 33'),
           (500, 2, '*', 'pk', 'pk % 100 <= 33 and non_pushable(pk) <= 5000'),
    -- non-PK Index Scan: + storage index filter, + storage table filter,
    --                    + local filter
           (600, 1, 'v', 'b',  'b % 100 <= 33'),
           (600, 2, 'v', 'b',  'b % 100 <= 33 and e % 100 <= 33'),
           (600, 3, 'v', 'b',  'b % 100 <= 33 and e % 100 <= 33 and non_pushable(e) <= 5000'),
    -- Index Only Scan: + storage filter, + local filter
           (700, 1, 'b', 'b',  'b % 100 <= 33'),
           (700, 2, 'b', 'b',  'b % 100 <= 33 and non_pushable(b) <= 5000')
)
select
    r.qidrel + fc.qidbase + fc.qidoff as qid,
    'select ' || fc.target || ' from ' || r.rel
    || ' where ' || fc.predicol || ' between 1 and 5000'
    || ' and ' || fc.extra as query
from relations r, filter_combos fc;
-- generate colocation x scan kind, single predicate with a 15-item IN list
insert into queries (qid, query)
with relations(rel, qidrel) as (
    values ('ce.r',  10000),
           ('ce.rC', 20000)
),
in_list(qidoff, target, predicol, items) as (
    values (1, '*', 'pk',
            '100, 500, 1000, 2000, 3000, 4000, 5000, 6000, 7000, 8000, 9000, 10000, 11000, 12000, 12345'),
           (2, 'v', 'b',
            '100, 500, 1000, 2000, 3000, 4000, 5000, 6000, 7000, 8000, 9000, 10000, 11000, 12000, 12345'),
           (3, 'b', 'b',
            '100, 500, 1000, 2000, 3000, 4000, 5000, 6000, 7000, 8000, 9000, 10000, 11000, 12000, 12345')
)
select
    r.qidrel + 900 + il.qidoff as qid,
    'select ' || il.target || ' from ' || r.rel
    || ' where ' || il.predicol || ' in (' || il.items || ')' as query
from relations r, in_list il;
-- queries from yb.orig.cardinality_estimate_consistency (single index scan
-- variants; the OR / bitmap combinations are not included here)
insert into queries values
    (31001, $$select pk from ce.r where pk <= 500$$),
    (31002, $$select pk from ce.r where pk <= 500 and pk % 100 <= 33$$),
    (31003, $$select pk from ce.r where pk <= 500 and pk % 100 <= 33 and non_pushable(pk) <= 500$$),
    (31004, $$select pk from ce.r where b <= 500$$),
    (31005, $$select pk from ce.r where b <= 500 and b % 100 <= 33$$),
    (31006, $$select pk from ce.r where b <= 500 and b % 100 <= 33 and non_pushable(b) <= 500$$),
    (31007, $$select b from ce.r where b <= 500$$),
    (31008, $$select b from ce.r where b <= 500 and b % 100 <= 33$$),
    (31009, $$select b from ce.r where b <= 500 and b % 100 <= 33 and non_pushable(b) <= 500$$);
-- queries from yb.orig.seeknext_estimate (colocation x index/index-only
-- x forward/backward scan combinations)
insert into queries (qid, query)
with colocations(colo, qidcolo) as (
    values ('',  50000),
           ('C', 60000)
),
columns(col_id, col) as (
    values (1, 'pk'), (2, 'f1'), (3, 'f2'), (4, 'f3'), (5, 'f4'), (6, 'f5'),
           (7, 'f10'), (8, 'f100'), (9, 'f1000'), (10, 'dv1'),
           (11, 'skw1'), (12, 'skw2'), (13, 'skw3')
),
scans(qidbase, is_only_scan, is_backward) as (
    values (1000, false, false), -- index scan
           (2000, true,  false), -- index only scan
           (3000, false, true),  -- backward index scan
           (4000, true,  true)   -- backward index only scan
)
select
    s.qidbase + c_colo.qidcolo + row_number() over (partition by c_colo.colo, s.qidbase order by c.col_id) as qid,
    'select ' ||
    case when s.is_only_scan then c.col else 'v, ' || c.col end ||
    ' from sn.r' || c_colo.colo ||
    ' where ' || c.col ||
    case when s.is_backward
         then ' <= 1 order by ' || c.col || ' desc'
         else ' = 1'
    end as query
from colocations c_colo,
     scans s,
     columns c
where not (s.is_only_scan and c.col = 'pk');
set enable_seqscan = off;
set enable_bitmapscan = off;
set yb_enable_bitmapscan = off;
set enable_sort = off;
select * from queries order by qid;
  qid  |                                                            query                                                             
-------+------------------------------------------------------------------------------------------------------------------------------
 10101 | select * from ce.r where pk = 1
 10102 | select v from ce.r where b = 1
 10103 | select b from ce.r where b = 1
 10201 | select * from ce.r where pk between 1 and 100
 10202 | select v from ce.r where b between 1 and 100
 10203 | select b from ce.r where b between 1 and 100
 10301 | select * from ce.r where pk between 1 and 5000
 10302 | select v from ce.r where b between 1 and 5000
 10303 | select b from ce.r where b between 1 and 5000
 10401 | select * from ce.r where pk between 1 and 12345
 10402 | select v from ce.r where b between 1 and 12345
 10403 | select b from ce.r where b between 1 and 12345
 10501 | select * from ce.r where pk between 1 and 5000 and pk % 100 <= 33
 10502 | select * from ce.r where pk between 1 and 5000 and pk % 100 <= 33 and non_pushable(pk) <= 5000
 10601 | select v from ce.r where b between 1 and 5000 and b % 100 <= 33
 10602 | select v from ce.r where b between 1 and 5000 and b % 100 <= 33 and e % 100 <= 33
 10603 | select v from ce.r where b between 1 and 5000 and b % 100 <= 33 and e % 100 <= 33 and non_pushable(e) <= 5000
 10701 | select b from ce.r where b between 1 and 5000 and b % 100 <= 33
 10702 | select b from ce.r where b between 1 and 5000 and b % 100 <= 33 and non_pushable(b) <= 5000
 10901 | select * from ce.r where pk in (100, 500, 1000, 2000, 3000, 4000, 5000, 6000, 7000, 8000, 9000, 10000, 11000, 12000, 12345)
 10902 | select v from ce.r where b in (100, 500, 1000, 2000, 3000, 4000, 5000, 6000, 7000, 8000, 9000, 10000, 11000, 12000, 12345)
 10903 | select b from ce.r where b in (100, 500, 1000, 2000, 3000, 4000, 5000, 6000, 7000, 8000, 9000, 10000, 11000, 12000, 12345)
 20101 | select * from ce.rC where pk = 1
 20102 | select v from ce.rC where b = 1
 20103 | select b from ce.rC where b = 1
 20201 | select * from ce.rC where pk between 1 and 100
 20202 | select v from ce.rC where b between 1 and 100
 20203 | select b from ce.rC where b between 1 and 100
 20301 | select * from ce.rC where pk between 1 and 5000
 20302 | select v from ce.rC where b between 1 and 5000
 20303 | select b from ce.rC where b between 1 and 5000
 20401 | select * from ce.rC where pk between 1 and 12345
 20402 | select v from ce.rC where b between 1 and 12345
 20403 | select b from ce.rC where b between 1 and 12345
 20501 | select * from ce.rC where pk between 1 and 5000 and pk % 100 <= 33
 20502 | select * from ce.rC where pk between 1 and 5000 and pk % 100 <= 33 and non_pushable(pk) <= 5000
 20601 | select v from ce.rC where b between 1 and 5000 and b % 100 <= 33
 20602 | select v from ce.rC where b between 1 and 5000 and b % 100 <= 33 and e % 100 <= 33
 20603 | select v from ce.rC where b between 1 and 5000 and b % 100 <= 33 and e % 100 <= 33 and non_pushable(e) <= 5000
 20701 | select b from ce.rC where b between 1 and 5000 and b % 100 <= 33
 20702 | select b from ce.rC where b between 1 and 5000 and b % 100 <= 33 and non_pushable(b) <= 5000
 20901 | select * from ce.rC where pk in (100, 500, 1000, 2000, 3000, 4000, 5000, 6000, 7000, 8000, 9000, 10000, 11000, 12000, 12345)
 20902 | select v from ce.rC where b in (100, 500, 1000, 2000, 3000, 4000, 5000, 6000, 7000, 8000, 9000, 10000, 11000, 12000, 12345)
 20903 | select b from ce.rC where b in (100, 500, 1000, 2000, 3000, 4000, 5000, 6000, 7000, 8000, 9000, 10000, 11000, 12000, 12345)
 31001 | select pk from ce.r where pk <= 500
 31002 | select pk from ce.r where pk <= 500 and pk % 100 <= 33
 31003 | select pk from ce.r where pk <= 500 and pk % 100 <= 33 and non_pushable(pk) <= 500
 31004 | select pk from ce.r where b <= 500
 31005 | select pk from ce.r where b <= 500 and b % 100 <= 33
 31006 | select pk from ce.r where b <= 500 and b % 100 <= 33 and non_pushable(b) <= 500
 31007 | select b from ce.r where b <= 500
 31008 | select b from ce.r where b <= 500 and b % 100 <= 33
 31009 | select b from ce.r where b <= 500 and b % 100 <= 33 and non_pushable(b) <= 500
 51001 | select v, pk from sn.r where pk = 1
 51002 | select v, f1 from sn.r where f1 = 1
 51003 | select v, f2 from sn.r where f2 = 1
 51004 | select v, f3 from sn.r where f3 = 1
 51005 | select v, f4 from sn.r where f4 = 1
 51006 | select v, f5 from sn.r where f5 = 1
 51007 | select v, f10 from sn.r where f10 = 1
 51008 | select v, f100 from sn.r where f100 = 1
 51009 | select v, f1000 from sn.r where f1000 = 1
 51010 | select v, dv1 from sn.r where dv1 = 1
 51011 | select v, skw1 from sn.r where skw1 = 1
 51012 | select v, skw2 from sn.r where skw2 = 1
 51013 | select v, skw3 from sn.r where skw3 = 1
 52001 | select f1 from sn.r where f1 = 1
 52002 | select f2 from sn.r where f2 = 1
 52003 | select f3 from sn.r where f3 = 1
 52004 | select f4 from sn.r where f4 = 1
 52005 | select f5 from sn.r where f5 = 1
 52006 | select f10 from sn.r where f10 = 1
 52007 | select f100 from sn.r where f100 = 1
 52008 | select f1000 from sn.r where f1000 = 1
 52009 | select dv1 from sn.r where dv1 = 1
 52010 | select skw1 from sn.r where skw1 = 1
 52011 | select skw2 from sn.r where skw2 = 1
 52012 | select skw3 from sn.r where skw3 = 1
 53001 | select v, pk from sn.r where pk <= 1 order by pk desc
 53002 | select v, f1 from sn.r where f1 <= 1 order by f1 desc
 53003 | select v, f2 from sn.r where f2 <= 1 order by f2 desc
 53004 | select v, f3 from sn.r where f3 <= 1 order by f3 desc
 53005 | select v, f4 from sn.r where f4 <= 1 order by f4 desc
 53006 | select v, f5 from sn.r where f5 <= 1 order by f5 desc
 53007 | select v, f10 from sn.r where f10 <= 1 order by f10 desc
 53008 | select v, f100 from sn.r where f100 <= 1 order by f100 desc
 53009 | select v, f1000 from sn.r where f1000 <= 1 order by f1000 desc
 53010 | select v, dv1 from sn.r where dv1 <= 1 order by dv1 desc
 53011 | select v, skw1 from sn.r where skw1 <= 1 order by skw1 desc
 53012 | select v, skw2 from sn.r where skw2 <= 1 order by skw2 desc
 53013 | select v, skw3 from sn.r where skw3 <= 1 order by skw3 desc
 54001 | select f1 from sn.r where f1 <= 1 order by f1 desc
 54002 | select f2 from sn.r where f2 <= 1 order by f2 desc
 54003 | select f3 from sn.r where f3 <= 1 order by f3 desc
 54004 | select f4 from sn.r where f4 <= 1 order by f4 desc
 54005 | select f5 from sn.r where f5 <= 1 order by f5 desc
 54006 | select f10 from sn.r where f10 <= 1 order by f10 desc
 54007 | select f100 from sn.r where f100 <= 1 order by f100 desc
 54008 | select f1000 from sn.r where f1000 <= 1 order by f1000 desc
 54009 | select dv1 from sn.r where dv1 <= 1 order by dv1 desc
 54010 | select skw1 from sn.r where skw1 <= 1 order by skw1 desc
 54011 | select skw2 from sn.r where skw2 <= 1 order by skw2 desc
 54012 | select skw3 from sn.r where skw3 <= 1 order by skw3 desc
 61001 | select v, pk from sn.rC where pk = 1
 61002 | select v, f1 from sn.rC where f1 = 1
 61003 | select v, f2 from sn.rC where f2 = 1
 61004 | select v, f3 from sn.rC where f3 = 1
 61005 | select v, f4 from sn.rC where f4 = 1
 61006 | select v, f5 from sn.rC where f5 = 1
 61007 | select v, f10 from sn.rC where f10 = 1
 61008 | select v, f100 from sn.rC where f100 = 1
 61009 | select v, f1000 from sn.rC where f1000 = 1
 61010 | select v, dv1 from sn.rC where dv1 = 1
 61011 | select v, skw1 from sn.rC where skw1 = 1
 61012 | select v, skw2 from sn.rC where skw2 = 1
 61013 | select v, skw3 from sn.rC where skw3 = 1
 62001 | select f1 from sn.rC where f1 = 1
 62002 | select f2 from sn.rC where f2 = 1
 62003 | select f3 from sn.rC where f3 = 1
 62004 | select f4 from sn.rC where f4 = 1
 62005 | select f5 from sn.rC where f5 = 1
 62006 | select f10 from sn.rC where f10 = 1
 62007 | select f100 from sn.rC where f100 = 1
 62008 | select f1000 from sn.rC where f1000 = 1
 62009 | select dv1 from sn.rC where dv1 = 1
 62010 | select skw1 from sn.rC where skw1 = 1
 62011 | select skw2 from sn.rC where skw2 = 1
 62012 | select skw3 from sn.rC where skw3 = 1
 63001 | select v, pk from sn.rC where pk <= 1 order by pk desc
 63002 | select v, f1 from sn.rC where f1 <= 1 order by f1 desc
 63003 | select v, f2 from sn.rC where f2 <= 1 order by f2 desc
 63004 | select v, f3 from sn.rC where f3 <= 1 order by f3 desc
 63005 | select v, f4 from sn.rC where f4 <= 1 order by f4 desc
 63006 | select v, f5 from sn.rC where f5 <= 1 order by f5 desc
 63007 | select v, f10 from sn.rC where f10 <= 1 order by f10 desc
 63008 | select v, f100 from sn.rC where f100 <= 1 order by f100 desc
 63009 | select v, f1000 from sn.rC where f1000 <= 1 order by f1000 desc
 63010 | select v, dv1 from sn.rC where dv1 <= 1 order by dv1 desc
 63011 | select v, skw1 from sn.rC where skw1 <= 1 order by skw1 desc
 63012 | select v, skw2 from sn.rC where skw2 <= 1 order by skw2 desc
 63013 | select v, skw3 from sn.rC where skw3 <= 1 order by skw3 desc
 64001 | select f1 from sn.rC where f1 <= 1 order by f1 desc
 64002 | select f2 from sn.rC where f2 <= 1 order by f2 desc
 64003 | select f3 from sn.rC where f3 <= 1 order by f3 desc
 64004 | select f4 from sn.rC where f4 <= 1 order by f4 desc
 64005 | select f5 from sn.rC where f5 <= 1 order by f5 desc
 64006 | select f10 from sn.rC where f10 <= 1 order by f10 desc
 64007 | select f100 from sn.rC where f100 <= 1 order by f100 desc
 64008 | select f1000 from sn.rC where f1000 <= 1 order by f1000 desc
 64009 | select dv1 from sn.rC where dv1 <= 1 order by dv1 desc
 64010 | select skw1 from sn.rC where skw1 <= 1 order by skw1 desc
 64011 | select skw2 from sn.rC where skw2 <= 1 order by skw2 desc
 64012 | select skw3 from sn.rC where skw3 <= 1 order by skw3 desc
(153 rows)

update explain_query_options set with_analyze = false;
-- should not return any row.  mismatches indicate non-index scan nodes.
select q.qid, q.query, x.qid, x.nid, "Node Type", "Index Name", "Index Cond"
from queries q full join check_roundtrip_estimates x on x.qid = q.qid
where x.qid is null or q.qid is null
order by coalesce(q.qid, x.qid), x.nid;
 qid | query | qid | nid | Node Type | Index Name | Index Cond 
-----+-------+-----+-----+-----------+------------+------------
(0 rows)

update explain_query_options set with_analyze = true;
-- should not return any row.  surface the per-field counts on failure so
-- that both totals mismatches and field-layout mismatches are diagnosable.
select qid, nid, "Node Type", "Index Name", scan_kind, is_colocated,
       "Estimated Table Roundtrips" est_t, "Estimated Index Roundtrips" est_i,
       "Storage Table Read Requests" act_t, "Storage Index Read Requests" act_i,
       "Estimated Roundtrips" est, "Actual Roundtrips" act,
       "Total Estimates", "Field Layout"
from check_roundtrip_estimates
where "Total Estimates" <> 'passed' or "Field Layout" <> 'passed'
order by qid, nid;
 qid | nid | Node Type | Index Name | scan_kind | is_colocated | est_t | est_i | act_t | act_i | est | act | Total Estimates | Field Layout 
-----+-----+-----------+------------+-----------+--------------+-------+-------+-------+-------+-----+-----+-----------------+--------------
(0 rows)

