-- -----------------------------------------------------------------------------
-- TEST 1: Multi-Statement Read-Your-Own-Write (RYOW)
-- -----------------------------------------------------------------------------
BEGIN;
CREATE TABLE ryow_test (id INT PRIMARY KEY, val TEXT);
INSERT INTO ryow_test SELECT i, 'init' FROM generate_series(1, 100) i;
-- If in_txn_limit_ht is not updated by Statement 1, Statement 2 might
-- use a read-time that is logically BEFORE Statement 1's write-time.
SELECT count(*) FROM ryow_test;
 count 
-------
   100
(1 row)

-- Statement 3: Update based on previous write
UPDATE ryow_test SET val = 'updated' WHERE id = 50;
-- Verification
SELECT id, val FROM ryow_test WHERE id = 50;
 id |   val   
----+---------
 50 | updated
(1 row)

COMMIT;
-- -----------------------------------------------------------------------------
-- TEST 2: Self-Referencing Insert (INSERT INTO ... SELECT FROM self)
-- -----------------------------------------------------------------------------
BEGIN;
CREATE TABLE self_insert_test (id INT PRIMARY KEY);
INSERT INTO self_insert_test SELECT i FROM generate_series(1, 10) i;
-- The SELECT must find the first 10 rows in the Regular DB.
-- The INSERT then writes 10 new rows (ID 11-20) to the Regular DB.
-- This must NOT loop indefinitely.
INSERT INTO self_insert_test SELECT id + 10 FROM self_insert_test;
-- Final count should be exactly 20.
SELECT count(*) FROM self_insert_test;
 count 
-------
    20
(1 row)

COMMIT;
-- -----------------------------------------------------------------------------
-- TEST 3: Cross-Statement Visibility with Mixed Operations
-- -----------------------------------------------------------------------------
BEGIN;
CREATE TABLE mixed_visibility_test (id INT PRIMARY KEY, balance INT);
-- First batch
INSERT INTO mixed_visibility_test VALUES (1, 100), (2, 200);
-- Use a statement that references the data to perform a calculation
INSERT INTO mixed_visibility_test
SELECT 3, sum(balance) FROM mixed_visibility_test;
SELECT * FROM mixed_visibility_test ORDER BY id;
 id | balance 
----+---------
  1 |     100
  2 |     200
  3 |     300
(3 rows)

COMMIT;
-- -----------------------------------------------------------------------------
-- TEST 4: The "Infinite Increment" Test
-- -----------------------------------------------------------------------------
BEGIN;
CREATE TABLE increment_test (id INT PRIMARY KEY, val INT);
-- Initial Data: Single row
INSERT INTO increment_test VALUES (1, 10);
-- Scenario:
-- We want to increment 'val' by 1 for any row where val < 100.
-- 1. Scan finds val=10. 10 < 100 is TRUE.
-- 2. UPDATE writes val=11 directly to Regular DB (Skip Intents).
-- 3. If the scan is NOT isolated, it might find val=11 later.
-- 4. 11 < 100 is still TRUE.
-- 5. UPDATE writes val=12... and so on.
UPDATE increment_test SET val = val + 1 WHERE val < 100;
-- EXPECTED (Correct Isolation): val = 11
-- ACTUAL (If Isolation Fails): val = 100 (or the query loops/times out)
SELECT * FROM increment_test;
 id | val 
----+-----
  1 |  11
(1 row)

COMMIT;
