SET yb_fetch_row_limit TO 1024;
SET yb_explain_hide_non_deterministic_fields TO true;
--
-- Tests to validate index updates in a table with no primary key.
--
DROP TABLE IF EXISTS no_pkey_table;
NOTICE:  table "no_pkey_table" does not exist, skipping
CREATE TABLE no_pkey_table (v1 INT, v2 INT, v3 INT, v4 INT);
CREATE INDEX NONCONCURRENTLY no_pkey_v1 ON no_pkey_table (v1 HASH);
CREATE INDEX NONCONCURRENTLY no_pkey_v2_hash_v3 ON no_pkey_table (v2 HASH) INCLUDE (v3);
CREATE INDEX NONCONCURRENTLY no_pkey_v2_range_v3 ON no_pkey_table (v2 ASC) INCLUDE (v3);
INSERT INTO no_pkey_table (SELECT i, i, i, i FROM generate_series(1, 10) AS i);
-- Updating a column with no indexes should not require index writes
EXPLAIN (ANALYZE, DIST, COSTS OFF) UPDATE no_pkey_table SET v4 = v4 + 1 WHERE v1 = 1;
                                 QUERY PLAN                                 
----------------------------------------------------------------------------
 Update on no_pkey_table (actual rows=0 loops=1)
   ->  Index Scan using no_pkey_v1 on no_pkey_table (actual rows=1 loops=1)
         Index Cond: (v1 = 1)
         Storage Table Read Requests: 1
         Storage Table Rows Scanned: 1
         Storage Index Read Requests: 1
         Storage Index Rows Scanned: 1
         Storage Table Write Requests: 1
 Storage Read Requests: 2
 Storage Rows Scanned: 2
 Storage Write Requests: 1
 Storage Flush Requests: 1
(12 rows)

-- Updating the key columns of an index should require a DELETE + INSERT
EXPLAIN (ANALYZE, DIST, COSTS OFF) UPDATE no_pkey_table SET v2 = v2 + 1 WHERE v1 = 1;
                                 QUERY PLAN                                 
----------------------------------------------------------------------------
 Update on no_pkey_table (actual rows=0 loops=1)
   ->  Index Scan using no_pkey_v1 on no_pkey_table (actual rows=1 loops=1)
         Index Cond: (v1 = 1)
         Storage Table Read Requests: 1
         Storage Table Rows Scanned: 1
         Storage Index Read Requests: 1
         Storage Index Rows Scanned: 1
         Storage Table Write Requests: 1
         Storage Index Write Requests: 4
 Storage Read Requests: 2
 Storage Rows Scanned: 2
 Storage Write Requests: 5
 Storage Flush Requests: 1
(13 rows)

-- Updating non-key columns of an index should only require an UPDATE
EXPLAIN (ANALYZE, DIST, COSTS OFF) UPDATE no_pkey_table SET v3 = v3 + 1 WHERE v1 = 1;
                                 QUERY PLAN                                 
----------------------------------------------------------------------------
 Update on no_pkey_table (actual rows=0 loops=1)
   ->  Index Scan using no_pkey_v1 on no_pkey_table (actual rows=1 loops=1)
         Index Cond: (v1 = 1)
         Storage Table Read Requests: 1
         Storage Table Rows Scanned: 1
         Storage Index Read Requests: 1
         Storage Index Rows Scanned: 1
         Storage Table Write Requests: 1
         Storage Index Write Requests: 2
 Storage Read Requests: 2
 Storage Rows Scanned: 2
 Storage Write Requests: 3
 Storage Flush Requests: 1
(13 rows)

EXPLAIN (ANALYZE, DIST, COSTS OFF) UPDATE no_pkey_table SET v3 = v3 + 1, v4 = v4 + 1 WHERE v1 = 1;
                                 QUERY PLAN                                 
----------------------------------------------------------------------------
 Update on no_pkey_table (actual rows=0 loops=1)
   ->  Index Scan using no_pkey_v1 on no_pkey_table (actual rows=1 loops=1)
         Index Cond: (v1 = 1)
         Storage Table Read Requests: 1
         Storage Table Rows Scanned: 1
         Storage Index Read Requests: 1
         Storage Index Rows Scanned: 1
         Storage Table Write Requests: 1
         Storage Index Write Requests: 2
 Storage Read Requests: 2
 Storage Rows Scanned: 2
 Storage Write Requests: 3
 Storage Flush Requests: 1
(13 rows)

-- Updating a mix of key and non-key columns of an index should require a DELETE + INSERT
EXPLAIN (ANALYZE, DIST, COSTS OFF) UPDATE no_pkey_table SET v2 = v2 + 1, v3 = v3 + 1 WHERE v1 = 1;
                                 QUERY PLAN                                 
----------------------------------------------------------------------------
 Update on no_pkey_table (actual rows=0 loops=1)
   ->  Index Scan using no_pkey_v1 on no_pkey_table (actual rows=1 loops=1)
         Index Cond: (v1 = 1)
         Storage Table Read Requests: 1
         Storage Table Rows Scanned: 1
         Storage Index Read Requests: 1
         Storage Index Rows Scanned: 1
         Storage Table Write Requests: 1
         Storage Index Write Requests: 4
 Storage Read Requests: 2
 Storage Rows Scanned: 2
 Storage Write Requests: 5
 Storage Flush Requests: 1
(13 rows)

-- Validate the updates above using both SeqScan and IndexOnlyScan
/*+ SeqScan(no_pkey_table) */ SELECT * FROM no_pkey_table WHERE v1 = 1 ORDER BY v1;
 v1 | v2 | v3 | v4 
----+----+----+----
  1 |  3 |  4 |  3
(1 row)

/*+ IndexOnlyScan(no_pkey_table no_pkey_v2_hash_v3) */ SELECT v2, v3 FROM no_pkey_table WHERE v2 = 3 ORDER BY (v2, v3);
 v2 | v3 
----+----
  3 |  3
  3 |  4
(2 rows)

/*+ IndexOnlyScan(no_pkey_table no_pkey_v2_range_v3) */ SELECT v2, v3 FROM no_pkey_table WHERE v2 = 3 ORDER BY (v2, v3);
 v2 | v3 
----+----
  3 |  3
  3 |  4
(2 rows)

DROP TABLE IF EXISTS t_simple;
CREATE TABLE t_simple (k1 INT, k2 INT NULL, v1 INT, v2 INT, v3 INT, v4 INT, PRIMARY KEY (k1, k2));
INSERT INTO t_simple (SELECT i, i, i, i, i, i FROM generate_series(1, 10) AS i);
--
-- Vanilla tests to validate index updates in a table with a primary key.
--
CREATE INDEX NONCONCURRENTLY simple_v1 ON t_simple (v1 HASH);
CREATE INDEX NONCONCURRENTLY simple_v2_hash_v3 ON t_simple (v2 HASH) INCLUDE (v3);
CREATE INDEX NONCONCURRENTLY simple_v2_range_v3 ON t_simple (v2 ASC) INCLUDE (v3);
-- Updating a column with no indexes should not require index writes
EXPLAIN (ANALYZE, DIST, COSTS OFF) UPDATE t_simple SET v4 = v4 + 1 WHERE k1 = 1;
                                QUERY PLAN                                
--------------------------------------------------------------------------
 Update on t_simple (actual rows=0 loops=1)
   ->  Index Scan using t_simple_pkey on t_simple (actual rows=1 loops=1)
         Index Cond: (k1 = 1)
         Storage Table Read Requests: 1
         Storage Table Rows Scanned: 1
         Storage Table Write Requests: 1
 Storage Read Requests: 1
 Storage Rows Scanned: 1
 Storage Write Requests: 1
 Storage Flush Requests: 1
(10 rows)

-- Updating the key columns of an index should require a DELETE + INSERT
EXPLAIN (ANALYZE, DIST, COSTS OFF) UPDATE t_simple SET v2 = v2 + 1 WHERE k1 = 1;
                                QUERY PLAN                                
--------------------------------------------------------------------------
 Update on t_simple (actual rows=0 loops=1)
   ->  Index Scan using t_simple_pkey on t_simple (actual rows=1 loops=1)
         Index Cond: (k1 = 1)
         Storage Table Read Requests: 1
         Storage Table Rows Scanned: 1
         Storage Table Write Requests: 1
         Storage Index Write Requests: 4
 Storage Read Requests: 1
 Storage Rows Scanned: 1
 Storage Write Requests: 5
 Storage Flush Requests: 1
(11 rows)

-- Updating non-key columns of an index should only require an UPDATE
EXPLAIN (ANALYZE, DIST, COSTS OFF) UPDATE t_simple SET v3 = v3 + 1 WHERE k1 = 1;
                                QUERY PLAN                                
--------------------------------------------------------------------------
 Update on t_simple (actual rows=0 loops=1)
   ->  Index Scan using t_simple_pkey on t_simple (actual rows=1 loops=1)
         Index Cond: (k1 = 1)
         Storage Table Read Requests: 1
         Storage Table Rows Scanned: 1
         Storage Table Write Requests: 1
         Storage Index Write Requests: 2
 Storage Read Requests: 1
 Storage Rows Scanned: 1
 Storage Write Requests: 3
 Storage Flush Requests: 1
(11 rows)

EXPLAIN (ANALYZE, DIST, COSTS OFF) UPDATE t_simple SET v3 = v3 + 1, v4 = v4 + 1 WHERE k1 = 1;
                                QUERY PLAN                                
--------------------------------------------------------------------------
 Update on t_simple (actual rows=0 loops=1)
   ->  Index Scan using t_simple_pkey on t_simple (actual rows=1 loops=1)
         Index Cond: (k1 = 1)
         Storage Table Read Requests: 1
         Storage Table Rows Scanned: 1
         Storage Table Write Requests: 1
         Storage Index Write Requests: 2
 Storage Read Requests: 1
 Storage Rows Scanned: 1
 Storage Write Requests: 3
 Storage Flush Requests: 1
(11 rows)

-- Updating a mix of key and non-key columns of an index should require a DELETE + INSERT
EXPLAIN (ANALYZE, DIST, COSTS OFF) UPDATE t_simple SET v2 = v2 + 1, v3 = v3 + 1 WHERE k1 = 1;
                                QUERY PLAN                                
--------------------------------------------------------------------------
 Update on t_simple (actual rows=0 loops=1)
   ->  Index Scan using t_simple_pkey on t_simple (actual rows=1 loops=1)
         Index Cond: (k1 = 1)
         Storage Table Read Requests: 1
         Storage Table Rows Scanned: 1
         Storage Table Write Requests: 1
         Storage Index Write Requests: 4
 Storage Read Requests: 1
 Storage Rows Scanned: 1
 Storage Write Requests: 5
 Storage Flush Requests: 1
(11 rows)

-- Validate the updates above using both SeqScan and IndexOnlyScan
/*+ SeqScan(t_simple) */ SELECT * FROM t_simple WHERE k1 = 1 ORDER BY (k1, k2);
 k1 | k2 | v1 | v2 | v3 | v4 
----+----+----+----+----+----
  1 |  1 |  1 |  3 |  4 |  3
(1 row)

/*+ IndexOnlyScan(t_simple simple_v2_hash_v3) */ SELECT v2, v3 FROM t_simple WHERE v2 = 3 ORDER BY (v2, v3);
 v2 | v3 
----+----
  3 |  3
  3 |  4
(2 rows)

/*+ IndexOnlyScan(t_simple simple_v2_range_v3) */ SELECT v2, v3 FROM t_simple WHERE v2 = 3 ORDER BY (v2, v3);
 v2 | v3 
----+----
  3 |  3
  3 |  4
(2 rows)

-- Updating the primary key columns should require a DELETE + INSERT on the main table
-- as well as on non-unique indexes.
EXPLAIN (ANALYZE, DIST, COSTS OFF) UPDATE t_simple SET k1 = k1 + 10, v3 = v3 + 1 WHERE k1 = 1;
                                QUERY PLAN                                
--------------------------------------------------------------------------
 Update on t_simple (actual rows=0 loops=1)
   ->  Index Scan using t_simple_pkey on t_simple (actual rows=1 loops=1)
         Index Cond: (k1 = 1)
         Storage Table Read Requests: 1
         Storage Table Rows Scanned: 1
         Storage Table Write Requests: 2
         Storage Index Write Requests: 6
 Storage Read Requests: 1
 Storage Rows Scanned: 1
 Storage Write Requests: 8
 Storage Flush Requests: 1
(11 rows)

EXPLAIN (ANALYZE, DIST, COSTS OFF) UPDATE t_simple SET k2 = k2 + 10, v3 = v3 + 1 WHERE k1 = 11;
                                QUERY PLAN                                
--------------------------------------------------------------------------
 Update on t_simple (actual rows=0 loops=1)
   ->  Index Scan using t_simple_pkey on t_simple (actual rows=1 loops=1)
         Index Cond: (k1 = 11)
         Storage Table Read Requests: 1
         Storage Table Rows Scanned: 1
         Storage Table Write Requests: 2
         Storage Index Write Requests: 6
 Storage Read Requests: 1
 Storage Rows Scanned: 1
 Storage Write Requests: 8
 Storage Flush Requests: 1
(11 rows)

EXPLAIN (ANALYZE, DIST, COSTS OFF) UPDATE t_simple SET k1 = 12, k2 = 22, v3 = v3 + 1 WHERE k1 < 3;
                     QUERY PLAN                     
----------------------------------------------------
 Update on t_simple (actual rows=0 loops=1)
   ->  Seq Scan on t_simple (actual rows=1 loops=1)
         Storage Filter: (k1 < 3)
         Storage Table Read Requests: 1
         Storage Table Rows Scanned: 10
         Storage Table Write Requests: 2
         Storage Index Write Requests: 6
 Storage Read Requests: 1
 Storage Rows Scanned: 10
 Storage Write Requests: 8
 Storage Flush Requests: 1
(11 rows)

EXPLAIN (ANALYZE, DIST, COSTS OFF) UPDATE t_simple SET k1 = k1 + 10, k2 = k2 + 10, v2 = v2 + 1 WHERE k2 = 3;
                     QUERY PLAN                     
----------------------------------------------------
 Update on t_simple (actual rows=0 loops=1)
   ->  Seq Scan on t_simple (actual rows=1 loops=1)
         Storage Filter: (k2 = 3)
         Storage Table Read Requests: 1
         Storage Table Rows Scanned: 10
         Storage Table Write Requests: 2
         Storage Index Write Requests: 6
 Storage Read Requests: 1
 Storage Rows Scanned: 10
 Storage Write Requests: 8
 Storage Flush Requests: 1
(11 rows)

EXPLAIN (ANALYZE, DIST, COSTS OFF) UPDATE t_simple SET k1 = k1 + 10, k2 = k2 + 10, v2 = v2 + 1, v3 = v3 + 1 WHERE k2 = 4;
                     QUERY PLAN                     
----------------------------------------------------
 Update on t_simple (actual rows=0 loops=1)
   ->  Seq Scan on t_simple (actual rows=1 loops=1)
         Storage Filter: (k2 = 4)
         Storage Table Read Requests: 1
         Storage Table Rows Scanned: 10
         Storage Table Write Requests: 2
         Storage Index Write Requests: 6
 Storage Read Requests: 1
 Storage Rows Scanned: 10
 Storage Write Requests: 8
 Storage Flush Requests: 1
(11 rows)

/*+ SeqScan(t_simple) */ SELECT * FROM t_simple WHERE k1 > 10 ORDER BY (k1, k2);
 k1 | k2 | v1 | v2 | v3 | v4 
----+----+----+----+----+----
 11 | 11 |  1 |  3 |  6 |  3
 12 | 22 |  2 |  2 |  3 |  2
 13 | 13 |  3 |  4 |  3 |  3
 14 | 14 |  4 |  5 |  5 |  4
(4 rows)

/*+ IndexOnlyScan(t_simple simple_v2_hash_v3) */ SELECT v2, v3 FROM t_simple WHERE v2 <= 5 ORDER BY (v2, v3);
 v2 | v3 
----+----
  2 |  3
  3 |  6
  4 |  3
  5 |  5
  5 |  5
(5 rows)

/*+ IndexOnlyScan(t_simple simple_v2_range_v3) */ SELECT v2, v3 FROM t_simple WHERE v2 <= 5 ORDER BY (v2, v3);
 v2 | v3 
----+----
  2 |  3
  3 |  6
  4 |  3
  5 |  5
  5 |  5
(5 rows)

/*+ IndexScan(simple_v2_hash_v3) */ SELECT * FROM t_simple WHERE v2 <= 5 ORDER BY (v2, v3);
 k1 | k2 | v1 | v2 | v3 | v4 
----+----+----+----+----+----
 12 | 22 |  2 |  2 |  3 |  2
 11 | 11 |  1 |  3 |  6 |  3
 13 | 13 |  3 |  4 |  3 |  3
  5 |  5 |  5 |  5 |  5 |  5
 14 | 14 |  4 |  5 |  5 |  4
(5 rows)

/*+ IndexScan(simple_v2_range_v3) */ SELECT * FROM t_simple WHERE v2 <= 5 ORDER BY (v2, v3);
 k1 | k2 | v1 | v2 | v3 | v4 
----+----+----+----+----+----
 12 | 22 |  2 |  2 |  3 |  2
 11 | 11 |  1 |  3 |  6 |  3
 13 | 13 |  3 |  4 |  3 |  3
  5 |  5 |  5 |  5 |  5 |  5
 14 | 14 |  4 |  5 |  5 |  4
(5 rows)

DROP INDEX simple_v1;
DROP INDEX simple_v2_hash_v3;
DROP INDEX simple_v2_range_v3;
--
-- Vanilla tests to validate index updates in unique indexes.
--
TRUNCATE t_simple;
INSERT INTO t_simple (SELECT i, i, i, i, i, i FROM generate_series(1, 10) AS i);
CREATE UNIQUE INDEX NONCONCURRENTLY simple_v2_hash_v3 ON t_simple (v2 HASH) INCLUDE (v3);
CREATE UNIQUE INDEX NONCONCURRENTLY simple_v2_range_v3 ON t_simple (v2 ASC) INCLUDE (v3);
-- Updating the key columns of a unique index should require a DELETE + INSERT
EXPLAIN (ANALYZE, DIST, COSTS OFF) UPDATE t_simple SET v2 = v2 + 10 WHERE k1 = 1;
                                QUERY PLAN                                
--------------------------------------------------------------------------
 Update on t_simple (actual rows=0 loops=1)
   ->  Index Scan using t_simple_pkey on t_simple (actual rows=1 loops=1)
         Index Cond: (k1 = 1)
         Storage Table Read Requests: 1
         Storage Table Rows Scanned: 1
         Storage Table Write Requests: 1
         Storage Index Write Requests: 4
 Storage Read Requests: 1
 Storage Rows Scanned: 1
 Storage Write Requests: 5
 Storage Flush Requests: 1
(11 rows)

-- Updating non-key columns of an index should only require an UPDATE
EXPLAIN (ANALYZE, DIST, COSTS OFF) UPDATE t_simple SET v3 = v3 + 1 WHERE k1 = 1;
                                QUERY PLAN                                
--------------------------------------------------------------------------
 Update on t_simple (actual rows=0 loops=1)
   ->  Index Scan using t_simple_pkey on t_simple (actual rows=1 loops=1)
         Index Cond: (k1 = 1)
         Storage Table Read Requests: 1
         Storage Table Rows Scanned: 1
         Storage Table Write Requests: 1
         Storage Index Write Requests: 2
 Storage Read Requests: 1
 Storage Rows Scanned: 1
 Storage Write Requests: 3
 Storage Flush Requests: 1
(11 rows)

EXPLAIN (ANALYZE, DIST, COSTS OFF) UPDATE t_simple SET v3 = v3 + 1, v4 = v4 + 1 WHERE k1 = 1;
                                QUERY PLAN                                
--------------------------------------------------------------------------
 Update on t_simple (actual rows=0 loops=1)
   ->  Index Scan using t_simple_pkey on t_simple (actual rows=1 loops=1)
         Index Cond: (k1 = 1)
         Storage Table Read Requests: 1
         Storage Table Rows Scanned: 1
         Storage Table Write Requests: 1
         Storage Index Write Requests: 2
 Storage Read Requests: 1
 Storage Rows Scanned: 1
 Storage Write Requests: 3
 Storage Flush Requests: 1
(11 rows)

-- Updating a mix of key and non-key columns of an index should require a DELETE + INSERT
EXPLAIN (ANALYZE, DIST, COSTS OFF) UPDATE t_simple SET v2 = v2 + 10, v3 = v3 + 1 WHERE k1 = 1;
                                QUERY PLAN                                
--------------------------------------------------------------------------
 Update on t_simple (actual rows=0 loops=1)
   ->  Index Scan using t_simple_pkey on t_simple (actual rows=1 loops=1)
         Index Cond: (k1 = 1)
         Storage Table Read Requests: 1
         Storage Table Rows Scanned: 1
         Storage Table Write Requests: 1
         Storage Index Write Requests: 4
 Storage Read Requests: 1
 Storage Rows Scanned: 1
 Storage Write Requests: 5
 Storage Flush Requests: 1
(11 rows)

-- Updating the primary key columns should require a DELETE + INSERT on the main table
-- but only an UPDATE on a non-unique index.
EXPLAIN (ANALYZE, DIST, COSTS OFF) UPDATE t_simple SET k1 = k1 + 10, v3 = v3 + 1 WHERE k1 = 1;
                                QUERY PLAN                                
--------------------------------------------------------------------------
 Update on t_simple (actual rows=0 loops=1)
   ->  Index Scan using t_simple_pkey on t_simple (actual rows=1 loops=1)
         Index Cond: (k1 = 1)
         Storage Table Read Requests: 1
         Storage Table Rows Scanned: 1
         Storage Table Write Requests: 2
         Storage Index Write Requests: 2
 Storage Read Requests: 1
 Storage Rows Scanned: 1
 Storage Write Requests: 4
 Storage Flush Requests: 1
(11 rows)

EXPLAIN (ANALYZE, DIST, COSTS OFF) UPDATE t_simple SET k2 = k2 + 10, v3 = v3 + 1 WHERE k1 = 11;
                                QUERY PLAN                                
--------------------------------------------------------------------------
 Update on t_simple (actual rows=0 loops=1)
   ->  Index Scan using t_simple_pkey on t_simple (actual rows=1 loops=1)
         Index Cond: (k1 = 11)
         Storage Table Read Requests: 1
         Storage Table Rows Scanned: 1
         Storage Table Write Requests: 2
         Storage Index Write Requests: 2
 Storage Read Requests: 1
 Storage Rows Scanned: 1
 Storage Write Requests: 4
 Storage Flush Requests: 1
(11 rows)

EXPLAIN (ANALYZE, DIST, COSTS OFF) UPDATE t_simple SET k1 = 12, k2 = 22, v3 = v3 + 1 WHERE k1 < 3;
                     QUERY PLAN                     
----------------------------------------------------
 Update on t_simple (actual rows=0 loops=1)
   ->  Seq Scan on t_simple (actual rows=1 loops=1)
         Storage Filter: (k1 < 3)
         Storage Table Read Requests: 1
         Storage Table Rows Scanned: 10
         Storage Table Write Requests: 2
         Storage Index Write Requests: 2
 Storage Read Requests: 1
 Storage Rows Scanned: 10
 Storage Write Requests: 4
 Storage Flush Requests: 1
(11 rows)

EXPLAIN (ANALYZE, DIST, COSTS OFF) UPDATE t_simple SET k1 = k1 + 10, k2 = k2 + 10, v2 = v2 + 10 WHERE k2 = 3;
                     QUERY PLAN                     
----------------------------------------------------
 Update on t_simple (actual rows=0 loops=1)
   ->  Seq Scan on t_simple (actual rows=1 loops=1)
         Storage Filter: (k2 = 3)
         Storage Table Read Requests: 1
         Storage Table Rows Scanned: 10
         Storage Table Write Requests: 2
         Storage Index Write Requests: 4
 Storage Read Requests: 1
 Storage Rows Scanned: 10
 Storage Write Requests: 6
 Storage Flush Requests: 1
(11 rows)

EXPLAIN (ANALYZE, DIST, COSTS OFF) UPDATE t_simple SET k1 = k1 + 10, k2 = k2 + 10, v2 = v2 + 10, v3 = v3 + 1 WHERE k2 = 4;
                     QUERY PLAN                     
----------------------------------------------------
 Update on t_simple (actual rows=0 loops=1)
   ->  Seq Scan on t_simple (actual rows=1 loops=1)
         Storage Filter: (k2 = 4)
         Storage Table Read Requests: 1
         Storage Table Rows Scanned: 10
         Storage Table Write Requests: 2
         Storage Index Write Requests: 4
 Storage Read Requests: 1
 Storage Rows Scanned: 10
 Storage Write Requests: 6
 Storage Flush Requests: 1
(11 rows)

/*+ SeqScan(t_simple) */ SELECT * FROM t_simple WHERE k1 > 10 ORDER BY (k1, k2);
 k1 | k2 | v1 | v2 | v3 | v4 
----+----+----+----+----+----
 11 | 11 |  1 | 21 |  6 |  2
 12 | 22 |  2 |  2 |  3 |  2
 13 | 13 |  3 | 13 |  3 |  3
 14 | 14 |  4 | 14 |  5 |  4
(4 rows)

/*+ IndexOnlyScan(t_simple simple_v2_hash_v3) */ SELECT v2, v3 FROM t_simple WHERE v2 <= 5 ORDER BY (v2, v3);
 v2 | v3 
----+----
  2 |  3
  5 |  5
(2 rows)

/*+ IndexOnlyScan(t_simple simple_v2_range_v3) */ SELECT v2, v3 FROM t_simple WHERE v2 <= 5 ORDER BY (v2, v3);
 v2 | v3 
----+----
  2 |  3
  5 |  5
(2 rows)

/*+ IndexScan(simple_v2_hash_v3) */ SELECT * FROM t_simple WHERE v2 <= 5 ORDER BY (v2, v3);
 k1 | k2 | v1 | v2 | v3 | v4 
----+----+----+----+----+----
 12 | 22 |  2 |  2 |  3 |  2
  5 |  5 |  5 |  5 |  5 |  5
(2 rows)

/*+ IndexScan(simple_v2_range_v3) */ SELECT * FROM t_simple WHERE v2 <= 5 ORDER BY (v2, v3);
 k1 | k2 | v1 | v2 | v3 | v4 
----+----+----+----+----+----
 12 | 22 |  2 |  2 |  3 |  2
  5 |  5 |  5 |  5 |  5 |  5
(2 rows)

DROP INDEX simple_v2_hash_v3;
DROP INDEX simple_v2_range_v3;
--
-- Tests to validate multi-column index update behavior
--
TRUNCATE t_simple;
INSERT INTO t_simple (SELECT i, i, i, i, i, i FROM generate_series(1, 10) AS i);
CREATE INDEX NONCONCURRENTLY simple_v1_v2_v3 ON t_simple ((v1, v2) HASH) INCLUDE (v3);
-- Updating any of the key columns of the non-unique index should require a DELETE + INSERT
EXPLAIN (ANALYZE, DIST, COSTS OFF) UPDATE t_simple SET v1 = v1 + 10, v2 = v2 + 10 WHERE k1 = 1;
                                QUERY PLAN                                
--------------------------------------------------------------------------
 Update on t_simple (actual rows=0 loops=1)
   ->  Index Scan using t_simple_pkey on t_simple (actual rows=1 loops=1)
         Index Cond: (k1 = 1)
         Storage Table Read Requests: 1
         Storage Table Rows Scanned: 1
         Storage Table Write Requests: 1
         Storage Index Write Requests: 2
 Storage Read Requests: 1
 Storage Rows Scanned: 1
 Storage Write Requests: 3
 Storage Flush Requests: 1
(11 rows)

EXPLAIN (ANALYZE, DIST, COSTS OFF) UPDATE t_simple SET v1 = v1 + 10, v3 = v3 + 1 WHERE k1 = 2;
                                QUERY PLAN                                
--------------------------------------------------------------------------
 Update on t_simple (actual rows=0 loops=1)
   ->  Index Scan using t_simple_pkey on t_simple (actual rows=1 loops=1)
         Index Cond: (k1 = 2)
         Storage Table Read Requests: 1
         Storage Table Rows Scanned: 1
         Storage Table Write Requests: 1
         Storage Index Write Requests: 2
 Storage Read Requests: 1
 Storage Rows Scanned: 1
 Storage Write Requests: 3
 Storage Flush Requests: 1
(11 rows)

EXPLAIN (ANALYZE, DIST, COSTS OFF) UPDATE t_simple SET v2 = v1 + 10, v3 = v3 + 1 WHERE k1 = 3;
                                QUERY PLAN                                
--------------------------------------------------------------------------
 Update on t_simple (actual rows=0 loops=1)
   ->  Index Scan using t_simple_pkey on t_simple (actual rows=1 loops=1)
         Index Cond: (k1 = 3)
         Storage Table Read Requests: 1
         Storage Table Rows Scanned: 1
         Storage Table Write Requests: 1
         Storage Index Write Requests: 2
 Storage Read Requests: 1
 Storage Rows Scanned: 1
 Storage Write Requests: 3
 Storage Flush Requests: 1
(11 rows)

-- Similaryly, updating the primary key should require a DELETE + INSERT
EXPLAIN (ANALYZE, DIST, COSTS OFF) UPDATE t_simple SET k2 = k2 + 10, v3 = v3 + 1 WHERE k1 = 4;
                                QUERY PLAN                                
--------------------------------------------------------------------------
 Update on t_simple (actual rows=0 loops=1)
   ->  Index Scan using t_simple_pkey on t_simple (actual rows=1 loops=1)
         Index Cond: (k1 = 4)
         Storage Table Read Requests: 1
         Storage Table Rows Scanned: 1
         Storage Table Write Requests: 2
         Storage Index Write Requests: 2
 Storage Read Requests: 1
 Storage Rows Scanned: 1
 Storage Write Requests: 4
 Storage Flush Requests: 1
(11 rows)

-- Updating non-key columns of the index should only require an UPDATE
EXPLAIN (ANALYZE, DIST, COSTS OFF) UPDATE t_simple SET v3 = v3 + 1, v4 = v4 + 1 WHERE k1 = 5;
                                QUERY PLAN                                
--------------------------------------------------------------------------
 Update on t_simple (actual rows=0 loops=1)
   ->  Index Scan using t_simple_pkey on t_simple (actual rows=1 loops=1)
         Index Cond: (k1 = 5)
         Storage Table Read Requests: 1
         Storage Table Rows Scanned: 1
         Storage Table Write Requests: 1
         Storage Index Write Requests: 1
 Storage Read Requests: 1
 Storage Rows Scanned: 1
 Storage Write Requests: 2
 Storage Flush Requests: 1
(11 rows)

/*+ IndexOnlyScan(t_simple simple_v1_v2_v3) */ SELECT v1, v2, v3 FROM t_simple WHERE v2 <= 5 ORDER BY (v1, v2);
 v1 | v2 | v3 
----+----+----
  4 |  4 |  5
  5 |  5 |  6
 12 |  2 |  3
(3 rows)

/*+ IndexScan(simple_v1_v2_v3) */ SELECT * FROM t_simple WHERE k1 <= 5 ORDER BY (v1, v2);
 k1 | k2 | v1 | v2 | v3 | v4 
----+----+----+----+----+----
  3 |  3 |  3 | 13 |  4 |  3
  4 | 14 |  4 |  4 |  5 |  4
  5 |  5 |  5 |  5 |  6 |  6
  1 |  1 | 11 | 11 |  1 |  1
  2 |  2 | 12 |  2 |  3 |  2
(5 rows)

DROP INDEX simple_v1_v2_v3;
-- Create an index that has columns out of order and repeat the test above.
CREATE INDEX NONCONCURRENTLY out_of_order_v1_v2_v3 ON t_simple ((v3, v1) HASH) INCLUDE (v2);
EXPLAIN (ANALYZE, DIST, COSTS OFF) UPDATE t_simple SET v1 = v1 + 10, v2 = v2 + 10 WHERE k1 = 1;
                                QUERY PLAN                                
--------------------------------------------------------------------------
 Update on t_simple (actual rows=0 loops=1)
   ->  Index Scan using t_simple_pkey on t_simple (actual rows=1 loops=1)
         Index Cond: (k1 = 1)
         Storage Table Read Requests: 1
         Storage Table Rows Scanned: 1
         Storage Table Write Requests: 1
         Storage Index Write Requests: 2
 Storage Read Requests: 1
 Storage Rows Scanned: 1
 Storage Write Requests: 3
 Storage Flush Requests: 1
(11 rows)

EXPLAIN (ANALYZE, DIST, COSTS OFF) UPDATE t_simple SET v1 = v1 + 10, v3 = v3 + 1 WHERE k1 = 2;
                                QUERY PLAN                                
--------------------------------------------------------------------------
 Update on t_simple (actual rows=0 loops=1)
   ->  Index Scan using t_simple_pkey on t_simple (actual rows=1 loops=1)
         Index Cond: (k1 = 2)
         Storage Table Read Requests: 1
         Storage Table Rows Scanned: 1
         Storage Table Write Requests: 1
         Storage Index Write Requests: 2
 Storage Read Requests: 1
 Storage Rows Scanned: 1
 Storage Write Requests: 3
 Storage Flush Requests: 1
(11 rows)

EXPLAIN (ANALYZE, DIST, COSTS OFF) UPDATE t_simple SET v2 = v1 + 10, v3 = v3 + 1 WHERE k1 = 3;
                                QUERY PLAN                                
--------------------------------------------------------------------------
 Update on t_simple (actual rows=0 loops=1)
   ->  Index Scan using t_simple_pkey on t_simple (actual rows=1 loops=1)
         Index Cond: (k1 = 3)
         Storage Table Read Requests: 1
         Storage Table Rows Scanned: 1
         Storage Table Write Requests: 1
         Storage Index Write Requests: 2
 Storage Read Requests: 1
 Storage Rows Scanned: 1
 Storage Write Requests: 3
 Storage Flush Requests: 1
(11 rows)

EXPLAIN (ANALYZE, DIST, COSTS OFF) UPDATE t_simple SET k2 = k2 + 10, v2 = v2 + 1 WHERE k1 = 1;
                                QUERY PLAN                                
--------------------------------------------------------------------------
 Update on t_simple (actual rows=0 loops=1)
   ->  Index Scan using t_simple_pkey on t_simple (actual rows=1 loops=1)
         Index Cond: (k1 = 1)
         Storage Table Read Requests: 1
         Storage Table Rows Scanned: 1
         Storage Table Write Requests: 2
         Storage Index Write Requests: 2
 Storage Read Requests: 1
 Storage Rows Scanned: 1
 Storage Write Requests: 4
 Storage Flush Requests: 1
(11 rows)

EXPLAIN (ANALYZE, DIST, COSTS OFF) UPDATE t_simple SET v2 = v2 + 1, v4 = v4 + 1 WHERE k1 = 1;
                                QUERY PLAN                                
--------------------------------------------------------------------------
 Update on t_simple (actual rows=0 loops=1)
   ->  Index Scan using t_simple_pkey on t_simple (actual rows=1 loops=1)
         Index Cond: (k1 = 1)
         Storage Table Read Requests: 1
         Storage Table Rows Scanned: 1
         Storage Table Write Requests: 1
         Storage Index Write Requests: 1
 Storage Read Requests: 1
 Storage Rows Scanned: 1
 Storage Write Requests: 2
 Storage Flush Requests: 1
(11 rows)

/*+ IndexOnlyScan(t_simple out_of_order_v1_v2_v3) */ SELECT v1, v2, v3 FROM t_simple WHERE v2 <= 5 ORDER BY (v1, v2);
 v1 | v2 | v3 
----+----+----
  4 |  4 |  5
  5 |  5 |  6
 22 |  2 |  4
(3 rows)

/*+ IndexScan(out_of_order_v1_v2_v3) */ SELECT * FROM t_simple WHERE k1 <= 5 ORDER BY (v1, v2);
 k1 | k2 | v1 | v2 | v3 | v4 
----+----+----+----+----+----
  3 |  3 |  3 | 13 |  5 |  3
  4 | 14 |  4 |  4 |  5 |  4
  5 |  5 |  5 |  5 |  6 |  6
  1 | 11 | 21 | 23 |  1 |  2
  2 |  2 | 22 |  2 |  4 |  2
(5 rows)

DROP INDEX out_of_order_v1_v2_v3;
-- Range indexes
--
-- Tests to validate index update behavior when the index contains NULL values
--
CREATE INDEX NONCONCURRENTLY simple_v1_v2_v3 ON t_simple (v1, v2) INCLUDE (v3);
EXPLAIN (ANALYZE, DIST, COSTS OFF) UPDATE t_simple SET v2 = NULL WHERE k1 = 1;
                                QUERY PLAN                                
--------------------------------------------------------------------------
 Update on t_simple (actual rows=0 loops=1)
   ->  Index Scan using t_simple_pkey on t_simple (actual rows=1 loops=1)
         Index Cond: (k1 = 1)
         Storage Table Read Requests: 1
         Storage Table Rows Scanned: 1
         Storage Table Write Requests: 1
         Storage Index Write Requests: 2
 Storage Read Requests: 1
 Storage Rows Scanned: 1
 Storage Write Requests: 3
 Storage Flush Requests: 1
(11 rows)

EXPLAIN (ANALYZE, DIST, COSTS OFF) UPDATE t_simple SET v2 = NULL, v3 = NULL WHERE k1 = 2;
                                QUERY PLAN                                
--------------------------------------------------------------------------
 Update on t_simple (actual rows=0 loops=1)
   ->  Index Scan using t_simple_pkey on t_simple (actual rows=1 loops=1)
         Index Cond: (k1 = 2)
         Storage Table Read Requests: 1
         Storage Table Rows Scanned: 1
         Storage Table Write Requests: 1
         Storage Index Write Requests: 2
 Storage Read Requests: 1
 Storage Rows Scanned: 1
 Storage Write Requests: 3
 Storage Flush Requests: 1
(11 rows)

EXPLAIN (ANALYZE, DIST, COSTS OFF) UPDATE t_simple SET v3 = NULL, v4 = NULL WHERE k1 = 3;
                                QUERY PLAN                                
--------------------------------------------------------------------------
 Update on t_simple (actual rows=0 loops=1)
   ->  Index Scan using t_simple_pkey on t_simple (actual rows=1 loops=1)
         Index Cond: (k1 = 3)
         Storage Table Read Requests: 1
         Storage Table Rows Scanned: 1
         Storage Table Write Requests: 1
         Storage Index Write Requests: 1
 Storage Read Requests: 1
 Storage Rows Scanned: 1
 Storage Write Requests: 2
 Storage Flush Requests: 1
(11 rows)

EXPLAIN (ANALYZE, DIST, COSTS OFF) UPDATE t_simple SET v1 = NULL WHERE k1 = 4;
                                QUERY PLAN                                
--------------------------------------------------------------------------
 Update on t_simple (actual rows=0 loops=1)
   ->  Index Scan using t_simple_pkey on t_simple (actual rows=1 loops=1)
         Index Cond: (k1 = 4)
         Storage Table Read Requests: 1
         Storage Table Rows Scanned: 1
         Storage Table Write Requests: 1
         Storage Index Write Requests: 2
 Storage Read Requests: 1
 Storage Rows Scanned: 1
 Storage Write Requests: 3
 Storage Flush Requests: 1
(11 rows)

EXPLAIN (ANALYZE, DIST, COSTS OFF) UPDATE t_simple SET v1 = NULL, v2 = NULL, v3 = NULL WHERE k1 = 5;
                                QUERY PLAN                                
--------------------------------------------------------------------------
 Update on t_simple (actual rows=0 loops=1)
   ->  Index Scan using t_simple_pkey on t_simple (actual rows=1 loops=1)
         Index Cond: (k1 = 5)
         Storage Table Read Requests: 1
         Storage Table Rows Scanned: 1
         Storage Table Write Requests: 1
         Storage Index Write Requests: 2
 Storage Read Requests: 1
 Storage Rows Scanned: 1
 Storage Write Requests: 3
 Storage Flush Requests: 1
(11 rows)

/*+ IndexOnlyScan(t_simple simple_v1_v2_v3) */ SELECT v1, v2, v3 FROM t_simple WHERE v1 <= 25 OR v1 IS NULL ORDER BY (v1, v2);
 v1 | v2 | v3 
----+----+----
  3 | 13 |   
  6 |  6 |  6
  7 |  7 |  7
  8 |  8 |  8
  9 |  9 |  9
 10 | 10 | 10
 21 |    |  1
 22 |    |   
    |  4 |  5
    |    |   
(10 rows)

/*+ IndexScan(simple_v1_v2_v3) */ SELECT * FROM t_simple WHERE k1 <= 5 ORDER BY (v1, v2);
 k1 | k2 | v1 | v2 | v3 | v4 
----+----+----+----+----+----
  3 |  3 |  3 | 13 |    |   
  1 | 11 | 21 |    |  1 |  2
  2 |  2 | 22 |    |    |  2
  4 | 14 |    |  4 |  5 |  4
  5 |  5 |    |    |    |  6
(5 rows)

EXPLAIN (ANALYZE, DIST, COSTS OFF) UPDATE t_simple SET v2 = 1 WHERE k1 = 1;
                                QUERY PLAN                                
--------------------------------------------------------------------------
 Update on t_simple (actual rows=0 loops=1)
   ->  Index Scan using t_simple_pkey on t_simple (actual rows=1 loops=1)
         Index Cond: (k1 = 1)
         Storage Table Read Requests: 1
         Storage Table Rows Scanned: 1
         Storage Table Write Requests: 1
         Storage Index Write Requests: 2
 Storage Read Requests: 1
 Storage Rows Scanned: 1
 Storage Write Requests: 3
 Storage Flush Requests: 1
(11 rows)

EXPLAIN (ANALYZE, DIST, COSTS OFF) UPDATE t_simple SET v2 = 2, v3 = k1 WHERE k1 = 2;
                                QUERY PLAN                                
--------------------------------------------------------------------------
 Update on t_simple (actual rows=0 loops=1)
   ->  Index Scan using t_simple_pkey on t_simple (actual rows=1 loops=1)
         Index Cond: (k1 = 2)
         Storage Table Read Requests: 1
         Storage Table Rows Scanned: 1
         Storage Table Write Requests: 1
         Storage Index Write Requests: 2
 Storage Read Requests: 1
 Storage Rows Scanned: 1
 Storage Write Requests: 3
 Storage Flush Requests: 1
(11 rows)

EXPLAIN (ANALYZE, DIST, COSTS OFF) UPDATE t_simple SET v4 = k1 - k2 + v1, v3 = 3 WHERE k1 = 3;
                                QUERY PLAN                                
--------------------------------------------------------------------------
 Update on t_simple (actual rows=0 loops=1)
   ->  Index Scan using t_simple_pkey on t_simple (actual rows=1 loops=1)
         Index Cond: (k1 = 3)
         Storage Table Read Requests: 1
         Storage Table Rows Scanned: 1
         Storage Table Write Requests: 1
         Storage Index Write Requests: 1
 Storage Read Requests: 1
 Storage Rows Scanned: 1
 Storage Write Requests: 2
 Storage Flush Requests: 1
(11 rows)

EXPLAIN (ANALYZE, DIST, COSTS OFF) UPDATE t_simple SET v1 = 4 WHERE k1 = 4;
                                QUERY PLAN                                
--------------------------------------------------------------------------
 Update on t_simple (actual rows=0 loops=1)
   ->  Index Scan using t_simple_pkey on t_simple (actual rows=1 loops=1)
         Index Cond: (k1 = 4)
         Storage Table Read Requests: 1
         Storage Table Rows Scanned: 1
         Storage Table Write Requests: 1
         Storage Index Write Requests: 2
 Storage Read Requests: 1
 Storage Rows Scanned: 1
 Storage Write Requests: 3
 Storage Flush Requests: 1
(11 rows)

EXPLAIN (ANALYZE, DIST, COSTS OFF) UPDATE t_simple SET v1 = 5, v2 = 5, v3 = 5 WHERE k1 = 5;
                                QUERY PLAN                                
--------------------------------------------------------------------------
 Update on t_simple (actual rows=0 loops=1)
   ->  Index Scan using t_simple_pkey on t_simple (actual rows=1 loops=1)
         Index Cond: (k1 = 5)
         Storage Table Read Requests: 1
         Storage Table Rows Scanned: 1
         Storage Table Write Requests: 1
         Storage Index Write Requests: 2
 Storage Read Requests: 1
 Storage Rows Scanned: 1
 Storage Write Requests: 3
 Storage Flush Requests: 1
(11 rows)

/*+ IndexOnlyScan(t_simple simple_v1_v2_v3) */ SELECT v1, v2, v3 FROM t_simple WHERE v1 <= 25 OR v1 IS NULL ORDER BY (v1, v2);
 v1 | v2 | v3 
----+----+----
  3 | 13 |  3
  4 |  4 |  5
  5 |  5 |  5
  6 |  6 |  6
  7 |  7 |  7
  8 |  8 |  8
  9 |  9 |  9
 10 | 10 | 10
 21 |  1 |  1
 22 |  2 |  2
(10 rows)

/*+ IndexScan(simple_v1_v2_v3) */ SELECT * FROM t_simple WHERE k1 <= 5 ORDER BY (v1, v2);
 k1 | k2 | v1 | v2 | v3 | v4 
----+----+----+----+----+----
  3 |  3 |  3 | 13 |  3 |  3
  4 | 14 |  4 |  4 |  5 |  4
  5 |  5 |  5 |  5 |  5 |  6
  1 | 11 | 21 |  1 |  1 |  2
  2 |  2 | 22 |  2 |  2 |  2
(5 rows)

DROP INDEX simple_v1_v2_v3;
-- Create a unique index with nullable values and repeat the tests above.
CREATE INDEX NONCONCURRENTLY simple_unique_v1_v2_v3 ON t_simple (v1, v2) INCLUDE (v3);
-- Setting any of the primary key columns to NULL should be done via a single UPDATE
-- Setting any of the secondary index key columns to NULL will still require the delete + update
EXPLAIN (ANALYZE, DIST, COSTS OFF) UPDATE t_simple SET v2 = NULL WHERE k1 = 1;
                                QUERY PLAN                                
--------------------------------------------------------------------------
 Update on t_simple (actual rows=0 loops=1)
   ->  Index Scan using t_simple_pkey on t_simple (actual rows=1 loops=1)
         Index Cond: (k1 = 1)
         Storage Table Read Requests: 1
         Storage Table Rows Scanned: 1
         Storage Table Write Requests: 1
         Storage Index Write Requests: 2
 Storage Read Requests: 1
 Storage Rows Scanned: 1
 Storage Write Requests: 3
 Storage Flush Requests: 1
(11 rows)

EXPLAIN (ANALYZE, DIST, COSTS OFF) UPDATE t_simple SET v2 = NULL, v3 = NULL WHERE k1 = 2;
                                QUERY PLAN                                
--------------------------------------------------------------------------
 Update on t_simple (actual rows=0 loops=1)
   ->  Index Scan using t_simple_pkey on t_simple (actual rows=1 loops=1)
         Index Cond: (k1 = 2)
         Storage Table Read Requests: 1
         Storage Table Rows Scanned: 1
         Storage Table Write Requests: 1
         Storage Index Write Requests: 2
 Storage Read Requests: 1
 Storage Rows Scanned: 1
 Storage Write Requests: 3
 Storage Flush Requests: 1
(11 rows)

EXPLAIN (ANALYZE, DIST, COSTS OFF) UPDATE t_simple SET v3 = NULL, v4 = NULL WHERE k1 = 3;
                                QUERY PLAN                                
--------------------------------------------------------------------------
 Update on t_simple (actual rows=0 loops=1)
   ->  Index Scan using t_simple_pkey on t_simple (actual rows=1 loops=1)
         Index Cond: (k1 = 3)
         Storage Table Read Requests: 1
         Storage Table Rows Scanned: 1
         Storage Table Write Requests: 1
         Storage Index Write Requests: 1
 Storage Read Requests: 1
 Storage Rows Scanned: 1
 Storage Write Requests: 2
 Storage Flush Requests: 1
(11 rows)

EXPLAIN (ANALYZE, DIST, COSTS OFF) UPDATE t_simple SET v1 = NULL WHERE k1 = 4;
                                QUERY PLAN                                
--------------------------------------------------------------------------
 Update on t_simple (actual rows=0 loops=1)
   ->  Index Scan using t_simple_pkey on t_simple (actual rows=1 loops=1)
         Index Cond: (k1 = 4)
         Storage Table Read Requests: 1
         Storage Table Rows Scanned: 1
         Storage Table Write Requests: 1
         Storage Index Write Requests: 2
 Storage Read Requests: 1
 Storage Rows Scanned: 1
 Storage Write Requests: 3
 Storage Flush Requests: 1
(11 rows)

EXPLAIN (ANALYZE, DIST, COSTS OFF) UPDATE t_simple SET v1 = NULL, v2 = NULL, v3 = NULL WHERE k1 = 5;
                                QUERY PLAN                                
--------------------------------------------------------------------------
 Update on t_simple (actual rows=0 loops=1)
   ->  Index Scan using t_simple_pkey on t_simple (actual rows=1 loops=1)
         Index Cond: (k1 = 5)
         Storage Table Read Requests: 1
         Storage Table Rows Scanned: 1
         Storage Table Write Requests: 1
         Storage Index Write Requests: 2
 Storage Read Requests: 1
 Storage Rows Scanned: 1
 Storage Write Requests: 3
 Storage Flush Requests: 1
(11 rows)

/*+ IndexOnlyScan(t_simple simple_unique_v1_v2_v3) */ SELECT v1, v2, v3 FROM t_simple WHERE v1 <= 25 OR v1 IS NULL ORDER BY (v1, v2);
 v1 | v2 | v3 
----+----+----
  3 | 13 |   
  6 |  6 |  6
  7 |  7 |  7
  8 |  8 |  8
  9 |  9 |  9
 10 | 10 | 10
 21 |    |  1
 22 |    |   
    |  4 |  5
    |    |   
(10 rows)

/*+ IndexScan(simple_unique_v1_v2_v3) */ SELECT * FROM t_simple WHERE k1 <= 5 ORDER BY (v1, v2);
 k1 | k2 | v1 | v2 | v3 | v4 
----+----+----+----+----+----
  3 |  3 |  3 | 13 |    |   
  1 | 11 | 21 |    |  1 |  2
  2 |  2 | 22 |    |    |  2
  4 | 14 |    |  4 |  5 |  4
  5 |  5 |    |    |    |  6
(5 rows)

EXPLAIN (ANALYZE, DIST, COSTS OFF) UPDATE t_simple SET v2 = 1 WHERE k1 = 1;
                                QUERY PLAN                                
--------------------------------------------------------------------------
 Update on t_simple (actual rows=0 loops=1)
   ->  Index Scan using t_simple_pkey on t_simple (actual rows=1 loops=1)
         Index Cond: (k1 = 1)
         Storage Table Read Requests: 1
         Storage Table Rows Scanned: 1
         Storage Table Write Requests: 1
         Storage Index Write Requests: 2
 Storage Read Requests: 1
 Storage Rows Scanned: 1
 Storage Write Requests: 3
 Storage Flush Requests: 1
(11 rows)

EXPLAIN (ANALYZE, DIST, COSTS OFF) UPDATE t_simple SET v2 = 2, v3 = k1 WHERE k1 = 2;
                                QUERY PLAN                                
--------------------------------------------------------------------------
 Update on t_simple (actual rows=0 loops=1)
   ->  Index Scan using t_simple_pkey on t_simple (actual rows=1 loops=1)
         Index Cond: (k1 = 2)
         Storage Table Read Requests: 1
         Storage Table Rows Scanned: 1
         Storage Table Write Requests: 1
         Storage Index Write Requests: 2
 Storage Read Requests: 1
 Storage Rows Scanned: 1
 Storage Write Requests: 3
 Storage Flush Requests: 1
(11 rows)

EXPLAIN (ANALYZE, DIST, COSTS OFF) UPDATE t_simple SET v4 = k1 - k2 + v1, v3 = 3 WHERE k1 = 3;
                                QUERY PLAN                                
--------------------------------------------------------------------------
 Update on t_simple (actual rows=0 loops=1)
   ->  Index Scan using t_simple_pkey on t_simple (actual rows=1 loops=1)
         Index Cond: (k1 = 3)
         Storage Table Read Requests: 1
         Storage Table Rows Scanned: 1
         Storage Table Write Requests: 1
         Storage Index Write Requests: 1
 Storage Read Requests: 1
 Storage Rows Scanned: 1
 Storage Write Requests: 2
 Storage Flush Requests: 1
(11 rows)

EXPLAIN (ANALYZE, DIST, COSTS OFF) UPDATE t_simple SET v1 = 4 WHERE k1 = 4;
                                QUERY PLAN                                
--------------------------------------------------------------------------
 Update on t_simple (actual rows=0 loops=1)
   ->  Index Scan using t_simple_pkey on t_simple (actual rows=1 loops=1)
         Index Cond: (k1 = 4)
         Storage Table Read Requests: 1
         Storage Table Rows Scanned: 1
         Storage Table Write Requests: 1
         Storage Index Write Requests: 2
 Storage Read Requests: 1
 Storage Rows Scanned: 1
 Storage Write Requests: 3
 Storage Flush Requests: 1
(11 rows)

EXPLAIN (ANALYZE, DIST, COSTS OFF) UPDATE t_simple SET v1 = 5, v2 = 5, v3 = 5 WHERE k1 = 5;
                                QUERY PLAN                                
--------------------------------------------------------------------------
 Update on t_simple (actual rows=0 loops=1)
   ->  Index Scan using t_simple_pkey on t_simple (actual rows=1 loops=1)
         Index Cond: (k1 = 5)
         Storage Table Read Requests: 1
         Storage Table Rows Scanned: 1
         Storage Table Write Requests: 1
         Storage Index Write Requests: 2
 Storage Read Requests: 1
 Storage Rows Scanned: 1
 Storage Write Requests: 3
 Storage Flush Requests: 1
(11 rows)

/*+ IndexOnlyScan(t_simple simple_unique_v1_v2_v3) */ SELECT v1, v2, v3 FROM t_simple WHERE v1 <= 25 OR v1 IS NULL ORDER BY (v1, v2);
 v1 | v2 | v3 
----+----+----
  3 | 13 |  3
  4 |  4 |  5
  5 |  5 |  5
  6 |  6 |  6
  7 |  7 |  7
  8 |  8 |  8
  9 |  9 |  9
 10 | 10 | 10
 21 |  1 |  1
 22 |  2 |  2
(10 rows)

/*+ IndexScan(simple_unique_v1_v2_v3) */ SELECT * FROM t_simple WHERE k1 <= 5 ORDER BY (v1, v2);
 k1 | k2 | v1 | v2 | v3 | v4 
----+----+----+----+----+----
  3 |  3 |  3 | 13 |  3 |  3
  4 | 14 |  4 |  4 |  5 |  4
  5 |  5 |  5 |  5 |  5 |  6
  1 | 11 | 21 |  1 |  1 |  2
  2 |  2 | 22 |  2 |  2 |  2
(5 rows)

DROP INDEX simple_unique_v1_v2_v3;
--
-- Tests to validate index update behavior for partial indexes
--
TRUNCATE t_simple;
INSERT INTO t_simple (SELECT i, i, i, i, i, i FROM generate_series(1, 10) AS i);
CREATE INDEX NONCONCURRENTLY simple_partial_or ON t_simple (v1, v2) INCLUDE (v3) WHERE v1 < 5 OR v2 < 10;
CREATE INDEX NONCONCURRENTLY simple_partial_and ON t_simple (v1, v2) INCLUDE (v3) WHERE v1 < 5 AND v2 < 10;
-- The row must be deleted from both indexes
EXPLAIN (ANALYZE, DIST, COSTS OFF) UPDATE t_simple SET v1 = 11, v2 = 10 WHERE k1 = 1;
                                QUERY PLAN                                
--------------------------------------------------------------------------
 Update on t_simple (actual rows=0 loops=1)
   ->  Index Scan using t_simple_pkey on t_simple (actual rows=1 loops=1)
         Index Cond: (k1 = 1)
         Storage Table Read Requests: 1
         Storage Table Rows Scanned: 1
         Storage Table Write Requests: 1
         Storage Index Write Requests: 2
 Storage Read Requests: 1
 Storage Rows Scanned: 1
 Storage Write Requests: 3
 Storage Flush Requests: 1
(11 rows)

-- The rows must be deleted from the AND index but not the OR index
EXPLAIN (ANALYZE, DIST, COSTS OFF) UPDATE t_simple SET v1 = 12, v2 = 8 WHERE k1 = 2;
                                QUERY PLAN                                
--------------------------------------------------------------------------
 Update on t_simple (actual rows=0 loops=1)
   ->  Index Scan using t_simple_pkey on t_simple (actual rows=1 loops=1)
         Index Cond: (k1 = 2)
         Storage Table Read Requests: 1
         Storage Table Rows Scanned: 1
         Storage Table Write Requests: 1
         Storage Index Write Requests: 3
 Storage Read Requests: 1
 Storage Rows Scanned: 1
 Storage Write Requests: 4
 Storage Flush Requests: 1
(11 rows)

EXPLAIN (ANALYZE, DIST, COSTS OFF) UPDATE t_simple SET v2 = 15 WHERE k1 = 3;
                                QUERY PLAN                                
--------------------------------------------------------------------------
 Update on t_simple (actual rows=0 loops=1)
   ->  Index Scan using t_simple_pkey on t_simple (actual rows=1 loops=1)
         Index Cond: (k1 = 3)
         Storage Table Read Requests: 1
         Storage Table Rows Scanned: 1
         Storage Table Write Requests: 1
         Storage Index Write Requests: 3
 Storage Read Requests: 1
 Storage Rows Scanned: 1
 Storage Write Requests: 4
 Storage Flush Requests: 1
(11 rows)

-- Modifying the INCLUDE columns should have no impact on the index
EXPLAIN (ANALYZE, DIST, COSTS OFF) UPDATE t_simple SET v3 = v3 + 10 WHERE k1 = 6;
                                QUERY PLAN                                
--------------------------------------------------------------------------
 Update on t_simple (actual rows=0 loops=1)
   ->  Index Scan using t_simple_pkey on t_simple (actual rows=1 loops=1)
         Index Cond: (k1 = 6)
         Storage Table Read Requests: 1
         Storage Table Rows Scanned: 1
         Storage Table Write Requests: 1
         Storage Index Write Requests: 1
 Storage Read Requests: 1
 Storage Rows Scanned: 1
 Storage Write Requests: 2
 Storage Flush Requests: 1
(11 rows)

-- The row must be inserted into both indexes
EXPLAIN (ANALYZE, DIST, COSTS OFF) UPDATE t_simple SET v1 = 5, v2 = -5 WHERE k1 = 1;
                                QUERY PLAN                                
--------------------------------------------------------------------------
 Update on t_simple (actual rows=0 loops=1)
   ->  Index Scan using t_simple_pkey on t_simple (actual rows=1 loops=1)
         Index Cond: (k1 = 1)
         Storage Table Read Requests: 1
         Storage Table Rows Scanned: 1
         Storage Table Write Requests: 1
         Storage Index Write Requests: 1
 Storage Read Requests: 1
 Storage Rows Scanned: 1
 Storage Write Requests: 2
 Storage Flush Requests: 1
(11 rows)

-- The row must be inserted into one of the indexes but not the other
EXPLAIN (ANALYZE, DIST, COSTS OFF) UPDATE t_simple SET v1 = 4 WHERE k1 = 2;
                                QUERY PLAN                                
--------------------------------------------------------------------------
 Update on t_simple (actual rows=0 loops=1)
   ->  Index Scan using t_simple_pkey on t_simple (actual rows=1 loops=1)
         Index Cond: (k1 = 2)
         Storage Table Read Requests: 1
         Storage Table Rows Scanned: 1
         Storage Table Write Requests: 1
         Storage Index Write Requests: 3
 Storage Read Requests: 1
 Storage Rows Scanned: 1
 Storage Write Requests: 4
 Storage Flush Requests: 1
(11 rows)

EXPLAIN (ANALYZE, DIST, COSTS OFF) UPDATE t_simple SET v1 = 4, v2 = 8, v3 = 100 WHERE k1 = 7;
                                QUERY PLAN                                
--------------------------------------------------------------------------
 Update on t_simple (actual rows=0 loops=1)
   ->  Index Scan using t_simple_pkey on t_simple (actual rows=1 loops=1)
         Index Cond: (k1 = 7)
         Storage Table Read Requests: 1
         Storage Table Rows Scanned: 1
         Storage Table Write Requests: 1
         Storage Index Write Requests: 3
 Storage Read Requests: 1
 Storage Rows Scanned: 1
 Storage Write Requests: 4
 Storage Flush Requests: 1
(11 rows)

-- Modifying the primary key columns should neither delete nor insert into the index
EXPLAIN (ANALYZE, DIST, COSTS OFF) UPDATE t_simple SET k2 = k1 + 10, v3 = v3 + 1 WHERE k1 = 8;
                                QUERY PLAN                                
--------------------------------------------------------------------------
 Update on t_simple (actual rows=0 loops=1)
   ->  Index Scan using t_simple_pkey on t_simple (actual rows=1 loops=1)
         Index Cond: (k1 = 8)
         Storage Table Read Requests: 1
         Storage Table Rows Scanned: 1
         Storage Table Write Requests: 2
         Storage Index Write Requests: 2
 Storage Read Requests: 1
 Storage Rows Scanned: 1
 Storage Write Requests: 4
 Storage Flush Requests: 1
(11 rows)

/*+ IndexOnlyScan(t_simple simple_partial_or) */ SELECT v1, v2, v3 FROM t_simple WHERE v1 < 5 OR v2 < 10 ORDER BY (v1, v2);
 v1 | v2 | v3  
----+----+-----
  3 | 15 |   3
  4 |  4 |   4
  4 |  8 | 100
  4 |  8 |   2
  5 | -5 |   1
  5 |  5 |   5
  6 |  6 |  16
  8 |  8 |   9
  9 |  9 |   9
(9 rows)

/*+ IndexScan(simple_unique_v1_v2_v3) */ SELECT * FROM t_simple WHERE v1 < 5 OR v2 < 10 ORDER BY (v1, v2);
 k1 | k2 | v1 | v2 | v3  | v4 
----+----+----+----+-----+----
  3 |  3 |  3 | 15 |   3 |  3
  4 |  4 |  4 |  4 |   4 |  4
  2 |  2 |  4 |  8 |   2 |  2
  7 |  7 |  4 |  8 | 100 |  7
  1 |  1 |  5 | -5 |   1 |  1
  5 |  5 |  5 |  5 |   5 |  5
  6 |  6 |  6 |  6 |  16 |  6
  8 | 18 |  8 |  8 |   9 |  8
  9 |  9 |  9 |  9 |   9 |  9
(9 rows)

/*+ IndexOnlyScan(t_simple simple_partial_and) */ SELECT v1, v2, v3 FROM t_simple WHERE v1 < 5 AND v2 < 10 ORDER BY (v1, v2);
 v1 | v2 | v3  
----+----+-----
  4 |  4 |   4
  4 |  8 | 100
  4 |  8 |   2
(3 rows)

/*+ IndexScan(simple_unique_v1_v2_v3) */ SELECT * FROM t_simple WHERE v1 < 5 AND v2 < 10 ORDER BY (v1, v2);
 k1 | k2 | v1 | v2 | v3  | v4 
----+----+----+----+-----+----
  4 |  4 |  4 |  4 |   4 |  4
  7 |  7 |  4 |  8 | 100 |  7
  2 |  2 |  4 |  8 |   2 |  2
(3 rows)

SELECT * FROM t_simple;
 k1 | k2 | v1 | v2 | v3  | v4 
----+----+----+----+-----+----
  5 |  5 |  5 |  5 |   5 |  5
  1 |  1 |  5 | -5 |   1 |  1
  6 |  6 |  6 |  6 |  16 |  6
  7 |  7 |  4 |  8 | 100 |  7
  9 |  9 |  9 |  9 |   9 |  9
 10 | 10 | 10 | 10 |  10 | 10
  4 |  4 |  4 |  4 |   4 |  4
  2 |  2 |  4 |  8 |   2 |  2
  8 | 18 |  8 |  8 |   9 |  8
  3 |  3 |  3 | 15 |   3 |  3
(10 rows)

DROP INDEX simple_partial_or;
DROP INDEX simple_partial_and;
--
-- Tests to validate index update behavior for expression indexes
--
TRUNCATE t_simple;
INSERT INTO t_simple (SELECT i, i, i, i, i, i FROM generate_series(1, 10) AS i);
CREATE UNIQUE INDEX NONCONCURRENTLY simple_expr ON t_simple ((v1 + 10)) INCLUDE (v3);
-- Updating any of the columns making up the expression should require a DELETE + INSERT
EXPLAIN (ANALYZE, DIST, COSTS OFF) UPDATE t_simple SET v1 = 11 WHERE k1 = 1;
                                QUERY PLAN                                
--------------------------------------------------------------------------
 Update on t_simple (actual rows=0 loops=1)
   ->  Index Scan using t_simple_pkey on t_simple (actual rows=1 loops=1)
         Index Cond: (k1 = 1)
         Storage Table Read Requests: 1
         Storage Table Rows Scanned: 1
         Storage Table Write Requests: 1
         Storage Index Write Requests: 2
 Storage Read Requests: 1
 Storage Rows Scanned: 1
 Storage Write Requests: 3
 Storage Flush Requests: 1
(11 rows)

-- Any other column update should only require an UPDATE
EXPLAIN (ANALYZE, DIST, COSTS OFF) UPDATE t_simple SET k2 = k2 + 1 WHERE k1 = 2;
                                QUERY PLAN                                
--------------------------------------------------------------------------
 Update on t_simple (actual rows=0 loops=1)
   ->  Index Scan using t_simple_pkey on t_simple (actual rows=1 loops=1)
         Index Cond: (k1 = 2)
         Storage Table Read Requests: 1
         Storage Table Rows Scanned: 1
         Storage Table Write Requests: 2
         Storage Index Write Requests: 2
 Storage Read Requests: 1
 Storage Rows Scanned: 1
 Storage Write Requests: 4
 Storage Flush Requests: 1
(11 rows)

EXPLAIN (ANALYZE, DIST, COSTS OFF) UPDATE t_simple SET k1 = k1 + 10 WHERE k1 = 3;
                                QUERY PLAN                                
--------------------------------------------------------------------------
 Update on t_simple (actual rows=0 loops=1)
   ->  Index Scan using t_simple_pkey on t_simple (actual rows=1 loops=1)
         Index Cond: (k1 = 3)
         Storage Table Read Requests: 1
         Storage Table Rows Scanned: 1
         Storage Table Write Requests: 2
         Storage Index Write Requests: 2
 Storage Read Requests: 1
 Storage Rows Scanned: 1
 Storage Write Requests: 4
 Storage Flush Requests: 1
(11 rows)

EXPLAIN (ANALYZE, DIST, COSTS OFF) UPDATE t_simple SET k2 = k2 + 5, v3 = v3 + 5 WHERE k1 = 4;
                                QUERY PLAN                                
--------------------------------------------------------------------------
 Update on t_simple (actual rows=0 loops=1)
   ->  Index Scan using t_simple_pkey on t_simple (actual rows=1 loops=1)
         Index Cond: (k1 = 4)
         Storage Table Read Requests: 1
         Storage Table Rows Scanned: 1
         Storage Table Write Requests: 2
         Storage Index Write Requests: 2
 Storage Read Requests: 1
 Storage Rows Scanned: 1
 Storage Write Requests: 4
 Storage Flush Requests: 1
(11 rows)

/*+ IndexScan(simple_expr) */ SELECT *, v1 + 10 FROM t_simple WHERE v1 + 10 IN (21, 12, 13, 14, 15, 16, 17, 18, 19, 20) ORDER BY (v1, v2);
 k1 | k2 | v1 | v2 | v3 | v4 | ?column? 
----+----+----+----+----+----+----------
  2 |  3 |  2 |  2 |  2 |  2 |       12
 13 |  3 |  3 |  3 |  3 |  3 |       13
  4 |  9 |  4 |  4 |  9 |  4 |       14
  5 |  5 |  5 |  5 |  5 |  5 |       15
  6 |  6 |  6 |  6 |  6 |  6 |       16
  7 |  7 |  7 |  7 |  7 |  7 |       17
  8 |  8 |  8 |  8 |  8 |  8 |       18
  9 |  9 |  9 |  9 |  9 |  9 |       19
 10 | 10 | 10 | 10 | 10 | 10 |       20
  1 |  1 | 11 |  1 |  1 |  1 |       21
(10 rows)

SELECT * FROM t_simple;
 k1 | k2 | v1 | v2 | v3 | v4 
----+----+----+----+----+----
  5 |  5 |  5 |  5 |  5 |  5
  1 |  1 | 11 |  1 |  1 |  1
 13 |  3 |  3 |  3 |  3 |  3
  6 |  6 |  6 |  6 |  6 |  6
  7 |  7 |  7 |  7 |  7 |  7
  9 |  9 |  9 |  9 |  9 |  9
 10 | 10 | 10 | 10 | 10 | 10
  4 |  9 |  4 |  4 |  9 |  4
  2 |  3 |  2 |  2 |  2 |  2
  8 |  8 |  8 |  8 |  8 |  8
(10 rows)

-- CREATE INDEX NONCONCURRENTLY complex_expr_v2 ON t_simple ((v1 * v2), v3) INCLUDE (v4);
--
-- Tests to validate multiple include columns
--
TRUNCATE t_simple;
INSERT INTO t_simple (SELECT i, i, i, i, i, i FROM generate_series(1, 10) AS i);
CREATE UNIQUE INDEX NONCONCURRENTLY multi_include ON t_simple (v1, v2) INCLUDE (v4, v3, v2);
-- Updating any of the key columns should require a DELETE + INSERT
EXPLAIN (ANALYZE, DIST, COSTS OFF) UPDATE t_simple SET v1 = 11 WHERE k1 = 1;
                                QUERY PLAN                                
--------------------------------------------------------------------------
 Update on t_simple (actual rows=0 loops=1)
   ->  Index Scan using t_simple_pkey on t_simple (actual rows=1 loops=1)
         Index Cond: (k1 = 1)
         Storage Table Read Requests: 1
         Storage Table Rows Scanned: 1
         Storage Table Write Requests: 1
         Storage Index Write Requests: 4
 Storage Read Requests: 1
 Storage Rows Scanned: 1
 Storage Write Requests: 5
 Storage Flush Requests: 1
(11 rows)

EXPLAIN (ANALYZE, DIST, COSTS OFF) UPDATE t_simple SET v2 = v2 + 1 WHERE k1 = 2;
                                QUERY PLAN                                
--------------------------------------------------------------------------
 Update on t_simple (actual rows=0 loops=1)
   ->  Index Scan using t_simple_pkey on t_simple (actual rows=1 loops=1)
         Index Cond: (k1 = 2)
         Storage Table Read Requests: 1
         Storage Table Rows Scanned: 1
         Storage Table Write Requests: 1
         Storage Index Write Requests: 2
 Storage Read Requests: 1
 Storage Rows Scanned: 1
 Storage Write Requests: 3
 Storage Flush Requests: 1
(11 rows)

EXPLAIN (ANALYZE, DIST, COSTS OFF) UPDATE t_simple SET v1 = v2 + 10, v2 = v1 + 1 WHERE k1 = 3;
                                QUERY PLAN                                
--------------------------------------------------------------------------
 Update on t_simple (actual rows=0 loops=1)
   ->  Index Scan using t_simple_pkey on t_simple (actual rows=1 loops=1)
         Index Cond: (k1 = 3)
         Storage Table Read Requests: 1
         Storage Table Rows Scanned: 1
         Storage Table Write Requests: 1
         Storage Index Write Requests: 4
 Storage Read Requests: 1
 Storage Rows Scanned: 1
 Storage Write Requests: 5
 Storage Flush Requests: 1
(11 rows)

-- Any other column update should only require an UPDATE
EXPLAIN (ANALYZE, DIST, COSTS OFF) UPDATE t_simple SET v3 = v3 + 1 WHERE k1 = 4;
                                QUERY PLAN                                
--------------------------------------------------------------------------
 Update on t_simple (actual rows=0 loops=1)
   ->  Index Scan using t_simple_pkey on t_simple (actual rows=1 loops=1)
         Index Cond: (k1 = 4)
         Storage Table Read Requests: 1
         Storage Table Rows Scanned: 1
         Storage Table Write Requests: 1
         Storage Index Write Requests: 2
 Storage Read Requests: 1
 Storage Rows Scanned: 1
 Storage Write Requests: 3
 Storage Flush Requests: 1
(11 rows)

EXPLAIN (ANALYZE, DIST, COSTS OFF) UPDATE t_simple SET v3 = v4, v4 = v3 WHERE k1 = 5;
                                QUERY PLAN                                
--------------------------------------------------------------------------
 Update on t_simple (actual rows=0 loops=1)
   ->  Index Scan using t_simple_pkey on t_simple (actual rows=1 loops=1)
         Index Cond: (k1 = 5)
         Storage Table Read Requests: 1
         Storage Table Rows Scanned: 1
         Storage Table Write Requests: 1
 Storage Read Requests: 1
 Storage Rows Scanned: 1
 Storage Write Requests: 1
 Storage Flush Requests: 1
(10 rows)

EXPLAIN (ANALYZE, DIST, COSTS OFF) UPDATE t_simple SET v4 = v2 + 1 WHERE k1 = 6;
                                QUERY PLAN                                
--------------------------------------------------------------------------
 Update on t_simple (actual rows=0 loops=1)
   ->  Index Scan using t_simple_pkey on t_simple (actual rows=1 loops=1)
         Index Cond: (k1 = 6)
         Storage Table Read Requests: 1
         Storage Table Rows Scanned: 1
         Storage Table Write Requests: 1
         Storage Index Write Requests: 1
 Storage Read Requests: 1
 Storage Rows Scanned: 1
 Storage Write Requests: 2
 Storage Flush Requests: 1
(11 rows)

EXPLAIN (ANALYZE, DIST, COSTS OFF) UPDATE t_simple SET k1 = k1 + 10, k2 = k2 + 1 WHERE k1 = 7;
                                QUERY PLAN                                
--------------------------------------------------------------------------
 Update on t_simple (actual rows=0 loops=1)
   ->  Index Scan using t_simple_pkey on t_simple (actual rows=1 loops=1)
         Index Cond: (k1 = 7)
         Storage Table Read Requests: 1
         Storage Table Rows Scanned: 1
         Storage Table Write Requests: 2
         Storage Index Write Requests: 3
 Storage Read Requests: 1
 Storage Rows Scanned: 1
 Storage Write Requests: 5
 Storage Flush Requests: 1
(11 rows)

EXPLAIN (ANALYZE, DIST, COSTS OFF) UPDATE t_simple SET k1 = k1 + 10, k2 = k2 + 1 WHERE k1 = 8;
                                QUERY PLAN                                
--------------------------------------------------------------------------
 Update on t_simple (actual rows=0 loops=1)
   ->  Index Scan using t_simple_pkey on t_simple (actual rows=1 loops=1)
         Index Cond: (k1 = 8)
         Storage Table Read Requests: 1
         Storage Table Rows Scanned: 1
         Storage Table Write Requests: 2
         Storage Index Write Requests: 3
 Storage Read Requests: 1
 Storage Rows Scanned: 1
 Storage Write Requests: 5
 Storage Flush Requests: 1
(11 rows)

EXPLAIN (VERBOSE) /*+ IndexOnlyScan(t_simple multi_include) */ SELECT v1, v2, v3, v4 FROM t_simple ORDER BY (v1, v2);
WARNING:  GUC yb_explain_hide_non_deterministic_fields disables EXPLAIN option VERBOSE
                                          QUERY PLAN                                           
-----------------------------------------------------------------------------------------------
 Sort  (cost=163.83..166.33 rows=1000 width=48)
   Sort Key: (ROW(v1, v2))
   ->  Index Only Scan using multi_include on t_simple  (cost=0.00..114.00 rows=1000 width=48)
(3 rows)

/*+ IndexOnlyScan(t_simple multi_include) */ SELECT v1, v2, v3, v4 FROM t_simple ORDER BY (v1, v2);
 v1 | v2 | v3 | v4 
----+----+----+----
  2 |  3 |  2 |  2
  4 |  4 |  5 |  4
  5 |  5 |  5 |  5
  6 |  6 |  6 |  7
  7 |  7 |  7 |  7
  8 |  8 |  8 |  8
  9 |  9 |  9 |  9
 10 | 10 | 10 | 10
 11 |  1 |  1 |  1
 13 |  4 |  3 |  3
(10 rows)

EXPLAIN (VERBOSE) /*+ IndexScan(multi_include) */ SELECT * FROM t_simple ORDER BY (v1, v2);
WARNING:  GUC yb_explain_hide_non_deterministic_fields disables EXPLAIN option VERBOSE
                             QUERY PLAN                             
--------------------------------------------------------------------
 Sort  (cost=149.83..152.33 rows=1000 width=56)
   Sort Key: (ROW(v1, v2))
   ->  Seq Scan on t_simple  (cost=0.00..100.00 rows=1000 width=56)
(3 rows)

/*+ IndexScan(multi_include) */ SELECT * FROM t_simple ORDER BY (v1, v2);
 k1 | k2 | v1 | v2 | v3 | v4 
----+----+----+----+----+----
  2 |  2 |  2 |  3 |  2 |  2
  4 |  4 |  4 |  4 |  5 |  4
  5 |  5 |  5 |  5 |  5 |  5
  6 |  6 |  6 |  6 |  6 |  7
 17 |  8 |  7 |  7 |  7 |  7
 18 |  9 |  8 |  8 |  8 |  8
  9 |  9 |  9 |  9 |  9 |  9
 10 | 10 | 10 | 10 | 10 | 10
  1 |  1 | 11 |  1 |  1 |  1
  3 |  3 | 13 |  4 |  3 |  3
(10 rows)

SELECT * FROM t_simple;
 k1 | k2 | v1 | v2 | v3 | v4 
----+----+----+----+----+----
  5 |  5 |  5 |  5 |  5 |  5
  1 |  1 | 11 |  1 |  1 |  1
  6 |  6 |  6 |  6 |  6 |  7
  9 |  9 |  9 |  9 |  9 |  9
 17 |  8 |  7 |  7 |  7 |  7
 10 | 10 | 10 | 10 | 10 | 10
  4 |  4 |  4 |  4 |  5 |  4
 18 |  9 |  8 |  8 |  8 |  8
  2 |  2 |  2 |  3 |  2 |  2
  3 |  3 | 13 |  4 |  3 |  3
(10 rows)

--
-- Additional coverage for hidden unique index key suffix changes.
--
SET yb_enable_inplace_index_update TO on;
DROP TABLE IF EXISTS t_unique_key_update;
NOTICE:  table "t_unique_key_update" does not exist, skipping
CREATE TABLE t_unique_key_update (
  h INT,
  r INT,
  k INT,
  a INT,
  b INT,
  active BOOLEAN DEFAULT true,
  PRIMARY KEY ((h) HASH, r ASC, k ASC)
);
CREATE UNIQUE INDEX NONCONCURRENTLY t_unique_key_update_uq
ON t_unique_key_update (a ASC, b ASC);
INSERT INTO t_unique_key_update (h, r, k, a, b) VALUES
  (1, 1, 0, NULL, 10),
  (1, 2, 0, 20, 20),
  (1, 3, 0, NULL, 30),
  (1, 4, 0, NULL, 40);
-- Non-expression unique index: key changes from NULL to not-NULL.
EXPLAIN (ANALYZE, DIST, COSTS OFF)
UPDATE t_unique_key_update SET a = 10 WHERE h = 1 AND r = 1;
                                           QUERY PLAN                                           
------------------------------------------------------------------------------------------------
 Update on t_unique_key_update (actual rows=0 loops=1)
   ->  Index Scan using t_unique_key_update_pkey on t_unique_key_update (actual rows=1 loops=1)
         Index Cond: ((h = 1) AND (r = 1))
         Storage Table Read Requests: 1
         Storage Table Read Ops: 1
         Storage Table Rows Scanned: 1
         Storage Table Write Requests: 1
         Storage Index Write Requests: 2
 Storage Read Requests: 1
 Storage Read Ops: 1
 Storage Rows Scanned: 1
 Storage Write Requests: 3
 Storage Flush Requests: 1
(13 rows)

-- Non-expression unique index: key changes from not-NULL to NULL.
EXPLAIN (ANALYZE, DIST, COSTS OFF)
UPDATE t_unique_key_update SET a = NULL WHERE h = 1 AND r = 2;
                                           QUERY PLAN                                           
------------------------------------------------------------------------------------------------
 Update on t_unique_key_update (actual rows=0 loops=1)
   ->  Index Scan using t_unique_key_update_pkey on t_unique_key_update (actual rows=1 loops=1)
         Index Cond: ((h = 1) AND (r = 2))
         Storage Table Read Requests: 1
         Storage Table Read Ops: 1
         Storage Table Rows Scanned: 1
         Storage Table Write Requests: 1
         Storage Index Write Requests: 2
 Storage Read Requests: 1
 Storage Read Ops: 1
 Storage Rows Scanned: 1
 Storage Write Requests: 3
 Storage Flush Requests: 1
(13 rows)

-- Non-expression unique index: key is NULL; primary key update.
EXPLAIN (ANALYZE, DIST, COSTS OFF)
UPDATE t_unique_key_update SET k = 1 WHERE h = 1 AND r = 3 AND k = 0;
                                           QUERY PLAN                                           
------------------------------------------------------------------------------------------------
 Update on t_unique_key_update (actual rows=0 loops=1)
   ->  Index Scan using t_unique_key_update_pkey on t_unique_key_update (actual rows=1 loops=1)
         Index Cond: ((h = 1) AND (r = 3) AND (k = 0))
         Storage Table Read Requests: 1
         Storage Table Read Ops: 1
         Storage Table Rows Scanned: 1
         Storage Table Write Requests: 2
         Storage Index Write Requests: 2
 Storage Read Requests: 1
 Storage Read Ops: 1
 Storage Rows Scanned: 1
 Storage Write Requests: 4
 Storage Flush Requests: 1
(13 rows)

-- Non-expression unique index: some keys are NULL; another key becomes NULL.
EXPLAIN (ANALYZE, DIST, COSTS OFF)
UPDATE t_unique_key_update SET b = NULL WHERE h = 1 AND r = 4;
                                           QUERY PLAN                                           
------------------------------------------------------------------------------------------------
 Update on t_unique_key_update (actual rows=0 loops=1)
   ->  Index Scan using t_unique_key_update_pkey on t_unique_key_update (actual rows=1 loops=1)
         Index Cond: ((h = 1) AND (r = 4))
         Storage Table Read Requests: 1
         Storage Table Read Ops: 1
         Storage Table Rows Scanned: 1
         Storage Table Write Requests: 1
         Storage Index Write Requests: 2
 Storage Read Requests: 1
 Storage Read Ops: 1
 Storage Rows Scanned: 1
 Storage Write Requests: 3
 Storage Flush Requests: 1
(13 rows)

SELECT yb_index_check('t_unique_key_update_uq'::regclass);
 yb_index_check 
----------------
 
(1 row)

SELECT * FROM t_unique_key_update ORDER BY h, r, k;
 h | r | k | a  | b  | active 
---+---+---+----+----+--------
 1 | 1 | 0 | 10 | 10 | t
 1 | 2 | 0 |    | 20 | t
 1 | 3 | 1 |    | 30 | t
 1 | 4 | 0 |    |    | t
(4 rows)

DROP TABLE t_unique_key_update;
DROP TABLE IF EXISTS t_unique_key_update_nnd;
NOTICE:  table "t_unique_key_update_nnd" does not exist, skipping
CREATE TABLE t_unique_key_update_nnd (
  h INT,
  r INT,
  k INT,
  a INT,
  b INT,
  active BOOLEAN DEFAULT true,
  PRIMARY KEY ((h) HASH, r ASC, k ASC)
);
CREATE UNIQUE INDEX NONCONCURRENTLY t_unique_key_update_nnd_uq
ON t_unique_key_update_nnd (a ASC, b ASC) NULLS NOT DISTINCT;
INSERT INTO t_unique_key_update_nnd (h, r, k, a, b) VALUES
  (2, 1, 0, NULL, 10),
  (2, 2, 0, 20, 20),
  (2, 3, 0, NULL, 30),
  (2, 4, 0, NULL, 40);
-- Non-expression unique NULLS NOT DISTINCT index: key changes from NULL to not-NULL.
EXPLAIN (ANALYZE, DIST, COSTS OFF)
UPDATE t_unique_key_update_nnd SET a = 10 WHERE h = 2 AND r = 1;
                                               QUERY PLAN                                               
--------------------------------------------------------------------------------------------------------
 Update on t_unique_key_update_nnd (actual rows=0 loops=1)
   ->  Index Scan using t_unique_key_update_nnd_pkey on t_unique_key_update_nnd (actual rows=1 loops=1)
         Index Cond: ((h = 2) AND (r = 1))
         Storage Table Read Requests: 1
         Storage Table Read Ops: 1
         Storage Table Rows Scanned: 1
         Storage Table Write Requests: 1
         Storage Index Write Requests: 2
 Storage Read Requests: 1
 Storage Read Ops: 1
 Storage Rows Scanned: 1
 Storage Write Requests: 3
 Storage Flush Requests: 1
(13 rows)

-- Non-expression unique NULLS NOT DISTINCT index: key changes from not-NULL to NULL.
EXPLAIN (ANALYZE, DIST, COSTS OFF)
UPDATE t_unique_key_update_nnd SET a = NULL WHERE h = 2 AND r = 2;
                                               QUERY PLAN                                               
--------------------------------------------------------------------------------------------------------
 Update on t_unique_key_update_nnd (actual rows=0 loops=1)
   ->  Index Scan using t_unique_key_update_nnd_pkey on t_unique_key_update_nnd (actual rows=1 loops=1)
         Index Cond: ((h = 2) AND (r = 2))
         Storage Table Read Requests: 1
         Storage Table Read Ops: 1
         Storage Table Rows Scanned: 1
         Storage Table Write Requests: 1
         Storage Index Write Requests: 2
 Storage Read Requests: 1
 Storage Read Ops: 1
 Storage Rows Scanned: 1
 Storage Write Requests: 3
 Storage Flush Requests: 1
(13 rows)

-- Non-expression unique NULLS NOT DISTINCT index: key is NULL; primary key update.
EXPLAIN (ANALYZE, DIST, COSTS OFF)
UPDATE t_unique_key_update_nnd SET k = 1 WHERE h = 2 AND r = 3 AND k = 0;
                                               QUERY PLAN                                               
--------------------------------------------------------------------------------------------------------
 Update on t_unique_key_update_nnd (actual rows=0 loops=1)
   ->  Index Scan using t_unique_key_update_nnd_pkey on t_unique_key_update_nnd (actual rows=1 loops=1)
         Index Cond: ((h = 2) AND (r = 3) AND (k = 0))
         Storage Table Read Requests: 1
         Storage Table Read Ops: 1
         Storage Table Rows Scanned: 1
         Storage Table Write Requests: 2
         Storage Index Write Requests: 1
 Storage Read Requests: 1
 Storage Read Ops: 1
 Storage Rows Scanned: 1
 Storage Write Requests: 3
 Storage Flush Requests: 1
(13 rows)

-- Non-expression unique NULLS NOT DISTINCT index: some keys are NULL; another key becomes NULL.
EXPLAIN (ANALYZE, DIST, COSTS OFF)
UPDATE t_unique_key_update_nnd SET b = NULL WHERE h = 2 AND r = 4;
                                               QUERY PLAN                                               
--------------------------------------------------------------------------------------------------------
 Update on t_unique_key_update_nnd (actual rows=0 loops=1)
   ->  Index Scan using t_unique_key_update_nnd_pkey on t_unique_key_update_nnd (actual rows=1 loops=1)
         Index Cond: ((h = 2) AND (r = 4))
         Storage Table Read Requests: 1
         Storage Table Read Ops: 1
         Storage Table Rows Scanned: 1
         Storage Table Write Requests: 1
         Storage Index Write Requests: 2
 Storage Read Requests: 1
 Storage Read Ops: 1
 Storage Rows Scanned: 1
 Storage Write Requests: 3
 Storage Flush Requests: 1
(13 rows)

SELECT yb_index_check('t_unique_key_update_nnd_uq'::regclass);
 yb_index_check 
----------------
 
(1 row)

SELECT * FROM t_unique_key_update_nnd ORDER BY h, r, k;
 h | r | k | a  | b  | active 
---+---+---+----+----+--------
 2 | 1 | 0 | 10 | 10 | t
 2 | 2 | 0 |    | 20 | t
 2 | 3 | 1 |    | 30 | t
 2 | 4 | 0 |    |    | t
(4 rows)

DROP TABLE t_unique_key_update_nnd;
DROP TABLE IF EXISTS t_unique_expr_update;
NOTICE:  table "t_unique_expr_update" does not exist, skipping
CREATE TABLE t_unique_expr_update (
  h INT,
  r INT,
  k INT,
  a INT,
  b INT,
  c INT,
  d INT,
  active BOOLEAN DEFAULT true,
  PRIMARY KEY ((h) HASH, r ASC, k ASC)
);
CREATE UNIQUE INDEX NONCONCURRENTLY t_unique_expr_update_uq
ON t_unique_expr_update ((a + b), (c + d));
INSERT INTO t_unique_expr_update (h, r, k, a, b, c, d) VALUES
  (3, 1, 0, NULL, 10, 1, 1),
  (3, 2, 0, 20, 20, 2, 2),
  (3, 3, 0, NULL, 30, 3, 3),
  (3, 4, 0, NULL, 40, 4, 4);
-- Expression unique index: key changes from NULL to not-NULL.
EXPLAIN (ANALYZE, DIST, COSTS OFF)
UPDATE t_unique_expr_update SET a = 10 WHERE h = 3 AND r = 1;
                                            QUERY PLAN                                            
--------------------------------------------------------------------------------------------------
 Update on t_unique_expr_update (actual rows=0 loops=1)
   ->  Index Scan using t_unique_expr_update_pkey on t_unique_expr_update (actual rows=1 loops=1)
         Index Cond: ((h = 3) AND (r = 1))
         Storage Table Read Requests: 1
         Storage Table Read Ops: 1
         Storage Table Rows Scanned: 1
         Storage Table Write Requests: 1
         Storage Index Write Requests: 2
 Storage Read Requests: 1
 Storage Read Ops: 1
 Storage Rows Scanned: 1
 Storage Write Requests: 3
 Storage Flush Requests: 1
(13 rows)

-- Expression unique index: key changes from not-NULL to NULL.
EXPLAIN (ANALYZE, DIST, COSTS OFF)
UPDATE t_unique_expr_update SET a = NULL WHERE h = 3 AND r = 2;
                                            QUERY PLAN                                            
--------------------------------------------------------------------------------------------------
 Update on t_unique_expr_update (actual rows=0 loops=1)
   ->  Index Scan using t_unique_expr_update_pkey on t_unique_expr_update (actual rows=1 loops=1)
         Index Cond: ((h = 3) AND (r = 2))
         Storage Table Read Requests: 1
         Storage Table Read Ops: 1
         Storage Table Rows Scanned: 1
         Storage Table Write Requests: 1
         Storage Index Write Requests: 2
 Storage Read Requests: 1
 Storage Read Ops: 1
 Storage Rows Scanned: 1
 Storage Write Requests: 3
 Storage Flush Requests: 1
(13 rows)

-- Expression unique index: key is NULL; primary key update.
EXPLAIN (ANALYZE, DIST, COSTS OFF)
UPDATE t_unique_expr_update SET k = 1 WHERE h = 3 AND r = 3 AND k = 0;
                                            QUERY PLAN                                            
--------------------------------------------------------------------------------------------------
 Update on t_unique_expr_update (actual rows=0 loops=1)
   ->  Index Scan using t_unique_expr_update_pkey on t_unique_expr_update (actual rows=1 loops=1)
         Index Cond: ((h = 3) AND (r = 3) AND (k = 0))
         Storage Table Read Requests: 1
         Storage Table Read Ops: 1
         Storage Table Rows Scanned: 1
         Storage Table Write Requests: 2
         Storage Index Write Requests: 2
 Storage Read Requests: 1
 Storage Read Ops: 1
 Storage Rows Scanned: 1
 Storage Write Requests: 4
 Storage Flush Requests: 1
(13 rows)

-- Expression unique index: some keys are NULL; another key becomes NULL.
EXPLAIN (ANALYZE, DIST, COSTS OFF)
UPDATE t_unique_expr_update SET c = NULL WHERE h = 3 AND r = 4;
                                            QUERY PLAN                                            
--------------------------------------------------------------------------------------------------
 Update on t_unique_expr_update (actual rows=0 loops=1)
   ->  Index Scan using t_unique_expr_update_pkey on t_unique_expr_update (actual rows=1 loops=1)
         Index Cond: ((h = 3) AND (r = 4))
         Storage Table Read Requests: 1
         Storage Table Read Ops: 1
         Storage Table Rows Scanned: 1
         Storage Table Write Requests: 1
         Storage Index Write Requests: 2
 Storage Read Requests: 1
 Storage Read Ops: 1
 Storage Rows Scanned: 1
 Storage Write Requests: 3
 Storage Flush Requests: 1
(13 rows)

SELECT yb_index_check('t_unique_expr_update_uq'::regclass);
 yb_index_check 
----------------
 
(1 row)

SELECT * FROM t_unique_expr_update ORDER BY h, r, k;
 h | r | k | a  | b  | c | d | active 
---+---+---+----+----+---+---+--------
 3 | 1 | 0 | 10 | 10 | 1 | 1 | t
 3 | 2 | 0 |    | 20 | 2 | 2 | t
 3 | 3 | 1 |    | 30 | 3 | 3 | t
 3 | 4 | 0 |    | 40 |   | 4 | t
(4 rows)

DROP TABLE t_unique_expr_update;
DROP TABLE IF EXISTS t_unique_expr_update_nnd;
NOTICE:  table "t_unique_expr_update_nnd" does not exist, skipping
CREATE TABLE t_unique_expr_update_nnd (
  h INT,
  r INT,
  k INT,
  a INT,
  b INT,
  c INT,
  d INT,
  active BOOLEAN DEFAULT true,
  PRIMARY KEY ((h) HASH, r ASC, k ASC)
);
CREATE UNIQUE INDEX NONCONCURRENTLY t_unique_expr_update_nnd_uq
ON t_unique_expr_update_nnd ((a + b), (c + d)) NULLS NOT DISTINCT;
INSERT INTO t_unique_expr_update_nnd (h, r, k, a, b, c, d) VALUES
  (4, 1, 0, NULL, 10, 1, 1),
  (4, 2, 0, 20, 20, 2, 2),
  (4, 3, 0, NULL, 30, 3, 3),
  (4, 4, 0, NULL, 40, 4, 4);
-- Expression unique NULLS NOT DISTINCT index: key changes from NULL to not-NULL.
EXPLAIN (ANALYZE, DIST, COSTS OFF)
UPDATE t_unique_expr_update_nnd SET a = 10 WHERE h = 4 AND r = 1;
                                                QUERY PLAN                                                
----------------------------------------------------------------------------------------------------------
 Update on t_unique_expr_update_nnd (actual rows=0 loops=1)
   ->  Index Scan using t_unique_expr_update_nnd_pkey on t_unique_expr_update_nnd (actual rows=1 loops=1)
         Index Cond: ((h = 4) AND (r = 1))
         Storage Table Read Requests: 1
         Storage Table Read Ops: 1
         Storage Table Rows Scanned: 1
         Storage Table Write Requests: 1
         Storage Index Write Requests: 2
 Storage Read Requests: 1
 Storage Read Ops: 1
 Storage Rows Scanned: 1
 Storage Write Requests: 3
 Storage Flush Requests: 1
(13 rows)

-- Expression unique NULLS NOT DISTINCT index: key changes from not-NULL to NULL.
EXPLAIN (ANALYZE, DIST, COSTS OFF)
UPDATE t_unique_expr_update_nnd SET a = NULL WHERE h = 4 AND r = 2;
                                                QUERY PLAN                                                
----------------------------------------------------------------------------------------------------------
 Update on t_unique_expr_update_nnd (actual rows=0 loops=1)
   ->  Index Scan using t_unique_expr_update_nnd_pkey on t_unique_expr_update_nnd (actual rows=1 loops=1)
         Index Cond: ((h = 4) AND (r = 2))
         Storage Table Read Requests: 1
         Storage Table Read Ops: 1
         Storage Table Rows Scanned: 1
         Storage Table Write Requests: 1
         Storage Index Write Requests: 2
 Storage Read Requests: 1
 Storage Read Ops: 1
 Storage Rows Scanned: 1
 Storage Write Requests: 3
 Storage Flush Requests: 1
(13 rows)

-- Expression unique NULLS NOT DISTINCT index: key is NULL; primary key update.
EXPLAIN (ANALYZE, DIST, COSTS OFF)
UPDATE t_unique_expr_update_nnd SET k = 1 WHERE h = 4 AND r = 3 AND k = 0;
                                                QUERY PLAN                                                
----------------------------------------------------------------------------------------------------------
 Update on t_unique_expr_update_nnd (actual rows=0 loops=1)
   ->  Index Scan using t_unique_expr_update_nnd_pkey on t_unique_expr_update_nnd (actual rows=1 loops=1)
         Index Cond: ((h = 4) AND (r = 3) AND (k = 0))
         Storage Table Read Requests: 1
         Storage Table Read Ops: 1
         Storage Table Rows Scanned: 1
         Storage Table Write Requests: 2
         Storage Index Write Requests: 1
 Storage Read Requests: 1
 Storage Read Ops: 1
 Storage Rows Scanned: 1
 Storage Write Requests: 3
 Storage Flush Requests: 1
(13 rows)

-- Expression unique NULLS NOT DISTINCT index: some keys are NULL; another key becomes NULL.
EXPLAIN (ANALYZE, DIST, COSTS OFF)
UPDATE t_unique_expr_update_nnd SET c = NULL WHERE h = 4 AND r = 4;
                                                QUERY PLAN                                                
----------------------------------------------------------------------------------------------------------
 Update on t_unique_expr_update_nnd (actual rows=0 loops=1)
   ->  Index Scan using t_unique_expr_update_nnd_pkey on t_unique_expr_update_nnd (actual rows=1 loops=1)
         Index Cond: ((h = 4) AND (r = 4))
         Storage Table Read Requests: 1
         Storage Table Read Ops: 1
         Storage Table Rows Scanned: 1
         Storage Table Write Requests: 1
         Storage Index Write Requests: 2
 Storage Read Requests: 1
 Storage Read Ops: 1
 Storage Rows Scanned: 1
 Storage Write Requests: 3
 Storage Flush Requests: 1
(13 rows)

SELECT yb_index_check('t_unique_expr_update_nnd_uq'::regclass);
 yb_index_check 
----------------
 
(1 row)

SELECT * FROM t_unique_expr_update_nnd ORDER BY h, r, k;
 h | r | k | a  | b  | c | d | active 
---+---+---+----+----+---+---+--------
 4 | 1 | 0 | 10 | 10 | 1 | 1 | t
 4 | 2 | 0 |    | 20 | 2 | 2 | t
 4 | 3 | 1 |    | 30 | 3 | 3 | t
 4 | 4 | 0 |    | 40 |   | 4 | t
(4 rows)

DROP TABLE t_unique_expr_update_nnd;
DROP TABLE IF EXISTS t_partial_unique_expr_update;
NOTICE:  table "t_partial_unique_expr_update" does not exist, skipping
CREATE TABLE t_partial_unique_expr_update (
  h INT,
  r INT,
  k INT,
  a INT,
  b INT,
  c INT,
  d INT,
  active BOOLEAN,
  PRIMARY KEY ((h) HASH, r ASC, k ASC)
);
CREATE UNIQUE INDEX NONCONCURRENTLY t_partial_unique_expr_update_uq
ON t_partial_unique_expr_update ((a + b), (c + d)) WHERE active;
INSERT INTO t_partial_unique_expr_update VALUES
  (5, 1, 0, NULL, 10, 1, 1, true),
  (5, 2, 0, 20, 20, 2, 2, false),
  (5, 3, 0, NULL, 30, 3, 3, true),
  (5, 4, 0, NULL, 40, 4, 4, false),
  (5, 5, 0, NULL, 50, 5, 5, false);
-- Partial expression unique index: NULL to not-NULL and exits the index.
EXPLAIN (ANALYZE, DIST, COSTS OFF)
UPDATE t_partial_unique_expr_update SET a = 10, active = false WHERE h = 5 AND r = 1;
                                                    QUERY PLAN                                                    
------------------------------------------------------------------------------------------------------------------
 Update on t_partial_unique_expr_update (actual rows=0 loops=1)
   ->  Index Scan using t_partial_unique_expr_update_pkey on t_partial_unique_expr_update (actual rows=1 loops=1)
         Index Cond: ((h = 5) AND (r = 1))
         Storage Table Read Requests: 1
         Storage Table Read Ops: 1
         Storage Table Rows Scanned: 1
         Storage Table Write Requests: 1
         Storage Index Write Requests: 1
 Storage Read Requests: 1
 Storage Read Ops: 1
 Storage Rows Scanned: 1
 Storage Write Requests: 2
 Storage Flush Requests: 1
(13 rows)

-- Partial expression unique index: not-NULL to NULL and enters the index.
EXPLAIN (ANALYZE, DIST, COSTS OFF)
UPDATE t_partial_unique_expr_update SET a = NULL, active = true WHERE h = 5 AND r = 2;
                                                    QUERY PLAN                                                    
------------------------------------------------------------------------------------------------------------------
 Update on t_partial_unique_expr_update (actual rows=0 loops=1)
   ->  Index Scan using t_partial_unique_expr_update_pkey on t_partial_unique_expr_update (actual rows=1 loops=1)
         Index Cond: ((h = 5) AND (r = 2))
         Storage Table Read Requests: 1
         Storage Table Read Ops: 1
         Storage Table Rows Scanned: 1
         Storage Table Write Requests: 1
         Storage Index Write Requests: 1
 Storage Read Requests: 1
 Storage Read Ops: 1
 Storage Rows Scanned: 1
 Storage Write Requests: 2
 Storage Flush Requests: 1
(13 rows)

-- Partial expression unique index: key is NULL, primary key update, and exits the index.
EXPLAIN (ANALYZE, DIST, COSTS OFF)
UPDATE t_partial_unique_expr_update SET k = 1, active = false WHERE h = 5 AND r = 3 AND k = 0;
                                                    QUERY PLAN                                                    
------------------------------------------------------------------------------------------------------------------
 Update on t_partial_unique_expr_update (actual rows=0 loops=1)
   ->  Index Scan using t_partial_unique_expr_update_pkey on t_partial_unique_expr_update (actual rows=1 loops=1)
         Index Cond: ((h = 5) AND (r = 3) AND (k = 0))
         Storage Table Read Requests: 1
         Storage Table Read Ops: 1
         Storage Table Rows Scanned: 1
         Storage Table Write Requests: 2
         Storage Index Write Requests: 1
 Storage Read Requests: 1
 Storage Read Ops: 1
 Storage Rows Scanned: 1
 Storage Write Requests: 3
 Storage Flush Requests: 1
(13 rows)

-- Partial expression unique index: some keys are NULL, another key becomes NULL, and enters the index.
EXPLAIN (ANALYZE, DIST, COSTS OFF)
UPDATE t_partial_unique_expr_update SET c = NULL, active = true WHERE h = 5 AND r = 4;
                                                    QUERY PLAN                                                    
------------------------------------------------------------------------------------------------------------------
 Update on t_partial_unique_expr_update (actual rows=0 loops=1)
   ->  Index Scan using t_partial_unique_expr_update_pkey on t_partial_unique_expr_update (actual rows=1 loops=1)
         Index Cond: ((h = 5) AND (r = 4))
         Storage Table Read Requests: 1
         Storage Table Read Ops: 1
         Storage Table Rows Scanned: 1
         Storage Table Write Requests: 1
         Storage Index Write Requests: 1
 Storage Read Requests: 1
 Storage Read Ops: 1
 Storage Rows Scanned: 1
 Storage Write Requests: 2
 Storage Flush Requests: 1
(13 rows)

-- Partial expression unique index: key is NULL, primary key update, and enters the index.
EXPLAIN (ANALYZE, DIST, COSTS OFF)
UPDATE t_partial_unique_expr_update SET k = 1, active = true WHERE h = 5 AND r = 5 AND k = 0;
                                                    QUERY PLAN                                                    
------------------------------------------------------------------------------------------------------------------
 Update on t_partial_unique_expr_update (actual rows=0 loops=1)
   ->  Index Scan using t_partial_unique_expr_update_pkey on t_partial_unique_expr_update (actual rows=1 loops=1)
         Index Cond: ((h = 5) AND (r = 5) AND (k = 0))
         Storage Table Read Requests: 1
         Storage Table Read Ops: 1
         Storage Table Rows Scanned: 1
         Storage Table Write Requests: 2
         Storage Index Write Requests: 1
 Storage Read Requests: 1
 Storage Read Ops: 1
 Storage Rows Scanned: 1
 Storage Write Requests: 3
 Storage Flush Requests: 1
(13 rows)

SELECT yb_index_check('t_partial_unique_expr_update_uq'::regclass);
 yb_index_check 
----------------
 
(1 row)

SELECT * FROM t_partial_unique_expr_update ORDER BY h, r, k;
 h | r | k | a  | b  | c | d | active 
---+---+---+----+----+---+---+--------
 5 | 1 | 0 | 10 | 10 | 1 | 1 | f
 5 | 2 | 0 |    | 20 | 2 | 2 | t
 5 | 3 | 1 |    | 30 | 3 | 3 | f
 5 | 4 | 0 |    | 40 |   | 4 | t
 5 | 5 | 1 |    | 50 | 5 | 5 | t
(5 rows)

DROP TABLE t_partial_unique_expr_update;
