---
--- Verify renaming on temp tables
---
CREATE TEMP TABLE temp_table(a int primary key, b int);
CREATE INDEX temp_table_b_idx ON temp_table(b);
ALTER INDEX temp_table_pkey RENAME TO temp_table_pkey_new;
ALTER INDEX temp_table_b_idx RENAME TO temp_table_b_idx_new;
---
--- Verify yb_db_admin role can ALTER table
---
CREATE TABLE foo(a INT UNIQUE);
CREATE TABLE bar(b INT);
ALTER TABLE bar ADD CONSTRAINT baz FOREIGN KEY (b) REFERENCES foo(a);
CREATE TABLE table_other(a int, b int);
CREATE INDEX index_table_other ON table_other(a);
CREATE USER regress_alter_table_user1;
SET SESSION AUTHORIZATION yb_db_admin;
ALTER TABLE table_other RENAME to table_new;
ALTER TABLE table_new OWNER TO regress_alter_table_user1;
ALTER TABLE bar DROP CONSTRAINT baz;
ALTER TABLE pg_database RENAME TO test; -- should fail
ERROR:  permission denied: "pg_database" is a system catalog
ALTER TABLE pg_tablespace OWNER TO regress_alter_table_user1; -- should fail
ERROR:  permission denied: "pg_tablespace" is a system catalog
---
--- Verify yb_db_admin role can ALTER index
---
ALTER INDEX index_table_other RENAME TO index_table_other_new;
RESET SESSION AUTHORIZATION;
DROP TABLE foo;
DROP TABLE bar;
DROP TABLE table_new;
DROP USER regress_alter_table_user1;
---
--- Verify alter table which requires table rewrite
---
--- Table without primary key index
--- Empty table case
CREATE TABLE no_pk_tbl(k INT);
ALTER TABLE no_pk_tbl ADD COLUMN s1 TIMESTAMP DEFAULT clock_timestamp();
NOTICE:  table rewrite may lead to inconsistencies
DETAIL:  Concurrent DMLs may not be reflected in the new table.
HINT:  See https://github.com/yugabyte/yugabyte-db/issues/19860. Set 'ysql_suppress_unsafe_alter_notice' yb-tserver gflag to true to suppress this notice.
ALTER TABLE no_pk_tbl ADD COLUMN v1 SERIAL;
NOTICE:  table rewrite may lead to inconsistencies
DETAIL:  Concurrent DMLs may not be reflected in the new table.
HINT:  See https://github.com/yugabyte/yugabyte-db/issues/19860. Set 'ysql_suppress_unsafe_alter_notice' yb-tserver gflag to true to suppress this notice.
\d no_pk_tbl;
                                      Table "public.no_pk_tbl"
 Column |            Type             | Collation | Nullable |                Default                
--------+-----------------------------+-----------+----------+---------------------------------------
 k      | integer                     |           |          | 
 s1     | timestamp without time zone |           |          | clock_timestamp()
 v1     | integer                     |           | not null | nextval('no_pk_tbl_v1_seq'::regclass)

--- Non-empty case
INSERT INTO no_pk_tbl VALUES(1), (2), (3);
ALTER TABLE no_pk_tbl ADD COLUMN s2 TIMESTAMP DEFAULT clock_timestamp();
NOTICE:  table rewrite may lead to inconsistencies
DETAIL:  Concurrent DMLs may not be reflected in the new table.
HINT:  See https://github.com/yugabyte/yugabyte-db/issues/19860. Set 'ysql_suppress_unsafe_alter_notice' yb-tserver gflag to true to suppress this notice.
ALTER TABLE no_pk_tbl ADD COLUMN v2 SERIAL;
NOTICE:  table rewrite may lead to inconsistencies
DETAIL:  Concurrent DMLs may not be reflected in the new table.
HINT:  See https://github.com/yugabyte/yugabyte-db/issues/19860. Set 'ysql_suppress_unsafe_alter_notice' yb-tserver gflag to true to suppress this notice.
\d no_pk_tbl;
                                      Table "public.no_pk_tbl"
 Column |            Type             | Collation | Nullable |                Default                
--------+-----------------------------+-----------+----------+---------------------------------------
 k      | integer                     |           |          | 
 s1     | timestamp without time zone |           |          | clock_timestamp()
 v1     | integer                     |           | not null | nextval('no_pk_tbl_v1_seq'::regclass)
 s2     | timestamp without time zone |           |          | clock_timestamp()
 v2     | integer                     |           | not null | nextval('no_pk_tbl_v2_seq'::regclass)

DROP TABLE no_pk_tbl;
--- Table with primary key index
--- Empty table case
CREATE TABLE pk_tbl(k INT PRIMARY KEY);
ALTER TABLE pk_tbl ADD COLUMN s1 TIMESTAMP DEFAULT clock_timestamp();
NOTICE:  table rewrite may lead to inconsistencies
DETAIL:  Concurrent DMLs may not be reflected in the new table.
HINT:  See https://github.com/yugabyte/yugabyte-db/issues/19860. Set 'ysql_suppress_unsafe_alter_notice' yb-tserver gflag to true to suppress this notice.
ALTER TABLE pk_tbl ADD COLUMN v1 SERIAL;
NOTICE:  table rewrite may lead to inconsistencies
DETAIL:  Concurrent DMLs may not be reflected in the new table.
HINT:  See https://github.com/yugabyte/yugabyte-db/issues/19860. Set 'ysql_suppress_unsafe_alter_notice' yb-tserver gflag to true to suppress this notice.
\d pk_tbl;
                                      Table "public.pk_tbl"
 Column |            Type             | Collation | Nullable |              Default               
--------+-----------------------------+-----------+----------+------------------------------------
 k      | integer                     |           | not null | 
 s1     | timestamp without time zone |           |          | clock_timestamp()
 v1     | integer                     |           | not null | nextval('pk_tbl_v1_seq'::regclass)
Indexes:
    "pk_tbl_pkey" PRIMARY KEY, lsm (k HASH)

--- Non-empty case
INSERT INTO pk_tbl VALUES(1), (2), (3);
ALTER TABLE pk_tbl ADD COLUMN s2 TIMESTAMP DEFAULT clock_timestamp();
NOTICE:  table rewrite may lead to inconsistencies
DETAIL:  Concurrent DMLs may not be reflected in the new table.
HINT:  See https://github.com/yugabyte/yugabyte-db/issues/19860. Set 'ysql_suppress_unsafe_alter_notice' yb-tserver gflag to true to suppress this notice.
ALTER TABLE pk_tbl ADD COLUMN v2 SERIAL;
NOTICE:  table rewrite may lead to inconsistencies
DETAIL:  Concurrent DMLs may not be reflected in the new table.
HINT:  See https://github.com/yugabyte/yugabyte-db/issues/19860. Set 'ysql_suppress_unsafe_alter_notice' yb-tserver gflag to true to suppress this notice.
\d pk_tbl;
                                      Table "public.pk_tbl"
 Column |            Type             | Collation | Nullable |              Default               
--------+-----------------------------+-----------+----------+------------------------------------
 k      | integer                     |           | not null | 
 s1     | timestamp without time zone |           |          | clock_timestamp()
 v1     | integer                     |           | not null | nextval('pk_tbl_v1_seq'::regclass)
 s2     | timestamp without time zone |           |          | clock_timestamp()
 v2     | integer                     |           | not null | nextval('pk_tbl_v2_seq'::regclass)
Indexes:
    "pk_tbl_pkey" PRIMARY KEY, lsm (k HASH)

DROP TABLE pk_tbl;
-- Verify cache cleanup of table names when TABLE RENAME fails.
CREATE TABLE rename_test (id int);
SET yb_test_fail_next_ddl TO true;
ALTER TABLE rename_test RENAME TO foobar;
ERROR:  Failed DDL operation as requested
-- The table name must be unchanged.
SELECT * FROM rename_test;
 id
----
(0 rows)

-- The name 'foobar' must be invalid.
SELECT * FROM foobar;
ERROR:  relation "foobar" does not exist
LINE 1: SELECT * FROM foobar;
                      ^
-- Rename operation must succeed now.
ALTER TABLE rename_test RENAME TO foobar;
DROP TABLE foobar;
--
-- ALTER TABLE ADD COLUMN ... DEFAULT tests.
--
CREATE TABLE foo(a int);
INSERT INTO foo VALUES (1), (2), (3);
-- Test add column with int default value.
ALTER TABLE foo ADD COLUMN b int DEFAULT 6;
INSERT INTO foo(a) VALUES (4);
INSERT INTO foo VALUES (5, 7);
INSERT INTO foo VALUES (6, null);
SELECT * FROM foo ORDER BY a;
 a | b 
---+---
 1 | 6
 2 | 6
 3 | 6
 4 | 6
 5 | 7
 6 |  
(6 rows)

CREATE TYPE typefoo AS (a inet, b BIT(3));
-- Test add column with a UDT default value.
ALTER TABLE foo ADD COLUMN c typefoo DEFAULT ('127.0.0.1', B'010');
SELECT * FROM foo ORDER BY a;
 a | b |        c        
---+---+-----------------
 1 | 6 | (127.0.0.1,010)
 2 | 6 | (127.0.0.1,010)
 3 | 6 | (127.0.0.1,010)
 4 | 6 | (127.0.0.1,010)
 5 | 7 | (127.0.0.1,010)
 6 |   | (127.0.0.1,010)
(6 rows)

CREATE FUNCTION functionfoo()
RETURNS TIMESTAMP
LANGUAGE plpgsql STABLE
AS
$$
BEGIN
RETURN '01-01-2023';
END;
$$;
-- Test add column with a non-volatile expression default value.
ALTER TABLE foo ADD COLUMN d TIMESTAMP DEFAULT functionfoo();
SELECT * FROM foo ORDER BY a;
 a | b |        c        |            d             
---+---+-----------------+--------------------------
 1 | 6 | (127.0.0.1,010) | Sun Jan 01 00:00:00 2023
 2 | 6 | (127.0.0.1,010) | Sun Jan 01 00:00:00 2023
 3 | 6 | (127.0.0.1,010) | Sun Jan 01 00:00:00 2023
 4 | 6 | (127.0.0.1,010) | Sun Jan 01 00:00:00 2023
 5 | 7 | (127.0.0.1,010) | Sun Jan 01 00:00:00 2023
 6 |   | (127.0.0.1,010) | Sun Jan 01 00:00:00 2023
(6 rows)

-- Test add column with default value and collation
ALTER TABLE foo ADD COLUMN e varchar DEFAULT 'hi' COLLATE "en_US";
INSERT INTO foo(a, e) VALUES(7, 'a');
INSERT INTO foo(a, e) VALUES(8, 'zz');
SELECT * FROM foo ORDER BY e, a;
 a | b |        c        |            d             | e  
---+---+-----------------+--------------------------+----
 7 | 6 | (127.0.0.1,010) | Sun Jan 01 00:00:00 2023 | a
 1 | 6 | (127.0.0.1,010) | Sun Jan 01 00:00:00 2023 | hi
 2 | 6 | (127.0.0.1,010) | Sun Jan 01 00:00:00 2023 | hi
 3 | 6 | (127.0.0.1,010) | Sun Jan 01 00:00:00 2023 | hi
 4 | 6 | (127.0.0.1,010) | Sun Jan 01 00:00:00 2023 | hi
 5 | 7 | (127.0.0.1,010) | Sun Jan 01 00:00:00 2023 | hi
 6 |   | (127.0.0.1,010) | Sun Jan 01 00:00:00 2023 | hi
 8 | 6 | (127.0.0.1,010) | Sun Jan 01 00:00:00 2023 | zz
(8 rows)

SELECT * FROM foo WHERE e COLLATE "C" < 'hi' ORDER BY e;
 a | b |        c        |            d             | e 
---+---+-----------------+--------------------------+---
 7 | 6 | (127.0.0.1,010) | Sun Jan 01 00:00:00 2023 | a
(1 row)

-- Test updating columns that have missing default values.
UPDATE foo SET d = '01-01-2024' WHERE a = 1;
SELECT * FROM foo ORDER BY a;
 a | b |        c        |            d             | e  
---+---+-----------------+--------------------------+----
 1 | 6 | (127.0.0.1,010) | Mon Jan 01 00:00:00 2024 | hi
 2 | 6 | (127.0.0.1,010) | Sun Jan 01 00:00:00 2023 | hi
 3 | 6 | (127.0.0.1,010) | Sun Jan 01 00:00:00 2023 | hi
 4 | 6 | (127.0.0.1,010) | Sun Jan 01 00:00:00 2023 | hi
 5 | 7 | (127.0.0.1,010) | Sun Jan 01 00:00:00 2023 | hi
 6 |   | (127.0.0.1,010) | Sun Jan 01 00:00:00 2023 | hi
 7 | 6 | (127.0.0.1,010) | Sun Jan 01 00:00:00 2023 | a
 8 | 6 | (127.0.0.1,010) | Sun Jan 01 00:00:00 2023 | zz
(8 rows)

UPDATE foo SET b = 8 WHERE b is null;
SELECT * FROM foo WHERE b = 8;
 a | b |        c        |            d             | e  
---+---+-----------------+--------------------------+----
 6 | 8 | (127.0.0.1,010) | Sun Jan 01 00:00:00 2023 | hi
(1 row)

UPDATE foo SET b = null WHERE b = 8;
SELECT * FROM foo WHERE b is null;
 a | b |        c        |            d             | e  
---+---+-----------------+--------------------------+----
 6 |   | (127.0.0.1,010) | Sun Jan 01 00:00:00 2023 | hi
(1 row)

-- Test expression pushdown on column with default value.
EXPLAIN SELECT * FROM foo WHERE d = '01-01-2023';
                                   QUERY PLAN
---------------------------------------------------------------------------------
 Seq Scan on foo  (cost=0.00..102.50 rows=1000 width=80)
   Storage Filter: (d = 'Sun Jan 01 00:00:00 2023'::timestamp without time zone)
(2 rows)

SELECT * FROM foo WHERE b = 6 ORDER BY a;
 a | b |        c        |            d             | e  
---+---+-----------------+--------------------------+----
 1 | 6 | (127.0.0.1,010) | Mon Jan 01 00:00:00 2024 | hi
 2 | 6 | (127.0.0.1,010) | Sun Jan 01 00:00:00 2023 | hi
 3 | 6 | (127.0.0.1,010) | Sun Jan 01 00:00:00 2023 | hi
 4 | 6 | (127.0.0.1,010) | Sun Jan 01 00:00:00 2023 | hi
 7 | 6 | (127.0.0.1,010) | Sun Jan 01 00:00:00 2023 | a
 8 | 6 | (127.0.0.1,010) | Sun Jan 01 00:00:00 2023 | zz
(6 rows)

-- Verify that we set pg_attribute.atthasmissing and
-- pg_attribute.attmissingval.
SELECT atthasmissing, attmissingval FROM pg_attribute
    WHERE attrelid='foo'::regclass;
 atthasmissing |        attmissingval 
---------------+------------------------------
 f             | 
 f             | 
 f             | 
 f             | 
 f             | 
 f             | 
 f             | 
 t             | {6}
 t             | {"(127.0.0.1,010)"}
 t             | {"Sun Jan 01 00:00:00 2023"}
 t             | {hi}
(11 rows)

-- Verify that ALTER TABLE ... SET DEFAULT doesn't change missing values.
ALTER TABLE foo ALTER COLUMN b SET DEFAULT 7;
INSERT INTO foo(a) VALUES (9);
SELECT * FROM foo ORDER BY a;
 a | b |        c        |            d             | e  
---+---+-----------------+--------------------------+----
 1 | 6 | (127.0.0.1,010) | Mon Jan 01 00:00:00 2024 | hi
 2 | 6 | (127.0.0.1,010) | Sun Jan 01 00:00:00 2023 | hi
 3 | 6 | (127.0.0.1,010) | Sun Jan 01 00:00:00 2023 | hi
 4 | 6 | (127.0.0.1,010) | Sun Jan 01 00:00:00 2023 | hi
 5 | 7 | (127.0.0.1,010) | Sun Jan 01 00:00:00 2023 | hi
 6 |   | (127.0.0.1,010) | Sun Jan 01 00:00:00 2023 | hi
 7 | 6 | (127.0.0.1,010) | Sun Jan 01 00:00:00 2023 | a
 8 | 6 | (127.0.0.1,010) | Sun Jan 01 00:00:00 2023 | zz
 9 | 7 | (127.0.0.1,010) | Sun Jan 01 00:00:00 2023 | hi
(9 rows)

-- Verify that indexes on columns with missing default values work.
CREATE INDEX ON foo(b);
EXPLAIN SELECT b FROM foo WHERE b = 6;
                                QUERY PLAN                                 
---------------------------------------------------------------------------
 Index Only Scan using foo_b_idx on foo  (cost=0.00..5.12 rows=10 width=4)
   Index Cond: (b = 6)
(2 rows)

SELECT b FROM foo WHERE b = 6;
 b 
---
 6
 6
 6
 6
 6
 6
(6 rows)

EXPLAIN SELECT * FROM foo WHERE b = 6 ORDER BY a;
                                 QUERY PLAN                                  
-----------------------------------------------------------------------------
 Sort  (cost=5.39..5.42 rows=10 width=80)
   Sort Key: a
   ->  Index Scan using foo_b_idx on foo  (cost=0.00..5.22 rows=10 width=80)
         Index Cond: (b = 6)
(4 rows)

SELECT * FROM foo WHERE b = 6 ORDER BY a;
 a | b |        c        |            d             | e  
---+---+-----------------+--------------------------+----
 1 | 6 | (127.0.0.1,010) | Mon Jan 01 00:00:00 2024 | hi
 2 | 6 | (127.0.0.1,010) | Sun Jan 01 00:00:00 2023 | hi
 3 | 6 | (127.0.0.1,010) | Sun Jan 01 00:00:00 2023 | hi
 4 | 6 | (127.0.0.1,010) | Sun Jan 01 00:00:00 2023 | hi
 7 | 6 | (127.0.0.1,010) | Sun Jan 01 00:00:00 2023 | a
 8 | 6 | (127.0.0.1,010) | Sun Jan 01 00:00:00 2023 | zz
(6 rows)

-- Verify that defaults are copied for tables created using CREATE TABLE LIKE
-- clause.
CREATE TABLE dummy (LIKE foo INCLUDING DEFAULTS);
INSERT INTO dummy(a) VALUES (1);
SELECT * FROM dummy;
 a | b |        c        |            d             | e  
---+---+-----------------+--------------------------+----
 1 | 7 | (127.0.0.1,010) | Sun Jan 01 00:00:00 2023 | hi
(1 row)

-- Verify that missing values work after table rewrite.
ALTER TABLE foo ADD PRIMARY KEY (a);
NOTICE:  table rewrite may lead to inconsistencies
DETAIL:  Concurrent DMLs may not be reflected in the new table.
HINT:  See https://github.com/yugabyte/yugabyte-db/issues/19860. Set 'ysql_suppress_unsafe_alter_notice' yb-tserver gflag to true to suppress this notice.
SELECT * FROM foo ORDER BY a;
 a | b |        c        |            d             | e  
---+---+-----------------+--------------------------+----
 1 | 6 | (127.0.0.1,010) | Mon Jan 01 00:00:00 2024 | hi
 2 | 6 | (127.0.0.1,010) | Sun Jan 01 00:00:00 2023 | hi
 3 | 6 | (127.0.0.1,010) | Sun Jan 01 00:00:00 2023 | hi
 4 | 6 | (127.0.0.1,010) | Sun Jan 01 00:00:00 2023 | hi
 5 | 7 | (127.0.0.1,010) | Sun Jan 01 00:00:00 2023 | hi
 6 |   | (127.0.0.1,010) | Sun Jan 01 00:00:00 2023 | hi
 7 | 6 | (127.0.0.1,010) | Sun Jan 01 00:00:00 2023 | a
 8 | 6 | (127.0.0.1,010) | Sun Jan 01 00:00:00 2023 | zz
 9 | 7 | (127.0.0.1,010) | Sun Jan 01 00:00:00 2023 | hi
(9 rows)

-- Verify missing default values for partitioned tables.
CREATE TABLE foo_part (a int) PARTITION BY RANGE (a);
CREATE TABLE foo_part_1 PARTITION OF foo_part FOR VALUES FROM (1) TO (6);
CREATE TABLE foo_part_2 PARTITION OF foo_part FOR VALUES FROM (6) TO (11);
INSERT INTO foo_part VALUES (generate_series(1, 10));
CREATE FUNCTION functionfoopart()
RETURNS TEXT
LANGUAGE plpgsql STABLE
AS
$$
BEGIN
RETURN 'default';
END;
$$;
ALTER TABLE foo_part ADD COLUMN b TEXT default functionfoopart();
INSERT INTO foo_part VALUES (1, null), (6, null);
SELECT * FROM foo_part ORDER BY a, b;
 a  |    b    
----+---------
  1 | default
  1 | 
  2 | default
  3 | default
  4 | default
  5 | default
  6 | default
  6 | 
  7 | default
  8 | default
  9 | default
 10 | default
(12 rows)

-- Verify that ADD COLUMN ... DEFAULT NOT NULL fails when the default value is
-- null.
ALTER TABLE foo ADD COLUMN g int DEFAULT null NOT NULL;
ERROR:  column "g" of relation "foo" contains null values
-- Test add column with volatile default value.
ALTER TABLE foo ADD COLUMN f FLOAT DEFAULT random();
NOTICE:  table rewrite may lead to inconsistencies
DETAIL:  Concurrent DMLs may not be reflected in the new table.
HINT:  See https://github.com/yugabyte/yugabyte-db/issues/19860. Set 'ysql_suppress_unsafe_alter_notice' yb-tserver gflag to true to suppress this notice.
--
-- Tests for ALTER TABLE ... ADD COLUMN ... UNIQUE
--
CREATE TABLE foo_unique(a int);
INSERT INTO foo_unique VALUES (1), (2), (3);
ALTER TABLE foo_unique ADD COLUMN b int UNIQUE NOT NULL; -- should fail
ERROR:  column "b" of relation "foo_unique" contains null values
ALTER TABLE foo_unique ADD COLUMN b int UNIQUE;
ALTER TABLE foo_unique ADD COLUMN c float UNIQUE DEFAULT 1.0; -- should fail
ERROR:  duplicate key value violates unique constraint "foo_unique_c_key"
ALTER TABLE foo_unique ADD COLUMN c float UNIQUE NOT NULL DEFAULT random();
NOTICE:  table rewrite may lead to inconsistencies
DETAIL:  Concurrent DMLs may not be reflected in the new table.
HINT:  See https://github.com/yugabyte/yugabyte-db/issues/19860. Set 'ysql_suppress_unsafe_alter_notice' yb-tserver gflag to true to suppress this notice.
ALTER TABLE foo_unique ADD COLUMN d float UNIQUE CHECK (d >= 1) DEFAULT random(); -- should fail
NOTICE:  table rewrite may lead to inconsistencies
DETAIL:  Concurrent DMLs may not be reflected in the new table.
HINT:  See https://github.com/yugabyte/yugabyte-db/issues/19860. Set 'ysql_suppress_unsafe_alter_notice' yb-tserver gflag to true to suppress this notice.
ERROR:  check constraint "foo_unique_d_check" of relation "foo_unique" is violated by some row
ALTER TABLE foo_unique ADD COLUMN d float UNIQUE CHECK (d >= 1);
SELECT a,b,d FROM foo_unique ORDER BY a;
 a | b | d
---+---+---
 1 |   |
 2 |   |
 3 |   |
(3 rows)

--
-- Test for cascaded drops on columns
--
CREATE TABLE test_dropcolumn(a int, b int, c int);
CREATE TYPE test_dropcolumn_type AS (a int, b int);
ALTER TABLE test_dropcolumn ADD COLUMN d test_dropcolumn_type;
DROP TYPE test_dropcolumn_type CASCADE; -- should drop the column d
NOTICE:  drop cascades to column d of table test_dropcolumn
ALTER TABLE test_dropcolumn ADD COLUMN d int;
