CREATE INDEX onek_two_idx ON onek USING lsm(two);
DROP INDEX onek_two_idx;
DROP INDEX onek_two_idx;
ERROR:  index "onek_two_idx" does not exist
DROP INDEX IF EXISTS onek_two_idx;
NOTICE:  index "onek_two_idx" does not exist, skipping
--
-- Create index on existing table with data
--
CREATE TABLE index_test (col1 int, col2 int);
INSERT INTO index_test (col1, col2) VALUES (1, 100);
INSERT INTO index_test (col1, col2) VALUES (2, 200);
CREATE INDEX index_test_idx1 ON index_test(col1);
CREATE INDEX index_test_idx2 ON index_test(col1, col2);
DROP INDEX index_test_idx1;
DROP INDEX index_test_idx2;
DROP TABLE index_test;
CREATE TABLE test_index (v1 INT, v2 INT, v3 INT);
CREATE INDEX ON test_index (v1);
CREATE INDEX ON test_index (v2, v3);
INSERT INTO test_index VALUES (1, 11, 21), (2, 12, 22), (3, 13, 23), (4, 14, 24), (5, 15, 25);
-- Verify order by on indexed column
SELECT * FROM test_index ORDER BY v1;
 v1 | v2 | v3
----+----+----
  1 | 11 | 21
  2 | 12 | 22
  3 | 13 | 23
  4 | 14 | 24
  5 | 15 | 25
(5 rows)

-- Verify delete with hash value in index
DELETE FROM test_index WHERE v2 = 12 OR v2 = 13;
SELECT * FROM test_index ORDER BY v1;
 v1 | v2 | v3
----+----+----
  1 | 11 | 21
  4 | 14 | 24
  5 | 15 | 25
(3 rows)

-- Verify different WHERE conditions are supported.
SELECT * FROM test_index WHERE v1 IS NULL;
 v1 | v2 | v3
----+----+----
(0 rows)

SELECT * FROM test_index WHERE v1 IS NOT NULL ORDER BY v1;
 v1 | v2 | v3
----+----+----
  1 | 11 | 21
  4 | 14 | 24
  5 | 15 | 25
(3 rows)

SELECT * FROM test_index WHERE v1 IN (1, 2, 3);
 v1 | v2 | v3
----+----+----
  1 | 11 | 21
(1 row)

-- Verify indexes on system catalog tables are updated properly
CREATE TABLE test_sys_catalog_update (k int primary key, v int);
EXPLAIN (COSTS OFF) SELECT relname FROM pg_class WHERE relname = 'test_sys_catalog_update';
                          QUERY PLAN
--------------------------------------------------------------
 Index Only Scan using pg_class_relname_nsp_index on pg_class
   Index Cond: (relname = 'test_sys_catalog_update'::name)
(2 rows)

SELECT relname  FROM pg_class WHERE relname = 'test_sys_catalog_update';
         relname
-------------------------
 test_sys_catalog_update
(1 row)

EXPLAIN (COSTS OFF) SELECT typname FROM pg_type WHERE typname = 'test_sys_catalog_update';
                         QUERY PLAN
------------------------------------------------------------
 Index Only Scan using pg_type_typname_nsp_index on pg_type
   Index Cond: (typname = 'test_sys_catalog_update'::name)
(2 rows)

SELECT typname FROM pg_type WHERE typname = 'test_sys_catalog_update';
         typname
-------------------------
 test_sys_catalog_update
(1 row)

EXPLAIN (COSTS OFF) SELECT attname, atttypid FROM pg_attribute WHERE attname = 'v';
                            QUERY PLAN
------------------------------------------------------------------
 Index Scan using pg_attribute_relid_attnam_index on pg_attribute
   Index Cond: (attname = 'v'::name)
(2 rows)

SELECT attname, atttypid FROM pg_attribute WHERE attname = 'v';
 attname | atttypid
---------+----------
 v       |       23
(1 row)

ALTER TABLE test_sys_catalog_update RENAME TO test_sys_catalog_update_new;
ALTER TABLE test_sys_catalog_update_new RENAME COLUMN v TO w;
SELECT relname FROM pg_class WHERE relname = 'test_sys_catalog_update';
 relname
---------
(0 rows)

SELECT typname FROM pg_type WHERE typname = 'test_sys_catalog_update';
 typname
---------
(0 rows)

SELECT attname, atttypid FROM pg_attribute WHERE attname = 'v';
 attname | atttypid
---------+----------
(0 rows)

SELECT relname FROM pg_class WHERE relname = 'test_sys_catalog_update_new';
           relname
-----------------------------
 test_sys_catalog_update_new
(1 row)

SELECT typname FROM pg_type WHERE typname = 'test_sys_catalog_update_new';
           typname
-----------------------------
 test_sys_catalog_update_new
(1 row)

SELECT attname, atttypid FROM pg_attribute WHERE attname = 'w';
 attname | atttypid
---------+----------
 w       |       23
(1 row)

-- Test primary key as index
CREATE TABLE t1 (h INT, r INT, v1 INT, v2 INT, PRIMARY KEY (h hash, r));
CREATE INDEX ON t1 (v1);
CREATE UNIQUE INDEX ON t1 (v1, v2);
CREATE TABLE t2 (h INT, r INT, v1 INT, v2 INT, PRIMARY KEY (h hash, r));
\d t1
                 Table "public.t1"
 Column |  Type   | Collation | Nullable | Default
--------+---------+-----------+----------+---------
 h      | integer |           | not null |
 r      | integer |           | not null |
 v1     | integer |           |          |
 v2     | integer |           |          |
Indexes:
    "t1_pkey" PRIMARY KEY, lsm (h HASH, r)
    "t1_v1_v2_idx" UNIQUE, lsm (v1 HASH, v2)
    "t1_v1_idx" lsm (v1 HASH)

\d t2
                 Table "public.t2"
 Column |  Type   | Collation | Nullable | Default
--------+---------+-----------+----------+---------
 h      | integer |           | not null |
 r      | integer |           | not null |
 v1     | integer |           |          |
 v2     | integer |           |          |
Indexes:
    "t2_pkey" PRIMARY KEY, lsm (h HASH, r)

INSERT INTO t1 VALUES (1, 1, 11, 11), (1, 2, 11, 12);
INSERT INTO t2 VALUES (1, 1, 21, 21);
-- The following 2 inserts should produce error due to duplicate primary key / unique index value
INSERT INTO t1 VALUES (1, 1, 99, 99);
ERROR:  duplicate key value violates unique constraint "t1_pkey"
INSERT INTO t1 VALUES (1, 3, 11, 11);
ERROR:  duplicate key value violates unique constraint "t1_v1_v2_idx"
INSERT INTO t1 VALUES (1, 3, 11, 13), (2, 1, 12, 13), (2, 2, 12, 14);
EXPLAIN (COSTS OFF) SELECT * FROM t1 ORDER BY h, r;
        QUERY PLAN
--------------------------
 Sort
   Sort Key: h, r
   ->  Foreign Scan on t1
(3 rows)

SELECT * FROM t1 ORDER BY h, r;
 h | r | v1 | v2
---+---+----+----
 1 | 1 | 11 | 11
 1 | 2 | 11 | 12
 1 | 3 | 11 | 13
 2 | 1 | 12 | 13
 2 | 2 | 12 | 14
(5 rows)

EXPLAIN (COSTS OFF) SELECT * FROM t1 WHERE h = 1 ORDER BY r;
           QUERY PLAN
--------------------------------
 Index Scan using t1_pkey on t1
   Index Cond: (h = 1)
(2 rows)

SELECT * FROM t1 WHERE h = 1 ORDER BY r;
 h | r | v1 | v2
---+---+----+----
 1 | 1 | 11 | 11
 1 | 2 | 11 | 12
 1 | 3 | 11 | 13
(3 rows)

EXPLAIN (COSTS OFF) SELECT * FROM t1 WHERE h > 1 ORDER BY h, r;
        QUERY PLAN
--------------------------
 Sort
   Sort Key: h, r
   ->  Foreign Scan on t1
         Filter: (h > 1)
(4 rows)

SELECT * FROM t1 WHERE h > 1 ORDER BY h, r;
 h | r | v1 | v2
---+---+----+----
 2 | 1 | 12 | 13
 2 | 2 | 12 | 14
(2 rows)

EXPLAIN (COSTS OFF) SELECT * FROM t1 WHERE h = 1 AND r = 1;
             QUERY PLAN
-------------------------------------
 Index Scan using t1_pkey on t1
   Index Cond: ((h = 1) AND (r = 1))
(2 rows)

SELECT * FROM t1 WHERE h = 1 AND r = 1;
 h | r | v1 | v2
---+---+----+----
 1 | 1 | 11 | 11
(1 row)

EXPLAIN (COSTS OFF) SELECT * FROM t1 WHERE v1 = 11 ORDER BY h, r;
               QUERY PLAN
----------------------------------------
 Sort
   Sort Key: h, r
   ->  Index Scan using t1_v1_idx on t1
         Index Cond: (v1 = 11)
(4 rows)

SELECT * FROM t1 WHERE v1 = 11 ORDER BY h, r;
 h | r | v1 | v2
---+---+----+----
 1 | 1 | 11 | 11
 1 | 2 | 11 | 12
 1 | 3 | 11 | 13
(3 rows)

-- Disabled this test because we do not have proper stats. We return the same cost estimate
-- for indexes t1_v1_idx and t1_v1_v2_idx and Postgres will be either of them at random.
-- EXPLAIN (COSTS OFF) SELECT * FROM t1 WHERE v1 = 11 AND v2 = 11;
-- SELECT * FROM t1 WHERE v1 = 11 AND v2 = 11;
EXPLAIN (COSTS OFF) SELECT t1.h, t1.r, t1.v1, t2.v1 FROM t1, t2 WHERE t1.h = t2.h AND t1.r = t2.r;
                   QUERY PLAN
-------------------------------------------------
 Nested Loop
   ->  Foreign Scan on t1
   ->  Index Scan using t2_pkey on t2
         Index Cond: ((h = t1.h) AND (r = t1.r))
(4 rows)

SELECT t1.h, t1.r, t1.v1, t2.v1 FROM t1, t2 WHERE t1.h = t2.h AND t1.r = t2.r;
 h | r | v1 | v1
---+---+----+----
 1 | 1 | 11 | 21
(1 row)

--
-- NULL value in index
--
CREATE TABLE null_index(k int, v int);
CREATE INDEX null_index_v ON null_index(v);
INSERT INTO null_index(k) VALUES(1);
INSERT INTO null_index VALUES(2, NULL);
INSERT INTO null_index VALUES(3, 3);
SELECT * FROM null_index ORDER BY k;
 k | v
---+---
 1 |
 2 |
 3 | 3
(3 rows)

SELECT * FROM null_index WHERE v IS NULL ORDER BY k;
 k | v
---+---
 1 |
 2 |
(2 rows)

SELECT * FROM null_index WHERE v IS NOT NULL ORDER BY k;
 k | v
---+---
 3 | 3
(1 row)

--
-- NULL value in unique index
--
CREATE TABLE null_unique_index(k int, v int);
CREATE UNIQUE INDEX ON null_unique_index(k);
INSERT INTO null_unique_index(v) values(1);
INSERT INTO null_unique_index values (NULL, 2), (3, 3), (4, 4);
INSERT INTO null_unique_index values(4, 5); -- fail
ERROR:  duplicate key value violates unique constraint "null_unique_index_k_idx"
EXPLAIN(COSTS OFF) SELECT * FROM null_unique_index WHERE k = 4;
                          QUERY PLAN
---------------------------------------------------------------
 Index Scan using null_unique_index_k_idx on null_unique_index
   Index Cond: (k = 4)
(2 rows)

EXPLAIN(COSTS OFF) SELECT * FROM null_unique_index WHERE k IS NULL ORDER BY k;
                             QUERY PLAN
---------------------------------------------------------------------
 Sort
   Sort Key: k
   ->  Index Scan using null_unique_index_k_idx on null_unique_index
         Index Cond: (k IS NULL)
(4 rows)

EXPLAIN(COSTS OFF) SELECT * FROM null_unique_index WHERE k IS NOT NULL ORDER BY k;
               QUERY PLAN
-----------------------------------------
 Sort
   Sort Key: k
   ->  Foreign Scan on null_unique_index
         Filter: (k IS NOT NULL)
(4 rows)

SELECT * FROM null_unique_index WHERE k = 4;
 k | v
---+---
 4 | 4
(1 row)

SELECT * FROM null_unique_index WHERE k IS NULL ORDER BY v;
 k | v
---+---
   | 1
   | 2
(2 rows)

SELECT * FROM null_unique_index WHERE k IS NOT NULL ORDER BY v;
 k | v
---+---
 3 | 3
 4 | 4
(2 rows)

DELETE FROM null_unique_index WHERE k = 3;
SELECT * FROM null_unique_index WHERE k IS NULL ORDER BY v;
 k | v
---+---
   | 1
   | 2
(2 rows)

SELECT * FROM null_unique_index WHERE k IS NOT NULL ORDER BY v;
 k | v
---+---
 4 | 4
(1 row)

EXPLAIN(COSTS OFF) DELETE FROM null_unique_index WHERE k IS NULL;
                             QUERY PLAN
---------------------------------------------------------------------
 Delete on null_unique_index
   ->  Index Scan using null_unique_index_k_idx on null_unique_index
         Index Cond: (k IS NULL)
(3 rows)

DELETE FROM null_unique_index WHERE k IS NULL;
SELECT * FROM null_unique_index ORDER BY v;
 k | v
---+---
 4 | 4
(1 row)

INSERT INTO null_unique_index values (NULL, 2), (3, 3), (NULL, 5);
EXPLAIN(COSTS OFF) UPDATE null_unique_index SET k = NULL WHERE k IS NOT NULL;
               QUERY PLAN
-----------------------------------------
 Update on null_unique_index
   ->  Foreign Scan on null_unique_index
         Filter: (k IS NOT NULL)
(3 rows)

UPDATE null_unique_index SET k = NULL WHERE k IS NOT NULL;
SELECT * FROM null_unique_index ORDER BY v;
 k | v
---+---
   | 2
   | 3
   | 4
   | 5
(4 rows)

-- Test index update with UPDATE and DELETE
CREATE TABLE test_unique (k int PRIMARY KEY, v1 int, v2 int);
CREATE UNIQUE INDEX ON test_unique (v1);
CREATE INDEX ON test_unique (v2);
-- Insert a row
INSERT INTO test_unique VALUES (1, 1, 1);
SELECT * FROM test_unique;
 k | v1 | v2
---+----+----
 1 |  1 |  1
(1 row)

-- UPDATE a row and verify the content of associated indexes via index-only scan
UPDATE test_unique SET v1 = 2 WHERE k = 1;
SELECT v1 FROM test_unique WHERE v1 IN (1, 2);
 v1
----
  2
(1 row)

SELECT v2 FROM test_unique WHERE v2 IN (1, 2);
 v2
----
  1
(1 row)

-- DELETE a row and verify the content of associated indexes via index-only scan
DELETE FROM test_unique WHERE k = 1;
SELECT v1 FROM test_unique WHERE v1 IN (1, 2);
 v1
----
(0 rows)

SELECT v2 FROM test_unique WHERE v2 IN (1, 2);
 v2
----
(0 rows)

-- Insert 2 rows of the affected v1 values. Make sure both can be inserted
-- with no duplicate key violation.
INSERT INTO test_unique VALUES (1, 1, 1);
INSERT INTO test_unique VALUES (2, 2, 2);
SELECT * FROM test_unique;
 k | v1 | v2
---+----+----
 1 |  1 |  1
 2 |  2 |  2
(2 rows)

-- Test cascade-truncate indexes
CREATE TABLE test_truncate (a int PRIMARY KEY, b int);
CREATE UNIQUE INDEX test_truncate_index ON test_truncate (b);
INSERT INTO test_truncate VALUES (1, 2);
INSERT INTO test_truncate VALUES (2, 2);
ERROR:  duplicate key value violates unique constraint "test_truncate_index"
EXPLAIN (COSTS OFF) SELECT b FROM test_truncate WHERE b = 2;
                         QUERY PLAN
------------------------------------------------------------
 Index Only Scan using test_truncate_index on test_truncate
   Index Cond: (b = 2)
(2 rows)

SELECT b FROM test_truncate WHERE b = 2;
 b
---
 2
(1 row)

TRUNCATE test_truncate;
SELECT b FROM test_truncate WHERE b = 2;
 b
---
(0 rows)

INSERT INTO test_truncate VALUES (2, 2);
INSERT INTO test_truncate VALUES (1, 2);
ERROR:  duplicate key value violates unique constraint "test_truncate_index"
DROP TABLE test_truncate;
-- Test index methods
CREATE TABLE test_method (k int PRIMARY KEY, v int);
CREATE INDEX ON test_method USING btree (v);
NOTICE:  index method "btree" was replaced with "lsm" in YugabyteDB
CREATE INDEX ON test_method USING hash (v);
NOTICE:  index method "hash" was replaced with "lsm" in YugabyteDB
CREATE INDEX ON test_method USING foo (v);
ERROR:  access method "foo" does not exist
\d test_method
            Table "public.test_method"
 Column |  Type   | Collation | Nullable | Default
--------+---------+-----------+----------+---------
 k      | integer |           | not null |
 v      | integer |           |          |
Indexes:
    "test_method_pkey" PRIMARY KEY, lsm (k HASH)
    "test_method_v_idx" lsm (v HASH)
    "test_method_v_idx1" lsm (v HASH)

DROP TABLE test_method;
-- Test include columns
CREATE TABLE test_include (c1 int, c2 int, c3 int);
INSERT INTO test_include VALUES (1, 1, 1), (1, 2, 2), (2, 2, 2), (3, 3, 3);
-- Expect duplicate key error
CREATE UNIQUE INDEX ON test_include (c1) include (c2);
ERROR:  duplicate key value violates unique constraint "test_include_c1_c2_idx"
DELETE FROM test_include WHERE c1 = 1 AND c2 = 2;
CREATE UNIQUE INDEX ON test_include (c1) include (c2);
EXPLAIN (COSTS OFF) SELECT c1, c2 FROM test_include WHERE c1 = 1;
                          QUERY PLAN
--------------------------------------------------------------
 Index Only Scan using test_include_c1_c2_idx on test_include
   Index Cond: (c1 = 1)
(2 rows)

SELECT c1, c2 FROM test_include WHERE c1 = 1;
 c1 | c2
----+----
  1 |  1
(1 row)

\d test_include
            Table "public.test_include"
 Column |  Type   | Collation | Nullable | Default
--------+---------+-----------+----------+---------
 c1     | integer |           |          |
 c2     | integer |           |          |
 c3     | integer |           |          |
Indexes:
    "test_include_c1_c2_idx" UNIQUE, lsm (c1 HASH) INCLUDE (c2)

-- Verify the included column is updated in both the base table and the index. Use WHERE condition
-- on c1 below to force the scan on the index vs. base table. Select the non-included column c3 in
-- the other case to force the use of sequential scan on the base table.
UPDATE test_include SET c2 = 22 WHERE c1 = 2;
EXPLAIN (COSTS OFF) SELECT c1, c2 FROM test_include WHERE c1 > 0 ORDER BY c2;
             QUERY PLAN
------------------------------------
 Sort
   Sort Key: c2
   ->  Foreign Scan on test_include
         Filter: (c1 > 0)
(4 rows)

EXPLAIN (COSTS OFF) SELECT * FROM test_include ORDER BY c2;
             QUERY PLAN
------------------------------------
 Sort
   Sort Key: c2
   ->  Foreign Scan on test_include
(3 rows)

SELECT c1, c2 FROM test_include WHERE c1 > 0 ORDER BY c2;
 c1 | c2
----+----
  1 |  1
  3 |  3
  2 | 22
(3 rows)

SELECT * FROM test_include ORDER BY c2;
 c1 | c2 | c3
----+----+----
  1 |  1 |  1
  3 |  3 |  3
  2 | 22 |  2
(3 rows)

UPDATE test_include SET c2 = NULL WHERE c1 = 1;
-- TODO(mihnea) Disabled temporarily due to issue #1611
-- UPDATE test_include SET c2 = 33 WHERE c2 = 3;
DELETE FROM test_include WHERE c1 = 2;
SELECT c1, c2 FROM test_include WHERE c1 > 0 ORDER BY c2;
 c1 | c2
----+----
  3 |  3
  1 |
(2 rows)

SELECT * FROM test_include ORDER BY c2;
 c1 | c2 | c3
----+----+----
  3 |  3 |  3
  1 |    |  1
(2 rows)

-- Test hash methods
CREATE TABLE test_method (
  h1 int, h2 int, r1 int, r2 int, v1 int, v2 int,
  PRIMARY KEY ((h1, h2) HASH, r1, r2));
CREATE INDEX ON test_method (h2 HASH, r2, r1);
CREATE INDEX ON test_method (r1, r2);
CREATE UNIQUE INDEX ON test_method (v1, v2);
\d test_method
            Table "public.test_method"
 Column |  Type   | Collation | Nullable | Default
--------+---------+-----------+----------+---------
 h1     | integer |           | not null |
 h2     | integer |           | not null |
 r1     | integer |           | not null |
 r2     | integer |           | not null |
 v1     | integer |           |          |
 v2     | integer |           |          |
Indexes:
    "test_method_pkey" PRIMARY KEY, lsm ((h1, h2) HASH, r1, r2)
    "test_method_v1_v2_idx" UNIQUE, lsm (v1 HASH, v2)
    "test_method_h2_r2_r1_idx" lsm (h2 HASH, r2, r1)
    "test_method_r1_r2_idx" lsm (r1 HASH, r2)

-- These should fail
CREATE INDEX ON test_method (h1 HASH, h2 HASH, r2, r1);
ERROR:  multiple hash columns must be defined as a single hash column group
LINE 1: CREATE INDEX ON test_method (h1 HASH, h2 HASH, r2, r1);
                                              ^
CREATE INDEX ON test_method (r1, h1 HASH);
ERROR:  hash column not allowed after an ASC/DESC column
LINE 1: CREATE INDEX ON test_method (r1, h1 HASH);
                                         ^
INSERT INTO test_method VALUES
  (1, 1, 1, 1, 1, 11),
  (1, 1, 1, 2, 2, 12),
  (1, 1, 2, 1, 3, 13),
  (1, 1, 2, 2, 4, 14),
  (1, 2, 1, 1, 5, 15),
  (1, 2, 1, 2, 6, 16),
  (1, 2, 2, 1, 7, 17),
  (1, 2, 2, 2, 8, 18),
  (2, 0, 1, 1, 9, 19),
  (2, 1, 1, 2, 10, 20);
-- Test scans using different indexes. Verify order by.
EXPLAIN (COSTS OFF) SELECT * FROM test_method ORDER BY h1, h2;
            QUERY PLAN
-----------------------------------
 Sort
   Sort Key: h1, h2
   ->  Foreign Scan on test_method
(3 rows)

SELECT * FROM test_method ORDER BY h1, h2;
 h1 | h2 | r1 | r2 | v1 | v2
----+----+----+----+----+----
  1 |  1 |  2 |  1 |  3 | 13
  1 |  1 |  2 |  2 |  4 | 14
  1 |  1 |  1 |  1 |  1 | 11
  1 |  1 |  1 |  2 |  2 | 12
  1 |  2 |  2 |  2 |  8 | 18
  1 |  2 |  1 |  2 |  6 | 16
  1 |  2 |  2 |  1 |  7 | 17
  1 |  2 |  1 |  1 |  5 | 15
  2 |  0 |  1 |  1 |  9 | 19
  2 |  1 |  1 |  2 | 10 | 20
(10 rows)

EXPLAIN (COSTS OFF) SELECT * FROM test_method WHERE h1 = 1 AND h2 = 1 ORDER BY r1, r2;
                    QUERY PLAN
--------------------------------------------------
 Index Scan using test_method_pkey on test_method
   Index Cond: ((h1 = 1) AND (h2 = 1))
(2 rows)

SELECT * FROM test_method WHERE h1 = 1 AND h2 = 1 ORDER BY r1, r2;
 h1 | h2 | r1 | r2 | v1 | v2
----+----+----+----+----+----
  1 |  1 |  1 |  1 |  1 | 11
  1 |  1 |  1 |  2 |  2 | 12
  1 |  1 |  2 |  1 |  3 | 13
  1 |  1 |  2 |  2 |  4 | 14
(4 rows)

EXPLAIN (COSTS OFF) SELECT * FROM test_method ORDER BY r1, r2;
            QUERY PLAN
-----------------------------------
 Sort
   Sort Key: r1, r2
   ->  Foreign Scan on test_method
(3 rows)

SELECT * FROM test_method ORDER BY r1, r2;
 h1 | h2 | r1 | r2 | v1 | v2
----+----+----+----+----+----
  1 |  2 |  1 |  1 |  5 | 15
  1 |  1 |  1 |  1 |  1 | 11
  2 |  0 |  1 |  1 |  9 | 19
  1 |  2 |  1 |  2 |  6 | 16
  1 |  1 |  1 |  2 |  2 | 12
  2 |  1 |  1 |  2 | 10 | 20
  1 |  1 |  2 |  1 |  3 | 13
  1 |  2 |  2 |  1 |  7 | 17
  1 |  2 |  2 |  2 |  8 | 18
  1 |  1 |  2 |  2 |  4 | 14
(10 rows)

EXPLAIN (COSTS OFF) SELECT * FROM test_method WHERE v1 > 5ORDER BY v1, v2;
            QUERY PLAN
-----------------------------------
 Sort
   Sort Key: v1, v2
   ->  Foreign Scan on test_method
         Filter: (v1 > 5)
(4 rows)

SELECT * FROM test_method WHERE v1 > 5ORDER BY v1, v2;
 h1 | h2 | r1 | r2 | v1 | v2
----+----+----+----+----+----
  1 |  2 |  1 |  2 |  6 | 16
  1 |  2 |  2 |  1 |  7 | 17
  1 |  2 |  2 |  2 |  8 | 18
  2 |  0 |  1 |  1 |  9 | 19
  2 |  1 |  1 |  2 | 10 | 20
(5 rows)

EXPLAIN (COSTS OFF) SELECT * FROM test_method WHERE h2 = 2 ORDER BY r1, r2;
                           QUERY PLAN
----------------------------------------------------------------
 Sort
   Sort Key: r1, r2
   ->  Index Scan using test_method_h2_r2_r1_idx on test_method
         Index Cond: (h2 = 2)
(4 rows)

SELECT * FROM test_method WHERE h2 = 2 ORDER BY r1, r2;
 h1 | h2 | r1 | r2 | v1 | v2
----+----+----+----+----+----
  1 |  2 |  1 |  1 |  5 | 15
  1 |  2 |  1 |  2 |  6 | 16
  1 |  2 |  2 |  1 |  7 | 17
  1 |  2 |  2 |  2 |  8 | 18
(4 rows)

EXPLAIN (COSTS OFF) UPDATE test_method SET v2 = v2 + 10 WHERE h2 = 2;
                           QUERY PLAN
----------------------------------------------------------------
 Update on test_method
   ->  Index Scan using test_method_h2_r2_r1_idx on test_method
         Index Cond: (h2 = 2)
(3 rows)

-- Test update using a hash index
UPDATE test_method SET v2 = v2 + 10 WHERE h2 = 2;
SELECT * FROM test_method ORDER BY h1, h2;
 h1 | h2 | r1 | r2 | v1 | v2
----+----+----+----+----+----
  1 |  1 |  2 |  1 |  3 | 13
  1 |  1 |  2 |  2 |  4 | 14
  1 |  1 |  1 |  1 |  1 | 11
  1 |  1 |  1 |  2 |  2 | 12
  1 |  2 |  2 |  2 |  8 | 28
  1 |  2 |  1 |  2 |  6 | 26
  1 |  2 |  2 |  1 |  7 | 27
  1 |  2 |  1 |  1 |  5 | 25
  2 |  0 |  1 |  1 |  9 | 19
  2 |  1 |  1 |  2 | 10 | 20
(10 rows)

SELECT * FROM test_method ORDER BY r1, r2;
 h1 | h2 | r1 | r2 | v1 | v2
----+----+----+----+----+----
  1 |  2 |  1 |  1 |  5 | 25
  1 |  1 |  1 |  1 |  1 | 11
  2 |  0 |  1 |  1 |  9 | 19
  1 |  2 |  1 |  2 |  6 | 26
  1 |  1 |  1 |  2 |  2 | 12
  2 |  1 |  1 |  2 | 10 | 20
  1 |  1 |  2 |  1 |  3 | 13
  1 |  2 |  2 |  1 |  7 | 27
  1 |  2 |  2 |  2 |  8 | 28
  1 |  1 |  2 |  2 |  4 | 14
(10 rows)

-- Test delete using a unique index
EXPLAIN (COSTS OFF) DELETE FROM test_method WHERE v1 = 5 AND v2 = 25;
                         QUERY PLAN
-------------------------------------------------------------
 Delete on test_method
   ->  Index Scan using test_method_v1_v2_idx on test_method
         Index Cond: ((v1 = 5) AND (v2 = 25))
(3 rows)

DELETE FROM test_method WHERE v1 = 5 AND v2 = 25;
-- Test delete using the primary key
EXPLAIN (COSTS OFF) DELETE FROM test_method WHERE h1 = 2 AND h2 = 0;
                       QUERY PLAN
--------------------------------------------------------
 Delete on test_method
   ->  Index Scan using test_method_pkey on test_method
         Index Cond: ((h1 = 2) AND (h2 = 0))
(3 rows)

DELETE FROM test_method WHERE h1 = 2 AND h2 = 0;
SELECT * FROM test_method ORDER BY h1, h2;
 h1 | h2 | r1 | r2 | v1 | v2
----+----+----+----+----+----
  1 |  1 |  2 |  2 |  4 | 14
  1 |  1 |  1 |  1 |  1 | 11
  1 |  1 |  1 |  2 |  2 | 12
  1 |  1 |  2 |  1 |  3 | 13
  1 |  2 |  2 |  2 |  8 | 28
  1 |  2 |  1 |  2 |  6 | 26
  1 |  2 |  2 |  1 |  7 | 27
  2 |  1 |  1 |  2 | 10 | 20
(8 rows)
