--
-- ALTER_TABLE
-- add, rename, drop attribute
--
CREATE TABLE tmp (initial int4);
ALTER TABLE tmp1 ADD COLUMN xmin integer; -- fails
ERROR:  relation "tmp1" does not exist
ALTER TABLE tmp ADD COLUMN b name;
ALTER TABLE tmp ADD COLUMN c text;
ALTER TABLE tmp ADD COLUMN d float8;
ALTER TABLE tmp ADD COLUMN e float4;
ALTER TABLE tmp ADD COLUMN f int2;
ALTER TABLE tmp ADD COLUMN i char;
ALTER TABLE tmp ADD COLUMN k int4;
ALTER TABLE tmp ADD COLUMN m xid;
ALTER TABLE tmp ADD COLUMN n oidvector;
ALTER TABLE tmp ADD COLUMN v timestamp;
ALTER TABLE tmp ADD COLUMN y float4[];
ALTER TABLE tmp ADD COLUMN z int2[];
INSERT INTO tmp (b, c, d, e, f, i, k, m, n, v, y, z)
   VALUES ('name', 'text', 4.1, 4.1, 2, 'c', 314159, '512',
   '1 2 3 4 5 6 7 8', 'epoch', '{1.0,2.0,3.0,4.0}', '{1,2,3,4}');
SELECT * FROM tmp;
 initial |  b   |  c   |  d  |  e  | f | i |   k    |  m  |        n        |            v             |     y     |     z
---------+------+------+-----+-----+---+---+--------+-----+-----------------+--------------------------+-----------+-----------
         | name | text | 4.1 | 4.1 | 2 | c | 314159 | 512 | 1 2 3 4 5 6 7 8 | Thu Jan 01 00:00:00 1970 | {1,2,3,4} | {1,2,3,4}
(1 row)

DROP TABLE tmp;
-- alter table / drop column tests
-- try altering system catalogs, should fail
alter table pg_class drop column relname;
ERROR:  permission denied: "pg_class" is a system catalog
-- try altering non-existent table, should fail
alter table nosuchtable drop column bar;
ERROR:  relation "nosuchtable" does not exist
-- test dropping columns
create table atacc1 (a int4 not null, b int4, c int4 not null, d int4);
insert into atacc1 values (1, 2, 3, 4);
alter table atacc1 drop a;
alter table atacc1 drop a;
ERROR:  Not found: The specified column does not exist: a
-- SELECTs
select * from atacc1;
 b | c | d
---+---+---
 2 | 3 | 4
(1 row)

select * from atacc1 order by a;
ERROR:  column "a" does not exist
LINE 1: select * from atacc1 order by a;
                                      ^
select * from atacc1 order by "........pg.dropped.1........";
ERROR:  column "........pg.dropped.1........" does not exist
LINE 1: select * from atacc1 order by "........pg.dropped.1........"...
                                      ^
select * from atacc1 group by a;
ERROR:  column "a" does not exist
LINE 1: select * from atacc1 group by a;
                                      ^
select * from atacc1 group by "........pg.dropped.1........";
ERROR:  column "........pg.dropped.1........" does not exist
LINE 1: select * from atacc1 group by "........pg.dropped.1........"...
                                      ^
select atacc1.* from atacc1;
 b | c | d
---+---+---
 2 | 3 | 4
(1 row)

select a from atacc1;
ERROR:  column "a" does not exist
LINE 1: select a from atacc1;
               ^
select atacc1.a from atacc1;
ERROR:  column atacc1.a does not exist
LINE 1: select atacc1.a from atacc1;
               ^
select b,c,d from atacc1;
 b | c | d
---+---+---
 2 | 3 | 4
(1 row)

select a,b,c,d from atacc1;
ERROR:  column "a" does not exist
LINE 1: select a,b,c,d from atacc1;
               ^
select * from atacc1 where a = 1;
ERROR:  column "a" does not exist
LINE 1: select * from atacc1 where a = 1;
                                   ^
select "........pg.dropped.1........" from atacc1;
ERROR:  column "........pg.dropped.1........" does not exist
LINE 1: select "........pg.dropped.1........" from atacc1;
               ^
select atacc1."........pg.dropped.1........" from atacc1;
ERROR:  column atacc1.........pg.dropped.1........ does not exist
LINE 1: select atacc1."........pg.dropped.1........" from atacc1;
               ^
select "........pg.dropped.1........",b,c,d from atacc1;
ERROR:  column "........pg.dropped.1........" does not exist
LINE 1: select "........pg.dropped.1........",b,c,d from atacc1;
               ^
select * from atacc1 where "........pg.dropped.1........" = 1;
ERROR:  column "........pg.dropped.1........" does not exist
LINE 1: select * from atacc1 where "........pg.dropped.1........" = ...
                                   ^
-- UPDATEs
update atacc1 set a = 3;
ERROR:  column "a" of relation "atacc1" does not exist
LINE 1: update atacc1 set a = 3;
                          ^
update atacc1 set b = 2 where a = 3;
ERROR:  column "a" does not exist
LINE 1: update atacc1 set b = 2 where a = 3;
                                      ^
update atacc1 set "........pg.dropped.1........" = 3;
ERROR:  column "........pg.dropped.1........" of relation "atacc1" does not exist
LINE 1: update atacc1 set "........pg.dropped.1........" = 3;
                          ^
update atacc1 set b = 2 where "........pg.dropped.1........" = 3;
ERROR:  column "........pg.dropped.1........" does not exist
LINE 1: update atacc1 set b = 2 where "........pg.dropped.1........"...
                                      ^
-- INSERTs
insert into atacc1 values (10, 11, 12, 13);
ERROR:  INSERT has more expressions than target columns
LINE 1: insert into atacc1 values (10, 11, 12, 13);
                                               ^
insert into atacc1 values (default, 11, 12, 13);
ERROR:  INSERT has more expressions than target columns
LINE 1: insert into atacc1 values (default, 11, 12, 13);
                                                    ^
insert into atacc1 values (11, 12, 13);
insert into atacc1 (a) values (10);
ERROR:  column "a" of relation "atacc1" does not exist
LINE 1: insert into atacc1 (a) values (10);
                            ^
insert into atacc1 (a) values (default);
ERROR:  column "a" of relation "atacc1" does not exist
LINE 1: insert into atacc1 (a) values (default);
                            ^
insert into atacc1 (a,b,c,d) values (10,11,12,13);
ERROR:  column "a" of relation "atacc1" does not exist
LINE 1: insert into atacc1 (a,b,c,d) values (10,11,12,13);
                            ^
insert into atacc1 (a,b,c,d) values (default,11,12,13);
ERROR:  column "a" of relation "atacc1" does not exist
LINE 1: insert into atacc1 (a,b,c,d) values (default,11,12,13);
                            ^
insert into atacc1 (b,c,d) values (11,12,13);
insert into atacc1 ("........pg.dropped.1........") values (10);
ERROR:  column "........pg.dropped.1........" of relation "atacc1" does not exist
LINE 1: insert into atacc1 ("........pg.dropped.1........") values (...
                            ^
insert into atacc1 ("........pg.dropped.1........") values (default);
ERROR:  column "........pg.dropped.1........" of relation "atacc1" does not exist
LINE 1: insert into atacc1 ("........pg.dropped.1........") values (...
                            ^
insert into atacc1 ("........pg.dropped.1........",b,c,d) values (10,11,12,13);
ERROR:  column "........pg.dropped.1........" of relation "atacc1" does not exist
LINE 1: insert into atacc1 ("........pg.dropped.1........",b,c,d) va...
                            ^
insert into atacc1 ("........pg.dropped.1........",b,c,d) values (default,11,12,13);
ERROR:  column "........pg.dropped.1........" of relation "atacc1" does not exist
LINE 1: insert into atacc1 ("........pg.dropped.1........",b,c,d) va...
                            ^
-- DELETEs
delete from atacc1 where a = 3;
ERROR:  column "a" does not exist
LINE 1: delete from atacc1 where a = 3;
                                 ^
delete from atacc1 where "........pg.dropped.1........" = 3;
ERROR:  column "........pg.dropped.1........" does not exist
LINE 1: delete from atacc1 where "........pg.dropped.1........" = 3;
                                 ^
delete from atacc1;
-- try dropping a non-existent column, should fail
alter table atacc1 drop bar;
ERROR:  Not found: The specified column does not exist: bar
-- try dropping the oid column, should succeed
alter table atacc1 drop oid;
ERROR:  Not found: The specified column does not exist: oid
-- try dropping the xmin column, should fail
alter table atacc1 drop xmin;
ERROR:  Not found: The specified column does not exist: xmin
-- try creating a view and altering that, should fail
create view myview as select * from atacc1;
select * from myview;
 b | c | d
---+---+---
(0 rows)

alter table myview drop d;
ERROR:  "myview" is not a table, composite type, or foreign table
drop view myview;
-- test some commands to make sure they fail on the dropped column
create index "testing_idx" on atacc1(a);
ERROR:  column "a" does not exist
create index "testing_idx" on atacc1("........pg.dropped.1........");
ERROR:  column "........pg.dropped.1........" does not exist
alter table atacc1 rename a to z;
ERROR:  column "a" does not exist
alter table atacc1 add constraint checka check (a >= 0);
ERROR:  column "a" does not exist
-- test create as and select into
insert into atacc1 values (21, 22, 23);
create table test1 as select * from atacc1;
select * from test1;
 b  | c  | d
----+----+----
 21 | 22 | 23
(1 row)

drop table test1;
select * into test2 from atacc1;
select * from test2;
 b  | c  | d
----+----+----
 21 | 22 | 23
(1 row)

drop table test2;
-- test constraints
alter table atacc1 add constraint checkb check (b < 0); -- should fail
ERROR:  check constraint "checkb" is violated by some row
alter table atacc1 add constraint checkb check (b > 0);
alter table atacc1 add constraint checkb2 check (b > 10);
alter table atacc1 add constraint checkb3 check (b > 10);
insert into atacc1 values (5, 5, 5); -- should fail
ERROR:  new row for relation "atacc1" violates check constraint "checkb2"
DETAIL:  Failing row contains (5, 5, 5).
alter table atacc1 drop constraint checkb2;
insert into atacc1 values (5, 5, 5);
ERROR:  new row for relation "atacc1" violates check constraint "checkb3"
DETAIL:  Failing row contains (5, 5, 5).
alter table atacc1 drop constraint checkb;
alter table atacc1 drop constraint if exists checkb2;
NOTICE:  constraint "checkb2" of relation "atacc1" does not exist, skipping
alter table atacc1 drop constraint if exists checkb3;
delete from atacc1 where b = 5;
-- test rename
alter table atacc1 rename b to e;
select * from atacc1;
 e  | c  | d
----+----+----
 21 | 22 | 23
(1 row)

-- try dropping all columns
alter table atacc1 drop c;
alter table atacc1 drop d;
alter table atacc1 drop b;
ERROR:  column "b" of relation "atacc1" does not exist
select * from atacc1;
ERROR:  Invalid argument: Invalid column number 2
drop table atacc1;
--
-- rename
--
CREATE TABLE tmp (regtable int);
ALTER TABLE tmp RENAME TO tmp_new;
SELECT * FROM tmp_new;
 regtable
----------
(0 rows)

SELECT * FROM tmp;		-- should fail
ERROR:  relation "tmp" does not exist
LINE 1: SELECT * FROM tmp;
                      ^
DROP TABLE tmp_new;
