CREATE TABLE yb_lock_tests
(
    k1 int,
    k2 int,
    r1 int,
    r2 text,
    v1 text,
    v2 text,
    PRIMARY KEY((k1, k2) HASH, r1,r2)
) SPLIT INTO 2 TABLETS;
CREATE UNIQUE INDEX yb_lock_tests_k1_k2 ON yb_lock_tests (k1,k2) SPLIT INTO 2 TABLETS;
CREATE FUNCTION is_between_now_and_clock_timestamp(input_time timestamptz)
RETURNS boolean
AS $$
BEGIN
  RETURN input_time >= now() AND input_time <= clock_timestamp();
END;
$$ LANGUAGE plpgsql;
CREATE
OR REPLACE FUNCTION validate_and_return_lock_status(input_relation oid, input_transaction_id uuid,
                                              OUT locktype text,
                                              OUT relation text, OUT mode text[], OUT granted boolean,
                                              OUT fastpath boolean, OUT valid_waitstart boolean,
                                              OUT valid_waitend boolean, OUT has_node boolean,
                                              OUT has_tablet_id boolean,
                                              OUT has_transaction_id boolean,
                                              OUT valid_subtransaction_id boolean,
                                              OUT has_status_tablet_id boolean,
                                              OUT is_explicit boolean,
                                              OUT hash_cols text[],
                                              OUT range_cols text[], OUT attnum smallint, OUT column_id integer,
                                              OUT multiple_rows_locked boolean, OUT num_blocking int4)
    RETURNS SETOF record
AS
$$
DECLARE
    difference record;
BEGIN
    FOR difference IN
        SELECT
            l.locktype,
            l.database,
            l.relation,
            l.pid,
            array_to_string(l.mode, ','),
            l.granted,
            l.fastpath,
            l.waitstart,
            l.waitend,
            CASE WHEN l.node IS NOT NULL THEN to_jsonb(l.node) ELSE 'null'::jsonb END AS node,
            CASE WHEN l.tablet_id IS NOT NULL THEN to_jsonb(l.tablet_id) ELSE 'null'::jsonb END AS tablet_id,
            CASE WHEN l.transaction_id IS NOT NULL THEN to_jsonb(l.transaction_id) ELSE 'null'::jsonb END AS transaction_id,
            CASE WHEN l.subtransaction_id IS NOT NULL THEN to_jsonb(l.subtransaction_id) ELSE 'null'::jsonb END AS subtransaction_id,
            CASE WHEN l.is_explicit IS NOT NULL THEN to_jsonb(l.is_explicit) ELSE 'null'::jsonb END AS is_explicit,
            CASE WHEN l.hash_cols IS NOT NULL OR l.range_cols IS NOT NULL THEN to_jsonb(l.hash_cols || l.range_cols) ELSE 'null'::jsonb END AS cols,
            CASE WHEN l.attnum IS NOT NULL THEN to_jsonb(l.attnum) ELSE 'null'::jsonb END AS attnum,
            CASE WHEN l.column_id IS NOT NULL THEN to_jsonb(l.column_id) ELSE 'null'::jsonb END AS column_id,
            CASE WHEN l.multiple_rows_locked IS NOT NULL THEN to_jsonb(l.multiple_rows_locked) ELSE 'null'::jsonb END AS multiple_rows_locked,
            CASE WHEN l.blocked_by IS NOT NULL THEN to_jsonb(l.blocked_by) ELSE 'null'::jsonb END AS blocked_by
        FROM
            yb_lock_status(null, null) l
        EXCEPT
        SELECT
            p.locktype,
            p.database,
            p.relation,
            p.pid,
            p.mode,
            p.granted,
            p.fastpath,
            p.waitstart,
            p.waitend,
            p.ybdetails->'node',
            p.ybdetails->'tablet_id',
            p.ybdetails->'transactionid',
            p.ybdetails->'subtransaction_id',
            p.ybdetails->'is_explicit',
            p.ybdetails->'keyrangedetails'->'cols',
            p.ybdetails->'keyrangedetails'->'attnum',
            p.ybdetails->'keyrangedetails'->'column_id',
            p.ybdetails->'keyrangedetails'->'multiple_rows_locked',
            p.ybdetails->'blocked_by'
        FROM pg_locks p
    LOOP
        RAISE EXCEPTION 'There is a difference in the output of pg_locks and yb_lock_status. The difference is: %', difference;
    END LOOP;

    RETURN QUERY SELECT l.locktype,
                        l.relation::regclass::text,
                        l.mode,
                        l.granted,
                        l.fastpath,
                        is_between_now_and_clock_timestamp(l.waitstart)                 as valid_waitstart,
                        is_between_now_and_clock_timestamp(l.waitend)                   as valid_waitend,
                        CASE WHEN l.node IS NOT NULL THEN true ELSE false END           as has_node,
                        CASE WHEN l.tablet_id IS NOT NULL THEN true ELSE FALSE END      as has_tablet_id,
                        CASE WHEN l.transaction_id IS NOT NULL THEN true ELSE FALSE END as has_transaction_id,
                        (l.subtransaction_id > 0) as valid_subtransaction_id,
                        CASE WHEN l.status_tablet_id IS NOT NULL THEN true ELSE FALSE END as has_status_tablet_id,
                        l.is_explicit,
                        l.hash_cols,
                        l.range_cols,
                        l.attnum,
                        l.column_id,
                        l.multiple_rows_locked,
                        array_length(l.blocked_by, 1)
                 -- TODO: Add the relation arg when we support querying by relation
                 FROM yb_lock_status(null, input_transaction_id) l
                 WHERE l.relation = input_relation
                 ORDER BY l.relation::regclass::text, l.transaction_id, l.hash_cols NULLS FIRST,
                          l.range_cols NULLS FIRST, l.column_id NULLS FIRST;
END ;
$$ LANGUAGE plpgsql;
-- Basic queries
SELECT true FROM yb_lock_status(null, null);
 bool
------
(0 rows)

SELECT true FROM yb_lock_status('yb_lock_tests'::regclass, null);
 bool
------
(0 rows)

SELECT true FROM yb_lock_status('yb_lock_tests'::regclass::int4, null);
 bool
------
(0 rows)

SELECT true FROM yb_lock_status(null, 'bogus');
ERROR:  invalid input syntax for type uuid: "bogus"
LINE 1: SELECT true FROM yb_lock_status(null, 'bogus');
                                              ^
SELECT true FROM yb_lock_status(null, '10000000-2000-3000-1000-400000000000');
 bool
------
(0 rows)

SELECT true FROM yb_lock_status('yb_lock_tests'::regclass, '10000000-2000-3000-1000-400000000000');
 bool
------
(0 rows)

-- READ COMMITTED
-- Basic insert
BEGIN TRANSACTION ISOLATION LEVEL READ COMMITTED;
INSERT INTO yb_lock_tests VALUES (1, 1, 1, 'one', 1, 1);
INSERT INTO yb_lock_tests VALUES (2, 2, 2, 'two', 2, 2);
SELECT * FROM validate_and_return_lock_status('yb_lock_tests'::regclass, null);
 locktype |   relation    |            mode            | granted | fastpath | valid_waitstart | valid_waitend | has_node | has_tablet_id | has_transaction_id | valid_subtransaction_id | has_status_tablet_id | is_explicit | hash_cols |  range_cols   | attnum | column_id | multiple_rows_locked | num_blocking
----------+---------------+----------------------------+---------+----------+-----------------+---------------+----------+---------------+--------------------+-------------------------+----------------------+-------------+-----------+---------------+--------+-----------+----------------------+--------------
 relation | yb_lock_tests | {WEAK_READ,WEAK_WRITE}     | t       | f        |                 | t             | t        | t             | t                  | t                       | f                    | f           |           |               |        |           | t                    |
 relation | yb_lock_tests | {WEAK_READ,WEAK_WRITE}     | t       | f        |                 | t             | t        | t             | t                  | t                       | f                    | f           |           |               |        |           | t                    |
 keyrange | yb_lock_tests | {WEAK_READ,WEAK_WRITE}     | t       | f        |                 | t             | t        | t             | t                  | t                       | f                    | f           | {1,1}     |               |        |           | t                    |
 keyrange | yb_lock_tests | {WEAK_READ,WEAK_WRITE}     | t       | f        |                 | t             | t        | t             | t                  | t                       | f                    | f           | {1,1}     | {1}           |        |           | t                    |
 row      | yb_lock_tests | {STRONG_READ,STRONG_WRITE} | t       | f        |                 | t             | t        | t             | t                  | t                       | f                    | f           | {1,1}     | {1,"\"one\""} |        |           | f                    |
 keyrange | yb_lock_tests | {WEAK_READ,WEAK_WRITE}     | t       | f        |                 | t             | t        | t             | t                  | t                       | f                    | f           | {2,2}     |               |        |           | t                    |
 keyrange | yb_lock_tests | {WEAK_READ,WEAK_WRITE}     | t       | f        |                 | t             | t        | t             | t                  | t                       | f                    | f           | {2,2}     | {2}           |        |           | t                    |
 row      | yb_lock_tests | {STRONG_READ,STRONG_WRITE} | t       | f        |                 | t             | t        | t             | t                  | t                       | f                    | f           | {2,2}     | {2,"\"two\""} |        |           | f                    |
(8 rows)

SELECT * FROM validate_and_return_lock_status('yb_lock_tests_k1_k2'::regclass, null);
 locktype |      relation       |            mode            | granted | fastpath | valid_waitstart | valid_waitend | has_node | has_tablet_id | has_transaction_id | valid_subtransaction_id | has_status_tablet_id | is_explicit | hash_cols | range_cols | attnum | column_id | multiple_rows_locked | num_blocking
----------+---------------------+----------------------------+---------+----------+-----------------+---------------+----------+---------------+--------------------+-------------------------+----------------------+-------------+-----------+------------+--------+-----------+----------------------+--------------
 relation | yb_lock_tests_k1_k2 | {WEAK_READ,WEAK_WRITE}     | t       | f        |                 | t             | t        | t             | t                  | t                       | f                    | f           |           |            |        |           | t                    |
 relation | yb_lock_tests_k1_k2 | {WEAK_READ,WEAK_WRITE}     | t       | f        |                 | t             | t        | t             | t                  | t                       | f                    | f           |           |            |        |           | t                    |
 keyrange | yb_lock_tests_k1_k2 | {WEAK_READ,WEAK_WRITE}     | t       | f        |                 | t             | t        | t             | t                  | t                       | f                    | f           | {1}       |            |        |           | t                    |
 keyrange | yb_lock_tests_k1_k2 | {WEAK_READ,WEAK_WRITE}     | t       | f        |                 | t             | t        | t             | t                  | t                       | f                    | f           | {1}       | {1}        |        |           | t                    |
 row      | yb_lock_tests_k1_k2 | {STRONG_READ,STRONG_WRITE} | t       | f        |                 | t             | t        | t             | t                  | t                       | f                    | f           | {1}       | {1,"null"} |        |           | f                    |
 keyrange | yb_lock_tests_k1_k2 | {WEAK_READ,WEAK_WRITE}     | t       | f        |                 | t             | t        | t             | t                  | t                       | f                    | f           | {2}       |            |        |           | t                    |
 keyrange | yb_lock_tests_k1_k2 | {WEAK_READ,WEAK_WRITE}     | t       | f        |                 | t             | t        | t             | t                  | t                       | f                    | f           | {2}       | {2}        |        |           | t                    |
 row      | yb_lock_tests_k1_k2 | {STRONG_READ,STRONG_WRITE} | t       | f        |                 | t             | t        | t             | t                  | t                       | f                    | f           | {2}       | {2,"null"} |        |           | f                    |
(8 rows)

COMMIT;
-- Basic Column Update
BEGIN TRANSACTION ISOLATION LEVEL READ COMMITTED;
UPDATE yb_lock_tests SET v1 = 2 WHERE k1 = 1 AND k2 = 1;
SELECT * FROM validate_and_return_lock_status('yb_lock_tests'::regclass, null);
 locktype |   relation    |            mode            | granted | fastpath | valid_waitstart | valid_waitend | has_node | has_tablet_id | has_transaction_id | valid_subtransaction_id | has_status_tablet_id | is_explicit | hash_cols |  range_cols   | attnum | column_id | multiple_rows_locked | num_blocking
----------+---------------+----------------------------+---------+----------+-----------------+---------------+----------+---------------+--------------------+-------------------------+----------------------+-------------+-----------+---------------+--------+-----------+----------------------+--------------
 relation | yb_lock_tests | {WEAK_READ,WEAK_WRITE}     | t       | f        |                 | t             | t        | t             | t                  | t                       | f                    | f           |           |               |        |           | t                    |
 keyrange | yb_lock_tests | {WEAK_READ,WEAK_WRITE}     | t       | f        |                 | t             | t        | t             | t                  | t                       | f                    | f           | {1,1}     |               |        |           | t                    |
 keyrange | yb_lock_tests | {WEAK_READ,WEAK_WRITE}     | t       | f        |                 | t             | t        | t             | t                  | t                       | f                    | f           | {1,1}     | {1}           |        |           | t                    |
 row      | yb_lock_tests | {WEAK_READ,WEAK_WRITE}     | t       | f        |                 | t             | t        | t             | t                  | t                       | f                    | f           | {1,1}     | {1,"\"one\""} |        |           | f                    |
 column   | yb_lock_tests | {STRONG_READ,STRONG_WRITE} | t       | f        |                 | t             | t        | t             | t                  | t                       | f                    | f           | {1,1}     | {1,"\"one\""} |      5 |         4 | f                    |
(5 rows)

SELECT * FROM validate_and_return_lock_status('yb_lock_tests_k1_k2'::regclass, null);
 locktype | relation | mode | granted | fastpath | valid_waitstart | valid_waitend | has_node | has_tablet_id | has_transaction_id | valid_subtransaction_id | has_status_tablet_id | is_explicit | hash_cols | range_cols | attnum | column_id | multiple_rows_locked | num_blocking
----------+----------+------+---------+----------+-----------------+---------------+----------+---------------+--------------------+-------------------------+----------------------+-------------+-----------+------------+--------+-----------+----------------------+--------------
(0 rows)

ABORT;
-- Basic primary key update
BEGIN TRANSACTION ISOLATION LEVEL READ COMMITTED;
UPDATE yb_lock_tests SET r1 = 2 WHERE k1 = 1 AND k2 = 1;
SELECT * FROM validate_and_return_lock_status('yb_lock_tests'::regclass, null);
 locktype |   relation    |            mode            | granted | fastpath | valid_waitstart | valid_waitend | has_node | has_tablet_id | has_transaction_id | valid_subtransaction_id | has_status_tablet_id | is_explicit | hash_cols |  range_cols   | attnum | column_id | multiple_rows_locked | num_blocking
----------+---------------+----------------------------+---------+----------+-----------------+---------------+----------+---------------+--------------------+-------------------------+----------------------+-------------+-----------+---------------+--------+-----------+----------------------+--------------
 relation | yb_lock_tests | {WEAK_READ,WEAK_WRITE}     | t       | f        |                 | t             | t        | t             | t                  | t                       | f                    | f           |           |               |        |           | t                    |
 keyrange | yb_lock_tests | {WEAK_READ,WEAK_WRITE}     | t       | f        |                 | t             | t        | t             | t                  | t                       | f                    | f           | {1,1}     |               |        |           | t                    |
 keyrange | yb_lock_tests | {WEAK_READ,WEAK_WRITE}     | t       | f        |                 | t             | t        | t             | t                  | t                       | f                    | f           | {1,1}     | {1}           |        |           | t                    |
 row      | yb_lock_tests | {STRONG_READ,STRONG_WRITE} | t       | f        |                 | t             | t        | t             | t                  | t                       | f                    | f           | {1,1}     | {1,"\"one\""} |        |           | f                    |
 keyrange | yb_lock_tests | {WEAK_READ,WEAK_WRITE}     | t       | f        |                 | t             | t        | t             | t                  | t                       | f                    | f           | {1,1}     | {2}           |        |           | t                    |
 row      | yb_lock_tests | {STRONG_READ,STRONG_WRITE} | t       | f        |                 | t             | t        | t             | t                  | t                       | f                    | f           | {1,1}     | {2,"\"one\""} |        |           | f                    |
(6 rows)

SELECT * FROM validate_and_return_lock_status('yb_lock_tests_k1_k2'::regclass, null);
 locktype |      relation       |            mode            | granted | fastpath | valid_waitstart | valid_waitend | has_node | has_tablet_id | has_transaction_id | valid_subtransaction_id | has_status_tablet_id | is_explicit | hash_cols | range_cols | attnum | column_id | multiple_rows_locked | num_blocking
----------+---------------------+----------------------------+---------+----------+-----------------+---------------+----------+---------------+--------------------+-------------------------+----------------------+-------------+-----------+------------+--------+-----------+----------------------+--------------
 relation | yb_lock_tests_k1_k2 | {WEAK_READ,WEAK_WRITE}     | t       | f        |                 | t             | t        | t             | t                  | t                       | f                    | f           |           |            |        |           | t                    |
 relation | yb_lock_tests_k1_k2 | {WEAK_READ,WEAK_WRITE}     | t       | f        |                 | t             | t        | t             | t                  | t                       | f                    | f           |           |            |        |           | t                    |
 keyrange | yb_lock_tests_k1_k2 | {WEAK_READ,WEAK_WRITE}     | t       | f        |                 | t             | t        | t             | t                  | t                       | f                    | f           | {1}       |            |        |           | t                    |
 keyrange | yb_lock_tests_k1_k2 | {WEAK_READ,WEAK_WRITE}     | t       | f        |                 | t             | t        | t             | t                  | t                       | f                    | f           | {1}       |            |        |           | t                    |
 keyrange | yb_lock_tests_k1_k2 | {WEAK_READ,WEAK_WRITE}     | t       | f        |                 | t             | t        | t             | t                  | t                       | f                    | f           | {1}       | {1}        |        |           | t                    |
 keyrange | yb_lock_tests_k1_k2 | {WEAK_READ,WEAK_WRITE}     | t       | f        |                 | t             | t        | t             | t                  | t                       | f                    | f           | {1}       | {1}        |        |           | t                    |
 row      | yb_lock_tests_k1_k2 | {STRONG_READ,STRONG_WRITE} | t       | f        |                 | t             | t        | t             | t                  | t                       | f                    | f           | {1}       | {1,"null"} |        |           | f                    |
 row      | yb_lock_tests_k1_k2 | {STRONG_READ,STRONG_WRITE} | t       | f        |                 | t             | t        | t             | t                  | t                       | f                    | f           | {1}       | {1,"null"} |        |           | f                    |
(8 rows)

ABORT;
BEGIN TRANSACTION ISOLATION LEVEL READ COMMITTED;
UPDATE yb_lock_tests SET k2 = 2 WHERE k1 = 1 AND k2 = 1;
SELECT * FROM validate_and_return_lock_status('yb_lock_tests'::regclass, null);
 locktype |   relation    |            mode            | granted | fastpath | valid_waitstart | valid_waitend | has_node | has_tablet_id | has_transaction_id | valid_subtransaction_id | has_status_tablet_id | is_explicit | hash_cols |  range_cols   | attnum | column_id | multiple_rows_locked | num_blocking
----------+---------------+----------------------------+---------+----------+-----------------+---------------+----------+---------------+--------------------+-------------------------+----------------------+-------------+-----------+---------------+--------+-----------+----------------------+--------------
 relation | yb_lock_tests | {WEAK_READ,WEAK_WRITE}     | t       | f        |                 | t             | t        | t             | t                  | t                       | f                    | f           |           |               |        |           | t                    |
 keyrange | yb_lock_tests | {WEAK_READ,WEAK_WRITE}     | t       | f        |                 | t             | t        | t             | t                  | t                       | f                    | f           | {1,1}     |               |        |           | t                    |
 keyrange | yb_lock_tests | {WEAK_READ,WEAK_WRITE}     | t       | f        |                 | t             | t        | t             | t                  | t                       | f                    | f           | {1,1}     | {1}           |        |           | t                    |
 row      | yb_lock_tests | {STRONG_READ,STRONG_WRITE} | t       | f        |                 | t             | t        | t             | t                  | t                       | f                    | f           | {1,1}     | {1,"\"one\""} |        |           | f                    |
 keyrange | yb_lock_tests | {WEAK_READ,WEAK_WRITE}     | t       | f        |                 | t             | t        | t             | t                  | t                       | f                    | f           | {1,2}     |               |        |           | t                    |
 keyrange | yb_lock_tests | {WEAK_READ,WEAK_WRITE}     | t       | f        |                 | t             | t        | t             | t                  | t                       | f                    | f           | {1,2}     | {1}           |        |           | t                    |
 row      | yb_lock_tests | {STRONG_READ,STRONG_WRITE} | t       | f        |                 | t             | t        | t             | t                  | t                       | f                    | f           | {1,2}     | {1,"\"one\""} |        |           | f                    |
(7 rows)

SELECT * FROM validate_and_return_lock_status('yb_lock_tests_k1_k2'::regclass, null);
 locktype |      relation       |            mode            | granted | fastpath | valid_waitstart | valid_waitend | has_node | has_tablet_id | has_transaction_id | valid_subtransaction_id | has_status_tablet_id | is_explicit | hash_cols | range_cols | attnum | column_id | multiple_rows_locked | num_blocking
----------+---------------------+----------------------------+---------+----------+-----------------+---------------+----------+---------------+--------------------+-------------------------+----------------------+-------------+-----------+------------+--------+-----------+----------------------+--------------
 relation | yb_lock_tests_k1_k2 | {WEAK_READ,WEAK_WRITE}     | t       | f        |                 | t             | t        | t             | t                  | t                       | f                    | f           |           |            |        |           | t                    |
 keyrange | yb_lock_tests_k1_k2 | {WEAK_READ,WEAK_WRITE}     | t       | f        |                 | t             | t        | t             | t                  | t                       | f                    | f           | {1}       |            |        |           | t                    |
 keyrange | yb_lock_tests_k1_k2 | {WEAK_READ,WEAK_WRITE}     | t       | f        |                 | t             | t        | t             | t                  | t                       | f                    | f           | {1}       | {1}        |        |           | t                    |
 row      | yb_lock_tests_k1_k2 | {STRONG_READ,STRONG_WRITE} | t       | f        |                 | t             | t        | t             | t                  | t                       | f                    | f           | {1}       | {1,"null"} |        |           | f                    |
 keyrange | yb_lock_tests_k1_k2 | {WEAK_READ,WEAK_WRITE}     | t       | f        |                 | t             | t        | t             | t                  | t                       | f                    | f           | {1}       | {2}        |        |           | t                    |
 row      | yb_lock_tests_k1_k2 | {STRONG_READ,STRONG_WRITE} | t       | f        |                 | t             | t        | t             | t                  | t                       | f                    | f           | {1}       | {2,"null"} |        |           | f                    |
(6 rows)

ABORT;
-- SELECT FOR SHARE
BEGIN TRANSACTION ISOLATION LEVEL READ COMMITTED;
SELECT * FROM yb_lock_tests FOR SHARE;
 k1 | k2 | r1 | r2  | v1 | v2
----+----+----+-----+----+----
  2 |  2 |  2 | two | 2  | 2
  1 |  1 |  1 | one | 1  | 1
(2 rows)

SELECT * FROM validate_and_return_lock_status('yb_lock_tests'::regclass, null);
 locktype |   relation    |     mode      | granted | fastpath | valid_waitstart | valid_waitend | has_node | has_tablet_id | has_transaction_id | valid_subtransaction_id | has_status_tablet_id | is_explicit | hash_cols |  range_cols   | attnum | column_id | multiple_rows_locked | num_blocking
----------+---------------+---------------+---------+----------+-----------------+---------------+----------+---------------+--------------------+-------------------------+----------------------+-------------+-----------+---------------+--------+-----------+----------------------+--------------
 relation | yb_lock_tests | {WEAK_READ}   | t       | f        |                 | t             | t        | t             | t                  | t                       | f                    | f           |           |               |        |           | t                    |
 relation | yb_lock_tests | {WEAK_READ}   | t       | f        |                 | t             | t        | t             | t                  | t                       | f                    | f           |           |               |        |           | t                    |
 keyrange | yb_lock_tests | {WEAK_READ}   | t       | f        |                 | t             | t        | t             | t                  | t                       | f                    | f           | {1,1}     |               |        |           | t                    |
 keyrange | yb_lock_tests | {WEAK_READ}   | t       | f        |                 | t             | t        | t             | t                  | t                       | f                    | f           | {1,1}     | {1}           |        |           | t                    |
 row      | yb_lock_tests | {STRONG_READ} | t       | f        |                 | t             | t        | t             | t                  | t                       | f                    | t           | {1,1}     | {1,"\"one\""} |        |           | f                    |
 keyrange | yb_lock_tests | {WEAK_READ}   | t       | f        |                 | t             | t        | t             | t                  | t                       | f                    | f           | {2,2}     |               |        |           | t                    |
 keyrange | yb_lock_tests | {WEAK_READ}   | t       | f        |                 | t             | t        | t             | t                  | t                       | f                    | f           | {2,2}     | {2}           |        |           | t                    |
 row      | yb_lock_tests | {STRONG_READ} | t       | f        |                 | t             | t        | t             | t                  | t                       | f                    | t           | {2,2}     | {2,"\"two\""} |        |           | f                    |
(8 rows)

SELECT * FROM validate_and_return_lock_status('yb_lock_tests_k1_k2'::regclass, null);
 locktype | relation | mode | granted | fastpath | valid_waitstart | valid_waitend | has_node | has_tablet_id | has_transaction_id | valid_subtransaction_id | has_status_tablet_id | is_explicit | hash_cols | range_cols | attnum | column_id | multiple_rows_locked | num_blocking
----------+----------+------+---------+----------+-----------------+---------------+----------+---------------+--------------------+-------------------------+----------------------+-------------+-----------+------------+--------+-----------+----------------------+--------------
(0 rows)

COMMIT;
-- SELECT FOR KEY SHARE
BEGIN TRANSACTION ISOLATION LEVEL READ COMMITTED;
SELECT * FROM yb_lock_tests FOR KEY SHARE;
 k1 | k2 | r1 | r2  | v1 | v2
----+----+----+-----+----+----
  2 |  2 |  2 | two | 2  | 2
  1 |  1 |  1 | one | 1  | 1
(2 rows)

SELECT * FROM validate_and_return_lock_status('yb_lock_tests'::regclass, null);
 locktype |   relation    |    mode     | granted | fastpath | valid_waitstart | valid_waitend | has_node | has_tablet_id | has_transaction_id | valid_subtransaction_id | has_status_tablet_id | is_explicit | hash_cols |  range_cols   | attnum | column_id | multiple_rows_locked | num_blocking
----------+---------------+-------------+---------+----------+-----------------+---------------+----------+---------------+--------------------+-------------------------+----------------------+-------------+-----------+---------------+--------+-----------+----------------------+--------------
 relation | yb_lock_tests | {WEAK_READ} | t       | f        |                 | t             | t        | t             | t                  | t                       | f                    | f           |           |               |        |           | t                    |
 relation | yb_lock_tests | {WEAK_READ} | t       | f        |                 | t             | t        | t             | t                  | t                       | f                    | f           |           |               |        |           | t                    |
 keyrange | yb_lock_tests | {WEAK_READ} | t       | f        |                 | t             | t        | t             | t                  | t                       | f                    | f           | {1,1}     |               |        |           | t                    |
 keyrange | yb_lock_tests | {WEAK_READ} | t       | f        |                 | t             | t        | t             | t                  | t                       | f                    | f           | {1,1}     | {1}           |        |           | t                    |
 row      | yb_lock_tests | {WEAK_READ} | t       | f        |                 | t             | t        | t             | t                  | t                       | f                    | t           | {1,1}     | {1,"\"one\""} |        |           | f                    |
 keyrange | yb_lock_tests | {WEAK_READ} | t       | f        |                 | t             | t        | t             | t                  | t                       | f                    | f           | {2,2}     |               |        |           | t                    |
 keyrange | yb_lock_tests | {WEAK_READ} | t       | f        |                 | t             | t        | t             | t                  | t                       | f                    | f           | {2,2}     | {2}           |        |           | t                    |
 row      | yb_lock_tests | {WEAK_READ} | t       | f        |                 | t             | t        | t             | t                  | t                       | f                    | t           | {2,2}     | {2,"\"two\""} |        |           | f                    |
(8 rows)

SELECT * FROM validate_and_return_lock_status('yb_lock_tests_k1_k2'::regclass, null);
 locktype | relation | mode | granted | fastpath | valid_waitstart | valid_waitend | has_node | has_tablet_id | has_transaction_id | valid_subtransaction_id | has_status_tablet_id | is_explicit | hash_cols | range_cols | attnum | column_id | multiple_rows_locked | num_blocking
----------+----------+------+---------+----------+-----------------+---------------+----------+---------------+--------------------+-------------------------+----------------------+-------------+-----------+------------+--------+-----------+----------------------+--------------
(0 rows)

COMMIT;
-- SELECT FOR UPDATE
BEGIN TRANSACTION ISOLATION LEVEL READ COMMITTED;
SELECT * FROM yb_lock_tests FOR UPDATE;
 k1 | k2 | r1 | r2  | v1 | v2
----+----+----+-----+----+----
  2 |  2 |  2 | two | 2  | 2
  1 |  1 |  1 | one | 1  | 1
(2 rows)

SELECT * FROM validate_and_return_lock_status('yb_lock_tests'::regclass, null);
 locktype |   relation    |            mode            | granted | fastpath | valid_waitstart | valid_waitend | has_node | has_tablet_id | has_transaction_id | valid_subtransaction_id | has_status_tablet_id | is_explicit | hash_cols |  range_cols   | attnum | column_id | multiple_rows_locked | num_blocking
----------+---------------+----------------------------+---------+----------+-----------------+---------------+----------+---------------+--------------------+-------------------------+----------------------+-------------+-----------+---------------+--------+-----------+----------------------+--------------
 relation | yb_lock_tests | {WEAK_READ,WEAK_WRITE}     | t       | f        |                 | t             | t        | t             | t                  | t                       | f                    | f           |           |               |        |           | t                    |
 relation | yb_lock_tests | {WEAK_READ,WEAK_WRITE}     | t       | f        |                 | t             | t        | t             | t                  | t                       | f                    | f           |           |               |        |           | t                    |
 keyrange | yb_lock_tests | {WEAK_READ,WEAK_WRITE}     | t       | f        |                 | t             | t        | t             | t                  | t                       | f                    | f           | {1,1}     |               |        |           | t                    |
 keyrange | yb_lock_tests | {WEAK_READ,WEAK_WRITE}     | t       | f        |                 | t             | t        | t             | t                  | t                       | f                    | f           | {1,1}     | {1}           |        |           | t                    |
 row      | yb_lock_tests | {STRONG_READ,STRONG_WRITE} | t       | f        |                 | t             | t        | t             | t                  | t                       | f                    | t           | {1,1}     | {1,"\"one\""} |        |           | f                    |
 keyrange | yb_lock_tests | {WEAK_READ,WEAK_WRITE}     | t       | f        |                 | t             | t        | t             | t                  | t                       | f                    | f           | {2,2}     |               |        |           | t                    |
 keyrange | yb_lock_tests | {WEAK_READ,WEAK_WRITE}     | t       | f        |                 | t             | t        | t             | t                  | t                       | f                    | f           | {2,2}     | {2}           |        |           | t                    |
 row      | yb_lock_tests | {STRONG_READ,STRONG_WRITE} | t       | f        |                 | t             | t        | t             | t                  | t                       | f                    | t           | {2,2}     | {2,"\"two\""} |        |           | f                    |
(8 rows)

SELECT * FROM validate_and_return_lock_status('yb_lock_tests_k1_k2'::regclass, null);
 locktype | relation | mode | granted | fastpath | valid_waitstart | valid_waitend | has_node | has_tablet_id | has_transaction_id | valid_subtransaction_id | has_status_tablet_id | is_explicit | hash_cols | range_cols | attnum | column_id | multiple_rows_locked | num_blocking
----------+----------+------+---------+----------+-----------------+---------------+----------+---------------+--------------------+-------------------------+----------------------+-------------+-----------+------------+--------+-----------+----------------------+--------------
(0 rows)

ABORT;
-- SERIALIZABLE tests
BEGIN TRANSACTION ISOLATION LEVEL SERIALIZABLE;
SELECT * from yb_lock_tests;
 k1 | k2 | r1 | r2  | v1 | v2
----+----+----+-----+----+----
  2 |  2 |  2 | two | 2  | 2
  1 |  1 |  1 | one | 1  | 1
(2 rows)

SELECT * FROM validate_and_return_lock_status('yb_lock_tests'::regclass, null);
 locktype |   relation    |     mode      | granted | fastpath | valid_waitstart | valid_waitend | has_node | has_tablet_id | has_transaction_id | valid_subtransaction_id | has_status_tablet_id | is_explicit | hash_cols | range_cols | attnum | column_id | multiple_rows_locked | num_blocking
----------+---------------+---------------+---------+----------+-----------------+---------------+----------+---------------+--------------------+-------------------------+----------------------+-------------+-----------+------------+--------+-----------+----------------------+--------------
 relation | yb_lock_tests | {STRONG_READ} | t       | f        |                 | t             | t        | t             | t                  | t                       | f                    | f           |           |            |        |           | t                    |
 relation | yb_lock_tests | {STRONG_READ} | t       | f        |                 | t             | t        | t             | t                  | t                       | f                    | f           |           |            |        |           | t                    |
(2 rows)

SELECT * FROM validate_and_return_lock_status('yb_lock_tests_k1_k2'::regclass, null);
 locktype | relation | mode | granted | fastpath | valid_waitstart | valid_waitend | has_node | has_tablet_id | has_transaction_id | valid_subtransaction_id | has_status_tablet_id | is_explicit | hash_cols | range_cols | attnum | column_id | multiple_rows_locked | num_blocking
----------+----------+------+---------+----------+-----------------+---------------+----------+---------------+--------------------+-------------------------+----------------------+-------------+-----------+------------+--------+-----------+----------------------+--------------
(0 rows)

COMMIT;
BEGIN TRANSACTION ISOLATION LEVEL SERIALIZABLE;
SELECT * from yb_lock_tests where k1 = 1;
 k1 | k2 | r1 | r2  | v1 | v2
----+----+----+-----+----+----
  1 |  1 |  1 | one | 1  | 1
(1 row)

SELECT * FROM validate_and_return_lock_status('yb_lock_tests'::regclass, null);
 locktype |   relation    |     mode      | granted | fastpath | valid_waitstart | valid_waitend | has_node | has_tablet_id | has_transaction_id | valid_subtransaction_id | has_status_tablet_id | is_explicit | hash_cols |  range_cols   | attnum | column_id | multiple_rows_locked | num_blocking
----------+---------------+---------------+---------+----------+-----------------+---------------+----------+---------------+--------------------+-------------------------+----------------------+-------------+-----------+---------------+--------+-----------+----------------------+--------------
 relation | yb_lock_tests | {WEAK_READ}   | t       | f        |                 | t             | t        | t             | t                  | t                       | f                    | f           |           |               |        |           | t                    |
 keyrange | yb_lock_tests | {WEAK_READ}   | t       | f        |                 | t             | t        | t             | t                  | t                       | f                    | f           | {1,1}     |               |        |           | t                    |
 keyrange | yb_lock_tests | {WEAK_READ}   | t       | f        |                 | t             | t        | t             | t                  | t                       | f                    | f           | {1,1}     | {1}           |        |           | t                    |
 row      | yb_lock_tests | {STRONG_READ} | t       | f        |                 | t             | t        | t             | t                  | t                       | f                    | f           | {1,1}     | {1,"\"one\""} |        |           | f                    |
(4 rows)

SELECT * FROM validate_and_return_lock_status('yb_lock_tests_k1_k2'::regclass, null);
 locktype |      relation       |     mode      | granted | fastpath | valid_waitstart | valid_waitend | has_node | has_tablet_id | has_transaction_id | valid_subtransaction_id | has_status_tablet_id | is_explicit | hash_cols | range_cols | attnum | column_id | multiple_rows_locked | num_blocking
----------+---------------------+---------------+---------+----------+-----------------+---------------+----------+---------------+--------------------+-------------------------+----------------------+-------------+-----------+------------+--------+-----------+----------------------+--------------
 relation | yb_lock_tests_k1_k2 | {WEAK_READ}   | t       | f        |                 | t             | t        | t             | t                  | t                       | f                    | f           |           |            |        |           | t                    |
 keyrange | yb_lock_tests_k1_k2 | {STRONG_READ} | t       | f        |                 | t             | t        | t             | t                  | t                       | f                    | f           | {1}       |            |        |           | t                    |
(2 rows)

COMMIT;
BEGIN TRANSACTION ISOLATION LEVEL SERIALIZABLE;
SELECT * from yb_lock_tests where k1 = 1 and k2 = 1;
 k1 | k2 | r1 | r2  | v1 | v2
----+----+----+-----+----+----
  1 |  1 |  1 | one | 1  | 1
(1 row)

SELECT * FROM validate_and_return_lock_status('yb_lock_tests'::regclass, null);
 locktype |   relation    |     mode      | granted | fastpath | valid_waitstart | valid_waitend | has_node | has_tablet_id | has_transaction_id | valid_subtransaction_id | has_status_tablet_id | is_explicit | hash_cols |  range_cols   | attnum | column_id | multiple_rows_locked | num_blocking
----------+---------------+---------------+---------+----------+-----------------+---------------+----------+---------------+--------------------+-------------------------+----------------------+-------------+-----------+---------------+--------+-----------+----------------------+--------------
 relation | yb_lock_tests | {WEAK_READ}   | t       | f        |                 | t             | t        | t             | t                  | t                       | f                    | f           |           |               |        |           | t                    |
 keyrange | yb_lock_tests | {WEAK_READ}   | t       | f        |                 | t             | t        | t             | t                  | t                       | f                    | f           | {1,1}     |               |        |           | t                    |
 keyrange | yb_lock_tests | {WEAK_READ}   | t       | f        |                 | t             | t        | t             | t                  | t                       | f                    | f           | {1,1}     | {1}           |        |           | t                    |
 row      | yb_lock_tests | {STRONG_READ} | t       | f        |                 | t             | t        | t             | t                  | t                       | f                    | f           | {1,1}     | {1,"\"one\""} |        |           | f                    |
(4 rows)

SELECT * FROM validate_and_return_lock_status('yb_lock_tests_k1_k2'::regclass, null);
 locktype |      relation       |     mode      | granted | fastpath | valid_waitstart | valid_waitend | has_node | has_tablet_id | has_transaction_id | valid_subtransaction_id | has_status_tablet_id | is_explicit | hash_cols | range_cols | attnum | column_id | multiple_rows_locked | num_blocking
----------+---------------------+---------------+---------+----------+-----------------+---------------+----------+---------------+--------------------+-------------------------+----------------------+-------------+-----------+------------+--------+-----------+----------------------+--------------
 relation | yb_lock_tests_k1_k2 | {WEAK_READ}   | t       | f        |                 | t             | t        | t             | t                  | t                       | f                    | f           |           |            |        |           | t                    |
 keyrange | yb_lock_tests_k1_k2 | {WEAK_READ}   | t       | f        |                 | t             | t        | t             | t                  | t                       | f                    | f           | {1}       |            |        |           | t                    |
 keyrange | yb_lock_tests_k1_k2 | {STRONG_READ} | t       | f        |                 | t             | t        | t             | t                  | t                       | f                    | f           | {1}       | {1}        |        |           | t                    |
(3 rows)

COMMIT;
BEGIN TRANSACTION ISOLATION LEVEL SERIALIZABLE;
SELECT * from yb_lock_tests where k1 = 1 and k2 = 1 and r1 = 1 and r2 = 'one';
 k1 | k2 | r1 | r2  | v1 | v2
----+----+----+-----+----+----
  1 |  1 |  1 | one | 1  | 1
(1 row)

SELECT * FROM validate_and_return_lock_status('yb_lock_tests'::regclass, null);
 locktype |   relation    |     mode      | granted | fastpath | valid_waitstart | valid_waitend | has_node | has_tablet_id | has_transaction_id | valid_subtransaction_id | has_status_tablet_id | is_explicit | hash_cols |  range_cols   | attnum | column_id | multiple_rows_locked | num_blocking
----------+---------------+---------------+---------+----------+-----------------+---------------+----------+---------------+--------------------+-------------------------+----------------------+-------------+-----------+---------------+--------+-----------+----------------------+--------------
 relation | yb_lock_tests | {WEAK_READ}   | t       | f        |                 | t             | t        | t             | t                  | t                       | f                    | f           |           |               |        |           | t                    |
 keyrange | yb_lock_tests | {WEAK_READ}   | t       | f        |                 | t             | t        | t             | t                  | t                       | f                    | f           | {1,1}     |               |        |           | t                    |
 keyrange | yb_lock_tests | {WEAK_READ}   | t       | f        |                 | t             | t        | t             | t                  | t                       | f                    | f           | {1,1}     | {1}           |        |           | t                    |
 row      | yb_lock_tests | {STRONG_READ} | t       | f        |                 | t             | t        | t             | t                  | t                       | f                    | f           | {1,1}     | {1,"\"one\""} |        |           | f                    |
(4 rows)

SELECT * FROM validate_and_return_lock_status('yb_lock_tests_k1_k2'::regclass, null);
 locktype | relation | mode | granted | fastpath | valid_waitstart | valid_waitend | has_node | has_tablet_id | has_transaction_id | valid_subtransaction_id | has_status_tablet_id | is_explicit | hash_cols | range_cols | attnum | column_id | multiple_rows_locked | num_blocking
----------+----------+------+---------+----------+-----------------+---------------+----------+---------------+--------------------+-------------------------+----------------------+-------------+-----------+------------+--------+-----------+----------------------+--------------
(0 rows)

COMMIT;
-- Foreign key reference
CREATE TABLE fk_reference
(
    k1 int,
    k2 int,
    r1 int,
    r2 text,
    FOREIGN KEY (k1, k2, r1, r2) REFERENCES yb_lock_tests (k1, k2, r1, r2),
    PRIMARY KEY (k1, k2, r1, r2)
);
BEGIN;
INSERT INTO fk_reference VALUES(1,1,1,'one');
SELECT * FROM validate_and_return_lock_status('yb_lock_tests'::regclass, null);
 locktype |   relation    |    mode     | granted | fastpath | valid_waitstart | valid_waitend | has_node | has_tablet_id | has_transaction_id | valid_subtransaction_id | has_status_tablet_id | is_explicit | hash_cols |  range_cols   | attnum | column_id | multiple_rows_locked | num_blocking
----------+---------------+-------------+---------+----------+-----------------+---------------+----------+---------------+--------------------+-------------------------+----------------------+-------------+-----------+---------------+--------+-----------+----------------------+--------------
 relation | yb_lock_tests | {WEAK_READ} | t       | f        |                 | t             | t        | t             | t                  | t                       | f                    | f           |           |               |        |           | t                    |
 keyrange | yb_lock_tests | {WEAK_READ} | t       | f        |                 | t             | t        | t             | t                  | t                       | f                    | f           | {1,1}     |               |        |           | t                    |
 keyrange | yb_lock_tests | {WEAK_READ} | t       | f        |                 | t             | t        | t             | t                  | t                       | f                    | f           | {1,1}     | {1}           |        |           | t                    |
 row      | yb_lock_tests | {WEAK_READ} | t       | f        |                 | t             | t        | t             | t                  | t                       | f                    | t           | {1,1}     | {1,"\"one\""} |        |           | f                    |
(4 rows)

SELECT * FROM validate_and_return_lock_status('fk_reference'::regclass, null);
 locktype |   relation   |            mode            | granted | fastpath | valid_waitstart | valid_waitend | has_node | has_tablet_id | has_transaction_id | valid_subtransaction_id | has_status_tablet_id | is_explicit | hash_cols |   range_cols    | attnum | column_id | multiple_rows_locked | num_blocking
----------+--------------+----------------------------+---------+----------+-----------------+---------------+----------+---------------+--------------------+-------------------------+----------------------+-------------+-----------+-----------------+--------+-----------+----------------------+--------------
 relation | fk_reference | {WEAK_READ,WEAK_WRITE}     | t       | f        |                 | t             | t        | t             | t                  | t                       | f                    | f           |           |                 |        |           | t                    |
 keyrange | fk_reference | {WEAK_READ,WEAK_WRITE}     | t       | f        |                 | t             | t        | t             | t                  | t                       | f                    | f           | {1}       |                 |        |           | t                    |
 keyrange | fk_reference | {WEAK_READ,WEAK_WRITE}     | t       | f        |                 | t             | t        | t             | t                  | t                       | f                    | f           | {1}       | {1}             |        |           | t                    |
 keyrange | fk_reference | {WEAK_READ,WEAK_WRITE}     | t       | f        |                 | t             | t        | t             | t                  | t                       | f                    | f           | {1}       | {1,1}           |        |           | t                    |
 row      | fk_reference | {STRONG_READ,STRONG_WRITE} | t       | f        |                 | t             | t        | t             | t                  | t                       | f                    | f           | {1}       | {1,1,"\"one\""} |        |           | f                    |
(5 rows)

SELECT * FROM validate_and_return_lock_status('yb_lock_tests_k1_k2'::regclass, null);
 locktype | relation | mode | granted | fastpath | valid_waitstart | valid_waitend | has_node | has_tablet_id | has_transaction_id | valid_subtransaction_id | has_status_tablet_id | is_explicit | hash_cols | range_cols | attnum | column_id | multiple_rows_locked | num_blocking
----------+----------+------+---------+----------+-----------------+---------------+----------+---------------+--------------------+-------------------------+----------------------+-------------+-----------+------------+--------+-----------+----------------------+--------------
(0 rows)

COMMIT;
-- When a number of rows are inserted
BEGIN TRANSACTION ISOLATION LEVEL REPEATABLE READ;
INSERT INTO yb_lock_tests SELECT i, i, i, 'value', i, i from generate_series(10, 20) i;
-- yb_lock_status returns entries from all tablets in the table
-- TODO: Remove WHERE when we support the relation argument
SELECT COUNT(DISTINCT(tablet_id)) FROM yb_lock_status('yb_lock_tests'::regclass, null)
                                  WHERE relation = 'yb_lock_tests'::regclass;
 count
-------
     2
(1 row)

-- Validate node field
SELECT COUNT(DISTINCT (node)) > 0 AS valid_node
FROM yb_lock_status(null, null) l
         INNER JOIN yb_servers() s ON l.node = s.uuid;
 valid_node
------------
 t
(1 row)

ABORT;
-- Validate attnum
CREATE TABLE attno_test_table(a int, b int, c int, d int, e int, f int, PRIMARY KEY((e, f) hash, b));
INSERT INTO attno_test_table VALUES (1,1,1,1,1,1);
-- Because the primary key is on (e,f,b), the first attnum 'a' should be the after the primary key in docdb
BEGIN; UPDATE attno_test_table SET a = 2 WHERE e = 1 AND f = 1 AND b = 1;
SELECT l.relation::regclass, a.attname, l.locktype, l.mode, l.hash_cols, l.range_cols, l.attnum, l.column_id
FROM yb_lock_status(null,null) l LEFT JOIN pg_attribute a ON a.attrelid = l.relation AND a.attnum = l.attnum;
     relation     | attname | locktype |            mode            | hash_cols | range_cols | attnum | column_id
------------------+---------+----------+----------------------------+-----------+------------+--------+-----------
 attno_test_table | a       | column   | {STRONG_READ,STRONG_WRITE} | {1,1}     | {1}        |      1 |         3
 attno_test_table |         | row      | {WEAK_READ,WEAK_WRITE}     | {1,1}     | {1}        |        |
 attno_test_table |         | keyrange | {WEAK_READ,WEAK_WRITE}     | {1,1}     |            |        |
 attno_test_table |         | relation | {WEAK_READ,WEAK_WRITE}     |           |            |        |
(4 rows)

ABORT;
-- 'c' should be the second non-key column in docdb, and the second attnum
BEGIN; UPDATE attno_test_table SET c = 2 WHERE e = 1 AND f = 1 AND b = 1;
SELECT l.relation::regclass, a.attname, l.locktype, l.mode, l.hash_cols, l.range_cols, l.attnum, l.column_id
FROM yb_lock_status(null,null) l LEFT JOIN pg_attribute a ON a.attrelid = l.relation AND a.attnum = l.attnum;
     relation     | attname | locktype |            mode            | hash_cols | range_cols | attnum | column_id
------------------+---------+----------+----------------------------+-----------+------------+--------+-----------
 attno_test_table | c       | column   | {STRONG_READ,STRONG_WRITE} | {1,1}     | {1}        |      3 |         4
 attno_test_table |         | row      | {WEAK_READ,WEAK_WRITE}     | {1,1}     | {1}        |        |
 attno_test_table |         | keyrange | {WEAK_READ,WEAK_WRITE}     | {1,1}     |            |        |
 attno_test_table |         | relation | {WEAK_READ,WEAK_WRITE}     |           |            |        |
(4 rows)

ABORT;
ALTER TABLE attno_test_table DROP COLUMN c;
-- 'd' is the fourth attnum, which should not have changed when we dropped column 'c'
BEGIN; UPDATE attno_test_table SET d = 2 WHERE e = 1 AND f = 1 AND b = 1;
SELECT l.relation::regclass, a.attname, l.locktype, l.mode, l.hash_cols, l.range_cols, l.attnum, l.column_id
FROM yb_lock_status(null,null) l LEFT JOIN pg_attribute a ON a.attrelid = l.relation AND a.attnum = l.attnum;
     relation     | attname | locktype |            mode            | hash_cols | range_cols | attnum | column_id
------------------+---------+----------+----------------------------+-----------+------------+--------+-----------
 attno_test_table | d       | column   | {STRONG_READ,STRONG_WRITE} | {1,1}     | {1}        |      4 |         5
 attno_test_table |         | row      | {WEAK_READ,WEAK_WRITE}     | {1,1}     | {1}        |        |
 attno_test_table |         | keyrange | {WEAK_READ,WEAK_WRITE}     | {1,1}     |            |        |
 attno_test_table |         | relation | {WEAK_READ,WEAK_WRITE}     |           |            |        |
(4 rows)

ABORT;
ALTER TABLE attno_test_table ADD COLUMN c text;
-- After re-adding 'c', it should be the last column both in docdb and in pg_attribute
BEGIN; UPDATE attno_test_table SET c = 'test' WHERE e = 1 AND f = 1 AND b = 1;
SELECT l.relation::regclass, a.attname, l.locktype, l.mode, l.hash_cols, l.range_cols, l.attnum, l.column_id
FROM yb_lock_status(null,null) l LEFT JOIN pg_attribute a ON a.attrelid = l.relation AND a.attnum = l.attnum;
     relation     | attname | locktype |            mode            | hash_cols | range_cols | attnum | column_id
------------------+---------+----------+----------------------------+-----------+------------+--------+-----------
 attno_test_table | c       | column   | {STRONG_READ,STRONG_WRITE} | {1,1}     | {1}        |      7 |         6
 attno_test_table |         | row      | {WEAK_READ,WEAK_WRITE}     | {1,1}     | {1}        |        |
 attno_test_table |         | keyrange | {WEAK_READ,WEAK_WRITE}     | {1,1}     |            |        |
 attno_test_table |         | relation | {WEAK_READ,WEAK_WRITE}     |           |            |        |
(4 rows)

ABORT;
-- Should not see any values
SELECT * FROM validate_and_return_lock_status(null, null);
 locktype | relation | mode | granted | fastpath | valid_waitstart | valid_waitend | has_node | has_tablet_id | has_transaction_id | valid_subtransaction_id | has_status_tablet_id | is_explicit | hash_cols | range_cols | attnum | column_id | multiple_rows_locked | num_blocking
----------+----------+------+---------+----------+-----------------+---------------+----------+---------------+--------------------+-------------------------+----------------------+-------------+-----------+------------+--------+-----------+----------------------+--------------
(0 rows)

-- TODO: Add support for colocated tables