--
-- MONEY
--
-- Note that we assume lc_monetary has been set to C.
--
SET LC_MONETARY TO 'en_US.UTF-8';
CREATE TABLE money_data (m money);
INSERT INTO money_data VALUES ('123');
SELECT * FROM money_data;
    m
---------
 $123.00
(1 row)

SELECT m + '123' FROM money_data;
 ?column?
----------
  $246.00
(1 row)

SELECT m + '123.45' FROM money_data;
 ?column?
----------
  $246.45
(1 row)

SELECT m - '123.45' FROM money_data;
 ?column?
----------
   -$0.45
(1 row)

SELECT m / '2'::money FROM money_data;
 ?column?
----------
     61.5
(1 row)

SELECT m * 2 FROM money_data;
 ?column?
----------
  $246.00
(1 row)

SELECT 2 * m FROM money_data;
 ?column?
----------
  $246.00
(1 row)

SELECT m / 2 FROM money_data;
 ?column?
----------
   $61.50
(1 row)

SELECT m * 2::int2 FROM money_data;
 ?column?
----------
  $246.00
(1 row)

SELECT 2::int2 * m FROM money_data;
 ?column?
----------
  $246.00
(1 row)

SELECT m / 2::int2 FROM money_data;
 ?column?
----------
   $61.50
(1 row)

SELECT m * 2::int8 FROM money_data;
 ?column?
----------
  $246.00
(1 row)

SELECT 2::int8 * m FROM money_data;
 ?column?
----------
  $246.00
(1 row)

SELECT m / 2::int8 FROM money_data;
 ?column?
----------
   $61.50
(1 row)

SELECT m * 2::float8 FROM money_data;
 ?column?
----------
  $246.00
(1 row)

SELECT 2::float8 * m FROM money_data;
 ?column?
----------
  $246.00
(1 row)

SELECT m / 2::float8 FROM money_data;
 ?column?
----------
   $61.50
(1 row)

SELECT m * 2::float4 FROM money_data;
 ?column?
----------
  $246.00
(1 row)

SELECT 2::float4 * m FROM money_data;
 ?column?
----------
  $246.00
(1 row)

SELECT m / 2::float4 FROM money_data;
 ?column?
----------
   $61.50
(1 row)

-- All true
SELECT m = '$123.00' FROM money_data;
 ?column?
----------
 t
(1 row)

SELECT m != '$124.00' FROM money_data;
 ?column?
----------
 t
(1 row)

SELECT m <= '$123.00' FROM money_data;
 ?column?
----------
 t
(1 row)

SELECT m >= '$123.00' FROM money_data;
 ?column?
----------
 t
(1 row)

SELECT m < '$124.00' FROM money_data;
 ?column?
----------
 t
(1 row)

SELECT m > '$122.00' FROM money_data;
 ?column?
----------
 t
(1 row)

-- All false
SELECT m = '$123.01' FROM money_data;
 ?column?
----------
 f
(1 row)

SELECT m != '$123.00' FROM money_data;
 ?column?
----------
 f
(1 row)

SELECT m <= '$122.99' FROM money_data;
 ?column?
----------
 f
(1 row)

SELECT m >= '$123.01' FROM money_data;
 ?column?
----------
 f
(1 row)

SELECT m > '$124.00' FROM money_data;
 ?column?
----------
 f
(1 row)

SELECT m < '$122.00' FROM money_data;
 ?column?
----------
 f
(1 row)

SELECT cashlarger(m, '$124.00') FROM money_data;
 cashlarger
------------
    $124.00
(1 row)

SELECT cashsmaller(m, '$124.00') FROM money_data;
 cashsmaller
-------------
     $123.00
(1 row)

SELECT cash_words(m) FROM money_data;
                   cash_words
-------------------------------------------------
 One hundred twenty three dollars and zero cents
(1 row)

SELECT cash_words(m + '1.23') FROM money_data;
                       cash_words
--------------------------------------------------------
 One hundred twenty four dollars and twenty three cents
(1 row)

DELETE FROM money_data;
INSERT INTO money_data VALUES ('$123.45');
SELECT * FROM money_data;
    m
---------
 $123.45
(1 row)

DELETE FROM money_data;
INSERT INTO money_data VALUES ('$123.451');
SELECT * FROM money_data;
    m
---------
 $123.45
(1 row)

DELETE FROM money_data;
INSERT INTO money_data VALUES ('$123.454');
SELECT * FROM money_data;
    m
---------
 $123.45
(1 row)

DELETE FROM money_data;
INSERT INTO money_data VALUES ('$123.455');
SELECT * FROM money_data;
    m
---------
 $123.46
(1 row)

DELETE FROM money_data;
INSERT INTO money_data VALUES ('$123.456');
SELECT * FROM money_data;
    m
---------
 $123.46
(1 row)

DELETE FROM money_data;
INSERT INTO money_data VALUES ('$123.459');
SELECT * FROM money_data;
    m
---------
 $123.46
(1 row)

--
-- Test various formats
--
DELETE FROM money_data;
INSERT INTO money_data VALUES ('0');
SELECT * FROM money_data;
   m
-------
 $0.00
(1 row)

DELETE FROM money_data;
INSERT INTO money_data VALUES ('-100');
SELECT * FROM money_data;
    m
----------
 -$100.00
(1 row)

DELETE FROM money_data;
INSERT INTO money_data VALUES ('2.0001');
SELECT * FROM money_data;
   m
-------
 $2.00
(1 row)

SELECT m + '0.0099' FROM money_data;
 ?column?
----------
    $2.01
(1 row)

SELECT m + '0.0098' FROM money_data;
 ?column?
----------
    $2.01
(1 row)

SELECT m + '0.0050' FROM money_data;
 ?column?
----------
    $2.01
(1 row)

SELECT m + '0.0049' FROM money_data;
 ?column?
----------
    $2.00
(1 row)

DELETE FROM money_data;
INSERT INTO money_data VALUES ('5,.06');
SELECT * FROM money_data;
   m
-------
 $5.06
(1 row)

DELETE FROM money_data;
INSERT INTO money_data VALUES ('$3.0001');
SELECT * FROM money_data;
   m
-------
 $3.00
(1 row)

DELETE FROM money_data;
INSERT INTO money_data VALUES ('$40');
SELECT * FROM money_data;
   m
--------
 $40.00
(1 row)

DELETE FROM money_data;
INSERT INTO money_data VALUES ('1,2');
SELECT * FROM money_data;
   m
--------
 $12.00
(1 row)

DELETE FROM money_data;
INSERT INTO money_data VALUES ('1,23');
SELECT * FROM money_data;
    m
---------
 $123.00
(1 row)

DELETE FROM money_data;
INSERT INTO money_data VALUES ('100,120');
SELECT * FROM money_data;
      m
-------------
 $100,120.00
(1 row)

DELETE FROM money_data;
INSERT INTO money_data VALUES ('100,23');
SELECT * FROM money_data;
     m
------------
 $10,023.00
(1 row)

DELETE FROM money_data;
INSERT INTO money_data VALUES ('1000,23');
SELECT * FROM money_data;
      m
-------------
 $100,023.00
(1 row)

DELETE FROM money_data;
INSERT INTO money_data VALUES ('1,000,000.12');
SELECT * FROM money_data;
       m
---------------
 $1,000,000.12
(1 row)

DELETE FROM money_data;
INSERT INTO money_data VALUES ('2,000.00012');
SELECT * FROM money_data;
     m
-----------
 $2,000.00
(1 row)

DELETE FROM money_data;
INSERT INTO money_data VALUES ('$3,000.00012');
SELECT * FROM money_data;
     m
-----------
 $3,000.00
(1 row)

DELETE FROM money_data;
INSERT INTO money_data VALUES ('$4,000,000.12');
SELECT * FROM money_data;
       m
---------------
 $4,000,000.12
(1 row)

-- documented minimums and maximums
DELETE FROM money_data;
INSERT INTO money_data VALUES ('-92233720368547758.08');
SELECT * FROM money_data;
              m
-----------------------------
 -$92,233,720,368,547,758.08
(1 row)

DELETE FROM money_data;
INSERT INTO money_data VALUES ('92233720368547758.07');
SELECT * FROM money_data;
             m
----------------------------
 $92,233,720,368,547,758.07
(1 row)

-- input checks
SELECT '1234567890'::money;
       money
-------------------
 $1,234,567,890.00
(1 row)

SELECT '12345678901234567'::money;
           money
----------------------------
 $12,345,678,901,234,567.00
(1 row)

-- TODO: Enable after issue #808 is done (ENG-4604)
--       (fails solely on yugabyte-centos-phabricator-gcc-release)
-- SELECT '123456789012345678'::money;
-- ERROR:  value "123456789012345678" is out of range for type money
-- LINE 1: SELECT '123456789012345678'::money;
-- ^
-- SELECT '9223372036854775807'::money;
-- ERROR:  value "9223372036854775807" is out of range for type money
-- LINE 1: SELECT '9223372036854775807'::money;
-- ^
SELECT '-12345'::money;
    money
-------------
 -$12,345.00
(1 row)

SELECT '-1234567890'::money;
       money
--------------------
 -$1,234,567,890.00
(1 row)

SELECT '-12345678901234567'::money;
            money
-----------------------------
 -$12,345,678,901,234,567.00
(1 row)

-- TODO: Enable after issue #808 is done (ENG-4604)
-- SELECT '-123456789012345678'::money;
-- ERROR:  value "-123456789012345678" is out of range for type money
-- LINE 1: SELECT '-123456789012345678'::money;
--                ^
-- SELECT '-9223372036854775808'::money;
-- ERROR:  value "-9223372036854775808" is out of range for type money
-- LINE 1: SELECT '-9223372036854775808'::money;
--                ^
-- special characters
SELECT '(1)'::money;
 money
--------
 -$1.00
(1 row)

SELECT '($123,456.78)'::money;
    money
--------------
 -$123,456.78
(1 row)

-- documented minimums and maximums
SELECT '-92233720368547758.08'::money;
            money
-----------------------------
 -$92,233,720,368,547,758.08
(1 row)

SELECT '92233720368547758.07'::money;
           money
----------------------------
 $92,233,720,368,547,758.07
(1 row)

-- TODO: Enable after issue #808 is done (ENG-4604)
-- SELECT '-92233720368547758.09'::money;
-- ERROR:  value "-92233720368547758.09" is out of range for type money
-- LINE 1: SELECT '-92233720368547758.09'::money;
--                ^
-- SELECT '92233720368547758.08'::money;
-- ERROR:  value "92233720368547758.08" is out of range for type money
-- LINE 1: SELECT '92233720368547758.08'::money;
--                ^
-- rounding
SELECT '-92233720368547758.085'::money;
ERROR:  value "-92233720368547758.085" is out of range for type money
LINE 1: SELECT '-92233720368547758.085'::money;
               ^
-- TODO: Enable after issue #808 is done (ENG-4604)
-- SELECT '92233720368547758.075'::money;
-- ERROR:  value "92233720368547758.075" is out of range for type money
-- LINE 1: SELECT '92233720368547758.075'::money;
--                ^
-- rounding vs. truncation in division
SELECT '878.08'::money / 11::float8;
 ?column?
----------
   $79.83
(1 row)

SELECT '878.08'::money / 11::float4;
 ?column?
----------
   $79.83
(1 row)

SELECT '878.08'::money / 11::bigint;
 ?column?
----------
   $79.82
(1 row)

SELECT '878.08'::money / 11::int;
 ?column?
----------
   $79.82
(1 row)

SELECT '878.08'::money / 11::smallint;
 ?column?
----------
   $79.82
(1 row)

-- check for precision loss in division
SELECT '90000000000000099.00'::money / 10::bigint;
         ?column?
---------------------------
 $9,000,000,000,000,009.90
(1 row)

SELECT '90000000000000099.00'::money / 10::int;
         ?column?
---------------------------
 $9,000,000,000,000,009.90
(1 row)

SELECT '90000000000000099.00'::money / 10::smallint;
         ?column?
---------------------------
 $9,000,000,000,000,009.90
(1 row)

-- Cast int4/int8/numeric to money
SELECT 1234567890::money;
       money
-------------------
 $1,234,567,890.00
(1 row)

SELECT 12345678901234567::money;
           money
----------------------------
 $12,345,678,901,234,567.00
(1 row)

SELECT (-12345)::money;
    money
-------------
 -$12,345.00
(1 row)

SELECT (-1234567890)::money;
       money
--------------------
 -$1,234,567,890.00
(1 row)

SELECT (-12345678901234567)::money;
            money
-----------------------------
 -$12,345,678,901,234,567.00
(1 row)

SELECT 1234567890::int4::money;
       money
-------------------
 $1,234,567,890.00
(1 row)

SELECT 12345678901234567::int8::money;
           money
----------------------------
 $12,345,678,901,234,567.00
(1 row)

SELECT 12345678901234567::numeric::money;
           money
----------------------------
 $12,345,678,901,234,567.00
(1 row)

SELECT (-1234567890)::int4::money;
       money
--------------------
 -$1,234,567,890.00
(1 row)

SELECT (-12345678901234567)::int8::money;
            money
-----------------------------
 -$12,345,678,901,234,567.00
(1 row)

SELECT (-12345678901234567)::numeric::money;
            money
-----------------------------
 -$12,345,678,901,234,567.00
(1 row)

-- Cast from money
SELECT '12345678901234567'::money::numeric;
       numeric
----------------------
 12345678901234567.00
(1 row)

SELECT '-12345678901234567'::money::numeric;
        numeric
-----------------------
 -12345678901234567.00
(1 row)

SELECT '92233720368547758.07'::money::numeric;
       numeric
----------------------
 92233720368547758.07
(1 row)

SELECT '-92233720368547758.08'::money::numeric;
        numeric
-----------------------
 -92233720368547758.08
(1 row)

--
-- Test for PRIMARY KEY
--
CREATE TABLE money_data_with_pk(id MONEY PRIMARY KEY, val money);
INSERT INTO money_data_with_pk VALUES ('1.1','-11.11');
INSERT INTO money_data_with_pk VALUES ('2.2','-22.22');
INSERT INTO money_data_with_pk VALUES ('3.3','-33.33');
SELECT * FROM money_data_with_pk ORDER BY id;
  id   |   val
-------+---------
 $1.10 | -$11.11
 $2.20 | -$22.22
 $3.30 | -$33.33
(3 rows)

SELECT VAL FROM money_data_with_pk WHERE id = '$2.2';
   val
---------
 -$22.22
(1 row)

-- ASC/DESC check
SELECT * FROM money_data_with_pk ORDER BY val ASC;
  id   |   val
-------+---------
 $3.30 | -$33.33
 $2.20 | -$22.22
 $1.10 | -$11.11
(3 rows)

SELECT * FROM money_data_with_pk ORDER BY val DESC;
  id   |   val
-------+---------
 $1.10 | -$11.11
 $2.20 | -$22.22
 $3.30 | -$33.33
(3 rows)

CREATE TEMP TABLE IF NOT EXISTS t0(c0 money );
INSERT INTO t0(c0) VALUES((0.3528332)::MONEY);
UPDATE t0 SET c0 = (0.7406399)::MONEY WHERE (((0.023219043)::MONEY) BETWEEN (CAST(0.19029781 AS MONEY)) AND (CAST(0.0984419 AS MONEY))) IS FALSE;
