--
-- Tests for some likely failure cases with combo cmin/cmax mechanism
--
CREATE TEMP TABLE combocidtest (foobar int);
BEGIN;
-- a few dummy ops to push up the CommandId counter
INSERT INTO combocidtest SELECT 1 LIMIT 0;
INSERT INTO combocidtest SELECT 1 LIMIT 0;
INSERT INTO combocidtest SELECT 1 LIMIT 0;
INSERT INTO combocidtest SELECT 1 LIMIT 0;
INSERT INTO combocidtest SELECT 1 LIMIT 0;
INSERT INTO combocidtest SELECT 1 LIMIT 0;
INSERT INTO combocidtest SELECT 1 LIMIT 0;
INSERT INTO combocidtest SELECT 1 LIMIT 0;
INSERT INTO combocidtest SELECT 1 LIMIT 0;
INSERT INTO combocidtest SELECT 1 LIMIT 0;
INSERT INTO combocidtest VALUES (1);
INSERT INTO combocidtest VALUES (2);
SELECT ctid,cmin,* FROM combocidtest;
 ctid  | cmin | foobar
-------+------+--------
 (0,1) |   10 |      1
 (0,2) |   11 |      2
(2 rows)

-- Not supporting SAVEPOINT yet.
-- SAVEPOINT s1;
-- Commit and restart new transaction here for now.
COMMIT;
BEGIN;
UPDATE combocidtest SET foobar = foobar + 10;
-- here we should see only updated tuples
SELECT ctid,cmin,* FROM combocidtest;
 ctid  | cmin | foobar
-------+------+--------
 (0,3) |    0 |     11
 (0,4) |    0 |     12
(2 rows)

-- Not supporting SAVEPOINT yet.
-- ROLLBACK TO s1;
ROLLBACK;
-- now we should see old tuples, but with combo CIDs starting at 0
SELECT ctid,cmin,* FROM combocidtest;
 ctid  | cmin | foobar
-------+------+--------
 (0,1) |    0 |      1
 (0,2) |    0 |      2
(2 rows)

-- Not supporting SAVEPOINT yet. Comment the commit for now.
-- COMMIT;
-- combo data is not there anymore, but should still see tuples
SELECT ctid,cmin,* FROM combocidtest;
 ctid  | cmin | foobar
-------+------+--------
 (0,1) |    0 |      1
 (0,2) |    0 |      2
(2 rows)

-- Test combo cids with portals
BEGIN;
INSERT INTO combocidtest VALUES (333);
DECLARE c CURSOR FOR SELECT ctid,cmin,* FROM combocidtest;
DELETE FROM combocidtest;
FETCH ALL FROM c;
 ctid  | cmin | foobar
-------+------+--------
 (0,1) |    1 |      1
 (0,2) |    1 |      2
 (0,5) |    0 |    333
(3 rows)

ROLLBACK;
SELECT ctid,cmin,* FROM combocidtest;
 ctid  | cmin | foobar
-------+------+--------
 (0,1) |    1 |      1
 (0,2) |    1 |      2
(2 rows)

-- check behavior with locked tuples
BEGIN;
-- a few dummy ops to push up the CommandId counter
INSERT INTO combocidtest SELECT 1 LIMIT 0;
INSERT INTO combocidtest SELECT 1 LIMIT 0;
INSERT INTO combocidtest SELECT 1 LIMIT 0;
INSERT INTO combocidtest SELECT 1 LIMIT 0;
INSERT INTO combocidtest SELECT 1 LIMIT 0;
INSERT INTO combocidtest SELECT 1 LIMIT 0;
INSERT INTO combocidtest SELECT 1 LIMIT 0;
INSERT INTO combocidtest SELECT 1 LIMIT 0;
INSERT INTO combocidtest SELECT 1 LIMIT 0;
INSERT INTO combocidtest SELECT 1 LIMIT 0;
INSERT INTO combocidtest VALUES (444);
SELECT ctid,cmin,* FROM combocidtest;
 ctid  | cmin | foobar
-------+------+--------
 (0,1) |    1 |      1
 (0,2) |    1 |      2
 (0,6) |   10 |    444
(3 rows)

-- Not supporting SAVEPOINT yet.
-- SAVEPOINT s1;
-- Commit and restart new transaction here for now.
COMMIT;
BEGIN;
-- this should not affect cmin
SELECT ctid,cmin,* FROM combocidtest FOR UPDATE;
 ctid  | cmin | foobar
-------+------+--------
 (0,1) |    1 |      1
 (0,2) |    1 |      2
 (0,6) |   10 |    444
(3 rows)

SELECT ctid,cmin,* FROM combocidtest;
 ctid  | cmin | foobar
-------+------+--------
 (0,1) |    1 |      1
 (0,2) |    1 |      2
 (0,6) |   10 |    444
(3 rows)

-- but this does
UPDATE combocidtest SET foobar = foobar + 10;
SELECT ctid,cmin,* FROM combocidtest;
 ctid  | cmin | foobar
-------+------+--------
 (0,7) |    1 |     11
 (0,8) |    1 |     12
 (0,9) |    1 |    454
(3 rows)

-- Not supporting SAVEPOINT yet.
-- ROLLBACK TO s1;
ROLLBACK;
SELECT ctid,cmin,* FROM combocidtest;
 ctid  | cmin | foobar
-------+------+--------
 (0,1) |    1 |      1
 (0,2) |    1 |      2
 (0,6) |    1 |    444
(3 rows)

-- Not supporting SAVEPOINT yet. Comment the commit for now.
-- COMMIT;
SELECT ctid,cmin,* FROM combocidtest;
 ctid  | cmin | foobar
-------+------+--------
 (0,1) |    1 |      1
 (0,2) |    1 |      2
 (0,6) |    1 |    444
(3 rows)

-- test for bug reported in
-- CABRT9RC81YUf1=jsmWopcKJEro=VoeG2ou6sPwyOUTx_qteRsg@mail.gmail.com
-- CREATE TABLE IF NOT EXISTS testcase(
-- 	id int PRIMARY KEY,
-- 	balance numeric
-- );
-- INSERT INTO testcase VALUES (1, 0);
-- BEGIN;
-- SELECT * FROM testcase WHERE testcase.id = 1 FOR UPDATE;
-- UPDATE testcase SET balance = balance + 400 WHERE id=1;
-- SAVEPOINT subxact;
-- UPDATE testcase SET balance = balance - 100 WHERE id=1;
-- ROLLBACK TO SAVEPOINT subxact;
-- should return one tuple
-- SELECT * FROM testcase WHERE id = 1 FOR UPDATE;
-- ROLLBACK;
-- DROP TABLE testcase;
