-- Test ON CONFLICT DO UPDATE with partitioned table and non-identical children
CREATE TABLE upsert_test (
    a   INT PRIMARY KEY,
    b   TEXT
) PARTITION BY LIST (a);
CREATE TABLE upsert_test_1 PARTITION OF upsert_test FOR VALUES IN (1);
CREATE TABLE upsert_test_2 (b TEXT, a INT PRIMARY KEY);
ALTER TABLE upsert_test ATTACH PARTITION upsert_test_2 FOR VALUES IN (2);
INSERT INTO upsert_test VALUES(1, 'Boo'), (2, 'Zoo');
-- uncorrelated sub-select:
WITH aaa AS (SELECT 1 AS a, 'Foo' AS b) INSERT INTO upsert_test
  VALUES (1, 'Bar') ON CONFLICT(a)
  DO UPDATE SET (b, a) = (SELECT b, a FROM aaa) RETURNING *;
 a |  b
---+-----
 1 | Foo
(1 row)

-- correlated sub-select:
WITH aaa AS (SELECT 1 AS ctea, ' Foo' AS cteb) INSERT INTO upsert_test
  VALUES (1, 'Bar'), (2, 'Baz') ON CONFLICT(a)
  DO UPDATE SET (b, a) = (SELECT upsert_test.b||cteb, upsert_test.a FROM aaa) RETURNING *;
 a |    b
---+---------
 1 | Foo Foo
 2 | Zoo Foo
(2 rows)

DROP TABLE upsert_test;
---------------------------
-- UPDATE with row movement
---------------------------
-- When a partitioned table receives an UPDATE to the partitioned key and the
-- new values no longer meet the partition's bound, the row must be moved to
-- the correct partition for the new partition key (if one exists). We must
-- also ensure that updatable views on partitioned tables properly enforce any
-- WITH CHECK OPTION that is defined. The situation with triggers in this case
-- also requires thorough testing as partition key updates causing row
-- movement convert UPDATEs into DELETE+INSERT.
CREATE TABLE range_parted (
	a text,
	b bigint,
	c numeric,
	d int,
	e varchar
) PARTITION BY RANGE (a, b);
-- Create partitions intentionally in descending bound order, so as to test
-- that update-row-movement works with the leaf partitions not in bound order.
CREATE TABLE part_b_20_b_30 (e varchar, c numeric, a text, b bigint, d int);
ALTER TABLE range_parted ATTACH PARTITION part_b_20_b_30 FOR VALUES FROM ('b', 20) TO ('b', 30);
CREATE TABLE part_b_10_b_20 (e varchar, c numeric, a text, b bigint, d int) PARTITION BY RANGE (c);
CREATE TABLE part_b_1_b_10 PARTITION OF range_parted FOR VALUES FROM ('b', 1) TO ('b', 10);
ALTER TABLE range_parted ATTACH PARTITION part_b_10_b_20 FOR VALUES FROM ('b', 10) TO ('b', 20);
CREATE TABLE part_a_10_a_20 PARTITION OF range_parted FOR VALUES FROM ('a', 10) TO ('a', 20);
CREATE TABLE part_a_1_a_10 PARTITION OF range_parted FOR VALUES FROM ('a', 1) TO ('a', 10);
-- Check that partition-key UPDATE works sanely on a partitioned table that
-- does not have any child partitions.
UPDATE part_b_10_b_20 set b = b - 6;
-- Create some more partitions following the above pattern of descending bound
-- order, but let's make the situation a bit more complex by having the
-- attribute numbers of the columns vary from their parent partition.
CREATE TABLE part_c_100_200 (e varchar, c numeric, a text, b bigint, d int) PARTITION BY range (abs(d));
ALTER TABLE part_c_100_200 DROP COLUMN e, DROP COLUMN c, DROP COLUMN a;
ALTER TABLE part_c_100_200 ADD COLUMN c numeric, ADD COLUMN e varchar, ADD COLUMN a text;
ALTER TABLE part_c_100_200 DROP COLUMN b;
ALTER TABLE part_c_100_200 ADD COLUMN b bigint;
CREATE TABLE part_d_1_15 PARTITION OF part_c_100_200 FOR VALUES FROM (1) TO (15);
CREATE TABLE part_d_15_20 PARTITION OF part_c_100_200 FOR VALUES FROM (15) TO (20);
ALTER TABLE part_b_10_b_20 ATTACH PARTITION part_c_100_200 FOR VALUES FROM (100) TO (200);
CREATE TABLE part_c_1_100 (e varchar, d int, c numeric, b bigint, a text);
ALTER TABLE part_b_10_b_20 ATTACH PARTITION part_c_1_100 FOR VALUES FROM (1) TO (100);
\set init_range_parted 'truncate range_parted; insert into range_parted VALUES (''a'', 1, 1, 1), (''a'', 10, 200, 1), (''b'', 12, 96, 1), (''b'', 13, 97, 2), (''b'', 15, 105, 16), (''b'', 17, 105, 19)'
\set show_data 'select tableoid::regclass::text COLLATE "C" partname, * from range_parted ORDER BY 1, 2, 3, 4, 5, 6'
:init_range_parted;
:show_data;
    partname    | a | b  |  c  | d  | e
----------------+---+----+-----+----+---
 part_a_10_a_20 | a | 10 | 200 |  1 |
 part_a_1_a_10  | a |  1 |   1 |  1 |
 part_c_1_100   | b | 12 |  96 |  1 |
 part_c_1_100   | b | 13 |  97 |  2 |
 part_d_15_20   | b | 15 | 105 | 16 |
 part_d_15_20   | b | 17 | 105 | 19 |
(6 rows)

-- The order of subplans should be in bound order
EXPLAIN (costs off) UPDATE range_parted set c = c - 50 WHERE c > 97;
                 QUERY PLAN
--------------------------------------------
 Update on range_parted
   Update on part_a_1_a_10
   Update on part_a_10_a_20
   Update on part_b_1_b_10
   Update on part_c_1_100
   Update on part_d_1_15
   Update on part_d_15_20
   Update on part_b_20_b_30
   ->  Seq Scan on part_a_1_a_10
         Remote Filter: (c > '97'::numeric)
   ->  Seq Scan on part_a_10_a_20
         Remote Filter: (c > '97'::numeric)
   ->  Seq Scan on part_b_1_b_10
         Remote Filter: (c > '97'::numeric)
   ->  Seq Scan on part_c_1_100
         Remote Filter: (c > '97'::numeric)
   ->  Seq Scan on part_d_1_15
         Remote Filter: (c > '97'::numeric)
   ->  Seq Scan on part_d_15_20
         Remote Filter: (c > '97'::numeric)
   ->  Seq Scan on part_b_20_b_30
         Remote Filter: (c > '97'::numeric)
(22 rows)

-- fail, row movement happens only within the partition subtree.
UPDATE part_c_100_200 set c = c - 20, d = c WHERE c = 105 AND b = 15;
ERROR:  new row for relation "part_c_100_200" violates partition constraint
DETAIL:  Failing row contains (105, 85, null, b, 15).
-- fail, no partition key update, so no attempt to move tuple,
-- but "a = 'a'" violates partition constraint enforced by root partition)
UPDATE part_b_10_b_20 set a = 'a' WHERE b = 12;
ERROR:  new row for relation "part_c_1_100" violates partition constraint
DETAIL:  Failing row contains (null, 1, 96, 12, a).
-- ok, partition key update, no constraint violation
UPDATE range_parted set d = d - 10 WHERE d > 10;
-- ok, no partition key update, no constraint violation
UPDATE range_parted set e = d;
-- No row found
UPDATE part_c_1_100 set c = c + 20 WHERE c = 98;
-- ok, row movement
WITH x AS (UPDATE part_b_10_b_20 set c = c + 20 returning c, b, a)
SELECT * FROM x ORDER BY b;
  c  | b  | a
-----+----+---
 116 | 12 | b
 117 | 13 | b
 125 | 15 | b
 125 | 17 | b
(4 rows)

:show_data;
    partname    | a | b  |  c  | d | e
----------------+---+----+-----+---+---
 part_a_10_a_20 | a | 10 | 200 | 1 | 1
 part_a_1_a_10  | a |  1 |   1 | 1 | 1
 part_d_1_15    | b | 12 | 116 | 1 | 1
 part_d_1_15    | b | 13 | 117 | 2 | 2
 part_d_1_15    | b | 15 | 125 | 6 | 6
 part_d_1_15    | b | 17 | 125 | 9 | 9
(6 rows)

-- fail, row movement happens only within the partition subtree.
UPDATE part_b_10_b_20 set b = b - 6 WHERE c > 116 AND d = 2 returning *;
ERROR:  new row for relation "part_d_1_15" violates partition constraint
DETAIL:  Failing row contains (2, 117, 2, b, 7).
-- ok, row movement, with subset of rows moved into different partition.
WITH x AS (UPDATE range_parted set b = b - 6 WHERE c > 116 returning a, b + c AS f)
SELECT * FROM x ORDER BY a, f;
 a |  f
---+-----
 a | 204
 b | 124
 b | 134
 b | 136
(4 rows)

:show_data;
   partname    | a | b  |  c  | d | e
---------------+---+----+-----+---+---
 part_a_1_a_10 | a |  1 |   1 | 1 | 1
 part_a_1_a_10 | a |  4 | 200 | 1 | 1
 part_b_1_b_10 | b |  7 | 117 | 2 | 2
 part_b_1_b_10 | b |  9 | 125 | 6 | 6
 part_d_1_15   | b | 11 | 125 | 9 | 9
 part_d_1_15   | b | 12 | 116 | 1 | 1
(6 rows)

-- Common table needed for multiple test scenarios.
CREATE TABLE mintab(c1 int);
INSERT into mintab VALUES (120);
-- update partition key using updatable view.
CREATE VIEW upview AS SELECT * FROM range_parted WHERE (select c > c1 FROM mintab) WITH CHECK OPTION;
ERROR:  VIEW WITH CHECK OPTION not supported yet
LINE 1: ...OM range_parted WHERE (select c > c1 FROM mintab) WITH CHECK...
                                                             ^
HINT:  Please report the issue on https://github.com/YugaByte/yugabyte-db/issues
/*
The following tests should be enabled after VIEW WITH CHECK OPTION
is supported.
-- ok
UPDATE upview set c = 199 WHERE b = 4;
-- fail, check option violation
UPDATE upview set c = 120 WHERE b = 4;
-- fail, row movement with check option violation
-- ok, row movement, check option passes
UPDATE upview set a = 'b', b = 15 WHERE b = 4;
-- cleanup
DROP VIEW upview;
*/
-- RETURNING having whole-row vars.
:init_range_parted;
WITH x AS (UPDATE range_parted set c = 95 WHERE a = 'b' and b > 10 and c > 100 returning (range_parted), *)
SELECT * FROM x ORDER BY b;
 range_parted  | a | b  | c  | d  | e
---------------+---+----+----+----+---
 (b,15,95,16,) | b | 15 | 95 | 16 |
 (b,17,95,19,) | b | 17 | 95 | 19 |
(2 rows)

:show_data;
    partname    | a | b  |  c  | d  | e
----------------+---+----+-----+----+---
 part_a_10_a_20 | a | 10 | 200 |  1 |
 part_a_1_a_10  | a |  1 |   1 |  1 |
 part_c_1_100   | b | 12 |  96 |  1 |
 part_c_1_100   | b | 13 |  97 |  2 |
 part_c_1_100   | b | 15 |  95 | 16 |
 part_c_1_100   | b | 17 |  95 | 19 |
(6 rows)

-- Transition tables with update row movement
:init_range_parted;
CREATE FUNCTION trans_updatetrigfunc() RETURNS trigger LANGUAGE plpgsql AS
$$
  begin
    raise notice 'trigger = %, old table = %, new table = %',
                 TG_NAME,
                 (select string_agg(old_table::text, ', ' ORDER BY a) FROM old_table),
                 (select string_agg(new_table::text, ', ' ORDER BY a) FROM new_table);
    return null;
  end;
$$;
-- Enable the following tests after REFERENCING clause (transition tables) is supported.
CREATE TRIGGER trans_updatetrig
  AFTER UPDATE ON range_parted REFERENCING OLD TABLE AS old_table NEW TABLE AS new_table
  FOR EACH STATEMENT EXECUTE PROCEDURE trans_updatetrigfunc();
ERROR:  REFERENCING clause (transition tables) not supported yet
LINE 2:   AFTER UPDATE ON range_parted REFERENCING OLD TABLE AS old_...
                                       ^
HINT:  See https://github.com/yugabyte/yugabyte-db/issues/1668. React with thumbs up to raise its priority
/*
UPDATE range_parted set c = (case when c = 96 then 110 else c + 1 end ) WHERE a = 'b' and b > 10 and c >= 96;
:show_data;
:init_range_parted;

-- Enabling OLD TABLE capture for both DELETE as well as UPDATE stmt triggers
-- should not cause DELETEd rows to be captured twice. Similar thing for
-- INSERT triggers and inserted rows.
CREATE TRIGGER trans_deletetrig
  AFTER DELETE ON range_parted REFERENCING OLD TABLE AS old_table
  FOR EACH STATEMENT EXECUTE PROCEDURE trans_updatetrigfunc();
CREATE TRIGGER trans_inserttrig
  AFTER INSERT ON range_parted REFERENCING NEW TABLE AS new_table
  FOR EACH STATEMENT EXECUTE PROCEDURE trans_updatetrigfunc();
UPDATE range_parted set c = c + 50 WHERE a = 'b' and b > 10 and c >= 96;
:show_data;
DROP TRIGGER trans_deletetrig ON range_parted;
DROP TRIGGER trans_inserttrig ON range_parted;
-- Don't drop trans_updatetrig yet. It is required below.

-- Test with transition tuple conversion happening for rows moved into the
-- new partition. This requires a trigger that references transition table
-- (we already have trans_updatetrig). For inserted rows, the conversion
-- is not usually needed, because the original tuple is already compatible with
-- the desired transition tuple format. But conversion happens when there is a
-- BR trigger because the trigger can change the inserted row. So install a
-- BR triggers on those child partitions where the rows will be moved.
CREATE FUNCTION func_parted_mod_b() RETURNS trigger AS $$
BEGIN
   NEW.b = NEW.b + 1;
   return NEW;
END $$ language plpgsql;
CREATE TRIGGER trig_c1_100 BEFORE UPDATE OR INSERT ON part_c_1_100
   FOR EACH ROW EXECUTE PROCEDURE func_parted_mod_b();
CREATE TRIGGER trig_d1_15 BEFORE UPDATE OR INSERT ON part_d_1_15
   FOR EACH ROW EXECUTE PROCEDURE func_parted_mod_b();
CREATE TRIGGER trig_d15_20 BEFORE UPDATE OR INSERT ON part_d_15_20
   FOR EACH ROW EXECUTE PROCEDURE func_parted_mod_b();
:init_range_parted;
UPDATE range_parted set c = (case when c = 96 then 110 else c + 1 end) WHERE a = 'b' and b > 10 and c >= 96;
:show_data;
:init_range_parted;
UPDATE range_parted set c = c + 50 WHERE a = 'b' and b > 10 and c >= 96;
:show_data;

-- Case where per-partition tuple conversion map array is allocated, but the
-- map is not required for the particular tuple that is routed, thanks to
-- matching table attributes of the partition and the target table.
:init_range_parted;
UPDATE range_parted set b = 15 WHERE b = 1;
:show_data;
DROP TRIGGER trans_updatetrig ON range_parted;
DROP TRIGGER trig_c1_100 ON part_c_1_100;
DROP TRIGGER trig_d1_15 ON part_d_1_15;
DROP TRIGGER trig_d15_20 ON part_d_15_20;
DROP FUNCTION func_parted_mod_b();
*/
-- RLS policies with update-row-movement
-----------------------------------------
ALTER TABLE range_parted ENABLE ROW LEVEL SECURITY;
CREATE USER regress_range_parted_user;
GRANT ALL ON range_parted, mintab TO regress_range_parted_user;
CREATE POLICY seeall ON range_parted AS PERMISSIVE FOR SELECT USING (true);
CREATE POLICY policy_range_parted ON range_parted for UPDATE USING (true) WITH CHECK (c % 2 = 0);
:init_range_parted;
SET SESSION AUTHORIZATION regress_range_parted_user;
-- This should fail with RLS violation error while moving row from
-- part_a_10_a_20 to part_d_1_15, because we are setting 'c' to an odd number.
UPDATE range_parted set a = 'b', c = 151 WHERE a = 'a' and c = 200;
ERROR:  new row violates row-level security policy for table "range_parted"
RESET SESSION AUTHORIZATION;
-- Create a trigger on part_d_1_15
CREATE FUNCTION func_d_1_15() RETURNS trigger AS $$
BEGIN
   NEW.c = NEW.c + 1; -- Make even numbers odd, or vice versa
   return NEW;
END $$ LANGUAGE plpgsql;
CREATE TRIGGER trig_d_1_15 BEFORE INSERT ON part_d_1_15
   FOR EACH ROW EXECUTE PROCEDURE func_d_1_15();
:init_range_parted;
SET SESSION AUTHORIZATION regress_range_parted_user;
-- Here, RLS checks should succeed while moving row from part_a_10_a_20 to
-- part_d_1_15. Even though the UPDATE is setting 'c' to an odd number, the
-- trigger at the destination partition again makes it an even number.
UPDATE range_parted set a = 'b', c = 151 WHERE a = 'a' and c = 200;
RESET SESSION AUTHORIZATION;
:init_range_parted;
SET SESSION AUTHORIZATION regress_range_parted_user;
-- This should fail with RLS violation error. Even though the UPDATE is setting
-- 'c' to an even number, the trigger at the destination partition again makes
-- it an odd number.
UPDATE range_parted set a = 'b', c = 150 WHERE a = 'a' and c = 200;
ERROR:  new row violates row-level security policy for table "range_parted"
-- Cleanup
RESET SESSION AUTHORIZATION;
DROP TRIGGER trig_d_1_15 ON part_d_1_15;
DROP FUNCTION func_d_1_15();
-- Policy expression contains SubPlan
RESET SESSION AUTHORIZATION;
:init_range_parted;
CREATE POLICY policy_range_parted_subplan on range_parted
    AS RESTRICTIVE for UPDATE USING (true)
    WITH CHECK ((SELECT range_parted.c <= c1 FROM mintab));
SET SESSION AUTHORIZATION regress_range_parted_user;
-- fail, mintab has row with c1 = 120
UPDATE range_parted set a = 'b', c = 122 WHERE a = 'a' and c = 200;
ERROR:  new row violates row-level security policy "policy_range_parted_subplan" for table "range_parted"
-- ok
UPDATE range_parted set a = 'b', c = 120 WHERE a = 'a' and c = 200;
-- RLS policy expression contains whole row.
RESET SESSION AUTHORIZATION;
:init_range_parted;
CREATE POLICY policy_range_parted_wholerow on range_parted AS RESTRICTIVE for UPDATE USING (true)
   WITH CHECK (range_parted = row('b', 10, 112, 1, NULL)::range_parted);
SET SESSION AUTHORIZATION regress_range_parted_user;
-- ok, should pass the RLS check
UPDATE range_parted set a = 'b', c = 112 WHERE a = 'a' and c = 200;
RESET SESSION AUTHORIZATION;
:init_range_parted;
SET SESSION AUTHORIZATION regress_range_parted_user;
-- fail, the whole row RLS check should fail
UPDATE range_parted set a = 'b', c = 116 WHERE a = 'a' and c = 200;
ERROR:  new row violates row-level security policy "policy_range_parted_wholerow" for table "range_parted"
-- Cleanup
RESET SESSION AUTHORIZATION;
DROP POLICY policy_range_parted ON range_parted;
DROP POLICY policy_range_parted_subplan ON range_parted;
DROP POLICY policy_range_parted_wholerow ON range_parted;
REVOKE ALL ON range_parted, mintab FROM regress_range_parted_user;
DROP USER regress_range_parted_user;
DROP TABLE mintab;
-- statement triggers with update row movement
---------------------------------------------------
:init_range_parted;
CREATE FUNCTION trigfunc() returns trigger language plpgsql as
$$
  begin
    raise notice 'trigger = % fired on table % during %',
                 TG_NAME, TG_TABLE_NAME, TG_OP;
    return null;
  end;
$$;
-- Triggers on root partition
CREATE TRIGGER parent_delete_trig
  AFTER DELETE ON range_parted for each statement execute procedure trigfunc();
CREATE TRIGGER parent_update_trig
  AFTER UPDATE ON range_parted for each statement execute procedure trigfunc();
CREATE TRIGGER parent_insert_trig
  AFTER INSERT ON range_parted for each statement execute procedure trigfunc();
-- Triggers on leaf partition part_c_1_100
CREATE TRIGGER c1_delete_trig
  AFTER DELETE ON part_c_1_100 for each statement execute procedure trigfunc();
CREATE TRIGGER c1_update_trig
  AFTER UPDATE ON part_c_1_100 for each statement execute procedure trigfunc();
CREATE TRIGGER c1_insert_trig
  AFTER INSERT ON part_c_1_100 for each statement execute procedure trigfunc();
-- Triggers on leaf partition part_d_1_15
CREATE TRIGGER d1_delete_trig
  AFTER DELETE ON part_d_1_15 for each statement execute procedure trigfunc();
CREATE TRIGGER d1_update_trig
  AFTER UPDATE ON part_d_1_15 for each statement execute procedure trigfunc();
CREATE TRIGGER d1_insert_trig
  AFTER INSERT ON part_d_1_15 for each statement execute procedure trigfunc();
-- Triggers on leaf partition part_d_15_20
CREATE TRIGGER d15_delete_trig
  AFTER DELETE ON part_d_15_20 for each statement execute procedure trigfunc();
CREATE TRIGGER d15_update_trig
  AFTER UPDATE ON part_d_15_20 for each statement execute procedure trigfunc();
CREATE TRIGGER d15_insert_trig
  AFTER INSERT ON part_d_15_20 for each statement execute procedure trigfunc();
-- Move all rows from part_c_100_200 to part_c_1_100. None of the delete or
-- insert statement triggers should be fired.
UPDATE range_parted set c = c - 50 WHERE c > 97;
NOTICE:  trigger = parent_update_trig fired on table range_parted during UPDATE
:show_data;
    partname    | a | b  |  c  | d  | e
----------------+---+----+-----+----+---
 part_a_10_a_20 | a | 10 | 150 |  1 |
 part_a_1_a_10  | a |  1 |   1 |  1 |
 part_c_1_100   | b | 12 |  96 |  1 |
 part_c_1_100   | b | 13 |  97 |  2 |
 part_c_1_100   | b | 15 |  55 | 16 |
 part_c_1_100   | b | 17 |  55 | 19 |
(6 rows)

DROP TRIGGER parent_delete_trig ON range_parted;
DROP TRIGGER parent_update_trig ON range_parted;
DROP TRIGGER parent_insert_trig ON range_parted;
DROP TRIGGER c1_delete_trig ON part_c_1_100;
DROP TRIGGER c1_update_trig ON part_c_1_100;
DROP TRIGGER c1_insert_trig ON part_c_1_100;
DROP TRIGGER d1_delete_trig ON part_d_1_15;
DROP TRIGGER d1_update_trig ON part_d_1_15;
DROP TRIGGER d1_insert_trig ON part_d_1_15;
DROP TRIGGER d15_delete_trig ON part_d_15_20;
DROP TRIGGER d15_update_trig ON part_d_15_20;
DROP TRIGGER d15_insert_trig ON part_d_15_20;
-- Creating default partition for range
:init_range_parted;
create table part_def partition of range_parted default;
\d+ part_def
                                       Table "public.part_def"
 Column |       Type        | Collation | Nullable | Default | Storage  | Stats target | Description
--------+-------------------+-----------+----------+---------+----------+--------------+-------------
 a      | text              |           |          |         | extended |              |
 b      | bigint            |           |          |         | plain    |              |
 c      | numeric           |           |          |         | main     |              |
 d      | integer           |           |          |         | plain    |              |
 e      | character varying |           |          |         | extended |              |
Partition of: range_parted DEFAULT
Partition constraint: (NOT ((a IS NOT NULL) AND (b IS NOT NULL) AND (((a = 'a'::text) AND (b >= '1'::bigint) AND (b < '10'::bigint)) OR ((a = 'a'::text) AND (b >= '10'::bigint) AND (b < '20'::bigint)) OR ((a = 'b'::text) AND (b >= '1'::bigint) AND (b < '10'::bigint)) OR ((a = 'b'::text) AND (b >= '10'::bigint) AND (b < '20'::bigint)) OR ((a = 'b'::text) AND (b >= '20'::bigint) AND (b < '30'::bigint)))))

insert into range_parted values ('c', 9);
-- ok
update part_def set a = 'd' where a = 'c';
-- fail
update part_def set a = 'a' where a = 'd';
ERROR:  new row for relation "part_def" violates partition constraint
DETAIL:  Failing row contains (a, 9, null, null, null).
:show_data;
    partname    | a | b  |  c  | d  | e
----------------+---+----+-----+----+---
 part_a_10_a_20 | a | 10 | 200 |  1 |
 part_a_1_a_10  | a |  1 |   1 |  1 |
 part_c_1_100   | b | 12 |  96 |  1 |
 part_c_1_100   | b | 13 |  97 |  2 |
 part_d_15_20   | b | 15 | 105 | 16 |
 part_d_15_20   | b | 17 | 105 | 19 |
 part_def       | d |  9 |     |    |
(7 rows)

-- Update row movement from non-default to default partition.
-- fail, default partition is not under part_a_10_a_20;
UPDATE part_a_10_a_20 set a = 'ad' WHERE a = 'a';
ERROR:  new row for relation "part_a_10_a_20" violates partition constraint
DETAIL:  Failing row contains (ad, 10, 200, 1, null).
-- ok
UPDATE range_parted set a = 'ad' WHERE a = 'a';
UPDATE range_parted set a = 'bd' WHERE a = 'b';
:show_data;
 partname | a  | b  |  c  | d  | e
----------+----+----+-----+----+---
 part_def | ad |  1 |   1 |  1 |
 part_def | ad | 10 | 200 |  1 |
 part_def | bd | 12 |  96 |  1 |
 part_def | bd | 13 |  97 |  2 |
 part_def | bd | 15 | 105 | 16 |
 part_def | bd | 17 | 105 | 19 |
 part_def | d  |  9 |     |    |
(7 rows)

-- Update row movement from default to non-default partitions.
-- ok
UPDATE range_parted set a = 'a' WHERE a = 'ad';
UPDATE range_parted set a = 'b' WHERE a = 'bd';
:show_data;
    partname    | a | b  |  c  | d  | e
----------------+---+----+-----+----+---
 part_a_10_a_20 | a | 10 | 200 |  1 |
 part_a_1_a_10  | a |  1 |   1 |  1 |
 part_c_1_100   | b | 12 |  96 |  1 |
 part_c_1_100   | b | 13 |  97 |  2 |
 part_d_15_20   | b | 15 | 105 | 16 |
 part_d_15_20   | b | 17 | 105 | 19 |
 part_def       | d |  9 |     |    |
(7 rows)

-- Cleanup: range_parted no longer needed.
DROP TABLE range_parted;
CREATE TABLE list_parted (
        a text,
        b int
) PARTITION BY list (a);
CREATE TABLE list_part1  PARTITION OF list_parted for VALUES in ('a', 'b');
CREATE TABLE list_default PARTITION OF list_parted default;
INSERT into list_part1 VALUES ('a', 1);
INSERT into list_default VALUES ('d', 10);
-- fail
UPDATE list_default set a = 'a' WHERE a = 'd';
ERROR:  new row for relation "list_default" violates partition constraint
DETAIL:  Failing row contains (a, 10).
-- ok
UPDATE list_default set a = 'x' WHERE a = 'd';
DROP TABLE list_parted;
--------------
-- Some more update-partition-key test scenarios below. This time use list
-- partitions.
--------------
-- Setup for list partitions
CREATE TABLE list_parted (a numeric, b int, c int8) PARTITION BY list (a);
CREATE TABLE sub_parted PARTITION OF list_parted for VALUES in (1) PARTITION BY list (b);
CREATE TABLE sub_part1(b int, c int8, a numeric);
ALTER TABLE sub_parted ATTACH PARTITION sub_part1 for VALUES in (1);
CREATE TABLE sub_part2(b int, c int8, a numeric);
ALTER TABLE sub_parted ATTACH PARTITION sub_part2 for VALUES in (2);
CREATE TABLE list_part1(a numeric, b int, c int8);
ALTER TABLE list_parted ATTACH PARTITION list_part1 for VALUES in (2,3);
INSERT into list_parted VALUES (2,5,50);
INSERT into list_parted VALUES (3,6,60);
INSERT into sub_parted VALUES (1,1,60);
INSERT into sub_parted VALUES (1,2,10);
-- Test partition constraint violation when intermediate ancestor is used and
-- constraint is inherited from upper root.
UPDATE sub_parted set a = 2 WHERE c = 10;
ERROR:  new row for relation "sub_part2" violates partition constraint
DETAIL:  Failing row contains (2, 10, 2).
-- Test update-partition-key, where the unpruned partitions do not have their
-- partition keys updated.
SELECT tableoid::regclass::text, * FROM list_parted WHERE a = 2 ORDER BY 1;
  tableoid  | a | b | c
------------+---+---+----
 list_part1 | 2 | 5 | 50
(1 row)

UPDATE list_parted set b = c + a WHERE a = 2;
SELECT tableoid::regclass::text, * FROM list_parted WHERE a = 2 ORDER BY 1;
  tableoid  | a | b  | c
------------+---+----+----
 list_part1 | 2 | 52 | 50
(1 row)

-- Test the case where BR UPDATE triggers change the partition key.
CREATE FUNCTION func_parted_mod_b() returns trigger as $$
BEGIN
   NEW.b = 2; -- This is changing partition key column.
   return NEW;
END $$ LANGUAGE plpgsql;
CREATE TRIGGER parted_mod_b before update on sub_part1
   for each row execute procedure func_parted_mod_b();
SELECT tableoid::regclass::text, * FROM list_parted ORDER BY 1, 2, 3, 4;
  tableoid  | a | b  | c
------------+---+----+----
 list_part1 | 2 | 52 | 50
 list_part1 | 3 |  6 | 60
 sub_part1  | 1 |  1 | 60
 sub_part2  | 1 |  2 | 10
(4 rows)

-- This should do the tuple routing even though there is no explicit
-- partition-key update, because there is a trigger on sub_part1.
UPDATE list_parted set c = 70 WHERE b  = 1;
SELECT tableoid::regclass::text, * FROM list_parted ORDER BY 1, 2, 3, 4;
  tableoid  | a | b  | c
------------+---+----+----
 list_part1 | 2 | 52 | 50
 list_part1 | 3 |  6 | 60
 sub_part2  | 1 |  2 | 10
 sub_part2  | 1 |  2 | 70
(4 rows)

DROP TRIGGER parted_mod_b ON sub_part1;
-- If BR DELETE trigger prevented DELETE from happening, we should also skip
-- the INSERT if that delete is part of UPDATE=>DELETE+INSERT.
CREATE OR REPLACE FUNCTION func_parted_mod_b() returns trigger as $$
BEGIN
   raise notice 'Trigger: Got OLD row %, but returning NULL', OLD;
   return NULL;
END $$ LANGUAGE plpgsql;
CREATE TRIGGER trig_skip_delete before delete on sub_part2
   for each row execute procedure func_parted_mod_b();
UPDATE list_parted set b = 1 WHERE c = 70;
NOTICE:  Trigger: Got OLD row (2,70,1), but returning NULL
SELECT tableoid::regclass::text, * FROM list_parted ORDER BY 1, 2, 3, 4;
  tableoid  | a | b  | c
------------+---+----+----
 list_part1 | 2 | 52 | 50
 list_part1 | 3 |  6 | 60
 sub_part2  | 1 |  2 | 10
 sub_part2  | 1 |  2 | 70
(4 rows)

-- Drop the trigger. Now the row should be moved.
DROP TRIGGER trig_skip_delete ON sub_part2;
UPDATE list_parted set b = 1 WHERE c = 70;
SELECT tableoid::regclass::text, * FROM list_parted ORDER BY 1, 2, 3, 4;
  tableoid  | a | b  | c
------------+---+----+----
 list_part1 | 2 | 52 | 50
 list_part1 | 3 |  6 | 60
 sub_part1  | 1 |  1 | 70
 sub_part2  | 1 |  2 | 10
(4 rows)

DROP FUNCTION func_parted_mod_b();
-- UPDATE partition-key with FROM clause. If join produces multiple output
-- rows for the same row to be modified, we should tuple-route the row only
-- once. There should not be any rows inserted.
CREATE TABLE non_parted (id int);
INSERT into non_parted VALUES (1), (1), (1), (2), (2), (2), (3), (3), (3);
UPDATE list_parted t1 set a = 2 FROM non_parted t2 WHERE t1.a = t2.id and a = 1;
SELECT tableoid::regclass::text, * FROM list_parted ORDER BY 1, 2, 3, 4;
  tableoid  | a | b  | c
------------+---+----+----
 list_part1 | 2 |  1 | 70
 list_part1 | 2 |  2 | 10
 list_part1 | 2 | 52 | 50
 list_part1 | 3 |  6 | 60
(4 rows)

DROP TABLE non_parted;
-- Cleanup: list_parted no longer needed.
DROP TABLE list_parted;
-- create custom operator class and hash function, for the same reason
-- explained in alter_table.sql
create or replace function dummy_hashint4(a int4, seed int8) returns int8 as
$$ begin return (a + seed); end; $$ language 'plpgsql' immutable;
create operator class custom_opclass for type int4 using hash as
operator 1 = , function 2 dummy_hashint4(int4, int8);
create table hash_parted (
        a int,
        b int
) partition by hash (a custom_opclass, b custom_opclass);
create table hpart1 partition of hash_parted for values with (modulus 2, remainder 1);
create table hpart2 partition of hash_parted for values with (modulus 4, remainder 2);
create table hpart3 partition of hash_parted for values with (modulus 8, remainder 0);
create table hpart4 partition of hash_parted for values with (modulus 8, remainder 4);
insert into hpart1 values (1, 1);
insert into hpart2 values (2, 5);
insert into hpart4 values (3, 4);
-- fail
update hpart1 set a = 3, b=4 where a = 1;
ERROR:  new row for relation "hpart1" violates partition constraint
DETAIL:  Failing row contains (3, 4).
-- ok, row movement
update hash_parted set b = b - 1 where b = 1;
-- ok
update hash_parted set b = b + 8 where b = 1;
-- cleanup
drop table hash_parted;
drop operator class custom_opclass using hash;
drop function dummy_hashint4(a int4, seed int8);
CREATE TABLE parted (a int, b text) PARTITION BY RANGE(a);
CREATE TABLE part_a_1_5 PARTITION OF parted (a, b, PRIMARY KEY(a)) FOR VALUES FROM (1) TO (5);
CREATE TABLE part_a_5_10 PARTITION OF parted (a, b, PRIMARY KEY(a)) FOR VALUES FROM (5) TO (10);
INSERT INTO parted VALUES (1, '1'), (2, '2'), (4, '4'), (6, '6'), (8, '8');
-- Test whether single row optimization is invoked when
-- only one partition is being updated.
EXPLAIN UPDATE parted SET b='5' WHERE a = 1;
                     QUERY PLAN
-----------------------------------------------------
 Update on parted  (cost=0.00..4.11 rows=1 width=68)
   Update on part_a_1_5 parted
   ->  Result  (cost=0.00..4.11 rows=1 width=68)
(3 rows)

UPDATE parted SET b='5' WHERE a = 1;
-- Verify that single row optimization is not invoked when
-- multiple partitions are being updated.
EXPLAIN UPDATE parted SET b='6' WHERE a > 1;
                              QUERY PLAN
-----------------------------------------------------------------------
 Update on parted  (cost=0.00..205.00 rows=2000 width=68)
   Update on part_a_1_5
   Update on part_a_5_10
   ->  Seq Scan on part_a_1_5  (cost=0.00..102.50 rows=1000 width=68)
         Remote Filter: (a > 1)
   ->  Seq Scan on part_a_5_10  (cost=0.00..102.50 rows=1000 width=68)
         Remote Filter: (a > 1)
(7 rows)

UPDATE parted SET b='6' WHERE a > 1;
-- Verify that the updates happened successfully.
SELECT * FROM parted ORDER BY a;
 a | b
---+---
 1 | 5
 2 | 6
 4 | 6
 6 | 6
 8 | 6
(5 rows)

DROP TABLE parted;
