-- Verify yb_db_admin can alter rows in tables it does not own
CREATE TABLE foo(a INT);
INSERT INTO foo VALUES (0);
INSERT INTO foo VALUES (1);
INSERT INTO foo VALUES (2);
SET SESSION AUTHORIZATION yb_db_admin;
SELECT * from foo ORDER BY a;
 a 
---
 0
 1
 2
(3 rows)

DELETE FROM foo WHERE a = 2;
SELECT * from foo ORDER BY a;
 a 
---
 0
 1
(2 rows)

UPDATE foo SET a = 5 WHERE a = 0;  
SELECT * from foo ORDER BY a;
 a 
---
 1
 5
(2 rows)

TRUNCATE foo;
SELECT * from foo ORDER BY a;
 a 
---
(0 rows)

-- Check yb_db_admin cannot alter sys tables
UPDATE pg_shdepend SET dbid=1 WHERE dbid=0;
ERROR:  permission denied for table pg_shdepend
DELETE from pg_shdepend WHERE dbid=0;
ERROR:  permission denied for table pg_shdepend
TRUNCATE pg_shdepend;
ERROR:  permission denied: "pg_shdepend" is a system catalog
