CREATE EXTENSION pg_stat_monitor;
SELECT pg_stat_monitor_reset();
 pg_stat_monitor_reset 
-----------------------
 
(1 row)

SELECT * from pg_stat_monitor_settings;
                   name                   | value  | default_value |                                               description                                                | minimum |  maximum   |    options     | restart 
------------------------------------------+--------+---------------+----------------------------------------------------------------------------------------------------------+---------+------------+----------------+---------
 pg_stat_monitor.pgsm_max                 | 100    | 100           | Sets the maximum size of shared memory in (MB) used for statement's metadata tracked by pg_stat_monitor. |       1 |       1000 |                | yes
 pg_stat_monitor.pgsm_query_max_len       | 2048   | 2048          | Sets the maximum length of query.                                                                        |    1024 | 2147483647 |                | yes
 pg_stat_monitor.pgsm_track_utility       | yes    | yes           | Selects whether utility commands are tracked.                                                            |         |            | yes, no        | no
 pg_stat_monitor.pgsm_normalized_query    | yes    | yes           | Selects whether save query in normalized format.                                                         |         |            | yes, no        | no
 pg_stat_monitor.pgsm_max_buckets         | 10     | 10            | Sets the maximum number of buckets.                                                                      |       1 |         10 |                | yes
 pg_stat_monitor.pgsm_bucket_time         | 60     | 60            | Sets the time in seconds per bucket.                                                                     |       1 | 2147483647 |                | yes
 pg_stat_monitor.pgsm_histogram_min       | 0      | 0             | Sets the time in millisecond.                                                                            |       0 | 2147483647 |                | yes
 pg_stat_monitor.pgsm_histogram_max       | 100000 | 100000        | Sets the time in millisecond.                                                                            |      10 | 2147483647 |                | yes
 pg_stat_monitor.pgsm_histogram_buckets   | 10     | 10            | Sets the maximum number of histogram buckets                                                             |       2 | 2147483647 |                | yes
 pg_stat_monitor.pgsm_query_shared_buffer | 20     | 20            | Sets the maximum size of shared memory in (MB) used for query tracked by pg_stat_monitor.                |       1 |      10000 |                | yes
 pg_stat_monitor.pgsm_overflow_target     | 1      | 1             | Sets the overflow target for pg_stat_monitor                                                             |       0 |          1 |                | yes
 pg_stat_monitor.pgsm_enable_query_plan   | yes    | no            | Enable/Disable query plan monitoring                                                                     |         |            | yes, no        | no
 pg_stat_monitor.pgsm_track               | top    | top           | Selects which statements are tracked by pg_stat_monitor.                                                 |         |            | none, top, all | no
 pg_stat_monitor.pgsm_extract_comments    | no     | no            | Enable/Disable extracting comments from queries.                                                         |         |            | yes, no        | no
 pg_stat_monitor.pgsm_track_planning      | no     | no            | Selects whether planning statistics are tracked.                                                         |         |            | yes, no        | no
(15 rows)

CREATE TABLE TBL_0(key text primary key, txt_0 text, value_0 int);
INSERT INTO TBL_0(key, txt_0, value_0) VALUES('000000', '846930886', 1804289383);
SELECT key, txt_0, value_0 FROM TBL_0;
  key   |   txt_0   |  value_0   
--------+-----------+------------
 000000 | 846930886 | 1804289383
(1 row)

SELECT key, txt_0, value_0 FROM TBL_0;
  key   |   txt_0   |  value_0   
--------+-----------+------------
 000000 | 846930886 | 1804289383
(1 row)

UPDATE TBL_0 SET value_0 = 1681692777;
select substr(query, 0,50) as query, calls, query_plan from pg_stat_monitor order by query,calls;
                       query                       | calls |                query_plan                 
---------------------------------------------------+-------+-------------------------------------------
 CREATE TABLE TBL_0(key text primary key, txt_0 te |     1 | 
 INSERT INTO TBL_0(key, txt_0, value_0) VALUES($1, |     1 | 
 SELECT * from pg_stat_monitor_settings            |     1 | Function Scan on pg_stat_monitor_settings
 SELECT key, txt_0, value_0 FROM TBL_0             |     2 | Seq Scan on tbl_0
 SELECT pg_stat_monitor_reset()                    |     1 | Result
 UPDATE TBL_0 SET value_0 = $1                     |     1 | 
(6 rows)

Drop TABLE TBL_0;
SELECT pg_stat_monitor_reset();
 pg_stat_monitor_reset 
-----------------------
 
(1 row)

SELECT * from pg_stat_monitor_settings;
                   name                   | value  | default_value |                                               description                                                | minimum |  maximum   |    options     | restart 
------------------------------------------+--------+---------------+----------------------------------------------------------------------------------------------------------+---------+------------+----------------+---------
 pg_stat_monitor.pgsm_max                 | 100    | 100           | Sets the maximum size of shared memory in (MB) used for statement's metadata tracked by pg_stat_monitor. |       1 |       1000 |                | yes
 pg_stat_monitor.pgsm_query_max_len       | 2048   | 2048          | Sets the maximum length of query.                                                                        |    1024 | 2147483647 |                | yes
 pg_stat_monitor.pgsm_track_utility       | yes    | yes           | Selects whether utility commands are tracked.                                                            |         |            | yes, no        | no
 pg_stat_monitor.pgsm_normalized_query    | yes    | yes           | Selects whether save query in normalized format.                                                         |         |            | yes, no        | no
 pg_stat_monitor.pgsm_max_buckets         | 10     | 10            | Sets the maximum number of buckets.                                                                      |       1 |         10 |                | yes
 pg_stat_monitor.pgsm_bucket_time         | 60     | 60            | Sets the time in seconds per bucket.                                                                     |       1 | 2147483647 |                | yes
 pg_stat_monitor.pgsm_histogram_min       | 0      | 0             | Sets the time in millisecond.                                                                            |       0 | 2147483647 |                | yes
 pg_stat_monitor.pgsm_histogram_max       | 100000 | 100000        | Sets the time in millisecond.                                                                            |      10 | 2147483647 |                | yes
 pg_stat_monitor.pgsm_histogram_buckets   | 10     | 10            | Sets the maximum number of histogram buckets                                                             |       2 | 2147483647 |                | yes
 pg_stat_monitor.pgsm_query_shared_buffer | 20     | 20            | Sets the maximum size of shared memory in (MB) used for query tracked by pg_stat_monitor.                |       1 |      10000 |                | yes
 pg_stat_monitor.pgsm_overflow_target     | 1      | 1             | Sets the overflow target for pg_stat_monitor                                                             |       0 |          1 |                | yes
 pg_stat_monitor.pgsm_enable_query_plan   | no     | no            | Enable/Disable query plan monitoring                                                                     |         |            | yes, no        | no
 pg_stat_monitor.pgsm_track               | top    | top           | Selects which statements are tracked by pg_stat_monitor.                                                 |         |            | none, top, all | no
 pg_stat_monitor.pgsm_extract_comments    | no     | no            | Enable/Disable extracting comments from queries.                                                         |         |            | yes, no        | no
 pg_stat_monitor.pgsm_track_planning      | no     | no            | Selects whether planning statistics are tracked.                                                         |         |            | yes, no        | no
(15 rows)

CREATE TABLE TBL_0(key text primary key, txt_0 text, value_0 int);
INSERT INTO TBL_0(key, txt_0, value_0) VALUES('000000', '846930886', 1804289383);
SELECT key, txt_0, value_0 FROM TBL_0;
  key   |   txt_0   |  value_0   
--------+-----------+------------
 000000 | 846930886 | 1804289383
(1 row)

SELECT key, txt_0, value_0 FROM TBL_0;
  key   |   txt_0   |  value_0   
--------+-----------+------------
 000000 | 846930886 | 1804289383
(1 row)

UPDATE TBL_0 SET value_0 = 1681692777;
select substr(query, 0,50) as query, calls, query_plan from pg_stat_monitor order by query,calls;
                       query                       | calls | query_plan 
---------------------------------------------------+-------+------------
 CREATE TABLE TBL_0(key text primary key, txt_0 te |     1 | 
 INSERT INTO TBL_0(key, txt_0, value_0) VALUES($1, |     1 | 
 SELECT * from pg_stat_monitor_settings            |     1 | 
 SELECT key, txt_0, value_0 FROM TBL_0             |     2 | 
 SELECT pg_stat_monitor_reset()                    |     1 | 
 UPDATE TBL_0 SET value_0 = $1                     |     1 | 
 select substr(query, $1,$2) as query, calls, quer |     1 | 
(7 rows)

Drop extension pg_stat_monitor;
