CREATE EXTENSION pg_stat_monitor;
SELECT pg_stat_monitor_reset();
 pg_stat_monitor_reset 
-----------------------
 
(1 row)

SELECT * from pg_stat_monitor_settings where name='pg_stat_monitor.pgsm_enable_query_plan';
                  name                  | value | default_value |             description              | minimum | maximum | options | restart 
----------------------------------------+-------+---------------+--------------------------------------+---------+---------+---------+---------
 pg_stat_monitor.pgsm_enable_query_plan | yes   | no            | Enable/Disable query plan monitoring |         |         | yes, no | no
(1 row)

CREATE TABLE TBL_0(key text primary key, txt_0 text, value_0 int);
INSERT INTO TBL_0(key, txt_0, value_0) VALUES('000000', '846930886', 1804289383);
SELECT key, txt_0, value_0 FROM TBL_0;
  key   |   txt_0   |  value_0   
--------+-----------+------------
 000000 | 846930886 | 1804289383
(1 row)

SELECT key, txt_0, value_0 FROM TBL_0;
  key   |   txt_0   |  value_0   
--------+-----------+------------
 000000 | 846930886 | 1804289383
(1 row)

UPDATE TBL_0 SET value_0 = 1681692777;
select substr(query, 0,50) as query, calls, query_plan from pg_stat_monitor order by query,calls;
                       query                       | calls |                            query_plan                             
---------------------------------------------------+-------+-------------------------------------------------------------------
 CREATE TABLE TBL_0(key text primary key, txt_0 te |     1 | 
 INSERT INTO TBL_0(key, txt_0, value_0) VALUES('00 |     1 | 
 SELECT * from pg_stat_monitor_settings where name |     1 | Function Scan on pg_stat_monitor_settings                        +
                                                   |       |   Filter: (name = 'pg_stat_monitor.pgsm_enable_query_plan'::text)
 SELECT key, txt_0, value_0 FROM TBL_0             |     2 | Seq Scan on tbl_0
 SELECT pg_stat_monitor_reset()                    |     1 | Result
 UPDATE TBL_0 SET value_0 = 1681692777             |     1 | 
(6 rows)

Drop TABLE TBL_0;
SELECT pg_stat_monitor_reset();
 pg_stat_monitor_reset 
-----------------------
 
(1 row)

SELECT * from pg_stat_monitor_settings where name='pg_stat_monitor.pgsm_enable_query_plan';
                  name                  | value | default_value |             description              | minimum | maximum | options | restart 
----------------------------------------+-------+---------------+--------------------------------------+---------+---------+---------+---------
 pg_stat_monitor.pgsm_enable_query_plan | no    | no            | Enable/Disable query plan monitoring |         |         | yes, no | no
(1 row)

CREATE TABLE TBL_0(key text primary key, txt_0 text, value_0 int);
INSERT INTO TBL_0(key, txt_0, value_0) VALUES('000000', '846930886', 1804289383);
SELECT key, txt_0, value_0 FROM TBL_0;
  key   |   txt_0   |  value_0   
--------+-----------+------------
 000000 | 846930886 | 1804289383
(1 row)

SELECT key, txt_0, value_0 FROM TBL_0;
  key   |   txt_0   |  value_0   
--------+-----------+------------
 000000 | 846930886 | 1804289383
(1 row)

UPDATE TBL_0 SET value_0 = 1681692777;
select substr(query, 0,50) as query, calls, query_plan from pg_stat_monitor order by query,calls;
                       query                       | calls | query_plan 
---------------------------------------------------+-------+------------
 CREATE TABLE TBL_0(key text primary key, txt_0 te |     1 | 
 INSERT INTO TBL_0(key, txt_0, value_0) VALUES('00 |     1 | 
 SELECT * from pg_stat_monitor_settings where name |     1 | 
 SELECT key, txt_0, value_0 FROM TBL_0             |     2 | 
 SELECT pg_stat_monitor_reset()                    |     1 | 
 UPDATE TBL_0 SET value_0 = 1681692777             |     1 | 
 select substr(query, 0,50) as query, calls, query |     1 | 
(7 rows)

Drop extension pg_stat_monitor;
