CREATE EXTENSION pg_stat_monitor;
SELECT pg_stat_monitor_reset();
 pg_stat_monitor_reset 
-----------------------
 
(1 row)

SELECT * from pg_stat_monitor_settings where name='pg_stat_monitor.pgsm_track_utility';
                name                | value | default_value |                  description                  | minimum | maximum | options | restart 
------------------------------------+-------+---------------+-----------------------------------------------+---------+---------+---------+---------
 pg_stat_monitor.pgsm_track_utility | no    | yes           | Selects whether utility commands are tracked. |         |         | yes, no | no
(1 row)

CREATE TABLE TBL_0(key text primary key, txt_0 text, value_0 int);
INSERT INTO TBL_0(key, txt_0, value_0) VALUES('000000', '846930886', 1804289383);
SELECT key, txt_0, value_0 FROM TBL_0;
  key   |   txt_0   |  value_0   
--------+-----------+------------
 000000 | 846930886 | 1804289383
(1 row)

SELECT key, txt_0, value_0 FROM TBL_0;
  key   |   txt_0   |  value_0   
--------+-----------+------------
 000000 | 846930886 | 1804289383
(1 row)

UPDATE TBL_0 SET value_0 = 1681692777;
Analyze TBL_0;
DROP TABLE TBL_0;
select datname, substr(query,0,100) as query, calls from pg_stat_monitor order by datname, query, calls desc Limit 20;
 datname  |                                                query                                                | calls 
----------+-----------------------------------------------------------------------------------------------------+-------
 postgres | INSERT INTO TBL_0(key, txt_0, value_0) VALUES('000000', '846930886', 1804289383)                    |     1
 postgres | SELECT * from pg_stat_monitor_settings where name='pg_stat_monitor.pgsm_track_utility'              |     1
 postgres | SELECT key, txt_0, value_0 FROM TBL_0                                                               |     2
 postgres | SELECT pg_stat_monitor_reset()                                                                      |     1
 postgres | UPDATE TBL_0 SET value_0 = 1681692777                                                               |     1
 postgres | select datname, substr(query,0,100) as query, calls from pg_stat_monitor order by datname, query, c |     1
(6 rows)

SELECT pg_stat_monitor_reset();
 pg_stat_monitor_reset 
-----------------------
 
(1 row)

SELECT * from pg_stat_monitor_settings where name='pg_stat_monitor.pgsm_track_utility';
                name                | value | default_value |                  description                  | minimum | maximum | options | restart 
------------------------------------+-------+---------------+-----------------------------------------------+---------+---------+---------+---------
 pg_stat_monitor.pgsm_track_utility | yes   | yes           | Selects whether utility commands are tracked. |         |         | yes, no | no
(1 row)

CREATE TABLE TBL_0(key text primary key, txt_0 text, value_0 int);
INSERT INTO TBL_0(key, txt_0, value_0) VALUES('000000', '846930886', 1804289383);
SELECT key, txt_0, value_0 FROM TBL_0;
  key   |   txt_0   |  value_0   
--------+-----------+------------
 000000 | 846930886 | 1804289383
(1 row)

SELECT key, txt_0, value_0 FROM TBL_0;
  key   |   txt_0   |  value_0   
--------+-----------+------------
 000000 | 846930886 | 1804289383
(1 row)

UPDATE TBL_0 SET value_0 = 1681692777;
Analyze TBL_0;
DROP TABLE TBL_0;
select datname, substr(query,0,100) as query, calls from pg_stat_monitor order by datname, query, calls desc Limit 20;
 datname  |                                                query                                                | calls 
----------+-----------------------------------------------------------------------------------------------------+-------
 postgres | Analyze TBL_0                                                                                       |     1
 postgres | CREATE TABLE TBL_0(key text primary key, txt_0 text, value_0 int)                                   |     1
 postgres | DROP TABLE TBL_0                                                                                    |     1
 postgres | INSERT INTO TBL_0(key, txt_0, value_0) VALUES('000000', '846930886', 1804289383)                    |     1
 postgres | SELECT * from pg_stat_monitor_settings where name='pg_stat_monitor.pgsm_track_utility'              |     1
 postgres | SELECT key, txt_0, value_0 FROM TBL_0                                                               |     2
 postgres | SELECT pg_stat_monitor_reset()                                                                      |     1
 postgres | UPDATE TBL_0 SET value_0 = 1681692777                                                               |     1
 postgres | select datname, substr(query,0,100) as query, calls from pg_stat_monitor order by datname, query, c |     1
(9 rows)

Drop extension pg_stat_monitor;
